RTN,AIRSHOW-Raytheon says in final talks on Qatar Patriot deal DUBAI, Nov 19 U.S. arms maker Raytheon Co  said on Tuesday it hoped to finalise the sale of its Patriot air and missile defence system to Qatar "fairly quickly," and wrap up the sale of additional Patriot fire units to Kuwait before the end of the year. ~
CRM,Salesforce.com fourth-quarter sales forecast bolstered by ExactTarget SAN FRANCISCO Salesforce.com Inc  forecast fourth-quarter revenue to come in slightly better than analysts' projections, helped by a strong performance by newly acquired email marketing firm ExactTarget. ~UPDATE 3-Salesforce.com Q4 sales forecast bolstered by ExactTarget * ExactTarget acquisition going smoothly, sales goal lifted ~
SYY,Sysco unit settles charges it overbilled U.S. military for produce WASHINGTON, Nov 19 A subsidiary of Sysco Corp  will pay $4.2 million to settle allegations brought by a whistleblower that it overcharged the U.S. military for fresh fruit and vegetables over a two-year period, the Justice Department said on Tuesday. ~
TJX,UPDATE 1-TJ Maxx owner TJX says holiday season off to good start * Maintains 4th-qtr profit forecast of $0.77-$0.80/share   (Adds details, outlook, share movement) ~BRIEF-The TJX Companies Inc Q3 earnings per share $0.86 Nov 19 TJX :  * The TJX Companies Inc sees strong momentum continue; reports above-planthird ~BRIEF-TJX Cos Q3 earnings per share $0.86 Nov 19 TJX :  * The TJX Companies Inc sees strong momentum continue; reports above-plan third ~Clothing retailer TJX adjusted profit beats estimates Nov 19 TJX Cos Inc's adjusted profit beat analysts' estimates for the second straight quarter as more value-conscious shoppers visited its stores for low-priced apparels. ~
URBN.O,Urban Outfitters warns of margin pressure in holiday season Teen apparel retailer Urban Outfitters Inc  joined rival Abercrombie & Fitch Co  in warning of a squeeze on current-quarter margins as a tough holiday season could force it to discount more. ~
VZ,CenturyLink boosts cloud offerings with Tier 3 buy Nov 19 Telecommunications company CenturyLink Inc said on Tuesday it has bought cloud computing startup Tier 3 Inc as part of its acquisition strategy that allows it to compete with the likes of Amazon Inc, IBM Corp and Verizon Communications Inc's Terremark. ~
WMT,Best Buy cuts prices, warns on holiday-quarter margins Best Buy Co  is cutting prices for the holiday season to thwart fierce competition from Wal-Mart and other discount and online rivals, a move that it warns will hurt margins for the current quarter. ~UPDATE 3-Best Buy cuts prices, warns on holiday-quarter margins Nov 19 Best Buy Co is cutting prices for the holiday season to thwart fierce competition from Wal-Mart and other discount and online rivals, a move that it warns will hurt margins for the current quarter. ~U.S. Labor Board may issue complaint against Wal-Mart on strikes NEW YORK The U.S. National Labor Relations Board on Monday said it has authorized legal action against Wal-Mart Stores Inc  for allegedly retaliating against workers who participated in strikes against the company over low pay. ~U.S. Labor Board may issue complaint against Wal-Mart on strikes NEW YORK, Nov 18 The U.S. National Labor Relations Board on Monday said it has authorized legal action against Wal-Mart Stores Inc for allegedly retaliating against workers who participated in strikes against the company over low pay. ~
