AAPL.O,INSIGHT-Trigger finger: Apple fires biometrics into the mainstream * Fingerprint security offers comfort for commerce, enterprises ~
BLK,UPDATE 1-PNC Chairman Rohr to leave BlackRock board-filing Sept 13 PNC Financial Services Group Inc  Executive Chairman James Rohr will not be seeking re-election to the board of New York-based asset manager BlackRock next year, the company said in a regulatory filing on Friday. ~PNC Chairman Rohr to leave BlackRock board-filing Sept 13 PNC Financial Services Group Inc  Executive Chairman James Rohr will not be seeking re-election to the board of New York-based asset manager BlackRock next year, the company said in a regulatory filing on Friday. ~MARKET PULSE-Facebook, Intel, Pactera, Ulta Beauty, Stratasys, Safeway (For more market insights, including options activity, click on  ; for the Day Ahead newsletter http://link.reuters.com/mex49s;  for the Morning News Call newsletter, http://link.reuters.com/nex49s) ~MARKET PULSE-Facebook, Sangamo, Ulta Beauty, Verizon, Delcath (For more market insights, including options activity, click on  ; for the Day Ahead newsletter http://link.reuters.com/mex49s;  for the Morning News Call newsletter, http://link.reuters.com/nex49s) ~MARKET PULSE-Facebook, Analogic, Ulta Beauty, Stratasys, Verizon (For more market insights, including options activity, click on  ; for the Day Ahead newsletter http://link.reuters.com/mex49s) ~UPDATE 1-Market Chatter-Corporate finance press digest Sept 13 The following corporate finance-related stories were reported by media on Friday: ~Pimco, BlackRock, buy chunks of Verizon's record bond deal: report Leading bond-fund managers Pacific Investment Management Co. and BlackRock Inc  bought about $13 billion of the debt Verizon Communications Inc  sold in its record $49 billion bond offering, the Wall Street Journal reported on Thursday, citing people familiar with the matter. ~Pimco, BlackRock, buy chunks of Verizon's record bond deal - report Sept 12 Leading bond-fund managers Pacific Investment Management Co. and BlackRock Inc bought about $13 billion of the debt Verizon Communications Inc sold in its record $49 billion bond offering, the Wall Street Journal reported on Thursday, citing people familiar with the matter. ~
BA,UPDATE 1-Lufthansa close to Airbus, Boeing jet order -sources * Split deal follows competition for around 50 long-haul jets ~Lufthansa close to Airbus, Boeing jet order -sources PARIS/FRANKFURT, Sept 13 Germany's Lufthansa  is close to placing an order shared between Airbus  and Boeing for dozens of long-haul jets, two people familiar with the matter said on Friday. ~
CVX,Chevron's Frade field in Brazil producing up to 16,000 bpd RIO DE JANEIRO, Sept 13 U.S. oil company Chevron  is producing 15,000 to 16,000 barrels per day of crude on average from its Brazilian offshore Frade oil field northeast of Rio de Janeiro, where the company spilled 3,600 barrels of oil into the sea after a 2011 accident, Rafael Jean Williamson, the company's director of corporate affairs in Brazil, said on Friday. ~
FB.O,Twitter takes first step toward going public SAN FRANCISCO/NEW YORK Twitter Inc has filed for an initial public offering with U.S. regulators, the company said on Thursday, taking the first step toward what would be Silicon Valley's most anticipated debut since Facebook Inc's last year. | Video  ~MARKET PULSE-Facebook, Intel, Pactera, Ulta Beauty, Stratasys, Safeway (For more market insights, including options activity, click on  ; for the Day Ahead newsletter http://link.reuters.com/mex49s;  for the Morning News Call newsletter, http://link.reuters.com/nex49s) ~MARKET PULSE-Facebook, Sangamo, Ulta Beauty, Verizon, Delcath (For more market insights, including options activity, click on  ; for the Day Ahead newsletter http://link.reuters.com/mex49s;  for the Morning News Call newsletter, http://link.reuters.com/nex49s) ~MARKET PULSE-Facebook, Analogic, Ulta Beauty, Stratasys, Verizon (For more market insights, including options activity, click on  ; for the Day Ahead newsletter http://link.reuters.com/mex49s) ~UPDATE 5-Twitter takes first step toward going public SAN FRANCISCO/NEW YORK, Sept 12 Twitter Inc has filed for an initial public offering with U.S. regulators, the company said on Thursday, taking the first step toward what would be Silicon Valley's most anticipated debut since Facebook Inc's last year. ~
F,Ford's U.S. sales chief retires; new COO in Europe named DETROIT, Sept 13 Ford Motor Co on Friday announced that its U.S. sales and marketing chief, Ken Czubay, will retire and that Barb Samardzich has been promoted to chief operating officer in Europe from product development chief in the region. ~
GE,UPDATE 1-General Electric names PNC chairman to board of directors Sept 13 General Electric Co named PNC Financial Services Group Chairman James Rohr to its board of directors on Friday. ~General Electric names PNC chairman to board of directors Sept 13 General Electric Co named PNC Financial Services Group Chairman James Rohr to its board of directors on Friday. ~EDF Renewable to buy GE wind turbines for U.S. wind farms Sept 13 EDF Renewable Energy said it would buy up to 200 megawatts of General Electric Co's 1.85 MW wind turbines for projects beginning construction in 2013. ~
HON,UPDATE 1-U.S. puts conditions on Honeywell's Intermec purchase WASHINGTON, Sept 13 U.S. authorities on Friday cleared Honeywell International's   proposed purchase of mobile computing device maker Intermec on the condition that Honeywell license to a competitor certain key patents used in barcode scanners. ~U.S. regulator puts conditions on Honeywell's Intermec purchase WASHINGTON, Sept 13 U.S. authorities on Friday cleared Honeywell International's   proposed purchase of mobile computing device maker Intermec on the condition that Honeywell license key patents used to make scanners. ~
HPQ,Insight: Trigger finger - Apple fires biometrics into the mainstream SINGAPORE/SAN FRANCISCO By adding a fingerprint scanner to its newest mobile phone, Apple Inc is offering a tantalizing glimpse of a future where your favorite gadget might become a biometric pass to the workplace, mobile commerce or real-world shopping and events. ~INSIGHT-Trigger finger: Apple fires biometrics into the mainstream * Fingerprint security offers comfort for commerce, enterprises ~
INTC.O,US STOCKS-Wall St ends up; Dow posts best weekly gain since Jan NEW YORK, Sept 13 U.S. stocks rose on Friday and the Dow registered its best weekly gain since January, helped by gains in Intel, though trading was subdued as the Federal Reserve is expected to scale back its stimulus measures next week. ~US STOCKS-Wall St drifts higher with eyes on Fed NEW YORK, Sept 13 U.S. stocks edged higher on Friday, with the S&P; 500 set to post its largest weekly gain in two months, with traders focusing on next week's U.S. Federal Reserve meeting and its expected reduction of stimulus. ~MARKET PULSE-Intel, GSV Capital, Prana, Galena, United Natural Foods (For more market insights, including options activity, click on  ; for the Day Ahead newsletter http://link.reuters.com/mex49s;  for the Morning News Call newsletter, http://link.reuters.com/nex49s) ~US STOCKS-Wall St set to rise at open after data * Futures: Dow up 20 pts, S&P; up 0.9 pt, Nasdaq up 4.25 pts ~US STOCKS-Futures little changed ahead of data flurry * Retail sales, U.Mich consumer sentiment survey headline expected data ~US STOCKS-Futures little changed ahead of data flurry * Retail sales, U.Mich consumer sentiment survey headline expected data ~
IBM,REFILE-UPDATE 1-India lures chip makers, says IBM and STMicro interested NEW DELHI/BANGALORE, Sept 13 Two consortiums, including IBM and STMicroelectronics, have proposed building semiconductor wafer plants in India costing a total of $8 billion, a minister said after the government approved concessions to lure chipmakers. ~India says consortia including IBM propose to build chip foundries NEW DELHI, Sept 13 Two consortia have proposed to build semiconductor wafer fabrication units in India, the Minister for Communication and Information Technology, Kapil Sibal, told reporters in New Delhi on Friday. ~
JPM,JPMorgan to spend $4 billion on compliance and risk controls: WSJ NEW YORK JPMorgan Chase & Co  plans to spend an additional $4 billion and commit 5,000 extra employees to fix risk and compliance issues after a slew of investigations by regulatory authorities, the Wall Street Journal reported on Thursday. ~UPDATE 1-JPMorgan to spend $4 bln on compliance and risk controls-WSJ NEW YORK, Sept 12 JPMorgan Chase & Co  plans to spend an additional $4 billion and commit 5,000 extra employees to fix risk and compliance issues after a slew of investigations by regulatory authorities, the Wall Street Journal reported on Thursday. ~JPMorgan to spend $4 bln on compliance and risk controls-WSJ NEW YORK, Sept 12 JPMorgan Chase & Co  plans to spend an additional $4 billion and commit 5,000 extra employees to fix risk and compliance issues after a slew of investigations by regulatory authorities, the Wall Street Journal reported on Thursday. ~
LMT,CORRECTED-Lockheed Martin wins rare commercial contract for Atlas launch CAPE CANAVERAL, Fla., Sept 12 Lockheed Martin Corp has won a rare commercial contract for launch services on its unmanned Atlas 5 rocket, officials said on Thursday. ~
NOC,Cost of flying Northrop's Global Hawk down over 50 pct-sources WASHINGTON, Sept 13 The cost of flying Northrop Grumman Corp's RQ-4 Global Hawk unmanned spy plane has dropped more than 50 percent over the past three years, reflecting higher use and efforts to lower operating costs, a source familiar with the program said. ~
OXY,Passive fund manager Vanguard turns activist in some board votes Sept 13 Fund manager Vanguard Group Inc opposed the election of board members in a number of high-profile proxy contests this year, votes that help explain why directors at firms such as Hewlett-Packard Co and Occidental Petroleum Corp had a hard time getting re-elected. ~Occidental seeks buyers for 40 percent of Middle East unit: report Occidental Petroleum Corp  is looking to sell 40 percent of its Middle East operations for $8 billion, Bloomberg reported on Friday, as Oxy seeks investment in the unit as part of a broader plan to split up the company. ~
ORCL.N,REFILE-UPDATE 2-Sailing-Oracle losing grasp on America's Cup as Kiwis win sixth SAN FRANCISCO, September 12 Oracle Team USA's bid to turn the tide in its floundering America's Cup campaign by bringing sailing superstar Ben Ainslie aboard failed on Thursday, when Emirates Team New Zealand crushed the defenders in two do-or-die races. ~
PNC,UPDATE 1-PNC Chairman Rohr to leave BlackRock board-filing Sept 13 PNC Financial Services Group Inc  Executive Chairman James Rohr will not be seeking re-election to the board of New York-based asset manager BlackRock next year, the company said in a regulatory filing on Friday. ~PNC Chairman Rohr to leave BlackRock board-filing Sept 13 PNC Financial Services Group Inc  Executive Chairman James Rohr will not be seeking re-election to the board of New York-based asset manager BlackRock next year, the company said in a regulatory filing on Friday. ~UPDATE 1-General Electric names PNC chairman to board of directors Sept 13 General Electric Co named PNC Financial Services Group Chairman James Rohr to its board of directors on Friday. ~General Electric names PNC chairman to board of directors Sept 13 General Electric Co named PNC Financial Services Group Chairman James Rohr to its board of directors on Friday. ~
VZ,MARKET PULSE-Facebook, Analogic, Ulta Beauty, Stratasys, Verizon (For more market insights, including options activity, click on  ; for the Day Ahead newsletter http://link.reuters.com/mex49s) ~UPDATE 1-Market Chatter-Corporate finance press digest Sept 13 The following corporate finance-related stories were reported by media on Friday: ~Pimco, BlackRock, buy chunks of Verizon's record bond deal: report Leading bond-fund managers Pacific Investment Management Co. and BlackRock Inc  bought about $13 billion of the debt Verizon Communications Inc  sold in its record $49 billion bond offering, the Wall Street Journal reported on Thursday, citing people familiar with the matter. ~Pimco, BlackRock, buy chunks of Verizon's record bond deal - report Sept 12 Leading bond-fund managers Pacific Investment Management Co. and BlackRock Inc bought about $13 billion of the debt Verizon Communications Inc sold in its record $49 billion bond offering, the Wall Street Journal reported on Thursday, citing people familiar with the matter. ~
VNO,Vornado's chairman, Roth, resigns from Penney board -filing NEW YORK, Sept 13 Vornado Realty Trust  Chairman and Chief Executive Steven Roth resigned on Friday from the board of department store chain J.C. Penney Co Inc, the company said in a regulatory filing. ~
