AAPL.O,Trader gets 30 months in prison for $1 bln Apple stock scheme Nov 19 A former trader was sentenced to 2 1/2 years in prison on Tuesday for an unauthorized purchase of about $1 billion in Apple Inc stock that eventually led to the demise of financial services firm Rochdale Securities. ~In retrial, Apple and Samsung make final pitches to jury SAN JOSE, California Apple Inc tried to persuade U.S. jurors to keep intact a historic verdict it won against Samsung Electronics Co Ltd last year, while the Korean company argued that Apple has overstated its injuries from patent violations. ~UPDATE 2-In retrial, Apple and Samsung make final pitches to jury SAN JOSE, Calif., Nov 19 Apple Inc  tried to persuade U.S. jurors to keep intact a historic verdict it won against Samsung Electronics Co Ltd last year, while the Korean company argued that Apple has overstated its injuries from patent violations. ~In retrial, Apple and Samsung make final pitches to jury SAN JOSE, Calif., Nov 19 Apple Inc  argued in court on Tuesday that Samsung had failed to present meaningful evidence to rebut allegations that the Korean electronics giant had improperly used the iPhone maker's patented technology. ~
ADSK.O,Autodesk eyes further growth from manufacturing, 3D designs TEL AVIV, Nov 19 The manufacturing sector and a shift to cloud computing and an increase in three-dimensional (3D) designs look to drive growth in the coming years at computer-aided design (CAD) software maker Autodesk, a senior official said. ~
BAC,Detroit could pay higher loan rate, unsealed letter shows Nov 18 Detroit could end up paying almost twice as much in interest as previously disclosed on a $350 million loan arranged by Barclays Capital, according to a fee letter made public on Monday after a judge ordered it unsealed last week. ~
BBY,US STOCKS SNAPSHOT-Wall St ends lower, but Home Depot helps Dow NEW YORK, Nov 19 U.S. stocks fell on Tuesday, with the Dow and the S&P; 500 retreating from milestone levels, led by a slide in Best Buy after a disappointing outlook. ~US STOCKS-Wall St inches lower; Dow slips after hitting 16,000 * Home Depot shares rise as housing recovery boosts results ~Best Buy cuts prices, warns on holiday-quarter margins Best Buy Co  is cutting prices for the holiday season to thwart fierce competition from Wal-Mart and other discount and online rivals, a move that it warns will hurt margins for the current quarter. ~UPDATE 3-Best Buy cuts prices, warns on holiday-quarter margins Nov 19 Best Buy Co is cutting prices for the holiday season to thwart fierce competition from Wal-Mart and other discount and online rivals, a move that it warns will hurt margins for the current quarter. ~US STOCKS-Dow pops back up above 16,000; Home Depot up on results * Home Depot shares rise as housing recovery boosts results ~US STOCKS-Wall Street drifts amid few market catalysts * Home Depot shares rise as housing recovery boosts results ~US STOCKS-Wall St to open flat amid few market catalysts * Home Depot shares rise as housing recovery boosts results ~US STOCKS-Futures little changed amid few market catalysts * Home Depot shares rise as housing recovery boosts results ~US STOCKS-Futures tick lower as traders scramble for catalysts * Home Depot shares rise as housing recovery boosts results ~
BA,UPDATE 2-AIRSHOW-US Navy committed to F-35 despite talks about more F/A-18 buys DUBAI, Nov 19 The U.S. Navy remains committed to the Lockheed Martin Corp F-35 Joint Strike Fighter (JSF) program, but is also looking at options to buy additional Boeing Co F/A-18 fighter jets, a senior U.S. Navy official said on Tuesday. ~AIRSHOW-Maker of V-22 Osprey encouraged by foreign interest DUBAI, Nov 19 The head of Bell Helicopter said on Tuesday he was encouraged by foreign interest in the V-22 tilt-rotor aircraft that his company builds with Boeing Co , but Bell may face additional layoffs if not enough orders emerge. ~Factbox: Airbus, Boeing orders at Dubai Airshow Following is a summary of commercial airplane orders announced by Airbus  and Boeing  at the Dubai Airshow, which runs from Nov 17 to 21. ~U.S. Navy committed to F-35 despite talks about more F/A-18 buys DUBAI The U.S. Navy remains committed to the Lockheed Martin Corp  F-35 Joint Strike Fighter (JSF) program, but is also looking at options to buy additional Boeing Co  F/A-18 fighter jets, a senior U.S. Navy official said on Tuesday. ~AIRSHOW-US Navy committed to F-35 despite talks about more F/A-18 buys DUBAI, Nov 19 The U.S. Navy remains committed to the Lockheed Martin Corp F-35 Joint Strike Fighter (JSF) program, but is also looking at options to buy additional Boeing Co F/A-18 fighter jets, a senior U.S. Navy official said on Tuesday. ~BRIEF-Boeing, Tui Travel complete order for two 787-8s Nov 19 Boeing :  * Tui travel plc complete order for two 787-8s  * Says the deal, worth $424 million at current list prices  * Source text for Eikon   * Further company coverage ~RPT-UPDATE 1-AIRSHOW-Airbus considers A320 production increase DUBAI, Nov 19 Airbus is considering an increase in production of its A320 medium-haul aircraft, taking output above 42 planes per month, sales chief John Leahy told Reuters on Tuesday. ~
CPB,UPDATE 4-Campbell Soup cuts forecast as U.S. soup sales slide Nov 19 Campbell Soup Co cut its full-year earnings forecast on Tuesday as it fights to lessen its dependence on soup and expand its product offerings in a bid to appeal to 20-somethings. ~US STOCKS-Dow, S&P; retreat for second day; Best Buy weighs * Best Buy, Campbell Soup shares plunge after cautious outlook ~RESEARCH ALERT-Campbell Soup: JP Morgan cuts target price Nov 19 Campbell Soup Co :  * JP Morgan cuts target price to $37 from $38; rating underweight For a summary of rating and price target changes on U.S. companies:    Reuters Eikon users, click on    Reuters 3000Xtra users, double-click    Reuters Station users, click .1568    For a summary of rating and price target changes on Canadian companies:    Reuters Eikon users, click on    Reuters 3000Xtra users, double-click    Reuters Station users, click .4899 ~BRIEF-Campbell Soup down 8.5 percent premarket after Q1 results, outlook NEW YORK, Nov 19 Campbell Soup Co :  * Down 8.5 percent to $38.25 in premarket after Q1 results, outlook ~CORRECTED-Campbell Soup's quarterly sales fall (Corrects paragraph 2 to say net earnings attributable to Campbell Soup was $172 million, not $171 million) ~BRIEF-Campbell Q1 adjusted earnings per share $0.66 from continuing ops Nov 19 Campbell Soup Co :  * Reports first-quarter results  * Q1 adjusted earnings per share $0.66 from continuing operations  * Q1 earnings per share $0.57 from continuing operations  * Q1 earnings per share view $0.86 -- Thomson Reuters I/B/E/S  * Q1 sales $2.17 billion versus I/B/E/S view $2.29 billion  * Lowers fiscal 2014 sales, adjusted EBIT and adjusted EPS guidance: sets new ~
CAT,REUTERS SUMMIT-Short-seller Chanos bearish on coal, oil NEW YORK, Nov 19 Short-seller Jim Chanos said Tuesday it is time for typical equity investors to be "a little more cautious" even as the stock market may continue to rise. ~
CTL,CenturyLink boosts cloud offerings with Tier 3 buy Nov 19 Telecommunications company CenturyLink Inc said on Tuesday it has bought cloud computing startup Tier 3 Inc as part of its acquisition strategy that allows it to compete with the likes of Amazon Inc, IBM Corp and Verizon Communications Inc's Terremark. ~BRIEF-CenturyLink acquires Tier 3 to accelerate cloud platform strategy Nov 19 CenturyLink Inc :  * Acquires tier 3 to accelerate cloud platform strategy  * Says acquired tier 3 for an undisclosed price * Source text for Eikon  * Further company coverage ~
CVX,U.S. lawyer denies bribery at trial in Chevron-Ecuador case NEW YORK, Nov 19 A U.S. lawyer on Tuesday denied using bribery to win a multibillion-dollar judgment against Chevron Corp in Ecuador, even as the oil company's lawyer raised tough questions about evidence that he said suggested the payments were made. ~U.S. attorney grilled over role in Chevron-Ecuador judgment NEW YORK Steven Donziger, the U.S. attorney accused of using bribery to secure a multibillion-dollar pollution judgment against Chevron Corp  in Ecuador, took the witness stand for the first time on Monday and was immediately challenged on his claim that he was not in charge of the Ecuadorean case. ~U.S. attorney grilled over role in Chevron-Ecuador judgment NEW YORK, Nov 18 Steven Donziger, the U.S. attorney accused of using bribery to secure a multibillion-dollar pollution judgment against Chevron Corp  in Ecuador, took the witness stand for the first time on Monday and was immediately challenged on his claim that he was not in charge of the Ecuadorean case. ~
DVN,UPDATE 2-Devon Energy near $6 bln deal for GeoSouthern -source NEW YORK, Nov 19 Devon Energy Corp is close to a deal to buy privately held GeoSouthern Energy Corp for around $6 billion, according to a person familiar with the matter. ~Devon Energy near $6 bln deal for GeoSouthern Energy -source NEW YORK, Nov 19 Devon Energy is close to a deal to buy privately held GeoSouthern Energy for around $6 billion, according to a person familiar with the matter. ~DIARY-U.S. MEETINGS/WEEK AHEAD THOMSON REUTERS, Nov 19,2013 - Corporate Meetings for US companies for Week ahead.         S&P; 500 Earnings - Weekly           S&P; 500 Earnings - Day Ahead        Non S&P; 500 - Weekly               Non S&P; 500 - Day Ahead             ConferenceCall/Webcast - Weekly    ConferenceCall/Webcast - Day        S&P; 500 Earnings - Monthly           Meetings - Day Ahead                Economic Indicators                  Dividends                           Daily earnings hits & misses         Federal Rese ~
XOM,Highlights Day 2: Exxon a 'value trap'; Puerto Rico attractive NEW YORK Short-seller Jim Chanos said he was bearish on oil companies like Exxon Mobil Corp. and said the U.S. stock market was becoming riskier, while Aaron Cowen, of hedge fund Suvretta Capital Management, said the market has yet to reach a peak. ~Short-seller Chanos says oil majors increasingly look like 'value traps' NEW YORK Short-seller Jim Chanos said on Tuesday that shares of international oil majors like Exxon Mobil Corp increasingly look like a value trap for investors as cash flows decline and return on capital slides. ~REUTERS SUMMIT-Short-seller Chanos says oil majors increasingly look like 'value traps' (For other news from Reuters Global Investment Outlook Summit, click on http://www.reuters.com/summit/Investment13)  (Adds bellwether Sotheby's, Exxon Mobil background) ~REUTERS SUMMIT-Short-seller Chanos says oil majors increasingly look like 'value traps' (For other news from Reuters Global Investment Outlook Summit, click on http://www.reuters.com/summit/Investment13)  (Adds background on Exxon, quotes on equities and Europe) ~REUTERS SUMMIT-Short-seller Chanos bearish on oil, coal companies NEW YORK, Nov 19 Short-seller Jim Chanos said on Tuesday that shares of the international oil majors like Exxon Mobil Corp increasingly look like a value trap for investors as cash flows decline and returns slide. ~Deals of the day- Mergers and acquisitions (Adds Adcock Ingram, Blackstone Group, Rolls-Royce, Pemex, Loewe, JSW, Teva Pharmaceutical; updates Deutsche Boerse) ~UPDATE 2-Exxon to sell Hong Kong power operations for $3.4 bln * Deal marks state-ownded CSG's first overseas investment ~CORRECTED-Exxon to sell Hong Kong power operations for $3.4 bln (Corrects company name in lead paragraph to China Southern Power Grid) ~Exxon to sell Hong Kong power operations for $3.4 billion HONG KONG Exxon Mobil Corp  has agreed to sell its majority stakes in a Hong Kong utility and a power storage firm for a combined $3.4 billion, helping the U.S. oil major raise funds to plough back into its core operations. ~
F,Car, tech firms must work together to provide Internet,  'apps' : Ford executive LOS ANGELES Automakers and technology companies need to cooperate more closely to ensure the rapid and smooth development of cars that are fully connected to the Internet, a top Ford Motor Co  executive said on Tuesday. ~Car, tech firms must work together to provide Internet,  'apps' -Ford exec LOS ANGELES, Nov 19 Automakers and technology companies need to cooperate more closely to ensure the rapid and smooth development of cars that are fully connected to the Internet, a top Ford Motor Co executive said on Tuesday. ~Ford to inspect, repair 386,000 older model large sedans in U.S. DETROIT, Nov 19 U.S. safety regulators have closed an investigation into loss of steering in some large Ford Motor Co sedans after the automaker said it would address the issue on affected vehicles. ~
GE,U.S. court questions ex-GE bankers' bid-rigging convictions NEW YORK, Nov 19 A U.S. appeals court on Tuesday questioned the convictions of three former banking executives at a unit of General Electric Co for being involved in a conspiracy to rig bids for contracts to invest municipal bond proceeds. ~
GM,Venezuela fines General Motors over spare parts' prices CARACAS, Nov 19 Venezuela's socialist government said on Tuesday it was fining the local subsidiary of General Motors nearly $85,000 for allegedly selling spare parts at exorbitant prices. ~
GS,REFILE-Goldman nears deal for events company PSAV -sources NEW YORK, Nov 19 Goldman Sachs Group Inc's  private equity arm is nearing a deal to acquire events services company PSAV Presentation Services for close to $900 million, according to people familiar with the matter. ~UPDATE 1-Abu Dhabi's Aldar Properties picks banks for sukuk sale * Goldman, StanChart, NBAD, FGB, DIB to arrange sale-sources ~RESEARCH ALERT-Endurance International: Goldman Sachs starts with buy - Theflyonthewall.com Nov 19 Endurance International Group Holdings Inc  :  * Goldman Sachs starts with buy rating - Theflyonthewall.com For a summary of rating and price target changes on U.S. companies:   Reuters Eikon users, click on    Reuters 3000Xtra users, double-click    Thomson ONE users, type in RT/RCH/US    For a summary of rating and price target changes on Canadian companies:   Reuters Eikon users, click on    Reuters 3000Xtra users, double-click    Thomson ONE users, type in RT/RCH/CA ~CORRECTED-REUTERS SUMMIT-Goldman Sachs funds head sees Treasury yields 100 bps higher in 2014 (Corrects story that ran on Monday to change title of Andrew Wilson to EMEA Chief Executive, not Chief Executive) ~Small Zambia cash grants pay big dividends for rural poor LUSAKA In rural Africa, where money is scarce and subsistence farming the norm, even small injections of cash can go far and help grow a local economy in surprising ways. ~AFRICA INVESTMENT-Small Zambia cash grants pay big dividends for rural poor LUSAKA, Nov 19 In rural Africa, where money is scarce and subsistence farming the norm, even small injections of cash can go far and help grow a local economy in surprising ways. ~Highlights Day 1: Europe's appeal, stock 'drop' coming NEW YORK Marc Lasry, chief executive of hedge fund Avenue Capital Group, said that European securities offer the best opportunity, while activist investor Carl Icahn said that the U.S. stock market could see a "big drop." ~
HD,US STOCKS-Wall St inches lower; Dow slips after hitting 16,000 * Home Depot shares rise as housing recovery boosts results ~US STOCKS-Dow pops back up above 16,000; Home Depot up on results * Home Depot shares rise as housing recovery boosts results ~Home Depot raises forecast as Americans spruce up homes Home Depot Inc  raised its 2013 forecast for the third time this year as rising home prices encourage more Americans to invest in their properties and complete delayed projects. ~UPDATE 3-Home Depot raises forecast as Americans spruce up homes * Shares rise as much as 3 pct   (Adds executives' quotes, analyst comment; updates shares) ~US STOCKS-Wall Street drifts amid few market catalysts * Home Depot shares rise as housing recovery boosts results ~US STOCKS-Wall St to open flat amid few market catalysts * Home Depot shares rise as housing recovery boosts results ~US STOCKS-Futures little changed amid few market catalysts * Home Depot shares rise as housing recovery boosts results ~US STOCKS-Futures tick lower as traders scramble for catalysts * Home Depot shares rise as housing recovery boosts results ~
IBM,CenturyLink boosts cloud offerings with Tier 3 buy Nov 19 Telecommunications company CenturyLink Inc said on Tuesday it has bought cloud computing startup Tier 3 Inc as part of its acquisition strategy that allows it to compete with the likes of Amazon Inc, IBM Corp and Verizon Communications Inc's Terremark. ~
JNJ,UPDATE 1-J&J; unit to pay $2.5 billion in U.S. hip implant settlement NEW YORK, Nov 19 A unit of Johnson & Johnson  has agreed to pay an estimated $2.5 billion to settle thousands of lawsuits from individuals allegedly injured by the company's artificial hip implants, the company announced Tuesday. ~J&J; unit to pay $2.5 billion in U.S. hip implant settlement NEW YORK, Nov 19 A unit of Johnson & Johnson  has agreed to pay an estimated $2.5 billion to settle thousands of lawsuits from individuals allegedly injured by the company's artificial hip implants, the company announced Tuesday. ~
LMT,UPDATE 2-AIRSHOW-US Navy committed to F-35 despite talks about more F/A-18 buys DUBAI, Nov 19 The U.S. Navy remains committed to the Lockheed Martin Corp F-35 Joint Strike Fighter (JSF) program, but is also looking at options to buy additional Boeing Co F/A-18 fighter jets, a senior U.S. Navy official said on Tuesday. ~U.S. Navy committed to F-35 despite talks about more F/A-18 buys DUBAI The U.S. Navy remains committed to the Lockheed Martin Corp  F-35 Joint Strike Fighter (JSF) program, but is also looking at options to buy additional Boeing Co  F/A-18 fighter jets, a senior U.S. Navy official said on Tuesday. ~AIRSHOW-US Navy committed to F-35 despite talks about more F/A-18 buys DUBAI, Nov 19 The U.S. Navy remains committed to the Lockheed Martin Corp F-35 Joint Strike Fighter (JSF) program, but is also looking at options to buy additional Boeing Co F/A-18 fighter jets, a senior U.S. Navy official said on Tuesday. ~
MDT,UPDATE 2-Medtronic profit up as heart device sales revive Nov 19 Medtronic Inc reported higher quarterly earnings on Tuesday as stronger sales of its implantable devices to treat abnormal heart rhythms offset weakness in its spinal products business. ~Medtronic second-quarter earnings rise; top estimates Nov 19 Medtronic Inc on Tuesday reported higher quarterly earnings that were slightly above analysts' expectations as sales rose across its medical device lines. ~
MRK,Merck brings maternity program from poor nations to U.S. as deaths rise NEW YORK, Nov 19 Merck & Co on Tuesday said it is expanding its "Merck for Mothers" program, which aims to reduce pregnancy-related deaths from impoverished countries such as Senegal and Zambia, to the United States - a stark reminder of how far the country lags other wealthy nations on key measures of health. ~
MSFT.O,UPDATE 2-Microsoft's Gates highlights tough requirements for new CEO BELLEVUE, Wash., Nov 19 Chairman Bill Gates said on Tuesday he was pleased with Microsoft Corp's  progress in finding a new chief executive but outlined the difficulties in picking the next leader of the world's largest software company as it seeks to reinvent itself as a mobile computing power. ~CORRECTED-UPDATE 1-Microsoft's Gates says 'pleased with progress' of CEO search (Corrects to show answered questions, not asked them in third paragraph) ~Nokia shareholders approve sale of mobile business to Microsoft HELSINKI Nokia shareholders approved the 5.4 billion euros ($7.4 billion) sale of the company's mobile phone business to Microsoft, deciding the deal's financial benefits outweighed any objections to the loss of a Finnish national asset. ~UPDATE 2-Nokia shareholders approve sale of mobile business to Microsoft (Updates with final vote, shareholders' comments, adds background, writes through) ~Nokia shareholders approve sale of handset business to Microsoft HELSINKI Nokia shareholders approved the sale of the company's mobile phone business to Microsoft, deciding the deal's financial benefits outweighed objections by a minority of investors upset by the sale of a Finnish national asset. ~Nokia shareholders approve sale of handset business to Microsoft HELSINKI, Nov 19 Nokia shareholders approved the sale of the company's mobile phone business to Microsoft, deciding the deal's financial benefits outweighed objections by a minority of investors upset by the sale of a Finnish national asset. ~Microsoft's Gates says 'pleased with progress' of CEO search BELLEVUE, Wash., Nov 19 Microsoft Corp  Chairman Bill Gates said on Tuesday he was pleased with the software company's progress in finding a new chief executive and the search committee had spoken to a number of candidates, but he did not give a date by which he expected a new leader to replace the retiring Steve Ballmer. ~Nokia shareholders set to approve Microsoft deal HELSINKI, Nov 19 Nokia shareholders were set to approve the sale of the company's mobile phone business to Microsoft on Tuesday, deciding the deal's financial benefits outweighed objections by a minority of investors upset by the sale of a Finnish national asset. ~RPT-Nokia shareholders expected to approve Microsoft deal HELSINKI, Nov 19 Nokia shareholders are expected to approve the sale of its mobile phone business to Microsoft on Tuesday, with the deal's financial benefits likely to outweigh resistance from a minority of investors upset over the sale of a Finnish national icon. ~
MDLZ.O,BRIEF-Mondelez invests over $100 million in new European biscuit factory Nov 18 Mondelez International Inc :  * Invests over $100 million in new European biscuit factory  * Says the investment will create 200 new roles making oreo cookies and belvita ~
MS,UPDATE 1-Rosneft studying Morgan Stanley oil trading unit Nov 19 Russian state-run oil company Rosneft  is in talks with Morgan Stanley on buying into the Wall Street bank's oil trading business, an industry publication and two industry sources said on Tuesday. ~Rosneft eyes stake in Morgan Stanley oil trading unit -report Nov 19 Russian state-controlled energy major Rosneft is in talks with Morgan Stanley on buying a stake in the Wall Street bank's oil trading business, industry publication SparkSpread reported on Tuesday. ~BRIEF-Endurance International: Morgan Stanley starts with overweight Nov 19 Endurance International Group Holdings Inc  :  * Morgan Stanley starts with overweight; price target $16  For a summary of rating and price target changes on U.S. companies:   Reuters Eikon users, click on    Reuters 3000Xtra users, double-click    Thomson ONE users, type in RT/RCH/US      For a summary of rating and price target changes on Canadian companies:   Reuters Eikon users, click on    Reuters 3000Xtra users, double-click    Thomson ONE users, type in RT/RCH/CA ~RESEARCH ALERT-Uniqa: Morgan Stanley resumes with equal weight rating Nov 18 UNIQA Insurance Group AG :  * Morgan Stanley resumes with equal weight rating; target price 9.90 euros For a summary of rating actions and price target changes on European companies:   Reuters Eikon users, click on    Reuters 3000Xtra users, double-click    Thomson ONE users, type in RT/RCH/EUROPE ~
NWSA.DF,Rupert Murdoch close to finalizing divorce - report Nov 19 Rupert Murdoch, the chairman of News Corp  and 21st Century Fox, and his wife of 14 years, Wendi Deng Murdoch, are close to settling their divorce, according to a report in the New York Times. ~
NWS.O,Rupert Murdoch close to finalizing divorce - report Nov 19 Rupert Murdoch, the chairman of News Corp  and 21st Century Fox, and his wife of 14 years, Wendi Deng Murdoch, are close to settling their divorce, according to a report in the New York Times. ~
