AAPL.O,UPDATE 1-Apple says never worked with NSA on iPhone backdoors SAN FRANCISCO, Dec 31 Apple Inc has never worked with the U.S. National Security Agency and is unaware of efforts to target its smartphones, the company said in response to reports that the spy agency had developed a system to hack into and monitor iPhones. ~Apple says has never worked with NSA on iPhone backdoors SAN FRANCISCO, Dec 31 Apple Inc  responded on Tuesday to reports that the National Security Agency had developed a system to hack into and monitor iPhones called "Dropout Jeep," saying it never worked with the U.S. spy agency and was unaware of efforts to target its smartphones. ~Justice Department defends Apple monitor in e-books case NEW YORK A bitter battle between Apple Inc and a lawyer appointed to monitor its compliance with a court antitrust ruling escalated on Monday, as the U.S. government and the monitor both hit back at Apple. ~Justice Department defends Apple monitor in e-books case NEW YORK, Dec 31 A bitter battle between Apple Inc and a lawyer appointed to monitor its compliance with a court antitrust ruling escalated on Monday, as the U.S. government and the monitor both hit back at Apple. ~
BRKa.N,US STOCKS-Wall St rises; S&P; 500 set for best year since 1997 NEW YORK, Dec 31 U.S. stocks advanced modestly on Tuesday, boosted by a solid consumer confidence reading, keeping the S&P; 500 on track for its best year since 1997 and the Dow on pace to record its best performance since 1995. ~US STOCKS-Wall St rises; S&P; 500 set for best year since 1997 NEW YORK, Dec 31 U.S. stocks advanced modestly on Tuesday, boosted by a solid consumer confidence reading, keeping the S&P; 500 on track for its best year since 1997 and the Dow on pace to record its best performance since 1995. ~US STOCKS-Wall St rises after data, on pace for best year since 1997 * Indexes up: Dow 0.21 pct, S&P; 0.21 pct, Nasdaq 0.22 pct ~US STOCKS-Wall St set to open higher, set for best year since 1997 * Report shows home price rise; consumer confidence data due ~CANADA STOCKS-TSX set to open slightly lower Dec 31 Canada's main stock index looked set to open flat to slightly lower on Tuesday even as investor optimism for 2014 driven by ultra-easy monetary policies and an improving global economic outlook pushed global markets higher. ~US STOCKS-Futures edge up; Wall St set for best year since 1997 * Case-Shiller home price index, consumer confidence data due ~US STOCKS-Futures flat as Wall St heads for best year since 1997 * Case-Shiller home price index, consumer confidence data due ~Deals of the day- Mergers and acquisitions Dec 31 The following bids, mergers, acquisitions and disposals were reported by 1100 GMT on Tuesday: ~
BA,Boeing tells state leaders 777X wing plant is at risk OLYMPIA, Wash., Dec 30 Boeing Co will not build the wing for its new 777X jetliner in Washington state if members of its largest union reject its latest contract offer in a Friday vote, company executives told Seattle-area elected officials on Monday. ~
DOW,BRIEF-Downer EDI says offer for Spotless Group now closed * Confirms that its offer for Spotless was not extended and has now closed. Source text for Eikon: Further company coverage: ~BRIEF-Downer EDI posts FY net profit of $181.5 million * FY total revenue and other income from ordinary activities $7.29 billion , up 6.4 percent ~BRIEF-Downer EDI says ‍offer for Spotless Group extended to 28 August 2017​ * ‍Offer for Spotless Group extended to 7pm on Monday, 28 august 2017​ Source text for Eikon: Further company coverage: ~BRIEF-Downer EDI says Spotless ‍offer extended to Aug 21, 2017​ * Spotless ‍offer extended to 7pm on monday, 21 august 2017​ Source text for Eikon: Further company coverage: ~BRIEF-Downer EDI's takeover offer for Spotless Group extended till 7pm (Sydney time) on Aug. 14 * Unconditional takeover offer for Spotless Group extended until 7:00pm (Sydney time) on Monday, 14 August Source text for Eikon: Further company coverage: (bangalore.newsroom@thomsonreuters.com) ~BRIEF-Downer extends takeover offer for Spotless Group * decided to extend Spotless offer period for one week; offer will now remain open for acceptance until 14 august Source text for Eikon: Further company coverage: ~BRIEF-Downer extends Spotless offer to August 7 2017 * ‍Downer has decided to extend offer for Spotless Group holdings to 7 pm on Monday, 7 august 2017​ Source text for Eikon: Further company coverage: ~BRIEF-Downer EDI's stake in Spotless increases to 80.3 pct * Downer's stake in Spotless increases to 80.3 pct Source text for Eikon: Further company coverage: ~BRIEF- Downer EDI Ltd'S stake in Spotless Group increases to 72% * As Downer's shareholding in Spotless is now over 70%, Downer expects that Spotless will be removed from certain S&P;/ASX market indices ~
HPQ,Hewlett-Packard to cut 5,000 more jobs Dec 31 Hewlett-Packard Co said it would cut 5,000 more jobs, bringing the total number of layoffs to 34,000, or 11 percent of its workforce. ~
MDLZ.O,Market Chatter- Corporate finance press digest Dec 31 The following corporate finance-related stories were reported by media: ~
NFLX.O,Netflix hikes CEO salary by 50 pct for 2014 Dec 30 Netflix Inc raised the salary of its Chief Executive Reed Hastings by 50 percent to $6 million for 2014, a regulatory filing showed, as its stock quadrupled in value this year amidst new programming and a growth in subscriber base. ~
PFE,China halts imports of Pfizer drug on paperwork glitch SHANGHAI, Dec 31 China suspended imports of U.S. drugmaker Pfizer Inc's AIDS-related drug Diflucan on Tuesday, citing a problem with late paperwork, the country's food and drug watchdog said in a statement on its website. ~
PSX,US STOCKS-Futures edge up; Wall St set for best year since 1997 * Case-Shiller home price index, consumer confidence data due ~US STOCKS-Futures flat as Wall St heads for best year since 1997 * Case-Shiller home price index, consumer confidence data due ~
SYK,Stryker to buy Patient Safety Technologies for $120 million Stryker Corp  said it would buy Patient Safety Technologies Inc  for $120 million to gain access to Patient Safety's device to reduce the risk of surgical sponges being left in patients after surgery. ~Stryker to buy Patient Safety Technologies for $120 mln Dec 31 Stryker Corp said it would buy Patient Safety Technologies Inc for $120 million to gain access to Patient Safety's device to reduce the risk of surgical sponges being left in patients after surgery. ~
TGT,Target faces problems with gift cards sold over holidays NEW YORK, Dec 31 Target Corp, which is dealing with one of the largest ever payment-data breaches in U.S. retail history, said on Tuesday that some of the gift cards it sold over the holiday season were not activated properly. ~
V,BRIEF-Visa calls for redemption all of its 1.200 pct notes due 2017 * Visa Inc - on Sept 11, co called for redemption all of $1.75 billion principal amount outstanding of its 1.200 pct notes due 2017‍​ - SEC filing ~BRIEF-Visa Inc files for three-part senior notes offering of up to $2.5 bln * Visa Inc says files for three-part senior notes offering of up to $2.5 billion - SEC filing‍​ ~Former BoE deputy Hogg to join Visa as Europe unit CEO Visa Inc, the world's largest payments processor, on Thursday named former Bank of England (BoE) deputy governor Charlotte Hogg as chief executive of its Europe division. ~CORRECTED-UPDATE 1-MOVES-Former BoE deputy Hogg to join Visa as Europe unit CEO Sept 7 Visa Inc, the world's largest payments processor, on Thursday named former Bank of England (BoE) deputy governor Charlotte Hogg as chief executive of its Europe division. ~MOVES-Visa names ex-BoE deputy Charlotte Hogg as Europe unit CEO Sept 7 Visa Inc, the world's largest payments processor, on Thursday named Charlotte Hogg as chief executive of its Europe division. ~BRIEF-Visa appoints Charlotte Hogg as CEO of European operations * Visa Inc appoints Charlotte Hogg as chief executive officer of the compan's European operations ~BRIEF-Visa Inc files prospectus supplement for potential three-part senior notes offering * Visa Inc files prospectus supplement for potential three-part senior notes offering; size not disclosed - sec filing‍​ Source text (http://bit.ly/2vLDrIe) Further company coverage: ~BRIEF-Visa enables on the go payments with the new Fitbit Ionic * Visa inc- ‍enabling visa payments on fitbit's smartwatch fitbit ionic​ ~BRIEF-Bridg raises $11 million in Series B funding * Bridg raises $11 million in Series B funding from Morpheus Ventures, March Capital, Visa and NextEquity ~
