AMZN.O,Amazon partners with HTC to make smartphones: report Amazon.com Inc is developing smartphones with HTC Corp, putting it in a position to compete with Apple Inc and Google Inc, the Financial Times reported. ~
T,Al Jazeera-AT&T; lawsuit to stay under wraps during appeal * Court filings to remain confidential while Al Jazeera appeals ~
BAC,BofA considers new checking account that prevents overdraft - WSJ Oct 17 Bank of America is considering a plan to introduce a checking account that curbs overdraft practices, the Wall Street Journal said, citing people familiar with the bank's strategy. ~
CSCO.O,Exclusive: Motorola looking to exit wireless LAN business - sources NEW YORK Motorola Solutions Inc is exploring the sale of its underperforming wireless LAN business, which has grappled with declining share in a market dominated by rivals such as Cisco Systems Inc, people familiar with the matter said. ~
C,Morgan Stanley profit beats Street as equity trading surges Morgan Stanley posted a higher-than-expected quarterly profit on Friday as stock trading revenue jumped 31 percent, surprisingly strong performance in a quarter when rivals posted smaller gains or even declines in that business. ~UPDATE 2-Morgan Stanley profit beats Street as equity trading surges Oct 18 Morgan Stanley posted a higher-than-expected quarterly profit on Friday as stock trading revenue jumped 31 percent, a surprisingly strong performance in a quarter when most rivals posted smaller gains or even declines in that business. ~
FB.O,UPDATE 4-Google shares break $1,000 barrier as mobile pays off * Revenue surge makes analysts rethink stock price targets ~Contrafund adds to Google stake in Q3 amid lift from Facebook BOSTON, Oct 18 Fidelity Investments' $101 billion Contrafund added to its stake in Google Inc  in the third quarter while the fund got a big lift from the surging performance of Facebook Inc and Tesla Motors Inc shares. ~
GE,UPDATE 4-GE posts strong Q3 order backlog, profit margins; shares rise Oct 18 General Electric Co on Friday posted a record backlog of orders that the company said positioned it well for 2014, lifting shares and overshadowing a decline in quarterly profit and revenue. ~REFILE-US STOCKS-Futures climb on rosy corporate results * Futures: Dow up 20 pts, S&P; up 1.7 pt, Nasdaq up 13 pts ~GE third-quarter net profit falls Oct 18 General Electric Co on Friday said third-quarter profit fell as revenue dropped in its Power and Water business, which makes a variety of turbines. ~
HON,REFILE-UPDATE 3-Honeywell cuts revenue forecast as defense unit lags Oct 18 Honeywell International Inc on Friday reported lower-than-expected quarterly revenue, due in part to supply problems at its defense unit, and the U.S. manufacturing conglomerate cut its full-year sales forecast. ~Honeywell quarterly profit up 4 percent Oct 18 Honeywell International Inc, which makes airplane cockpit parts and a host of other electronics and equipment, reported a 4 percent increase in quarterly profit on Friday. ~
IPG,UPDATE 1-Interpublic results miss estimates due to weak Europe * Third-quarter adjusted earnings/share $0.17 vs est $0.18 ~Interpublic revenue rises 2 pct on higher U.S. income Oct 18 Interpublic Group of Cos, home to advertising agencies McCann Erickson and Draftfcb, reported a 2 percent rise in quarterly revenue due to strength in U.S. advertising. ~
JPM,UPDATE 2-JPMorgan in $4 billion deal with U.S. housing agency WASHINGTON/NEW YORK, Oct 18 JPMorgan Chase & Co  has reached a tentative $4 billion deal with the U.S. Federal Housing Finance Agency to settle claims that the bank misled government-sponsored mortgage agencies about the quality of mortgages it sold them during the housing boom, according to a person familiar with the matter. ~URGENT-JPMorgan reaches $4 billion deal with U.S. housing agency -WSJ NEW YORK, Oct 18 JPMorgan Chase & Co has reached a tentative $4 billion deal with the U.S. Federal Housing Finance Agency to settle claims that the bank misled government-sponsored mortgage agencies about the quality of mortgages it sold to them during the housing boom, the Wall Street Journal reported on its website on Friday. ~Morgan Stanley trims Q3 commodity trading risk Oct 18 Morgan Stanley trimmed its commodity trading risk in the third quarter from the previous quarter, the bank reported on Friday, but held its position as the Wall Street firm with the most money at play in the sector.     Value-at-Risk (VaR) in commodities stood at $20 million in the third quarter, down from $24 million in the second quarter and unchanged from the third quarter of 2012. That compares with $17 million for Goldman Sachs  and $13 million for JPMorgan Chase & Co.    ~
KSU,Kansas City Southern posts higher results, sees strong year-end Oct 18 Kansas City Southern posted higher quarterly profit and revenue as the railroad saw improved shipments, and it said it expects a strong end to the year as cross-border business grew. ~
MS,Morgan Stanley profit beats Street as equity trading surges Morgan Stanley posted a higher-than-expected quarterly profit on Friday as stock trading revenue jumped 31 percent, surprisingly strong performance in a quarter when rivals posted smaller gains or even declines in that business. ~UPDATE 3-Morgan Stanley profit beats Street as equity trading surges * Shares rise 2.6 percent   (Adds CFO and investor comments, financial details, updates stock price) ~Morgan Stanley commodity revenues up 'modestly' as bank waits on Fed LONDON Morgan Stanley's commodity revenues were up modestly in the third quarter, the bank said on Friday, extending a mild recovery, as the company awaits a decision from the Federal Reserve on the future of its physical trading business. ~UPDATE 1-Morgan Stanley commodity revenues up 'modestly' as bank waits on Fed By David Sheppard     LONDON, Oct 18 Morgan Stanley's commodity revenues were up modestly in the third quarter, the bank said on Friday, extending a mild recovery, as the company awaits a decision from the Federal Reserve on the future of its physical trading business.     Speaking on the bank's third-quarter earnings call, Chief Financial Officer Ruth Porat said that a recovery in client activity had bolstered commodities for the second straight quarter, following a 77 percent colla ~BRIEF-Morgan Stanley still searching for ways to cut costs-CEO * Morgan Stanley is investing in people and technology in fixed-income trading-CEO James Gorman ~Morgan Stanley Wealth third-quarter profit soars on fee revenue NEW YORK Morgan Stanley, which has made a bigger bet on wealth management than any other major U.S. investment or commercial bank, said third-quarter pretax profit at its wealth unit more than doubled to $430 million from last year on asset management fees that hit $1.9 billion. ~CORRECTED-Morgan Stanley Wealth third-quarter profit soars on fee revenue NEW YORK, Oct 18 Morgan Stanley, which has made a bigger bet on wealth management than any other major U.S. investment or commercial bank, said third-quarter pretax profit at its wealth unit more than doubled to $430 million from last year on asset management fees that hit $1.9 billion. ~UPDATE 2-Morgan Stanley profit beats Street as equity trading surges Oct 18 Morgan Stanley posted a higher-than-expected quarterly profit on Friday as stock trading revenue jumped 31 percent, a surprisingly strong performance in a quarter when most rivals posted smaller gains or even declines in that business. ~Morgan Stanley trims Q3 commodity trading risk Oct 18 Morgan Stanley trimmed its commodity trading risk in the third quarter from the previous quarter, the bank reported on Friday, but held its position as the Wall Street firm with the most money at play in the sector.     Value-at-Risk (VaR) in commodities stood at $20 million in the third quarter, down from $24 million in the second quarter and unchanged from the third quarter of 2012. That compares with $17 million for Goldman Sachs  and $13 million for JPMorgan Chase & Co.    ~
MSI,Exclusive: Motorola looking to exit wireless LAN business - sources NEW YORK Motorola Solutions Inc is exploring the sale of its underperforming wireless LAN business, which has grappled with declining share in a market dominated by rivals such as Cisco Systems Inc, people familiar with the matter said. ~Deals of the day- Mergers and acquisitions (Adds Irving Oil, Banca Monte dei Paschi di Siena, SoftBank Corp, Motorola Solutions, Gecamines, Vinci Partners, Peugeot, NRG Energy. Updates Terna) ~
NRG,UPDATE 2-NRG to buy Edison Mission Energy assets for $2.64 bln LOS ANGELES, Oct 18 Power company NRG Energy Inc  said on Friday it would pay $2.64 billion to acquire the assets of bankrupt unregulated power producer Edison Mission Energy, adding nearly 8,000 megawatts of coal, gas and wind generation to its business. ~Deals of the day- Mergers and acquisitions (Adds Irving Oil, Banca Monte dei Paschi di Siena, SoftBank Corp, Motorola Solutions, Gecamines, Vinci Partners, Peugeot, NRG Energy. Updates Terna) ~NRG to buy Edison Mission Energy assets for $2.64 bln LOS ANGELES, Oct 18 Power company NRG Energy Inc  on Friday said it would pay $2.635 billion to acquire the assets of bankrupt unregulated power producer Edison Mission Energy, adding nearly 8,000 megawatts of electricity generation capacity to its business. ~
OXY,Occidental looking to sell Middle East stake, other assets Oct 18 Oil and gas company Occidental Petroleum Corp said it is looking to sell a minority stake in its Middle East and North Africa operations and will consider options for some Rocky Mountain assets. ~
PFE,One million fake anti-anxiety pills seized at Zurich airport ZURICH, Oct 18 Swiss customs authorities have seized one million fake pills resembling Pfizer's  anti-anxiety medicine Xanax at Zurich airport, they said on Friday. ~
PRU,UPDATE 1-Prudential says will not appeal US council's systemic tag WASHINGTON, Oct 18 Prudential Financial  said it will not ask a federal court to overturn a designation by the U.S. risk council that will subject the company to strict capital requirements and oversight by the Federal Reserve. ~Prudential says will not appeal U.S. council's systemic risk tag WASHINGTON, Oct 18 Prudential Financial  said it will not seek court review of a decision made earlier this year by the U.S. risk council to designate the insurance giant as "systemically important," a tag that will subject Prudential to capital requirements and stricter federal oversight. ~
SLB,WRAPUP 2-Schlumberger, Baker top estimates with global drilling Oct 18 Increased oilfield activity in U.S. offshore waters and overseas gave a bigger-than-expected lift to profits at Schlumberger Ltd and Baker Hughes Inc , marking a clear divide with struggling smaller U.S. oil services firms. ~Schlumberger profit rises on strong drilling worldwide Schlumberger Ltd , the world's largest oilfield services company, reported a better-than-expected 20 percent rise in quarterly profit as offshore drilling increased in North America and demand from the Middle East and Asia rose. ~UPDATE 1-Schlumberger profit rises on strong drilling worldwide Oct 18 Schlumberger Ltd, the world's largest oilfield services company, reported a better-than-expected 20 percent rise in quarterly profit as offshore drilling increased in North America and demand from the Middle East and Asia rose. ~UPDATE 1-Baker Hughes profit up on strong international drilling Oct 18 Baker Hughes Inc, the world's third-largest oilfield services company, reported a better-than-expected quarterly profit, driven by strong drilling activity in the Middle East and Asia Pacific. ~Schlumberger profit rises 20 pct as global drilling booms Oct 18 Schlumberger Ltd, the world's largest oilfield services company, reported a 20 percent rise in quarterly profit as global drilling activity remained buoyant. ~
TXT,UPDATE 3-Cessna maker's profit falls as businesses delay spending * Income from cont ops $0.35/share vs $0.48 a year earlier ~Textron profit falls as Cessna sales hit air pocket Cessna maker Textron Inc  reported a 31 percent fall in quarterly profit from continuing operations due to sluggish sales of its jets as small business owners delay spending in an uncertain U.S. economy. ~Textron profit dives as Cessna aircraft sales fall Oct 18 Textron Inc, the world's largest maker of business aircraft, reported a 31 percent fall in quarterly profit from continuing operations due to sluggish sales of its Cessna aircraft. ~
WMT,Wal-Mart offers to rehire employee fired for aiding attacked woman Oct 18 A Michigan man who was fired by Wal-Mart after he defended a woman who was attacked in a store parking lot during his meal break has been offered his job back, the company said on Friday. ~India probe into Wal-Mart investment moves to central bank: sources MUMBAI/NEW DELHI An investigation by Indian authorities into whether Wal-Mart Stores Inc violated local investment rules in 2010 has been referred to the country's central bank, officials familiar with the matter said. ~
