ADBE.O,UPDATE 1-Adobe's Creative Cloud subscriber growth impresses investors Dec 12 Adobe Systems Inc, the maker of Photoshop and Acrobat software, forecast current-quarter results below analysts' estimates but reported a 22 percent jump in the number of subscribers to its Creative Cloud suite from the preceding quarter. ~BRIEF-Adobe Systems shares turn higher in after-hours trade; last up 1.7 pct NEW YORK, Dec 12 Adobe Systems Inc :  * Shares turned higher in after-hours trade and were last trading up 1.7 percent ~Adobe's first-quarter forecast misses estimates; shares fall Dec 12 Adobe Systems Inc, the maker of Photoshop and Acrobat software, forecast current-quarter results below analysts' estimates, sending its shares down as much as 5 percent in extended trading. ~BRIEF-Adobe Systems shares down 5.1 pct after the bell following guidance NEW YORK, Dec 12 Adobe Systems Inc :  * Shares were down 5.1 percent after the bell following guidance ~
AET,UPDATE 1-Aetna will not reinstate individual insurance plans -CEO * Aetna CEO says will not extend canceled policies further ~BRIEF-Aetna CEO says coming up with "workaround" solutions for January 1 around exchange plans Dec 12 Aetna Inc :  * CEO says coming up with "workaround" solutions for January 1 around exchange ~Aetna will not reinstate individual insurance plans -CEO Dec 12 Aetna Inc's CEO said on Thursday that the time frame is too short for the U.S. health insurer to go through the regulatory processes it needs to reinstate or extend canceled health plans and that it will not be doing so. ~BRIEF-Aetna CEO says public health insurance exchanges are 'here to stay' Dec 12 Aetna Inc :  * CEO says public health insurance exchanges are 'here to stay'  * CEO says if exchanges are 'fixed right', 2015 will be a 'new start'  * CEO says priced competitively in 15 percent of public exchange markets  * CEO says offering early renewals to individuals but will not extend ~BRIEF-Aetna CEO Bertolini says 2014 revenue outlook represents "bottom of the range" Dec 12 Aetna Inc :  * CEO Bertolini says 2014 revenue outlook represents "bottom of the range"  * Outlook for 2014 operating revenue is $53 billion  * CEO sees shift in health insurance market as it becomes more retail focused  * CEO expects 75 million people will buy retail insurance by 2020 as employers ~
AMZN.O,Amazon founder Bezos' space company loses challenge over NASA launch pad Dec 12 A commercial space company owned by Amazon founder Jeff Bezos has lost a challenge over NASA's plans to lease out one of the space shuttle's dormant launch pads in Florida, officials said on Thursday. ~
AAL.O,WRAPUP 1-American Air orders regional jets worth about $4 bln * American goes from "one of oldest fleets to one of newest" ~UPDATE 1-American Airlines orders 60 Embraer jets worth $2.5 bln SAO PAULO, Dec 12 American Airlines Group Inc  agreed to buy 60 aircraft from Embraer SA, the world's largest producer of regional jets, in a deal worth $2.5 billion at list prices, sending Embraer shares to a two-month high on Thursday. ~UPDATE 1-American Airlines to buy up to 70 Bombardier aircraft TORONTO, Dec 12 Bombardier Inc said on Thursday that American Airlines Group Inc has agreed to buy 30 of its CRJ900 NextGen planes and taken options on an additional 40 aircraft. ~American Airlines to buy up to 70 of CRJ900 NextGen aircraft TORONTO Bombardier Inc  said on Thursday that American Airlines Group Inc would buy 30 of its CRJ900 NextGen aircraft and had also taken options on an additional 40 planes. ~American Airlines to buy up to 70 of CRJ900 NextGen aircraft TORONTO, Dec 12 Bombardier Inc said on Thursday that American Airlines Group Inc would buy 30 of its CRJ900 NextGen aircraft and had also taken options on an additional 40 planes. ~
AIG,UPDATE 1-U.S. Treasury calls for more federal insurance oversight WASHINGTON, Dec 12 The U.S. Treasury Department's insurance office called for a bigger federal government role in insurance regulation, including new standards for mortgage insurers, and said state officials should improve oversight of the entire industry. ~U.S. Treasury wants federal oversight of mortgage insurers WASHINGTON, Dec 12 The U.S. Treasury Department's insurance office on Thursday called for federal oversight of mortgage insurers, adding that state regulators should improve oversight of the entire industry. ~AIG in talks to sell ILFC to AerCap Holdings - Bloomberg Insurer American International Group  is in talks to sell its jet-leasing finance business to AerCap Holdings NV , Bloomberg reported, citing people with knowledge of the matter. ~AIG in talks to sell ILFC to AerCap Holdings-Bloomberg Dec 12 Insurer American International Group  is in talks to sell its jet-leasing finance business to AerCap Holdings NV, Bloomberg reported, citing people with knowledge of the matter. ~
APC,BRIEF-Anadarko, Kerr-McGee found liable for damages in Tronox bankruptcy Dec 12 Anadarko Petroleum Corp :  * U.S. bankruptcy judge says Anadarko Petroleum Corp  kerr-mcgee acted ~
AAPL.O,UPDATE 2-Apple says death at Pegatron unrelated to working conditions * Pegatron says 15-year-old got job using someone else's ID ~CORRECTED-Apple sends medical experts to Pegatron factory after worker death (Corrects to expand Apple statement in the third paragraph, clarify who conducted investigation) ~Apple scores legal victory over Samsung in South Korea SEOUL Samsung Electronics Co Ltd on Thursday lost its bid to ban sales of Apple Inc's older iPhone and iPad in South Korea after a court dismissed a lawsuit claiming the U.S. firm had infringed on three of Samsung's mobile patents. ~UPDATE 2-Apple scores legal victory over Samsung in South Korea SEOUL, Dec 12 Samsung Electronics Co Ltd  on Thursday lost its bid to ban sales of Apple Inc's  older iPhone and iPad in South Korea after a court dismissed a lawsuit claiming the U.S. firm had infringed on three of Samsung's mobile patents. ~Nikkei falls 1.4 pct as index heavyweights drag on Fed concern * Futures, index heavyweights lead declines     * Market may be supported above 15,000 near term - analysts     * Nitto Denko nosedives after cutting forecast     * Exporters lose ground as yen bounces      By Ayai Tomisawa     TOKYO, Dec 12 Japan's Nikkei share average dropped 1.4 percent to a one-week low on Thursday morning, led by selling in futures and big-cap stocks as the mood was soured by renewed anxiety of an early  reduction in U.S. stimulus.        The Nikkei shed 223.11  ~Apple scores legal victory over Samsung in South Korea SEOUL, Dec 12 Samsung Electronics Co Ltd  on Thursday lost its bid to ban sales of Apple Inc's  older iPhone and iPad in South Korea, as a court dismissed a lawsuit claiming the U.S. firm had infringed three of Samsung's mobile patents. ~
BAC,BRIEF-SEC says BofA's Merrill Lynch to pay more than $131 mln for misleading investors in CDOs Dec 12 Bank of America Corp :  * SEC says charges Merrill Lynch with misleading investors in cd0s, and that ~
BSX,U.S. FDA panel backs use of Boston Scientific anti-stroke device Dec 11 An advisory panel of medical experts voted on Wednesday to recommend that U.S. health regulators approve an experimental stroke-prevention device made by Boston Scientific Corp ~BRIEF-Boston Scientific anti-stroke device wins FDA panel backing * Says US FDA advisory committee votes 13-1 that benefits of Watchman anti-stroke device outweigh risks ~
BMY,UPDATE 1-FDA panel backs Bristol diabetes drug after prior rejection Dec 12 By a lopsided vote of 13 to 1, an independent committee of medical experts voted on Thursday to recommend approval of a new type of diabetes drug from Bristol-Myers Squibb that U.S. regulators rejected two years ago due to safety concerns. ~Bristol adds medicine to patent pool for AIDS drugs LONDON Bristol-Myers Squibb is to share intellectual property rights on an important HIV/AIDS drug in a patent pool designed to make treatments more widely available in poor countries. ~
CVX,Chevron to cooperate on shale gas in Poland with PGNiG WARSAW, Dec 12 U.S. energy major Chevron  will cooperate on shale gas exploration in south-eastern Poland with Polish state-controlled gas firm PGNiG to lower costs and speed up exploration work, PGNiG said in a statement on Thursday. ~UPDATE 2-Chevron sees cost jump at Australia Gorgon LNG project LOS ANGELES, Dec 12 Chevron Corp raised the cost of its giant Gorgon liquefied natural gas (LNG) project in Australia by $2 billion on Wednesday, the second increase in just over a year to take the total cost to $54 billion. ~
CSCO.O,UPDATE 4-Cisco cuts long-term revenue, earnings targetS * CFO sees core business growth stalling, higher growth in software, services, security   (Adds analyst comment, more executive comments) ~Cisco resurgence in China to require time, patience: CEO Chambers NEW YORK Cisco Systems Chief Executive John Chambers said on Thursday that the network equipment company is preparing for a long battle to improve its business in China, one that will not be won "in a quarter or two." ~Cisco resurgence in China to require time, patience -CEO Chambers NEW YORK, Dec 12 Cisco Systems Chief Executive John Chambers said on Thursday that the network equipment company is preparing for a long battle to improve its business in China, one that will not be won "in a quarter or two." ~MARKET PULSE-Hilton, Faceboook, Cytrx, Genvec, Cisco, ARC Group (For more market insights, including options activity, click on  ; for the Day Ahead newsletter http://link.reuters.com/mex49s;  for the Morning News Call newsletter, http://link.reuters.com/nex49s) U.S. stocks fell for a third day on Thursday amid uncertainty over how soon the Federal Reserve will trim its market-friendly stimulus program. The Dow Jones industrial average was down 0.63 percent at 15,744.05, the S&P; 500 was down 0.29 percent at 1,777.12 and the Nasdaq Composite was down 0.01 per ~MARKET PULSE-Hilton, Faceboook, Genvec, Cisco, ARC Group, Sarepta (For more market insights, including options activity, click on  ; for the Day Ahead newsletter http://link.reuters.com/mex49s;  for the Morning News Call newsletter, http://link.reuters.com/nex49s) U.S. stocks fell for a third day on Thursday amid uncertainty over how soon the Federal Reserve will trim its market-friendly stimulus program. The Dow Jones industrial average was down 0.63 percent at 15,744.05, the S&P; 500 was down 0.29 percent at 1,777.12 and the Nasdaq Composite was down 0.01 per ~
DAL,WRAPUP 1-American Air orders regional jets worth about $4 bln * American goes from "one of oldest fleets to one of newest" ~UPDATE 1-American Airlines orders 60 Embraer jets worth $2.5 bln SAO PAULO, Dec 12 American Airlines Group Inc  agreed to buy 60 aircraft from Embraer SA, the world's largest producer of regional jets, in a deal worth $2.5 billion at list prices, sending Embraer shares to a two-month high on Thursday. ~
XOM,UPDATE 2-Exxon expects N. American liquids output to rise 40 pct by 2040 Dec 12 North American liquids production is expected to rise by more than 40 percent between 2010 and 2040, driven by technological advancements that enable increased output from sources such as oil sands, Exxon Mobil Corp  said on Thursday. ~CORRECTED-Exxon pushes for U.S. oil exports - WSJ (Corrects paragraph 1 to show that the comment on U.S. oil exports was based on an interview with an Exxon executive, not the company's energy outlook report) ~UPDATE 2-Chevron sees cost jump at Australia Gorgon LNG project LOS ANGELES, Dec 12 Chevron Corp raised the cost of its giant Gorgon liquefied natural gas (LNG) project in Australia by $2 billion on Wednesday, the second increase in just over a year to take the total cost to $54 billion. ~
FB.O,US STOCKS-Wall St drops on taper anxiety; Facebook rallies * Dow down 0.7 pct, S&P; 500 off 0.4 pct, Nasdaq off 0.1 pct ~MARKET PULSE-Hilton, Faceboook, Cytrx, Genvec, Cisco, ARC Group (For more market insights, including options activity, click on  ; for the Day Ahead newsletter http://link.reuters.com/mex49s;  for the Morning News Call newsletter, http://link.reuters.com/nex49s) U.S. stocks fell for a third day on Thursday amid uncertainty over how soon the Federal Reserve will trim its market-friendly stimulus program. The Dow Jones industrial average was down 0.63 percent at 15,744.05, the S&P; 500 was down 0.29 percent at 1,777.12 and the Nasdaq Composite was down 0.01 per ~US STOCKS-Wall St dips on taper uncertainty, Facebook rallies * Retail sales top expectations; initial jobless claims jump ~High-profile venture capitalists cut back roles at Accel Partners SAN FRANCISCO Two of Silicon Valley's most respected venture capitalists are cutting back their roles at Accel Partners, the big-name firm best known for its early investment in Facebook. ~Instagram unveils private photo-sharing, messaging NEW YORK/SAN FRANCISCO Photo-sharing service Instagram unveiled a new feature Thursday that allows users to send images and messages privately, as the Facebook-owned company sought to bolster its appeal among younger consumers who are increasingly using mobile messaging applications. ~UPDATE 1-Instagram unveils private photo-sharing, messaging NEW YORK/SAN FRANCISCO, Dec 12 Photo-sharing service Instagram unveiled a new feature Thursday that allows users to send images and messages privately, as the Facebook-owned company sought to bolster its appeal among younger consumers who are increasingly using mobile messaging applications. ~MARKET PULSE-Hilton, Faceboook, Genvec, Cisco, ARC Group, Sarepta (For more market insights, including options activity, click on  ; for the Day Ahead newsletter http://link.reuters.com/mex49s;  for the Morning News Call newsletter, http://link.reuters.com/nex49s) U.S. stocks fell for a third day on Thursday amid uncertainty over how soon the Federal Reserve will trim its market-friendly stimulus program. The Dow Jones industrial average was down 0.63 percent at 15,744.05, the S&P; 500 was down 0.29 percent at 1,777.12 and the Nasdaq Composite was down 0.01 per ~High-profile venture capitalists cut back roles at Accel Partners SAN FRANCISCO, Dec 12 Two of Silicon Valley's most respected venture capitalists are cutting back their roles at Accel Partners, the big-name firm best known for its early investment in Facebook. ~Instagram unveils private photo-sharing, messaging feature NEW YORK/SAN FRANCISCO, Dec 12 Photo-sharing service Instagram unveiled a new feature on Thursday to let people send images and messages privately, as the Facebook-owned company seeks to bolster its appeal among younger consumers who are increasingly using mobile messaging applications. ~
F,Ford to hire 11,000 in U.S., Asia amid new model push DETROIT, Dec 12 Ford Motor Co said on Thursday that it is adding more than 11,000 new jobs in the United States and Asia in 2014 as it rolls out 23 new vehicles, the biggest launch year in the company's 110-year history. ~Exclusive: Ford board aims to pin down CEO Mulally's plans DETROIT/NEW YORK Ford Motor Co's board of directors plans to press Chief Executive Alan Mulally soon for a decision on his future, as speculation intensifies that he may be offered the job of CEO at Microsoft Corp. ~
GM,GM ties up loose ends as reign of new CEO nears DETROIT General Motors Co  checked off items from its to-do list as the era of a new chief executive approaches, with the automaker announcing on Thursday that it has sold the stake in its former finance arm and in its French auto partner. ~WRAPUP 1-GM ties up loose ends as reign of new CEO nears * Engages in financial housecleaning so Barra can focus on operations ~Peugeot takes writedown, gets GM's backing for Dongfeng deal PARIS/LONDON PSA Peugeot Citroen  said on Thursday it took a 1.1 billion euro ($1.52 billion) writedown at its ailing overseas operations and is pursuing a tie-up with China's Dongfeng Motor Group that would give the French carmaker the time and cash to pull out of its downward spiral. ~UPDATE 4-Peugeot takes writedown, gets GM's backing for Dongfeng deal PARIS/LONDON, Dec 12 PSA Peugeot Citroen  said on Thursday it took a 1.1 billion euro ($1.52 billion) writedown at its ailing overseas operations and is pursuing a tie-up with China's Dongfeng Motor Group that would give the French carmaker the time and cash to pull out of its downward spiral. ~Compensation for new GM CEO Barra not yet determined: filing DETROIT Compensation for Mary Barra, who will become General Motors Co  chief executive on January 15, has not yet been determined, the automaker said in a U.S. regulatory filing on Thursday. ~Compensation for new GM CEO Barra not yet determined -filing DETROIT, Dec 12 Compensation for Mary Barra, who will become General Motors Co chief executive on Jan. 15, has not yet been determined, the automaker said in a U.S. regulatory filing on Thursday. ~European shares extend 2-week slide on Fed jitters * FTSEurofirst 300 down 0.9 pct, Euro STOXX 50 down 0.7 pct ~General Motors sells Ally stake for $900 million General Motors Co  has sold its remaining 8.5 percent stake in Ally Financial Inc , its former auto finance arm, for $900 million, the carmaker said on Thursday. ~GM yet to reap full benefits of European alliance plans FRANKFURT General Motors Co  scaled back its alliance with Peugeot  on Thursday and put a brave face on yet another setback for its efforts to seek growth in Europe through collaboration and partnerships. ~
GS,UPDATE 1-L&G; hires Goldman Sachs to advise on bid for Co-Op insurance unit LONDON, Dec 12 UK insurer Legal & General  has hired Goldman Sachs to advise on a possible bid for the general insurance arm of the Co-operative Group, a source familiar with the process said. ~L&G; hires Goldman Sachs to advise on bid for Co-Op insurance unit-source LONDON, Dec 12 UK Insurer Legal & General  has hired Goldman Sachs to advise on a possible bid for the general insurance arm of the Co-operative Group, a source familiar with the process said. ~Goldman to provide $120 million pre-IPO loan to China warehouse firm HONG KONG Goldman Sachs  has agreed to provide a $120 million pre-IPO loan to Shanghai-based warehouse developer e-Shang, co-founded by U.S. private equity firm Warburg Pincus , e-Shang said on Thursday. ~Goldman to provide $120 mln pre-IPO loan to China warehouse firm HONG KONG, Dec 12 Goldman Sachs has agreed to provide a $120 million pre-IPO loan to Shanghai-based warehouse developer e-Shang, co-founded by U.S. private equity firm Warburg Pincus, e-Shang said on Thursday. ~
INTC.O,UPDATE 1-Soccer-Barcelona strike sponsorship deal with Intel BARCELONA, Dec 12 Barcelona have agreed a sponsorship deal with Intel under which the chipmaker's logo will be printed on the inside of players' shirts, the Spanish champions announced on Thursday. ~Barcelona strike sponsorship deal with Intel BARCELONA Barcelona have agreed a sponsorship deal with Intel in which the chipmaker's logo will be printed on the inside of players' shirts, the Spanish champions announced on Thursday. ~Soccer-Barcelona strike sponsorship deal with Intel BARCELONA, Dec 12 Barcelona have agreed a sponsorship deal with Intel in which the chipmaker's logo will be printed on the inside of players' shirts, the Spanish champions announced on Thursday. ~
IBM,Lawsuit accuses IBM of hiding China risks amid NSA spy scandal NEW YORK, Dec 12 IBM Corp has been sued by a shareholder who accused it of concealing how its ties to what became a major U.S. spying scandal reduced business in China and ultimately caused its market value to plunge more than $12 billion. ~
JPM,UPDATE 3-BofA's Merrill to pay $132 mln in SEC case over mortgages Dec 12 Bank of America Corp has agreed to pay $131.8 million to settle U.S. Securities and Exchange Commission charges that its Merrill Lynch unit misled investors about mortgage securities it structured and sold. ~REFILE-UPDATE 1-U.S. authorities near deal with JPMorgan on Madoff violations NEW YORK, Dec 12 JPMorgan Chase & Co is working with criminal and regulatory authorities on settlements over the bank's relationship with convicted Ponzi schemer Bernard Madoff, ones that would involve $2 billion in penalties and a rare criminal action, according to sources familiar with the matter. ~Criminal action expected for JPMorgan in Madoff case: NYT JPMorgan Chase & Co  and federal authorities are nearing settlements over the bank's relationship with convicted Ponzi schemer Bernard Madoff, striking tentative deals that would involve about $2 billion in penalties and a rare criminal action, the New York Times reported. ~Criminal action expected for JPMorgan in Madoff case-NYT Dec 12 JPMorgan Chase & Co and federal authorities are nearing settlements over the bank's relationship with convicted Ponzi schemer Bernard Madoff, striking tentative deals that would involve about $2 billion in penalties and a rare criminal action, the New York Times reported. ~
MRK,FDA panel says Merck's allergy drug effective Dec 12 A panel of experts advising the U.S. Food and Drug Administration said an oral drug made by Merck & Co  was effective in treating grass pollen allergy but expressed concerns about the drug's safety in children. ~
MSFT.O,TrueCar gets $30 mln from Paul Allen's Vulcan Capital Dec 12 TrueCar.com, a car pricing information website, said it received a $30 million investment from Microsoft Corp co-founder Paul Allen's Vulcan Capital. ~India to allow Nokia to transfer Chennai factory to Microsoft NEW DELHI/HELSINKI Nokia has won an appeal to release a local factory seized by authorities in a tax dispute, allowing the transfer of the plant as part of the sale of its mobile phone business to Microsoft. ~UPDATE 2-India to allow Nokia to transfer Chennai factory to Microsoft NEW DELHI/HELSINKI, Dec 12 Nokia has won an appeal to release a local factory seized by authorities in a tax dispute, allowing the transfer of the plant as part of the sale of its mobile phone business to Microsoft. ~India court lifts Nokia factory freeze in tax dispute NEW DELHI, Dec 12 An Indian court on Thursday accepted Nokia's appeal to release its local factory after its seizure by authorities in a tax dispute, removing a hurdle for the sale of the company's mobile phone business to Microsoft . ~
MS,Landmark HK court order forces insider trader to compensate investors SINGAPORE, Dec 12 A former Morgan Stanley  banker convicted of insider trading will have to pay more than 290 investors a total of HK$23.9 million ($3.08 million) they lost out on, a Hong Kong court ordered on Thursday, in an unprecedented legal ruling. ~
ORCL.N,UPDATE 1-European Factors to Watch-Stocks to fall on prospect of early Fed taper LONDON, Dec 12 European stocks are set to open lower on Thursday, with the probable nomination of a relatively hawkish central banker to the U.S. Federal Reserve vice-chair adding to the view that the U.S. may slow its monetary stimulus sooner than previously thought. ~Exclusive: Hellman & Friedman looks to sell HR software firm Kronos - sources NEW YORK Private equity firms Hellman & Friedman LLC and JMI Equity are exploring a sale of human resources management software firm Kronos Inc, which could be valued at more than $4 billion, people familiar with the matter said on Wednesday. ~
PEP,PepsiCo to replace Coca-Cola at Buffalo Wild Wings- NYT Dec 12 PepsiCo is set to replace Coca-Cola as the beverage supplier to restaurant chain Buffalo Wild Wings, the New York Times reported on Wednesday. ~
QCOM.O,China official says has "substantial" price-fixing evidence against Qualcomm - media BEIJING, Dec 12 China's top economic planning agency has "substantial evidence" against chipmaker Qualcomm Inc  in an antitrust probe, state media on Thursday quoted a senior official at the price regulator as saying. ~
SBUX.O,INSIGHT-China CCTV Starbucks report set off storm inside network BEIJING, Dec 13 A China state television investigative report accusing Starbucks of overcharging local customers for coffee triggered enormous disquiet among journalists at the network and even some soul-searching after it aired. ~
KO,PepsiCo to replace Coca-Cola at Buffalo Wild Wings : NYT PepsiCo  is set to replace Coca-Cola  as the beverage supplier to restaurant chain Buffalo Wild Wings , the New York Times reported on Wednesday. ~PepsiCo to replace Coca-Cola at Buffalo Wild Wings- NYT Dec 12 PepsiCo is set to replace Coca-Cola as the beverage supplier to restaurant chain Buffalo Wild Wings, the New York Times reported on Wednesday. ~
VZ,UPDATE 1-Verizon takes hard line on surveillance vote -activists BOSTON, Dec 11 Verizon Communications Inc  told activist investors on Wednesday that it might skip a vote on a shareholder proposal that seeks details on the company's cooperation with government surveillance efforts. ~
