AMZN.O,UPDATE 3-Amazon plans Prime fee hike by $20, risks consumer wrath March 13 Amazon.com Inc plans to hike the annual fee for its popular Prime service by 25 percent to $99 starting next week, a move announced on Thursday that risks losing customers for a feature that has helped drive its business. ~Ocado sees opportunities from Amazon move into groceries LONDON British online grocer Ocado sees Amazon's push to sell more groceries as more of an opportunity than a threat, believing it will encourage big international retailers to look for partners to help them get set up in e-commerce. ~Ocado sees opportunities from Amazon move into groceries LONDON, March 13 British online grocer Ocado  sees Amazon's  push to sell more groceries as more of an opportunity than a threat, believing it will encourage big international retailers to look for partners to help them get set up in e-commerce. ~Amazon raising annual Prime membership fee to $99   ~BRIEF-Amazon.com raises price of Amazon Prime membership to $99/yr from $79/yr March 13 Amazon.com Inc :  * Says raises price of amazon prime membership to $99/yr from $79/yr ~
BAC,Bank of America back in court over $2.1 billion fraud penalties * Government to increase penalties against ex-Countrywide executive ~
BA,WRAPUP 1-Malaysia jet sent "pings" after going missing, sources say * "Pings" indicate missing plane's systems on for some time ~UPDATE 3-Boeing in talks with India airlines on 737 MAX jet * Two sources say $5 bln deal with Jet essentially secured ~CORRECTED-UPDATE 2-Boeing in talks with India airlines on 737 MAX jet (Corrects Airbus forecast to 20 years, not 29, in third paragraph) ~Boeing in talks with Jet Airways, Air India for 737 Max jets HYDERABAD, March 13 Boeing Co is in discussions with Indian airlines Jet Airways and Air India about the sale of its 737 MAX jets, one of the aircraft manufacturer's senior sales executives said on Thursday. ~
CSCO.O,Polycom eliminates COO position in push to boost margins March 13 Videoconferencing equipment maker Polycom Inc said it eliminated the position of chief operating officer at a time when the company is cutting costs to better compete against rivals such as Cisco and Google. ~U.S. tech giants' offshore cash piles earn interest from government: report LONDON Four of the biggest U.S. technology groups collectively hold an estimated $124 billion in U.S. Treasury debt, much of it offshore, earning them tax-free interest, the UK's Bureau of Investigative Journalism (BIJ) said on Thursday. ~U.S. tech giants' offshore cash piles earn interest from govt-report LONDON, March 13 Four of the biggest U.S. technology groups collectively hold an estimated $124 billion in U.S. Treasury debt, much of it offshore, earning them tax-free interest, the UK's Bureau of Investigative Journalism (BIJ) said on Thursday. ~
CMCSA.O,Comcast deal may offer media companies leverage on fees LOS ANGELES/NEW YORK, March 13 Media companies plan to press Comcast Corp for higher fees in the coming year, seeing an opportunity to squeeze better terms from the U.S. cable company as regulators review its planned takeover of Time Warner Cable Inc. ~
COP,World Bank panel rejects Venezuela's appeal over Conoco CARACAS, March 12 A World Bank panel has rejected Venezuela's request for a new hearing to contest a 2013 partial ruling that it failed to act in good faith regarding negotiations to compensate U.S. oil company ConocoPhillips  for expropriations. ~
DG,UPDATE 2-Penny-pinching shoppers weigh on Dollar General sales March 13 Retailer Dollar General Corp  reported lower-than-expected sales for the holiday quarter on Thursday, blaming weak consumer confidence among its low-income shoppers, cold weather and aggressive competition. ~Dollar General holiday-quarter sales, forecast miss estimates Retailer Dollar General Corp  on Thursday posted lower-than-expected sales for the holiday quarter, blaming cold weather, aggressive competition and low consumer confidence. ~Dollar General holiday-quarter sales miss estimates March 13 Retailer Dollar General Corp on Thursday posted lower-than-expected sales for the holiday quarter, blaming cold weather, tough competition and low consumer confidence. ~
DOW,BRIEF-Downer EDI says offer for Spotless Group now closed * Confirms that its offer for Spotless was not extended and has now closed. Source text for Eikon: Further company coverage: ~BRIEF-Downer EDI posts FY net profit of $181.5 million * FY total revenue and other income from ordinary activities $7.29 billion , up 6.4 percent ~BRIEF-Downer EDI says ‍offer for Spotless Group extended to 28 August 2017​ * ‍Offer for Spotless Group extended to 7pm on Monday, 28 august 2017​ Source text for Eikon: Further company coverage: ~BRIEF-Downer EDI says Spotless ‍offer extended to Aug 21, 2017​ * Spotless ‍offer extended to 7pm on monday, 21 august 2017​ Source text for Eikon: Further company coverage: ~BRIEF-Downer EDI's takeover offer for Spotless Group extended till 7pm (Sydney time) on Aug. 14 * Unconditional takeover offer for Spotless Group extended until 7:00pm (Sydney time) on Monday, 14 August Source text for Eikon: Further company coverage: (bangalore.newsroom@thomsonreuters.com) ~BRIEF-Downer extends takeover offer for Spotless Group * decided to extend Spotless offer period for one week; offer will now remain open for acceptance until 14 august Source text for Eikon: Further company coverage: ~BRIEF-Downer extends Spotless offer to August 7 2017 * ‍Downer has decided to extend offer for Spotless Group holdings to 7 pm on Monday, 7 august 2017​ Source text for Eikon: Further company coverage: ~BRIEF-Downer EDI's stake in Spotless increases to 80.3 pct * Downer's stake in Spotless increases to 80.3 pct Source text for Eikon: Further company coverage: ~BRIEF- Downer EDI Ltd'S stake in Spotless Group increases to 72% * As Downer's shareholding in Spotless is now over 70%, Downer expects that Spotless will be removed from certain S&P;/ASX market indices ~
EBAY.O,EBay CEO sees Icahn getting louder, tells employees not to listen SAN FRANCISCO, March 13 Carl Icahn's campaign to convince eBay Inc to spin off its PayPal payments service will intensify in the run-up to eBay's shareholders' meeting in May, eBay's chief executive said on Thursday, warning employees to ignore the "noise." ~
FB.O,Facebook CEO Zuckerberg phoned Obama to complain about spying SAN FRANCISCO, March 13 Facebook Inc  Chief Executive Mark Zuckerberg blasted the U.S. government's electronic surveillance practices on Thursday, saying he'd personally called President Barack Obama to voice his displeasure. ~Facebook rolls out video ads, aims to capture part of TV-marketing budgets SAN FRANCISCO Facebook Inc will allow more marketers to run video advertisements on its website, provided the world's No.1 social network deem them to be of high-enough quality. ~Facebook rolls out video ads, aims to capture part of TV-marketing budgets SAN FRANCISCO, March 13 Facebook Inc will allow more marketers to run video advertisements on its website, provided the world's No.1 social network deem them to be of high-enough quality. ~U.S. news readers less engaged when referred by Facebook: study Readers of some of the top U.S. news sites are more engaged when they go directly to the website rather than through Facebook, according to a study from the Pew Research Center released on Monday. ~
GE,UPDATE 3-GE files to spin off credit card unit * Goldman Sachs, JP Morgan, Citigroup, Morgan Stanley are lead underwriters ~DIARY-U.S. MEETINGS/WEEK AHEAD THOMSON REUTERS, Mar 13,2014 - Corporate Meetings for US companies for Week ahead.         S&P; 500 Earnings - Weekly           S&P; 500 Earnings - Day Ahead        Non S&P; 500 - Weekly               Non S&P; 500 - Day Ahead             ConferenceCall/Webcast - Weekly    ConferenceCall/Webcast - Day        S&P; 500 Earnings - Monthly           Meetings - Day Ahead                Economic Indicators                  Dividends                           Daily earnings hits & misses         Federal Rese ~GE's North American retail finance business files for IPO March 13 General Electric Co's North American retail finance business filed with U.S. regulators to raise up to $100 million in an initial public offering of common stock. ~
GM,UPDATE 2-U.S. transportation chief pledges hard look at GM recall * Senator Murray asks why so long before government acted ~U.S. probes timing of GM reporting ignition problem -Secretary Foxx WASHINGTON, March 13 U.S. Transportation Secretary Anthony Foxx on Thursday said his agency was looking into whether General Motors was slow to report to the federal government problems with ignition switches in its autos, which has led to 12 deaths. ~GM waited on Ion recall despite awareness of fatal crashes DETROIT/WASHINGTON General Motors Co waited more than two weeks to expand a major recall to include the Saturn Ion and other compact cars, even though its engineers were aware of four fatalities in crashes involving the model, GM said in filings published on Wednesday. ~
GS,Avenue Capital hunts for distressed buyout using blank-check IPO NEW YORK, March 13 Marc Lasry's $12.6 billion Avenue Capital Group has taken the unusual step of funding a deal in the public markets before it has even figured out what it wants to buy. ~
INTC.O,Intel lead on conflict minerals helps, challenges other firms March 13 (Thomson Reuters Foundation) - Intel Corp has spent more than five years figuring out how to rid its supply chain of minerals that finance violence in the Democratic Republic of Congo region, and now it is offering to show other companies how they can do the same. ~
MCD,UPDATE 1-McDonald's hit by worker lawsuits claiming it steals wages March 13 McDonald's Corp workers in three U.S. states filed lawsuits this week against the fast-food chain, alleging it is stealing wages by forcing them to work off the clock, by cheating them out of overtime and by denying them rest breaks. ~REFILE-McDonald's hit by lawsuits claiming it steals wages March 13 Several lawsuits were filed this week against McDonald's Corp by fast-food workers, alleging the hamburger chain was systematically stealing their wages. ~
MSFT.O,Microsoft poised to fight back as iPad generation shuns Office SAN FRANCISCO/SEATTLE It may be one of Microsoft Corp's biggest squandered opportunities. ~NORDIC STOCKS - Factors to watch on March 13 HELSINKI, March 13 The following stocks may be affected by newspaper reports and other factors on Thursday: ~NORDIC STOCKS - Factors to watch on March 13 HELSINKI, March 13 The following stocks may be affected by newspaper reports and other factors on Thursday: ~U.S. tech giants' offshore cash piles earn interest from government: report LONDON Four of the biggest U.S. technology groups collectively hold an estimated $124 billion in U.S. Treasury debt, much of it offshore, earning them tax-free interest, the UK's Bureau of Investigative Journalism (BIJ) said on Thursday. ~U.S. tech giants' offshore cash piles earn interest from govt-report LONDON, March 13 Four of the biggest U.S. technology groups collectively hold an estimated $124 billion in U.S. Treasury debt, much of it offshore, earning them tax-free interest, the UK's Bureau of Investigative Journalism (BIJ) said on Thursday. ~
MS,Morgan Stanley names Falloon as head of Asia Pac fixed income - memo HONG KONG, March 13 Morgan Stanley has named Ben Falloon as head of Asia Pacific fixed income markets, replacing Steve Glynn, who is leaving the firm, according to an internal memo seen by Reuters on Thursday. ~
TROW.O,Eventbrite raises $60 million, likely delaying IPO SAN FRANCISCO, March 13 Online ticketing service Eventbrite said it had raised $60 million in financing from Tiger Global and T. Rowe Price, damping expectations that Eventbrite might hold an initial public offering this year. ~
TGT,UPDATE 2-Target says it declined to act on early alert of cyber breach BOSTON/WASHINGTON, March 13 Target Corp's  security software detected potentially malicious activity during last year's massive data breach, but its staff decided not to take immediate action, the No. 3. U.S. retailer said on Thursday. ~Target missed early alert of credit card data breach -report WASHINGTON, March 13 A Target Corp team of security experts, armed with a malware detection tool made by FireEye Inc, alerted company officials about a possible data breach on Nov. 30, but they failed to respond to the warning signs, according to a media report on Thursday. ~
TXN.O,UPDATE 1-Texas Instruments wants to hand more cash back to shareholders SAN FRANCISCO, March 13 Texas Instruments  said on Thursday it plans to return more cash to its shareholders, expanding a capital management policy that has helped boost the chipmaker's stock to its highest level in more than a decade. ~Texas Instruments wants to hand more cash back to shareholders SAN FRANCISCO, March 13 Texas Instruments  said on Thursday it plans to return more cash to shareholders, expanding a capital management policy that has helped boost the chipmaker's stock to its highest level in more than a decade. ~
UTX,UPDATE 1-United Tech upbeat on sales to 2020; Q1 view lags Street March 13 Diversified manufacturer United Technologies Corp. forecast sales may approach $100 billion by the end of the decade, up from roughly $64 billion expected for 2014, as the company grows at about twice the pace of the global economy. ~United Tech sees first quarter earnings below Wall Street target Diversified manufacturer United Technologies Corp.  forecast first-quarter earnings below Wall Street's target on Thursday, although it backed its full-year financial outlook. ~United Tech sees Q1 earnings below Wall Street target March 13 Diversified manufacturer United Technologies Corp. forecast first-quarter earnings below Wall Street's target on Thursday, although it backed its full-year financial outlook. ~BRIEF-United Technologies sees Q1 EPS about $1.25 March 13 United Technologies Corp :  * Sees Q1 EPS about $1.25 ~United Technologies sets revenue target through 2020 March 13 Diversified manufacturer United Technologies Corp. said on Thursday it aims to increase revenue by mid-single-digit percentages annually, excluding acquisitions, from now until 2020. ~BRIEF-United Technologies sees 2014 EPS in range of $6.55-$6.85, 2014 sales about $64 billion--slides March 13 United Technologies Corp :  * Sees 2014 EPS in range of $6.55-$6.85, 2014 sales about $64 billion--slides  * Says targets mid-single digit organic revenue growth annually through 2020 ~
VZ,UPDATE 2-Target says it declined to act on early alert of cyber breach BOSTON/WASHINGTON, March 13 Target Corp's  security software detected potentially malicious activity during last year's massive data breach, but its staff decided not to take immediate action, the No. 3. U.S. retailer said on Thursday. ~
V,BRIEF-Visa calls for redemption all of its 1.200 pct notes due 2017 * Visa Inc - on Sept 11, co called for redemption all of $1.75 billion principal amount outstanding of its 1.200 pct notes due 2017‍​ - SEC filing ~BRIEF-Visa Inc files for three-part senior notes offering of up to $2.5 bln * Visa Inc says files for three-part senior notes offering of up to $2.5 billion - SEC filing‍​ ~Former BoE deputy Hogg to join Visa as Europe unit CEO Visa Inc, the world's largest payments processor, on Thursday named former Bank of England (BoE) deputy governor Charlotte Hogg as chief executive of its Europe division. ~CORRECTED-UPDATE 1-MOVES-Former BoE deputy Hogg to join Visa as Europe unit CEO Sept 7 Visa Inc, the world's largest payments processor, on Thursday named former Bank of England (BoE) deputy governor Charlotte Hogg as chief executive of its Europe division. ~MOVES-Visa names ex-BoE deputy Charlotte Hogg as Europe unit CEO Sept 7 Visa Inc, the world's largest payments processor, on Thursday named Charlotte Hogg as chief executive of its Europe division. ~BRIEF-Visa appoints Charlotte Hogg as CEO of European operations * Visa Inc appoints Charlotte Hogg as chief executive officer of the compan's European operations ~BRIEF-Visa Inc files prospectus supplement for potential three-part senior notes offering * Visa Inc files prospectus supplement for potential three-part senior notes offering; size not disclosed - sec filing‍​ Source text (http://bit.ly/2vLDrIe) Further company coverage: ~BRIEF-Visa enables on the go payments with the new Fitbit Ionic * Visa inc- ‍enabling visa payments on fitbit's smartwatch fitbit ionic​ ~BRIEF-Bridg raises $11 million in Series B funding * Bridg raises $11 million in Series B funding from Morpheus Ventures, March Capital, Visa and NextEquity ~
WDC.O,Western banks cold-shoulder Iran trade finance scheme LONDON/ANKARA, March 13 Despite a diplomatic thaw, Western banks are steering clear of attempts by Iran to get them involved in financing humanitarian transactions, fearing they could be penalised under U.S. sanctions, bankers and government officials told Reuters. ~
