AMZN.O,Africa e-commerce firm expands to new markets BERLIN Online retailer Jumia, a would-be African Amazon set up by German venture capital firm Rocket Internet, is expanding into three new markets - Uganda, Ghana and Cameroon, the company said on Monday. ~Amazon offers 3D printing to customize earrings, bobble head toys SAN FRANCISCO Amazon.com Inc will offer 3D printing services that allow customers to customize and build earrings, bobble head toys and other items from third-party sellers using a new personalization option on its website. ~Amazon to open five new warehouses in India MUMBAI Amazon.com Inc's Indian unit will open five new warehouses in the country, which will almost double its storage capacity to half a million square feet, the company said in a statement on Monday. ~Africa e-commerce firm expands to new markets * African online retailer Jumia expands into three markets ~Amazon to open five new warehouses in India MUMBAI, July 28 Amazon.com Inc's Indian unit will open five new warehouses in the country, which will almost double its storage capacity to half a million square feet, the company said in a statement on Monday. ~
BAC,MOVES- Deloitte Corporate Finance, Bank Of America, Citigroup July 28 The following financial services industry appointments were announced on Monday. To inform us of other job changes, email moves@thomsonreuters.com. ~
CMI,Engine maker Cummins raises full-year sales forecast Cummins Inc, which makes engines and other vehicle components, reported a 7 percent rise in quarterly revenue and raised its full-year revenue forecast, citing improving demand from makers of pickup trucks and motor homes in North America. ~Auto component maker Cummins raises sales forecast July 28 Cummins Inc, the U.S. maker of engines and other vehicle components, reported a 7.7 percent rise in quarterly profit and raised its full-year revenue forecast, citing improving demand in North America. ~
DRI,Darden CEO Clarence Otis to step down, stock jumps Darden Restaurants Inc on Monday said Clarence Otis would step down as chairman and chief executive officer, buckling under pressure from activist investors Barington Capital Group LP and Starboard Value LP. ~Darden CEO Clarence Otis to step down July 28 Darden Restaurants Inc said Clarence Otis would step down as chairman and chief executive, buckling under pressure from activist investors Barington Capital Group LP and Starboard Value LP. ~
DG,Deals of the day- Mergers and acquisitions (Adds Carlyle Group, Zillow, CVC Capital Partners, Galeries Lafayette) ~
DLTR.O,UPDATE 6-Dollar Tree to buy Family Dollar to stave off competition * Company to beat Dollar General as top N. America discount chain ~US STOCKS-Wall St yawns as deal news offsets data; Herbalife sinks * Dollar Tree offers to buy Family Dollar; deal valued at $9.2 bln ~US STOCKS-Wall St finishes flat; deal news offsets housing data * Dollar Tree offers to buy Family Dollar; deal valued at $9.2 bln ~Deals of the day- Mergers and acquisitions (Adds Carlyle Group, Zillow, CVC Capital Partners, Galeries Lafayette) ~US STOCKS-Wall St near flat as deal news offsets housing data * Dollar Tree offers to buy Family Dollar; deal valued at $9.2 bln ~US STOCKS-Wall St dips as housing data disappoints * Dollar Tree offers to buy Family Dollar; deal valued at $9.2 bln ~US STOCKS-Wall St falls after housing data disappoints * Indexes down: Dow 0.4 pct, S&P; 0.5 pct, Nasdaq 0.7 pct   (Updates to market open, adds economic data) ~US STOCKS-Futures point to flat open, but M&A; supports * Futures up: Dow 1 pt, S&P; 0.5 pt, Nasdaq 5.5 pts   (Updates prices, adds Zillow acquisition) ~US STOCKS-Futures flat with S&P; 500 near record levels NEW YORK, July 28 U.S. stock index futures were little changed on Monday as investors looked ahead to the latest economic data and corporate earnings to give direction to a market near record levels. ~
FB.O,UPDATE 1-OkCupid admits to Facebook-style experimenting on customers (Adds comment from internet ethics expert, details throughout) ~OkCupid admits to Facebook-style experimenting on customers SAN FRANCISCO, July 28 OkCupid, a top U.S. matchmaking website, regularly mismatches users to test its technology, the IAC/InterActive Corp service revealed on Monday, weeks after Facebook Inc admitted to misleading users in a psychological study. ~
F,Ford raises F-150 prices, dealers begin ordering 2015 models DETROIT U.S. and Canadian dealers on Monday began ordering 2015 Ford Motor Co F-150 pickup trucks, which are lighter than earlier models, priced higher and include additional standard features, the company said. ~Ford raises F-150 prices, dealers begin ordering 2015 models DETROIT, July 28 U.S. and Canadian dealers on Monday began ordering 2015 Ford Motor Co F-150 pickup trucks, which are lighter than earlier models, priced higher and include additional standard features, the company said. ~
GS,Court appeal to move LME closer to cutting warehouse backlogs * LME to give three-month notice on rules if wins case-source ~
MCD,U.S. food group CEO to brief media as McDonald's feels pinch in China food scandal SHANGHAI, July 28 The head of U.S. meat supplier OSI Group, the parent company of a Chinese firm at the centre of a food safety scandal, will hold a news conference in Shanghai later on Monday, as McDonald's Corp struck more meat dishes off its menus in China. ~
MRK,Pfizer's need for deal looms larger with earnings report NEW YORK Pfizer Inc's vulnerability to cheaper generics and its weak roster of experimental medicines will be on display Tuesday when the company reports quarterly earnings, reviving interest in its pursuit of AstraZeneca Plc or other deals to fortify its pipeline. ~
MSFT.O,UPDATE 3-Judge allows $2 bln sale of NBA's Los Angeles Clippers to proceed LOS ANGELES, July 28 The record $2 billion sale of pro basketball's Los Angeles Clippers to former Microsoft Corp chief executive Steve Ballmer can proceed over the objections of co-owner Donald Sterling, a judge tentatively ruled on Monday. ~Microsoft targeted in apparent Chinese antitrust probe BEIJING Microsoft Corp appears to be the latest U.S. company targeted by China for antitrust investigation as government officials paid sudden visits to the software firm's Chinese offices on Monday. ~UPDATE 2-Microsoft targeted in apparent Chinese antitrust probe BEIJING, July 28 Microsoft Corp appears to be the latest U.S. company targeted by China for antitrust investigation as government officials paid sudden visits to the software firm's Chinese offices on Monday. ~UPDATE 1-JD.com to sell Microsoft's Xbox One games console in China BEIJING, July 28 JD.com Inc, China's second-biggest e-commerce company by market share, will accept pre-orders for Microsoft Corp's Xbox One games console in China from July 28 to July 30, the firm said on Monday. ~
MS,Morgan Stanley to raise junior bankers' base salaries by 25 pct - Bloomberg July 28 Morgan Stanley is raising base salaries for junior bankers by about 25 percent in a bid to improve working conditions and retention, Bloomberg said, citing people briefed on the matter. ~
TSN,UPDATE 3-Tyson to sell Mexico, Brazil poultry businesses to JBS July 28 Tyson Foods Inc said on Monday it would sell its Mexican and Brazilian poultry businesses to JBS SA's Pilgrim's Pride for $575 million and use the proceeds to pay down debt from its pending $7.7 billion purchase of Hillshire Brands Co. ~Shares of Brazil's JBS rise after deal to buy Tyson units SAO PAULO, July 28 Shares of JBS SA, the world's largest meat producer, rose 3 percent in Sao Paulo trading on Monday after it announced it would buy Tyson Foods Inc's Mexican and Brazilian poultry businesses for $575 million. ~Tyson to sell Mexican and Brazilian poultry businesses July 28 Tyson Foods Inc, the biggest U.S. meat processor, said it would sell its Mexican and Brazilian poultry businesses to Pilgrims Pride Corp  parent JBS SA for $575 million. ~
WMT,INDIA PRESS-Wal-Mart seeks to grow footprint in India - Mint Note: Reuters has not verified this story and does not vouch for its accuracy.   (Compiled by Aby Jose Koilparambil in Bangalore) ~JD.com to sell Microsoft's Xbox One games console in China BEIJING JD.com Inc, China's second-biggest e-commerce company by market share, will accept pre-orders for Microsoft Corp's Xbox One games console in China from July 28 to July 30, the firm said on Monday. ~
