AMZN.O,SPECIAL REPORT-Rainforest raiders foil the guardians of the Amazon NOVA ESPERANÇA DO PIRIÁ, Brazil, Jan 16 Alex Lacerda and Paulo Maués drive a silver pickup to an outdoor sawmill near the edge of the Amazon rainforest. Carrying 12-gauge shotguns, they step out and approach a shack, knock and enter cautiously. They are agents for Brazil's environmental police. ~Amazon.com workers reject unionization in Delaware vote SEATTLE A small group of Amazon.com Inc technicians at a distribution center in Delaware voted on Wednesday not to join a union, marking a victory for the U.S. online retailer which is strongly opposed to any kind of third-party representation for its employees. ~UPDATE 1-Amazon.com workers reject unionization in Delaware vote SEATTLE, Jan 15 A small group of Amazon.com Inc  technicians at a distribution center in Delaware voted on Wednesday not to join a union, marking a victory for the U.S. online retailer which is strongly opposed to any kind of third-party representation for its employees. ~
AXP,BRIEF-American Express shares down 2.5 pct in extended trade NEW YORK, Jan 16 American Express Co :  * Shares down 2.5 percent in extended trade following results ~
APA,Apache Corp says severe weather hurt U.S. output Jan 16 Oil and gas producer Apache Corp  said severe winter weather in the western United States hurt output at its operations in Oklahoma, Texas and New Mexico in the fourth quarter. ~
AAPL.O,Apple China Mobile launch could spark costly subsidy war BEIJING, Jan 17 Apple Inc is finally launching its iPhone on China Mobile Ltd's vast network  on Friday, opening the door to the world's largest carrier's 763 million subscribers and giving its China sales a short-term jolt. ~Germany's insolvent TV maker Loewe salvaged by investor group FRANKFURT, Jan 16 German television maker Loewe AG said it would be taken over by a group of investors that include former senior managers at Apple  and Bang & Olufsen, six months after seeking creditor protection. ~Apple's objections show why e-book monitor is needed: judge NEW YORK Apple Inc's various objections to a court-appointed antitrust monitor in a case involving fixing e-book prices only confirm the importance of his work, a federal judge said on Thursday. ~Apple's objections show why e-book monitor is needed - judge NEW YORK, Jan 16 Apple Inc's various objections to a court-appointed antitrust monitor in a case involving fixing e-book prices only confirm the importance of his work, a federal judge said on Thursday. ~China's ZTE aims to ship 60 million smartphones this year, up 20 million HONG KONG, Jan 16 Chinese smartphone maker ZTE Corp  aims to ship more than 60 million smartphones globally this year, as it tries to grab more share of a highly competitive market dominated by Samsung Electronics and Apple. ~Apple to refund at least $32.5 million in disputed kids' app purchases WASHINGTON Apple Inc will refund consumers at least $32.5 million to settle a longstanding complaint that the technology company billed U.S. consumers for charges incurred by children through mobile apps without their parents' consent. | Video  ~
T,AT&T; ends 'American Idol' sponsorship Jan 15 AT&T; Inc is no longer an official sponsor of Fox's "American Idol," as the pioneer singing competition's declining viewership appears to be making it less attractive to advertisers. ~
BAC,UPDATE 1-U.S. judge rejects deal to end Detroit swap agreements DETROIT, Jan 16 A U.S. bankruptcy judge on Thursday rejected a deal allowing Detroit to end costly interest-rate swap agreements with two investment banks, possibly further delaying when the city will submit to the court its plan to adjust its debt. ~
BBY,US STOCKS-Dow, S&P; 500 end down; bond trading bites bank profits * Dow down 0.4 pct, S&P; 500 off 0.1 pct, Nasdaq up 0.1 pct ~US STOCKS-Dow, S&P; 500 ease as bank earnings disappoint * Dow down 0.4 pct, S&P; 500 off 0.2 pct, Nasdaq up 0.03 pct ~US STOCKS-S&P; 500 retreats from record; bank profits disappoint * Initial jobless claims dip; CPI up in December vs November ~Best Buy shares tumble on weak holiday sales, margin forecast NEW YORK Best Buy Co  shares tumbled about 30 percent on Thursday after the world's largest consumer electronics chain reported disappointing holiday sales and warned of a bigger-than-expected decline in quarterly operating margins. | Video  ~UPDATE 4-Best Buy shares tumble on weak holiday sales, margin forecast NEW YORK, Jan 16 Best Buy Co shares tumbled about 30 percent on Thursday after the world's largest consumer electronics chain reported disappointing holiday sales and warned of a bigger-than-expected decline in quarterly operating margins. ~US STOCKS-Best Buy, financials knock Wall Street off new high * Indexes off: Dow 0.34 pct, S&P; 0.22 pct, Nasdaq 0.04 pct ~US STOCKS-Wall St to pull back at open after record high * Futures: Dow off 32 pts, S&P; down 3.8 pts, Nasdaq down 2 pts ~US STOCKS-Futures dip after record high, ahead of data * Futures: Dow off 24 pts, S&P; down 3.8 pts, Nasdaq down 2.25 pt ~US STOCKS-Futures flat ahead of data, bank earnings * Futures: Dow off 4 pts, S&P; off 1.3 pts, Nasdaq up 3 pts ~
BLK,UPDATE 4-BlackRock profit jumps on strong markets; shares gain Jan 16 BlackRock Inc, the world's largest money manager, reported a higher-than-expected quarterly profit on Thursday, benefiting from strong markets and a flow of new money into its exchange-traded funds and retail business. ~US STOCKS-Futures flat ahead of data, bank earnings * Futures: Dow off 4 pts, S&P; off 1.3 pts, Nasdaq up 3 pts ~BlackRock's fourth-quarter profit rises 24 percent Jan 16 BlackRock Inc, the world's largest money manager, said on Thursday its fourth-quarter profit rose 24 percent, citing growth in markets, long-term net inflows and strong performance fees. ~
BA,In Boeing 787 battery probe, x-rays may offer clues to past incidents TOKYO/SEATTLE Investigators in Japan are studying x-ray images of a lithium-ion battery from when it left the factory, hoping these may shed some light on why it appeared to overheat on a Boeing 787 Dreamliner jet earlier this week. ~In Boeing 787 battery probe, x-rays may offer clues to past incidents TOKYO/SEATTLE, Jan 16 Investigators in Japan are studying x-ray images of a lithium-ion battery from when it left the factory, hoping these may shed some light on why it appeared to overheat on a Boeing 787 Dreamliner jet earlier this week. ~
COF,UPDATE 2-Capital One profit misses as net interest income falls * Shares down about 3 pct after the bell   (Adds details, analyst comment) ~BRIEF-Capital One Financial shares down 2 pct after the bell NEW YORK, Jan 16 Capital One Financial Corp :  * Shares down 2 percent after the bell following results ~Capital One profit rises 2 percent Jan 16 Capital One Financial Corp, one of the largest credit card issuers in the United States, reported a 2 percent rise in quarterly profit as it set aside less provisions to cover credit losses. ~
SCHW.N,UPDATE 2-Discount broker Charles Schwab's profit beats estimates Jan 16 Discount broker Charles Schwab Corp  reported a higher-than-expected quarterly profit as it earned more from trading commissions and fees for managing client assets. ~
CMG,Suvretta cites big gains with J.C. Penney short, consumer stocks Jan 16 Suvretta Capital Management, founded by a former portfolio manager for billionaire investors George Soros and Steven A. Cohen, told clients on Thursday that its bet against shares of J.C. Penney Company Inc. helped contribute to solid returns in the last two years. ~
C,US STOCKS-Dow, S&P; 500 end down; bond trading bites bank profits * Dow down 0.4 pct, S&P; 500 off 0.1 pct, Nasdaq up 0.1 pct ~GLOBAL MARKETS-Stocks slip as banks weigh on Wall St; Treasuries gain on steady inflation NEW YORK, Jan 16 A measure of global equity markets edged lower on Thursday, weighed by a decline on Wall Street following a slew of disappointing bank earnings, while the dollar fell, although the dip was viewed as temporary. ~Fitch: Citi Reports Disappointing Fourth Quarter (The following statement was released by the rating agency) CHICAGO, January 16 (Fitch) Citigroup's (Citi) fourth quarter 2013 (4Q'13)  reported results declined 17% sequentially, driven mainly by weaker trading  results, elevated legal and related charges, and higher provision expenses. This  was partially offset by margin and spread income expansion, well-controlled core  expenses, and decent loan growth. Further, other credit risk fundamentals remain  strong with continuing improvements in li ~US STOCKS-Dow, S&P; 500 ease as bank earnings disappoint * Dow down 0.4 pct, S&P; 500 off 0.2 pct, Nasdaq up 0.03 pct ~Bond trading stings Goldman, Citi in fourth quarter Goldman Sachs Group Inc  and Citigroup Inc  were hit hard by a sharp fall in bond trading revenues in the fourth quarter, a stinging blow for two banks long seen as stalwarts of fixed income markets. ~WRAPUP 1-Bond trading stings Goldman, Citi in 4th quarter Jan 16 Goldman Sachs Group Inc and Citigroup Inc were hit hard by a sharp fall in bond trading revenues in the fourth quarter, a stinging blow for two banks long seen as stalwarts of fixed income markets. ~GLOBAL MARKETS-Stocks slip as Wall St weighed by banks; dollar down vs yen, euro NEW YORK, Jan 16 A measure of global equity markets edged lower on Thursday, weighed by a decline on Wall Street following a slew of corporate earnings, while the dollar fell against rival currencies although the dip was viewed as temporary. ~US STOCKS-S&P; 500 retreats from record; bank profits disappoint * Initial jobless claims dip; CPI up in December vs November ~BRIEF-Citigroup CFO expects economy to improve at slow pace * Citigroup CFO: mortgage revenues have "somewhat stabilized" ~
CMCSA.O,Exclusive: Charter, Comcast in renewed talks on Time Warner Cable bid NEW YORK Charter Communications Inc reached out to Comcast Corp this week about teaming up to buy Time Warner Cable Inc, after the larger rival rejected its $37.3 billion takeover bid, according to people familiar with the matter. ~
DOW,BRIEF-Downer EDI says offer for Spotless Group now closed * Confirms that its offer for Spotless was not extended and has now closed. Source text for Eikon: Further company coverage: ~BRIEF-Downer EDI posts FY net profit of $181.5 million * FY total revenue and other income from ordinary activities $7.29 billion , up 6.4 percent ~BRIEF-Downer EDI says ‍offer for Spotless Group extended to 28 August 2017​ * ‍Offer for Spotless Group extended to 7pm on Monday, 28 august 2017​ Source text for Eikon: Further company coverage: ~BRIEF-Downer EDI says Spotless ‍offer extended to Aug 21, 2017​ * Spotless ‍offer extended to 7pm on monday, 21 august 2017​ Source text for Eikon: Further company coverage: ~BRIEF-Downer EDI's takeover offer for Spotless Group extended till 7pm (Sydney time) on Aug. 14 * Unconditional takeover offer for Spotless Group extended until 7:00pm (Sydney time) on Monday, 14 August Source text for Eikon: Further company coverage: (bangalore.newsroom@thomsonreuters.com) ~BRIEF-Downer extends takeover offer for Spotless Group * decided to extend Spotless offer period for one week; offer will now remain open for acceptance until 14 august Source text for Eikon: Further company coverage: ~BRIEF-Downer extends Spotless offer to August 7 2017 * ‍Downer has decided to extend offer for Spotless Group holdings to 7 pm on Monday, 7 august 2017​ Source text for Eikon: Further company coverage: ~BRIEF-Downer EDI's stake in Spotless increases to 80.3 pct * Downer's stake in Spotless increases to 80.3 pct Source text for Eikon: Further company coverage: ~BRIEF- Downer EDI Ltd'S stake in Spotless Group increases to 72% * As Downer's shareholding in Spotless is now over 70%, Downer expects that Spotless will be removed from certain S&P;/ASX market indices ~
F,Ford recalling 46,000 Edge SUVs over fuel leak DETROIT, Jan 16 Ford Motor Co is recalling about 46,000 Edge SUVs from the 2012 and 2013 model years on a fuel system leak that could lead to a fire, the company and U.S. regulators said. ~Renault, VW lead European car sales rally as recovery spreads BERLIN Renault , Volkswagen  and Ford  spurred European car sales to their strongest performance in four years in December, industry data showed on Thursday, as the sector's recovery spread to Mediterranean markets. | Video  ~UPDATE 1-Renault, VW lead European car sales rally as recovery spreads * Renault, VW, Ford, GM, Toyota see double-digit rise   (Adds analyst quote, detail, incentive data) ~Renault, VW lead European car sales rally as recovery spreads BERLIN, Jan 16 Renault, Volkswagen  and Ford spurred monthly European car sales to their highest year-on-year gain in four years in December, industry data showed on Thursday, as the sector recovery spreads to Mediterranean markets. ~
GM,Gen Y likes tech-savvy green cars, but cost a barrier -study DETROIT, Jan 16 Young U.S. consumers want vehicles outfitted with expensive technology that boosts gas mileage and keeps them safe and connected, according to a survey published on Thursday. But the high cost of car ownership remains a stumbling block. ~Renault, VW lead European car sales rally as recovery spreads BERLIN, Jan 16 Renault, Volkswagen  and Ford spurred monthly European car sales to their highest year-on-year gain in four years in December, industry data showed on Thursday, as the sector recovery spreads to Mediterranean markets. ~Former GM CEO urges new leaders to avoid past mistakes DETROIT Dan Akerson, who retired as chief executive of General Motors Co , on Wednesday, urged his replacement and others at the No.1 U.S. automaker to avoid the decades of short-term thinking that led to its 2009 bankruptcy. ~UPDATE 1-Former GM CEO urges new leaders to avoid past mistakes DETROIT, Jan 15 Dan Akerson, who retired as chief executive of General Motors Co, on Wednesday, urged his replacement and others at the No.1 U.S. automaker to avoid the decades of short-term thinking that led to its 2009 bankruptcy. ~Retired GM chief says 'optimistic' about Opel brand DETROIT The retired chief executive of General Motors Co said on Wednesday he is "optimistic" about the largest U.S. automaker's struggling European brand, Opel. ~Retired GM chief says 'optimistic' about Opel brand DETROIT, Jan 15 The retired chief executive of General Motors Co said on Wednesday he is "optimistic" about the largest U.S. automaker's struggling European brand, Opel. ~Former GM CEO says must have competitive labor cost structure DETROIT, Jan 15 Dan Akerson, the retired chief executive of General Motors Co, said on Wednesday the largest U.S. automaker needed to have competitive labor costs. ~
GS,US STOCKS-Dow, S&P; 500 dip after bond trading bites bank profits * Dow down 0.4 pct, S&P; 500 off 0.1 pct, Nasdaq up 0.1 pct ~US STOCKS-Dow, S&P; 500 end down; bond trading bites bank profits * Dow down 0.4 pct, S&P; 500 off 0.1 pct, Nasdaq up 0.1 pct ~US STOCKS-Dow, S&P; 500 ease as bank earnings disappoint * Dow down 0.4 pct, S&P; 500 off 0.2 pct, Nasdaq up 0.03 pct ~Goldman's commodity trade 'too important' to quit: CFO Goldman Sachs Group Inc  reaffirmed its intent to remain in the commodities trading business, deeming it "too important" to clients to exit, a top executive said on Thursday. ~US STOCKS-S&P; 500 retreats from record; bank profits disappoint * Initial jobless claims dip; CPI up in December vs November ~Apollo Global to swallow Chuck E Cheese Apollo Global Management LLC  said it will buy CEC Entertainment Inc , the parent of Chuck E Cheese restaurant chain, for about $948 million, adding to a portfolio that includes companies ranging from cruise ship operators to casinos. ~UPDATE 3-Apollo Global to swallow Chuck E Cheese Jan 16 Apollo Global Management LLC said it will buy CEC Entertainment Inc, the parent of Chuck E Cheese restaurant chain, for about $948 million, adding to a portfolio that includes companies ranging from cruise ship operators to casinos. ~Goldman Sachs fourth-quarter profit hit by lower bond trading revenue Goldman Sachs Group Inc reported a 21 percent drop in quarterly profit on Thursday as revenue from fixed-income trading fell in what Chief Executive Lloyd C. Blankfein described as "a somewhat challenging environment." | Video  ~CORRECTED-UPDATE 3-Goldman Sachs profit hit by lower bond trading revenue (In 2nd and 12th paragraphs corrects the decline in bond trading revenue, and in 4th paragraph corrects percent comparison to Bank of America bond trading revenue) ~
INTC.O,UPDATE 3-Intel gives lukewarm revenue forecast, shares fall SAN FRANCISCO, Jan 16 Intel Corp's  earnings missed expectations by a penny in the fourth quarter due to weak spending on servers and the chipmaker gave a lukewarm forecast for first-quarter revenue that did little to dispel concerns about a slowing PC industry. ~US STOCKS-Dow, S&P; 500 end down; bond trading bites bank profits * Dow down 0.4 pct, S&P; 500 off 0.1 pct, Nasdaq up 0.1 pct ~BRIEF-Intel shares down 2.8 pct following results NEW YORK, Jan 16 Intel Corp :  * Shares down 2.8 percent following results ~Intel 4th-quarter revenue exceeds expectations SAN FRANCISCO, Jan 16 Intel Corp posted fourth-quarter net earnings of $2.6 billion, or 51 cents a share, compared with $2.5 billion, or 48 cents a share, in the year-ago quarter as the chipmaker grapples with a shrinking PC industry and finds support from demand for more servers. ~RPT-UPDATE 2-TSMC forecasts upbeat 2014 on mobiles and margins * Q1 slowdown seen ahead of new product launches by clients ~
JNJ,FDA advisory panel rejects J&J; drug for acute coronary syndrome Johnson & Johnson's anticoagulant Xarelto should not be approved to prevent further heart problems in patients who have recently suffered a heart attack, an advisory panel to the U.S. Food and Drug Administration concluded on Thursday. ~FDA advisory panel rejects J&J; drug for acute coronary syndrome Jan 16 Johnson & Johnson's anticoagulant Xarelto should not be approved to prevent further heart problems in patients who have recently suffered a heart attack, an advisory panel to the U.S. Food and Drug Administration concluded on Thursday. ~Deals of the day- Mergers and acquisitions (Adds Warsaw bourse, Ally Financial, RCS Capital, Apollo Global, Vattenfall, Loewe AG, Tyson Foods; Updates Johnson & Johnson, Bidvest Group, Tyson Foods) ~J&J; to sell slow-growing diagnostics unit to Carlyle Johnson & Johnson  said on Thursday it would sell its ortho clinical diagnostics unit to buyout firm Carlyle Group LP  for $4.15 billion, shedding a slow-growing business to focus on more lucrative products. ~UPDATE 3-J&J; to sell slow-growing diagnostics unit to Carlyle Jan 16 Johnson & Johnson said on Thursday it would sell its ortho clinical diagnostics unit to buyout firm Carlyle Group LP for $4.15 billion, shedding a slow-growing business to focus on more lucrative products. ~REFILE-Carlyle to buy J&J; diagnostic unit for $4.15 bln Jan 16 Private equity firm Carlyle Group  said it would buy Johnson & Johnson's diagnostics unit for $4.15 billion. ~
LMT,Pentagon cuts littoral combat ships buy to 32: Navy Times Jan 16 The office of the secretary of defense (OSD) has directed the U.S. Navy to cut its overall buy of the littoral combat ships to 32 ships, foregoing 20 more of the small, fast warships, the Navy Times reported, citing Pentagon sources. ~
MET,UPDATE 2-RCS Capital to buy broker-dealer Cetera for $1.15 billion Jan 16 RCS Capital Corp on Thursday announced it would buy independent broker-dealer Cetera Financial Group from private equity firm Lightyear Capital LLC for about $1.15 billion in cash to expand its retail brokerage business. ~
MSFT.O,UPDATE 2-Microsoft considers Ericsson CEO for top job - report SAN FRANCISCO/STOCKHOLM, Jan 15 Microsoft Corp  is considering Ericsson Chief Executive Hans Vestberg as a possible successor to outgoing CEO Steve Ballmer, Bloomberg reported, citing sources briefed on the software giant's executive search. ~Microsoft pondering Ericsson CEO for top job -Bloomberg SAN FRANCISCO, Jan 15 Microsoft Corp is considering Ericsson AB Chief Executive Hans Vestberg as a possible successor to outgoing CEO Steve Ballmer, Bloomberg cited sources briefed on the software giant's executive search as saying on Wednesday. ~
SWKS.O,Chipmaker Skyworks profit rises 44 pct Chipmaker Skyworks Solutions Inc's  quarterly profit rose 44 percent, helped by higher demand for analog chips used to connect machines and devices to the Internet. ~Chipmaker Skyworks profit rises 44 pct Jan 16 Chipmaker Skyworks Solutions Inc's  quarterly profit rose 44 percent, helped by higher demand for analog chips used to connect machines and devices to the Internet. ~BRIEF-Skyworks Solutions shares up 7.3 percent after the bell following results NEW YORK, Jan 16 Skyworks Solutions Inc :  * Shares were up 7.3 percent after the bell following results ~
TGT,UPDATE 2-U.S. govt warns merchants on methods used by Target hackers BOSTON, Jan 16 The U.S. government on Thursday provided merchants with information gleaned from its confidential investigation into the massive data breach at Target Corp, in a move aimed at identifying and thwarting similar attacks that may be ongoing. ~Citi to replace debit cards involved in Target data breach Citigroup will replace all customer debit cards involved in the data breach at Target Corp, the No.3 U.S. retailer, a spokeswoman for the bank said. ~UPDATE 1-Citi to replace debit cards involved in Target data breach Jan 16 Citigroup will replace all customer debit cards involved in the data breach at Target Corp, the No.3 U.S. retailer, a spokeswoman for the bank said. ~Citi to replace debit cards involved in Target data breach - NYT Jan 15 Citigroup will replace all customer debit cards involved in the data breach at Target Corp, the No.3 U.S. retailer, the New York Times reported quoting a person briefed on the bank's decision. ~
DIS,UPDATE 1-Sony, Warner Bros. lead studios in nominations for Oscar gold LOS ANGELES, Jan 16 Sony Pictures Entertainment  and Time Warner Inc's Warner Bros. led Hollywood studios competing for Academy Awards with 21 nominations each, grabbing publicity that could provide a box office bounce for their contending films, including "American Hustle" and "Gravity." ~Sony, Warner Bros. lead studios in nominations for Oscar gold LOS ANGELES Sony Pictures Entertainment and Time Warner Inc's Warner Bros. led Hollywood studios competing for Academy Awards with 21 nominations each, grabbing publicity that could provide a box office bounce for their contending films including "American Hustle" and "Gravity." ~Sony, Warner Bros. lead studios in nominations for Oscar gold LOS ANGELES, Jan 16 Sony Pictures Entertainment  and Time Warner Inc's Warner Bros. led Hollywood studios competing for Academy Awards with 21 nominations each, grabbing publicity that could provide a box office bounce for their contending films including "American Hustle" and "Gravity." ~
TMO,China approves Thermo Fisher, Life Tech deal with conditions BEIJING, Jan 16 China's Commerce Ministry said it had approved U.S.-listed laboratory equipment maker Thermo Fisher Scientific Inc's $13.6 billion takeover of Life Technologies Corp, subject to certain conditions. ~
TIF,UPDATE 2-Richemont's expanding retail business boosts sales * Company says wholesale retailers in Asia still cautious   (Adds comments by analysts, further details, share price) ~
TWX,UPDATE 1-Sony, Warner Bros. lead studios in nominations for Oscar gold LOS ANGELES, Jan 16 Sony Pictures Entertainment  and Time Warner Inc's Warner Bros. led Hollywood studios competing for Academy Awards with 21 nominations each, grabbing publicity that could provide a box office bounce for their contending films, including "American Hustle" and "Gravity." ~Sony, Warner Bros. lead studios in nominations for Oscar gold LOS ANGELES Sony Pictures Entertainment and Time Warner Inc's Warner Bros. led Hollywood studios competing for Academy Awards with 21 nominations each, grabbing publicity that could provide a box office bounce for their contending films including "American Hustle" and "Gravity." ~Sony, Warner Bros. lead studios in nominations for Oscar gold LOS ANGELES, Jan 16 Sony Pictures Entertainment  and Time Warner Inc's Warner Bros. led Hollywood studios competing for Academy Awards with 21 nominations each, grabbing publicity that could provide a box office bounce for their contending films including "American Hustle" and "Gravity." ~Time Warner to relocate New York headquarters Time Warner Inc will relocate its Manhattan corporate headquarters to the Hudson Yards development from Columbus Circle in a move to bring all its business units from HBO to CNN under one roof and save money. ~UPDATE 1-Time Warner to relocate New York headquarters Jan 16 Time Warner Inc will relocate its Manhattan corporate headquarters to the Hudson Yards development from Columbus Circle in a move to bring all its business units from HBO to CNN under one roof and save money. ~Time Warner to relocate New York headquarters to cut costs Jan 16 Time Warner Inc will relocate its Manhattan corporate headquarters to the Hudson Yards development from Columbus Circle in a move to bring operations under one roof and cut costs, the company said on Thursday. ~
TSN,Exclusive: Tyson weighs $2 billion-plus deal for Michael Foods - sources NEW YORK Tyson Foods Inc  is exploring a bid for Michael Foods Group Inc, a deal that would combine one of the world's largest chicken processors with a large distributor of egg and dairy products, according to three people familiar with the matter. ~
