GOOGL.O,Ireland likely to phase out "Double Irish" tax regime - sources * Dublin set to change tax residency rules in Oct. 14 budget ~
GOOG.O,Ireland likely to phase out "Double Irish" tax regime - sources * Dublin set to change tax residency rules in Oct. 14 budget ~
AAPL.O,UPDATE 1-GT to cut jobs, wind down sapphire plant; takes aim at Apple Oct 10 GT Advanced Technologies Inc  said it will cut 890 jobs, close an Arizona plant expected to make scratch-resistant screens for Apple Inc, and suggested it could pursue legal claims against the iPhone maker while revamping under bankruptcy. ~GT to cut jobs, wind down sapphire plant; takes aim at Apple Oct 10 GT Advanced Technologies Inc  said it will cut 890 jobs, close an Arizona plant expected to make scratch-resistant screens for Apple Inc, and suggested it could pursue legal claims against the iPhone maker while revamping under bankruptcy. ~Apple supplier GT to drop sapphire ops, asks bankruptcy plan remain secret MANCHESTER N.H. GT Advanced Technologies Inc  on Thursday revealed it intends to wind down sapphire production, cutting short its once-promising bid to supply the scratch-resistant material for Apple Inc's  iPhones and other mobile devices. ~UPDATE 7-Apple supplier GT to drop sapphire ops, asks bankruptcy plan remain secret MANCHESTER, N.H., Oct 9 GT Advanced Technologies Inc on Thursday revealed it intends to wind down sapphire production, cutting short its once-promising bid to supply the scratch-resistant material for Apple Inc's  iPhones and other mobile devices. ~Apple given time to block info in GT bankruptcy case: ruling Apple Inc  will have at least three days to review and potentially move to bar any information about its relationship with GT Advanced Technologies Inc  that may arise during the latter's bankruptcy hearings, the court said in a ruling on Thursday. ~Apple given time to block info in GT bankruptcy case -ruling Oct 9 Apple Inc will have at least three days to review and potentially move to bar any information about its relationship with GT Advanced Technologies Inc  that may arise during the latter's bankruptcy hearings, the court said in a ruling on Thursday. ~
BRKa.N,Berkshire-owned Dairy Queen says customer data hacked in 46 states Oct 10 Ice cream and fast-food restaurant chain Dairy Queen has confirmed a security breach that may have compromised the payment card information of customers at several hundred locations across 46 U.S. states. ~
CMCSA.O,Obama says unequivocally committed to 'net neutrality' SANTA MONICA Calif. President Barack Obama declared himself fully committed to "net neutrality" on Thursday while U.S. regulators review controversial new regulations that would govern how Internet service providers (ISPs) manage traffic on their networks. ~UPDATE 1-Obama says unequivocally committed to 'net neutrality' SANTA MONICA, Calif., Oct 9 President Barack Obama declared himself fully committed to "net neutrality" on Thursday while U.S. regulators review controversial new regulations that would govern how Internet service providers (ISPs) manage traffic on their networks. ~Obama says unequivocally committed to 'net neutrality' SANTA MONICA, Calif., Oct 9 President Barack Obama declared himself fully committed to "net neutrality" on Thursday while U.S. regulators review controversial new regulations that would govern how Internet service providers (ISPs) manage traffic on their networks. ~
COP,Conoco files for ICC arbitration against Venezuela's PDVSA HOUSTON, Oct 10 ConocoPhillips on Friday said it has filed for arbitration under the rules of the International Chamber of Commerce against Venezuela's state-run oil company PDVSA for compensation related to nationalized oil projects. ~
DRI,UPDATE 4-Darden activist ousts Olive Garden owner's full board ORLANDO/LOS ANGELES, Oct 10 Activist shareholder Starboard Value LP won its standoff with Darden Restaurants Inc , convincing shareholders to replace the entire board of the Olive Garden parent, a rare victory for dissident investors. ~Deals of the day- Mergers and acquisitions (Adds Darden Restaurants, Fidelity, Lanco Infratech, Twenty-First Century Fox, Reliance Industries, Unicredit and Tieto) ~Darden investors elect starboard's full slate of board nominees Oct 10 Darden Restaurants Inc investors elect Starboard's full slate of 12 board nominees. Darden had nominated eight directors, including four incumbents.   (Reporting by Lisa Baertlein in Los Angeles) ~Factbox: Darden, Starboard's dueling board nominees Shareholders in Darden Restaurants Inc  on Friday will decide whether to hand control of Darden's board to activist Starboard Value LP at the company's annual meeting on Friday in Orlando. ~Darden faces shareholder ire in proxy vote Oct 10 The showdown between Darden Restaurants Inc and activist investor Starboard Value LC will come to a boil at the company's annual meeting on Friday, where the Olive Garden parent is expected to at minimum lose control of its board. ~
DG,FTC asks Family Dollar for more information on Dollar General bid Oct 10 Dollar-store operator Family Dollar Inc  said it received a request for additional information from the Federal Trade Commission related to Dollar General Corp's hostile takeover attempt. ~
XOM,Exxon Mobil asks court to recognize payment from Venezuela HOUSTON Oil company Exxon Mobil  asked a U.S. District Court on Friday to recognize a World Bank arbitration ruling that Venezuela must pay $1.6 billion over a nationalization claim filed in 2007. ~Exxon Mobil asks U.S. court to recognize payment from Venezuela HOUSTON, Oct 10 Oil company Exxon Mobil  asked a U.S. District Court on Friday to recognize a World Bank arbitration ruling that Venezuela must pay $1.6 billion over a nationalization claim filed in 2007. ~Venezuela ordered to pay Exxon $1.6 billion for nationalization CARACAS A World Bank arbitration tribunal on Thursday ordered Venezuela to pay Exxon Mobil Corp about $1.6 billion to compensate for oil nationalization in 2007, though state oil company PDVSA expects to eventually pay closer to $1 billion. ~UPDATE 2-Venezuela says to pay less than $1 bln to Exxon over nationalization CARACAS, Oct 10 Venezuela will end up paying less than $1 billion to Exxon Mobil Corp for oil assets nationalized in 2007, after this week's World Bank tribunal award, the Venezuelan government said on Friday. ~Venezuela says to pay less than $1 bln to Exxon over nationalization CARACAS, Oct 10 Venezuela will end up having to pay less than $1 billion to  Exxon Mobil Corp for oil assets nationalized in 2007, after this week's World Bank tribunal award of $1.6 billion, Venezuela's Foreign Minister Rafael Ramirez said on Friday. ~UPDATE 3-Venezuela ordered to pay Exxon $1.6 bln for nationalization * Arbitration tribunal orders Venezuela pay $1.6 bln to Exxon ~
FIS,Fidelity doubles stake in World Duty Free to 10 pct - document MILAN, Oct 10 U.S. mutual fund Fidelity raised its stake in Italian travel retailer World Duty Free to 10 percent as of Oct. 8 from 5.177 percent previously, according to a document seen by Reuters on Friday. ~
F,Ford says new plants, models to boost China sales after September dip SHANGHAI Ford Motor Co  said on Friday it expects to boost sales in China once new assembly facilities come online and new vehicles hit showrooms in coming months, after posting its first dip in China monthly sales this year. ~UPDATE 1-Ford says new plants, models to boost China sales after Sept dip SHANGHAI, Oct 10 Ford Motor Co said on Friday it expects to boost sales in China once new assembly facilities come online and new vehicles hit showrooms in coming months, after posting its first dip in China monthly sales this year. ~Ford says Sept China auto sales dipped 0.2 pct y/y SHANGHAI, Oct 10 Ford Motor Co and its Chinese joint ventures sold 95,875 vehicles in China in September, edging down 0.2 percent from 96,111 vehicles in the same period a year earlier. ~
GE,GE unit in talks to buy Milestone Aviation - WSJ Oct 10 General Electric Co's finance arm is in talks to buy Milestone Aviation Group Ltd, as the U.S. conglomerate looks to expand its aircraft-leasing operation into helicopters, The Wall Street Journal reported, citing people familiar with the matter. ~Alstom seeks transport deals beyond GE signaling unit BERLIN (Story corrects Sept. 23 story in seventh paragraph that Siemens acquired Invensys Rail, not Invensys) ~CORRECTED-UPDATE 1-Alstom seeks transport deals beyond GE signaling unit (Corrects Sept. 23 story in seventh paragraph that Siemens acquired Invensys Rail, not Invensys) ~
GM,GM says Sept China auto sales up 15.2 pct y/y SHANGHAI, Oct 10 General Motors Co and its Chinese joint ventures sold 319,936 vehicles in China in September, up 15.2 percent from a year earlier, the U.S. automaker said on Friday. ~
GILD.O,UPDATE 2-U.S. FDA approves Gilead's $94,500 hepatitis C drug (Adds pharmacy benefit manager comment, analyst comment, background) ~U.S. FDA approves Gilead's all-oral hepatitis C drug Oct 10 U.S. regulators on Friday approved Gilead Sciences Inc's all-oral hepatitis C drug, clearing the way for the company to increase its revenue from sales of treatments for the liver-destroying viral infection. ~
HPQ,UPDATE 3-Symantec to split into two companies focused on security, storage Oct 9 Norton antivirus software maker Symantec Corp will split into two publicly traded companies, one focused on security and the other storage and backup, potentially making itself more attractive to suitors. ~
INTC.O,UPDATE 1-Wall St Week Ahead-Investors gird for scarier days in markets NEW YORK, Oct 10 Volatility has suddenly returned to U.S. stocks, and for the first time all year it doesn't appear that the weakness in equities will go away quietly in the span of a few days. ~
LMT,CORRECTED-UPDATE 1-U.S. Air Force probed for scrapping costly planes bought for Afghans (In story published Oct 9, corrects aircraft name in second paragraph to C-27A, from C-27J) ~CORRECTED-U.S. Air Force probed for scrapping costly planes bought for Afghans (In story published Oct 9, corrects aircraft name in second paragraph to C-27A, from C-27J.) ~
MSFT.O,REFILE-After gaffe, Microsoft board to look at gender pay gap, male culture SEATTLE/SAN FRANCISCO, Oct 10 A well-known picture in tech circles, taken in 1978, shows the first 11 employees at Microsoft. Two are women. One of them left two years later after a pay dispute. ~Microsoft CEO criticized for suggesting women not ask for raises SEATTLE Microsoft Corp's  chief executive officer suggested on Thursday that women in technology should not ask for raises but have faith in the "system", bringing a torrent of criticism and causing the executive to backtrack after the statement. ~UPDATE 1-Microsoft CEO criticized for suggesting women not ask for raises SEATTLE, Oct 9 Microsoft Corp's chief executive officer suggested on Thursday that women in technology should not ask for raises but have faith in the "system", bringing a torrent of criticism and causing the executive to backtrack after the statement. ~Microsoft CEO criticized for suggesting women not ask for raises SEATTLE, Oct 9 Microsoft Corp's chief executive officer suggested on Thursday that women in technology should not ask for raises but have faith in the system, bringing a torrent of criticism and causing the executive to backtrack after the statement. ~
PXD,Deals of the day- Mergers and acquisitions (Adds Darden Restaurants, Fidelity, Lanco Infratech, Twenty-First Century Fox, Reliance Industries, Unicredit and Tieto) ~Reliance seeks sale of Eagle Ford stake for up to $4.5 billion: sources NEW YORK India's Reliance Industries Ltd  is seeking a buyer for its stake in the Eagle Ford Basin oil and natural gas joint venture with Pioneer Natural Resources Co , a sale that could raise up to $4.5 billion, according to people familiar with the matter. ~
SYMC.O,Symantec to split into security and storage software companies Norton antivirus software maker Symantec Corp SYMC.O will split into two publicly traded companies, one focused on security and the other storage and backup, potentially making itself more attractive to suitors. ~UPDATE 3-Symantec to split into two companies focused on security, storage Oct 9 Norton antivirus software maker Symantec Corp will split into two publicly traded companies, one focused on security and the other storage and backup, potentially making itself more attractive to suitors. ~
DIS,'Guardians of the Galaxy' head to Disney XD TV in animated show LOS ANGELES, Oct 10 The misfit "Guardians of the Galaxy" superheroes are headed to television in a new animated series, Walt Disney Co's children's TV network said on Friday, after they saved the universe from destruction in the summer's biggest movie. ~Alexander takes family on 'Very Bad Day' in Disney comedy LOS ANGELES A rogue crocodile, a green baby, a puking Peter Pan and a punching kangaroo are troublesome yet comedic obstacles that befall the Cooper family on a "Terrible, Horrible, No Good, Very Bad Day" in Disney's new live-action family comedy. ~CEO Bewkes needs to show Time Warner better alone than with Murdoch NEW YORK Ten years ago, Walt Disney Co, having fended off a hostile bid from Comcast, had to make a case why it was better off as an independent company. ~Alexander takes family on 'Very Bad Day' in Disney comedy LOS ANGELES, Oct 10 A rogue crocodile, a green baby, a puking Peter Pan and a punching kangaroo are troublesome yet comedic obstacles that befall the Cooper family on a "Terrible, Horrible, No Good, Very Bad Day" in Disney's new live-action family comedy. ~
FOXA.O,Fox-Apollo JV to bring 'Big Brother', 'Masterchef' under one roof Rupert Murdoch's Twenty-First Century Fox and Apollo Global Management LLC agreed to combine three of their TV production companies behind hit shows such as "Big Brother", "American Idol" and "Masterchef" under one group. ~CORRECTED-Fox-Apollo JV to bring "Big Brother", "Masterchef" under one roof (Corrects paragraph 5 to say Core Media co-owns, not owns, "American Idol" and "So You Think You Can Dance") ~
FOX.O,Fox-Apollo JV to bring 'Big Brother', 'Masterchef' under one roof Rupert Murdoch's Twenty-First Century Fox and Apollo Global Management LLC agreed to combine three of their TV production companies behind hit shows such as "Big Brother", "American Idol" and "Masterchef" under one group. ~CORRECTED-Fox-Apollo JV to bring "Big Brother", "Masterchef" under one roof (Corrects paragraph 5 to say Core Media co-owns, not owns, "American Idol" and "So You Think You Can Dance") ~
WFC,MOVES-Wells Fargo appoints four senior credit officers Oct 10 Financial services company Wells Fargo & Co announced the appointment of four commercial banking leaders as part its attempts to improve the credit experience for its customers. ~
