AIG,UPDATE 2-Ex-AIG CEO loses appeal of bailout lawsuit vs N.Y. Fed NEW YORK, Jan 29 Former American International Group Inc Chief Executive Maurice "Hank" Greenberg lost his appeal Wednesday in a lawsuit accusing the Federal Reserve Bank of New York of unlawfully bailing out the insurer at the height of the 2008 financial crisis. ~Ex-AIG CEO loses appeal of bailout lawsuit vs N.Y. Fed NEW YORK A federal appeals court upheld the dismissal of a lawsuit by former American International Group Inc  Chief Executive Maurice "Hank" Greenberg accusing the Federal Reserve Bank of New York of unlawfully bailing out the insurer at the height of the 2008 financial crisis. ~Ex-AIG CEO loses appeal of bailout lawsuit vs N.Y. Fed NEW YORK, Jan 29 A federal appeals court has upheld the dismissal of former American International Group Inc  Chief Executive Maurice "Hank" Greenberg's lawsuit accusing the Federal Reserve Bank of New York of unlawfully bailing out the insurer at the height of the 2008 financial crisis. ~BRIEF-US appeals court rules against Greenberg's Starr Int'l over AIG bailout Jan 29 American International Group Inc :  * U.S. appeals court upholds dismissal of starr international lawsuit against ~
AAPL.O,UPDATE 3-Lenovo to buy Google's Motorola in China's largest tech deal   ~UPDATE 2-Qualcomm posts higher 1st-quarter revenue, says year on track SAN FRANCISCO, Jan 29 Leading mobile chipmaker Qualcomm Inc posted higher fiscal first-quarter revenue that slightly missed expectations  as smartphone growth shifted to China but it bumped up its full-year earnings outlook on the strong start to 2014. ~Obama urges Congress to pass anti-patent troll bill WASHINGTON President Barack Obama called for Congress to pass legislation aimed at reining in what many companies complain are proliferating and frivolous patent infringement lawsuits. ~Obama urges Congress to pass anti-patent troll bill WASHINGTON, Jan 28 President Barack Obama called for Congress to pass legislation aimed at reining in what many companies complain are proliferating and frivolous patent infringement lawsuits. ~
BIIB.O,UPDATE 3-Biogen profit rises as new multiple sclerosis drug shines Jan 29 Biogen Idec Inc said on Wednesday its new, high-profile oral multiple sclerosis drug Tecfidera had sales of $398 million in the fourth quarter, easily exceeding estimates for a third successive quarter and keeping it on track to top $1 billion in its first year on the market. ~CORRECTED-UPDATE 2-Biogen profit rises as new multiple sclerosis drug shines (Corrects to shares fell, rather than rose, in last paragraph) ~MARKET PULSE-Boeing, Dow, Tupperware, EMC, Biogen, Praxair, Rockwell (For more market insights, including options activity, click on  ; for the Day Ahead newsletter http://link.reuters.com/mex49s) ~Biogen Idec profit rises as new multiple sclerosis drug shines Jan 29 Biogen Idec Inc on Wednesday said fourth-quarter profit soared 57 percent, helped by strong sales of its new multiple sclerosis drug, Tecfidera. ~
BA,US STOCKS-Wall St falls after Fed sticks with taper plan * Dow down 1.2 pct; S&P; 500 down 1 pct; Nasdaq off 1.1 pct ~Boeing shares dip on cautious outlook despite fourth-quarter profit rise NEW YORK Conservative profit and cash-flow forecasts spooked Boeing Co  investors on Wednesday, sending the stock down 5 percent and overshadowing the company's strong fourth-quarter profit. | Video  ~Boeing shares dip on cautious outlook despite fourth-quarter profit rise NEW YORK Conservative profit and cash-flow forecasts spooked Boeing Co  investors on Wednesday, sending the stock down 5 percent and overshadowing the company's strong fourth-quarter profit. ~UPDATE 4-Boeing shares dip on cautious outlook despite 4th-qtr profit rise NEW YORK, Jan 29 Conservative profit and cash-flow forecasts spooked Boeing Co investors on Wednesday, sending the stock down 5 percent and overshadowing the company's strong fourth-quarter profit. ~US STOCKS-Wall St extends slide after Fed sticks with taper plan * Dow down 1.2 pct; S&P; 500 down 1 pct; Nasdaq off 1.1 pct ~US STOCKS-Wall St falls in volatile trading after Fed decision NEW YORK, Jan 29 U.S. stocks were down as much as 1 percent in volatile trading on Wednesday following the Federal Reserve's decision to further reduce its monthly bond purchases. ~Despite weak forecast, Boeing to top target on cash to shareholders NEW YORK Boeing Co  expects to return cash to shareholders in excess of its target this year, despite its forecast for 2014 cash generation that was below analysts' expectations. ~US STOCKS-Wall St slides on emerging market jitters; Fed in focus * Fed set for $10 billion taper; announcement 2:00 p.m. EST ~US STOCKS-Wall St down on jitters ahead of Fed decision * Fed set for $10 billion taper; announcement 2:00 p.m. EST ~
CSCO.O,Obama urges Congress to pass anti-patent troll bill WASHINGTON, Jan 28 President Barack Obama called for Congress to pass legislation aimed at reining in what many companies complain are proliferating and frivolous patent infringement lawsuits. ~
C,Deals of the day- Mergers and acquisitions (Adds Banco de Chile, Standard Bank, Royal Bank of Canada, Itau Unibanco) ~
CTXS.O,UPDATE 1-Citrix's profit forecast misses on "uneven" contract closures Jan 29 Cloud-computing software maker Citrix Systems Inc forecast current-quarter and 2014 earnings far below analysts' estimates, citing "uneven" closure of some contracts, and said its long-time CEO would retire next year. ~Citrix revenue misses as cloud-computing software sales stall Jan 29 Citrix Systems Inc reported lower-than-expected quarterly revenue as sales of its cloud-computing software and licenses grew by less than 1 percent. ~
CMCSA.O,As Olympics loom, NBC leads in the race for prized viewers Jan 28 Comcast Corp's NBC network, for years a ratings laggard, is ahead in a key contest among broadcasters even before it attracts millions of viewers this month to its marquee event, the Winter Olympics. ~
COST.O,Analysis: Obama's nod to trade leaves tough work ahead in Congress WASHINGTON U.S. President Barack Obama's nod to trade in his annual State of the Union address reflects a delicate political dance and leaves the hard work still ahead in convincing a skeptical Congress to get behind free trade deals. ~DIARY-U.S. MEETINGS/WEEK AHEAD THOMSON REUTERS, Jan 29,2014 - Corporate Meetings for US companies for Week ahead.         S&P; 500 Earnings - Weekly           S&P; 500 Earnings - Day Ahead        Non S&P; 500 - Weekly               Non S&P; 500 - Day Ahead             ConferenceCall/Webcast - Weekly    ConferenceCall/Webcast - Day        S&P; 500 Earnings - Monthly           Meetings - Day Ahead                Economic Indicators                  Dividends                           Daily earnings hits & misses         Federal Rese ~
DISCA.O,REFILE-Larger than life Oprah celebrating 60th birthday quietly at home LOS ANGELES, Jan 28 Fifty came with a televised bash, celebrity friends and a black-tie dinner, but Oprah Winfrey will have a low-key 60th birthday  at home in California on Wednesday. ~
DISCK.O,REFILE-Larger than life Oprah celebrating 60th birthday quietly at home LOS ANGELES, Jan 28 Fifty came with a televised bash, celebrity friends and a black-tie dinner, but Oprah Winfrey will have a low-key 60th birthday  at home in California on Wednesday. ~
DOW,BRIEF-Downer EDI says offer for Spotless Group now closed * Confirms that its offer for Spotless was not extended and has now closed. Source text for Eikon: Further company coverage: ~BRIEF-Downer EDI posts FY net profit of $181.5 million * FY total revenue and other income from ordinary activities $7.29 billion , up 6.4 percent ~BRIEF-Downer EDI says ‍offer for Spotless Group extended to 28 August 2017​ * ‍Offer for Spotless Group extended to 7pm on Monday, 28 august 2017​ Source text for Eikon: Further company coverage: ~BRIEF-Downer EDI says Spotless ‍offer extended to Aug 21, 2017​ * Spotless ‍offer extended to 7pm on monday, 21 august 2017​ Source text for Eikon: Further company coverage: ~BRIEF-Downer EDI's takeover offer for Spotless Group extended till 7pm (Sydney time) on Aug. 14 * Unconditional takeover offer for Spotless Group extended until 7:00pm (Sydney time) on Monday, 14 August Source text for Eikon: Further company coverage: (bangalore.newsroom@thomsonreuters.com) ~BRIEF-Downer extends takeover offer for Spotless Group * decided to extend Spotless offer period for one week; offer will now remain open for acceptance until 14 august Source text for Eikon: Further company coverage: ~BRIEF-Downer extends Spotless offer to August 7 2017 * ‍Downer has decided to extend offer for Spotless Group holdings to 7 pm on Monday, 7 august 2017​ Source text for Eikon: Further company coverage: ~BRIEF-Downer EDI's stake in Spotless increases to 80.3 pct * Downer's stake in Spotless increases to 80.3 pct Source text for Eikon: Further company coverage: ~BRIEF- Downer EDI Ltd'S stake in Spotless Group increases to 72% * As Downer's shareholding in Spotless is now over 70%, Downer expects that Spotless will be removed from certain S&P;/ASX market indices ~
FB.O,BRIEF-Facebook CFO says expects GAAP expenses in 2014 to increase between 35 percent and 40 percent Jan 29 Facebook Inc :  * CFO says expects GAAP expenses in 2014 to increase between 35 percent and 40 ~US STOCKS-Wall St sells off after Fed sticks with stimulus cuts * Boeing, Yahoo shares fall after results; Facebook up late ~UPDATE 2-Mobile ad revenue lifts Facebook past Wall Street targets * Shares up 10 pct in extended trading   (Adds comments by chief operating officer, updates after-hours stock price) ~Facebook 4th-quarter revenue rises 63 percent SAN FRANCISCO, Jan 29 Facebook Inc's  revenue increased 63 percent in the fourth quarter, as advertising on its mobile services continued to accelerate. ~Facebook teams up with Fox on Super Bowl SAN FRANCISCO Facebook Inc is collaborating with Fox Sports for Sunday's Super Bowl broadcast, the social network's latest move to increase its role as a hub for real-time conversations around sports and news events. ~Facebook teams up with Fox on Super Bowl SAN FRANCISCO, Jan 29 Facebook Inc is collaborating with Fox Sports for Sunday's Super Bowl broadcast, the social network's latest move to increase its role as a hub for real-time conversations around sports and news events. ~
F,Ford to recall Edge SUVs in China on possible fuel leak SHANGHAI, Jan 29 Ford Motor Co will recall 13,493 imported Edge SUVs in China on a possible fuel system leak that could lead to a fire, China's quality watchdog said. ~Ford posts higher profit but faces pressure in U.S. DEARBORN, Michigan Ford Motor Co  reported higher-than-expected quarterly results on Tuesday as earnings in its core North American market fell less steeply than Wall Street expected, but declining vehicle prices there raised concerns about 2014. | Video  ~Ford concerned Argentina, Venezuela may bite into 2014 profit DEARBORN, Michigan Ford Motor Co  on Tuesday joined a growing number of multinational companies expressing concern that economic turmoil in Venezuela and Argentina could spell trouble for 2014 profits. ~Ford concerned Argentina, Venezuela may bite into 2014 profit DEARBORN, Mich., Jan 28 Ford Motor Co on Tuesday joined a growing number of multinational companies expressing concern that economic turmoil in Venezuela and Argentina could spell trouble for 2014 profits. ~
GD,UPDATE 1-A-12 settlement won't extend Boeing's F/A-18 production line * New Pentagon report says F/A-18 not effective for certain threats ~
HES,UPDATE 2-Hess profit misses expectations as production sags Jan 29 Unrest in Libya and maintenance in the U.S. Gulf of Mexico weighed on Hess Corp's output and profit in the fourth quarter, and the oil and natural gas producer reported lower-than-expected results on Wednesday. ~Hess profit spikes after asset sales, but production lags Jan 29 Oil and natural gas producer Hess Corp  posted a jump in quarterly profit on Wednesday due in part to one-time gains from the sale of energy terminals and other assets, but production fell. ~
MPC,WRAPUP-Cheaper crude on Gulf Coast helps U.S. refiners' profits HOUSTON, Jan 29 Marathon Petroleum Corp, Valero Energy Corp and Phillips 66, the three largest U.S. independent refiners, reported quarterly results on Wednesday that topped Wall Street estimates as cheaper crude prices on the Gulf Coast helped profits. ~Marathon confirms small diesel spill into Mississippi river Marathon Petroleum Corp confirmed that two barrels of diesel spilled into the Mississippi river on Tuesday from its 490,000-barrel-per-day (bpd) Garyville, Louisiana, refinery. ~Marathon Petroleum Q4 profit lower, but tops Street Marathon Petroleum Corp , the third-largest stand-alone U.S. refining company, on Wednesday posted a quarterly profit that topped estimates as refining margins were better than expected. ~UPDATE 1-Marathon Petroleum Q4 profit lower, but tops Street Jan 29 Marathon Petroleum Corp, the third-largest stand-alone U.S. refining company, on Wednesday posted a quarterly profit that topped estimates as refining margins were better than expected. ~Marathon Petroleum profit drops 17 percent amid rising costs Jan 29 Marathon Petroleum Corp, the third-largest stand-alone U.S. refining company, posted a 17 percent drop in quarterly profit on Wednesday due to shrinking crude discounts and rising maintenance costs. ~
MSFT.O,Ericsson CEO Vestberg tells board he plans to stay -Bloomberg STOCKHOLM, Jan 29 Ericsson CEO Hans Vestberg has told directors he has no plans to step down from the company following a report he is among candidates to take over from Microsoft Corp's Steve Ballmer, Bloomberg reported on Wednesday. ~Nintendo looks to power-up Mario after not-so-super Wii U TOKYO Nintendo Co Ltd, facing a third year of losses, is getting lots of unsolicited advice on how to squeeze more out of its Mario franchise and revive its fortunes after admitting that its Wii U game console has been a flop. ~RPT-UPDATE 1-Nintendo looks to power-up Mario after not-so-super Wii U * Nintendo warned of third year of operating losses after poor Wii U sales ~RPT-Nintendo looks to power-up Mario after not-so-super Wii U (Repeats item first issued late on Tuesday, adds link to graphic) ~
MON,UPDATE 1-GMO critics protest at Monsanto meeting; resolutions fail Jan 28 Critics of genetically modified crops protested at Monsanto Co's annual shareholders meeting on Tuesday, calling for the world's largest seed company to provide a report on contamination in non-GMO crops and to stop fighting mandatory labels on foods containing GMO ingredients. ~
MS,MOVES- Morgan Stanley, PIMCO, Sberbank CIB Jan 29 The following financial services industry appointments were announced on Wednesday. To inform us of other job changes, email to moves@thomsonreuters.com. ~
MSI,UPDATE 2-Flextronics forecasts strong revenue; cost cuts planned * Does not see near-term impact from Lenovo's deal for Motorola Mobility ~Lenovo to buy Google's Motorola in China's largest tech deal NEW YORK/SAN FRANCISCO Lenovo Group said on Wednesday it agreed to buy Google Inc's Motorola handset division for $2.91 billion, in what is China's largest-ever tech deal as Lenovo buys its way into a heavily competitive U.S. handset market dominated by Apple Inc. ~UPDATE 3-Lenovo to buy Google's Motorola in China's largest tech deal   ~
PSX,Phillips 66 4th-quarter profit higher U.S. refining company Phillips 66  said on Wednesday its fourth-quarter profit rose, helped by stronger results in its transportation and processing and chemicals businesses. ~Phillips 66 4th-quarter profit higher Jan 29 U.S. refining company Phillips 66  said on Wednesday its fourth-quarter profit rose, helped by stronger results in its transportation and processing and chemicals businesses. ~
PX,Praxair raises dividend, to buy back $1.5 bln in stock Jan 29 Praxair Inc, the largest industrial gas supplier in the Americas, raised its dividend by 8 percent and said it would buy back stock worth $1.5 billion, after reporting a 15 percent rise in quarterly profit. ~
QCOM.O,UPDATE 2-Qualcomm posts higher 1st-quarter revenue, says year on track SAN FRANCISCO, Jan 29 Leading mobile chipmaker Qualcomm Inc posted higher fiscal first-quarter revenue that slightly missed expectations  as smartphone growth shifted to China but it bumped up its full-year earnings outlook on the strong start to 2014. ~Qualcomm posts higher 1st-quarter revenue, short of Street SAN FRANCISCO, Jan 29 Leading mobile chipmaker Qualcomm Inc posted higher fiscal first-quarter revenue that slightly missed expectations as smartphone growth shifted from developed economies to China. ~Qualcomm faces prospect of record antitrust fines in China BEIJING Qualcomm Inc, the world's biggest cellphone chip maker, may be hit with a record fine exceeding $1 billion in a Chinese antitrust probe, raising the specter of harsh penalties for foreign firms facing an increasingly aggressive regulator. ~Qualcomm faces prospect of record antitrust fines in China BEIJING, Jan 29 Qualcomm Inc, the world's biggest cellphone chip maker, may be hit with a record fine exceeding $1 billion in a Chinese antitrust probe, raising the spectre of harsh penalties for foreign firms facing an increasingly aggressive regulator. ~
ROK,UPDATE 2-Rockwell Auto results boosted by improving Asia, Europe Jan 29 Rockwell Automation Inc lifted the lower end of its 2014 forecast as sales in Asia Pacific rose for the first time in six quarters and spending in Europe picked up. ~Rockwell Auto lifts low end of forecast as Europe, Asia improve Industrial automation company Rockwell Automation Inc  lifted the lower end of its 2014 forecast after reporting a 23 percent jump in first-quarter profit due to sales increases in Europe, Asia Pacific and the United States. ~MARKET PULSE-Boeing, Dow, Tupperware, EMC, Biogen, Praxair, Rockwell (For more market insights, including options activity, click on  ; for the Day Ahead newsletter http://link.reuters.com/mex49s) ~Rockwell Automation profit up 23 pct on strong U.S., Asia sales Jan 29 Rockwell Automation Inc, which makes systems that help factories run smoothly, posted a 23 percent rise in quarterly profit, partly due to sales increases in the United States and Asia Pacific. ~
SEE,WR Grace's bankruptcy exit financing deal gets court approval Jan 29 Chemical maker W.R. Grace & Co  received approval to line up about $1.55 billion in bankruptcy exit financing, a court filing showed on Tuesday. ~
SO,UPDATE 1-Southern Co working to finalize $8 bln nuclear loan guarantee HOUSTON, Jan 29 Southern Co Chairman Tom Fanning said on Wednesday that the company is working with the U.S. Energy Department to finalize an $8.3 billion loan guarantee for its two-reactor expansion at the Vogtle nuclear plant in Georgia, the first new reactors to be built in three decades. ~Southern Co files documents to complete DOE nuclear loan guarantee HOUSTON, Jan 29 Southern Co Chairman Tom Fanning said on Wednesday that the company has delivered documents to the U.S. Energy Department to complete the $8.3 billion loan guarantee for its two-reactor expansion at the Vogtle nuclear plant in Georgia. ~Southern Co says Kemper coal plant costs still climbing HOUSTON, Jan 28 Southern Co will take a $25 million charge in the 2013 fourth quarter as the cost for its coal-gasification power plant in Kemper County, Mississippi, climbs to more than $5 billion, the company said in a filing with regulators on Tuesday. ~
SBUX.O,Starbucks promotes CFO to new post in e-commerce push LOS ANGELES, Jan 29 Starbucks Corp  Chief Executive Howard Schultz on Wednesday said he was promoting Chief Financial Officer Troy Alstead to the new position of chief operating officer, allowing Schultz to focus on expanding the coffee shop chain's e-commerce business. ~
SYMC.O,Symantec's quarterly revenue falls 5 percent Jan 29 Symantec Corp, the maker of Norton anti-virus software, reported a 5 percent fall in quarterly revenue, hurt by lower demand for its security and storage products as consumers switch to tablets from PCs. ~
TGT,Target officials to brief House Oversight panel -source WASHINGTON, Jan 29 Officials from Target Corp  will participate in a telephone briefing on Thursday with members of a powerful House of Representatives committee, a source familiar with the issue told Reuters. ~Target to expand further in Canada with nine new stores in 2014 TORONTO, Jan 29 Target Corp will add more stores in Canada this year, the retailer said on Wednesday, even thought its 2013 entry into the country proved costlier than expected and forced it to cut its full-year profit forecast. ~
VLO,WRAPUP-Cheaper crude on Gulf Coast helps U.S. refiners' profits HOUSTON, Jan 29 Marathon Petroleum Corp, Valero Energy Corp and Phillips 66, the three largest U.S. independent refiners, reported quarterly results on Wednesday that topped Wall Street estimates as cheaper crude prices on the Gulf Coast helped profits. ~UPDATE 1-Valero Energy's quarterly profit climbs, CST sale helps Jan 29 Valero Energy Corp on Wednesday said its fourth-quarter  profit rose, topping estimates, as the largest independent U.S. refiner processed more crude and sold its interest in its retail business, CST Brands Inc. ~Valero Energy's quarterly profit climbs, CST sale helps Jan 29 Valero Energy Corp on Wednesday said its fourth-quarter  profit rose as the largest independent U.S. refiner processed more crude and sold its interest in its retail business, CST Brands Inc. ~
V,BRIEF-Visa calls for redemption all of its 1.200 pct notes due 2017 * Visa Inc - on Sept 11, co called for redemption all of $1.75 billion principal amount outstanding of its 1.200 pct notes due 2017‍​ - SEC filing ~BRIEF-Visa Inc files for three-part senior notes offering of up to $2.5 bln * Visa Inc says files for three-part senior notes offering of up to $2.5 billion - SEC filing‍​ ~Former BoE deputy Hogg to join Visa as Europe unit CEO Visa Inc, the world's largest payments processor, on Thursday named former Bank of England (BoE) deputy governor Charlotte Hogg as chief executive of its Europe division. ~CORRECTED-UPDATE 1-MOVES-Former BoE deputy Hogg to join Visa as Europe unit CEO Sept 7 Visa Inc, the world's largest payments processor, on Thursday named former Bank of England (BoE) deputy governor Charlotte Hogg as chief executive of its Europe division. ~MOVES-Visa names ex-BoE deputy Charlotte Hogg as Europe unit CEO Sept 7 Visa Inc, the world's largest payments processor, on Thursday named Charlotte Hogg as chief executive of its Europe division. ~BRIEF-Visa appoints Charlotte Hogg as CEO of European operations * Visa Inc appoints Charlotte Hogg as chief executive officer of the compan's European operations ~BRIEF-Visa Inc files prospectus supplement for potential three-part senior notes offering * Visa Inc files prospectus supplement for potential three-part senior notes offering; size not disclosed - sec filing‍​ Source text (http://bit.ly/2vLDrIe) Further company coverage: ~BRIEF-Visa enables on the go payments with the new Fitbit Ionic * Visa inc- ‍enabling visa payments on fitbit's smartwatch fitbit ionic​ ~BRIEF-Bridg raises $11 million in Series B funding * Bridg raises $11 million in Series B funding from Morpheus Ventures, March Capital, Visa and NextEquity ~
WMT,Wal-Mart to upgrade China vendor compliance after state TV criticism HONG KONG, Jan 29 U.S. retailer Wal-Mart Stores Inc said on Wednesday it will upgrade its vendor compliance process in China, requiring more documentation and making use of a computer-based system to help suppliers manage associated paperwork. ~'Boss Hog' of 'Duck Dynasty' TV show to attend big Obama speech LOS ANGELES "Duck Dynasty" reality television star Willie "Boss Hog" Robertson is on the invitation list to attend President Barack Obama's State of the Union speech Tuesday night, compliments of a congressman from his home state of Louisiana. ~
