GOOGL.O,UPDATE 2-Patent consortium Rockstar loses bid to move Google case SAN FRANCISCO, April 17 A U.S. judge on Thursday rejected a request by patent consortium Rockstar to transfer patent litigation from Google Inc's home turf in California to Texas, according to a court ruling. ~UPDATE 1-Patent consortium Rockstar loses bid to move Google case SAN FRANCISCO, April 17 A U.S. judge on Thursday rejected a request by patent consortium Rockstar to transfer patent litigation from Google Inc's home turf in California to Texas, according to a court ruling. ~Patent lawsuit against Google to be fought in California -ruling SAN FRANCISCO, April 17 A federal judge in California on Thursday rejected a request by patent consortium Rockstar to transfer patent litigation against Google Inc  to Texas, according to a court ruling. ~Earnings lift S&P; 500, Nasdaq; S&P;'s best week since July NEW YORK Stocks ended a holiday-shortened week with mostly modest gains on Thursday, though the S&P; 500 notched its biggest weekly advance since July as Morgan Stanley and General Electric rallied after strong results. | Video  ~US STOCKS-Earnings lift S&P; 500, Nasdaq; S&P;'s best week since July * S&P; 500 scores biggest weekly percentage gain since July ~US STOCKS-Wall St edges higher during earnings flurry * Jobless claims rise less than expected; Philly Fed jumps ~REFILE-US STOCKS-Wall St little changed amid earnings flurry (Replaces extraneous word "market" for "most" in quote in 6th paragraph ) ~Google still a top pick for Wall Street, despite mobile ad challenges Google Inc's disappointing first-quarter results left Wall Street unfazed about the internet giant's ability to come to grips with the shift to the fast-growing mobile advertising market. ~Fidelity biotech fund among worst performers in April sell-off BOSTON One of the biotechnology sector's worst two-week declines in the past decade has clobbered one of Fidelity Investments' hottest funds. ~
GOOG.O,UPDATE 2-Patent consortium Rockstar loses bid to move Google case SAN FRANCISCO, April 17 A U.S. judge on Thursday rejected a request by patent consortium Rockstar to transfer patent litigation from Google Inc's home turf in California to Texas, according to a court ruling. ~UPDATE 1-Patent consortium Rockstar loses bid to move Google case SAN FRANCISCO, April 17 A U.S. judge on Thursday rejected a request by patent consortium Rockstar to transfer patent litigation from Google Inc's home turf in California to Texas, according to a court ruling. ~Patent lawsuit against Google to be fought in California -ruling SAN FRANCISCO, April 17 A federal judge in California on Thursday rejected a request by patent consortium Rockstar to transfer patent litigation against Google Inc  to Texas, according to a court ruling. ~Earnings lift S&P; 500, Nasdaq; S&P;'s best week since July NEW YORK Stocks ended a holiday-shortened week with mostly modest gains on Thursday, though the S&P; 500 notched its biggest weekly advance since July as Morgan Stanley and General Electric rallied after strong results. | Video  ~US STOCKS-Earnings lift S&P; 500, Nasdaq; S&P;'s best week since July * S&P; 500 scores biggest weekly percentage gain since July ~US STOCKS-Wall St edges higher during earnings flurry * Jobless claims rise less than expected; Philly Fed jumps ~REFILE-US STOCKS-Wall St little changed amid earnings flurry (Replaces extraneous word "market" for "most" in quote in 6th paragraph ) ~Google still a top pick for Wall Street, despite mobile ad challenges Google Inc's disappointing first-quarter results left Wall Street unfazed about the internet giant's ability to come to grips with the shift to the fast-growing mobile advertising market. ~Fidelity biotech fund among worst performers in April sell-off BOSTON One of the biotechnology sector's worst two-week declines in the past decade has clobbered one of Fidelity Investments' hottest funds. ~
AMZN.O,UPDATE 1-Online retailers in Germany under fire over working conditions * Zalando denies allegations, sues journalist   (Recasts, adds union comment, details on Zalando) ~German Amazon workers called out on strike again FRANKFURT, April 17 German labour union Verdi has called on workers at online retailer Amazon in Germany to go on strike on Thursday as a long-running pay dispute continues. ~
APA,Apache CEO, Vermont activist build alliance on climate issues NEW YORK, April 17 Steve Farris runs a $33 billion Texas oil and gas company and turns, for advice, to a bearded Vermont environmentalist. ~
AAPL.O,Wall Street Week Ahead: Spring fever brings hope for U.S. earnings NEW YORK Earnings season shifts into high gear next week, and with nearly one-third of S&P; 500 names set to post results, investors hope the news provides a catalyst to buy stocks and leave the market's recent weakness in the dust. ~Wall St Week Ahead-Spring fever brings hope for U.S. earnings NEW YORK, April 17 Earnings season shifts into high gear next week, and with nearly one-third of S&P; 500 names set to post results, investors hope the news provides a catalyst to buy stocks and leave the market's recent weakness in the dust. ~UPDATE 1-Patent consortium Rockstar loses bid to move Google case SAN FRANCISCO, April 17 A U.S. judge on Thursday rejected a request by patent consortium Rockstar to transfer patent litigation from Google Inc's home turf in California to Texas, according to a court ruling. ~
ADM,Confectioners sweet on ADM's decision to keep cocoa business NEW YORK Easter came early for the global chocolate makers this year. ~
T,UPDATE 1-U.S. regulator reasserts goal to restrict AT&T;, Verizon in auction (Adds further details of Wheeler's letter, proposed rules and AT&T; opposition) ~U.S. regulator reasserts goal to restrict AT&T;, Verizon in auction WASHINGTON, April 17 The top U.S. telecommunications regulator in a letter to a lawmaker on Thursday reasserted his commitment to help smaller national wireless carriers get access to valuable lower-frequency airwaves in the upcoming spectrum auction. ~
AN,UPDATE 1-AutoNation posts higher profit despite severe winter weather (Adds executives' comments, details of results, background on auto sector, byline) ~AutoNation posts higher profit despite severe winter weather DETROIT AutoNation Inc , the largest U.S. automobile dealer group, on Thursday posted a higher first-quarter profit despite the severe winter weather that slowed sales. ~AutoNation posts higher profit despite severe winter weather DETROIT, April 17 AutoNation Inc, the largest U.S. automobile dealer group, on Thursday posted a higher first-quarter profit despite the severe winter weather that slowed sales. ~
BLK,UPDATE 4-BlackRock's quarterly profit climbs as investors pile into funds NEW YORK, April 17 BlackRock Inc, the world's largest money manager, said on Thursday first-quarter profit rose 20 percent, boosted by strong performance fees and strength in its retail business as investors poured money into long-term funds. ~BlackRock's first-quarter profit rises sharply NEW YORK, April 17 BlackRock Inc, the world's largest money manager, said on Thursday its first-quarter profit rose sharply, boosted by strength in its retail business and positive flows across asset classes. ~
COF,Capital One defeats patent lawsuit brought by Intellectual Ventures Capital One Financial Corp defeated a lawsuit on Wednesday brought by large patent owner Intellectual Ventures, after a U.S. judge invalidated two of IV's patents, according to the court opinion. ~UPDATE 1-Capital One defeats patent lawsuit brought by Intellectual Ventures April 16 Capital One Financial Corp  defeated a lawsuit on Wednesday brought by large patent owner Intellectual Ventures, after a U.S. judge invalidated two of IV's patents, according to the court opinion. ~U.S. judge dismisses Intellectual Ventures patent suit versus Capital One April 16 A U.S. judge on Wednesday dismissed a lawsuit brought by patent owner Intellectual Ventures against Capital One Financial Corp, finding that two of IV's patents are invalid. ~
CVX,Argentina forced by ailing economy to change populist policies BUENOS AIRES, April 17 Argentine President Cristina Fernandez is reversing some of the populist policies that defined her first six years in power and will have little choice but to stick to the new, more pragmatic  path over the remaining 20 months of her final term. ~
CMG,UPDATE 2-Chipotle raising prices as steak, avocados, cheese costs rise April 17 Chipotle Mexican Grill Inc on Thursday said it will increase menu prices for the first time in nearly three years, fueled by all-time high costs for steak as well increasingly expensive avocados and cheese. ~Chipotle to start raising prices later this quarter-CFO LOS ANGELES, April 17 Chipotle Mexican Grill Inc  to begin raising menu prices in the mid-single-digit percentages in late Q2 - CFO Chipotle's price increases should be completely rolled out in early Q3 Chipotle's steak costs are up 25 percent since the end of the year Chipotle's food costs to rise due to higher costs for steak, avocados and cheese  Chipotle has not yet seen pork costs rise due to PEDv, a deadly piglet virus   (Reporting by Lisa Baertlein in Los Angeles) ~
DLPH.N,UPDATE 1-GM faced a Cadillac ignition switch issue in 2006 DETROIT/WASHINGTON, April 16 General Motors engineers reported accidentally turning off ignition switches in a Cadillac SRX with their knees more than eight years ago, and they ordered a similar fix to a similar problem in smaller, cheaper cars linked to 13 deaths, according to documents from parts maker Delphi Automotive. ~
DOV,UPDATE 1-Dover Corp revenue rises as sales improve across businesses April 17 Diversified industrial products maker Dover Corp posted a higher-than-expected quarterly revenue as sales rose across its engineered systems and energy equipment businesses. ~Dover Corp's quarterly revenue rises 7 percent Diversified industrial products maker Dover Corp  reported a 7 percent rise in quarterly revenue as sales rose across its energy, engineered systems and fluids businesses. ~Dover Corp's quarterly revenue rises 7 pct April 17 Diversified industrial products maker Dover Corp reported a 7 percent rise in quarterly revenue as sales rose across its energy, engineered systems and fluids businesses. ~
DOW,BRIEF-Downer EDI says offer for Spotless Group now closed * Confirms that its offer for Spotless was not extended and has now closed. Source text for Eikon: Further company coverage: ~BRIEF-Downer EDI posts FY net profit of $181.5 million * FY total revenue and other income from ordinary activities $7.29 billion , up 6.4 percent ~BRIEF-Downer EDI says ‍offer for Spotless Group extended to 28 August 2017​ * ‍Offer for Spotless Group extended to 7pm on Monday, 28 august 2017​ Source text for Eikon: Further company coverage: ~BRIEF-Downer EDI says Spotless ‍offer extended to Aug 21, 2017​ * Spotless ‍offer extended to 7pm on monday, 21 august 2017​ Source text for Eikon: Further company coverage: ~BRIEF-Downer EDI's takeover offer for Spotless Group extended till 7pm (Sydney time) on Aug. 14 * Unconditional takeover offer for Spotless Group extended until 7:00pm (Sydney time) on Monday, 14 August Source text for Eikon: Further company coverage: (bangalore.newsroom@thomsonreuters.com) ~BRIEF-Downer extends takeover offer for Spotless Group * decided to extend Spotless offer period for one week; offer will now remain open for acceptance until 14 august Source text for Eikon: Further company coverage: ~BRIEF-Downer extends Spotless offer to August 7 2017 * ‍Downer has decided to extend offer for Spotless Group holdings to 7 pm on Monday, 7 august 2017​ Source text for Eikon: Further company coverage: ~BRIEF-Downer EDI's stake in Spotless increases to 80.3 pct * Downer's stake in Spotless increases to 80.3 pct Source text for Eikon: Further company coverage: ~BRIEF- Downer EDI Ltd'S stake in Spotless Group increases to 72% * As Downer's shareholding in Spotless is now over 70%, Downer expects that Spotless will be removed from certain S&P;/ASX market indices ~
FB.O,Wall Street Week Ahead: Spring fever brings hope for U.S. earnings NEW YORK Earnings season shifts into high gear next week, and with nearly one-third of S&P; 500 names set to post results, investors hope the news provides a catalyst to buy stocks and leave the market's recent weakness in the dust. ~Wall St Week Ahead-Spring fever brings hope for U.S. earnings NEW YORK, April 17 Earnings season shifts into high gear next week, and with nearly one-third of S&P; 500 names set to post results, investors hope the news provides a catalyst to buy stocks and leave the market's recent weakness in the dust. ~Fidelity biotech fund among worst performers in April sell-off BOSTON One of the biotechnology sector's worst two-week declines in the past decade has clobbered one of Fidelity Investments' hottest funds. ~Billionaire Usmanov remains Russia's richest tycoon: Forbes MOSCOW Alisher Usmanov is Russia's richest tycoon for the third year in a row, with wealth of $18.6 billion, after selling his stake in the social media website Facebook, according to the latest report by the U.S. magazine Forbes. ~Billionaire Usmanov remains Russia's richest tycoon - Forbes MOSCOW, April 17 Alisher Usmanov is Russia's richest tycoon for the third year in a row, with wealth of $18.6 billion, after selling his stake in the social media website Facebook, according to the latest report by the U.S. magazine Forbes. ~
F,Ford, IBM to face renewed U.S. lawsuit over apartheid-era abuses NEW YORK, April 17 Ford Motor Co and IBM Corp will again have to face a U.S. lawsuit claiming they encouraged race-based human rights abuses in apartheid-era South Africa, despite a series of recent court decisions limiting the right to pursue such cases. ~Ford's Lincoln brand to debut in China in seven cities BEIJING Ford Motor Co's premium brand Lincoln may be late to China's luxury boom, but its top executives say the upscale car market still has plenty of steam left for growth to make its debut later this year worthwhile. ~UPDATE 2-Ford's Lincoln brand to debut in China in seven cities (Adds comments from Lincoln global chief, paragraphs 5-7. 18-19) ~REFILE-Ford's Lincoln brand to debut in China with eight stores in seven cities: exec BEIJING, April 17 Ford Motor Co said on Thursday it plans to launch its premium Lincoln brand in China in October, when it will open eight stores in seven Chinese cities. ~
GE,US STOCKS-Earnings lift S&P; 500, Nasdaq; S&P;'s best week since July * S&P; 500 scores biggest weekly percentage gain since July ~GLOBAL MARKETS-Global shares edge higher on U.S. data; dollar gains * Dollar up as call to end Ukraine violence cuts safety bid ~US STOCKS SNAPSHOT-S&P; 500, Nasdaq rise after strong results NEW YORK, April 17 The major U.S. stock indexes ended a holiday-shortened week with mostly gains on Thursday, giving the S&P; 500 its biggest weekly advance since July as Morgan Stanley and General Electric rallied after strong results. ~GLOBAL MARKETS-Global shares edge higher on U.S. data; dollar gains * Russia, Ukraine, U.S. and EU in joint call to end violence ~GE industrial profit boost underscores strategy, shares up General Electric Co  posted a 12 percent rise in overall industrial profits on Thursday, as strength in its businesses selling gas turbines, jet engines and oil industry equipment offset weakness in healthcare and transportation. ~UPDATE 4-GE industrial profit boost underscores strategy, shares up April 17 General Electric Co posted a 12 percent rise in overall industrial profits on Thursday, as strength in its businesses selling gas turbines, jet engines and oil industry equipment offset weakness in healthcare and transportation. ~European shares end higher on upbeat U.S. company results LONDON, April 17 European equities finished higher on Thursday after losing ground earlier in the session, with upbeat results from major U.S. companies like Morgan Stanley, Goldman Sachs and General Electric improving sentiment. ~European shares up on encouraging U.S. company results * FTSEurofirst 300 gains 0.4 percent after falling earlier ~DIARY-U.S. MEETINGS/WEEK AHEAD THOMSON REUTERS, Apr 17,2014 - Corporate Meetings for US companies for Week ahead.         S&P; 500 Earnings - Weekly           S&P; 500 Earnings - Day Ahead        Non S&P; 500 - Weekly               Non S&P; 500 - Day Ahead             ConferenceCall/Webcast - Weekly    ConferenceCall/Webcast - Day        S&P; 500 Earnings - Monthly           Meetings - Day Ahead                Economic Indicators                  Dividends                           Daily earnings hits & misses         Federal Rese ~
GM,Exclusive: GM says recalled cars safe, but has not tested for knee-bump danger WASHINGTON General Motors says that cars being recalled because of faulty ignition switches can be driven safely before repairs, based on more than 80 tests, but the automaker has not addressed a problem long known to potentially shut off the engine: a simple bump from a driver's knee. ~Auto airbag maker Continental named in GM recall suit Plaintiffs' lawyers are seeking to draw Continental Automotive Systems US, the maker of airbag systems in recalled General Motors Co vehicles, into litigation over an ignition-switch defect that has been linked to 13 deaths. ~Auto airbag maker Continental named in GM recall suit April 17 Plaintiffs' lawyers are seeking to draw Continental Automotive Systems US, the maker of airbag systems in recalled General Motors Co vehicles, into litigation over an ignition-switch defect that has been linked to 13 deaths. ~GM to shift global Cadillac chief back to Washington policy job-source DETROIT General Motors Co plans to shift its global Cadillac chief back to focus full time on his former lobbying position in Washington as the No. 1 U.S. automaker deals with fallout from defective ignition switches linked to at least 13 deaths, a person familiar with the plans said on Thursday. ~GM to shift global Cadillac chief back to Washington policy job-source DETROIT, April 17 General Motors Co plans to shift its global Cadillac chief back to focus full time on his former lobbying position in Washington as the No. 1 U.S. automaker deals with fallout from defective ignition switches linked to at least 13 deaths, a person familiar with the plans said on Thursday. ~U.S. judge declines to order 'park it now' notices for GM cars April 17 A federal judge on Thursday rejected a bid to compel General Motors Co to tell customers to stop driving millions of cars that have been recalled for defective ignition switches. ~GM faced a Cadillac ignition switch issue in 2006 DETROIT/WASHINGTON General Motors engineers reported accidentally turning off ignition switches in a Cadillac SRX with their knees more than eight years ago, and they ordered a similar fix to a similar problem in smaller, cheaper cars linked to 13 deaths, according to documents from parts maker Delphi Automotive. ~GM to seek court protection against ignition lawsuits General Motors Co said it would ask a U.S. court to bar lawsuits related to actions before its 2009 bankruptcy, signaling a tougher stance toward legal claims stemming from its recent recall over faulty ignition switches. ~UPDATE 1-GM faced a Cadillac ignition switch issue in 2006 DETROIT/WASHINGTON, April 16 General Motors engineers reported accidentally turning off ignition switches in a Cadillac SRX with their knees more than eight years ago, and they ordered a similar fix to a similar problem in smaller, cheaper cars linked to 13 deaths, according to documents from parts maker Delphi Automotive. ~
GILD.O,UPDATE 4-UnitedHealth: New hepatitis C drug costs far more than forecast April 17 UnitedHealth Group Inc, the largest U.S. health insurer, said it spent more than $100 million to cover a pricey new hepatitis C drug from Gilead Sciences Inc in its first three months on the market, an amount that was "multiple" times what it had expected. ~England agrees funding for Gilead hepatitis C drug LONDON, April 17 Health authorities in England have approved an 18.7 million pound ($31 million) investment to provide Gilead Sciences' controversial new hepatitis C pill Sovaldi for seriously ill patients. ~
GS,UPDATE 1-Ex-Goldman director Gupta starts prison term on June 17 NEW YORK, April 17 Former Goldman Sachs Group Inc director Rajat Gupta is expected to begin his two-year prison term on June 17 for insider trading. ~Amid frigid winter, Goldman, Morgan Stanley see commodity gains LONDON/NEW YORK Goldman Sachs  and Morgan Stanley  both cited stronger commodities trading as a bright spot in the first quarter, aided in part by extraordinary volatility caused by the coldest U.S. winter in three decades. ~UPDATE 2-Amid frigid winter, Goldman, Morgan Stanley see commodity gains * Morgan Stanley says "strong performance" bolstered FICC ~Ex-Goldman director Gupta to surrender June 17 in insider case NEW YORK, April 17 Former Goldman Sachs Group Inc director Rajat Gupta is expected to begin his two-year prison term on June 17 for insider trading. ~WRAPUP 1-For Goldman Sachs and Morgan Stanley, boring is beautiful April 17 Investment banks Morgan Stanley  and Goldman Sachs Group Inc posted better-than-expected quarterly earnings on Thursday, helped by gains in merger advisory and stock underwriting. ~BRIEF-Goldman CFO declines to give return-on-equity target NEW YORK, April 17 Goldman Sachs Group Inc  chief financial officer Harvey Schwartz said the following on a Thursday conference call with analysts: ~Goldman Sachs profit falls 11 percent but beats estimates Goldman Sachs Group Inc reported an 11 percent drop in quarterly profit as client activity remained constrained and fixed-income revenue shrank, but both earnings and revenue beat market estimates and the Wall Street bank's shares rose. ~Goldman, Morgan report strong commodity results as rivals exit * Morgan Stanley says "strong performance" bolstered FICC ~UPDATE 2-Goldman Sachs profit falls 11 pct but beats estimates April 17 Goldman Sachs Group Inc reported an 11 percent drop in quarterly profit as client activity remained constrained and fixed-income revenue shrank, but both earnings and revenue beat market estimates and the Wall Street bank's shares rose. ~
HD,UPDATE 1-Market Chatter-Corporate finance press digest April 17 The following corporate finance-related stories were reported by media: ~Home Depot puts a lid on new-store openings - WSJ April 17 Home Depot Inc is putting a lid on new-store openings and focusing its expansion efforts on e-commerce, which presents some logistical challenges for a retailer that sells a lot of bulky materials, the Wall Street Journal reported. ~
HON,UPDATE 3-Turbocharger sales help Honeywell profit zoom past forecasts April 17 Diversified manufacturer Honeywell International Inc posted a better-than-expected quarterly profit on Thursday, helped by strong sales of turbochargers to help automobiles meet fuel-efficiency standards. ~CORRECTED-UPDATE 2-Turbocharger sales help Honeywell profit zoom past expectations April 17 Diversified manufacturer Honeywell International Inc posted a better-than-expected quarterly profit on Thursday, helped by strong sales of automobile turbochargers in the United States and China. ~Honeywell quarterly profit jumps 5 percent April 17 Honeywell International Inc, which makes airplane cockpit parts and a host of other electronics and equipment, said on Thursday its quarterly profit jumped 5 percent. ~
IBM,Ford, IBM to face renewed U.S. lawsuit over apartheid-era abuses NEW YORK, April 17 Ford Motor Co and IBM Corp will again have to face a U.S. lawsuit claiming they encouraged race-based human rights abuses in apartheid-era South Africa, despite a series of recent court decisions limiting the right to pursue such cases. ~Earnings lift S&P; 500, Nasdaq; S&P;'s best week since July NEW YORK Stocks ended a holiday-shortened week with mostly modest gains on Thursday, though the S&P; 500 notched its biggest weekly advance since July as Morgan Stanley and General Electric rallied after strong results. | Video  ~US STOCKS-Earnings lift S&P; 500, Nasdaq; S&P;'s best week since July * S&P; 500 scores biggest weekly percentage gain since July ~IBM's quarterly revenue sinks to 5-year low as hardware sales fall IBM Corp , the world's biggest technology services company, reported its lowest quarterly revenue in five years on Wednesday, as Big Blue struggles with falling demand for its hardware and faces challenges in growth markets like China. ~CORRECTED-UPDATE 5-IBM's quarterly revenue sinks to 5-year low as hardware sales fall (Corrects paragraph 10 to remove reference to Lenovo buying System z. Lenovo is acquiring System x.) ~US STOCKS-Wall St edges higher during earnings flurry * Jobless claims rise less than expected; Philly Fed jumps ~REFILE-US STOCKS-Wall St little changed amid earnings flurry (Replaces extraneous word "market" for "most" in quote in 6th paragraph ) ~US STOCKS-Wall St to open little changed on mixed earnings * Futures up: Dow 15 pts, S&P; 3 pts, Nasdaq up 12 pts   (Recasts, updates prices) ~US STOCKS-Weak earnings weigh on futures after rally NEW YORK, April 17 U.S. stock index futures were flat and pointed to a lower open on Thursday after three days of gains on Wall Street, weighed by results including those from Google and IBM and ahead of employment and regional business growth data. ~
