ATVI.O,Activision CEO Kotick gets $7.9 million cash bonus for 2013 SAN FRANCISCO, March 11 Activision Blizzard Inc's chief executive, Robert Kotick, was awarded a cash bonus of $7.9 million for 2013 as part of the videogame publisher's incentive plan, according to a regulatory filing on Tuesday. ~
AIG,U.S. Senator Collins says bill would tweak capital rules for insurers WASHINGTON, March 11 A U.S. senator who backed tougher capital rules for nonbank financial firms said on Tuesday that regulators misread how that requirement applied to insurance companies, and she has proposed new legislation to clear up the confusion. ~
BA,REFILE-INSIGHT-Legal limbo hampers probe into missing Malaysia jet KUALA LUMPUR/NEW YORK/PARIS, March 12 (Reuters) - I nvestigators trying to solve the disappearance without trace of a Malaysia Airlines jetliner face an extremely rare challenge that could hinder their efforts: they lack the powers of a formal air safety investigation. ~
COG,Anti-fracking activist barred from 40 pct of Pennsylvania county HARRISBURG, Pa., March 11 A court injunction obtained by Texas-based Cabot Oil & Gas is preventing Pennsylvania resident Vera Scroggins from going to her local grocery store, her friends' homes, schools, or even the hospital. ~
CBS,CBS may go online, cut off its broadcast signal if Aereo prevails -CEO March 11 CBS Corp Chief Executive Officer Leslie Moonves said the No. 1 rated broadcaster could offer its content directly to consumers over the Internet and cut off its traditional broadcast signal if the Aereo video streaming service is deemed legal. ~
CVX,Chevron cuts 2017 production forecast March 11 Chevron Corp, the second largest U.S. oil company, cut its 2017 production forecast on Tuesday. ~
CME.O,UPDATE 2-US futures markets group CME cleared to launch London exchange LONDON, March 11 U.S. futures market operator CME has joined a growing list of companies seeking to cash in on new rules on derivatives trading by securing regulatory approval for a London-based derivatives exchange. ~
CMCSA.O,UPDATE 2-Media executives question Comcast-Time Warner Cable deal March 11 One of the top executives of Twenty-First Century Fox Inc has raised questions about Comcast's potential dominance of the U.S. broadband Internet market if regulators allow its $45.2 billion merger with Time Warner Cable to be completed. ~SoftBank CEO says Sprint could shake up U.S. 'oligopoly' WASHINGTON The chief executive of Japan's SoftBank Corp on Tuesday called the U.S. wireless market an oligopoly plagued by slow speeds and high prices and said his company's Sprint Corp could shake up the competition, but it would require a scale that Sprint cannot reach alone. ~UPDATE 1-SoftBank CEO says Sprint could shake up US 'oligopoly' WASHINGTON, March 11 The chief executive of Japan's SoftBank Corp on Tuesday called the U.S. wireless market an oligopoly plagued by slow speeds and high prices and said his company's Sprint Corp could shake up the competition, but it would require a scale that Sprint cannot reach alone. ~Fox exec raises questions on Comcast-Time Warner Cable merger March 11 One of the top executives of Twenty-First Century Fox Inc has raised questions about Comcast's potential dominance of the U.S. broadband Internet market if regulators allow its $45.2 billion merger with Time Warner Cable to be completed. ~
DOW,BRIEF-Downer EDI says offer for Spotless Group now closed * Confirms that its offer for Spotless was not extended and has now closed. Source text for Eikon: Further company coverage: ~BRIEF-Downer EDI posts FY net profit of $181.5 million * FY total revenue and other income from ordinary activities $7.29 billion , up 6.4 percent ~BRIEF-Downer EDI says ‍offer for Spotless Group extended to 28 August 2017​ * ‍Offer for Spotless Group extended to 7pm on Monday, 28 august 2017​ Source text for Eikon: Further company coverage: ~BRIEF-Downer EDI says Spotless ‍offer extended to Aug 21, 2017​ * Spotless ‍offer extended to 7pm on monday, 21 august 2017​ Source text for Eikon: Further company coverage: ~BRIEF-Downer EDI's takeover offer for Spotless Group extended till 7pm (Sydney time) on Aug. 14 * Unconditional takeover offer for Spotless Group extended until 7:00pm (Sydney time) on Monday, 14 August Source text for Eikon: Further company coverage: (bangalore.newsroom@thomsonreuters.com) ~BRIEF-Downer extends takeover offer for Spotless Group * decided to extend Spotless offer period for one week; offer will now remain open for acceptance until 14 august Source text for Eikon: Further company coverage: ~BRIEF-Downer extends Spotless offer to August 7 2017 * ‍Downer has decided to extend offer for Spotless Group holdings to 7 pm on Monday, 7 august 2017​ Source text for Eikon: Further company coverage: ~BRIEF-Downer EDI's stake in Spotless increases to 80.3 pct * Downer's stake in Spotless increases to 80.3 pct Source text for Eikon: Further company coverage: ~BRIEF- Downer EDI Ltd'S stake in Spotless Group increases to 72% * As Downer's shareholding in Spotless is now over 70%, Downer expects that Spotless will be removed from certain S&P;/ASX market indices ~
XOM,ExxonMobil seeks settlement in $800 million Chad tax dispute: sources N'DJAMENA An ExxonMobil led consortium in Chad is seeking an out-of-court settlement after the government filed a legal claim for more than $800 million in unpaid taxes, finance ministry sources said on Tuesday. ~UPDATE 1-ExxonMobil seeks settlement in $800 mln Chad tax dispute -sources N'DJAMENA, March 11 An ExxonMobil led  consortium in Chad is seeking an out-of-court settlement after the government filed a legal claim for more than $800 million in unpaid taxes, finance ministry sources said on Tuesday. ~ExxonMobil seeks settlement in $800 mln Chad tax dispute -sources N'DJAMENA, March 11 An ExxonMobil-led  consortium in Chad is seeking an out-of-court settlement after the government filed a legal claim for more than $800 million in unpaid taxes, finance ministry sources said on Tuesday. ~
F,Canada, South Korea conclude long-delayed free trade deal OTTAWA, March 11 Canada and South Korea announced on Tuesday they had wrapped up talks on a long-delayed free trade deal which had stalled for years amid squabbles over exports of autos and beef. ~
GM,WRAPUP 1-Federal prosecutors open criminal probe of GM recall -source NEW YORK/WASHINGTON/DETROIT, March 11 Federal prosecutors are examining whether General Motors is criminally liable for failing to properly disclose problems with some of its vehicles that were linked to 13 deaths and led to a recall last month, according to a source familiar with the investigation. ~US STOCKS-Profit-taking drags Wall Street lower * GM shares fall; federal prosecutors open criminal probe -source ~Federal prosecutors in New York open criminal probe of GM: source NEW YORK/WASHINGTON/DETROIT Federal prosecutors in New York are examining whether General Motors is criminally liable for failing to properly disclose problems with some of its vehicles that were linked to 13 deaths and led to a recall last month, according to a source familiar with the investigation. ~Federal prosecutors in New York open criminal probe of GM -source NEW YORK/WASHINGTON/DETROIT, March 11 Federal prosecutors in New York are examining whether General Motors  is criminally liable for failing to properly disclose problems with some of its vehicles that were linked to 13 deaths and led to a recall last month, according to a source familiar with the investigation. ~BRIEF-US attorney's office in New York has opened criminal probe of General Motors Co related to ignition switch recall-source DETROIT, March 11 General Motors Co :  * US attorney's office in New York has opened criminal probe of General Motors ~U.S. Senate seeks hearings on GM recalls: aide WASHINGTON A probe by the U.S. Congress into General Motors' recall of malfunctioning cars blamed for 13 deaths expanded on Tuesday when Senate Commerce Committee Chairman John Rockfeller sought hearings related to the company's ignition switch problems. | Video  ~U.S. House panel requests auto recall documents from GM WASHINGTON A U.S. House of Representatives committee on Tuesday gave General Motors and the National Highway Traffic Safety Administration (NHTSA) until March 25 to provide information related to the automaker's recall of vehicles due to safety concerns. ~U.S. House panel requests auto recall documents from GM WASHINGTON, March 11 A U.S. House of Representatives committee on Tuesday gave General Motors and the National Highway Traffic Safety Administration (NHTSA) until March 25 to provide information related to the automaker's recall of vehicles due to safety concerns. ~U.S. Senate seeks hearings on GM recalls -aide WASHINGTON, March 11 A probe by the U.S. Congress into General Motors' recall of malfunctioning cars blamed for 13 deaths expanded on Tuesday when Senate Commerce Committee Chairman John Rockfeller sought hearings related to the company's ignition switch problems. ~
HUM,Insurers wary of Obamacare unknowns as they plan for 2015 NEW YORK, March 11 U.S. health insurers are struggling to set prices for their Obamacare plans in 2015 and decide which regions to return to before the deadlines for submitting those plans to regulators. ~
INTC.O,Blackstone buys most of Accuvant, valuing firm at about $225 mln BOSTON, March 11 Blackstone Group, the world's biggest alternative asset manager, said on Tuesday it has agreed to buy most of cybersecurity firm Accuvant Inc from investment firm Sverica International. ~
IBM,Lenovo says China strike an IBM matter, but it won't cut wages SHANGHAI, March 11 Chinese PC maker Lenovo Group Ltd said it was up to IBM to resolve a wildcat strike at a China-based  factory, as a deal to buy the U.S. company's server business had yet to be finalised. ~
MSFT.O,Microsoft appoints activist investor Mason Morfit to board SEATTLE, March 11 Microsoft Corp said on Tuesday it appointed Mason Morfit, president of activist investor ValueAct Capital, as a board member. ~Microsoft counts on shooter game 'Titanfall' to fire up Xbox One sales SAN FRANCISCO Microsoft Corp is betting on making sci-fi combat game "Titanfall" a hit big enough to boost sales of its Xbox One videogame device, helping it catch up in terms of sales with rival Sony Corp's PlayStation 4 console. | Video  ~NORDIC STOCKS-Factors to watch on March 11 The following stocks may be affected by newspaper reports and other factors on Tuesday: ~NORDIC STOCKS-Factors to watch on March 11 The following stocks may be affected by newspaper reports and other factors on Tuesday: ~Microsoft counts on shooter game 'Titanfall' to fire up Xbox One sales SAN FRANCISCO, March 10 Microsoft Corp  is betting on making sci-fi combat game "Titanfall" a hit big enough to boost sales of its Xbox One videogame device, helping it catch up in terms of sales with rival Sony Corp's  PlayStation 4 console. ~
DIS,UPDATE 2-Disney TV executive Sweeney to leave company in January LOS ANGELES, March 11 Anne Sweeney, the president of Walt Disney Co's Disney/ABC Television Group, will leave the media company in January after 18 years to pursue a career in television directing, the company said on Tuesday. ~Disney in talks to buy YouTube network Maker Studios: report SAN FRANCISCO Walt Disney Co is in talks to buy Maker Studios, potentially valuing the fast-growing developer and publisher of YouTube entertainment videos at half a billion dollars or more, tech blog Re/code reported on Tuesday, citing anonymous sources. ~CORRECTED-Disney in talks to buy YouTube network Maker Studios -report (In paragraph three, corrects Maker investor to Time Warner Investments, not Time Warner Cable) ~Disney TV executive Sweeney to leave company in January 2015 LOS ANGELES, March 11 Anne Sweeney, the president of Walt Disney Co's Disney/ABC Television Group, will leave the company in January 2015 to pursue a career in television directing, the company said in a statement on Tuesday. ~
FOXA.O,UPDATE 2-Media executives question Comcast-Time Warner Cable deal March 11 One of the top executives of Twenty-First Century Fox Inc has raised questions about Comcast's potential dominance of the U.S. broadband Internet market if regulators allow its $45.2 billion merger with Time Warner Cable to be completed. ~Fox exec raises questions on Comcast-Time Warner Cable merger March 11 One of the top executives of Twenty-First Century Fox Inc has raised questions about Comcast's potential dominance of the U.S. broadband Internet market if regulators allow its $45.2 billion merger with Time Warner Cable to be completed. ~
FOX.O,UPDATE 2-Media executives question Comcast-Time Warner Cable deal March 11 One of the top executives of Twenty-First Century Fox Inc has raised questions about Comcast's potential dominance of the U.S. broadband Internet market if regulators allow its $45.2 billion merger with Time Warner Cable to be completed. ~Fox exec raises questions on Comcast-Time Warner Cable merger March 11 One of the top executives of Twenty-First Century Fox Inc has raised questions about Comcast's potential dominance of the U.S. broadband Internet market if regulators allow its $45.2 billion merger with Time Warner Cable to be completed. ~
VZ,SoftBank CEO says still keen to merge U.S. Sprint and T-Mobile March 11 Japan's SoftBank Corp is still trying to buy T-Mobile US Inc and merge it with its U.S. wireless carrier Sprint Corp, SoftBank CEO Masayoshi Son said, even though U.S. regulators appear set against a deal. ~
V,BRIEF-Visa calls for redemption all of its 1.200 pct notes due 2017 * Visa Inc - on Sept 11, co called for redemption all of $1.75 billion principal amount outstanding of its 1.200 pct notes due 2017‍​ - SEC filing ~BRIEF-Visa Inc files for three-part senior notes offering of up to $2.5 bln * Visa Inc says files for three-part senior notes offering of up to $2.5 billion - SEC filing‍​ ~Former BoE deputy Hogg to join Visa as Europe unit CEO Visa Inc, the world's largest payments processor, on Thursday named former Bank of England (BoE) deputy governor Charlotte Hogg as chief executive of its Europe division. ~CORRECTED-UPDATE 1-MOVES-Former BoE deputy Hogg to join Visa as Europe unit CEO Sept 7 Visa Inc, the world's largest payments processor, on Thursday named former Bank of England (BoE) deputy governor Charlotte Hogg as chief executive of its Europe division. ~MOVES-Visa names ex-BoE deputy Charlotte Hogg as Europe unit CEO Sept 7 Visa Inc, the world's largest payments processor, on Thursday named Charlotte Hogg as chief executive of its Europe division. ~BRIEF-Visa appoints Charlotte Hogg as CEO of European operations * Visa Inc appoints Charlotte Hogg as chief executive officer of the compan's European operations ~BRIEF-Visa Inc files prospectus supplement for potential three-part senior notes offering * Visa Inc files prospectus supplement for potential three-part senior notes offering; size not disclosed - sec filing‍​ Source text (http://bit.ly/2vLDrIe) Further company coverage: ~BRIEF-Visa enables on the go payments with the new Fitbit Ionic * Visa inc- ‍enabling visa payments on fitbit's smartwatch fitbit ionic​ ~BRIEF-Bridg raises $11 million in Series B funding * Bridg raises $11 million in Series B funding from Morpheus Ventures, March Capital, Visa and NextEquity ~
WMT,FuelCell Energy first quarter revenue surges as demand grows, shares rise FuelCell Energy Inc , a United States developer of next-generation fuel cell power plants, said on Monday that revenue jumped and losses narrowed in the first quarter amid growing demand for multi-megawatt fuel cell parks. ~
