ABBV.N,EU to decide on $52 billion AbbVie, Shire deal by Oct. 16 BRUSSELS European Union competition regulators will decide by Oct. 16 whether to clear U.S. drugmaker AbbVie's  32 billion pounds (51.99 billion US dollar) bid for Irish peer Shire Plc , the European Commission said on Monday. ~
AET,UPDATE 4-Danaher to buy Nobel Biocare for $2.2 bln * Deal to make Danaher world No.1 maker of dental implants ~
GOOGL.O,Second actor sues Google over 'Innocence of Muslims' movie trailer Sept 15 A second actor has sued Google Inc  over a movie trailer called "Innocence of Muslims" that mocked the Prophet Mohammad and led to riots in 2012, six months after a U.S. appeals court ruled for another actor and ordered the film taken off YouTube. ~Governments pressure Google for more user information Google Inc said it was facing increasing pressure from governments around the world to reveal user information in criminal investigations amid ongoing revelations about national surveillance programs. ~Governments pressure Google for more user information Sept 15 Google Inc said it was facing increasing pressure from governments around the world to reveal user information in criminal investigations amid ongoing revelations about national surveillance programs. ~Google launches $105 Android One; eyes low-price smartphone boom NEW DELHI/MUMBAI Google Inc launched in India on Monday a $105 smartphone, the first device from its "Android One" initiative which is aimed at boosting sales in key emerging markets through cheaper prices and better quality software. ~UPDATE 2-Google launches $105 Android One; eyes low-price smartphone boom * Partners with Micromax, Karbonn and Spice for low-cost phones ~Google launches Android One, phones to be priced at around $105 NEW DELHI/MUMBAI, Sept 15 Google Inc  launched in India on Monday the first smartphones powered by its Android One operating system, pricing them at around 6,399 rupees ($105) to capture the low-cost segement of the world's fastest growing smartphone market. ~
GOOG.O,Second actor sues Google over 'Innocence of Muslims' movie trailer Sept 15 A second actor has sued Google Inc  over a movie trailer called "Innocence of Muslims" that mocked the Prophet Mohammad and led to riots in 2012, six months after a U.S. appeals court ruled for another actor and ordered the film taken off YouTube. ~Governments pressure Google for more user information Google Inc said it was facing increasing pressure from governments around the world to reveal user information in criminal investigations amid ongoing revelations about national surveillance programs. ~Governments pressure Google for more user information Sept 15 Google Inc said it was facing increasing pressure from governments around the world to reveal user information in criminal investigations amid ongoing revelations about national surveillance programs. ~Google launches $105 Android One; eyes low-price smartphone boom NEW DELHI/MUMBAI Google Inc launched in India on Monday a $105 smartphone, the first device from its "Android One" initiative which is aimed at boosting sales in key emerging markets through cheaper prices and better quality software. ~UPDATE 2-Google launches $105 Android One; eyes low-price smartphone boom * Partners with Micromax, Karbonn and Spice for low-cost phones ~Google launches Android One, phones to be priced at around $105 NEW DELHI/MUMBAI, Sept 15 Google Inc  launched in India on Monday the first smartphones powered by its Android One operating system, pricing them at around 6,399 rupees ($105) to capture the low-cost segement of the world's fastest growing smartphone market. ~
MO,US STOCKS-Molson, Altria hit records on brewer merger talk NEW YORK, Sept 15 Talk about further consolidation in the brewing industry was helping lift consumer staple stocks on the S&P; 500, with the largest gainers Altria , in point terms, and Molson Coors, percentage-wise. ~
AMZN.O,Hachette writers plan to appeal directly to Amazon's board: NYT Writers published by Hachette Book Group and their allies are planning to appeal directly to the board of Amazon.com Inc to find a way out of the impasse over e-book prices, the New York Times reported. ~Hachette writers plan to appeal directly to Amazon's board - NYT Sept 15 Writers published by Hachette Book Group and their allies are planning to appeal directly to the board of Amazon.com Inc to find a way out of the impasse over e-book prices, the New York Times reported. ~
AAPL.O,UPDATE 2-Apple iPhone 6 pre-orders hit record 4 mln on first day (Adds analysts' comments, updates share movement, details) ~Apple receives record pre-orders for new iPhones Sept 15 Apple Inc said it received record first-day pre-orders of its new iPhone 6 and iPhone 6 Plus, with over four million in the first 24 hours, meaning many customers will have to wait for their new phones. ~Exclusive: Two Apple medical trials shed light on how HealthKit will work SAN FRANCISCO Two prominent U.S. hospitals are preparing to launch trials with diabetics and chronic disease patients using Apple Inc's  HealthKit, offering a glimpse of how the iPhone maker's ambitious take on healthcare will work in practice. ~
T,UPDATE 1-America Movil contacts AT&T;, Softbank on bids for assets-Bloomberg Sept 15 Carlos Slim's America Movil has contacted AT&T; Inc and SoftBank Corp as the telecommunications company tries to sell a chunk of assets that could be worth up to $17.5 billion, Bloomberg reported on Monday, citing people with knowledge of the matter. ~America Movil seeks AT&T;, Softbank bids for Mexican assets-Bloomberg Sept 15 Mexican telecom company America Movil  has reached out to AT&T; Inc and Japan's SoftBank Corp as it looks to sell assets along the east coast of Mexico that could fetch as much as $17.5 billion, Bloomberg reported, citing people with knowledge of the matter. ~
BAC,Bank of America to move frontier markets research head to Dubai DUBAI, Sept 15 Bank of America-Merrill Lynch  is moving its head of frontier markets research to Dubai, the lender told Reuters on Monday, as it looks to take advantage of growing investor interest in the Gulf and surrounding region. ~
BLK,BlackRock calls for U.S. stock market reforms NEW YORK, Sept 15 BlackRock Inc, the world's largest asset manager, has asked regulators to force exchanges to lower their access fees and require greater transparency of broker dealer-run trading venues known as "dark pools." ~MOVES-Carlyle hires Michael Hart from BlackRock Solutions Sept 15 Carlyle Group LP said it appointed Michael Hart as managing director and president of Carlyle GMS Finance Inc and NF Investment Corp. ~
CTSH.O,UPDATE 2-Cognizant to buy TriZetto to boost healthcare business Sept 15 Cognizant Technology Solutions Corp  struck its biggest deal on Monday, acquiring healthcare IT services provider TriZetto Corp for $2.7 billion to beef up its slowing healthcare business. ~Cognizant to buy IT services provider Trizetto for $2.7 bln Sept 15 Cognizant Technology Solutions Corp  said it would buy privately held healthcare IT services provider TriZetto Corp for $2.7 billion in cash. ~
CMCSA.O,UPDATE 1-Deadline near, net neutrality comments top 3 million at U.S. FCC WASHINGTON, Sept 15 The U.S. Federal Communications Commission has received a record 3 million comments from consumers, advocates, companies and lawmakers on proposed new Internet traffic, or "net neutrality," rules as the deadline to formally weigh in approached on Monday. ~Deluged with comments, U.S. FCC to continue 'net neutrality' outreach WASHINGTON, Sept 15 U.S. regulators on Monday will formally stop accepting public comments on proposed new Internet traffic, or "net neutrality," rules but will continue reaching out to Americans as they review the controversial regulations. ~
DHR,UPDATE 4-Danaher to buy Nobel Biocare for $2.2 bln * Deal to make Danaher world No.1 maker of dental implants ~BRIEF-Nobel Biocare shares open down 5.8 percent Sept 15 Nobel Biocare :  * Nobel biocare shares open down 5.8 percent after Danaher agrees to buy ~Swiss stocks - Factors to watch on Sept 15 ZURICH, Sept 15 Swiss shares were seen opening lower on Monday, in line with European shares, after disappointing data from China raised fresh concerns about the pace of economic growth in the world's second-biggest economy. ~BRIEF-Nobel Biocare seen opening down 3.3 pct - premarket Sept 15 NOBELBIOCARE/  * Shares in Nobel Biocare seen opening down 3.3 percent after Danaher agrees to ~Danaher to buy Nobel Biocare Holding for $2.2 billion including debt Sept 15 U.S. healthcare conglomerate Danaher Corp said it will buy Nobel Biocare Holding in an all-cash deal valued at about $2.2 billion, including debt, to widen its market presence in the global dental industry. ~
DE,BUSINESS-NEWS-SCHEDULE AT 1500 GMT / 11:00 a.m. ET STOCKHOLM - Microsoft Corp says it will acquire Stockholm-based games developer Mojang and the company's wildly popular Minecraft video game franchise for $2.5 billion. (MOJANG M&A;/MICROSOFT (UPDATE 2), expect by 1600 GMT / 12:00 p.m. ET, by Mia Shanley, 700 words) ~
DD,UPDATE 1-DuPont to pay $1.85 mln fine after herbicide injures trees Sept 15 DuPont will pay a $1.85 million penalty to resolve allegations that the global chemical company did not properly disclose the risks of using one of its herbicides, leading to widespread damage to tree species through several U.S. states. ~DuPont to pay $1.85 mln to resolve EPA herbicide allegations WASHINGTON, Sept 15 The U.S. Environmental Protection Agency on Monday said it had settled with the chemical company DuPont over violations of federal pesticide laws that agency says led to widespread tree deaths and damage. ~
DUK,Duke Energy to invest $500 mln in North Carolina solar power RALEIGH, N.C., Sept 15 Duke Energy Corp, the largest provider of electric power in the United States, will invest $500 million in a major expansion of its solar power program in North Carolina, the Charlotte-based company said Monday. ~
FB.O,Fraud trial of NY man who claimed Facebook stake delayed to May NEW YORK, Sept 15 The trial of an upstate New York man accused of attempting to defraud Facebook Inc  and billionaire founder Mark Zuckerberg of half of the company was delayed by six months on Monday after the defendant hired a new lawyer. ~Alibaba worried about Facebook IPO as considered Nasdaq versus NYSE Alibaba Group Holding Ltd could have sold nearly $2 billion worth of stock without lifting a finger. All it had to do was list its shares on Nasdaq. | Video  ~UPDATE 2-Microsoft to buy Minecraft maker Mojang for $2.5 billion STOCKHOLM/SEATTLE, Sept 15 Microsoft Corp  has agreed to acquire the Stockholm-based developer of the wildly popular Minecraft video game for $2.5 billion, as it tries to lure a new and mostly young audience into its mobile world. ~INSIGHT-RPT-Alibaba worried about Facebook IPO as considered Nasdaq vs NYSE Sept 15 Alibaba Group Holding Ltd could have sold nearly $2 billion worth of stock without lifting a finger. All it had to do was list its shares on Nasdaq. ~INSIGHT-Alibaba worried about Facebook IPO as considered Nasdaq vs NYSE Sept 15 Alibaba Group Holding Ltd could have sold nearly $2 billion worth of stock without lifting a finger. All it had to do was list its shares on Nasdaq. ~
F,U.S. regulators probe 205,000 Ford Fiestas for door-latch issue DETROIT U.S. safety regulators have opened an investigation into an estimated 205,000 Ford Fiesta small cars after receiving consumer complaints that doors failed to properly latch or stay closed. ~U.S. regulators probe 205,000 Ford Fiestas for door-latch issue DETROIT, Sept 15 U.S. safety regulators have opened an investigation into an estimated 205,000 Ford Fiesta small cars after receiving consumer complaints that doors failed to properly latch or stay closed. ~
GE,GE exec says avoided geared design in jet engine battle with Pratt Sept 15 General Electric Co avoided using a geared design for its new engine for narrowbody jets because of concerns about weight and reliability, said a top GE executive on Monday as it battles with rival Pratt & Whitney for billions of dollars in engine orders. ~
GM,REFILE-UPDATE 2-Germany's ZF agrees $13.5 bln TRW buy to position for self-drive cars growth * All-cash deal to create group with sales of over $40 bln ~Germany's ZF to take over TRW Automotive for $13.5 billion NEW YORK/FRANKFURT German car parts maker ZF Friedrichshafen [ZFF.UL] has reached a deal to buy U.S.-based TRW Automotive Holdings Corp  for $13.5 billion including debt, creating a global automotive supply powerhouse with combined annual sales of more than $40 billion. ~UPDATE 1-GM to offer compensation for 19 deaths related to ignition switch (Includes comment from GM in paragraph four and information from plaintiffs' lawyer in paragraph eight) ~GM to offer compensation for 19 deaths related to ignition switch WASHINGTON, Sept 15 General Motors Co  will pay compensation for 19 deaths linked to a faulty ignition switch, according to the lawyer overseeing the process, more than the 13 deaths the automaker had previously admitted were caused by the now recalled part. ~
GILD.O,UPDATE 2-Gilead signs hepatitis C pact to cut drug cost for poor * Generic Sovaldi to be available in 91 developing countries ~Gilead licenses hepatitis C drug to Cipla, Ranbaxy, 5 others NEW DELHI/MUMBAI, Sept 15 U.S. drugmaker Gilead Sciences Inc said on Monday it has licensed its hepatitis C drug to seven companies including Cipla Ltd  and Ranbaxy Laboratories Ltd to make it available in 91 developing countries including India. ~
JPM,Governments hold key to unlocking billions for social good - G8 report LONDON (Thomson Reuters Foundation) - Governments can unleash billions of dollars to tackle social problems more effectively if they take bold steps to reduce barriers to investing for both profit and social good, a task force set up by the world's richest nations said on Monday. ~TRF- UPDATE 1-Governments hold key to unlocking billions for social good - G8 report (Updates with new quote in para 17 and information about development impact bonds in para 18/19) ~
LMT,UPDATE 1-Pratt says next F-35 engine deals will cut costs by 7-8 pct WASHINGTON, Sept 15 Pratt & Whitney, a unit of United Technologies Corp, said its contracts with the Pentagon for the next two batches of engines for the Lockheed Martin Corp F-35 fighter jet will result in combined cost savings of 7 percent to 8 percent. ~Lockheed delivers next version of F-35 logistics system WASHINGTON, Sept 15 Lockheed Martin Corp  on Monday said it has delivered the next version of the computer-based logistics system used to support the F-35 fighter jet to the U.S. military for flight testing. ~
MRK,UPDATE 2-Merck osteoporosis drug passes trial, but side effects hover (Adds Merck comment, details on side effects, effectiveness) ~Merck says osteoporosis drug achieves goal in large trial Sept 15 Merck & Co on Monday said it expects next year to seek U.S. approval for its experimental osteoporosis drug, odanacatib, after the once-weekly medicine met its primary effectiveness goals in a late-stage trial. ~
MSFT.O,BUSINESS-NEWS-SCHEDULE AT 1830 GMT / 2:30 p.m. ET STOCKHOLM/SEATTLE - Microsoft Corp has agreed to acquire the Stockholm-based developer of the wildly popular Minecraft video game for $2.5 billion, as it tries to lure a new and mostly young audience into its mobile world. (MOJANG-M&A;/MICROSOFT (UPDATE 2), moved, by Mia Shanley and Bill Rigby, 904 words) ~Microsoft to buy Minecraft maker Mojang for $2.5 billion STOCKHOLM/SEATTLE Microsoft Corp  has agreed to acquire the Stockholm-based developer of the wildly popular Minecraft video game for $2.5 billion, as it tries to lure a new and mostly young audience into its mobile world. ~UPDATE 2-Microsoft to buy Minecraft maker Mojang for $2.5 billion STOCKHOLM/SEATTLE, Sept 15 Microsoft Corp  has agreed to acquire the Stockholm-based developer of the wildly popular Minecraft video game for $2.5 billion, as it tries to lure a new and mostly young audience into its mobile world. ~BUSINESS-NEWS-SCHEDULE AT 1500 GMT / 11:00 a.m. ET STOCKHOLM - Microsoft Corp says it will acquire Stockholm-based games developer Mojang and the company's wildly popular Minecraft video game franchise for $2.5 billion. (MOJANG M&A;/MICROSOFT (UPDATE 2), expect by 1600 GMT / 12:00 p.m. ET, by Mia Shanley, 700 words) ~
TAP,US STOCKS-Molson, Altria hit records on brewer merger talk NEW YORK, Sept 15 Talk about further consolidation in the brewing industry was helping lift consumer staple stocks on the S&P; 500, with the largest gainers Altria , in point terms, and Molson Coors, percentage-wise. ~
MS,MOVES-BofA hires Morgan Stanley's China investment banking chairman-Report Sept 15 Bank of America Corp has hired Morgan Stanley's Chairman of China investment banking, Alex To, in a similar role, Bloomberg reported, citing a person familiar with the matter. ~
MYL.A,Epirus, Ranbaxy win India approval for arthritis drug copy Sept 15 Epirus Biopharmaceuticals Inc  said India's drug regulator has approved its copy of a top-selling arthritis treatment, paving the way for its launch in the country early next year. ~
NFLX.O,UPDATE 1-Netflix will focus on ramping up in Europe over next year * CEO Reed Hastings calls for EU to pass net neutrality law   (Adds CEO interview, background) ~Netflix launches in France, partners with third-largest telco PARIS, Sept 15 Netflix launched its video streaming service in France on Monday and teamed up with Bouygues to offer its content on France's third-largest telecom operator's set-top boxes. ~
NEM,PRECIOUS-Gold at 8-month low on fears of more hawkish Fed SINGAPORE, Sept 15 Gold dropped to fresh eight-month lows on Monday on fears that the U.S. Federal Reserve may signal an early interest rate hike at this week's policy meeting, while the strength in the dollar and weak physical demand also weighed on bullion.           FUNDAMENTALS     * Spot gold fell to $1,225.30 an ounce, its lowest since January, early on Monday before steadying at $1,227.70 by 0020 GMT. Last week, the metal dropped 3 percent as the dollar index posted its ninth  ~
NUE,UPDATE 1-ArcelorMittal, Gerdau to sell US joint venture to Nucor Sept 15 ArcelorMittal and Gerdau  said on Monday they were selling their Gallatin Steel U.S. joint venture to Nucor Corp for $770 million. ~ArcelorMittal, Gerdau to sell U.S. joint venture to Nucor BRUSSELS, Sept 15 ArcelorMittal, the world's largest steel maker, and Brazil's Gerdau on Monday announced they would sell their 50-50 joint venture Gallatin Steel to U.S. producer Nucor for $770 million. ~
KO,New Issue-Coca-Cola prices dual tranche deal Ratings                 Aa3 (stable)  (Moody's), AA (stable)(S&P;), ~Horschel wins Tour Championship, $10 million bonus ATLANTA Billy Horschel took the limelight from world number one Rory McIlroy to win the biggest title of his career at the Tour Championship on Sunday, along with FedExCup honors and an eye-popping $10 million bonus. ~
USB,MOVES-U.S. Bank hires four people for private client reserve in Chicago Sept 15 Wealth manager U.S. Bank, a unit of U.S. Bancorp, said it appointed four people for its private client reserve in Chicago. ~
UTX,Pratt says next F-35 engine deals will cut costs by 7-8 percent WASHINGTON Pratt & Whitney, a unit of United Technologies Corp, said its contracts with the Pentagon for the next two batches of engines for the Lockheed Martin Corp F-35 fighter jet will result in combined cost savings of 7 percent to 8 percent. ~UPDATE 1-Pratt says next F-35 engine deals will cut costs by 7-8 pct WASHINGTON, Sept 15 Pratt & Whitney, a unit of United Technologies Corp, said its contracts with the Pentagon for the next two batches of engines for the Lockheed Martin Corp F-35 fighter jet will result in combined cost savings of 7 percent to 8 percent. ~
URBN.O,Urban Outfitters apologizes for Kent State red-splattered sweatshirt CLEVELAND, Sept 15 Teen apparel retailer Urban Outfitters apologized on Monday after criticism for selling a vintage Kent State University sweatshirt that appeared to be splattered with blood-red dye in a look reminiscent of an infamous 1970 campus shooting. ~
WFC,Wells Fargo finds mortgage myths hamper home purchases NEW YORK, Sept 15 Getting a mortgage in the United States may be easier than many borrowers think, according to a survey released Monday by Wells Fargo & Co, the largest U.S. mortgage lender. ~
