ALK,Alaska Air Group posts higher fourth quarter profit Jan 23 Alaska Air Group reported a higher fourth-quarter profit on Thursday, aided by lower fuel costs. ~
AMGN.O,UPDATE 1-Amgen cholesterol drug meets goal of 3rd late stage trial Jan 23 A cholesterol fighter developed by Amgen Inc from a highly promising new class of medicines significantly lowered levels of "bad" LDL cholesterol in a late stage trial in patients unable to tolerate statin drugs, the company said on Thursday. ~Amgen cholesterol drug meets goal of third late stage trial Jan 23 A cholesterol fighter developed by Amgen Inc from a new class of medicines succeeded in significantly lowering levels of "bad" LDL cholesterol in a late stage trial in patients unable to tolerate statin drugs, the company said on Thursday. ~
AAPL.O,Samsung Electronics Q4 profit sags as smartphone growth concern deepens SEOUL, Jan 24 Samsung Electronics Co Ltd  posted its first decline in quarterly profit in two years, hit by a one-off special bonus as well as slowing smartphone sales as it braces for a year of tougher competition with rival Apple Inc. ~Icahn takes another $500 million bite out of Apple SAN FRANCISCO Activist investor Carl Icahn picked up another $500 million of Apple Inc shares on Thursday to take his investment in the iPhone maker to $3.6 billion, while ratcheting up his months-long campaign to pry open the company's cash hoard. ~UPDATE 3-Icahn takes another $500 million bite out of Apple SAN FRANCISCO, Jan 23 Activist investor Carl Icahn picked up another $500 million of Apple Inc  shares on Thursday to take his investment in the iPhone maker to $3.6 billion, while ratcheting up his months-long campaign to pry open the company's cash hoard. ~US STOCKS-Wall St falls as China data trigger selloff in risky assets * Microsoft profit up on strong commercial sales; shares up in extended trade ~Icahn buys another $500 million of Apple shares SAN FRANCISCO, Jan 23 Activist investor Carl Icahn picked up another $500 million of Apple Inc  shares on Thursday, taking his total investment in the iPhone maker to $3.6 billion. ~YOUR MONEY-The cost of being an Apple fan can add up NEW YORK, Jan 23 Apple Inc's Macintosh computer, which celebrates its 30th anniversary on Friday, has attracted many fans who have gone on to buy lots of other devices from the company. ~UPDATE 2-LG Display sees smartphone demand cushioning TV's seasonal Q1 lull * Operating profit 257 bln won vs 238 bln won analyst estimate ~PRESS DIGEST - Wall Street Journal - Jan 23 Jan 23 The following are the top stories in the Wall Street Journal. Reuters has not verified these stories and does not vouch for their accuracy. ~Nikkei climbs to 2-week high on banks, component makers * Nidec, Japan Aviation jump after quarterly results     * Banks in demand as investors seek underperformers      By Dominic Lau     TOKYO, Jan 23 Japan's Nikkei stock average advanced to a two-week high on Thursday, helped by gains in electronics component makers after strong results from Nidec, while some investors sought underperformers in the banking sector.     The Nikkei was up 0.7 percent at 15,925.51 after rising as high as 15,958.58 - edging closer to the 16,000 mark it had  ~
T,UPDATE 2-AT&T; sees fourth-quarter pension related gain of $7.6 bln Jan 22 AT&T; Inc said on Wednesday that it would record a non-cash, pre-tax gain of about $7.6 billion for the fourth quarter from its pensions and post-employment benefit plans, the latest company to see hefty pension related gains from 2013. ~
BA,Boeing, General Dynamics agree to $400 million A-12 settlement WASHINGTON, Jan 23 Boeing Co and General Dynamics Corp have agreed to a $400 million deal to settle the last of a series of legal disputes with the U.S. government over its 1991 decision to cancel the A-12 stealth aircraft program, the Justice Department said on Thursday. ~Boeing hiring in South Carolina as it raises 787 production Boeing Co  is hiring contract workers at its factory in South Carolina as it boosts output of the 787 Dreamliner and seeks to avoid manufacturing issues linked to the production increase, according to people familiar with the situation. ~Boeing hiring in South Carolina as it raises 787 production Jan 22 Boeing Co is hiring contract workers at its factory in South Carolina as it boosts output of the 787 Dreamliner and seeks to avoid manufacturing issues linked to the production increase, according to people familiar with the situation. ~
CAT,SPECIAL REPORT-How Caterpillar got bulldozed in China (Read this story in a PDF: http://link.reuters.com/jys26v) ~
DFS,Discover Financial profit rises 11 pct Jan 23 Credit card issuer Discover Financial Services reported an 11 percent rise in fourth-quarter profit as more consumers used cards to make payments. ~BRIEF-Discover Financial Services shares up 1.6 pct after the bell following results NEW YORK, Jan 23 Discover Financial Services  :  * Shares were up 1.6 percent after the bell following results ~
DOW,BRIEF-Downer EDI says offer for Spotless Group now closed * Confirms that its offer for Spotless was not extended and has now closed. Source text for Eikon: Further company coverage: ~BRIEF-Downer EDI posts FY net profit of $181.5 million * FY total revenue and other income from ordinary activities $7.29 billion , up 6.4 percent ~BRIEF-Downer EDI says ‍offer for Spotless Group extended to 28 August 2017​ * ‍Offer for Spotless Group extended to 7pm on Monday, 28 august 2017​ Source text for Eikon: Further company coverage: ~BRIEF-Downer EDI says Spotless ‍offer extended to Aug 21, 2017​ * Spotless ‍offer extended to 7pm on monday, 21 august 2017​ Source text for Eikon: Further company coverage: ~BRIEF-Downer EDI's takeover offer for Spotless Group extended till 7pm (Sydney time) on Aug. 14 * Unconditional takeover offer for Spotless Group extended until 7:00pm (Sydney time) on Monday, 14 August Source text for Eikon: Further company coverage: (bangalore.newsroom@thomsonreuters.com) ~BRIEF-Downer extends takeover offer for Spotless Group * decided to extend Spotless offer period for one week; offer will now remain open for acceptance until 14 august Source text for Eikon: Further company coverage: ~BRIEF-Downer extends Spotless offer to August 7 2017 * ‍Downer has decided to extend offer for Spotless Group holdings to 7 pm on Monday, 7 august 2017​ Source text for Eikon: Further company coverage: ~BRIEF-Downer EDI's stake in Spotless increases to 80.3 pct * Downer's stake in Spotless increases to 80.3 pct Source text for Eikon: Further company coverage: ~BRIEF- Downer EDI Ltd'S stake in Spotless Group increases to 72% * As Downer's shareholding in Spotless is now over 70%, Downer expects that Spotless will be removed from certain S&P;/ASX market indices ~
EBAY.O,BRIEF-Icahn nominees to eBay board are employees Jonathan Christodoro and Daniel Ninivaggi-eBay Jan 23 eBay Inc :  * Carl Icahn's Nominees to eBay Inc board are icahn enterprises ~DHL, FedEx suspend shipments to Russian customers MOSCOW Express delivery companies DHL and FedEx  said on Thursday they had suspended foreign shipments to individual customers in Russia because of stricter customs procedures, making it harder for internet users to buy goods from abroad. ~US STOCKS-Wall St to open lower after China data, earnings NEW YORK, Jan 23 U.S. stocks were set to open lower on Thursday, after disappointing manufacturing data in China and the latest round of corporate earnings failed to provide investors the impetus to push equities higher. ~US STOCKS-Futures fall with earnings, data on tap NEW YORK, Jan 23 U.S. stock index futures fell on Thursday, ahead of data on the labor and housing markets, along with the latest round of corporate earnings results. ~EBay dismisses Icahn proposal to spin off Paypal Carl Icahn has taken a stake in eBay Inc and is proposing a spin-off of the its fast-growing PayPal division, but the e-commerce giant rebuffed the overture, setting the stage for a potential battle with the activist investor. ~UPDATE 4-EBay dismisses Icahn proposal to spin off Paypal Jan 22 Carl Icahn has taken a stake in eBay Inc  and is proposing a spin-off of the its fast-growing PayPal division, but the e-commerce giant rebuffed the overture, setting the stage for a potential battle with the activist investor. ~BRIEF-Interview-eBay CEO says consulting with Goldman following Icahn proposal Jan 22  * Interview-eBay Inc CEO says consulting with Goldman Sachs Group Inc ~
FDX,DHL, FedEx suspend shipments to Russian customers MOSCOW, Jan 23 Express delivery companies DHL and FedEx said on Thursday they had suspended foreign shipments to individual customers in Russia because of stricter customs procedures, making it harder for internet users to buy goods from abroad. ~
GD,Boeing, General Dynamics agree to $400 million A-12 settlement WASHINGTON, Jan 23 Boeing Co and General Dynamics Corp have agreed to a $400 million deal to settle the last of a series of legal disputes with the U.S. government over its 1991 decision to cancel the A-12 stealth aircraft program, the Justice Department said on Thursday. ~
GE,Oil industry joins world of 3D printing NEWCASTLE, England, Jan 23 General Electric's oil and gas division will start pilot production of 3D printed metal fuel nozzles for its gas turbines in the second half of this year, a major step towards using the technology for mass-manufactured parts in the industry. ~
GM,UPDATE 3-New GM chief vows to stay on course and 'accelerate' DETROIT, Jan 23 General Motors Co's new chief executive, Mary Barra, said on Thursday she has no plans to deviate from predecessor Dan Akerson's strategy as the No. 1 U.S. automaker pushes for profitability everywhere it operates. ~BRIEF-GM CEO Barra says no switch from strategy laid out under predecessor Akerson DETROIT, Jan 23 General Motors Co CEO Mary Barra in interview with reporters at the comnpany's Detroit headquarters:  * CEO Barra says company has keen focus on operating profitably everywhere it ~Toyota retains global auto crown in 2013, sees strong 2014 TOKYO Toyota Motor Corp retained its rank as the world's best-selling automaker last year, beating out rivals General Motors Co and Volkswagen AG for the second year in a row as the weak yen underpinned sales overseas. ~
GS,Carlyle to invest in haircare product maker Vogue NEW YORK, Jan 23 Private equity firm Carlyle Group LP said on Thursday it has agreed to acquire a strategic minority stake in privately held Vogue International, the maker of the Organix Hair Care product line. ~RPT-Judge rules Goldman must face class-action lawsuit by investors NEW YORK, Jan 23 Goldman Sachs Group Inc  must face a class-action lawsuit accusing it of defrauding investors to whom it sold $2 billion of risky debt linked to subprime mortgages that it was betting against before the 2008 financial crisis, a federal judge ruled on Thursday. ~Goldman Sachs places 5 pct of Spain's Almirall at 11.75 eur/share MADRID, Jan 23 Goldman Sachs on Thursday said it had placed a 5 percent stake in Spanish drug maker Almirall  belonging to Grupo Plafin at 11.75 euros per share. ~Goldman places 15.2 mln LEG Immobilien shares at 42.50 eur/shr FRANKFURT, Jan 23 Goldman Sachs has places 15.2 mln shares in German real estate company LEG Immobilien at 42.50 euros ($57.65)apiece, via its Saturea BV holding, the bank said in a statement on Thursday. ~BRIEF-Interview-eBay CEO says consulting with Goldman following Icahn proposal Jan 22  * Interview-eBay Inc CEO says consulting with Goldman Sachs Group Inc ~
HPQ,UPDATE 1-Qualcomm acquires patents from HP to bulk up portfolio Jan 23 Chipmaker Qualcomm Inc acquired a patent portfolio from Hewlett-Packard Co, including those of Palm Inc and its iPaq smartphone, in a move that will bulk up HP's offerings to handset makers and other licensees. ~Qualcomm acquires patent portfolio from HP Jan 23 Chipmaker Qualcomm Inc acquired a patent portfolio from Hewlett-Packard Co, including those of its iPaq smartphone, for an undisclosed amount. ~
IBM,Deals of the day- Mergers and acquisitions (Adds Bharti, Banco Popular, Time Warner, Carlyle, Rosneft, RWE AG, Air France, Tullow Oil, BAE Systems, Autogrill) ~UPDATE 4-Lenovo to buy IBM's low-end server unit for $2.3 bln * Deal seen likely to approved by U.S. foreign investment panel ~CORRECTED-UPDATE 3-Lenovo to buy IBM's low-end server unit for $2.3 bln (Corrects paragraph 9 to describe Reynolds as a partner at the law firm, not head of regulatory practise) ~CORRECTED-UPDATE 1-Lenovo to buy IBM's low-end server business in China's biggest tech M&A; * IBM's unit made $26.4 mln loss after in 12 months ended 2013 ~Lenovo buys IBM's server business in China's biggest IT acquisition BEIJING, Jan 23 Lenovo Group Ltd, the world's largest PC maker, agreed to buy IBM Corp's  low-end server business in a long-awaited deal valued at about $2.3 billion, the biggest-ever tech acquisition by a Chinese company. ~UPDATE 1-Market Chatter-Corporate finance press digest Jan 23 The following corporate finance-related stories were reported by media: ~Market Chatter- Corporate finance press digest Jan 23 The following corporate finance-related stories were reported by media: ~UPDATE 1-China's Lenovo nears deal to buy IBM's server unit -sources Jan 23 Lenovo Group Ltd is nearing an agreement to buy International Business Machines Corp's  low-end server business for $2-2.5 billion, a deal that would help the Chinese company counter the shrinking personal computers market, people familiar with the matter said. ~China's Lenovo nears deal to buy IBM's server unit -source Jan 22 Lenovo Group is close to an agreement to buy International Business Machines Corp's  low-end server business, according to two people who are familiar with the matter. ~
ISRG.O,BRIEF-Intuitive Surgical sees fewer da Vinci sales Jan 23 Intuitive Surgical Inc :  * Sees 2014 procedure growth 9-12 percent  * Sees fewer da Vinci system sales in 2014 than 2013  * Declines to provide 2014 revenue forecast until later in year ~Intuitive Surgical profit tops Street view despite sales decline Intuitive Surgical Inc  on Thursday reported fourth quarter profit that easily exceeded diminished Wall Street expectations despite another steep decline in sales of its high priced da Vinci surgical robot systems. ~Intuitive Surgical profit tops Street view despite sales decline Jan 23 Intuitive Surgical Inc on Thursday reported fourth quarter profit that easily exceeded diminished Wall Street expectations despite another steep decline in sales of its high priced da Vinci surgical robot systems. ~BRIEF-Intuitive Surgical shares up 2.2 pct after the bell following results NEW YORK, Jan 23 Intuitive Surgical Inc :  * Shares were up 2.2 percent after the bell following results ~
JCI,UPDATE 1-China lifts Johnson Controls revenue above estimates Jan 23 Johnson Controls Inc on Thursday reported a fiscal first-quarter profit that met Wall Street expectations and reaffirmed its fiscal 2014 outlook, while sales beat forecasts, helped by higher automobile production, particularly in China. ~Johnson Controls first-quarter revenues top estimates Jan 23 Johnson Controls Inc on Thursday reported a fiscal first-quarter profit that met Wall Street expectations and reaffirmed its fiscal 2014 outlook. ~
JPM,JPMorgan CEO Dimon says government cases were 'unfair' JPMorgan Chase & Co  Chief Executive Officer Jamie Dimon said on Thursday that government legal cases, including those over mortgage securities the company settled for more than $13 billion, were "unfair". ~UPDATE 1-JPMorgan CEO Dimon says government cases were "unfair" Jan 23 JPMorgan Chase & Co Chief Executive Officer Jamie Dimon said on Thursday that government legal cases, including those over mortgage securities the company settled for more than $13 billion, were "unfair". ~JPMorgan CEO Dimon says government cases against company were 'unfair' Jan 23 JPMorgan Chase & Co Chief Executive Officer Jamie Dimon said on television on Thursday that government legal actions that the company settled for more than $13 billion were "unfair." ~
JNPR.N,UPDATE 1-Juniper's profit soars on higher telecom carrier spending Jan 23 Network gear maker Juniper Networks Inc  posted a better-than-expected 59 percent rise in quarterly profit, helped by higher spending by U.S. telecom carriers. ~Juniper Networks profit soars on higher telecom carrier spending Network gear maker Juniper Networks Inc's  quarterly profit rose 59 percent due to higher spending by U.S. telecom carriers. ~Juniper Networks profit soars on higher telecom carrier spending Jan 23 Network gear maker Juniper Networks Inc's  quarterly profit rose 59 percent due to higher spending by U.S. telecom carriers. ~BRIEF-Juniper Networks shares up 3.2 percent after the bell following results NEW YORK, Jan 23 Juniper Networks Inc :  * Shares up 3.2 percent after the bell following results ~
KLAC.O,UPDATE 2-KLA-Tencor's second-quarter revenue meets expectations SAN FRANCISCO, Jan 23 KLA-Tencor Corp  reported higher fiscal second-quarter revenue that met analysts' expectations as chipmakers implementing cutting-edge technology bought more process control tools. ~KLA-Tencor's second-quarter revenue meets expectations SAN FRANCISCO, Jan 23 Chip equipment maker KLA-Tencor Corp reported higher fiscal second-quarter revenue that met analysts' expectations as growing demand for mobile gadgets propelled investments in production capacity. ~
