AGN,Deals of the day- Mergers and acquisitions (Adds Uniprom, Cukurova Holding, Google, Odyssey Investment Kion Group; updates PPL, Allergan) ~Allergan rejects Valeant and Ackman's raised takeover offer The battle for botox maker Allergan Inc heated up on Tuesday as the company officially rejected a sweetened $53 billion takeover offer from Valeant Pharmaceuticals International and activist investor William Ackman. ~UPDATE 2-Allergan rejects Valeant and Ackman's raised takeover offer June 10 The battle for botox maker Allergan Inc  heated up on Tuesday as the company officially rejected a sweetened $53 billion takeover offer from Valeant Pharmaceuticals International and activist investor William Ackman. ~Allergan CEO undaunted by likely long battle with Valeant The chief executive of Allergan Inc said Tuesday he is an "endurance player" who is prepared for a long, drawn-out effort to fend off a hostile takeover attempt by Valeant Pharmaceuticals International Inc and its ally, hedge fund billionaire William Ackman."I'm an endurance player; I climbed Kilmanjaro last year," David Pyott said in a telephone interview, when asked if he was prepared to battle Valeant and Ackman possibly into next year. "I like long slogs and enjoy it; we're plann ~Allergan CEO undaunted by likely long battle with Valeant June 10 The chief executive of Allergan Inc  said Tuesday he is an "endurance player" who is prepared for a long, drawn-out effort to fend off a hostile takeover attempt by Valeant Pharmaceuticals International Inc and its ally, hedge fund billionaire William Ackman. ~BRIEF-U.S. appeals court rules for Novartis, Actavis, Apotex and against Allergan, Duke over patents related to eyelash growth June 10 Novartis AG :  * Actavis PLC apotex inc win reversal of lower court ruling regarding ~BRIEF-Allergan CEO says investors must question Valeant's "mishmash" financial reporting June 10 Allergan:  * Allergan CEO says he's an "endurance player," prepared for long ~Valeant to take bid to shareholders after Allergan rejection Allergan Inc's "inaccurate and misleading statements" and unsupported arguments about Valeant Pharmaceuticals Inc leaves Valeant no choice but to take its $53 billion takeover offer directly to Allergan shareholders, Valeant said on Tuesday. ~Valeant to take bid to shareholders after Allergan rejection June 10 Allergan Inc's "inaccurate and misleading statements" and unsupported arguments about Valeant Pharmaceuticals Inc leaves Valeant no choice but to take its $53 billion takeover offer directly to Allergan shareholders, Valeant said on Tuesday. ~
GOOGL.O,Google to buy satellite company Skybox Imaging for $500 million SAN FRANCISCO Google Inc   said on Tuesday it is acquiring satellite company Skybox Imaging for $500 million in cash, the Internet company's second high-profile acquisition of an aerospace company this year. ~UPDATE 1-Google to buy satellite company Skybox Imaging for $500 mln SAN FRANCISCO, June 10 Google Inc   said on Tuesday it is acquiring satellite company Skybox Imaging for $500 million in cash, the Internet company's second high-profile acquisition of an aerospace company this year. ~Google to buy satellite company Skybox Imaging for $500 million SAN FRANCISCO, June 10 Google Inc    said on Tuesday that it is acquiring satellite company Skybox Imaging for $500 million in cash. ~
GOOG.O,Google to buy satellite company Skybox Imaging for $500 million SAN FRANCISCO Google Inc   said on Tuesday it is acquiring satellite company Skybox Imaging for $500 million in cash, the Internet company's second high-profile acquisition of an aerospace company this year. ~UPDATE 1-Google to buy satellite company Skybox Imaging for $500 mln SAN FRANCISCO, June 10 Google Inc   said on Tuesday it is acquiring satellite company Skybox Imaging for $500 million in cash, the Internet company's second high-profile acquisition of an aerospace company this year. ~Google to buy satellite company Skybox Imaging for $500 million SAN FRANCISCO, June 10 Google Inc    said on Tuesday that it is acquiring satellite company Skybox Imaging for $500 million in cash. ~
AAPL.O,UPDATE 1-Synaptics to buy iPhone display chipmaker for $475 mln * To buy Renesas SP Drivers Inc from Renesas Electronics, Sharp ~EU to launch probe into Apple's Irish tax deal: report DUBLIN The European Commission will launch a formal investigation on Wednesday into Apple Inc's  tax arrangements in Ireland, Irish state broadcaster RTE reported, without naming its source. ~UPDATE 3-EU to launch probe into Apple's Irish tax deal -report DUBLIN, June 10 The European Commission will launch a formal investigation on Wednesday into Apple Inc's  tax arrangements in Ireland, Irish state broadcaster RTE reported, without naming its source. ~RPT-UPDATE 2-EU to launch formal investigation into Apple's Irish tax deal - report DUBLIN, June 10 The European Commission will launch a formal investigation on Wednesday into Apple Inc's  tax arrangements in Ireland, Irish state broadcaster RTE reported, without naming its source. ~Russia arrests two hackers it says hijacked Apple devices MOSCOW, June 10 Russian police have arrested two alleged hackers they say extorted money from users of Apple  devices by blocking them and demanding payment to free them up again. ~EU to launch formal investigation into Apple's Irish tax deal - TV DUBLIN, June 10 The European Commission will launch a formal investigation on Wednesday into Apple Inc's  tax arrangements in Ireland, Irish state broadcaster RTE reported, without naming its source. ~
T,AT&T; settles U.S. lawsuit with broadcaster Al Jazeera June 9 AT&T; Inc settled a lawsuit over its refusal to carry the U.S. news channel of Qatar-based broadcaster Al Jazeera, according to records in Delaware's Court of Chancery. ~
BRKa.N,Gupta makes last-ditch bid to U.S. Supreme Court to avoid prison NEW YORK, June 10 Former Goldman Sachs Group Inc  director Rajat Gupta asked the U.S. Supreme Court to let him stay free while he appeals his insider trading conviction, in a last-ditch bid to avoid beginning his two-year prison term on June 17. ~
BLK,BlackRock expands low-cost 'Core' series with 10 ETFs NEW YORK, June 10 BlackRock Inc, the largest U.S. provider of exchange-traded funds, is expanding its lineup of low-cost ETFs with 10 equity and fixed-income funds that focus on areas such as dividend growth and value, and add exposures such as European and Pacific region stocks. ~
DAL,United Airlines to tie frequent-flier miles to ticket price in 2015 June 10 United Airlines, moving to sweeten awards for its biggest spenders, plans to base its frequent-flier rewards program on the ticket-price paid rather than the distance traveled, in a boon especially to the business traveler. ~
EQT,EQT to announce listing of food operator SSP next week - sources LONDON, June 10 Swedish private equity firm EQT is planning to announce a London initial public offering (IPO) of food outlet operator SSP next week, two sources familiar with the matter said on Tuesday. ~
F,Ford to keep Fiesta production in Germany after cost-saving deal * Ford plans to cut $400 mln on Fiesta production in 2017-21 ~China vehicle sales rise 8.5 pct in May BEIJING, June 10 China's vehicle sales increased 8.5 percent year-on-year in May, an industry association said on Tuesday, as foreign automakers such as General Motors Co  and Ford Motor Co continue to post robust growth. ~
GM,UPDATE 2-Target appoints GM exec to help oversee security efforts June 10 U.S. retailer Target Corp named General Motors Co executive Brad Maiorino to the newly created position of chief information security officer, as part of its plan to tighten its security following a massive data breach last year. ~Seven out of 10 North American trucks will be aluminum bodied by 2025 -study NEW YORK, June 10 Most new pickup trucks produced in North America will use aluminum instead of steel for lighter bodies that boost fuel efficiency, driving consumption of the metal by the region's automotive sector up 40 percent by 2025, according to a study released by Ducker Worldwide. ~GM plans no more dismissals linked to switch recall: CEO DETROIT General Motors Co does not plan more employee dismissals relating to the company's handling of a defective ignition switch linked to at least 13 deaths, Chief Executive Mary Barra said on Tuesday. ~UPDATE 2-GM plans no more dismissals linked to switch recall -CEO DETROIT, June 10 General Motors Co does not plan more employee dismissals relating to the company's handling of a defective ignition switch linked to at least 13 deaths, Chief Executive Mary Barra said on Tuesday. ~BRIEF-GM chairman says board has confidence in CEO Barra and her team to lead company DETROIT, June 10 General Motors Co annual meeting:  * Chairman Solso said board has complete confidence in barra and her team  * CEO Barra says in near term there will be a "few more recalls" ~REFILED-No more dismissals planned relating to GM switch recall, Barra says DETROIT, June 10 General Motors Co Chief Executive Mary Barra said on Tuesday that no more employee dismissals were planned relating to the company's handling of a defective ignition switch linked to at least 13 deaths. ~BRIEF-CEO Barra: GM's internal report on switch recall fulcrum for change DETROIT, June 10 General Motors Co Mary Barra speaking ahead of annual meeting with media:  * CEO Barra says there is no new information as it relates to ignition switch ~Victims of 2004 Ion crash sue GM to reopen case Victims of the crash of a Saturn Ion in 2004 have filed a lawsuit against General Motors Co to reopen a settlement and accusing the automaker of fraud. ~China vehicle sales rise 8.5 pct in May BEIJING, June 10 China's vehicle sales increased 8.5 percent year-on-year in May, an industry association said on Tuesday, as foreign automakers such as General Motors Co  and Ford Motor Co continue to post robust growth. ~
GS,Gupta makes last-ditch bid to U.S. Supreme Court to avoid prison NEW YORK Former Goldman Sachs Group Inc  director Rajat Gupta asked the U.S. Supreme Court to let him stay free while he appeals his insider trading conviction, in a last-ditch bid to avoid beginning his two-year prison term on June 17. ~Gupta makes last-ditch bid to U.S. Supreme Court to avoid prison NEW YORK, June 10 Former Goldman Sachs Group Inc  director Rajat Gupta asked the U.S. Supreme Court to let him stay free while he appeals his insider trading conviction, in a last-ditch bid to avoid beginning his two-year prison term on June 17. ~
IBM,IBM overtakes Trend Micro as No. 3 security software maker BOSTON, June 10 IBM overtook Japan's Trend Micro Inc to become the world's No. 3 provider of security software last year, after acquiring cybersecurity firm Trusteer, according to market share data released on Tuesday by Gartner. ~
LMT,Lockheed sees next U.S. F-35 fighter contract early this summer WASHINGTON Lockheed Martin Corp expects to sign a contract with the U.S. government early this summer for 43 more F-35 fighter jets, but the deal is unlikely to match price reductions seen on the last few contracts, a top company executive said Monday. ~UPDATE 1-Lockheed sees next U.S. F-35 fighter contract early this summer (Adds comments on possible Canadian order, software; in paragraphs 10-13) ~Lockheed eyes foreign, non-defense work as Pentagon budget drops WASHINGTON, June 9 Lockheed Martin Corp  on Monday said it was banking on international and non-defense orders to offset a drop in U.S. military spending, with Pentagon orders accounting for a low 61 percent of overall sales in 2013 and trending lower. ~
MET,Metlife to buy back up to $1 billion shares June 10 Insurer Metlife Inc said it would buy back up to $1 billion of its common stock. ~
MSFT.O,Microsoft to cooperate with Qihoo 360 amid security concerns in China -Xinhua BEIJING, June 10 Microsoft Corp will work with Chinese Internet security specialist Qihoo 360 Technology Co on mobile Internet and artificial intelligence technology, state media reported, as the U.S. software giant fights security concerns in the country. ~
MON,Index Ventures raises 400 million euros for new early-stage fund SAN FRANCISCO, June 10 Index Ventures, the firm known for backing online video-chat service Skype at its early stages, said on Tuesday that it had raised 400 million euros for a venture fund focused on early-stage investments. ~
MS,Morgan Stanley CEO expects commodities sales to close in 3rd qtr NEW YORK, June 10 Morgan Stanley will "probably" close sales of two physical commodities businesses in the third quarter, Chief Executive James Gorman said on Tuesday. ~MOVES-JPMorgan, E*Trade, Macquarie Securities, Standish, Morningstar June 10 The following financial services industry appointments were announced on Tuesday. To inform us of other job changes, email to moves@thomsonreuters.com. ~
NFLX.O,UPDATE 1-Netflix to stop messages blaming Verizon for slow streaming LOS ANGELES/NEW YORK, June 9 Netflix Inc  said on Monday it will stop sending messages that blame Verizon Inc's broadband service for slow delivery of its TV shows and movies, a move that may defuse tension between the two over Internet congestion. ~
ORCL.N,Oracle's Ellison debuts technology for faster databases REDWOOD CITY, California, June 10 Oracle Corp  Chief Executive Larry Ellison on Tuesday launched "in-memory" technology for speeding up data analysis in a bid to beef up demand for his company's software products. ~
PPL,UPDATE 2-PPL, Riverstone to combine generation units into new company * PPL shares rise 3 pct   (Adds details, background, shares, analyst comments) ~CORRECTED-Deals of the day- Mergers and acquisitions (Corrects PPL Corp item to say Riverstone is not buying its energy unit, but the two companies are combining their merchant power generation businesses) ~CORRECTED-UPDATE 1-PPL, Riverstone to combine merchant power businesses (Corrects headline and paragraph 1 to say Riverstone is not buying PPL'S energy unit. The two companies are combining their merchant power generation businesses. Removes reference to Reverse Morris Trust) ~PPL to spin off merchant power generation business June 10 PPL Corp and Riverstone Holdings LLC on Monday said they would combine their merchant power generation businesses into a new stand-alone, publicly traded independent power producer. ~
TGT,UPDATE 2-Target appoints GM exec to help oversee security efforts June 10 U.S. retailer Target Corp named General Motors Co executive Brad Maiorino to the newly created position of chief information security officer, as part of its plan to tighten its security following a massive data breach last year. ~Target names Brad Maiorino as chief information security officer June 10 Retailer Target Corp, which is recovering from a massive data breach, named General Motors Co  executive Brad Maiorino to the newly created position of chief information security officer. ~
TWX,CORRECTED-Deals of the day- Mergers and acquisitions (Corrects PPL Corp item to say Riverstone is not buying its energy unit, but the two companies are combining their merchant power generation businesses) ~
TSN,CORRECTED-US STOCKS-Wall St edges up, lifted by mergers, acquisitions (Fixes Rex Macey's job title and firm's name, which both changed recently, to chief allocation officer at Wilmington Trust Investment Advisors from chief investment officer at Wilmington Trust, in this U.S. stock report published June 9) ~
WMT,Five Below names Walmart.com CEO as president June 10 Five Below Inc named Walmart.com's chief executive, Joel Anderson, as the teen discount retailer's president. ~
WFC,UPDATE 1-Wells Fargo loses bid to avoid lawsuit over FHA mortgage loans WASHINGTON, June 10 A U.S. appeals court on Tuesday rejected Wells Fargo & Co's attempt to avoid litigation over government allegations of misconduct related to home mortgage loans issued by the Federal Housing Administration. ~Wells Fargo loses bid to avoid lawsuit over FHA mortgage loans WASHINGTON, June 10 A U.S. appeals court on Tuesday rejected Wells Fargo & Co's attempt to avoid litigation over government allegations of misconduct related to home mortgage loans issued by the Federal Housing Administration. ~BRIEF-Wells Fargo CFO says new mortgage rules are "constraining factor" June 10 Wells Fargo & Co chief financial officer John Shrewsberry said at an investor conference on Tuesday:  * new mortgage rules are "constraining factor" for less creditworthy ~DIARY-U.S. MEETINGS/WEEK AHEAD THOMSON REUTERS, June 10,2014 - Corporate Meetings for US companies for Week ahead.         S&P; 500 Earnings - Weekly           S&P; 500 Earnings - Day Ahead        Non S&P; 500 - Weekly               Non S&P; 500 - Day Ahead             ConferenceCall/Webcast - Weekly    ConferenceCall/Webcast - Day        S&P; 500 Earnings - Monthly           Meetings - Day Ahead                Economic Indicators                  Dividends                           Daily earnings hits & misses         Federal Res ~
