GOOGL.O,UPDATE 1-U.S. judge concerned Google antitrust lawsuit too vague (Rewrites throughout to add judge orders more details in antitrust lawsuit against Google) ~U.S. judge says concerned about Google antitrust lawsuit SAN JOSE, Calif., Dec 18 A U.S. judge said on Thursday she would require consumers suing Google to submit additional factual details in order for an antitrust lawsuit over Android to proceed. ~Google looks to head off U.S. antitrust lawsuit over Android SAN JOSE, Calif. Google will try to persuade a U.S. judge on Thursday to dismiss an antitrust lawsuit over its Android smartphone operating system, as the Internet search company faces increased regulatory pressure from European authorities. ~Google looks to head off U.S. antitrust lawsuit over Android SAN JOSE, Calif., Dec 18 Google will try to persuade a U.S. judge on Thursday to dismiss an antitrust lawsuit over its Android smartphone operating system, as the Internet search company faces increased regulatory pressure from European authorities. ~
GOOG.O,UPDATE 1-U.S. judge concerned Google antitrust lawsuit too vague (Rewrites throughout to add judge orders more details in antitrust lawsuit against Google) ~U.S. judge says concerned about Google antitrust lawsuit SAN JOSE, Calif., Dec 18 A U.S. judge said on Thursday she would require consumers suing Google to submit additional factual details in order for an antitrust lawsuit over Android to proceed. ~Google looks to head off U.S. antitrust lawsuit over Android SAN JOSE, Calif. Google will try to persuade a U.S. judge on Thursday to dismiss an antitrust lawsuit over its Android smartphone operating system, as the Internet search company faces increased regulatory pressure from European authorities. ~Google looks to head off U.S. antitrust lawsuit over Android SAN JOSE, Calif., Dec 18 Google will try to persuade a U.S. judge on Thursday to dismiss an antitrust lawsuit over its Android smartphone operating system, as the Internet search company faces increased regulatory pressure from European authorities. ~
AAPL.O,Chinese shopping 'agents' cash in on Russian currency slide SHANGHAI In Blagoveshchensk on Russia's side of the Chinese border, Mou Jiani has turned her home into a warehouse, stocking up on Apple Inc  iPhones, handbags and milk powder to sell back home as Chinese shoppers take advantage of the rouble's slide. ~Chinese shopping "agents" cash in on Russian currency slide SHANGHAI, Dec 18 In Blagoveshchensk on Russia's side of the Chinese border, Mou Jiani has turned her home into a warehouse, stocking up on Apple Inc iPhones, handbags and milk powder to sell back home as Chinese shoppers take advantage of the rouble's slide. ~
ADM,Olam's cocoa purchase raises supply, price volatility concerns NEW YORK Olam's $1.3 billion deal to buy rival Archer Daniels Midland's cocoa processing business may reduce liquidity in the niche cocoa bean trade, raising concerns about volatile prices and a potential shake-up of customer relationships. ~
CVX,UPDATE 9-Oil tumbles after brief rebound; Brent back below $60 * Brent, U.S. crude fall over $2 a barrel after Wednesday rally ~
CL,UPDATE 2-France fines household product firms $1.2 bln for price fixing PARIS, Dec 18 The French competition authority slapped fines worth 951 million euros ($1.2 billion) on household goods makers on Thursday over price fixing in supermarkets between 2003 and 2006. ~
CAG,UPDATE 2-ConAgra says recovery in private-label business to take longer * Sees private-label profit recovery in year ending May 2016 ~ConAgra Foods quarterly sales fall 2 percent Dec 18 ConAgra Foods Inc reported a 2 percent fall in quarterly net sales, due to weak demand for branded foods such as Hunt's ketchup and Bertolli pastas and frozen meals. ~
DD,UPDATE 1-DuPont to take $315 mln restructuring charge in Q4 Dec 18 DuPont said it will record a pre-tax charge of about $315 million in the fourth quarter, related to the spin-off of its performance chemical business and other restructuring measures. ~DuPont to take $315 mln restructuring charge in Q4 Dec 18 DuPont said it will take a record a pre-tax charge of about $315 million in the fourth quarter related to the spin-off of its performance chemical business and other restructuring measures. ~UPDATE 3-China approves delayed GMO imports as U.S. ties warm * But bottleneck to prevent further approvals   (Recasts, adds context, analyst comments) ~
XOM,Exxon Mobil says strikes more shale oil, gas again in Argentine region BUENOS AIRES, Dec 18 Exxon Mobil has struck non-conventional oil and gas at a second well in Argentina's Neuquen province, the company said on Thursday, referring to a region that sits atop Vaca Muerta, one of the world's largest shale resources. ~
F,UPDATE 1-Ford expands Takata driver-side air bag recall in U.S. (Adds expanded recall actions by other automakers in paragraph 4) ~Ford expands Takata driver-side airbag recall in U.S. DETROIT, Dec 18 Ford Motor Co on Thursday expanded the recall of older-model Mustang cars, that have driver-side Takata airbags with inflators, to include about 502,500 vehicles. ~Ford shuts doors of Belgium's Genk plant GENK, Belgium Ford Motor Company  produced the last car at its plant in Genk, Belgium, on Thursday, closing the site which produced some 14 million vehicles over the past 50 years. ~Ford shuts doors of Belgium's Genk plant GENK, Belgium, Dec 18 Ford Motor Company  produced the last car at its plant in Genk, Belgium, on Thursday, closing the site which produced some 14 million vehicles over the past 50 years. ~
GPS,China's JD.com to sell Gap clothing, vying with Alibaba to woo Western brands BEIJING, Dec 18 China's JD.com Inc has partnered Gap Inc to sell the U.S. clothing retailer's apparel online in China, as the Beijing-based e-commerce company goes head to head with Alibaba Group Holding Ltd to woo big foreign fashion names. ~
GE,GE to launch breakdancing documentary for streaming devices Dec 18 U.S. industrial conglomerate General Electric Co plans to release its first feature film through video streaming devices like Roku and Apple TV in a marketing effort that raises the bar for sponsored content. ~
GS,Atlantia investor group Sintonia dissolves pact MILAN, Dec 18 Investors in Sintonia have agreed to dissolve a shareholder pact controlling 45.6 percent of Atlantia by end-June, taking direct control of their stakes in the Italian motorway and airport operator, Atlantia said on Thursday. ~
IBM,U.S. judge says to likely vacate insider trading guilty pleas over IBM deal NEW YORK A U.S. judge said Thursday he would likely vacate the guilty pleas of four men accused of engaging in an insider trading scheme ahead of an IBM Corp deal, as fallout continued from an appellate ruling curtailing authorities' abilities to pursue such cases. ~U.S. judge says to likely vacate insider trading guilty pleas over IBM deal NEW YORK, Dec 18 A U.S. judge said Thursday he would likely vacate the guilty pleas of four men accused of engaging in an insider trading scheme ahead of an IBM Corp  deal, as fallout continued from an appellate ruling curtailing authorities' abilities to pursue such cases. ~IBM says cloud business enjoying 'breakthrough year' LONDON IBM aims to expand the number of data centers it offers clients around the world by 25 percent to meet fast-rising demand for internet-based services, after what a company executive said has been a "breakthrough year" in 2014 for its cloud computing business. ~REFILE-IBM says cloud business enjoying "breakthrough year" LONDON, Dec 17 IBM aims to expand the number of data centres it offers clients around the world by 25 percent to meet fast-rising demand for internet-based services, after what a company executive said has been a "breakthrough year" in 2014 for its cloud computing business. ~
K,UPDATE 1-Kellogg outbids Abraaj for third time in race for Egypt's Bisco CAIRO, Dec 18 Breakfast cereal maker Kellogg Co  has again raised its bid for Egyptian snack maker Bisco Misr, outbidding private equity group Abraaj for the third time and snatching the lead in a $140 million takeover battle. ~Kellogg outbids Abraaj for Egypt's Bisco Misr again CAIRO, Dec 18 Kellogg has raised its bid for Egyptian snack maker Bisco Misr to 86.36 Egyptian pounds per share, topping a rival offer from the UAE's Abraaj Investment Management by two percent. ~
LMT,UPDATE 3-S.Korea balks as U.S. picks Japan, Australia to service F-35s in Asia WASHINGTON/SEOUL, Dec 18 South Korea said on Thursday it will not send its F-35 fleet to Japan for heavy airframe maintenance, one of the two Asian hubs chosen by the United States to service the Lockheed Martin Corp  stealth fighter. ~S.Korea won't conduct F-35 fighter maintenance in Japan - official SEOUL, Dec 18 South Korea will not conduct maintenance of its new fleet of Lockheed Martin Corp  F-35 fighters in Japan, a South Korean official said on Thursday, despite a new deal by the Pentagon to service the stealth jets in Asia. ~
NKE,UPDATE 1-Nike flags slowing growth in western Europe, emerging markets Dec 18 Nike Inc's futures orders rose at its slowest pace in four quarters, indicating weakening demand for the sportswear maker's products in emerging markets and western Europe. ~CORRECTED-Nike's future orders growth rate slows Dec 18 Nike Inc said future orders, a indicator of growth, increased 11 percent in the latest quarter, the slowest rate in four quarters and lower than market estimates. ~
ORCL.N,US STOCKS-Wall St has best 2-day gain since 2011 on Fed optimism * Indexes up: Dow 2.4 pct, S&P; 2.4 pct, Nasdaq 2.2 pct   (Updates to close) ~US STOCKS-Wall St up more than 1 pct for 2nd day; tech leads * Indexes up: Dow 1.6 pct, S&P; 1.7 pct, Nasdaq 1.8 pct   (Updates to late afternoon) ~US STOCKS-Wall St gains sharply for 2nd day; tech shares lead * Indexes up: Dow 1.7 pct, S&P; 1.6 pct, Nasdaq 1.6 pct   (Updates to midday) ~US STOCKS-Wall St climbs as tech shares lead * Indexes up: Dow 1.19 pct, S&P; 1.2 pct, Nasdaq 1.33 pct   (Adds Philly Fed data) ~US STOCKS-Wall St climbs on oil boost in wake of Fed statement * Indexes up: Dow 1.3 pct, S&P; 1.34 pct, Nasdaq 1.33 pct   (Updates to open, adds Markit data) ~US STOCKS-Wall St to rise in wake of Fed statement as oil climbs * Futures up: Dow 221 pts, S&P; 25.75 pts, Nasdaq 57.25 pts   (Adds comments, data) ~US STOCKS-Futures climb as oil climbs; initial claims due * Futures up: Dow 192 pts, S&P; 23 pts, Nasdaq 57 pts   (Adds premarket actives) ~US STOCKS-Futures climb as oil rebounds; data on tap NEW YORK, Dec 18 U.S. stock index futures surged on Thursday, putting the S&P; 500 on track to extend gains from the prior session, as oil prices showed hints of stabilizing and ahead of data on the labor market. ~UPDATE 2-Oracle revenue rises 3.5 pct on strong growth in cloud Dec 17 Oracle Corp reported a 3.5 percent increase in quarterly revenue on Wednesday, beating Wall Street's expectations, as sales at its closely watched cloud services business rose 45 percent. ~
RHT,UPDATE 2-Linux distributor Red Hat raises full-year profit forecast * Sees full-year adj EPS $1.57-$1.58 vs prev view $1.53-$1.55 ~Linux distributor Red Hat's revenue up 15 pct on subscription growth Dec 18 Red Hat Inc, the world's largest commercial distributor of the Linux operating system, posted a 15 percent rise in quarterly revenue, helped by strong growth in subscriptions. ~
STT,Ex-State Street executives to appeal SEC ruling in crisis-era case WASHINGTON Attorneys for two former State Street Corp executives plan to file an appeal after the U.S. Securities and Exchange Commission this week partially reversed a judge's decision, ruling they mislead investors in a fund exposed to subprime mortgages. ~Ex-State Street executives to appeal SEC ruling in crisis-era case WASHINGTON, Dec 18 Attorneys for two former State Street Corp executives plan to file an appeal after the U.S. Securities and Exchange Commission this week partially reversed a judge's decision, ruling they mislead investors in a fund exposed to subprime mortgages. ~RPT - INSIGHT-Green bonds sell big in 2014 as finance bids to help climate Dec 18 A "green" bond market has taken root this year, with municipalities and corporations issuing new environmentally-focused bonds and money managers jumping in to buy them. ~MOVES-State Street appoints Wai Kwong Seck to its management committee Dec 18 State Street Corp, the world's second-largest standalone custody bank, appointed Wai Kwong Seck to its management committee, the company's senior-most strategy and policy making group. ~Green bonds sell big in 2014 as finance bids to help climate A "green" bond market has taken root this year, with municipalities and corporations issuing new environmentally-focused bonds and money managers jumping in to buy them. ~INSIGHT-Green bonds sell big in 2014 as finance bids to help climate Dec 18 A "green" bond market has taken root this year, with municipalities and corporations issuing new environmentally-focused bonds and money managers jumping in to buy them. ~
USB,U.S. Bancorp unit settles lawsuit over role as trustee NEW YORK U.S. Bank has agreed to pay $6 million to settle an investor lawsuit that accused the U.S. Bancorp unit of violating its duties as a trustee for mortgage-backed securities that were sold by Bear Stearns before the 2008 financial crisis. ~U.S. Bancorp unit settles lawsuit over role as trustee NEW YORK, Dec 18 U.S. Bank has agreed to pay $6 million to settle an investor lawsuit that accused the U.S. Bancorp unit of violating its duties as a trustee for mortgage-backed securities that were sold by Bear Stearns before the 2008 financial crisis. ~
WFC,UPDATE 1-Two Wells Fargo units to pay $1.5 mln for anti-money laundering lapses -FINRA Dec 18 Two brokerage units of Wells Fargo & Co  must pay a joint $1.5 million fine for failing to comply with anti-money laundering regulations by not verifying 220,000 new accounts during a nine-year period, the Financial Industry Regulatory Authority (FINRA) said on Thursday. ~
XRX,Xerox to sell IT outsourcing arm to France's Atos for $1.05 bln Dec 18 Xerox Corp said it agreed to sell its IT outsourcing (ITO) arm to French IT services firm Atos SE  for $1.05 billion. ~
