LMT,RPT-UPDATE 2-Lockheed sees relief for defense spending after 2014 'trough' WASHINGTON, Jan 23 Lockheed Martin Corp, maker of F-35 fighter jets, satellites and warships, on Thursday forecast higher earnings in 2014 after charges linked to U.S. defense budget cuts and workforce reductions depressed earnings in the fourth quarter. ~Exclusive: Pentagon report faults F-35 on software, reliability WASHINGTON A new U.S. Defense Department report warns that ongoing software, maintenance and reliability problems with Lockheed Martin Corp's F-35 stealth fighter could delay the Marine Corps' plans to start using its F-35 jets by mid-2015. ~Lockheed sees backlog remaining above $80 billion in 2014 WASHINGTON Lockheed Martin Corp expects its backlog to remain above $80 billion in 2014 after it reached a record level of $82.6 billion last year, Chief Financial Officer Bruce Tanner told analysts on Thursday. ~Lockheed sees backlog remaining above $80 billion in 2014 WASHINGTON, Jan 23 Lockheed Martin Corp  expects its backlog to remain above $80 billion in 2014 after it reached a record level of $82.6 billion last year, Chief Financial Officer Bruce Tanner told analysts on Thursday. ~RPT-UPDATE 2-Lockheed sees relief for defense spending after 2014 'trough' WASHINGTON, Jan 23 Lockheed Martin Corp, maker of F-35 fighter jets, satellites and warships, on Thursday forecast higher earnings in 2014 after charges linked to U.S. defense budget cuts and workforce reductions depressed earnings in the fourth quarter. ~Britain may order 14 F-35 jets as early as next week: sources LONDON Britain may announce an order for 14 Lockheed Martin-built F-35 super-stealth jets as early as next week, three sources familiar with the talks told Reuters. ~UPDATE 1-Britain may order 14 F-35 jets as early as next week-sources LONDON, Jan 23 Britain may announce an order for 14 Lockheed Martin-built F-35 super-stealth jets as early as next week, three sources familiar with the talks told Reuters. ~Britain may order 14 F-35 jets as early as next week-sources LONDON, Jan 23 Britain may announce an order for 14 Lockheed Martin-built F-35 super-stealth jets as early as next week, three sources familiar with the talks told Reuters. ~Lockheed eyes 2014 as 'trough' for U.S. defense spending WASHINGTON Lockheed Martin Corp  Chief Financial Officer Bruce Tanner said on Thursday he was hopeful that 2014 would mark a "trough," or "bottoming out," in U.S. military spending, with recent budget agreements paving the way for a more stable outlook going forward. ~
MCD,UPDATE 4-McDonald's gets fewer visits in quarter, expects weak January Jan 23 McDonald's Corp reported weaker-than-expected quarterly sales at established restaurants on Thursday as fewer diners frequented the fast-food chain, and warned that sales would again fall short of analysts' expectations in January. ~MARKET PULSE-Herbalife, Santander Consumer, Fusion-io, Silicom (For more market insights, including options activity, click on  ; for the Day Ahead newsletter http://link.reuters.com/mex49s;  for the Morning News Call newsletter, http://link.reuters.com/nex49s)  U.S. stocks fell on Thursday, after disappointing manufacturing data in China and discouraging earnings reports from bellwether names such as McDonald's Corp. The Dow Jones industrial average  was down 1.12 percent at 16,190.23, the S&P; 500  was down 1.05 percent at 1,825.4 and the Nasdaq Composite  ~McDonald's global comparable sales decline Jan 23 McDonald's Corp's global sales at established restaurants missed analysts' expectations, hurt by fewer customers visits partly due to severe winter weather in the United States. ~BRIEF-McDonald's down 1 pct in premarket after results NEW YORK, Jan 23 McDonald's Corp :  * Shares down 1 percent in premarket trading after results ~
MCK,UPDATE 1-McKesson wins deal for 75 pct stake in Celesio * McKesson say to enter into domination agreement with Celesio ~McKesson gets 75 pct in Celesio as part of fresh takeover offer FRANKFURT, Jan 23 U.S. drugs distributor McKesson said on Thursday it would make a fresh takeover offer for German peer Celesio after winning support from Celesio's two largest shareholders, German investment group Haniel and U.S. hedge fund Elliott. ~Deals of the day- Mergers and acquisitions (Adds Bharti, Banco Popular, Time Warner, Carlyle, Rosneft, RWE AG, Air France, Tullow Oil, BAE Systems, Autogrill) ~UPDATE 1-Celesio shareholder on mission to salvage takeover -sources * Price under discussion is 23.50 euros per share -sources ~Haniel offers Elliott 23.50 eur/shr for Celesio stock-sources FRANKFURT, Jan 23 The majority shareholder behind German drugs distributor Celesio has offered 23.50 euros apiece for Celesio shares held by hedge fund Elliott, as part of a fresh attempt to secure the sale to U.S. drugs wholesaler group McKesson, three people familiar with the talks told Reuters. ~Haniel in bid to boost Celesio stake to sell to McKesson-source FRANKFURT, Jan 23 The majority shareholder behind German drugs distributor Celesio is in talks to buy the shares in Celesio held by hedge fund Elliott as part of a fresh attempt to sell the company to U.S. drugs wholesaler group McKesson, a person familiar with the talks told Reuters. ~
MSFT.O,UPDATE 3-Microsoft profit beats forecasts, no word on new CEO SEATTLE, Jan 23 Microsoft Corp posted a bigger-than-expected quarterly profit on Thursday, boosted by strong sales of its Office software to businesses, a solid holiday season for its new Xbox game console and Surface tablets, and a slightly lower tax bill. ~US STOCKS-Wall St falls as China data trigger selloff in risky assets * Microsoft profit up on strong commercial sales; shares up in extended trade ~Microsoft profit up slightly on strong commercial sales SEATTLE, Jan 23 Microsoft Corp said on Thursday fiscal second-quarter profit rose 3 percent, as strong sales of its Office software to businesses offset another weak quarter for its flagship Windows system, and as consumers increasingly favor tablets over personal computers. ~BRIEF-Microsoft shares up 5.5 pct after the bell following results NEW YORK, Jan 23 Microsoft Corp :  * Shares up 2.7 percent after the bell following results  * Shares add to after-hours gain; last up 5.5 percent ~Nokia sets sights on reviving wireless network sales HELSINKI Nokia has reported a steep fall in sales at its network equipment division, raising concerns about growth prospects for what will be its primary operation after selling its former flagship phone business to Microsoft. ~UPDATE 3-Nokia sets sights on reviving wireless network sales * Sales in rump NSN network business fall more than expected ~.   ~Nokia   ~CORRECTED-Nokia network sales fall 22 percent (Corrects operating margin forecast in the third paragraph) ~
MS,Morgan Stanley CEO Gorman gets $4.9 million stock award -filing NEW YORK, Jan 23 Morgan Stanley Chief Executive James Gorman received a $4.9 million stock bonus for his performance in 2013, according to a regulatory filing and based on the bank's closing share price on Thursday. ~Morgan Stanley pressing $2 bln Puerto Rico financing -sources NEW YORK, Jan 22 Morgan Stanley, rebuffed late last year by Puerto Rico officials over an offer to arrange a high-cost loan of up to $2 billion for the cash-strapped commonwealth, is now trying to pique investor interest in backing the idea, according to people briefed on the matter. ~
NFLX.O,Analysis: New shows, customer gains give Netflix muscle to hike prices LOS ANGELES Netflix Inc, riding high after another strong earnings report, is in better shape to raise prices for new U.S. customers to its movie and TV streaming service than it was in 2011, when a price hike sent its stock into a downward spiral. ~US STOCKS-Wall St extends losses on China data, earnings; VIX jumps NEW YORK, Jan 23 U.S stocks fell on Thursday, with the selloff accelerating in afternoon trading, hurt by disappointing manufacturing data in China and a mixed bag of U.S. corporate earnings. ~Digital brands woo Sundance filmmakers with new platforms PARK CITY, Utah When newcomer filmmaker Cutter Hodierne won the Sundance Film Festival special jury prize for his short film on Somali pirates in 2012, he decided to release the movie on video-hosting site Vimeo, charging viewers $1. ~CORRECTED-Digital brands woo Sundance filmmakers with new platforms (Corrects magazine Vice to media company Vice in paragraph 2) ~US STOCKS-Wall St falls on China data, earnings * Indexes off: Dow 0.94 pct, S&P; 0.89 pct, Nasdaq 0.90 pct ~Netflix shares to open higher after strong customer additions forecast Netflix Inc's shares were set to open 18 percent higher on Thursday, after the world's largest video streaming company said it expected customer additions in the U.S. to remain strong, prompting at least six brokerages to raise their price targets on the stock by as much as $55. | Video  ~US STOCKS-Wall St to open lower after China data, earnings NEW YORK, Jan 23 U.S. stocks were set to open lower on Thursday, after disappointing manufacturing data in China and the latest round of corporate earnings failed to provide investors the impetus to push equities higher. ~Netflix shares to open higher after strong customer additions forecast Jan 23 Netflix Inc's shares were set to open 18 percent higher on Thursday, after the world's largest video streaming company said it expected customer additions in the U.S. to remain strong, prompting at least six brokerages to raise their price targets on the stock by as much as $55. ~US STOCKS-Futures fall with earnings, data on tap NEW YORK, Jan 23 U.S. stock index futures fell on Thursday, ahead of data on the labor and housing markets, along with the latest round of corporate earnings results. ~
RL,Team USA's Olympic parade uniforms torn apart by online critics NEW YORK, Jan 23 The Team USA parade uniform designed by fashion house Ralph Lauren for the 2014 Winter Olympics in Sochi, was unveiled on Thursday, prompting waves of disapproval from social-media critics for its patchwork woolen cardigan of stars and stripes. ~
QCOM.O,UPDATE 1-Qualcomm acquires patents from HP to bulk up portfolio Jan 23 Chipmaker Qualcomm Inc acquired a patent portfolio from Hewlett-Packard Co, including those of Palm Inc and its iPaq smartphone, in a move that will bulk up HP's offerings to handset makers and other licensees. ~Qualcomm acquires patent portfolio from HP Jan 23 Chipmaker Qualcomm Inc acquired a patent portfolio from Hewlett-Packard Co, including those of its iPaq smartphone, for an undisclosed amount. ~
LUV,WRAPUP 1-United, Southwest profits top estimates as fuel costs fall Jan 23 U.S. airlines United Continental Holdings  and Southwest Airlines reported higher-than-expected fourth quarter profit on Thursday, aided by strong revenue and lower fuel costs. ~Southwest Airlines fourth-quarter profit tops estimates as costs fall U.S. carrier Southwest Airlines Co  posted a better-than-expected profit in the fourth quarter, aided by higher fares and lower costs for fuel and aircraft maintenance. ~UPDATE 2-Southwest Airlines Q4 profit tops estimates as costs fall Jan 23 U.S. carrier Southwest Airlines Co  posted a better-than-expected profit in the fourth quarter, aided by higher fares and lower costs for fuel and aircraft maintenance. ~BRIEF-Southwest Airlines up in premarket after results NEW YORK, Jan 23 Southwest Airlines Co :  * Shares up 2.1 percent in premarket trading after results ~Southwest Air posts higher fourth-quarter profit Jan 23 U.S. carrier Southwest Airlines  on Thursday said fourth-quarter profit rose, aided by higher airfares and lower fuel costs. ~
SBUX.O,REFILE-UPDATE 2-Starbucks' growth cooled in latest quarter Jan 23 Starbucks Corp on Thursday reported that sales at established stores in its U.S.-dominated Americas region cooled more than analysts expected in its latest quarter as consumers spent more time holiday shopping online than at physical stores. ~US STOCKS-Wall St falls as China data trigger selloff in risky assets * Microsoft profit up on strong commercial sales; shares up in extended trade ~Starbucks' growth cooled in latest quarter Jan 23 Starbucks Corp on Thursday reported that sales at established stores in its U.S.-dominated Americas region cooled more than analysts expected in its latest quarter as consumers spent more time holiday shopping online than at physical stores. ~BRIEF-Starbucks shares down 1.4 percent after the bell following results NEW YORK, Jan 23 Starbucks Corp :  * Shares down 1.4 percent after the bell ~
TROW.O,UPDATE 2-Time Warner Cable should talk to Charter, T. Rowe says Jan 23 A Time Warner Cable Inc investor that also has a large stake in would-be predator Charter Communications Inc is urging Time Warner Cable to talk to its smaller rival, after weeks of Charter's aggressive campaign to win over investors. ~T. Rowe Price letter urges Time Warner Cable/Charter talks -sources Jan 23 T. Rowe Price Group sent a letter this week to Time Warner Cable urging the cable company to have talks with smaller cable provider Charter  about a possible deal, according to people familiar with the matter. ~
TGT,BRIEF-Democratic leaders ask Target CEO for documents related to data breach Jan 23 Target Corp :  * Democratic leaders ask Target Corp CEO for documents related to data ~Exclusive: FBI warns retailers to expect more credit card breaches WASHINGTON The FBI has warned U.S. retailers to prepare for more cyber attacks after discovering about 20 hacking cases in the past year that involved the same kind of malicious software used against Target Corp in the holiday shopping season. ~What Target knows about you Among the millions of consumers who received recent emails from Target Corp apologizing that their personal data might have been accessed by cyber thieves are those who wonder exactly how they got on the list in the first place. ~YOUR MONEY-What Target knows about you Jan 23 Among the millions of consumers who received recent emails from Target Corp apologizing that their personal data might have been accessed by cyber thieves are those who wonder exactly how they got on the list in the first place. ~Target CFO to testify before Senate on big data breach Target Corp's chief financial officer will testify before the U.S. Senate Judiciary Committee on February 4 about a massive data breach in what is likely to be the first time the retailer publicly answers questions about the unprecedented attack. ~UPDATE 1-Target CFO to testify before Senate on big data breach Jan 23 Target Corp's chief financial officer will testify before the U.S. Senate Judiciary Committee on Feb. 4 about a massive data breach in what is likely to be the first time the retailer publicly answers questions about the unprecedented attack. ~Target CFO to testify before Senate on big data breach Jan 23 Target Corp's chief financial officer will testify before the U.S. Senate Judiciary Committee on Feb. 4 about a massive data breach in what is likely to be the first time the retailer publicly answers questions about the unprecedented attack. ~
UNP,Union Pacific profit rises on higher prices, shipments Union Pacific Corp  reported a bigger quarterly profit on Thursday as the railroad raised prices and saw demand grow in overall shipments, sending shares up almost 4 percent. ~UPDATE 2-Union Pacific profit rises on higher prices, shipments Jan 23 Union Pacific Corp reported a bigger quarterly profit on Thursday as the railroad raised prices and saw demand grow in overall shipments, sending shares up almost 4 percent. ~Union Pacific profit rises on higher prices, shipments Union Pacific Corp  reported a bigger quarterly profit on Thursday as the railroad raised prices and saw demand in overall shipments grow, sending shares up more than 2 percent in premarket trading. ~Union Pacific's crude shipments to US Gulf Coast down in 4Q-exec HOUSTON, Jan 23 Union Pacific Corp's  crude oil shipments via rail to the U.S. Gulf Coast were down 22 percent in the fourth quarter versus a year earlier as pipeline startups increased supply in the region, a senior executive told analysts on Thursday. ~REFILE-Union Pacific posts bigger quarterly profit Jan 23 Union Pacific Corp posted a bigger quarterly profit as the railroad raised prices and saw demand in overall shipments grow, it said on Thursday. ~BRIEF-Union Pacific up in premarket after results NEW YORK, Jan 23 Union Pacific Corp :  * Shares up 2.4 percent in premarket trading after results ~
UAL,WRAPUP 1-United, Southwest profits top estimates as fuel costs fall Jan 23 U.S. airlines United Continental Holdings  and Southwest Airlines reported higher-than-expected fourth quarter profit on Thursday, aided by strong revenue and lower fuel costs. ~United Continental fourth-quarter profit tops estimates, shares sag on outlook CHICAGO United Continental Holdings Inc  on Thursday reported a quarterly profit that easily topped Wall Street expectations, helped by an increase in passenger travel, higher ticket prices and lower fuel costs. ~UPDATE 2-United Continental Q4 profit tops estimates, shares sag on outlook CHICAGO, Jan 23 United Continental Holdings Inc  on Thursday reported a quarterly profit that easily topped Wall Street expectations, helped by an increase in passenger travel, higher ticket prices and lower fuel costs. ~United Continental swings to fourth-quarter profit CHICAGO, Jan 23 United Continental Holdings Inc  swung to a quarterly profit on strong results in December, lower fuel costs and higher fares, it said on Thursday. ~
V,BRIEF-Visa calls for redemption all of its 1.200 pct notes due 2017 * Visa Inc - on Sept 11, co called for redemption all of $1.75 billion principal amount outstanding of its 1.200 pct notes due 2017‍​ - SEC filing ~BRIEF-Visa Inc files for three-part senior notes offering of up to $2.5 bln * Visa Inc says files for three-part senior notes offering of up to $2.5 billion - SEC filing‍​ ~Former BoE deputy Hogg to join Visa as Europe unit CEO Visa Inc, the world's largest payments processor, on Thursday named former Bank of England (BoE) deputy governor Charlotte Hogg as chief executive of its Europe division. ~CORRECTED-UPDATE 1-MOVES-Former BoE deputy Hogg to join Visa as Europe unit CEO Sept 7 Visa Inc, the world's largest payments processor, on Thursday named former Bank of England (BoE) deputy governor Charlotte Hogg as chief executive of its Europe division. ~MOVES-Visa names ex-BoE deputy Charlotte Hogg as Europe unit CEO Sept 7 Visa Inc, the world's largest payments processor, on Thursday named Charlotte Hogg as chief executive of its Europe division. ~BRIEF-Visa appoints Charlotte Hogg as CEO of European operations * Visa Inc appoints Charlotte Hogg as chief executive officer of the compan's European operations ~BRIEF-Visa Inc files prospectus supplement for potential three-part senior notes offering * Visa Inc files prospectus supplement for potential three-part senior notes offering; size not disclosed - sec filing‍​ Source text (http://bit.ly/2vLDrIe) Further company coverage: ~BRIEF-Visa enables on the go payments with the new Fitbit Ionic * Visa inc- ‍enabling visa payments on fitbit's smartwatch fitbit ionic​ ~BRIEF-Bridg raises $11 million in Series B funding * Bridg raises $11 million in Series B funding from Morpheus Ventures, March Capital, Visa and NextEquity ~
WMT,Wal-Mart creates $10 million fund to back U.S. manufacturing WASHINGTON, Jan 23 Wal-Mart Stores Inc, the world's largest retailer, said on Thursday it has created a $10 million fund to support manufacturing in the United States, and that one of its bicycle suppliers plans to start production in the U.S. this year. ~
