AA,UPDATE 3-Alcoa earnings beat estimates after special items, shares rise April 8 Alcoa Inc reported a decline in first quarter adjusted profit on Tuesday as aluminum prices dropped. But earnings came in ahead of analysts' expectations, and the aluminum producer's  shares rose in trading after the bell. ~BRIEF-Alcoa CFO says EPS unit eyes Q2 earns of $200 million or more * Chief financial officer William Oplinger says engineered products and solutions unit is targeting after-tax earnings of $200 million or more in 2nd quarter  Source text for Eikon:  Further company coverage:    (Reporting by Nicole Mordant in Vancouver) ~US STOCKS-Wall St snaps 3-day losing streak as tech rebounds * Amazon.com, Yahoo shares jump; investors buy Internet 'bargains' ~GLOBAL MARKETS-Wall St stocks rise as dollar, euro drop against yen * Wall Street rise led by social media and Internet share ~Alcoa reports loss on restructuring April 8 Alcoa Inc reported a first quarter loss on Tuesday, hurt by restructuring charges linked to recent smelter and mill closures as well as a decline in aluminum prices. ~US STOCKS-Wall St rebound led by gains Internet stocks * Indexes: Dow flat; S&P; up 0.3 pct, Nasdaq up 0.7 pct   (Updates prices) ~US STOCKS-Wall St gains as social media, Internet stocks rebound * Indexes up: Dow 0.3 pct, S&P; 0.4 pct, Nasdaq 1 pct   (Updates to late morning trade) ~US STOCKS-Wall Street opens flat ahead of earnings season * Eli Lilly ordered to pay $3 bln in damages in Actos case ~US STOCKS-Wall Street set for flat open after selloff * Eli Lilly ordered to pay $3 bln in damages in Actos case ~
GOOGL.O,UPDATE 3-Comcast defends Time Warner Cable deal as U.S. review kicks off * Says merger would not eliminate cable or broadband competition   (Recasts throughout; adds details on broadband market) ~Big push into gaming brings out Amazon's gentler side SAN FRANCISCO Amazon.com Inc, a company known for its ruthless drive, is courting the free-wheeling coders and dreamers of the gaming industry with a lighter touch as it seeks to break into an arena now dominated by Apple and Google. ~Big push into gaming brings out Amazon's gentler side SAN FRANCISCO, April 8 Amazon.com Inc, a company known for its ruthless drive, is courting the free-wheeling coders and dreamers of the gaming industry with a lighter touch as it seeks to break into an arena now dominated by Apple and Google. ~
GOOG.O,UPDATE 3-Comcast defends Time Warner Cable deal as U.S. review kicks off * Says merger would not eliminate cable or broadband competition   (Recasts throughout; adds details on broadband market) ~Big push into gaming brings out Amazon's gentler side SAN FRANCISCO Amazon.com Inc, a company known for its ruthless drive, is courting the free-wheeling coders and dreamers of the gaming industry with a lighter touch as it seeks to break into an arena now dominated by Apple and Google. ~Big push into gaming brings out Amazon's gentler side SAN FRANCISCO, April 8 Amazon.com Inc, a company known for its ruthless drive, is courting the free-wheeling coders and dreamers of the gaming industry with a lighter touch as it seeks to break into an arena now dominated by Apple and Google. ~
AMZN.O,Rovi loses patent fight with Amazon in U.S. appeals court WASHINGTON Rovi, which sells television guide programs to cable providers, lost a patent fight with Amazon.com on Tuesday when a federal appeals court upheld a U.S. district judge's ruling in favor of the world's largest online retailer. ~UPDATE 1-Rovi loses patent fight with Amazon in U.S. appeals court WASHINGTON, April 8 Rovi, which sells television guide programs to cable providers, lost a patent fight with Amazon.com on Tuesday when a federal appeals court upheld a U.S. district judge's ruling in favor of the world's largest online retailer. ~US STOCKS-Wall St rebound led by gains Internet stocks * Indexes: Dow flat; S&P; up 0.3 pct, Nasdaq up 0.7 pct   (Updates prices) ~Amazon wins patent fight with Rovi in appeals court WASHINGTON, April 8 Rovi, which sells television guide programs to cable providers, lost a patent fight with Amazon.com on Tuesday when an appeals court upheld a decision by a Delaware district court. ~US STOCKS-Wall St gains as social media, Internet stocks rebound * Indexes up: Dow 0.3 pct, S&P; 0.4 pct, Nasdaq 1 pct   (Updates to late morning trade) ~Big push into gaming brings out Amazon's gentler side SAN FRANCISCO Amazon.com Inc, a company known for its ruthless drive, is courting the free-wheeling coders and dreamers of the gaming industry with a lighter touch as it seeks to break into an arena now dominated by Apple and Google. ~Big push into gaming brings out Amazon's gentler side SAN FRANCISCO, April 8 Amazon.com Inc, a company known for its ruthless drive, is courting the free-wheeling coders and dreamers of the gaming industry with a lighter touch as it seeks to break into an arena now dominated by Apple and Google. ~
AAL.O,UPDATE 2-American Airlines says weather hurt first quarter results * Shares off about 1 percent   (Adds United commentary on first quarter) ~American Airlines says cancellations hurt first-quarter results April 8 American Airlines Group on Tuesday said flight cancellations because of bad weather hurt first-quarter results. ~
AAPL.O,Comcast defends Time Warner Cable deal as U.S. review kicks off WASHINGTON/NEW YORK Comcast Corp sought to rebut critics of its planned $45.2 billion takeover of Time Warner Cable Inc, arguing that newcomers like Google Inc and Apple Inc would ensure competition in both Internet and video markets. ~UPDATE 3-Comcast defends Time Warner Cable deal as U.S. review kicks off * Says merger would not eliminate cable or broadband competition   (Recasts throughout; adds details on broadband market) ~Big push into gaming brings out Amazon's gentler side SAN FRANCISCO Amazon.com Inc, a company known for its ruthless drive, is courting the free-wheeling coders and dreamers of the gaming industry with a lighter touch as it seeks to break into an arena now dominated by Apple and Google. ~Big push into gaming brings out Amazon's gentler side SAN FRANCISCO, April 8 Amazon.com Inc, a company known for its ruthless drive, is courting the free-wheeling coders and dreamers of the gaming industry with a lighter touch as it seeks to break into an arena now dominated by Apple and Google. ~
ADM,UPDATE 2-Cargill earnings hit by commodity market disruptions CHICAGO, April 8 Cargill Inc said on Tuesday its quarterly earnings fell 28 percent, making it one of the largest companies yet to demonstrate how big commodity market disruptions this year have hurt its bottom line. ~
BAC,U.S. wants one trial in $5 bln fraud case vs S&P; April 8 The United States said its $5 billion civil fraud lawsuit against Standard & Poor's should be tried all at once, rejecting the credit rating agency's insistence that a single trial would be too big, confusing and unfair. ~
BLK,CORRECTED-MOVES- BlackRock, State Street Global, Stanhope Capital (Corrects BlackRock item to say that the company is the world's largest money manager, not the world's largest listed alternative asset manager) ~CORRECTED-BlackRock appoints Barry Knapp to lead Thematic Strategies team (Corrects paragraph 1 to say that BlackRock is the world's largest money manager, not the world's largest listed alternative asset manager) ~BlackRock appoints Barry Knapp to lead Thematic Strategies team BlackRock Inc , the world's largest listed alternative asset manager, has hired Barry Knapp from Barclays to head its newly formed Thematic Strategies team, according to an internal memo seen by Reuters on Tuesday. ~
BA,Australians' urge to shop, build and buy homes a boon for jobs * Forward-looking measures of labour demand all flashing green ~Iran aviation official in Vienna to discuss sanctions relief VIENNA A senior Iranian aviation official has arrived in Vienna to discuss lifting sanctions on the country's aviation sector as part of nuclear talks with world powers, Iran's semi-official Fars news agency reported. ~
C,U.S. wants one trial in $5 billion fraud case versus S&P; The United States said its $5 billion civil fraud lawsuit against Standard & Poor's should be tried all at once, rejecting the credit rating agency's insistence that a single trial would be too big, confusing and unfair. ~U.S. wants one trial in $5 bln fraud case vs S&P; April 8 The United States said its $5 billion civil fraud lawsuit against Standard & Poor's should be tried all at once, rejecting the credit rating agency's insistence that a single trial would be too big, confusing and unfair. ~UPDATE 2-U.S. House panel to vote on swaps regulator mandate WASHINGTON, April 7 U.S. lawmakers on Monday launched a bill to rewrite the rules of of the Commodity Futures Trading Commission (CFTC), giving more leeway to smaller players in the derivative markets it oversees. ~
CMCSA.O,U.S. mulls impact of Comcast-TWC deal on programming: cable executive WASHINGTON Executives from Veria Living, a U.S. cable television channel, met in March with Justice Department officials who are digging into the Comcast deal to buy Time Warner Cable, even before the government was formally notified of the proposed transaction, Veria's CEO told Reuters. ~U.S. mulls impact of Comcast-TWC deal on programming -cable exec WASHINGTON, April 8 Executives from Veria Living, a U.S. cable television channel,  met in March with Justice Department officials who are digging into the Comcast deal to buy Time Warner Cable, even before the government was formally notified of the proposed transaction, Veria's CEO told Reuters. ~UPDATE 3-Comcast defends Time Warner Cable deal as U.S. review kicks off * Says merger would not eliminate cable or broadband competition   (Recasts throughout; adds details on broadband market) ~Comcast makes case for Time Warner Cable deal to U.S. regulators WASHINGTON/NEW YORK, April 8 Comcast Corp  told U.S. regulators on Tuesday that its merger with Time Warner Cable Inc would not take away any TV or broadband choices for consumers. ~
CVS,UPDATE 2-CVS to pay $20 mln to settle SEC fraud charges April 8 CVS Caremark Corp, the second largest U.S. drugstore chain, will pay $20 million to settle U.S. Securities and Exchange Commission charges that it defrauded investors in 2009 during a debt offering and by accounting improperly for an acquisition. ~CVS to pay $20 mln to settle SEC charges April 8 CVS Caremark Corp agreed to pay $20 million to settle U.S. Securities and Exchange Commission charges that it misled investors about significant financial setbacks and used improper accounting to artificially boost its results. ~BRIEF-CVS to pay $20 mln to settle SEC case over disclosures, accounting April 8 CVS Caremark Corp :  * SEC files civil lawsuit against CVS Caremark Corp  over alleged ~
DOW,BRIEF-Downer EDI says offer for Spotless Group now closed * Confirms that its offer for Spotless was not extended and has now closed. Source text for Eikon: Further company coverage: ~BRIEF-Downer EDI posts FY net profit of $181.5 million * FY total revenue and other income from ordinary activities $7.29 billion , up 6.4 percent ~BRIEF-Downer EDI says ‍offer for Spotless Group extended to 28 August 2017​ * ‍Offer for Spotless Group extended to 7pm on Monday, 28 august 2017​ Source text for Eikon: Further company coverage: ~BRIEF-Downer EDI says Spotless ‍offer extended to Aug 21, 2017​ * Spotless ‍offer extended to 7pm on monday, 21 august 2017​ Source text for Eikon: Further company coverage: ~BRIEF-Downer EDI's takeover offer for Spotless Group extended till 7pm (Sydney time) on Aug. 14 * Unconditional takeover offer for Spotless Group extended until 7:00pm (Sydney time) on Monday, 14 August Source text for Eikon: Further company coverage: (bangalore.newsroom@thomsonreuters.com) ~BRIEF-Downer extends takeover offer for Spotless Group * decided to extend Spotless offer period for one week; offer will now remain open for acceptance until 14 august Source text for Eikon: Further company coverage: ~BRIEF-Downer extends Spotless offer to August 7 2017 * ‍Downer has decided to extend offer for Spotless Group holdings to 7 pm on Monday, 7 august 2017​ Source text for Eikon: Further company coverage: ~BRIEF-Downer EDI's stake in Spotless increases to 80.3 pct * Downer's stake in Spotless increases to 80.3 pct Source text for Eikon: Further company coverage: ~BRIEF- Downer EDI Ltd'S stake in Spotless Group increases to 72% * As Downer's shareholding in Spotless is now over 70%, Downer expects that Spotless will be removed from certain S&P;/ASX market indices ~
XOM,UPDATE 4-Japan drugmaker Takeda to fight $6 bln damages awarded by U.S. jury * Louisiana jury orders $6 bln damages from Takeda, $3 bln from Eli Lilly ~Japan drugmaker Takeda to fight $6 billion damages imposed by U.S. jury SAN FRANCISCO/TOKYO Takeda Pharmaceutical Co Ltd said it would contest $6 billion in punitive damages imposed by a U.S. federal jury in a case alleging that Japan's largest drugmaker had concealed cancer risks associated with its Actos diabetes drug. ~
GM,U.S. fines GM for not answering recall questions WASHINGTON General Motors is being fined $7,000 a day for missing an April 3 deadline to provide information about its recall of 2.6 million cars for defective ignition switches, the National Highway Traffic Safety Administration said on Tuesday. ~GM is late delivering ignition switch fix to dealers April 8 General Motors Co is running two days behind Chief Executive Mary Barra's plan to begin shipping replacement ignition switches in its massive recall, dealerships and the company said on Tuesday. ~UPDATE 2-U.S. fines GM for not answering recall questions WASHINGTON, April 8 General Motors is being fined $7,000 a day for missing an April 3 deadline to provide information about its recall of 2.6 million cars for defective ignition switches, the National Highway Traffic Safety Administration said on Tuesday. ~GM says it has 'fully cooperated' with U.S. safety regulators DETROIT General Motors Co said on Tuesday it has "fully cooperated" with the National Highway Traffic Safety Administration, which says the company has not fully responded to 107 questions the agency asked about the automaker's recall of 2.6 million cars for defective ignition switches. ~GM says it has "fully cooperated" with U.S. safety regulators DETROIT, April 8 General Motors Co said on Tuesday it has "fully cooperated" with the National Highway Traffic Safety Administration, which says the company has not fully responded to 107 questions the agency asked about the automaker's recall of 2.6 million cars for defective ignition switches. ~Exclusive: GM planning lower-priced version of 2016 Chevy Volt - sources DETROIT Hoping to boost demand for its slow-selling Volt hybrid, Chevrolet is planning to sell two versions of the redesigned 2016 Volt, including a lower-priced model with a smaller battery pack and shorter driving range, supplier sources told Reuters on Tuesday. ~U.S. says GM in violation of its order to answer questions about recall WASHINGTON, April 8 The National Highway Traffic Safety Administration said on Tuesday that General Motors  had not met an April 3 deadline to respond to the agency's request for information about the automaker's recall of 2.6 million cars for defective ignition switches. ~Deals of the day- Mergers and acquisitions April 8 The following bids, mergers, acquisitions and disposals were reported by 1000 GMT on Tuesday: ~Safety group calls for U.S. probe of Chevy Impala air bags WASHINGTON General Motors, which has recalled 2.6 million cars for faulty ignition switches that caused air bags to deactivate, may also have a defect in air bags in 2003 to 2010 Chevrolet Impalas, an auto safety watchdog group said on Monday. ~
GS,CVC set to sell ink maker, Flint, to Koch, Goldman: sources FRANKFURT Private equity firm CVC Capital Partners Ltd  is in advanced talks to sell its printing-ink maker, Flint Group, to Koch Industries  and Goldman Sachs Group's  private equity arm, two people familiar with the transaction said on Tuesday. ~UPDATE 1-CVC set to sell ink maker, Flint, to Koch, Goldman -sources FRANKFURT, April 8 Private equity firm CVC Capital Partners Ltd is in advanced talks to sell its printing-ink maker, Flint Group, to Koch Industries  and Goldman Sachs Group's private equity arm, two people familiar with the transaction said on Tuesday. ~CVC set to sell ink maker Flint to Koch, Goldman - sources FRANKFURT, April 8 Private equity firm CVC is in advanced talks to sell its printing-ink maker Flint Group to Koch Industries and Goldman Sachs, two people familiar with the transaction said on Tuesday. ~
INTC.O,UPDATE 2-Intel closes Costa Rica operation, cuts 1,500 jobs (Adds details on plan for Costa Rica, background; adds share price) ~Intel closes Costa Rica operation, cuts 1,500 jobs SAN FRANCISCO, April 8 Chipmaker Intel, struggling with a shrinking personal computer market, is shutting its assembly and test operation in Costa Rica and eliminating 1,500 jobs, a spokesman said on Tuesday. ~
JPM,U.S. House panel to vote on swaps regulator mandate WASHINGTON U.S. lawmakers on Monday launched a bill to rewrite the rules of  the Commodity Futures Trading Commission (CFTC), giving more leeway to smaller players in the derivative markets it oversees. ~UPDATE 2-U.S. House panel to vote on swaps regulator mandate WASHINGTON, April 7 U.S. lawmakers on Monday launched a bill to rewrite the rules of of the Commodity Futures Trading Commission (CFTC), giving more leeway to smaller players in the derivative markets it oversees. ~
LLY,US STOCKS-Wall Street opens flat ahead of earnings season * Eli Lilly ordered to pay $3 bln in damages in Actos case ~US STOCKS-Wall Street set for flat open after selloff * Eli Lilly ordered to pay $3 bln in damages in Actos case ~US STOCKS-Wall Street to edge higher at open after selloff * Eli Lilly ordered to pay $3 bln in damages in Actos case ~US STOCKS-Futures slip as investors brace for earnings * Eli Lilly ordered to pay $3 bln in damages in Actos case ~U.S. jury orders Takeda, Eli Lilly to pay $9 bln damages in Actos case -lawyer April 8 A U.S. jury ordered Takeda Pharmaceutical Co Ltd to pay $6 billion in punitive damages and Eli Lilly and Co to pay $3 billion in a case claiming that cancer risks to the diabetes drug Actos were concealed, the plaintiffs' lawyer said. ~
LMT,UPDATE 1-Pentagon sees deal with Lockheed, Pratt on next F-35 lot by end May WASHINGTON, April 8 The U.S. Air Force general who runs the F-35 fighter jet program for the Pentagon said he expected to reach agreements with both Lockheed Martin Corp  and engine-maker Pratt & Whitney by the end of May for the next order of fighter planes. ~REFILE-Pentagon sees deal with Lockheed, Pratt on next F-35 lot by end May WASHINGTON, April 8 The U.S. Air Force general who runs the F-35 fighter jet program for the Pentagon said he expected to reach agreement with both Lockheed Martin Corp  and engine-maker Pratt & Whitney by the end of May for the next order of fighter planes. ~
MSFT.O,Microsoft ends Windows XP support, hackers may be lurking BOSTON Microsoft Corp released its final security updates for Windows XP and Office 2003 on Tuesday as security experts warned users that they could soon be prime targets for cyber attacks if they do not abandon the products. ~Microsoft ends Windows XP support, hackers may be lurking BOSTON, April 8 Microsoft Corp released its final security updates for Windows XP and Office 2003 on Tuesday as security experts warned users that they could soon be prime targets for cyber attacks if they do not abandon the products. ~Nokia wins Chinese approval for Microsoft deal HELSINKI Nokia has won approval from Chinese competition authorities to sell its mobile phone business to Microsoft Corp without having to change its main technology patent practices, it said on Tuesday. ~UPDATE 2-Nokia wins Chinese approval for Microsoft deal * China approves $7.4 bln deal between Nokia and Microsoft ~
MS,New Morgan Stanley brokerage sales head reorganizes leadership NEW YORK, April 8 Six weeks after being named to lead Morgan Stanley's brokerage force of more than 16,000 financial advisers, managing director Shelley O'Connor has streamlined the sales organization and replaced some key executives. ~
NKE,Soccer-Atletico success built on shaky economic foundations MADRID, April 8 Atletico Madrid's emergence as a third force in Spain and contenders among Europe's elite rests on wobbly economic foundations and the edifice could come crashing down if they cannot sustain their remarkable run. ~
PM,Australians' urge to shop, build and buy homes a boon for jobs * Forward-looking measures of labour demand all flashing green ~
QCOM.O,Wearable chip start-up Ineda gets funding from Qualcomm and Samsung SAN FRANCISCO, April 8 Start-up Ineda Systems said on Tuesday it received $17 million in funding from investors including major semiconductor industry players Qualcomm and Samsung Electronics, as it designs low-power chips for smart watches and other wearable computing gadgets. ~
TROW.O,T Rowe Price deal values software company Atlassian at $3.3 bln SAN FRANCISCO, April 8 Software-development company Atlassian has sold $150 million of its shares to mutual-fund giant T. Rowe Price, the company said on Tuesday. ~
DIS,Families of autistic kids sue Disney parks over policy on lines April 8 Families with autistic children have sued Walt Disney Co, alleging the company does not provide adequate access to theme park visitors with autism who have difficulty waiting in long lines for rides. ~
TWX,Time Inc to raise $1.4 billion of debt Time Warner Inc said its soon-to-be-divested magazine unit Time Inc plans to raise $1.4 billion of debt. ~
UTX,Alert on United Airlines wrongly coded to United Inc, United SA April 9 Please be advised United Airlines March 2014 Operational Performance results was inadvertently coded to United Inc, United Group Holdings Co PLC and United SA. The press release was from United Airlines, a unit of United Continental Holdings Inc. ~
V,BRIEF-Visa calls for redemption all of its 1.200 pct notes due 2017 * Visa Inc - on Sept 11, co called for redemption all of $1.75 billion principal amount outstanding of its 1.200 pct notes due 2017‍​ - SEC filing ~BRIEF-Visa Inc files for three-part senior notes offering of up to $2.5 bln * Visa Inc says files for three-part senior notes offering of up to $2.5 billion - SEC filing‍​ ~Former BoE deputy Hogg to join Visa as Europe unit CEO Visa Inc, the world's largest payments processor, on Thursday named former Bank of England (BoE) deputy governor Charlotte Hogg as chief executive of its Europe division. ~CORRECTED-UPDATE 1-MOVES-Former BoE deputy Hogg to join Visa as Europe unit CEO Sept 7 Visa Inc, the world's largest payments processor, on Thursday named former Bank of England (BoE) deputy governor Charlotte Hogg as chief executive of its Europe division. ~MOVES-Visa names ex-BoE deputy Charlotte Hogg as Europe unit CEO Sept 7 Visa Inc, the world's largest payments processor, on Thursday named Charlotte Hogg as chief executive of its Europe division. ~BRIEF-Visa appoints Charlotte Hogg as CEO of European operations * Visa Inc appoints Charlotte Hogg as chief executive officer of the compan's European operations ~BRIEF-Visa Inc files prospectus supplement for potential three-part senior notes offering * Visa Inc files prospectus supplement for potential three-part senior notes offering; size not disclosed - sec filing‍​ Source text (http://bit.ly/2vLDrIe) Further company coverage: ~BRIEF-Visa enables on the go payments with the new Fitbit Ionic * Visa inc- ‍enabling visa payments on fitbit's smartwatch fitbit ionic​ ~BRIEF-Bridg raises $11 million in Series B funding * Bridg raises $11 million in Series B funding from Morpheus Ventures, March Capital, Visa and NextEquity ~
WMT,UPDATE 2-Wal-Mart plans 50 more India wholesale outlets, e-commerce launch * Wal-Mart has yet to apply to open retail stores in India ~South Africa's Massmart to enter Angola with two stores JOHANNESBURG Massmart , South Africa's No.4 retailer by market value, plans to enter oil-rich Angola with two stores by 2015, a senior executive said, as the unit of Wal-Mart  expands on a continent that is still largely an informal retail market. ~Wal-Mart plans 50 more India wholesale outlets, e-commerce launch MUMBAI Wal-Mart Stores Inc  plans to open 50 more wholesale outlets in India and launch online operations to sell to small traders after calling off a joint venture last year and shelving plans to open its own retail stores in the country. ~Wal-Mart plans to open 50 wholesale stores in India over 4-5 yrs HONG KONG, April 8 Wal-Mart Stores Inc  plans to open 50 additional wholesale stores in India over the next 4-5 years, company spokesman Anthony Rose said on Tuesday. ~UK's big 4 grocers all losing market share to discounters - Kantar LONDON, April 8 Britain's big four grocers - Tesco, Wal-Mart's Asda, Sainsbury's  and Morrisons - all lost market share over the last three months to discounters Aldi and Lidl, industry data showed on Tuesday.     The data from market researcher Kantar Worldpanel showed the UK grocery market continuing to polarise, with the big four being squeezed between the discounters and upmarket players such as Waitrose.     Although Britain's economy is recovering from a long and deep recession ~
