GOOGL.O,Retailers push into crowded mobile payment market * Mobile payments can cut retailers' costs, boost service-study ~
GOOG.O,Retailers push into crowded mobile payment market * Mobile payments can cut retailers' costs, boost service-study ~
BLK,BlackRock shakes up management, names new co-president, COO -memo NEW YORK, April 6 BlackRock Inc, the world's largest money manager, is reorganizing its senior management, shifting at least 10 senior executives into new or different roles, according to an internal memo seen by Reuters on Sunday. ~
DOW,BRIEF-Downer EDI says offer for Spotless Group now closed * Confirms that its offer for Spotless was not extended and has now closed. Source text for Eikon: Further company coverage: ~BRIEF-Downer EDI posts FY net profit of $181.5 million * FY total revenue and other income from ordinary activities $7.29 billion , up 6.4 percent ~BRIEF-Downer EDI says ‍offer for Spotless Group extended to 28 August 2017​ * ‍Offer for Spotless Group extended to 7pm on Monday, 28 august 2017​ Source text for Eikon: Further company coverage: ~BRIEF-Downer EDI says Spotless ‍offer extended to Aug 21, 2017​ * Spotless ‍offer extended to 7pm on monday, 21 august 2017​ Source text for Eikon: Further company coverage: ~BRIEF-Downer EDI's takeover offer for Spotless Group extended till 7pm (Sydney time) on Aug. 14 * Unconditional takeover offer for Spotless Group extended until 7:00pm (Sydney time) on Monday, 14 August Source text for Eikon: Further company coverage: (bangalore.newsroom@thomsonreuters.com) ~BRIEF-Downer extends takeover offer for Spotless Group * decided to extend Spotless offer period for one week; offer will now remain open for acceptance until 14 august Source text for Eikon: Further company coverage: ~BRIEF-Downer extends Spotless offer to August 7 2017 * ‍Downer has decided to extend offer for Spotless Group holdings to 7 pm on Monday, 7 august 2017​ Source text for Eikon: Further company coverage: ~BRIEF-Downer EDI's stake in Spotless increases to 80.3 pct * Downer's stake in Spotless increases to 80.3 pct Source text for Eikon: Further company coverage: ~BRIEF- Downer EDI Ltd'S stake in Spotless Group increases to 72% * As Downer's shareholding in Spotless is now over 70%, Downer expects that Spotless will be removed from certain S&P;/ASX market indices ~
GM,GM ignition switch case could lead to criminal charges -U.S. senator WASHINGTON, April 6 General Motors should make restitution to victims' families and face criminal action if merited for the way it handled defective ignition switches that caused fatal auto accidents, U.S. Senator Claire McCaskill said on Sunday. ~Opel to launch small electric car by 2017: report BERLIN General Motors'  European brand Opel plans to start selling an all-electric compact car no later than by 2017 as the automaker is striving to meet EU emission targets, Automobilwoche reported on Sunday. ~GM's Opel to launch small electric car by 2017 -report BERLIN, April 6 General Motors' European brand Opel plans to start selling an all-electric compact car no later than by 2017 as the automaker is striving to meet EU emission targets, Automobilwoche reported on Sunday. ~
HUM,Sports Direct founder buys stake in House of Fraser LONDON, April 6 The founder of Britain's Sports Direct has bought an 11 percent stake in House of Fraser, a source close to the deal said, only days after China's Sanpower Group agreed to buy a 89 percent in the British department store. ~
MA,Retailers push into crowded mobile payment market * Mobile payments can cut retailers' costs, boost service-study ~
PFE,Pfizer drug doubles time to breast cancer tumor growth in trial April 6 Pfizer Inc's experimental breast cancer drug in a clinical trial nearly doubled the amount of time patients lived without their disease getting worse, but overall survival was not yet shown to be statistically significant, researchers said. ~
DIS,UPDATE 2-Disney's latest hero, 'Captain America,' sets box office record (Recasts story to include Disney track record with Marvel films) ~
V,BRIEF-Visa calls for redemption all of its 1.200 pct notes due 2017 * Visa Inc - on Sept 11, co called for redemption all of $1.75 billion principal amount outstanding of its 1.200 pct notes due 2017‍​ - SEC filing ~BRIEF-Visa Inc files for three-part senior notes offering of up to $2.5 bln * Visa Inc says files for three-part senior notes offering of up to $2.5 billion - SEC filing‍​ ~Former BoE deputy Hogg to join Visa as Europe unit CEO Visa Inc, the world's largest payments processor, on Thursday named former Bank of England (BoE) deputy governor Charlotte Hogg as chief executive of its Europe division. ~CORRECTED-UPDATE 1-MOVES-Former BoE deputy Hogg to join Visa as Europe unit CEO Sept 7 Visa Inc, the world's largest payments processor, on Thursday named former Bank of England (BoE) deputy governor Charlotte Hogg as chief executive of its Europe division. ~MOVES-Visa names ex-BoE deputy Charlotte Hogg as Europe unit CEO Sept 7 Visa Inc, the world's largest payments processor, on Thursday named Charlotte Hogg as chief executive of its Europe division. ~BRIEF-Visa appoints Charlotte Hogg as CEO of European operations * Visa Inc appoints Charlotte Hogg as chief executive officer of the compan's European operations ~BRIEF-Visa Inc files prospectus supplement for potential three-part senior notes offering * Visa Inc files prospectus supplement for potential three-part senior notes offering; size not disclosed - sec filing‍​ Source text (http://bit.ly/2vLDrIe) Further company coverage: ~BRIEF-Visa enables on the go payments with the new Fitbit Ionic * Visa inc- ‍enabling visa payments on fitbit's smartwatch fitbit ionic​ ~BRIEF-Bridg raises $11 million in Series B funding * Bridg raises $11 million in Series B funding from Morpheus Ventures, March Capital, Visa and NextEquity ~
