AGN,CORRECTED-Valeant says on hunt for more deals, including contact lenses (Corrects to show that Valeant based in Laval, Quebec, not Toronto) ~Valeant says on hunt for more deals, including contact lenses Valeant Pharmaceuticals International Inc  on Thursday said it remains on the hunt for other companies, including makers of innovative contact lenses, as it presses on with efforts to take over Botox-maker Allergan Inc . ~
GOOGL.O,RPT-INSIGHT-European regulators training sights on Google's mobile software (Repeats July 30 INSIGHT with no changes to headline or text) ~
GOOG.O,RPT-INSIGHT-European regulators training sights on Google's mobile software (Repeats July 30 INSIGHT with no changes to headline or text) ~
AMZN.O,GE credit card unit Synchrony makes muted debut on NYSE General Electric Co's  credit card unit, Synchrony Financial , made a muted debut on the New York Stock Exchange on Thursday as investors remained ambivalent about the chances of a consumer-led U.S. economic recovery. ~CORRECTED-UPDATE 2-GE credit card unit Synchrony makes muted debut on NYSE (Corrects 17th paragraph to " ... 75 percent of profit", not " ... 75 percent of revenue") ~Amazon quickens push into tough local services market SAN FRANCISCO Seattle audio and video technician Todd Mueller showed up last year for what might have been a routine job except for one thing: Amazon.com Inc  was taking notes. As he mounted a flat-screen TV on the wall, an Amazon employee studied how he covered his shoes and used a blanket to protect the hardwood floor. ~
APA,Transcanada says Apache plan to sell Kitimat interest was no surprise CALGARY, Alberta, July 31 Oil and gas pipeline company Transcanada Corp said on Thursday in a second quarter earnings call it was always aware Apache Corp  was looking to sell at least a piece of its interest in the Kitimat, BC, LNG project. ~UPDATE 3-Apache to quit gas projects in Australia and Canada HOUSTON, July 31 U.S. oil and gas company Apache Corp, under pressure from activist investor Jana Partners, said on Thursday it plans to sell interests in two liquefied natural gas (LNG) projects as it sharpens the focus on developing North American shale fields. ~BRIEF-Apache CEO says company is cutting rigs and capital in Anadarko basin HOUSTON, July 31 Apache Corp :  * CEO says company is cutting rigs and capital in Anadarko basin  * Now holds 200,000 acres in the Eagle Ford, recently added acreage -CEO  * Says expects to boost drilling activity in duvernay shale in Canada-CEO  * Sees global oil and gas output flat to 1 percent higher in Q3 on a sequential ~Chevron defers comments on Apache, LNG projects to Friday call July 31 Chevron Corp said it plans to discuss its liquefied natural gas projects during an earnings conference call on Friday, deferring commentary on Apache Corp's  decision to exit two LNG joint ventures. ~Apache 2nd-qtr profit falls; plans to exit some LNG projects July 31 Apache Corp, a U.S. oil and gas company under pressure from activist investor Jana Partners, reported lower quarterly profit on Thursday and said it plans to sell its interest in two liquefied natural gas projects (LNG). ~
AAPL.O,Xiaomi's star rises as Chinese handset makers gnaw at Samsung's share: report BEIJING, July 31 Xiaomi Inc, the three-year old company known as the Apple of China, has become the world's No.5 smartphone maker by market share while Samsung Electronics Co Ltd's lead has continued to shrink, a report by Strategy Analytics shows. ~Apple to lay off about 200 people at Beats - Bloomberg July 30 Apple Inc intends to lay off about 200 people at Beats Electronics LLC following its $3 billion acquisition of the headphone and music streaming services company, Bloomberg cited a person with knowledge of the restructuring as saying. ~
BAX,FDA panel: Benefit of Baxter's immune therapy outweighs risk The benefits associated with Baxter International Inc's experimental treatment for certain diseases of the immune system outweigh the risks, an advisory committee to the U.S. Food and Drug Administration concluded on Thursday, paving the way for approval of the therapy. ~FDA panel: Benefit of Baxter's immune therapy outweighs risk July 31 The benefits associated with Baxter International Inc's experimental treatment for certain diseases of the immune system outweigh the risks, an advisory committee to the U.S. Food and Drug Administration concluded on Thursday, paving the way for approval of the therapy. ~
BA,ANA finalises $13 bln deal for 40 long-haul Boeing planes SINGAPORE, July 31 All Nippon Airways  said on Thursday that it has finalised a $13 billion order for 40 Boeing wide body jets as part of the Japanese carrier's efforts to further modernise and expand its fleet. ~
BWA,UPDATE 1-BorgWarner forecasts 2014 earnings below expectations July 31 Auto-parts maker BorgWarner Inc's  full-year profit forecasts fell short of analyst expectations, sending its shares down 4 percent in early trading. ~BorgWarner profit up 9 pct, raises FY earnings forecast July 31 BorgWarner Inc, a maker of automotive turbochargers and emissions systems, posted a higher quarterly profit, helped by higher sales at its engine and drivetrain businesses. ~
CI,UPDATE 3-Cigna's individual customer costs rise in qtr; shares fall July 31 U.S. health insurer Cigna Corp  said on Thursday that medical costs for its individual customers were higher than expected in the second quarter, adding to investor worries that spending is on the rise. ~Cigna to sell individual exchange plans in three more U.S. states Insurer Cigna Corp Chief Executive Officer David Cordani said on Thursday that it plans to sell individual exchange health plans in three additional U.S. states in 2015, for a total of eight states. ~Cigna to sell individual exchange plans in three more U.S. states July 31 Insurer Cigna Corp Chief Executive Officer David Cordani said on Thursday that it plans to sell individual exchange health plans in three additional U.S. states in 2015, for a total of eight states. ~
COP,UPDATE 2-ConocoPhillips profit slightly higher; output rises (Adds comments from CFO, conference call, closing share price) ~BRIEF-Conoco is marketing its interest in Rosneft's Polar Lights project-CEO HOUSTON, July 31 ConocoPhillips :  * CEO says supports U.S. crude and condensate exports, but says condensate ~ConocoPhillips quarterly profit flat, output up July 31 ConocoPhillips, the largest U.S. independent oil and gas company, on Thursday reported a flat quarterly profit as higher costs offset an increase in oil and gas production. ~
DLPH.N,UPDATE 2-Delphi profit strong, but third-quarter outlook may disappoint DETROIT, July 31 Delphi Automotive Plc  reported stronger-than-expected second-quarter profit on Thursday, but offered a forecast for the third quarter that could fall short of analysts' expectations, and shares fell 0.4 percent in morning trading. ~BRIEF-Delphi Automotive CEO says further restructuring in South America to reduce regional footprint DETROIT, July 31 Delphi Automotive PLC CEO Rodney O'Neal on conference call:  * CEO says undertaking further restructuring in South America to reduce company ~Delphi posts strong profit, but third-quarter forecast may disappoint DETROIT, July 31 Delphi Automotive  reported a stronger-than-expected second-quarter profit on Thursday, but offered a forecast for the current quarter that could disappoint investors. ~
DISCA.O,UPDATE 1-Discovery Communications international ad sales jumps July 31 Discovery Communications Inc, which runs channels such as Animal Planet and Investigation Discovery, reported quarterly revenue slightly above analysts' expectations, helped by a jump in advertising sales in its international networks. ~Higher international ad sales boosts Discovery Communications July 31 Discovery Communications Inc  reported a 10 percent rise in second-quarter revenue, helped by a 23 percent jump in advertising sales in its international networks. ~
DISCK.O,UPDATE 1-Discovery Communications international ad sales jumps July 31 Discovery Communications Inc, which runs channels such as Animal Planet and Investigation Discovery, reported quarterly revenue slightly above analysts' expectations, helped by a jump in advertising sales in its international networks. ~Higher international ad sales boosts Discovery Communications July 31 Discovery Communications Inc  reported a 10 percent rise in second-quarter revenue, helped by a 23 percent jump in advertising sales in its international networks. ~
XOM,US STOCKS-S&P; 500 posts worst day since April; indexes down for month * Investors fret over Argentina default fallout, Russia tensions ~US STOCKS-Wall St drops, S&P; on track for worst day since April * Investors fret over Argentina default fallout, Russia tensions ~Higher oil prices lift Exxon's profit as production sags Exxon Mobil Corp , the world's largest publicly traded oil company, reported a stronger-than-expected quarterly profit on Thursday as higher prices for its crude and natural gas offset a 6 percent drop in production. ~UPDATE 3-Higher oil prices lift Exxon's profit as production sags (Adds Breakingviews link, updates share price)     By Ernest Scheyder     July 31 Exxon Mobil Corp, the world's largest publicly traded oil company, reported a stronger-than-expected quarterly profit on Thursday as higher prices for its crude and natural gas offset a 6 percent drop in production.     Exxon has struggled in recent quarters to replenish its reserves quickly, investing in massive new projects in Russia and Papua New Guinea that take years to develop.      Meanwhile, man ~US STOCKS-Wall St tumbles; S&P; below 50-day moving average * Jobless claims rise more than expected in latest week; wages rise ~US STOCKS-Wall St tumbles; Dow, S&P; turn negative for July * Indexes down: Dow 0.7 pct, S&P; 0.8 pct, Nasdaq 0.9 pct   (Updates to open, adds Chicago PMI data) ~US STOCKS-Futures slump; Dow, S&P; may turn negative for July * Futures down: Dow 132 pts, S&P; 16.5 pts, Nasdaq 35.25 pts   (Updates prices, adds jobless claims data) ~CORRECTED-Exxon Mobil quarterly profit jumps 28 percent July 31 Exxon Mobil Corp, the world's largest publicly traded oil company, said on Thursday its quarterly profit jumped 28 percent on higher prices for crude and natural gas. ~
FB.O,Facebook mobile app to offer free, limited Internet in Zambia SAN FRANCISCO, July 31 Facebook Inc is launching a mobile app that gives users in Zambia free access to a handful of online services on mobile phones, broadening an effort to boost Internet usage in underdeveloped countries. ~
FLR,UPDATE 2-U.S. Senate Democrats relent on transport funding, accept longer extension WASHINGTON, July 31 With time running out to avert cutbacks in federal transportation money due to start on Friday, Democratic leaders in the U.S. Senate agreed to accept a Republican plan to extend funding for highway and transit construction through May 2015. ~U.S. House transportation vote aims to push longer funding extension WASHINGTON, July 31 The U.S. House of Representatives on Thursday was poised to reject a Senate-passed $8.1 billion measure to fund transportation projects through 2014 in a bid to force through Republicans' plans that would extend funding until May. ~
GE,CORRECTED-UPDATE 2-GE credit card unit Synchrony makes muted debut on NYSE (Corrects 17th paragraph to " ... 75 percent of profit", not " ... 75 percent of revenue") ~GE credit card unit Synchrony makes muted debut on NYSE July 31 General Electric Co's credit card unit, Synchrony Financial, made a muted debut on the New York Stock Exchange on Thursday as investors remained ambivalent about a consumer-led U.S. economic recovery. ~GE credit card unit Synchrony Financial prices IPO at $23 per share General Electric Co's  credit card unit, Synchrony Financial , raised $2.88 billion in the biggest initial public offering so far this year, the company said on Wednesday. ~GE credit card unit Synchrony Financial prices IPO at $23 per share July 30 General Electric Co's credit card unit, Synchrony Financial, raised $2.88 billion in the biggest initial public offering so far this year, the company said on Wednesday. ~
GM,Lawyers expect hundreds of claims at start of GM ignition-switch fund NEW YORK, July 31 Several hundred claims are expected to be filed at the start of a GM-financed program being launched Friday to compensate victims of a faulty ignition switch on some of its vehicles, lawyers say. ~REPEAT-Soccer-Glazers to raise $150 million by cutting Man Utd stake LONDON, July 30 (Repeats story first filed on Wednesday, no changes to text) The Glazer family will make around $150 million by selling part of its stake in Manchester United although the deal will leave the Americans firmly in control of the English soccer club. ~
GS,Market Chatter- Corporate finance press digest July 31 The following corporate finance-related stories were reported by media: ~
IVZ,UPDATE 2-Invesco 2nd-quarter profit jumps as assets rise NEW YORK, July 31 Invesco Ltd, which oversees the PowerShares line of exchange-traded funds, said on Thursday that second-quarter profit jumped 35.5 percent as strong markets boosted assets under management. ~Invesco's second-quarter profit jumps 35.5 percent NEW YORK, July 31 Invesco Ltd, which oversees the PowerShares line of exchange-traded funds, said on Thursday that its second-quarter profit rose 35.5 percent as strong markets boosted the company's assets under management. ~
K,Kellogg cuts full-year sales forecast as cereal sales fall Kellogg Co, the world's largest maker of breakfast cereal, reported its fifth straight decline in quarterly U.S. cereal sales and said it no longer expects full-year internal sales to rise. ~Kellogg quarterly profit falls 16 percent July 31 Kellogg Co, the world's largest maker of breakfast cereals, reported a 16 percent fall in quarterly profit as sales declined in North America, its biggest market. ~
LLL,UPDATE 3-Whistleblower alerted L-3 to accounting misconduct * Shares down as much as 17 pct   (Adds detail from sources familiar with situation) ~L-3 Communications fires four for misconduct in aerospace unit July 31 L-3 Communications Holdings Inc  said it had fired four employees as part of an ongoing internal review that revealed overstatement of net sales and deferred cost overruns in the company's aerospace business. ~
LM,UPDATE 1-Legg Mason profit rises 51 pct on higher assets under management July 31 Asset manager Legg Mason Inc's  net income rose 51 pct in the first quarter, driven by increased assets under management and lower operating expenses. ~CORRECTED-Legg Mason profit rises 51 pct on higher assets under management (Corrects headline and first paragraph to say profit rose 51 percent, not more than doubled) ~
LYB,UPDATE 1-LyondellBasell stops buying Kurdish crude amid dispute (Adds statement on Blavatnik not being involved in daily operations) ~LyondellBasell emerges as mystery U.S. buyer of Kurdish oil; says no more NEW YORK/HOUSTON, July 31 Chemicals firm LyondellBasell, owned by Ukraine-born billionaire Leonard Blavatnik, has emerged as the mystery American buyer of Kurdish crude oil this year, but said on Thursday it will not be buying any more due to an ownership dispute. ~LyondellBasell says won't buy anymore disputed crude from Iraq HOUSTON LyondellBasell, which has reportedly bought Kurdish crude oil being claimed by Iraq, confirmed on Thursday it has recently purchased "modest quantities of Iraqi crudes" for its Houston Refining unit. ~LyondellBasell says won't buy anymore disputed crude from Iraq HOUSTON, July 31 LyondellBasell, which has reportedly bought Kurdish crude oil being claimed by Iraq, confirmed on Thursday it has recently purchased "modest quantities of Iraqi crudes" for its Houston Refining unit. ~Exclusive: LyondellBasell seen as mystery U.S. buyer of Kurdish oil in May NEW YORK Chemicals firm LyondellBasell, owned by Ukraine-born billionaire Leonard Blavatnik, appears to be the mystery American buyer of two cargoes of Kurdish crude delivered in May, according to U.S. government data and industry sources. ~
MPC,Marathon Petroleum profit rises 44 pct as margins rise July 31 Marathon Petroleum Corp's  quarterly profit rose 44 percent, helped by higher crude refining margins on the Gulf of Mexico coast. ~
MA,UPDATE 1-MasterCard profit rises 10 pct as card usage grows July 31 MasterCard Inc, the world's second-largest debit and credit card company, posted a better-than-expected 10 percent rise in quarterly profit, as more customers used its cards to make purchases. ~MasterCard quarterly profit rises 10 pct July 31 MasterCard Inc, the world's second-largest debit and credit card company, posted a 10 percent rise in quarterly profit, as more customers used cards to make purchases. ~
MCD,UPDATE 4-Food scare driving away Yum, McDonald's diners in China * Yum says China meat scare impact "significant, negative" ~COLUMN-Clashes with Russia point to globalization's end (The opinions expressed here are those of the author, a columnist for Reuters.) ~
MSFT.O,Microsoft ordered by U.S. judge to submit customer's emails from abroad NEW YORK Microsoft Corp must turn over a customer's emails and other account information stored in a data center in Ireland to the U.S. government, a judge ruled on Thursday, in a case that has drawn concern from privacy groups and major technology companies. ~US judge orders Microsoft turn over customer's emails from overseas NEW YORK, July 31 Microsoft Corp must turn over a customer's emails and other account information stored in a data center in Ireland to the U.S. government, a U.S. judge ruled on Thursday, in a case that has drawn concern from privacy groups and major technology companies. ~UPDATE 2-New products to return Taiwan's HTC to growth by year end * Company looking for efficiencies in sales and marketing ~RPT-INSIGHT-European regulators training sights on Google's mobile software (Repeats July 30 INSIGHT with no changes to headline or text) ~
MS,Quarterly profit dips at Japan's MUFG, dives at Mizuho, SMFG TOKYO Mitsubishi UFJ Financial Group (MUFG)  reported a far milder quarterly profit decline than its main banking rivals as aggressive overseas expansion dulled the impact of perennially weak loan demand at home. ~WRAPUP 2-Quarterly profit dips at Japan's MUFG, dives at Mizuho, SMFG * Mizuho, SMFG stock-related gains drop vs year prior   (Recasts, adds profit breakdown, analyst comments, context) ~
MUR,ONGC, Oil India submit $1.5 bln joint bid for Murphy Oil's Malaysia assets-sources MUMBAI, July 31 India's state-owned Oil & Natural Gas Corp and Oil India Ltd have submitted a joint bid worth about $1.5 billion to buy Murphy Oil Corp's Malaysian oil and gas assets, sources directly involved in the process said. ~
OXY,UPDATE 1-Oil bull Hall's fund up 20 pct at half-year, outpacing rivals NEW YORK, July 31  Famed oil trader Andy Hall's more than $3 billion hedge fund was up nearly 20 percent at the half-year mark, sharply outpacing its rivals in one of the best performances of its seven-year history, data obtained by Reuters showed on Thursday. ~Occidental Petroleum's profit rises 8 pct on higher prices July 31 Occidental Petroleum Corp  reported an 8.2 percent rise in profit for the second quarter, helped by higher prices for crude oil and natural gas. ~
PEP,UPDATE 4-Target names outsider as CEO after data breach * Target appoints Pepsi executive Brian Cornell as CEO   (Adds analysts' comments, updates shares) ~Target to hire Pepsi executive Brian Cornell as CEO - WSJ July 31 Target Corp is hiring PepsiCo Inc executive Brian Cornell as its new chief executive, the Wall Street Journal reported. ~
PFE,UPDATE 3-AstraZeneca raises forecasts after seeing off Pfizer * Now assuming generic Nexium in U.S. from Oct. 1   (Adds CEO comments from conference call, further analyst comment) ~BRIEF-Astra CEO says Nov. 18 investor day to focus on progress, no comment on Pfizer July 31 AstraZeneca PLC CEO Pascal Soriot told reporters:  * CEO says can't comment on Pfizer, says November 18 investor day will focus on ~BG, Shell boost Britain's FTSE after profits rise EDINBURGH, July 31 British blue chip shares rose on Thursday, boosted by better than expected earnings reports, with the oil and gas sector lifted by rising profits. ~AstraZeneca smashes forecasts in Q2 after seeing off Pfizer LONDON, July 31 AstraZeneca smashed forecasts for second-quarter sales and earnings on Thursday, demonstrating resilience after seeing off a $118 billion takeover approach from rival drugmaker Pfizer two months ago. ~
LUV,Southwest Airlines, SeaWorld to end marketing partnership TAMPA, Fla., July 31 Southwest Airlines and SeaWorld said on Thursday they are ending a longtime marketing partnership, as the airline faces pressure from animal rights groups critical of the marine life conditions at its popular tourist attractions. ~
TGT,UPDATE 4-Target names outsider as CEO after data breach * Target appoints Pepsi executive Brian Cornell as CEO   (Adds analysts' comments, updates shares) ~Target to hire Pepsi executive Brian Cornell as CEO - WSJ July 31 Target Corp is hiring PepsiCo Inc executive Brian Cornell as its new chief executive, the Wall Street Journal reported. ~
BK,BNY confirms still holding Argentina bond monies NEW YORK, July 31 (IFR) - Bank of New York Mellon (BNY) sent a formal letter Thursday to holders of Argentina's exchange bonds essentially confirming that the sovereign had defaulted. ~
MOS,Mosaic second-quarter profit falls 42 pct July 31 U.S. fertilizer company Mosaic Co  reported a 42 percent slump in quarterly profit, hurt by weak potash prices. ~Mosaic second-quarter profit falls 42 pct July 31 U.S. fertilizer company Mosaic Co  reported a 42 percent slump in quarterly profit, hurt by weak potash prices. ~
VMC,UPDATE 2-U.S. Senate Democrats relent on transport funding, accept longer extension WASHINGTON, July 31 With time running out to avert cutbacks in federal transportation money due to start on Friday, Democratic leaders in the U.S. Senate agreed to accept a Republican plan to extend funding for highway and transit construction through May 2015. ~U.S. House transportation vote aims to push longer funding extension WASHINGTON, July 31 The U.S. House of Representatives on Thursday was poised to reject a Senate-passed $8.1 billion measure to fund transportation projects through 2014 in a bid to force through Republicans' plans that would extend funding until May. ~
WMT,GE credit card unit Synchrony makes muted debut on NYSE General Electric Co's  credit card unit, Synchrony Financial , made a muted debut on the New York Stock Exchange on Thursday as investors remained ambivalent about the chances of a consumer-led U.S. economic recovery. ~CORRECTED-UPDATE 2-GE credit card unit Synchrony makes muted debut on NYSE (Corrects 17th paragraph to " ... 75 percent of profit", not " ... 75 percent of revenue") ~GE credit card unit Synchrony Financial prices IPO at $23 per share July 30 General Electric Co's credit card unit, Synchrony Financial, raised $2.88 billion in the biggest initial public offering so far this year, the company said on Wednesday. ~
WU,Western Union profit falls as costs rise July 31 Western Union Co, the world's largest money-transfer company, reported a 2 percent fall in quarterly profit as costs rose slightly. ~
YUM,UPDATE 4-Food scare driving away Yum, McDonald's diners in China * Yum says China meat scare impact "significant, negative" ~
