AMZN.O,UK court ruling may prompt more scrutiny of Amazon tax plans LONDON, March 7 Amazon's tax affairs could come under more scrutiny in Britain, tax experts said, after a judge questioned whether it really was organized in the tax efficient way it said it was. ~
ADP.O,RPT-FOREX-Euro hits 2014 high vs dollar, may get boost from U.S. data * Expectations for U.S. jobs lowered by soft ADP, ISM reports ~FOREX-Euro hits 2014 high vs dollar, may get boost from U.S. data * Expectations for U.S. jobs lowered by soft ADP, ISM reports ~FOREX-Euro clings to post-ECB gains, U.S. jobs data eyed * Dollar/yen hovers near 5-week high, Ukraine wariness seen capping gains ~FOREX-Euro holds gains after ECB relief rally, U.S. jobs data eyed * Dollar firm versus yen, Ukraine wariness seen capping gains ~
BAC,BofA executives' pay rose 12 percent in 2013 March 7 Bank of America Corp gave its top executives a collective 12 percent pay raise in 2013, according to a filing with the U.S. Securities and Exchange Commission on Friday. ~
BBT,ON THE MOVE-BB&T; hires two financial advisers from Morgan Stanley March 7 BB&T; Corp's brokerage unit said on Friday it hired two veteran advisers from Morgan Stanley . ~
BA,UPDATE 3-Boeing reports wing cracks on 787 Dreamliners in production NEW YORK, March 7 Boeing Co said on Friday that "hairline cracks" had been discovered in the wings of about 40 787 Dreamliners that are in production, marking another setback for the company's newest jet. ~Boeing reports wing cracks on 787 Dreamliners still in production NEW YORK, March 7 Boeing Co said on Friday that "hairline cracks" had been discovered in the wings of 787 Dreamliner jets still in production, a condition that could delay deliveries of some jets but will not affect its 2014 guidance on overall deliveries for the year. ~UPDATE 1-Airline shake-ups dent Airbus order surge in Feb PARIS, March 7 Airline shake-ups in Indonesia and Serbia dented a surge in orders for Airbus aircraft in February, but the European planemaker edged ahead in its annual order race with Boeing, company data showed on Friday. ~UPDATE 2-China's Juneyao in talks with Boeing, Airbus on plane orders - chairman BEIJING, March 6 China's Juneyao Group, the parent of Juneyao Airlines, is in talks with planemaker Boeing  and Airbus about acquiring more than 20 more planes in a deal that may be worth more than $1.8 billion, its chairman said on Thursday. ~
CVX,Chevron's U.S. win in Ecuador case looms over cases elsewhere NEW YORK, March 7 Ecuadorean villagers who are trying to get billions of dollars from Chevron Corp for pollution in the Amazon jungle are ready to refocus their fight on pending suits in other countries after a setback in the United States. ~CERAWEEK-UPDATE 1-Latin America takes oil spotlight despite troubles HOUSTON, March 7 Nationalizations, currency controls, contract changes, subsidies and political instability over the last 15 years have not prevented energy investors from showing renewed interest in Latin America. ~
C,BRIEF-Guy Hands' Terra Firma ends U.S. lawsuit vs Citigroup over EMI, may continue in England March 7 Citigroup Inc :  * Guy hands' terra firma capital partners agrees to end U.S. lawsuit against ~
DOW,BRIEF-Downer EDI says offer for Spotless Group now closed * Confirms that its offer for Spotless was not extended and has now closed. Source text for Eikon: Further company coverage: ~BRIEF-Downer EDI posts FY net profit of $181.5 million * FY total revenue and other income from ordinary activities $7.29 billion , up 6.4 percent ~BRIEF-Downer EDI says ‍offer for Spotless Group extended to 28 August 2017​ * ‍Offer for Spotless Group extended to 7pm on Monday, 28 august 2017​ Source text for Eikon: Further company coverage: ~BRIEF-Downer EDI says Spotless ‍offer extended to Aug 21, 2017​ * Spotless ‍offer extended to 7pm on monday, 21 august 2017​ Source text for Eikon: Further company coverage: ~BRIEF-Downer EDI's takeover offer for Spotless Group extended till 7pm (Sydney time) on Aug. 14 * Unconditional takeover offer for Spotless Group extended until 7:00pm (Sydney time) on Monday, 14 August Source text for Eikon: Further company coverage: (bangalore.newsroom@thomsonreuters.com) ~BRIEF-Downer extends takeover offer for Spotless Group * decided to extend Spotless offer period for one week; offer will now remain open for acceptance until 14 august Source text for Eikon: Further company coverage: ~BRIEF-Downer extends Spotless offer to August 7 2017 * ‍Downer has decided to extend offer for Spotless Group holdings to 7 pm on Monday, 7 august 2017​ Source text for Eikon: Further company coverage: ~BRIEF-Downer EDI's stake in Spotless increases to 80.3 pct * Downer's stake in Spotless increases to 80.3 pct Source text for Eikon: Further company coverage: ~BRIEF- Downer EDI Ltd'S stake in Spotless Group increases to 72% * As Downer's shareholding in Spotless is now over 70%, Downer expects that Spotless will be removed from certain S&P;/ASX market indices ~
FB.O,Man who sued Facebook's Zuckerberg must face fraud charges: judge NEW YORK A New York businessman must face criminal fraud charges for trying to claim a billion-dollar stake in social media company Facebook Inc, a federal judge ruled on Friday. ~Man who sued Facebook's Zuckerberg must face fraud charges -judge NEW YORK, March 7 A New York businessman must face criminal fraud charges for trying to claim a billion-dollar stake in social media company Facebook Inc, a federal judge ruled on Friday. ~Turkish president rejects Facebook, YouTube ban over wiretaps ISTANBUL Turkey's president on Friday ruled out any ban on Facebook and YouTube after Prime Minister Tayyip Erdogan said the sites could be shut to stop his foes anonymously posting audio recordings purportedly exposing corruption in his inner circle. ~UPDATE 3-Turkish president rejects Facebook, YouTube ban over wiretaps * PM Erdogan locked in power struggle with U.S.-based cleric ~FEATURE-Elite security posse fostered founders of WhatsApp, Napster SAN FRANCISCO, March 7 A few days after selling WhatsApp to Facebook for $19 billion, Jan Koum stepped into a suite at the St. Regis Hotel in San Francisco to celebrate with old friends, including CEOs, reformed hackers and a few people who fell into both those camps. ~Ukraine crisis, domestic politics weigh on Turkish assets * Turkish PM moots Facebook, YouTube ban amid leaked recordings ~
GS,UBS's Brazil unit to make quiet return to investment banking -sources SAO PAULO, March 7 UBS AG will restart investment banking operations in Brazil as early as next week, sources said, almost five years after Switzerland's biggest bank sold its highly profitable securities unit there following the global financial crisis. ~
JPM,UPDATE 1-JPMorgan whistleblower gets $63.9 mln in mortgage fraud deal March 7 A whistleblower will be paid $63.9 million for providing tips that led to JPMorgan Chase & Co's  agreement to pay $614 million and tighten oversight to resolve charges that it defrauded the government into insuring flawed home loans. ~JPMorgan whistleblower gets $63.9 million in mortgage fraud accord March 7 A whistleblower will be paid $63.9 million for providing tips that led to JPMorgan Chase & Co's  agreement to pay $614 million and tighten oversight to resolve charges that it defrauded the government into insuring flawed home loans. ~Appeals court acquits banks in Milan derivatives case MILAN A Milan appeals court has acquitted four international banks, including JPMorgan and UBS, found guilty in an earlier trial of mis-selling derivatives to the city of Milan. ~UPDATE 1-Appeals court acquits banks in Milan derivatives case MILAN, March 7 A Milan appeals court has acquitted four international banks, including JPMorgan  and UBS, found guilty in an earlier trial of mis-selling derivatives to the city of Milan. ~
MA,UPDATE 3-MasterCard, Visa form group to push for better card security March 7 Visa Inc and MasterCard Inc  said they had launched a cross-industry group to improve security for card transactions and press U.S. retailers and banks to meet a 2015 deadline to adopt technology that would make it safer to pay with plastic. ~Mastercard, Visa form cross-industry group for payment security Credit card companies MasterCard Inc  and Visa Inc  said they had formed a new cross-industry group to enhance payment system security across networks. ~Mastercard, Visa form cross-industry group for payment security March 7 Credit card companies MasterCard Inc  and Visa Inc said they had formed a new cross-industry group to enhance payment system security across networks. ~
MS,ON THE MOVE-BB&T; hires two financial advisers from Morgan Stanley March 7 BB&T; Corp's brokerage unit said on Friday it hired two veteran advisers from Morgan Stanley . ~Mentor women after maternity leave, says Morgan Stanley boss LONDON For top Morgan Stanley financier Cecile Houlot-Hillary, every day brings pressure in the form of complex bond deals, intense competition and demands from high level clients. ~REFILE-Mentor women after maternity leave, says Morgan Stanley boss LONDON, March 7 For top Morgan Stanley financier Cecile Houlot-Hillary, every day brings pressure in the form of complex bond deals, intense competition and demands from high level clients. ~
REGN.O,UPDATE 3-U.S. FDA probes cognitive impact of new cholesterol drugs March 7 The U.S. Food and Drug Administration has asked Regeneron Pharmaceuticals Inc and Sanofi SA  to assess potential neurocognitive side effects of their experimental cholesterol drug, Sanofi said in its annual report on Friday. ~UPDATE 1-U.S. FDA asks Sanofi, Regeneron to assess cholesterol drug's cognitive risks March 7 The U.S. Food and Drug Administration has asked Regeneron and Sanofi to assess potential neurocognitive side effects of their experimental cholesterol drug, Sanofi said in its annual report on Friday. ~U.S. FDA probes cognitive impact of new cholesterol drugs; Regeneron, Sanofi shares fall March 7 The U.S. Food and Drug Administration has called for an assessment of potential neurocognitive side effects of an experimental cholesterol drug being developed by Regeneron and Sanofi, Sanofi said in its annual report on Friday. ~
DIS,Walt Disney, Shanghai Media Group to develop Disney-branded movies March 7 Walt Disney Studios has signed an agreement with Shanghai Media Group Pictures to develop Disney-branded movies, the latest move by a U.S. studio to grow its presence in China's entertainment business. ~
VZ,U.S. extends Terremark contract as HealthCare.gov host WASHINGTON, March 7 The Obama administration said on Friday Verizon Communications Inc's Terremark unit will remain under contract as host of the federal website HealthCare.gov to better ensure a smooth end to Obamacare's open enrollment period on March 31. ~
V,BRIEF-Visa calls for redemption all of its 1.200 pct notes due 2017 * Visa Inc - on Sept 11, co called for redemption all of $1.75 billion principal amount outstanding of its 1.200 pct notes due 2017‍​ - SEC filing ~BRIEF-Visa Inc files for three-part senior notes offering of up to $2.5 bln * Visa Inc says files for three-part senior notes offering of up to $2.5 billion - SEC filing‍​ ~Former BoE deputy Hogg to join Visa as Europe unit CEO Visa Inc, the world's largest payments processor, on Thursday named former Bank of England (BoE) deputy governor Charlotte Hogg as chief executive of its Europe division. ~CORRECTED-UPDATE 1-MOVES-Former BoE deputy Hogg to join Visa as Europe unit CEO Sept 7 Visa Inc, the world's largest payments processor, on Thursday named former Bank of England (BoE) deputy governor Charlotte Hogg as chief executive of its Europe division. ~MOVES-Visa names ex-BoE deputy Charlotte Hogg as Europe unit CEO Sept 7 Visa Inc, the world's largest payments processor, on Thursday named Charlotte Hogg as chief executive of its Europe division. ~BRIEF-Visa appoints Charlotte Hogg as CEO of European operations * Visa Inc appoints Charlotte Hogg as chief executive officer of the compan's European operations ~BRIEF-Visa Inc files prospectus supplement for potential three-part senior notes offering * Visa Inc files prospectus supplement for potential three-part senior notes offering; size not disclosed - sec filing‍​ Source text (http://bit.ly/2vLDrIe) Further company coverage: ~BRIEF-Visa enables on the go payments with the new Fitbit Ionic * Visa inc- ‍enabling visa payments on fitbit's smartwatch fitbit ionic​ ~BRIEF-Bridg raises $11 million in Series B funding * Bridg raises $11 million in Series B funding from Morpheus Ventures, March Capital, Visa and NextEquity ~
