ABBV.N,UPDATE 2-Google's Calico, AbbVie forge deal against diseases of aging Sept 3 U.S. drugmaker AbbVie Inc and Calico, a new company set up by Google Inc to cure diseases of aging, will each invest $250 million to help create Calico research facilities and collaborate on discovery and development of new medicines. ~AbbVie, Calico forge deal against age-related diseases   ~
AET,U.S. healthcare spending growth to slow further - gov't report WASHINGTON, Sept 3 U.S. healthcare spending is expected to grow more slowly in the coming decade as a sluggish economic recovery and higher cost sharing in private insurance plans limit demand for services, a government report released on Wednesday said. ~
GOOGL.O,UPDATE 1-Apple, Google resume talks with tech workers in hiring lawsuit -filing SAN FRANCISCO, Sept 3 Four technology companies, including Apple and Google, have resumed mediation talks with tech workers in a high-profile lawsuit over hiring practices in Silicon Valley, according to a court filing. ~Google's Calico, AbbVie forge deal against diseases of aging U.S. drugmaker AbbVie Inc  and Calico, a new company set up by Google Inc  to cure diseases of aging, will each invest $250 million to help create Calico research facilities and collaborate on discovery and development of new medicines. ~UPDATE 2-Google's Calico, AbbVie forge deal against diseases of aging Sept 3 U.S. drugmaker AbbVie Inc and Calico, a new company set up by Google Inc to cure diseases of aging, will each invest $250 million to help create Calico research facilities and collaborate on discovery and development of new medicines. ~Apple, Google resume talks with tech workers in hiring lawsuit -filing SAN FRANCISCO, Sept 3 Four tech companies including Apple and Google have resumed mediation talks with tech workers who are suing over hiring practices in Silicon Valley, according to a court filing on Wednesday. ~AbbVie, Calico forge deal against age-related diseases   ~India's smartphone wars: Google's Android One adds to Samsung's worries * Android One threatens much pricing pressure for Samsung ~Google starts quantum computing research project Google Inc said a research team led by physicist John Martinis from the University of California Santa Barbara will join the company to start a project to build new quantum information processors based on superconducting electronics. ~Google starts quantum computing research project Sept 2 Google Inc said a research team led by physicist John Martinis from the University of California Santa Barbara will join the company to start a project to build new quantum information processors based on superconducting electronics. ~
GOOG.O,UPDATE 1-Apple, Google resume talks with tech workers in hiring lawsuit -filing SAN FRANCISCO, Sept 3 Four technology companies, including Apple and Google, have resumed mediation talks with tech workers in a high-profile lawsuit over hiring practices in Silicon Valley, according to a court filing. ~Google's Calico, AbbVie forge deal against diseases of aging U.S. drugmaker AbbVie Inc  and Calico, a new company set up by Google Inc  to cure diseases of aging, will each invest $250 million to help create Calico research facilities and collaborate on discovery and development of new medicines. ~UPDATE 2-Google's Calico, AbbVie forge deal against diseases of aging Sept 3 U.S. drugmaker AbbVie Inc and Calico, a new company set up by Google Inc to cure diseases of aging, will each invest $250 million to help create Calico research facilities and collaborate on discovery and development of new medicines. ~Apple, Google resume talks with tech workers in hiring lawsuit -filing SAN FRANCISCO, Sept 3 Four tech companies including Apple and Google have resumed mediation talks with tech workers who are suing over hiring practices in Silicon Valley, according to a court filing on Wednesday. ~AbbVie, Calico forge deal against age-related diseases   ~India's smartphone wars: Google's Android One adds to Samsung's worries * Android One threatens much pricing pressure for Samsung ~Google starts quantum computing research project Google Inc said a research team led by physicist John Martinis from the University of California Santa Barbara will join the company to start a project to build new quantum information processors based on superconducting electronics. ~Google starts quantum computing research project Sept 2 Google Inc said a research team led by physicist John Martinis from the University of California Santa Barbara will join the company to start a project to build new quantum information processors based on superconducting electronics. ~
AMZN.O,UPDATE 2-Amazon CFO to step down next summer amid investor discontent Sept 3 Amazon.com Inc's finance chief plans to step down next summer after more than a dozen years at the post, the e-commerce company said on Wednesday, at a time when more investors have been complaining about skimpy profits and high spending. ~
AAPL.O,RPT-US STOCKS SNAPSHOT-S&P; 500, Nasdaq end down with Apple NEW YORK, Sept 3 The Nasdaq and S&P; 500 ended lower on Wednesday, dragged down by a drop in shares of Apple , while the Dow finished with a slight gain. ~Apple, Google resume talks with tech workers in hiring lawsuit: filing SAN FRANCISCO Four technology companies, including Apple  and Google , have resumed mediation talks with tech workers in a high-profile lawsuit over hiring practices in Silicon Valley, according to a court filing. ~UPDATE 1-Apple, Google resume talks with tech workers in hiring lawsuit -filing SAN FRANCISCO, Sept 3 Four technology companies, including Apple and Google, have resumed mediation talks with tech workers in a high-profile lawsuit over hiring practices in Silicon Valley, according to a court filing. ~Apple, Google resume talks with tech workers in hiring lawsuit -filing SAN FRANCISCO, Sept 3 Four tech companies including Apple and Google have resumed mediation talks with tech workers who are suing over hiring practices in Silicon Valley, according to a court filing on Wednesday. ~Apple says its systems not to blame for celebrity photo breach SAN FRANCISCO (This story corrects reputation.com CEO's last name to Fertik, instead of Fertike, on second reference, 15th paragraph) ~BUZZ-U.S. Stocks on the Move-Apple, Mobileye, Local Corp, Marrone (For faster updates on individual market-movers, Eikon users please use search string "STXBZ US"; for more market insights, including options activity, ; for the Day Ahead newsletter, http://link.reuters.com/mex49s; for the Morning Call newsletter, http://link.reuters.com/nex49s) ~UPDATE 1-Apple shares slump ahead of Sept 9 iPhone launch NEW YORK, Sept 3 Apple Inc shares were on track Wednesday for their worst day since January just days ahead of the launch of its latest iPhone, with one brokerage warning of a stock downgrade unless its new products show better promise for profit growth. ~Samsung unveils Galaxy Note 4 with extras but no breakaway features * Note 4 adds novel accessories, fixes prior design missteps ~RPT-Celebrity hacking clouds Apple's upcoming product launch SAN FRANCISCO, Sept 3 Apple Inc has often displayed uncanny timing, with its well-orchestrated end-of-year iPhone releases. But the leak of racy celebrity photos in the past few days put the company in the unusual position of having to mend its image just days before a highly anticipated Sept. 9 product launch. ~
BAC,UPDATE 1-Market Chatter-Corporate finance press digest Sept 3 The following corporate finance-related stories were reported by media: ~Market Chatter- Corporate finance press digest Sept 3 The following corporate finance-related stories were reported by media: ~JPMorgan in talks to sell oil-supply agreement to BoA: WSJ JPMorgan Chase & Co  is in talks to sell its oil-supply agreement with a major Philadelphia refinery to Bank of America Corp , the Wall Street Journal reported Tuesday, citing people familiar with the matter. ~
BBT,UPDATE 2-Citi sells more branches in Texas to BB&T; (Adds comments from BB&T; CEO, additional information on Citigroup's strategy; updates share prices) ~Janney adds exec to New York office from BB&T; NEW YORK Philadelphia-based brokerage Janney Montgomery Scott LLC said on Wednesday it hired a new vice president of investments for its New York City office. ~ON THE MOVE-Janney adds exec to New York office from BB&T; NEW YORK, Sept 3 Philadelphia-based brokerage Janney Montgomery Scott LLC said on Wednesday it hired a new vice president of investments for its New York City office. ~BB&T; to buy 41 branches in Texas from Citi Sept 3 BB&T; Corp agreed to buy 41 branches in Texas from Citigroup Inc, adding to the 21 it had acquired last December in the state from Citi. ~
C,Deals of the day- Mergers and acquisitions (Adds Family Dollar Stores, Ryanair, Dassault Aviation, Citigroup, BP, Mutuelle Generale) ~Citi sells more branches in Texas to BB&T; Citigroup Inc  agreed to sell another 41 branches in Texas to BB&T; Corp  as the third-largest U.S. bank cuts back on brick-and-mortar outlets and focuses on online banking. ~UPDATE 2-Citi sells more branches in Texas to BB&T; (Adds comments from BB&T; CEO, additional information on Citigroup's strategy; updates share prices) ~
CMCSA.O,Xfinity to become title sponsor of NASCAR's second-tier series Internet provider Xfinity will become the title sponsor of NASCAR's second-tier series, currently the Nationwide Series, in a 10-year deal that runs through 2024, NASCAR and Comcast Corp said Wednesday. ~Xfinity to become title sponsor of NASCAR's second-tier series Sept 3 Internet provider Xfinity will become the title sponsor of NASCAR's second-tier series, currently the Nationwide Series, in a 10-year deal that runs through 2024, NASCAR and Comcast Corp said Wednesday. ~Charter, Comcast name spin-off company GreatLand Connections Charter Communications Inc and Comcast Corp said a new cable company to be spun off from Comcast after it buys Time Warner Cable Inc will be called GreatLand Connections Inc. ~Charter, Comcast name spin-off company GreatLand Connections Sept 3 Charter Communications Inc and Comcast Corp said a new cable company to be spun off from Comcast after it buys Time Warner Cable Inc will be called GreatLand Connections Inc. ~
COST.O,Costco is fined, to fix refrigerant leaks in Clean Air Act case Sept 3 Costco Wholesale Corp will pay a $335,000 fine and spend about $2 million over three years to fix refrigerant leaks and make other improvements at 274 stores to settle allegations that the warehouse club operator violated the federal Clean Air Act. ~
DHI,Toll Brothers profit doubles on higher home prices Toll Brothers Inc's quarterly income more than doubled as the largest U.S. luxury homebuilder sold more homes at higher prices. | Video  ~UPDATE 1-Toll Brothers profit doubles on higher home prices Sept 3 Toll Brothers Inc's quarterly income more than doubled as the largest U.S. luxury homebuilder sold more homes at higher prices. ~
DAL,US STOCKS-Wall St mixed as Apple weighs on Nasdaq * Dow up 0.14 pct, S&P; flat, Nasdaq off 0.44 pct   (Updates to afternoon, adds detail on Apple shares) ~U.S. airlines stocks fall after Delta trims margin outlook U.S. airlines stocks fell on Wednesday after Delta Air Lines  trimmed its operating margin forecast and reported that international passenger traffic lagged slightly in August, heightening concerns that other U.S. carriers might encounter similar headwinds. ~U.S. airlines stocks fall after Delta trims margin outlook Sept 3 U.S. airlines stocks fell on Wednesday after Delta Air Lines trimmed its operating margin forecast and reported that international passenger traffic lagged slightly in August, heightening concerns that other U.S. carriers might encounter similar headwinds. ~Virgin Atlantic says on track for 2014 return to profit LONDON, Sept 3 Britain's Virgin Atlantic  said it was on track to make an annual profit by the end of this year, after two years of running at a loss, and announced plans to increase its focus on trans-Atlantic routes to help boost future earnings. ~
FB.O,UPDATE 1-Facebook goes down for some U.S. users SAN FRANCISCO, Sept 3 Facebook Inc went down briefly for an unknown number of U.S. users on Wednesday afternoon in what appeared to be the latest outage to affect the world's largest social network. ~US STOCKS-Wall Street ends mixed as Apple weighs on Nasdaq * Dow up 0.06 pct, S&P; down 0.08 pct, Nasdaq off 0.56 pct   (Updates to close) ~Facebook goes down for some U.S. users SAN FRANCISCO, Sept 3 Facebook Inc went down for an unknown number of U.S. users on Wednesday afternoon, in what appeared to be the latest outage to affect the world's largest social network. ~US STOCKS-Wall St mixed as Apple weighs on Nasdaq * Dow up 0.14 pct, S&P; flat, Nasdaq off 0.44 pct   (Updates to afternoon, adds detail on Apple shares) ~UPDATE 1-Samsung launches virtual reality headset for Galaxy Note 4 Sept 3 Samsung Electronics Co Ltd  has launched a virtual reality headset for its new Galaxy Note 4 phablet using technology from Oculus VR, a company that Facebook Inc acquired for $2 billion. ~Samsung launches virtual reality headset for Galaxy Note 4 Samsung Electronics Co Ltd has launched a virtual reality headset for its new Galaxy Note 4 phablet using technology from Oculus VR, a company that Facebook Inc is buying for $2 billion. ~
F,WRAPUP 3-Strong factory orders, auto sales brighten U.S. economic picture (Adds final auto sales figure, analyst comment; updates markets) ~Carmakers report best U.S. August since 2003 DETROIT U.S. August auto sales were the highest for that month in more than a decade, thanks in part to heavy discounting by the manufacturers and a strong Labor Day weekend close, with the industry selling at an annualized pace not seen since early 2006. | Video  ~UPDATE 5-Carmakers report best U.S. August since 2003 DETROIT, Sept 3 U.S. August auto sales were the highest for that month in more than a decade, thanks in part to heavy discounting by the manufacturers and a strong Labor Day weekend close, with the industry selling at an annualized pace not seen since early 2006. ~US STOCKS-Wall St climbs to fresh record on Ukraine hopes, data * Indexes: Dow up 0.34 pct, S&P; 500 up 0.17 pct, Nasdaq off 0.1 pct   (Updates to market open; adds quote) ~Ford sees U.S. August industry auto sales up 3 percent DETROIT Ford Motor Co  sales analyst Erich Merkle said the company expects U.S. auto industry sales to rise 3 percent in August, easily beating expectations of a 0.1 percent gain. ~Ford sees U.S. August industry auto sales up 3 percent DETROIT Ford Motor Co  sales analyst Erich Merkle said the company expects U.S. auto industry sales to rise 3 percent in August, easily beating expectations of a 0.1 percent gain. ~Ford sees U.S. August industry auto sales up 3 percent DETROIT, Sept 3 Ford Motor Co sales analyst Erich Merkle said the company expects U.S. auto industry sales to rise 3 percent in August, easily beating expectations of a 0.1 percent gain. ~
GD,UK to sign $5.8 bln deal with General Dynamics for armoured vehicles Sept 3 The British government said it would sign a deal worth 3.5 billion pounds ($5.76 billion) on Wednesday with General Dynamics for new armoured fighting vehicles, its biggest single order for such vehicles in over 30 years. ~
GE,GE's 3D mammography device gets U.S. FDA approval Sept 2 General Electric Co's healthcare unit last week won U.S. Food and Drug Administration approval for its mammography device that produces three-dimensional images to detect breast cancer. ~
GM,UPDATE 5-Carmakers report best U.S. August since 2003 DETROIT, Sept 3 U.S. August auto sales were the highest for that month in more than a decade, thanks in part to heavy discounting by the manufacturers and a strong Labor Day weekend close, with the industry selling at an annualized pace not seen since early 2006. ~BRIEF-GM says all vehicles inventory at August-end 727,325 units * GM says all vehicles inventory at August-end 727,325 units vs 737,731 units at July-end  Further company coverage:    (Reporting by Narottam Medhora in Bangalore) ~BRIEF-GM says delivered 272,423 vehicles in U.S. in August * GM says delivered 272,423 vehicles in U.S. in August;  total deliveries were down 1 percent versus last August ~
GS,U.S. court reverses fee award to ex-Goldman programmer Goldman Sachs Group Inc should not have been ordered to pay former programmer Sergey Aleynikov's legal fees to defend against criminal charges that he stole secret code from the bank's computers, a divided federal appeals court ruled on Wednesday. ~UPDATE 1-U.S. court reverses fee award to ex-Goldman programmer Sept 3 Goldman Sachs Group Inc should not have been ordered to pay former programmer Sergey Aleynikov's legal fees to defend against criminal charges that he stole secret code from the bank's computers, a divided federal appeals court ruled on Wednesday. ~U.S. court reverses fee award to ex-Goldman programmer Sept 3 Goldman Sachs Group Inc should not have been ordered to pay former programmer Sergey Aleynikov's legal fees to defend against criminal charges that he stole secret code from the bank's computers, a divided federal appeals court ruled on Wednesday. ~
HD,UPDATE 1-Almost all U.S. Home Depot stores may have been hit by breach -new data CHICAGO, Sept 3 Customer data could have been stolen from nearly all of Home Depot Inc's stores in the United States, according to new information released on Wednesday by security website KrebsonSecurity. ~Almost all U.S. Home Depot stores may have been hit by breach -new data CHICAGO, Sept 3 Customer data could have been stolen from nearly all of Home Depot Inc's stores in the United States, according to new information released on Wednesday by security website KrebsonSecurity. ~
JPM,U.S. regulators adopt tighter rules for banks' cash needs WASHINGTON U.S. regulators on Wednesday issued rules for banks to hold enough easy-to-sell assets to keep them afloat during a crunch, after many were caught short of cash during the 2007-09 financial crisis. ~U.S. regulators to vote on liquidity, swap margin rules WASHINGTON, Sept 3 U.S. regulators met on Wednesday to adopt rules for banks to hold enough easy-to-sell assets to keep them afloat during a crunch, after many were caught short of cash during the 2007-09 financial crisis. ~UPDATE 1-Market Chatter-Corporate finance press digest Sept 3 The following corporate finance-related stories were reported by media: ~Market Chatter- Corporate finance press digest Sept 3 The following corporate finance-related stories were reported by media: ~
LMT,UPDATE 2-Pentagon says nearing fix for F-35 engine, Pratt to pay (Recasts to add comments from Pentagon's F-35 program chief) ~Pentagon says cost to fix F-35 engine issue "relatively minor" WASHINGTON, Sept 3 Pentagon chief arms buyer Frank Kendall said the United States was close to a design fix for the Pratt & Whitney engine that powers Lockheed Martin Corp's F-35 fighter jet after a major engine failure in June, and the cost would be "relatively minor." ~
MS,ON THE MOVE-Morgan Stanley hires three brokers who managed nearly $1.3 bln NEW YORK, Sept 3 The largest U.S. securities brokerage by sales force, Morgan Stanley, said Wednesday it hired three financial advisers who collectively managed $1.275 billion in client assets away from rival brokerages just before the Labor Day holiday weekend. ~
NOC,Russia, China aim to close military technology gap with U.S. -Hagel NEWPORT, Rhode Island, Sept 3 Russia and China are trying to close the technology gap with the U.S. military and developing weapons systems that appear designed to counter traditional U.S. advantages, Defense Secretary Chuck Hagel said on Wednesday. ~
ORCL.N,Deals of the day- Mergers and acquisitions (Adds Family Dollar Stores, Ryanair, Dassault Aviation, Citigroup, BP, Mutuelle Generale) ~BUZZ-U.S. Stocks on the Move-Apple, Mobileye, Local Corp, Marrone (For faster updates on individual market-movers, Eikon users please use search string "STXBZ US"; for more market insights, including options activity, ; for the Day Ahead newsletter, http://link.reuters.com/mex49s; for the Morning Call newsletter, http://link.reuters.com/nex49s) ~US STOCKS-Wall St to open higher on Ukraine, Russia truce hopes * Futures up: Dow 67 pts, S&P; 6.5 pts, Nasdaq 12.25 pts   (Updates prices, adds Russian indexes) ~US STOCKS-Futures higher on Ukraine, Russia optimism NEW YORK, Sept 3 U.S. stock index futures rose on Wednesday, on hopes a resolution would be reached between Ukraine and Russia and ahead of the latest batch of data which could provide insight on the health of the economy. ~UPDATE 1-Market Chatter-Corporate finance press digest Sept 3 The following corporate finance-related stories were reported by media: ~Market Chatter- Corporate finance press digest Sept 3 The following corporate finance-related stories were reported by media: ~
PSX,Phillips 66 says adding railcars to move crude to coastal refineries HOUSTON, Sept 3 Phillips 66 is buying more railcars to eventually move up to 185,000 barrels per day (bpd) of North Dakota Bakken crude oil to its refineries on the East and West coasts, Chief Executive Officer Greg Garland told analysts on Wednesday. ~
PXD,Pioneer in talks to sell condensate overseas NEW YORK, Sept 3 Pioneer Natural Resources , benefited from improved pricing as a result of its ability to sell an ultra-light oil called condensate outside of the United States. ~
KO,Keurig expands deal with Coca-Cola to sell iced tea pods Sept 3 Keurig Green Mountain Inc  expanded its deal with Coca-Cola Co to sell the beverage company's Honest Tea pods in its Keurig hot brewing machines in North America. ~
VZ,Verizon to pay $7.4 mln over failure to notify consumers on privacy rights WASHINGTON, Sept 3 Verizon Communications Inc will pay $7.4 million to settle a U.S. investigation that found the company failed to notify properly some customers of their privacy rights before using their information for marketing, U.S. regulators said on Wednesday. ~U.S. says Verizon to pay $7.4 mln in consumer privacy probe WASHINGTON, Sept 3 Telecommunications company Verizon Communications will pay $7.4 million to settle a consumer privacy investigation, the Federal Communications Commission said on Wednesday. ~
YUM,UPDATE 1-Yum estimates China same-store sales fell 13 pct due to food safety scare Sept 3 Yum Brands Inc estimated same-store sales in China fell about 13 percent in the third quarter and continue to decline, hurt by a food safety scare in late July when a former supplier was said to have used expired meat. ~Yum estimates China same-store sales fell 13 pct after food safety scare Sept 3 Yum Brands Inc estimated same-store sales in China fell about 13 percent in the third quarter as a results of a food safety scare in July when a former supplier was said to have improperly handled meat and used expired food. ~
ZTS,UPDATE 1-Zoetis granted conditional license by USDA for PEDv vaccine * Stock price hits record high   (Adds USDA comment, stock price) ~Zoetis granted conditional license by USDA for PEDv vaccine CHICAGO, Sept 3Zoetis Inc, the world's largest animal-health company, has received a conditional license from the U.S. Agriculture Department for its vaccine against a deadly piglet virus and will begin selling it this month in the United States, the company said on Wednesday. ~
