ACN,Early Match Play exits for Poulter and Donald Unpredictability was again a recurring theme at the WGC-Accenture Match Play Championship as former champions Ian Poulter and Luke Donald of England, and American Zach Johnson, were all eliminated in Wednesday's first round. ~
AAPL.O,Tesla CEO confirms talks with Apple - Bloomberg TV DETROIT, Feb 20 Tesla Motors Inc has had "conversations" with Apple Inc, Chief Executive Elon Musk confirmed to Bloomberg TV on Thursday, but he would not comment on whether those talks revolved around acquisitions. ~
BRKa.N,Business Wire to stop selling directly to high-frequency traders NEW YORK Business Wire will no longer let high-frequency trading companies buy potentially market-moving press releases directly from the Berkshire Hathaway unit. ~Business Wire to stop selling directly to high-frequency traders NEW YORK, Feb 20 Business Wire will no longer let high-frequency trading companies buy potentially market-moving press releases directly from the Berkshire Hathaway unit. ~EXCLUSIVE-BNSF to take bids to buy up to 5,000 safer oil railcars (Adds details on crude-by-rail growth, safety standards, crashes, share movement, second byline and dateline) ~Exclusive: BNSF taking bids to buy up to 5,000 safer oil railcars HOUSTON BNSF Railway Co aims to buy its own fleet of up to 5,000 new crude oil tank cars with safety features that exceed the latest standards adopted by the industry more than two years ago, the company confirmed on Thursday. ~
CAT,What polar vortex? Caterpillar sales to builders surge despite chill Feb 20 Caterpillar Inc said on Thursday that sales of its construction equipment had surged in recent months, driven by an especially large jump in demand in North America, where a series of severe winter storms and arctic temperatures failed to keep builders out of dealer showrooms. ~
SCHW.N,ON THE MOVE-Veteran Pennsylvania Wells Fargo brokers go independent NEW YORK, Feb 20 A family brokerage team who had been at Wells Fargo Advisors for more than a decade and manage more than $300 million of assets for wealthy clients resigned on Wednesday to start an independent registered investment advisory firm. ~
CMCSA.O,DirecTV CEO urges U.S. scrutiny of Comcast-TWC broadband reach LOS ANGELES DirecTV Chief Executive Officer Mike White on Thursday called for U.S. regulatory scrutiny of Comcast Corp's proposed purchase of Time Warner Cable Inc and the "effective broadband monopoly" he said it might create in as much as two-thirds of the United States. ~DirecTV CEO urges U.S. scrutiny of Comcast-TWC broadband reach LOS ANGELES, Feb 20 DirecTV Chief Executive Officer Mike White on Thursday called for U.S. regulatory scrutiny of Comcast Corp's proposed purchase of Time Warner Cable Inc and the "effective broadband monopoly" he said it might create in as much as two-thirds of the United States. ~COLUMN-Who's afraid of Comcast? Feb 20 Set aside for a moment everything you've read about the $45 billion bid Comcast made for Time Warner Cable last week. Blank from your mind Paul Krugman's prediction that the deal will result in a Comcast monopoly. Pretend you didn't read the New York Times piece about the acquisition presaging further consolidation in the cable market, with Charter Communications picking off Cox Communications. Thump yourself with a neuralyzer, if you can, and remove from your memory the prote ~
CAG,U.S. court says food labeling lawsuit against ConAgra can proceed SAN FRANCISCO, Feb 20 A U.S. appeals court on Thursday revived a lawsuit against ConAgra Foods Inc  over the amount of sodium the company discloses on sunflower seed packages. ~
DOW,BRIEF-Downer EDI says offer for Spotless Group now closed * Confirms that its offer for Spotless was not extended and has now closed. Source text for Eikon: Further company coverage: ~BRIEF-Downer EDI posts FY net profit of $181.5 million * FY total revenue and other income from ordinary activities $7.29 billion , up 6.4 percent ~BRIEF-Downer EDI says ‍offer for Spotless Group extended to 28 August 2017​ * ‍Offer for Spotless Group extended to 7pm on Monday, 28 august 2017​ Source text for Eikon: Further company coverage: ~BRIEF-Downer EDI says Spotless ‍offer extended to Aug 21, 2017​ * Spotless ‍offer extended to 7pm on monday, 21 august 2017​ Source text for Eikon: Further company coverage: ~BRIEF-Downer EDI's takeover offer for Spotless Group extended till 7pm (Sydney time) on Aug. 14 * Unconditional takeover offer for Spotless Group extended until 7:00pm (Sydney time) on Monday, 14 August Source text for Eikon: Further company coverage: (bangalore.newsroom@thomsonreuters.com) ~BRIEF-Downer extends takeover offer for Spotless Group * decided to extend Spotless offer period for one week; offer will now remain open for acceptance until 14 august Source text for Eikon: Further company coverage: ~BRIEF-Downer extends Spotless offer to August 7 2017 * ‍Downer has decided to extend offer for Spotless Group holdings to 7 pm on Monday, 7 august 2017​ Source text for Eikon: Further company coverage: ~BRIEF-Downer EDI's stake in Spotless increases to 80.3 pct * Downer's stake in Spotless increases to 80.3 pct Source text for Eikon: Further company coverage: ~BRIEF- Downer EDI Ltd'S stake in Spotless Group increases to 72% * As Downer's shareholding in Spotless is now over 70%, Downer expects that Spotless will be removed from certain S&P;/ASX market indices ~
ESRX.O,UPDATE 1-Express Scripts sees long-term earnings growth of up to 20 pct Feb 20 Pharmacy benefit manager Express Scripts Holding Co on Thursday forecast 2014 earnings in line with Wall Street expectations and said it sees long-term earnings growth of up to 20 percent per year. ~Express Scripts profit, outlook match Street estimates Feb 20 Pharmacy benefit manager Express Scripts Holding Co  on Thursday reported fourth-quarter profit and issued a 2014 earnings forecast in line with Wall Street expectations. ~
FB.O,US STOCKS-Wall St rises on factory data; Tesla and Facebook jump * Facebook stock turns sharply on WhatsApp buy, hits record high ~Wall Street sees sense in Facebook's $19 billion WhatsApp buy Facebook Inc's purchase of fast-growing messaging startup WhatsApp for an eye-popping $19 billion largely won approval from analysts, who said the deal made strategic sense as it will solidify the social network's position as a leader in mobile. | Video  ~US STOCKS-Wall St rises on manufacturing data, S&P; nears record * Indexes up: Dow 0.68 pct, S&P; 0.57 pct, Nasdaq 0.46 pct ~CANADA STOCKS-TSX nears three-year high on BlackBerry, U.S. data * TSX rises 56.79 points, or 0.40 percent, to 14,176.52     * Nine of 10 main index sectors advance     * BlackBerry jumps almost 4 percent after Facebook move     * TransCanada slips 1.8 percent      By John Tilak     TORONTO, Feb 20 Canada's main stock index rose on Thursday to its highest in nearly 3 years as positive U.S. economic data boosted sentiment and Facebook Inc's  planned acquisition of mobile-messaging service WhatsApp lifted BlackBerry.     The move by Facebook raised  ~US STOCKS-Wall St ticks up after mixed data, Wal-Mart falls NEW YORK, Feb 20 U.S. stocks edged higher in volatile trading on Thursday, as a strong read on manufacturing offset weak results from Wal-Mart and geopolitical and economic uncertainty around the world. ~US STOCKS-Futures dip with global concerns in view; Tesla soars NEW YORK, Feb 20 U.S. stock index futures fell on Thursday, pressured by weak results from Wal-Mart as well as global geopolitical and economic uncertainty that gave investors few reasons to buy despite a sharp selloff in the previous session. ~Facebook to buy WhatsApp for $19 billion in deal shocker Facebook Inc will buy fast-growing mobile-messaging startup WhatsApp for $19 billion in cash and stock in a landmark deal that places the world's largest social network closer to the heart of mobile communications and may bring younger users into the fold. | Video  ~US STOCKS-Futures dip with global concerns in view, Tesla soars NEW YORK, Feb 20 U.S. stock index futures edged lower on Thursday as global geopolitical and economic uncertainty gave investors few reasons to buy despite a sharp selloff in the previous session. ~BUSINESS-NEWS-SCHEDULE AT 0930 GMT / 4.30 AM ET Facebook Inc will buy fast-growing mobile-messaging startup WhatsApp for $19 billion in cash and stock in a landmark deal that places the world's largest social network closer to the heart of mobile communications and may bring younger users into the fold. (WHATSAPP-FACEBOOK/ (UPDATE 3, PICTURE, TV), moved, by Gerry Shih and Sarah McBride, 800 words) ~
GPS,UPDATE 2-Gap to raise hourly pay to $10 in 2015; Wal-Mart remains 'neutral' Feb 19 Apparel retailer Gap Inc said it would raise the hourly pay for its U.S. employees to $9 in June 2014 and $10 in June 2015, after the White House said the minimum wage for federal contract workers would be raised to $10.10 an hour in 2015. ~
GS,U.S. judge asks if Goldman can cover ex-trader Tourre's penalties NEW YORK, Feb 20 A U.S. judge on Thursday weighed the limits of the U.S. Securities and Exchange Commission's ability to punish former Goldman Sachs Group Inc  trader Fabrice Tourre, including whether the agency could block him from asking the bank to cover any penalties. ~Goldman Sachs misses out on WhatsApp, 2014's top deals so far The world's top deal adviser for nine of the past 10 years, Goldman Sachs Group Inc  has been notably absent on 2014's largest mergers and acquisitions, including Facebook's $19 billion deal to purchase mobile messaging service WhatsApp. ~Goldman Sachs misses out on WhatsApp, 2014's top deals so far The world's top deal adviser for nine of the past 10 years, Goldman Sachs Group Inc has been notably absent on 2014's largest mergers and acquisitions, including Facebook's $19 billion deal to purchase mobile messaging service WhatsApp. ~
HPQ,UPDATE 4-HP reins in revenue slide as turnaround progresses SAN FRANCISCO, Feb 20 Hewlett Packard Co's  revenue fell less than Wall Street expected in the first quarter and it raised its outlook for fiscal 2014 earnings as the computing giant grew sales at its two largest businesses and again signaled a better year ahead. ~BRIEF-HP CEO says enterprise group revenue growth possible through remainder of year Feb 20 Hewlett-Packard Co :  * CEO says enterprise group revenue growth possible through remainder of year  * CEO says seeing long-overdue pc replacements at corporations, slight effect ~
HUM,Bearish bets seen on U.S. insurers ahead of Medicare rate announcement NEW YORK, Feb 19 A flurry of bearish bets placed Wednesday in the options for some health insurers caught the eye of several analysts, who said it appears that someone is banking on a sizeable drop in their stocks by the end of the week, which is also when 2015 Medicare payment rates are expected from the government. ~
INTU.O,Intuit raises forecast on demand for DIY tax filing Intuit Inc raised its third-quarter earnings forecast due to strong demand for its online tax-preparation software, TurboTax, in the U.S. tax-filing season. ~Intuit post quarterly loss due to delayed U.S. tax filing Feb 20 Intuit Inc, maker of tax-preparation software TurboTax, reported a second-quarter loss due to a delayed start to the U.S. tax-filing season. ~
JPM,UPDATE 1-Deal with activists lets JPMorgan avoid battle over chairman Feb 20 A deal with shareholder activists outlined by JPMorgan Chase & Co on Thursday will allow the bank to avoid another battle at its spring shareholder meeting over whether the firm should have an independent chairman. ~Deal with activists lets JPMorgan avoid battle over chairman Feb 20 A deal with shareholder activists will allow JPMorgan Chase & Co to avoid another battle at its spring shareholder meeting over whether the bank should have an independent chairman, a person briefed on the matter said on Thursday. ~Madoff said JPMorgan executives knew of his fraud: lawsuit NEW YORK Two senior officials at JPMorgan Chase & Co and predecessor companies repeatedly confronted Bernard Madoff over irregularities in his business, a new lawsuit said, suggesting that bank leaders had "direct knowledge" of his Ponzi scheme. ~Madoff said JPMorgan execs knew of his fraud -lawsuit NEW YORK, Feb 20 Two senior officials at JPMorgan Chase & Co and  predecessor companies repeatedly confronted Bernard Madoff over irregularities in his business, a new lawsuit said, suggesting that bank leaders had "direct knowledge" of his Ponzi scheme. ~JPMorgan posts 12 pct decline in '13 commodities revenues-filing LONDON, Feb 20 JPMorgan Chase & Co's  commodity revenues fell 12 percent last year, the bank said in a filing on Thursday, shedding new light on the unit as the bank prepares to sell its physical trading arm to Swiss-based trader Mercuria. ~
JNPR.N,UPDATE 3-Nokia considers buying Juniper to expand network unit - report FRANKFURT/HELSINKI, Feb 20 Finland's Nokia  is considering buying U.S.-based Juniper Networks  to merge into its telecommunications network gear business, German's Manager Magazin Online reported, citing unidentified sources. ~CORRECTED-Nokia mulls buying Juniper, merging it with NSN - report (Corrects in first paragraph to reflect NSN has been renamed Nokia Solutions and Networks from Nokia Siemens Networks) ~
LMT,RPT-UPDATE 3-BAE warns U.S. defence spending cuts to hit earnings this year LONDON, Feb 20 Europe's biggest defence contractor BAE Systems warned on Thursday it expected earnings this year to drop by up to 10 percent as a result of U.S. spending cuts, with conditions still difficult despite a recent budget deal in Congress. ~
MRK,Market Chatter- Corporate finance press digest Feb 20 The following corporate finance-related stories were reported by media: ~
KORS.N,A Minute With: Fashion's Michael Kors on 'staying on the street' NEW YORK, Feb 19 Michael Kors, whose namesake fashion house is best known for its urban-inspired women's clothing and accessories, has taken a more laid-back approach to its fall-winter collection with muted colors drawn from Northern California's craggy coastline. ~
MS,ON THE MOVE-Raymond James hires two financial advisers from Morgan Stanley Feb 20 Raymond James & Associates Inc said it hired two financial advisers from Morgan Stanley to run its first full-service branch in Buffalo, New York. ~Blackstone, GIC nearing Kronos minority stake deal: sources New York Private equity firm Blackstone Group LP and Singapore sovereign wealth fund GIC are in advanced talks to buy minority stakes in Kronos Inc that could value the human resources software company at around $4.5 billion, including debt, three people familiar with the matter said. ~
NKE,INTERVIEW-Puma seeks to source goods closer to Western consumers * Brands looking to improve speed, flexibility of sourcing ~Puma hopes top signings will stop sales slump in 2014 HERZOGENAURACH, Germany German sportswear company Puma SE  is banking on high-profile signings to underline its sporting credentials and stop sales falling this year, after revenue tumbled more than expected in the last three months of 2013. ~UPDATE 2-Puma hopes top signings will stop sales slump in 2014 * Q4 sales fall 13.2 pct to 698.3 mln eur vs f'cast 718 mln ~
JWN,UPDATE 1-Deeper promotions lower Nordstrom holiday quarter profit Feb 20 Nordstrom Inc on Thursday reported a lower profit for the holiday quarter, hit by higher-than-expected markdowns, and the high-end retailer gave a full-year profit forecast that missed Wall Street expectations. ~CORRECTED-Deeper promotions lower Nordstrom holiday quarter profit (Corrects in last paragraph the company's FY EPS forecast to $3.75-$3.90, not $3.65 to $3.80 ) ~
PEP,UPDATE 3-Nelson Peltz revives campaign to split up PepsiCo Feb 20 Activist Investor Nelson Peltz renewed his crusade to convince  PepsiCo Inc to spin off its beverage business from its flourishing snacks division, less than a week after the company poured cold water on the idea. ~Peltz revives bid to split PepsiCo Feb 20 Nelson Peltz has resumed his call to break up PepsiCo Inc less than a week after the maker of Pepsi-Cola and  Lay's potato chips said it would not spin off its North-American beverage business. ~
PCLN.O,Priceline posts higher quarterly profit Priceline.com, the online travel agency known for its name-your-own-price auction, posted a higher-than-expected quarterly profit on Thursday as it booked more hotel stays, airline tickets and rental-car reservations. ~Priceline posts higher quarterly profit Feb 20 Priceline.com, the online travel agency known for its name-your-own-price auction, posted a higher quarterly profit on Thursday as it booked more hotel stays, airline tickets and rental-car reservations. ~
PG,P&G;'s smart toothbrush keeps tabs on tooth care LONDON, Feb 20 Procter & Gamble Co is bringing the dentist into the bathroom with the world's first smartphone-connected toothbrush, a device that gives personalised advice to help people improve their brushing. ~
KO,Coca-Cola CFO Gary Fayard to retire Coca-Cola Co  said Chief Financial Officer Gary Fayard would retire in May after serving the company for more than 20 years. ~Coca-Cola CFO Gary Fayard to retire Feb 20 Coca-Cola Co said Chief Financial Officer Gary Fayard would retire in May after serving the company for more than 20 years. ~Peltz revives bid to split PepsiCo Feb 20 Nelson Peltz has resumed his call to break up PepsiCo Inc less than a week after the maker of Pepsi-Cola and  Lay's potato chips said it would not spin off its North-American beverage business. ~
UNH,Bearish bets seen on U.S. insurers ahead of Medicare rate announcement NEW YORK, Feb 19 A flurry of bearish bets placed Wednesday in the options for some health insurers caught the eye of several analysts, who said it appears that someone is banking on a sizeable drop in their stocks by the end of the week, which is also when 2015 Medicare payment rates are expected from the government. ~
V,BRIEF-Visa calls for redemption all of its 1.200 pct notes due 2017 * Visa Inc - on Sept 11, co called for redemption all of $1.75 billion principal amount outstanding of its 1.200 pct notes due 2017‍​ - SEC filing ~BRIEF-Visa Inc files for three-part senior notes offering of up to $2.5 bln * Visa Inc says files for three-part senior notes offering of up to $2.5 billion - SEC filing‍​ ~Former BoE deputy Hogg to join Visa as Europe unit CEO Visa Inc, the world's largest payments processor, on Thursday named former Bank of England (BoE) deputy governor Charlotte Hogg as chief executive of its Europe division. ~CORRECTED-UPDATE 1-MOVES-Former BoE deputy Hogg to join Visa as Europe unit CEO Sept 7 Visa Inc, the world's largest payments processor, on Thursday named former Bank of England (BoE) deputy governor Charlotte Hogg as chief executive of its Europe division. ~MOVES-Visa names ex-BoE deputy Charlotte Hogg as Europe unit CEO Sept 7 Visa Inc, the world's largest payments processor, on Thursday named Charlotte Hogg as chief executive of its Europe division. ~BRIEF-Visa appoints Charlotte Hogg as CEO of European operations * Visa Inc appoints Charlotte Hogg as chief executive officer of the compan's European operations ~BRIEF-Visa Inc files prospectus supplement for potential three-part senior notes offering * Visa Inc files prospectus supplement for potential three-part senior notes offering; size not disclosed - sec filing‍​ Source text (http://bit.ly/2vLDrIe) Further company coverage: ~BRIEF-Visa enables on the go payments with the new Fitbit Ionic * Visa inc- ‍enabling visa payments on fitbit's smartwatch fitbit ionic​ ~BRIEF-Bridg raises $11 million in Series B funding * Bridg raises $11 million in Series B funding from Morpheus Ventures, March Capital, Visa and NextEquity ~
WMT,US STOCKS-Wall St rises on factory data; Tesla and Facebook jump * Facebook stock turns sharply on WhatsApp buy, hits record high ~US STOCKS-Wall St rises on manufacturing data, S&P; nears record * Indexes up: Dow 0.68 pct, S&P; 0.57 pct, Nasdaq 0.46 pct ~Wal-Mart forecast disappoints as grocery business struggles The struggles of the low-income U.S. consumer are playing out in Wal-Mart Stores Inc's grocery aisles. ~UPDATE 3-Wal-Mart forecast disappoints as grocery business struggles (New throughout, adds details on grocery segment, comments from executives on media call) ~UK's economic recovery fragile, warns Asda boss LONDON Britain's economic recovery is fragile, with huge regional variations, the head of Asda supermarkets said on Thursday as the company reported flat sales over the key Christmas quarter. ~US STOCKS-Wall St ticks up after mixed data, Wal-Mart falls NEW YORK, Feb 20 U.S. stocks edged higher in volatile trading on Thursday, as a strong read on manufacturing offset weak results from Wal-Mart and geopolitical and economic uncertainty around the world. ~US STOCKS-Futures dip with global concerns in view; Tesla soars NEW YORK, Feb 20 U.S. stock index futures fell on Thursday, pressured by weak results from Wal-Mart as well as global geopolitical and economic uncertainty that gave investors few reasons to buy despite a sharp selloff in the previous session. ~Wal-Mart profit slips as U.S. comparable sales fall again Feb 20 Wal-Mart Stores Inc on Thursday reported a lower profit for the holiday quarter as comparable sales in the United States declined again. ~
WFC,ON THE MOVE-Veteran Pennsylvania Wells Fargo brokers go independent NEW YORK, Feb 20 A family brokerage team who had been at Wells Fargo Advisors for more than a decade and manage more than $300 million of assets for wealthy clients resigned on Wednesday to start an independent registered investment advisory firm. ~
