ADBE.O,US STOCKS-Wall St little changed ahead of Fed policy statement * Dow off 0.07 pct, S&P; up 0.09 pct, Nasdaq off 0.06 pct   (Updates to open, adds comment) ~US STOCKS-Wall St to open flat with Fed statement on tap * Futures: Dow off 6 pts, S&P; off 0.25 pts, Nasdaq up 4 pts   (Adds data, updates prices) ~US STOCKS-Futures little changed ahead of Fed statement NEW YORK, June 18 U.S. stock index futures were little changed on Wednesday, after a three-day winning streak for the S&P; 500 index and ahead of a monetary policy announcement by the Federal Reserve. ~
APD,UPDATE 3-Air Products appoints new CEO; shares at life-high * Shares rise as much as 8 percent   (Adds closing stock price, Breakingviews link) ~Air Products appoints Rockwood's Seifi Ghasemi CEO June 18 Industrial gas producer Air Products & Chemicals, under pressure from Bill Ackman to overhaul its management, said it has appointed Seifi Ghasemi chief executive. ~
AMZN.O,UPDATE 3-Amazon aims to break from pack with 3D, shopping-ready "Fire" phone SEATTLE, June 18 Amazon.com Inc's new cellphone seeks to offer shoppers instant gratification by recognizing thousands of products, television shows and songs and allowing users to immediately buy them - on the e-commerce giant's own site, of course. ~BlackBerry seals deal with Amazon to offer Android apps TORONTO BlackBerry Ltd reached a licensing deal with Amazon.com Inc on Wednesday that will let the Canadian smartphone maker offer some 240,000 Android applications from Amazon's app store on its lineup of BlackBerry 10 devices this fall. ~UPDATE 2-BlackBerry seals deal with Amazon to offer Android apps TORONTO, June 18 BlackBerry Ltd reached a licensing deal with Amazon.com Inc on Wednesday that will let the Canadian smartphone maker offer some 240,000 Android applications from Amazon's app store on its lineup of BlackBerry 10 devices this fall. ~US STOCKS-Wall St gains on Fed's view; S&P; 500 ends at a record * Fed bumps up rate-hike path but sees lower long-term rates ~US STOCKS-Wall St on track to end at a new record after Fed comments * Fed cuts 2014 growth forecast, still confident about recovery ~US STOCKS-Wall St rises slightly after Fed statement * Fed cuts 2014 growth forecast, still confident about recovery ~Amazon expected to unveil 3D smartphone to court mobile shoppers SEATTLE Amazon.com Inc's  newest mobile device, a smartphone that may sport a 3D screen, is the retailer's latest attempt to exert its influence over the way consumers shop online. | Video  ~Amazon CEO Bezos unveils "Fire" smartphone SAN FRANCISCO, June 18 Amazon.com Inc  Chief Executive Officer Jeff Bezos unveiled a "Fire" smartphone on Wednesday with free, unlimited photo storage, jumping into a crowded field dominated by Apple Inc and Samsung Electronics. ~Singing binmen of Belo Horizonte entertain fans BELO HORIZONTE Brazil The strait-laced Brazilian city of Belo Horizonte may not have exotic Amazon or sun-kissed beaches to entertain fans between matches - but it does have its very own singing binmen. ~
AAL.O,American assigns 20 Embraer jets to Compass Airlines * Other carriers sought for jets after Envoy pilots rejected contract ~
AAPL.O,UPDATE 3-Amazon aims to break from pack with 3D, shopping-ready "Fire" phone SEATTLE, June 18 Amazon.com Inc's new cellphone seeks to offer shoppers instant gratification by recognizing thousands of products, television shows and songs and allowing users to immediately buy them - on the e-commerce giant's own site, of course. ~Dollar slips as Fed cuts U.S. growth forecast NEW YORK The dollar retreated against the euro and the yen on Wednesday as the Federal Reserve struck a dovish tone in its post-meeting statement, slashing its forecast for economic growth and suggesting long-term rates could be lower than previously indicated. ~
BAC,Bank of America, JPMorgan stay top in 2014 Extel awards LONDON Bank of America Merrill Lynch was named top pan-European equity brokerage for a second straight year at the annual Thomson Reuters Extel Awards on Tuesday, while JPMorgan Asset Management won best fund manager for the fifth year in a row. ~Merrill's Thiel ramps up recruiting NEW YORK After a steady reduction in its brokerage force, Merrill Lynch is again adding numbers to its "Thundering Herd." ~CORRECTED-Bank of America, JPMorgan stay top in 2014 Extel awards (Corrects in paragraph eight to show Pecriaux works for GLG Partners, not HSBC) ~
BA,UPDATE 1-UK agency says faulty wiring likely caused Dreamliner fire NEW YORK, June 18 A fire that scorched the top of a Boeing Co 787 Dreamliner at London Heathrow airport last summer was likely caused by faulty wiring in an emergency rescue beacon that led to "an uncontrolled discharge" from a lithium-ion battery, the UK aviation safety agency said on Wednesday. ~UK aviation probe says faulty wiring led to Dreamliner fire NEW YORK, June 18 A fire that scorched the top of a Boeing Co 787 Dreamliner at London Heathrow airport last summer was likely caused by faulty wiring in an emergency rescue beacon that led to "an uncontrolled discharge" from a lithium-ion battery, the UK aviation safety agency said on Wednesday. ~
CAG,Private brands business hurts ConAgra's profit ConAgra Foods Inc warned that its adjusted fourth-quarter profit would be lower than its forecast, as the company struggles with its big push into private-label foods and sales fall in its consumer foods business. ~UPDATE 2-Private brands business hurts ConAgra's profit * Estimates 4th-qtr profit $0.55/share vs forecast of over $0.60 ~US STOCKS-Wall St little changed ahead of Fed policy statement * Dow off 0.07 pct, S&P; up 0.09 pct, Nasdaq off 0.06 pct   (Updates to open, adds comment) ~US STOCKS-Wall St to open flat with Fed statement on tap * Futures: Dow off 6 pts, S&P; off 0.25 pts, Nasdaq up 4 pts   (Adds data, updates prices) ~ConAgra estimates fourth-qtr profit below forecast June 18 ConAgra Foods Inc said its adjusted fourth-quarter profit would be lower than its forecast due to lower sales in its consumer foods business and weak profits in private brands. ~
XOM,China's oil operations in Iraq unaffected, cuts some staff BEIJING PetroChina , the single biggest investor in Iraq's oil sector, is pulling some of its staff out of the Middle East nation, but production remains unaffected as militant Islamists threaten the unity of OPEC's second-largest producer. ~China's oil operations in Iraq unaffected, cuts some staff BEIJING, June 18 PetroChina, the single biggest investor in Iraq's oil sector, is pulling some of its staff out of the Middle East nation, but production remains unaffected as militant Islamists threaten the unity of OPEC's second-largest producer. ~
FB.O,Data sharing deal with U.S. referred to EU's top court DUBLIN Ireland's High Court on Wednesday asked the European Court of Justice (ECJ) to review a European Union-U.S. data protection agreement in light of allegations that Facebook FB.O shared data from EU users with the U.S. National Security Agency. ~UPDATE 2-Data sharing deal with US referred to EU's top court * Referral follows case on Facebook data   (Adds comment by student group, lawyer) ~Irish judge asks EU court to clarify data rules after Facebook allegations DUBLIN Ireland's High Court on Wednesday asked the European Court of Justice (ECJ) to clarify European Union data protection rules in light of allegations that Facebook shared data from EU users with the U.S. National Security Agency. ~Irish judge asks EU court to clarify data rules after Facebook allegations DUBLIN, June 18 Ireland's High Court on Wednesday asked the European Court of Justice (ECJ) to clarify European Union data protection rules in light of allegations that Facebook shared data from EU users with the U.S. National Security Agency. ~Irish judge rejects demand for probe into Facebook cooperation with NSA DUBLIN An Irish judge on Wednesday rejected an attempt by campaigners to force an investigation into Facebook's alleged sharing of data from EU users with the U.S. National Security Agency. ~
FDX,US STOCKS-Wall St on track to end at a new record after Fed comments * Fed cuts 2014 growth forecast, still confident about recovery ~US STOCKS-Wall St rises slightly after Fed statement * Fed cuts 2014 growth forecast, still confident about recovery ~Online shopping boosts FedEx's profit, shares hit life high FedEx Corp  reported a better-than-expected quarterly profit as strong shipments of items ordered online boosted the ground business of world's No. 2 parcel delivery company. ~UPDATE 3-Online shopping boosts FedEx's profit, shares hit life high * Shares rise as much as 5.4 pct to touch life high   (Adds analyst and CEO comment, updates shares and Reuters estimate for 2015 earnings per share) ~US STOCKS-Wall St flat with Fed policy statement due * Indexes off: Dow 0.22 pct, S&P; up 0.03 pct, Nasdaq off 0.11 pct   (Updates to midday) ~US STOCKS-Wall St little changed ahead of Fed policy statement * Dow off 0.07 pct, S&P; up 0.09 pct, Nasdaq off 0.06 pct   (Updates to open, adds comment) ~US STOCKS-Wall St to open flat with Fed statement on tap * Futures: Dow off 6 pts, S&P; off 0.25 pts, Nasdaq up 4 pts   (Adds data, updates prices) ~
GE,UPDATE 3-GE to submit improved Alstom offer Thursday - sources * GE's Immelt to meet France's Montebourg Thursday -sources ~GE to submit improved Alstom offer Thursday - sources PARIS, June 18 General Electric will submit an improved offer for the energy businesses of French engineering group Alstom on Thursday, a source close to the U.S. conglomerate said, as GE seeks to fend off a rival proposal. ~Market Chatter- Corporate finance press digest June 18 The following corporate finance-related stories were reported by media: ~
GIS,UPDATE 2-Private brands business hurts ConAgra's profit * Estimates 4th-qtr profit $0.55/share vs forecast of over $0.60 ~
GM,UPDATE 5-GM emails show more unheeded warnings about ignition defects (Adds "no comment" by GM employee who warned of possible big recall, paragraph 7) ~UPDATE 3-U.S. ignition-switch investigation extended to Chrysler (Adds comments by safety experts, adds consumer complaints on Jeeps) ~GM hit with $10 billion lawsuit A new lawsuit says General Motors Co should compensate millions of car and truck owners for lost resale value, potentially exceeding $10 billion, because a slew of recalls and a deadly delay in recalling cars with defective ignition switches has damaged its brand. | Video  ~GM, Hyundai models win most JD Power quality awards DETROIT General Motors Co on Wednesday received more awards for initial quality from J.D. Power than any other automaker in the U.S. market, as its chief executive officer was grilled by a U.S. congressional committee about safety issues. ~GM, Hyundai models win most JD Power quality awards DETROIT General Motors Co on Wednesday received more awards for initial quality from J.D. Power than any other automaker in the U.S. market, as its chief executive officer was grilled by a U.S. congressional committee about safety issues. ~GM, Hyundai models win most JD Power quality awards DETROIT, June 18 General Motors Co on Wednesday received more awards for initial quality from J.D. Power than any other automaker in the U.S. market, as its chief executive officer was grilled by a U.S. congressional committee about safety issues. ~BRIEF-GM CEO Barra says company's victim compensation fund will not be capped DETROIT, June 18 General Motors Co CEO Mary Barra speaking in Congress:  * CEO Barra says company's board will not approve feinberg awards, he is ~BRIEF-GM CEO: issue of vehicles that have lost value due to switch recall not part of victim compnensation fund DETROIT, June 18 General Motors Co CEO Mary Barra speaking in Congress:  * CEO Barra says issue of vehicles that have lost value due to switch recall is ~BRIEF-GM CEO says known number of deaths linked to defective switch still at 13 people DETROIT, June 18 General Motors Co CEO Mary Barra speaking in Congress:  * CEO Barra says Feinberg will reveal criteria to GM for victim compensation ~
GS,UPDATE 1-Financial service provider Markit's IPO raises $1.2 bln - WSJ June 18 Markit Ltd  priced its initial public offering at $24 per share, valuing the financial information service provider at about $4.3 billion, the Wall Street Journal reported, citing sources. ~Private equity buyouts in Asia take old risks with new money HONG KONG A little over a month ago, a Texas power utility at the center of the biggest leveraged buyout in history filed for bankruptcy, sunk by billions of dollars of debt that it took on after being acquired by a trio of top private equity names in 2007. ~
INTC.O,Intel woos Internet heavyweights with flexible server chips SAN FRANCISCO, June 18 Intel Corp is taking a new approach to the powerful server chips it sells to Internet heavyweights like Facebook and Google. ~
JPM,JPMorgan's investment bank ranked top in first quarter: survey LONDON JPMorgan Chase & Co was again ranked the top investment bank by revenue in the first quarter with $5.9 billion, according to a new survey published on Wednesday. ~JPMorgan's investment bank ranked top in Q1- survey * JPMorgan investment bank revenue $5.9 bln in Q1 - survey ~
K,UPDATE 2-Private brands business hurts ConAgra's profit * Estimates 4th-qtr profit $0.55/share vs forecast of over $0.60 ~
LMT,Lockheed buys California firm that makes thin film coatings WASHINGTON, June 18 Lockheed Martin Corp  on Wednesday said it is acquiring Deposition Sciences Inc, a California-based company that provides thin film coatings, for an undisclosed amount from its parent company, Advanced Lighting Technologies Inc. ~Lockheed can proceed with U.S. radar work in absence of Raytheon protest WASHINGTON Lockheed Martin Corp got good news on Tuesday when  Raytheon Co failed to protest the award of a $915 million contract to Lockheed in time to block automatically the company's work on a new ground-based radar. ~Lockheed can proceed with U.S. radar work in absence of Raytheon protest WASHINGTON, June 17 Lockheed Martin Corp  got good news on Tuesday when  Raytheon Co failed to protest the award of a $915 million contract to Lockheed in time to block automatically the company's work on a new ground-based radar. ~
MLM,Wall Street's latest fad is built on sand HOUSTON Super-sized hydraulic fracturing jobs, which use vast amounts of sand to coax more oil and gas from shale, have led to astronomical returns for investors in companies that mine the tiny particles.    The question is whether those super-sized gains can continue. ~
MA,Russia to reduce deposit payments for Mastercard, Visa MOSCOW, June 18 Russia will reduce the size of deposit payments required for Mastercard and Visa  to operate in the country, First Deputy Prime Minister Igor Shuvalov said on Wednesday. ~
MRK,RLPC-Bayer signs $14.2 bln acquisition loan LONDON, June 18 Bayer has signed a $14.2 billion acquisition loan backing its purchase of US-based Merck's consumer care business, the lead banks said in a statement on Wednesday. ~
MSFT.O,UPDATE 2-Red Hat raises revenue forecast on strong subscription growth * Sees full-year revenue $1.76-$1.785 bln vs est $1.75 bln ~
MS,JPMorgan's investment bank ranked top in first quarter: survey LONDON JPMorgan Chase & Co was again ranked the top investment bank by revenue in the first quarter with $5.9 billion, according to a new survey published on Wednesday. ~JPMorgan's investment bank ranked top in Q1- survey * JPMorgan investment bank revenue $5.9 bln in Q1 - survey ~
MYL.A,UK says Mylan recalls batches of Indian-made antibiotic LONDON U.S. drugmaker Mylan is recalling batches of the injectable antibiotic clarithromycin made in India due to possible impurities, Britain's healthcare regulator said on Wednesday. ~UK says Mylan recalls batches of Indian-made antibiotic LONDON, June 18 U.S. drugmaker Mylan is recalling batches of the injectable antibiotic clarithromycin made in India due to possible impurities, Britain's healthcare regulator said on Wednesday. ~
PFE,French biotech Cellectis surges as Pfizer signs cancer drug deal U.S. drugmaker Pfizer, which failed last month in a $118 billion bid to buy AstraZeneca, said on Wednesday it had signed a deal with French biotech Cellectis to develop immunotherapy drugs in cancer. ~UPDATE 2-French biotech Cellectis surges as Pfizer signs cancer drug deal * Pfizer secures access to early cancer-hunting CAR-T drugs ~BRIEF-Cellectis shares rise 50 pct after Pfizer deal PARIS, June 18 Cellectis SA :  * Shares rise 50 percent after signs deal with Pfizer  to develop ~Pfizer signs cancer immunotherapy deal with France's Cellectis June 18 U.S. drugmaker Pfizer, which failed last month in a $118 billion bid to buy AstraZeneca , said on Wednesday it had signed a deal with French biotech Cellectis to develop immunotherapy drugs in cancer. ~
RTN,Lockheed can proceed with U.S. radar work in absence of Raytheon protest WASHINGTON, June 17 Lockheed Martin Corp  got good news on Tuesday when  Raytheon Co failed to protest the award of a $915 million contract to Lockheed in time to block automatically the company's work on a new ground-based radar. ~
RHT,UPDATE 2-Red Hat raises revenue forecast on strong subscription growth * Sees full-year revenue $1.76-$1.785 bln vs est $1.75 bln ~Red Hat 1st-qtr results beat estimates on subscription growth June 18 Red Hat Inc, the world's largest commercial distributor of the Linux operating system, reported better-than-expected adjusted profit and revenue for the first quarter, helped by growth in subscriptions. ~
TGT,Target sells $2 billion of bonds in two-part offering June 17 U.S. retailer Target Corp  increased yields on Tuesday to sell $2 billion of bonds in a two-part offering and plans to use part of the proceeds to buy back as much as $1 billion of debt. ~
TEL,UPDATE 1-TE Connectivity to buy sensor maker for $1.7 bln June 18 Swiss electronics company TE Connectivity said it would buy sensor maker Measurement Specialties Inc for about $1.7 billion, including debt, to grab a bigger slice of the high-growth global sensor market. ~TE Connectivity to buy Measurement Specialties for $1.7 bln June 18 TE Connectivity, a maker of switches and sensors, said it would buy Measurement Specialties Inc, which makes precision sensors and sensor-based systems, for about $1.7 billion including debt, to strengthen its sensor-making business. ~
UTX,UPDATE 1-United Technologies, Canada reach deal on delayed helicopters WASHINGTON, June 18 United Technologies Corp  on Wednesday said its Sikorsky Aircraft unit would record sales of $850 million and a charge of $440 million in the second quarter after signing a revamped agreement with Canada for 28 maritime patrol helicopters. ~United Technologies, Canada reach deal on delayed helicopters WASHINGTON, June 18 United Technologies Corp  said on Wednesday its Sikorsky Aircraft unit signed a revamped agreement with Canada for 28 maritime patrol helicopters after the initial C$5 billion ($4.61 billion) deal ran into delays and was nearly scrapped. ~
