AGN,COLUMN-Little fresh evidence in new Allergan suit: FRANKEL (The opinions expressed here are those of Alison Frankel, a columnist for Reuters.) ~
AMGN.O,UPDATE 2-Amgen blood cancer drug succeeds in late-stage study Aug 4 Amgen Inc said on Monday its Kyprolis combined with standard treatment helped patients with relapsed multiple myeloma live significantly longer before their blood cancer worsened, compared with the standard therapy, according to interim data from an eagerly-anticipated late stage study. ~Amgen cancer drug meets main goal in late-stage study Aug 4 Amgen Inc said its cancer drug significantly improved the length of time that patients lived with a type of blood cancer without the disease worsening. ~
BRKa.N,US STOCKS-Late surge lifts Wall St; utilities sag * Dow up 0.5 pct; S&P; 500 up 0.7 pct; Nasdaq up 0.7 pct   (Updates to close) ~US STOCKS SNAPSHOT-Wall St ends higher with help from Berkshire NEW YORK, Aug 4 U.S. stocks finished modestly higher on Monday, boosted by  Berkshire Hathaway's results and other earnings, though gains were offset by declines in high-dividend payers in the utilities sector. ~US STOCKS-Wall St gains on earnings; utilities sag * Indexes: Dow down 0.2 pct, S&P; up 0.4 pct, Nasdaq up 0.5 pct   (Updates to mid-afternoon, adds quotes, updates prices) ~US STOCKS-Wall St drifts on mixed earnings, utilities drop * Indexes: Dow off 0.1 pct, S&P; flat, Nasdaq up 0.2 pct   (Updates prices, changes comment) ~US STOCKS-Wall St up on earnings, Portugal bank deal * Michael Kors shares reverse premarket move, fall 5.5 pct ~US STOCKS-Wall St to rise after selloff; earnings in focus * Futures up: Dow 27 pts, S&P; 4 pts, Nasdaq 10 pts   (Updates prices) ~
BA,UPDATE 2-Airbus wins 980 gross orders, 705 net in Jan-July PARIS, Aug 4 Airbus overtook Boeing  in unadjusted aircraft orders for 2014 after last month's Farnborough Airshow, but continued to lag its U.S. rival when taking into account cancellations, company data showed on Monday. ~RPT-Airbus, Boeing wide-body jet battle triggers warnings of oversupply (Repeats story published late on Aug 1 with no changes to text.) ~Engineer Senior posts higher profit steered by Boeing, Airbus Aug 4 Senior Plc, an aircraft and auto parts maker, said first-half pretax profit rose 22 percent, boosted by an increased demand for its products from the growing the civil aviation sector. ~
CSCO.O,UPDATE 1-Symantec, Kaspersky downplay Beijing effort to exclude products Aug 4 U.S. security software maker Symantec Corp  and Russia's Kaspersky Lab downplayed a move by Beijing to exclude them from a list of anti-virus vendors whose products are approved for sale to central government agencies in China. ~
C,Former Citi official fined $500,000 for fraud in CFTC case WASHINGTON, Aug 4 A federal court has ordered former Citigroup director, John Aaron Brooks, to pay $500,000 for defrauding two Citigroup companies by mismarking and inflating the value of his position in ethanol futures to conceal his trading losses, the Commodity Futures Trading Commission said on Monday. ~Citigroup loses North America head of Treasury and Trade Solutions NEW YORK Citigroup Inc  North America head of Treasury and Trade solutions, Andrew Gelb, leaves- memo ~
CMCSA.O,Murdoch's Fox expected to push for Time Warner deal on Wednesday Aug 4 Rupert Murdoch's Twenty-First Century Fox Inc is expected to make an aggressive case for merging with Time Warner Inc during its quarterly earnings call on Wednesday, though people familiar with the company's plans have said it would not use that forum to raise its bid. ~
DO,US STOCKS-Wall St up on earnings, Portugal bank deal * Michael Kors shares reverse premarket move, fall 5.5 pct ~US STOCKS-Wall St to rise after selloff; earnings in focus * Futures up: Dow 27 pts, S&P; 4 pts, Nasdaq 10 pts   (Updates prices) ~US STOCKS-Futures rise after selloff with earnings in focus NEW YORK, Aug 4 U.S. stock index futures bounced back on Monday following the largest weekly decline on the S&P; 500 since 2012, as a scant U.S. economic calendar kept the focus on earnings and Portugal was poised to bail out its largest publicly traded bank. ~
ESRX.O,GSK gets a lift as Express Scripts reinstates lung drug Advair LONDON GlaxoSmithKline (GSK) received a boost on Monday from a decision by Express Scripts, the largest U.S. pharmacy benefit manager, to reinstate its top-selling lung drug Advair as an approved drug in 2015. ~
FCX,UPDATE 1-Freeport Indonesia says to resume copper concentrate exports by Wednesday JAKARTA, Aug 4 Freeport-McMoRan Inc's  Indonesia unit will resume copper concentrate exports by Wednesday, the company's local CEO said on Monday, after it resolved a six-month old tax dispute with the government. ~Freeport Indonesia says to resume copper concentrate exports by Wednesday JAKARTA, Aug 4 Freeport-McMoRan Inc's  Indonesia unit will resume copper concentrate exports by Wednesday, the company's local CEO said on Monday, with an initial shipment of 10,000 tonnes to China. ~
GE,African leaders want U.S. trade deal renewed for 15 more years WASHINGTON African leaders urged the United States on Monday to renew a trade benefits program giving duty-free access to billions of dollars of African exports for 15 years, saying it would help cement trade relations and boost development in the region. ~African leaders want U.S. trade deal renewed for 15 more years WASHINGTON, Aug 4 African leaders urged the United States on Monday to renew a trade benefits program giving duty-free access to billions of dollars of African exports for 15 years, saying it would help cement trade relations and boost development in the region. ~GE to invest $2 bln to boost African energy, infrastructure WASHINGTON, Aug 4 General Electric Co on Monday pledged to invest $2 billion in Africa by 2018 to boost infrastructure, worker skills and access to energy, an announcement timed to coincide with a U.S. summit meeting of nearly 50 African leaders. ~GE's Immelt says Ex-Im bank closure would hurt US-Africa trade: FT Trade ties between the United States and Africa will be hit if the U.S. Congress decides to close the Export-Import bank, the Financial Times reported General Electric Co  Chief Executive Jeff Immelt as saying. ~GE's Immelt says Ex-Im bank closure would hurt US-Africa trade - FT Aug 4 Trade ties between the United States and Africa will be hit if the U.S. Congress decides to close the Export-Import bank, the Financial Times reported General Electric Co Chief Executive Jeff Immelt as saying. ~
GM,UPDATE 2-GM unit gets subpoena over subprime auto loans (Adds background of GM Financial, scrutiny of subprime auto lending) ~REFILE-ZF explores steering unit sale as part of TRW deal -sources NEW YORK/FRANKFURT, Aug 4 German auto parts maker ZF Friedrichshafen AG is considering selling its steering business as part of its proposed acquisition of U.S.-based TRW Automotive Holdings Corp, to resolve expected antitrust issues, people familiar with the matter said on Monday. ~GM unit gets subpoena over subprime auto loans Aug 4 General Motors Co's auto financing arm said it received a subpoena from the U.S. Department of Justice to produce documents related to subprime auto loans since 2007. ~
GS,Market Chatter- Corporate finance press digest Aug 4 The following corporate finance-related stories were reported by media : ~
HPQ,UPDATE 1-HP, Autonomy trade barbs as lawsuit against ex-CFO looms Aug 4 Hewlett-Packard Co said it would sue former Autonomy Chief Financial Officer Sushovan Hussain as he seeks to block HP's settlement of three shareholder lawsuits over its troubled purchase of the British software company. ~Hewlett-Packard to sue former Autonomy CFO Aug 4 Hewlett-Packard Co said it would sue former Autonomy Chief Financial Officer Sushovan Hussain after he sought to block HP's settlement of three shareholder lawsuits over its troubled purchase of the British software company. ~
IBM,UPDATE 1-Symantec, Kaspersky downplay Beijing effort to exclude products Aug 4 U.S. security software maker Symantec Corp  and Russia's Kaspersky Lab downplayed a move by Beijing to exclude them from a list of anti-virus vendors whose products are approved for sale to central government agencies in China. ~
JNJ,COLUMN-Healthcare: A remedy for long-term investors (The opinions expressed here are those of the author, a columnist for Reuters.) ~
L,US STOCKS-Wall St drifts on mixed earnings, utilities drop * Indexes: Dow off 0.1 pct, S&P; flat, Nasdaq up 0.2 pct   (Updates prices, changes comment) ~Loews profit halves due to lower Diamond Offshore earnings Hotel, energy and financial services conglomerate Loews Corp  reported a lower-than-expected quarterly profit, hurt by a drop in profit at its second-biggest subsidiary, Diamond Offshore Drilling Inc . ~UPDATE 2-Loews profit halves due to lower Diamond Offshore earnings Aug 4 Hotel, energy and financial services conglomerate Loews Corp reported a lower-than-expected quarterly profit, hurt by a drop in profit at its second-biggest subsidiary, Diamond Offshore Drilling Inc. ~US STOCKS-Wall St up on earnings, Portugal bank deal * Michael Kors shares reverse premarket move, fall 5.5 pct ~US STOCKS-Wall St to rise after selloff; earnings in focus * Futures up: Dow 27 pts, S&P; 4 pts, Nasdaq 10 pts   (Updates prices) ~US STOCKS-Futures rise after selloff with earnings in focus NEW YORK, Aug 4 U.S. stock index futures bounced back on Monday following the largest weekly decline on the S&P; 500 since 2012, as a scant U.S. economic calendar kept the focus on earnings and Portugal was poised to bail out its largest publicly traded bank. ~Loews quarterly profit falls 57 pct Aug 4 Hotel, energy and financial services conglomerate Loews Corp reported a 57 percent drop in quarterly profit due to lower earnings from Diamond Offshore Drilling Inc. ~
MCD,UPDATE 2-McDonald's says China food scandal hurting regional results Aug 4 McDonald's Corp said its business has been hurt by China's latest food scare that forced restaurants in the region to temporarily pull meat items from menus. ~McDonald's says near-term results to be hurt by China food scandal Aug 4 McDonald's Corp's sales in markets, including China and Japan, are experiencing a "significant negative impact" since a food safety scandal in China a fortnight ago forced it to halt the sale of items such as Big Macs and Spicy McWings. ~McDonald's to resume full menu in Beijing, Guangzhou this week HONG KONG/SHANGHAI McDonald's Corp , which has over 2,000 restaurants in China, will restore its full menu in some Chinese cities this week, a fortnight after a food safety scandal forced the company to halt the sale of staples such as Big Macs and Spicy McWings. ~McDonald's to resume full menu in Beijing, Guangzhou this week HONG KONG/SHANGHAI, Aug 4 McDonald's Corp , which has over 2,000 restaurants in China, will restore its full menu in some Chinese cities this week, a fortnight after a food safety scandal forced the company to halt the sale of staples such as Big Macs and Spicy McWings. ~
KORS.N,UPDATE 3-Michael Kors says margins to shrink as it expands in Europe Aug 4 Fast-growing Michael Kors Holdings Ltd , known for its trendy handbags and watches, said it expects margins to shrink for the year as it invests more to open stores in Europe and increases the number of shops it has in department stores. ~US STOCKS-Wall St drifts on mixed earnings, utilities drop * Indexes: Dow off 0.1 pct, S&P; flat, Nasdaq up 0.2 pct   (Updates prices, changes comment) ~US STOCKS-Wall St up on earnings, Portugal bank deal * Michael Kors shares reverse premarket move, fall 5.5 pct ~US STOCKS-Wall St to rise after selloff; earnings in focus * Futures up: Dow 27 pts, S&P; 4 pts, Nasdaq 10 pts   (Updates prices) ~US STOCKS-Futures rise after selloff with earnings in focus NEW YORK, Aug 4 U.S. stock index futures bounced back on Monday following the largest weekly decline on the S&P; 500 since 2012, as a scant U.S. economic calendar kept the focus on earnings and Portugal was poised to bail out its largest publicly traded bank. ~Michael Kors revenue soars 43 pct Aug 4 Michael Kors Holdings Ltd  reported a 43 percent rise in quarterly revenue, helped by higher sales of handbags and watches in North America, sending its shares up 12 percent in premarket trading. ~
MSFT.O,UPDATE 2-China regulator says Microsoft should not obstruct anti-trust probe BEIJING, Aug 4 Microsoft Corp should not obstruct an anti-trust investigation by Chinese regulators, the State Administration for Industry and Commerce (SAIC) said on Monday, the latest shot fired by China's government at the U.S. software giant. ~China regulator says Microsoft should not obstruct anti-trust probe - TV BEIJING, Aug 4 Microsoft Corp should not obstruct an anti-trust investigation by Chinese regulators, the State Administration for Industry and Commerce (SAIC) said on Monday. ~
MS,INSIGHT-Morgan Stanley lends to Lotto winner to boost tailored loans NEW YORK, Aug 4 Early this year, a New York State Lottery winner in Brooklyn approached Morgan Stanley with a problem: he needed to borrow hundreds of thousands of dollars before he collected his prize money. ~
PFE,COLUMN-Healthcare: A remedy for long-term investors (The opinions expressed here are those of the author, a columnist for Reuters.) ~
PG,CORRECTED-UPDATE 4-P&G; to sell up to 100 brands to revive sales, cut costs(August 1) (Corrects in paragraph 8 to "The company might be more likely to sell" from "Dibadj expects" and to "could potentially keep" from "unlikely to sell") ~
QCOM.O,UPDATE 1-Symantec, Kaspersky downplay Beijing effort to exclude products Aug 4 U.S. security software maker Symantec Corp  and Russia's Kaspersky Lab downplayed a move by Beijing to exclude them from a list of anti-virus vendors whose products are approved for sale to central government agencies in China. ~
SYMC.O,UPDATE 1-Symantec, Kaspersky downplay Beijing effort to exclude products Aug 4 U.S. security software maker Symantec Corp  and Russia's Kaspersky Lab downplayed a move by Beijing to exclude them from a list of anti-virus vendors whose products are approved for sale to central government agencies in China. ~Symantec says its products not banned in China Aug 4 U.S. security software maker Symantec Corp  said its products are not banned by the Chinese government after Chinese media reported that the government's procurement agency has excluded the company from a list of approved anti-virus vendors. ~
TWX,Murdoch's Fox expected to push for Time Warner deal on Wednesday Aug 4 Rupert Murdoch's Twenty-First Century Fox Inc is expected to make an aggressive case for merging with Time Warner Inc during its quarterly earnings call on Wednesday, though people familiar with the company's plans have said it would not use that forum to raise its bid. ~
