AAPL.O,US STOCKS-Wall St starts 2014 with decline; investors take profits * Among top decliners are stocks that gained most in 2013 ~US STOCKS-Wall St falls on first trading day of 2014; techs weigh * Among top decliners are stocks that gained most in 2013 ~China's Xiaomi says to more than double smartphone sales in 2014 BEIJING Chinese budget smartphone maker Xiaomi plans to sell 40 million handsets in 2014, more than double the number it sold in 2013, its chairman said on Thursday, reinforcing the company's ambitions to outsell more expensive offerings from Apple Inc and Samsung Electronics Co Ltd. ~US STOCKS-Wall St dips on first trading day of 2014; techs weigh * Among top decliners are stocks that gained most in 2013 ~China's Xiaomi says to more than double smartphone sales in 2014 BEIJING, Jan 2 Chinese budget smartphone maker Xiaomi plans to sell 40 million handsets in 2014, more than double the number it sold in 2013, its chairman said on Thursday, reinforcing the company's ambitions to outsell more expensive offerings from Apple Inc and Samsung Electronics Co Ltd. ~
BAC,UPDATE 1-BofA Merrill Lynch still top U.S. municipal underwriter WASHINGTON, Jan 2 Bank of America Merrill Lynch  remained the top underwriter in a shrinking U.S. municipal bond market in 2013, while California sold the most debt in the year, Thomson Reuters data released on Thursday showed. ~Bank of America Merrill Lynch remains top US municipal underwriter WASHINGTON, Jan 2 Bank of America Merrill Lynch remained the top underwriter for U.S. municipal bond deals in 2013, even as debt sales fell 15.1 percent to $311.8 billion from the prior year, according to Thomson Reuters final data released on Thursday. ~
BRKa.N,Berkshire owns over one-fourth of USG Corp after crisis-era bet Jan 2 Warren Buffett's Berkshire Hathaway Inc   has converted much of its debt in building products company USG Corp into more than $600 million of common stock in a successful investment made in the wake of the financial crisis. ~UPDATE 1-BNSF Railway reopens tracks after train crash HOUSTON, Jan 2 BNSF Railway Co said it reopened the two mainline tracks that it shut after a crude oil train exploded after it hit a derailed grain train earlier in the week. ~RPT-Railcars in North Dakota crude train crash older, less safe-investigators FARGO, N.D., Dec 31 The railcars carrying crude oil that crashed into a derailed grain train in North Dakota on Monday were all older types that do not meet the latest industry safety standards, a member of the National Transportation Safety Board said on Tuesday. ~
C,UPDATE 1-Citigroup paid $250 mln to resolve U.S. mortgage suit WASHINGTON, Jan 2 Citigroup Inc. paid $250 million to taxpayer-owned Fannie Mae and Freddie Mac  to settle a lawsuit over soured mortgage securities, the regulator of the two housing finance firms said on Thursday. ~Citigroup paid $250 mln to resolve U.S. mortgage suit WASHINGTON, Jan 2 Citigroup Inc. paid $250 million to taxpayer-owned Fannie Mae and Freddie Mac  to settle a lawsuit over soured mortgage securities, the regulator of the two housing finance firms said on Thursday. ~
DOW,BRIEF-Downer EDI says offer for Spotless Group now closed * Confirms that its offer for Spotless was not extended and has now closed. Source text for Eikon: Further company coverage: ~BRIEF-Downer EDI posts FY net profit of $181.5 million * FY total revenue and other income from ordinary activities $7.29 billion , up 6.4 percent ~BRIEF-Downer EDI says ‍offer for Spotless Group extended to 28 August 2017​ * ‍Offer for Spotless Group extended to 7pm on Monday, 28 august 2017​ Source text for Eikon: Further company coverage: ~BRIEF-Downer EDI says Spotless ‍offer extended to Aug 21, 2017​ * Spotless ‍offer extended to 7pm on monday, 21 august 2017​ Source text for Eikon: Further company coverage: ~BRIEF-Downer EDI's takeover offer for Spotless Group extended till 7pm (Sydney time) on Aug. 14 * Unconditional takeover offer for Spotless Group extended until 7:00pm (Sydney time) on Monday, 14 August Source text for Eikon: Further company coverage: (bangalore.newsroom@thomsonreuters.com) ~BRIEF-Downer extends takeover offer for Spotless Group * decided to extend Spotless offer period for one week; offer will now remain open for acceptance until 14 august Source text for Eikon: Further company coverage: ~BRIEF-Downer extends Spotless offer to August 7 2017 * ‍Downer has decided to extend offer for Spotless Group holdings to 7 pm on Monday, 7 august 2017​ Source text for Eikon: Further company coverage: ~BRIEF-Downer EDI's stake in Spotless increases to 80.3 pct * Downer's stake in Spotless increases to 80.3 pct Source text for Eikon: Further company coverage: ~BRIEF- Downer EDI Ltd'S stake in Spotless Group increases to 72% * As Downer's shareholding in Spotless is now over 70%, Downer expects that Spotless will be removed from certain S&P;/ASX market indices ~
GE,UPDATE 1-Citigroup paid $250 mln to resolve U.S. mortgage suit WASHINGTON, Jan 2 Citigroup Inc. paid $250 million to taxpayer-owned Fannie Mae and Freddie Mac  to settle a lawsuit over soured mortgage securities, the regulator of the two housing finance firms said on Thursday. ~
GM,DEALTALK-Private investors increasingly keen on Ally shares NEW YORK, Jan 2 Demand for Ally Financial's  shares has been ramping up, with investors paying increasingly high prices in recent private transactions that signal the U.S. government could be able to sell its remaining stake in the auto lender this year, sources familiar with the situation said. ~UPDATE 2-Fiat strikes $4.35 billion deal to buy rest of Chrysler * Ends year-long dispute between Fiat and UAW health trust ~
JPM,FireEye buys cyber forensics firm Mandiant for about $1 bln BOSTON, Jan 2 Cybersecurity company FireEye Inc , one of last year's hottest IPOs, has acquired Mandiant Corp, the computer forensics specialist best known for unveiling a secretive Chinese military unit believed to be behind a series of hacking attacks on U.S. companies. ~
M,UPDATE 3-Martha Stewart, Macy's settle lawsuit over Penney deal * Macy's says deal does not affect lawsuit against Penney ~CORRECTED-UPDATE 2-Martha Stewart, Macy's settle lawsuit over Penney deal (Corrects paragraph 4 to say that Macy's sued Martha Stewart and J.C. Penney in 2012, not last year) ~Martha Stewart settles legal dispute with Macy's Jan 2 Martha Stewart Living Omnimedia Inc  said it had settled a legal dispute with retailer Macy's Inc over exclusive rights to its home products. ~
NWSA.DF,21st Century Fox sells Star China TV stake 21st Century Fox said on Thursday it would sell its 47 percent stake in Star China TV to the TV channel operator's management and private equity fund China Media Capital. ~21st Century Fox sells Star China TV stake Jan 2 21st Century Fox said on Thursday it would sell its 47 percent stake in Star China TV to the TV channel operator's management and private equity fund China Media Capital. ~
NWS.O,21st Century Fox sells Star China TV stake 21st Century Fox said on Thursday it would sell its 47 percent stake in Star China TV to the TV channel operator's management and private equity fund China Media Capital. ~21st Century Fox sells Star China TV stake Jan 2 21st Century Fox said on Thursday it would sell its 47 percent stake in Star China TV to the TV channel operator's management and private equity fund China Media Capital. ~
URBN.O,US STOCKS-Wall St starts 2014 with decline; investors take profits * Among top decliners are stocks that gained most in 2013 ~BRIEF-Urban Outfitters up 3.8 percent after upgrade NEW YORK, Jan 2 Urban Outfitters Inc :  * Shares up 3.8 percent in early trading, jefferies upgrades to buy ~
V,BRIEF-Visa calls for redemption all of its 1.200 pct notes due 2017 * Visa Inc - on Sept 11, co called for redemption all of $1.75 billion principal amount outstanding of its 1.200 pct notes due 2017‍​ - SEC filing ~BRIEF-Visa Inc files for three-part senior notes offering of up to $2.5 bln * Visa Inc says files for three-part senior notes offering of up to $2.5 billion - SEC filing‍​ ~Former BoE deputy Hogg to join Visa as Europe unit CEO Visa Inc, the world's largest payments processor, on Thursday named former Bank of England (BoE) deputy governor Charlotte Hogg as chief executive of its Europe division. ~CORRECTED-UPDATE 1-MOVES-Former BoE deputy Hogg to join Visa as Europe unit CEO Sept 7 Visa Inc, the world's largest payments processor, on Thursday named former Bank of England (BoE) deputy governor Charlotte Hogg as chief executive of its Europe division. ~MOVES-Visa names ex-BoE deputy Charlotte Hogg as Europe unit CEO Sept 7 Visa Inc, the world's largest payments processor, on Thursday named Charlotte Hogg as chief executive of its Europe division. ~BRIEF-Visa appoints Charlotte Hogg as CEO of European operations * Visa Inc appoints Charlotte Hogg as chief executive officer of the compan's European operations ~BRIEF-Visa Inc files prospectus supplement for potential three-part senior notes offering * Visa Inc files prospectus supplement for potential three-part senior notes offering; size not disclosed - sec filing‍​ Source text (http://bit.ly/2vLDrIe) Further company coverage: ~BRIEF-Visa enables on the go payments with the new Fitbit Ionic * Visa inc- ‍enabling visa payments on fitbit's smartwatch fitbit ionic​ ~BRIEF-Bridg raises $11 million in Series B funding * Bridg raises $11 million in Series B funding from Morpheus Ventures, March Capital, Visa and NextEquity ~
WMT,Wal-Mart recalls donkey product in China after fox meat scandal SHANGHAI, Jan 2 Wal-Mart Stores Inc, the world's largest retailer, has recalled donkey meat sold at some outlets in China after tests showed the product contained the DNA of other animals, the U.S. company said. ~
YUM,Wal-Mart recalls donkey product in China after fox meat scandal SHANGHAI, Jan 2 Wal-Mart Stores Inc, the world's largest retailer, has recalled donkey meat sold at some outlets in China after tests showed the product contained the DNA of other animals, the U.S. company said. ~
