AMGN.O,Amgen drug lowers cholesterol up to 66 pct in pivotal studies WASHINGTON, March 29 Amgen Inc's drug from a high profile new class of experimental medicines lowered "bad" LDL cholesterol by 55 percent to 66 percent compared with a placebo in a trio of late-stage clinical trials, according to data presented on Saturday. ~
AAPL.O,UPDATE 2-Apple, Google lose bid to avoid trial on tech worker lawsuit (Adds Apple declined to comment and additional detail, paragraphs 5, 9-13) ~
BA,WRAPUP 3-Chinese ships search new area for Malaysian plane (Adds China report on debris spotted, detail from AMSA on search) ~
DOW,BRIEF-Downer EDI says offer for Spotless Group now closed * Confirms that its offer for Spotless was not extended and has now closed. Source text for Eikon: Further company coverage: ~BRIEF-Downer EDI posts FY net profit of $181.5 million * FY total revenue and other income from ordinary activities $7.29 billion , up 6.4 percent ~BRIEF-Downer EDI says ‍offer for Spotless Group extended to 28 August 2017​ * ‍Offer for Spotless Group extended to 7pm on Monday, 28 august 2017​ Source text for Eikon: Further company coverage: ~BRIEF-Downer EDI says Spotless ‍offer extended to Aug 21, 2017​ * Spotless ‍offer extended to 7pm on monday, 21 august 2017​ Source text for Eikon: Further company coverage: ~BRIEF-Downer EDI's takeover offer for Spotless Group extended till 7pm (Sydney time) on Aug. 14 * Unconditional takeover offer for Spotless Group extended until 7:00pm (Sydney time) on Monday, 14 August Source text for Eikon: Further company coverage: (bangalore.newsroom@thomsonreuters.com) ~BRIEF-Downer extends takeover offer for Spotless Group * decided to extend Spotless offer period for one week; offer will now remain open for acceptance until 14 august Source text for Eikon: Further company coverage: ~BRIEF-Downer extends Spotless offer to August 7 2017 * ‍Downer has decided to extend offer for Spotless Group holdings to 7 pm on Monday, 7 august 2017​ Source text for Eikon: Further company coverage: ~BRIEF-Downer EDI's stake in Spotless increases to 80.3 pct * Downer's stake in Spotless increases to 80.3 pct Source text for Eikon: Further company coverage: ~BRIEF- Downer EDI Ltd'S stake in Spotless Group increases to 72% * As Downer's shareholding in Spotless is now over 70%, Downer expects that Spotless will be removed from certain S&P;/ASX market indices ~
GM,Exclusive: GM crash victims' families who settled may revisit deals Two families who settled with General Motors Co over fatal crashes linked to faulty ignition switches are considering trying to overturn the agreements, after the company disclosed it had known about the issue for years. | Video  ~GM expands ignition switch recall to 2.6 million cars DETROIT General Motors Co expanded its global recall of cars with defective ignition switches to 2.6 million on Friday, adding 971,000 later-model vehicles due to concerns over faulty replacement parts. ~General Motors recalls Chevrolet Cruzes, trucks and SUVs General Motors Co is recalling certain Chevrolet Cruze models for possible axle fractures, and more than 490,000 trucks and SUVs for potential transmission cooler line issues, the company said in a statement late on Friday. ~General Motors recalls Chevrolet Cruzes, trucks and SUVs March 29 General Motors Co is recalling certain Chevrolet Cruze models for possible axle fractures, and more than 490,000 trucks and SUVs for potential transmission cooler line issues, the company said in a statement late on Friday. ~UPDATE 3-GM expands ignition switch recall to 2.6 million cars DETROIT, March 28 General Motors Co  expanded its global recall of cars with defective ignition switches to 2.6 million on Friday, adding 971,000 later-model vehicles due to concerns over faulty replacement parts. ~
PFE,Amgen drug lowers cholesterol up to 66 pct in pivotal studies WASHINGTON, March 29 Amgen Inc's drug from a high profile new class of experimental medicines lowered "bad" LDL cholesterol by 55 percent to 66 percent compared with a placebo in a trio of late-stage clinical trials, according to data presented on Saturday. ~
V,BRIEF-Visa calls for redemption all of its 1.200 pct notes due 2017 * Visa Inc - on Sept 11, co called for redemption all of $1.75 billion principal amount outstanding of its 1.200 pct notes due 2017‍​ - SEC filing ~BRIEF-Visa Inc files for three-part senior notes offering of up to $2.5 bln * Visa Inc says files for three-part senior notes offering of up to $2.5 billion - SEC filing‍​ ~Former BoE deputy Hogg to join Visa as Europe unit CEO Visa Inc, the world's largest payments processor, on Thursday named former Bank of England (BoE) deputy governor Charlotte Hogg as chief executive of its Europe division. ~CORRECTED-UPDATE 1-MOVES-Former BoE deputy Hogg to join Visa as Europe unit CEO Sept 7 Visa Inc, the world's largest payments processor, on Thursday named former Bank of England (BoE) deputy governor Charlotte Hogg as chief executive of its Europe division. ~MOVES-Visa names ex-BoE deputy Charlotte Hogg as Europe unit CEO Sept 7 Visa Inc, the world's largest payments processor, on Thursday named Charlotte Hogg as chief executive of its Europe division. ~BRIEF-Visa appoints Charlotte Hogg as CEO of European operations * Visa Inc appoints Charlotte Hogg as chief executive officer of the compan's European operations ~BRIEF-Visa Inc files prospectus supplement for potential three-part senior notes offering * Visa Inc files prospectus supplement for potential three-part senior notes offering; size not disclosed - sec filing‍​ Source text (http://bit.ly/2vLDrIe) Further company coverage: ~BRIEF-Visa enables on the go payments with the new Fitbit Ionic * Visa inc- ‍enabling visa payments on fitbit's smartwatch fitbit ionic​ ~BRIEF-Bridg raises $11 million in Series B funding * Bridg raises $11 million in Series B funding from Morpheus Ventures, March Capital, Visa and NextEquity ~
