AMZN.O,UPDATE 1-Cisco joins cloud computing race with $1 bln plan March 24 Cisco Systems Inc plans to offer cloud computing services, pledging to spend $1 billion over the next two years to enter a market currently led by the world's biggest online retailer Amazon.com Inc. ~Cisco joins cloud computing race with $1 bln plan - WSJ March 24 Cisco Systems Inc plans to offer cloud computing services, pledging to spend $1 billion over the next two years to enter a market currently led by the world's biggest online retailer Amazon.com Inc, the Wall Street Journal reported. ~
AAPL.O,Tech leads Wall Street lower as Ukraine casts a shadow NEW YORK U.S. stocks fell on Monday, with some of the market's recent best performers like technology and biotech shares leading the way down. | Video  ~Netflix shares fall on Comcast-Apple report Netflix shares slumped more than 7 percent on Monday after a report about a new television streaming product that Comcast and Apple were working on together. ~Netflix shares fall on Comcast-Apple report March 24 Netflix shares slumped more than 7 percent on Monday after a report about a new television streaming product that Comcast and Apple were working on together. ~US STOCKS-Wall St slumps, Nasdaq under 50-day moving average * Nasdaq hit as trading favorites like Netflix, Tesla sink ~US STOCKS-Wall St lower, investors take profit in high-flying names * Nasdaq hit as trading favorites like Netflix, Tesla sink ~US STOCKS-Futures imply slight gains on hope for Chinese stimulus * Futures up: Dow 28 pts, S&P; 5 pts, Nasdaq 9 pts   (Updates prices, adds NU Skin) ~US STOCKS-Futures edge up on hope for Chinese stimulus NEW YORK, March 24 U.S. stock index futures edged higher on Monday as a weak reading on Chinese manufacturing raised hopes that the Chinese government would issue new stimulus to combat slowing momentum, though ongoing tensions in Ukraine weighed on sentiment. ~EU orders Luxembourg to hand over corporate tax practices information BRUSSELS, March 24 European Union antitrust regulators ordered Luxembourg on Monday to hand over information on its corporate tax practices as part of their investigation into tax loopholes which have allowed companies such as Starbucks and Apple to cut their tax bills. ~UPDATE 1-Taiwan's Pegatron to focus on mobiles, sees PC turnaround * Q4 net profit hits T$3.38 billion vs analyst estimates of T$2.84 billion ~
BLK,CORRECTED-MOVES- JP Morgan Chase, Federated Investors, BlackRock, KPMG (Corrects fifth item to say that Federated Investors has hired Ruggero de' Rossi, not Ruggero Rossi) ~
BA,Air France-KLM picks GE to power Boeing 787 jets PARIS, March 24 Air France-KLM said on Monday it had chosen GEnx engines made by General Electric  to power 25 787-9 Dreamliner aircraft it has ordered from Boeing. ~
CAT,U.S. Senate panel to hold hearing on Caterpillar offshore taxes WASHINGTON, March 24 A U.S. Senate subcommittee known for investigating corporate tax avoidance said on Monday it will hold a hearing on April 1 to examine the offshore tax strategies of Caterpillar Inc, the world's largest mining and construction equipment maker. ~
CSCO.O,UPDATE 1-Cisco joins cloud computing race with $1 bln plan March 24 Cisco Systems Inc plans to offer cloud computing services, pledging to spend $1 billion over the next two years to enter a market currently led by the world's biggest online retailer Amazon.com Inc. ~Cisco joins cloud computing race with $1 bln plan - WSJ March 24 Cisco Systems Inc plans to offer cloud computing services, pledging to spend $1 billion over the next two years to enter a market currently led by the world's biggest online retailer Amazon.com Inc, the Wall Street Journal reported. ~
C,Citi shakes up FX, creates position of global head of spot trading LONDON, March 24 Citi, the world's second-largest foreign exchange trader, is restructuring its FX trading desk, appointing a global head of trading and bringing its electronic and voice trading businesses closer together, according to an internal memo seen by Reuters. ~Mexico's Oceanografia CEO held for questioning in Citigroup fraud case MEXICO CITY The chief executive of a major Mexican oilfield services company was held for questioning on Saturday in connection with a fraud investigation that forced Citigroup to cut its 2013 profit, the federal attorney general's office said on Sunday. ~Mexico's Oceanografia CEO held for questioning in Citigroup fraud case MEXICO CITY, March 23 The chief executive of a major Mexican oilfield services company was held for questioning on Saturday in connection with a fraud investigation that forced Citigroup to cut its 2013 profit, the federal attorney general's office said on Sunday. ~
CMCSA.O,Tech leads Wall Street lower as Ukraine casts a shadow NEW YORK U.S. stocks fell on Monday, with some of the market's recent best performers like technology and biotech shares leading the way down. | Video  ~Netflix shares fall on Comcast-Apple report Netflix shares slumped more than 7 percent on Monday after a report about a new television streaming product that Comcast and Apple were working on together. ~Netflix shares fall on Comcast-Apple report March 24 Netflix shares slumped more than 7 percent on Monday after a report about a new television streaming product that Comcast and Apple were working on together. ~US STOCKS-Wall St slumps, Nasdaq under 50-day moving average * Nasdaq hit as trading favorites like Netflix, Tesla sink ~US STOCKS-Wall St lower, investors take profit in high-flying names * Nasdaq hit as trading favorites like Netflix, Tesla sink ~US STOCKS-Futures imply slight gains on hope for Chinese stimulus * Futures up: Dow 28 pts, S&P; 5 pts, Nasdaq 9 pts   (Updates prices, adds NU Skin) ~US STOCKS-Futures edge up on hope for Chinese stimulus NEW YORK, March 24 U.S. stock index futures edged higher on Monday as a weak reading on Chinese manufacturing raised hopes that the Chinese government would issue new stimulus to combat slowing momentum, though ongoing tensions in Ukraine weighed on sentiment. ~UPDATE 1-Market Chatter-Corporate finance press digest (Adds item on Lockheed Martin, Aditya Birla Private Equity, UK energy firms; updates item on Apple, Comcast) ~
DOW,BRIEF-Downer EDI says offer for Spotless Group now closed * Confirms that its offer for Spotless was not extended and has now closed. Source text for Eikon: Further company coverage: ~BRIEF-Downer EDI posts FY net profit of $181.5 million * FY total revenue and other income from ordinary activities $7.29 billion , up 6.4 percent ~BRIEF-Downer EDI says ‍offer for Spotless Group extended to 28 August 2017​ * ‍Offer for Spotless Group extended to 7pm on Monday, 28 august 2017​ Source text for Eikon: Further company coverage: ~BRIEF-Downer EDI says Spotless ‍offer extended to Aug 21, 2017​ * Spotless ‍offer extended to 7pm on monday, 21 august 2017​ Source text for Eikon: Further company coverage: ~BRIEF-Downer EDI's takeover offer for Spotless Group extended till 7pm (Sydney time) on Aug. 14 * Unconditional takeover offer for Spotless Group extended until 7:00pm (Sydney time) on Monday, 14 August Source text for Eikon: Further company coverage: (bangalore.newsroom@thomsonreuters.com) ~BRIEF-Downer extends takeover offer for Spotless Group * decided to extend Spotless offer period for one week; offer will now remain open for acceptance until 14 august Source text for Eikon: Further company coverage: ~BRIEF-Downer extends Spotless offer to August 7 2017 * ‍Downer has decided to extend offer for Spotless Group holdings to 7 pm on Monday, 7 august 2017​ Source text for Eikon: Further company coverage: ~BRIEF-Downer EDI's stake in Spotless increases to 80.3 pct * Downer's stake in Spotless increases to 80.3 pct Source text for Eikon: Further company coverage: ~BRIEF- Downer EDI Ltd'S stake in Spotless Group increases to 72% * As Downer's shareholding in Spotless is now over 70%, Downer expects that Spotless will be removed from certain S&P;/ASX market indices ~
XOM,UPDATE 5-Houston ship lane to have 'tapered' reopening; Exxon cuts output * Coast Guard says will re-open channel 'as soon as we can' ~Sinopec aims to complete mega marketing asset sale in third quarter HONG KONG State-run oil giant China Petroleum and Chemical Corp (Sinopec Corp)  aims to complete the sale of up to 30 percent of its sprawling marketing business in the third quarter of this year, a restructuring analysts say could raise $10-$20 billion. ~UPDATE 6-Vital Houston oil tanker routes shut amid spill cleanup * Coast Guard says no timeline for reopening Houston Channel ~
FB.O,How Facebook avoided costly suits over hiring from rivals SAN FRANCISCO, March 24 Facebook Inc has emerged as one of the biggest Silicon Valley players not to have agreed with other technology companies to avoid poaching each other's employees, saving the social-networking giant years of costly litigation. ~
GE,Air France-KLM picks GE to power Boeing 787 jets PARIS, March 24 Air France-KLM said on Monday it had chosen GEnx engines made by General Electric  to power 25 787-9 Dreamliner aircraft it has ordered from Boeing. ~GE Europe chief wants Britain in EU, Scotland to stay part of UK - FT March 24 The chief of General Electric's  European business said the industrial conglomerate wanted Britain to stay in the European Union and Scotland to remain part of Britain, the Financial Times reported. ~
GM,U.S. senator calls on DOJ to force GM compensation fund WASHINGTON A U.S. senator on Monday asked the federal government to force General Motors  to establish a fund to compensate consumers affected by a long-running problem that prompted a major recall of some GM vehicles he characterized as "lethally defective." ~U.S. senator demands compensation fund for recalled GM cars WASHINGTON Pressure built on General Motors on Monday to take steps to get 1.6 million of its recalled cars off the road immediately and to establish a compensation fund for consumers affected by the company's faulty ignition switches linked to 12 deaths. ~UPDATE 2-U.S. senator demands compensation fund for recalled GM cars (Adds details on Congressional hearings, Texas lawsuit against GM, GM returning "black box" from 2010 crash that killed woman) ~GM sued over fatal crash tied to ignition defect NEW YORK General Motors Co  has been hit with what is believed to be the first wrongful death lawsuit over ignition switch problems since it recalled 1.6 million vehicles in February. ~U.S. senator calls on DOJ to force GM compensation fund WASHINGTON, March 24 A U.S. senator on Monday asked the federal government to force General Motors to establish a fund to compensate consumers affected by a long-running problem that prompted a major recall of some GM vehicles he characterized as "lethally defective." ~GM sued over fatal crash tied to ignition defect * Lawsuit filed on behalf of three teenage girls injured or killed in 2006 crash ~CORRECTED-RPT-INSIGHT-U.S. regulators failed to spot deadly GM defects that others saw (Corrects description of Sean Kane to consultant from expert witness in paragraph 27) ~U.S. regulators failed to spot deadly GM defects that others saw WASHINGTON/CHICAGO Retired Wisconsin state trooper Keith Young and his wife were sitting at the kitchen table last month when a story on the evening news jarred them: General Motors Co was recalling 1.6 million vehicles for faulty ignition switches. ~Israel's Mobileye prepares for Nasdaq IPO - report TEL AVIV Mobileye, whose collision-avoidance technology has been adopted in cars made by the likes of BMW  and General Motors , is planning an initial public offering on Nasdaq this year, the Calcalist financial news website said on Monday. ~
JPM,CORRECTED-MOVES- JP Morgan Chase, Federated Investors, BlackRock, KPMG (Corrects fifth item to say that Federated Investors has hired Ruggero de' Rossi, not Ruggero Rossi) ~JPMorgan top China banker Fang to leave amid hiring probe HONG KONG JPMorgan Chase & Co's  chief executive for China investment banking, Fang Fang, will leave the firm, according to an internal memo - a departure that comes amid a probe of JPMorgan hiring practices in Asia. ~UPDATE 2-JPMorgan top China banker Fang to leave amid hiring probe * Departure comes amid probe of JPMorgan's hiring practices ~JPMorgan top China investment banker Fang to retire HONG KONG, March 24 JPMorgan Chase & Co's  chief executive for China investment banking Fang Fang has decided to retire from the firm, according to an internal memo obtained by Reuters on Monday. ~JPMorgan top China executive close to departing -WSJ March 24 JPMorgan Chase & Co's chief executive for China investment banking Fang Fang has decided to leave the U.S. bank after more than a decade amid a probe of its Asian hiring practices, the Wall Street Journal reported on Sunday. ~
LMT,Lockheed's F-35 gets South Korea nod, but momentum slower than hoped WASHINGTON South Korea on Monday became the 10th country to choose Lockheed Martin Corp.'s  F-35 fighter jet to replace aging warplanes, a boost for the Pentagon's biggest weapons program at a time when Italy, Canada and other countries are rethinking their procurement plans. ~UPDATE 1-Market Chatter-Corporate finance press digest (Adds item on Lockheed Martin, Aditya Birla Private Equity, UK energy firms; updates item on Apple, Comcast) ~South Korea boosts air defenses with about $6.8 billion budget for F-35s SEOUL South Korea expects to pay around 7.34 trillion won ($6.79 billion) for 40 Lockheed Martin  F-35 fighter jets, two sources with knowledge of the matter said on Monday, as Seoul boosts its air defenses amid simmering tensions in the region. ~S.Korea to pay around $6.8 bln for 40 F-35 fighter jets-source SEOUL, March 24 South Korea has set a budget of around 7.34 trillion won ($6.79 billion) for 40 Lockheed Martin  F-35 fighter jets, a source with direct knowledge of the deal said on Monday, in a purchase to be finalised in the third quarter. ~
MU.O,Einhorn's Greenlight Capital finds Micron leaker, drops case NEW YORK, March 24 Greenlight Capital Inc, the hedge fund overseen by David Einhorn, has identified a blogger who disclosed its stake in Micron Technology Inc before it was officially announced, and has dropped a legal case seeking to force the website Seeking Alpha to reveal the blogger's name. ~BRIEF-Greenlight Capital says has identified blogger who revealed stake in Micron, drops case March 24 Micron Technology Inc :  * Greenlight capital says has identified blogger who disclosed firm's stake in ~
MSFT.O,UPDATE 3-Microsoft deal delay may mean more Nokia patent concessions * Asian authorities seen delaying $7.4 bln deal until April ~Deals of the day- Mergers and acquisitions March 24 The following bids, mergers, acquisitions and disposals were reported by 1000 GMT on Monday: ~Nokia says now expects Devices sale to close in April STOCKHOLM, March 24 Finland's Nokia  said on Monday it expected the 5.4 billion euro ($7.5 billion) sale of most of its Devices and Services business to Microsoft  will close in April this year. ~BRIEF-Nokia expects Devices sale to Microsoft to close April STOCKHOLM, March 24 Nokia Oyj :  * Expects the sale of substantially all of its devices & services business to ~
MS,Factbox: CFTC action on speculative position limit violations CHICAGO Morgan Stanley has agreed to pay $200,000 to settle civil charges it exceeded speculative position limits in soybean meal futures in January 2013, while attempting to hedge a commodity index investment, U.S. regulators said on Monday. ~UPDATE 2-Morgan Stanley pays fine after index hedge topped soymeal limits WASHINGTON/CHICAGO, March 24 Morgan Stanley  has agreed to pay $200,000 to settle civil charges it exceeded speculative position limits in soybean meal futures for two days while attempting to hedge a commodity index investment, U.S. regulators said on Monday. ~New Issue- Morgan Stanley prices 1.5 bln euro 2021 bond Underlying govt bond    Over Mid-swaps, equivalent to 144.3bp ~ON THE MOVE-Raymond James hires two managers from UBS, Morgan Stanley March 24 Raymond James Financial Inc  said on Monday it appointed two managers earlier this month to expand its employee branches in Boston and Washington D.C. ~
NDAQ.O,Nasdaq reorganizes market services to boost global competitiveness NEW YORK, March 24 Nasdaq OMX Group  said on Monday it is reorganizing its market services business to better compete globally in fixed income, currencies, derivatives and other asset classes. ~
NFLX.O,Netflix shares fall on Comcast-Apple report March 24 Netflix shares slumped more than 7 percent on Monday after a report about a new television streaming product that Comcast and Apple were working on together. ~US STOCKS-Wall St slumps, Nasdaq under 50-day moving average * Nasdaq hit as trading favorites like Netflix, Tesla sink ~US STOCKS-Wall St lower, investors take profit in high-flying names * Nasdaq hit as trading favorites like Netflix, Tesla sink ~
SLB,UPDATE 1-Schlumberger expects Q1 earnings to jump from last year NEW ORLEANS, March 24 Schlumberger Ltd, the world's largest oilfield services company, said on Monday it expects first-quarter earnings to be much higher than in the same period last year, as it takes market share from rivals and cuts costs. ~Schlumberger expects 'strong' Q1 earnings bump NEW ORLEANS, March 24 Schlumberger Ltd, the world's largest oilfield services company, said on Monday it expects first-quarter earnings to be much higher than in the same period last year. ~
LUV,UPDATE 2-Southwest to add flights from Reagan National Airport * New flights follow purchase of slots from American Airlines   (Adds aviation consultants' comments, closing share prices) ~Southwest to add flights from Reagan National Airport Southwest Airlines Co will more than double its flights from Ronald Reagan Washington National Airport this year with new nonstop routes to cities including Akron-Canton, Ohio; Indianapolis and Dallas Love Field, it said on Monday. ~BRIEF-Southwest adding new flights from Reagan National Airport March 24 Southwest Airlines Co :  * Carrier plans this year to add new flights between Reagan National Airport and ~
DIS,UPDATE 2-Disney to buy YouTube network Maker Studios for $500 mln (Adds comment from Disney executive, forecast for impact on earnings, paragraphs 4-6) ~Disney promotes ABC News chief Sherwood to top TV job ABC News President Ben Sherwood next year will replace Anne Sweeney as co-chairman of Disney Media Networks and president of Disney/ABC Television Group, Walt Disney Co said on Monday. ~UPDATE 2-Disney promotes ABC News chief Sherwood to top TV job March 24 ABC News President Ben Sherwood next year will replace Anne Sweeney as co-chairman of Disney Media Networks and president of Disney/ABC Television Group, Walt Disney Co said on Monday. ~CORRECTED-UPDATE 1-Disney names news chief Sherwood to co-chair of media networks (In headline, corrects title to "co-chair of media networks" instead of "of ABC TV Group") ~Disney names Ben Sherwood to replace long-time executive Sweeney   ~
V,BRIEF-Visa calls for redemption all of its 1.200 pct notes due 2017 * Visa Inc - on Sept 11, co called for redemption all of $1.75 billion principal amount outstanding of its 1.200 pct notes due 2017‍​ - SEC filing ~BRIEF-Visa Inc files for three-part senior notes offering of up to $2.5 bln * Visa Inc says files for three-part senior notes offering of up to $2.5 billion - SEC filing‍​ ~Former BoE deputy Hogg to join Visa as Europe unit CEO Visa Inc, the world's largest payments processor, on Thursday named former Bank of England (BoE) deputy governor Charlotte Hogg as chief executive of its Europe division. ~CORRECTED-UPDATE 1-MOVES-Former BoE deputy Hogg to join Visa as Europe unit CEO Sept 7 Visa Inc, the world's largest payments processor, on Thursday named former Bank of England (BoE) deputy governor Charlotte Hogg as chief executive of its Europe division. ~MOVES-Visa names ex-BoE deputy Charlotte Hogg as Europe unit CEO Sept 7 Visa Inc, the world's largest payments processor, on Thursday named Charlotte Hogg as chief executive of its Europe division. ~BRIEF-Visa appoints Charlotte Hogg as CEO of European operations * Visa Inc appoints Charlotte Hogg as chief executive officer of the compan's European operations ~BRIEF-Visa Inc files prospectus supplement for potential three-part senior notes offering * Visa Inc files prospectus supplement for potential three-part senior notes offering; size not disclosed - sec filing‍​ Source text (http://bit.ly/2vLDrIe) Further company coverage: ~BRIEF-Visa enables on the go payments with the new Fitbit Ionic * Visa inc- ‍enabling visa payments on fitbit's smartwatch fitbit ionic​ ~BRIEF-Bridg raises $11 million in Series B funding * Bridg raises $11 million in Series B funding from Morpheus Ventures, March Capital, Visa and NextEquity ~
