PFE,Pfizer CEO flies in to pitch Astra deal to UK government LONDON Pfizer  Chief Executive Ian Read flew into London on Tuesday to pitch his planned $100 billion takeover of rival British drugmaker AstraZeneca  to government ministers and urge them not to obstruct the deal. ~Pfizer CEO flies in to pitch Astra deal to UK government LONDON, April 29 Pfizer Chief Executive Ian Read flew into London on Tuesday to pitch his planned $100 billion takeover of rival British drugmaker AstraZeneca  to government ministers and urge them not to obstruct the deal. ~Pfizer may have to pay more cash and top $105 billion to win AstraZeneca LONDON U.S. drugmaker Pfizer  will need to raise its bid for AstraZeneca  to around $105-110 billion and increase the proportion of cash in the offer to win its British rival, investors believe. ~Pfizer may have to pay more cash and top $105 bln to win AstraZeneca * Pfizer may give more cash but limited by UK domicile move ~RPT-Fitch: Pfizer, AstraZeneca Combo Would Achieve Strategic Aims April 29 (The following statement was released by the rating agency) ~Wockhardt denies media report on asset sale talks MUMBAI, April 29 Indian generic drugmaker Wockhardt Ltd denied on Tuesday a media report that said U.S. drugmakers Mylan Inc and Pfizer Inc  were in talks with the company to buy some of its assets. ~Pfizer's weak drug pipeline fuels hunger for AstraZeneca NEW YORK At the heart of Pfizer Inc's  pursuit of British drugmaker AstraZeneca Plc  is a shortage of attractive products in its own research pipeline, aggravated by a recent series of disappointing drug launches, according to some industry analysts and money managers. ~Pfizer's weak drug pipeline fuels hunger for AstraZeneca NEW YORK At the heart of Pfizer Inc's pursuit of British drugmaker AstraZeneca Plc is a shortage of attractive products in its own research pipeline, aggravated by a recent series of disappointing drug launches, according to some industry analysts and money managers. ~India Morning Call-Global Markets NEW YORK - The S&P; 500 ended higher on Monday after a volatile session, as gains in Apple and Pfizer  helped offset another round of selling in some high-growth tech shares. ~
ROK,UPDATE 2-Rockwell Auto misses estimates as strong dollar hits margins * Shares fall as much as 7 pct   (Adds CFO, analyst comments; updates shares) ~Strong U.S. sales boost Rockwell Automation profit Rockwell Automation Inc , which makes systems that help factories run smoothly, reported a 2.5 percent rise in quarterly profit due to higher sales of its motion control and industrial safety products in the United States. ~Strong U.S. sales boost Rockwell Automation profit April 29 Rockwell Automation Inc, which makes systems that help factories run smoothly, reported a 2.5 percent rise in quarterly profit due to higher sales of its motion control and industrial safety products in the United States. ~
SJP.L,Upbeat earnings hoist Britain's FTSE to 7-week high LONDON, April 29 Britain's blue chip shares hit a seven-week high on Tuesday, bolstered by upbeat corporate earnings reports from oil major BP and wealth manager St. James's Place. ~Britain's FTSE hits 7-week high, led by Shire LONDON, April 29 Britain's top shares hit a seven-week high on Tuesday, bolstered by more deal news in the pharmaceuticals sector alongside upbeat corporate earnings reports from BP and wealth manager St. James's Place. ~UPDATE 2-Retail investors boost St James's Place Q1 new money * Says well-placed to meet mid-term growth targets   (Adds CEO comment, share reaction, analyst comment) ~Britain's FTSE hits 7-week high, Shire gains LONDON, April 29 Britain's top share index climbed to a seven-week high on Tuesday, boosted by merger and acquisition news and positive updates from companies such as Whitbread and St. James's Place. ~St James's Place sees strong start to 2014 LONDON, April 29 British wealth manager St. James's Place said on Tuesday it had started the year strongly, taking in 1.2 billion pounds ($2.02 billion) in new money, up 26 percent on the year earlier. ~
TROW.O,Doximity, the LinkedIn for doctors, raises $54 mln from T Rowe Price, DFJ SAN FRANCISCO, April 29 Doximity, an online professional network for physicians, has raised $54 million in new funding from investors including T. Rowe Price and Draper Fisher Jurvetson, making it one of the most well-financed private companies in health IT. ~
TGT,CORRECTED-UPDATE 1-Target names new CIO to oversee technology, security (Correcting in 5th paragraph to show that DeRodes is no longer on Veracode board) ~Target names new CIO to oversee technology, security April 29 Target Corp on Tuesday said it has appointed a new Chief Information Officer, Bob DeRodes, to oversee the discount retailer's technology team, operations and data security enhancements. ~
KO,Berkshire's Buffett says son serves Coca-Cola shareholders - CNBC NEW YORK, April 29 Berkshire Hathaway (BRKa.N) Chairman and Chief Executive Warren Buffett said Tuesday that his son, Howard Buffett, served Coca-Cola shareholders and not Berkshire on the beverage maker's board. ~
DIS,Harrison Ford, Carrie Fisher lead cast of new 'Star Wars' film LOS ANGELES, April 29 Harrison Ford will lead returning and rising stars, including Carrie Fisher, Mark Hamill, Andy Serkis and Oscar Isaac, for the anticipated new "Star Wars: Episode VII" film, Walt Disney Co and Lucasfilm said on Tuesday. ~Disney to increase investment in Chinese theme park and resort Walt Disney  said on Monday it has struck a deal with its Chinese joint venture partner to increase investment in its upcoming resort and theme park, Shanghai Disney, by an additional $800 million. ~Disney to increase investment in Chinese theme park and resort April 28 Walt Disney said on Monday it has struck a deal with its Chinese joint venture partner to increase investment in its upcoming resort and theme park, Shanghai Disney, by an additional $800 million. ~
TWX,UPDATE 7-NBA bans Los Angeles Clippers owner for life over racist comments (Adds legal analysis and sponsors status, comments from Players Association, Jesse Jackson) ~
VLO,DIARY-U.S. MEETINGS/WEEK AHEAD THOMSON REUTERS, Apr 29,2014 - Corporate Meetings for US companies for Week ahead.         S&P; 500 Earnings - Weekly           S&P; 500 Earnings - Day Ahead        Non S&P; 500 - Weekly               Non S&P; 500 - Day Ahead             ConferenceCall/Webcast - Weekly    ConferenceCall/Webcast - Day        S&P; 500 Earnings - Monthly           Meetings - Day Ahead                Economic Indicators                  Dividends                           Daily earnings hits & misses         Federal Rese ~Valero profit rises on higher U.S. Gulf refining margins April 29 Valero Energy Corp, the largest U.S. independent refining company, reported a 27 percent increase in quarterly profit, helped by higher margins for processing crude oil in the U.S. Gulf Coast. ~
VZ,Netflix in deal to pay Verizon for faster access LOS ANGELES, April 28 Netflix Inc has reached a deal to pay Verizon Communications Inc for faster delivery of its TV shows and movies, the second arrangement to pay fees for quicker access that the company argues should be free. ~
V,BRIEF-Visa calls for redemption all of its 1.200 pct notes due 2017 * Visa Inc - on Sept 11, co called for redemption all of $1.75 billion principal amount outstanding of its 1.200 pct notes due 2017‍​ - SEC filing ~BRIEF-Visa Inc files for three-part senior notes offering of up to $2.5 bln * Visa Inc says files for three-part senior notes offering of up to $2.5 billion - SEC filing‍​ ~Former BoE deputy Hogg to join Visa as Europe unit CEO Visa Inc, the world's largest payments processor, on Thursday named former Bank of England (BoE) deputy governor Charlotte Hogg as chief executive of its Europe division. ~CORRECTED-UPDATE 1-MOVES-Former BoE deputy Hogg to join Visa as Europe unit CEO Sept 7 Visa Inc, the world's largest payments processor, on Thursday named former Bank of England (BoE) deputy governor Charlotte Hogg as chief executive of its Europe division. ~MOVES-Visa names ex-BoE deputy Charlotte Hogg as Europe unit CEO Sept 7 Visa Inc, the world's largest payments processor, on Thursday named Charlotte Hogg as chief executive of its Europe division. ~BRIEF-Visa appoints Charlotte Hogg as CEO of European operations * Visa Inc appoints Charlotte Hogg as chief executive officer of the compan's European operations ~BRIEF-Visa Inc files prospectus supplement for potential three-part senior notes offering * Visa Inc files prospectus supplement for potential three-part senior notes offering; size not disclosed - sec filing‍​ Source text (http://bit.ly/2vLDrIe) Further company coverage: ~BRIEF-Visa enables on the go payments with the new Fitbit Ionic * Visa inc- ‍enabling visa payments on fitbit's smartwatch fitbit ionic​ ~BRIEF-Bridg raises $11 million in Series B funding * Bridg raises $11 million in Series B funding from Morpheus Ventures, March Capital, Visa and NextEquity ~
WMT,UPDATE 1-MoneyGram slashes forecast as Wal-Mart threat looms * Slashes FY constant currency revenue growth to 1-3 pct from 8-10 pct ~MoneyGram slashes 2014 forecast as Wal-Mart looms April 29 MoneyGram International Inc, the world's second-largest money transfer company, slashed its forecast for 2014 on fears of competition from Wal-Mart Stores Inc. ~
