AGN,Britain's FTSE hits 7-week high, led by Shire LONDON, April 29 Britain's top shares hit a seven-week high on Tuesday, bolstered by more deal news in the pharmaceuticals sector alongside upbeat corporate earnings reports from BP and wealth manager St. James's Place. ~BUSINESS-NEWS-SCHEDULE AT 0830 GMT / 4.30 AM ET UK grows slightly more slowly than expected in 1st quarter ~
GOOGL.O,UPDATE 2-Apple, Samsung make final pitches to U.S. jury in patent trial SAN JOSE, Calif., April 29 Apple has vastly exaggerated the importance of its patented iPhone features, a Samsung attorney said on Tuesday as the two companies delivered closing arguments to jurors after a month-long trial over mobile technology. ~Microsoft raises cloud pitch, targets Dropbox, Box April 28 Microsoft Corp said it will increase its cloud storage offering for business users by 40-fold as the world's largest software company makes a case for businesses buying an all-in-one product from itself rather than buying technology "piecemeal" from multiple sellers. ~
GOOG.O,UPDATE 2-Apple, Samsung make final pitches to U.S. jury in patent trial SAN JOSE, Calif., April 29 Apple has vastly exaggerated the importance of its patented iPhone features, a Samsung attorney said on Tuesday as the two companies delivered closing arguments to jurors after a month-long trial over mobile technology. ~Microsoft raises cloud pitch, targets Dropbox, Box April 28 Microsoft Corp said it will increase its cloud storage offering for business users by 40-fold as the world's largest software company makes a case for businesses buying an all-in-one product from itself rather than buying technology "piecemeal" from multiple sellers. ~
AIG,Ex-AIG chief Greenberg must face judge he called biased NEW YORK, April 29 Former AIG chief Maurice "Hank" Greenberg will have to defend himself against claims of accounting fraud in a non-jury trial conducted by a judge he tried to remove for alleged bias. ~
AAPL.O,UPDATE 2-Apple, Samsung make final pitches to U.S. jury in patent trial SAN JOSE, Calif., April 29 Apple has vastly exaggerated the importance of its patented iPhone features, a Samsung attorney said on Tuesday as the two companies delivered closing arguments to jurors after a month-long trial over mobile technology. ~UPDATE 4-Orders pour in for Apple's $12bn bond offering NEW YORK, April 29 (IFR) - Investors rushed on Tuesday to get a piece of Apple's new US$12bn seven-part bond deal, just the company's second foray into the US bond market. ~European Union moves to end smartphone patent wars BRUSSELS The European Union's antitrust enforcer has told two top smartphone makers to stop filing aggressive patent lawsuits against rivals such as Apple, aiming to end a patent war and open the market to freer competition. ~Apple bond now seen at US$10-$12bn; demand tops US$40bn -sources NEW YORK, April 29 (IFR) - Technology giant Apple is now expected to raise US$10bn-US$12bn from a seven-tranche bond deal, higher than initial expectations of US$8bn-US$10bn as order books climbed in excess of US$40bn, market sources said on Tuesday. ~GLOBAL MARKETS-Stocks rise on corporate results, euro falls on inflation data * U.S. bond yields rise as Apple prepares huge bond deal   (Updates market action,) ~Apple makes final pitch to U.S. jury in Samsung trial SAN JOSE, Calif., April 29 Samsung transformed the smartphone market only by copying iPhone technology, an Apple attorney said on Tuesday as the two companies delivered closing arguments to jurors after a month-long trial over mobile patents. ~Apple bond guidance levels 10bp-20bp inside IPTs NEW YORK, April 29 (IFR) - Technology giant Apple has tightened guidance on its seven-tranche US dollar bond by 10bp to 20bp from initial price talk levels, reflecting strong demand for the deal that was heard to be in excess of US$30bn by midday. ~UPDATE 2-European Union moves to end smartphone patent wars * EU antitrust chief: Motorola action against Apple illegal ~
ADM,UPDATE 2-ADM stock drops almost 3 percent after earnings miss (Updates with decline in stock price, analyst and executive comments) ~ADM returns cocoa business to profit as sale plans scrapped NEW YORK, April 29 Archer Daniels Midland  said on Tuesday its cocoa business returned to a profit in the first quarter, the latest sign of a turnaround at a niche division just weeks after the U.S. food and farming giant said it dropped plans to sell its cocoa operations. ~ADM earnings dip as cold drives up grain handling costs April 29 Agribusiness company Archer Daniels Midland Co on Tuesday said quarterly earnings slipped as a cold U.S. winter drove up costs for grain merchandising and handling. ~
BRKa.N,Berkshire's Buffett says son serves Coca-Cola shareholders - CNBC NEW YORK, April 29 Berkshire Hathaway (BRKa.N) Chairman and Chief Executive Warren Buffett said Tuesday that his son, Howard Buffett, served Coca-Cola shareholders and not Berkshire on the beverage maker's board. ~
BSX,Boston Scientific adjusted profit rises due to higher device sales Boston Scientific Corp  reported a higher adjusted profit in the first quarter, helped by higher sales of its neuromodulation and heart rhythm management devices. ~Boston Scientific adjusted profit rises due to higher device sales April 29 Boston Scientific Corp reported a higher adjusted  profit in the first quarter, helped by higher sales of its neuromodulation and heart rhythm management devices. ~
BMY,UPDATE 2-Possible delay for Bristol cancer-drug causes jitters (Adds analyst comments, details on nivolumab; updates share movement) ~Bristol-Myers profit beats forecasts, but sales lag Bristol-Myers Squibb Co  reported higher-than-expected quarterly earnings, helped by cost cuts and lower taxes, but sales missed Wall Street estimates, and the U.S. drugmaker's shares fell. ~Bristol-Myers quarterly profit beats expectations as costs cut U.S. drugmaker Bristol-Myers Squibb Co  reported higher-than-expected quarterly earnings, helped by cost cuts, but sales fell short of Wall Street expectations. ~Bristol-Myers quarterly profit beats expectations as costs cut April 29 U.S. drugmaker Bristol-Myers Squibb Co  reported higher-than-expected quarterly earnings, helped by cost cuts, but sales fell short of Wall Street expectations. ~
CBS,UPDATE 1-Craig Ferguson to leave CBS' 'The Late Late Show' in December 2014 LOS ANGELES, April 28 Late night host Craig Ferguson will be leaving CBS' "The Late Late Show" in December, the host and the network said on Monday, the latest movement in the shuffling of late-night television to draw a younger audience. ~Craig Ferguson to leave CBS 'The Late Late Show' in December 2014 LOS ANGELES Late night host Craig Ferguson will be leaving CBS' "The Late Late Show" in December, the host and the network said on Monday, the latest movement in the shuffling of late-night television to draw a younger audience. ~Craig Ferguson to leave CBS 'The Late Late Show' in December 2014 LOS ANGELES, April 28 Late night host Craig Ferguson will be leaving CBS' "The Late Late Show" in December, the host and the network said on Monday, the latest movement in the shuffling of late-night television to draw a younger audience. ~
CVX,Patton Boggs' latest case vs Chevron over pollution award tossed NEW YORK A New York federal judge has dismissed a lawsuit brought by Patton Boggs accusing Chevron Corp of "bad faith" litigation tactics while the Washington law firm tried to enforce a multibillion-dollar pollution judgment. ~Putin sees no need to sanction West, may review energy ties MINSK Russian President Vladimir Putin said on Tuesday that Moscow saw no need for counter sanctions against the West, but could reconsider the participation of Western companies in its economy, including energy projects. ~UPDATE 2-Putin sees no need to sanction West, may review energy ties MINSK, April 29 Russian President Vladimir Putin said on Tuesday that Moscow saw no need for counter sanctions against the West, but could reconsider the participation of Western companies in its economy, including energy projects. ~
COH,US STOCKS-Wall St ends up on earnings, rebound in high-growth shares * Indexes up: Dow 0.5 pct, S&P; 0.5 pct, Nasdaq 0.7 pct   (Updates to close) ~US STOCKS-Wall St gains with upbeat earnings, more deal activity * Indexes up: Dow 0.6 pct, S&P; 0.5 pct, Nasdaq 0.7 pct   (Updates to afternoon, changes byline) ~US STOCKS-Wall St climbs, lifted by Merck, Sprint on rosy earnings * EU sanctions 15 politicians, military leaders over Ukraine ~US STOCKS-Wall St higher as Merck, Sprint shares gain on results * EU sanctions 15 politicians, military leaders over Ukraine ~US STOCKS-Wall St set to open higher; FOMC meeting on tap * EU sanctions 15 politicians, military leaders over Ukraine ~Coach N. American comparable sales tumble 21 percent April 29 Coach Inc reported a sharp drop in North American sales on Tuesday as the upscale leather goods maker continued to lose ground to fast-growing rivals. ~
CMCSA.O,BRIEF-Comcast will probably increase buybacks after deals-CNBC * CEO Roberts says company will probably 'need to be in a position' to increase buybacks-CNBC  Source text for Eikon:  Further company coverage:    (Reporting By Christian Plumb) ~Univision says Comcast buy of TWC could be 'bad for Hispanic audiences' WASHINGTON The head of the Spanish-language television network Univision [UVN.UL] said on Monday that Comcast Corp's plan to buy rival Time Warner Cable Inc could be "bad for Hispanic audiences." ~Univision says Comcast buy of TWC could be 'bad for Hispanic audiences' WASHINGTON The head of the Spanish-language television network Univision said on Monday that Comcast Corp's plan to buy rival Time Warner Cable Inc could be "bad for Hispanic audiences." ~UPDATE 1-Univision says Comcast buy of TWC could be 'bad for Hispanic audiences' WASHINGTON, April 28 The head of the Spanish-language television network Univision said on Monday that Comcast Corp's plan to buy rival Time Warner Cable Inc could be "bad for Hispanic audiences." ~
CMI,Cummins beats, raises forecast on North America strength April 29 Cummins Inc posted results on Tuesday that topped analysts expectations and raised its full-year forecast as strong demand for its engines and vehicle components in North America offset weakness in many other parts of the world. ~
DLPH.N,Delphi Automotive reviewing possible violations April 29 Auto parts maker Delphi Automotive Plc  is reviewing potential violations of the U.S. Foreign Corrupt Practices Act linked to payments made by employees in China, the company disclosed in a regulatory filing. ~
DOW,BRIEF-Downer EDI says offer for Spotless Group now closed * Confirms that its offer for Spotless was not extended and has now closed. Source text for Eikon: Further company coverage: ~BRIEF-Downer EDI posts FY net profit of $181.5 million * FY total revenue and other income from ordinary activities $7.29 billion , up 6.4 percent ~BRIEF-Downer EDI says ‍offer for Spotless Group extended to 28 August 2017​ * ‍Offer for Spotless Group extended to 7pm on Monday, 28 august 2017​ Source text for Eikon: Further company coverage: ~BRIEF-Downer EDI says Spotless ‍offer extended to Aug 21, 2017​ * Spotless ‍offer extended to 7pm on monday, 21 august 2017​ Source text for Eikon: Further company coverage: ~BRIEF-Downer EDI's takeover offer for Spotless Group extended till 7pm (Sydney time) on Aug. 14 * Unconditional takeover offer for Spotless Group extended until 7:00pm (Sydney time) on Monday, 14 August Source text for Eikon: Further company coverage: (bangalore.newsroom@thomsonreuters.com) ~BRIEF-Downer extends takeover offer for Spotless Group * decided to extend Spotless offer period for one week; offer will now remain open for acceptance until 14 august Source text for Eikon: Further company coverage: ~BRIEF-Downer extends Spotless offer to August 7 2017 * ‍Downer has decided to extend offer for Spotless Group holdings to 7 pm on Monday, 7 august 2017​ Source text for Eikon: Further company coverage: ~BRIEF-Downer EDI's stake in Spotless increases to 80.3 pct * Downer's stake in Spotless increases to 80.3 pct Source text for Eikon: Further company coverage: ~BRIEF- Downer EDI Ltd'S stake in Spotless Group increases to 72% * As Downer's shareholding in Spotless is now over 70%, Downer expects that Spotless will be removed from certain S&P;/ASX market indices ~
ETN,UPDATE 2-Eaton projects 2nd-qtr profit below Street, shares fall April 29 Diversified manufacturer Eaton Corp  on Tuesday forecast second-quarter profit below Wall Street's target, weighed down by restructuring costs. ~Manufacturer Eaton's first-quarter profit tops estimate Diversified manufacturer Eaton Corp  posted a rise in first-quarter profit that just topped analysts' estimates on Tuesday, helped by lower-than-expected costs, but forecast second-quarter earnings that appeared to lag Wall Street's target. ~Manufacturer Eaton posts Q1 profit ahead of street view April 29 Eaton Corp, the diversified maker of electrical and hydraulic systems, posted a 16 percent rise in first-quarter net income on Tuesday, despite a negative impact from rough winter weather in North America. ~
EBAY.O,UPDATE 2-EBay beefs up U.S. war chest in pursuit of growth SAN FRANCISCO, April 29 EBay Inc is preparing to bring a major portion of its foreign earnings back into the United States, hoping to bankroll acquisitions and drive an expansion into mobile payments and other high-growth areas as its core business matures. ~US STOCKS-Wall St ends up on earnings, rebound in high-growth shares * Indexes up: Dow 0.5 pct, S&P; 0.5 pct, Nasdaq 0.7 pct   (Updates with eBay down after the bell) ~EBay's first-quarter profit tops Wall Street, but outlook disappoints SAN FRANCISCO, April 29 EBay Inc posted a better-than-expected first-quarter profit on Tuesday, boosted by its PayPal payments unit, but the e-commerce giant's second-quarter forecast fell short of estimates. ~
ESRX.O,UPDATE 2-Express Scripts 1st-qtr profit falls, lowers 2014 forecast (Adds analyst comment, prescription volume details; updates share price) ~Express Scripts profit falls, lowers 2014 forecast Pharmacy benefit manager Express Scripts Holding Co  on Tuesday reported lower-than-expected first quarter profit and took down its full-year earnings forecast range by 6 cents, saying adjusted prescription volume would be less than it had anticipated. ~Express Scripts profit falls, lowers 2014 forecast April 29 Pharmacy benefit manager Express Scripts Holding Co on Tuesday reported lower first quarter profit and took down its full-year earnings forecast range by 6 cents, saying adjusted prescription volume would be less than it had anticipated. ~
FB.O,Ex-Rothschild banker Yao faces tough Alibaba IPO test HONG KONG As Alibaba.com prepared for its Hong Kong IPO in late 2007, details of the deal emerged in local media, much to the frustration of Michael Yao, the company's top financial adviser. ~NEWSMAKER-Ex-Rothschild banker Yao faces tough Alibaba IPO test HONG KONG, April 30 As Alibaba.com prepared for its Hong Kong IPO in late 2007, details of the deal emerged in local media, much to the frustration of Michael Yao, the company's top financial adviser. ~US STOCKS-Wall St ends up on earnings, rebound in high-growth shares * Indexes up: Dow 0.5 pct, S&P; 0.5 pct, Nasdaq 0.7 pct   (Updates to close) ~
FDX,UPDATE 8-Six hurt, suspect dead in Georgia FedEx facility shooting (Adds identity and age of gunman in second and fourth paragraphs) ~At least six hurt in shooting at FedEx facility in Georgia - local media April 29 At least six people were hurt in a shooting at an airport-based FedEx Corp. facility in Kennesaw, Georgia, early on Tuesday, WSB-TV reported. ~
GE,UPDATE 6-Alstom accepts 10 bln euro GE bid for its energy unit * Talks not exclusive, Alstom can hold talks with Siemens ~Alstom accepts GE offer for its energy unit: sources PARIS The board of French transport-to-turbines group Alstom  has accepted General Electric's  offer for its energy unit, two sources familiar with the situation told Reuters. ~Alstom accepts GE offer for its energy unit - sources PARIS, April 29 The board of French transport-to-turbines group Alstom has accepted General Electric's offer for its energy unit, two sources familiar with the situation told Reuters. ~Alstom board accepts 10 billion euro GE offer for energy unit-paper PARIS The board of French trains-to-turbines maker Alstom has accepted General Electric's  10 billion euro offer for its energy division, French daily Le Figaro said on its website. ~Alstom board accepts 10 bln euro GE offer for energy unit-paper PARIS, April 29 The board of French trains-to-turbines maker Alstom has accepted General Electric's  10 billion euro offer for its energy division, French daily Le Figaro said on its website. ~GE vows to boost French jobs with Alstom bid - letter PARIS General Electric  Chief Executive Jeffrey Immelt said in a letter to French President Francois Hollande that if GE were to buy the energy unit of Alstom, it would boost employment in France and locate global headquarters for several key businesses in the country. ~GE vows to boost French jobs with Alstom bid - letter PARIS, April 29 General Electric Chief Executive Jeffrey Immelt said in a letter to French President Francois Hollande that if GE were to buy the energy unit of Alstom, it would boost employment in France and locate global headquarters for several key businesses in the country. ~GE trumpets 40-year jet engine venture to bolster Alstom bid PARIS As General Electric  tries to convince French leaders to back its offer to rescue engineering firm Alstom , it hopes that three letters will convince them of its good will: CFM. ~Whoever wins Alstom power assets, industry faces shakeout PARIS General Electric's  bid for Alstom's  energy business will force a shakeout in the electrical engineering industry, regardless of whether it or a rival suitor succeeds in breaking up the struggling French group. ~
GS,Chinese pork giant WH Group pulls IPO due to weak demand: sources HONG KONG China's WH Group Ltd, the world's biggest pork company, has postponed its planned Hong Kong initial public offering (IPO) due to weak demand for the deal even after it cut the offer size by two-thirds, sources said on Tuesday. ~
GT.O,UPDATE 2-Severe winter hits Goodyear Tire's profit * First-quarter revenue falls 8 pct to $4.47 billion vs est $4.80 bln ~Goodyear revenue misses analyst expectations, shares fall Goodyear Tire & Rubber Co  reported lower-than-expected quarterly revenue, hit by the extreme winter in North America and a labor dispute in Venezuela. ~Goodyear posts quarterly loss Goodyear Tire & Rubber Co  reported a quarterly loss compared with a profit a year earlier as it booked a one-time charge related to a drop in the value of the Venezuelan bolivar. ~Goodyear posts quarterly loss April 29 Goodyear Tire & Rubber Co  reported a quarterly loss compared with a profit a year earlier as it booked a one-time charge related to a drop in the value of the Venezuelan bolivar. ~
HCA,Hospital operator HCA earnings rise; maintains outlook April 29 HCA Holdings Inc, the largest U.S. hospital operator, said on Tuesday that first-quarter earnings rose from a year ago as it generated more revenue from patients even as it admitted fewer people to its facilities. ~
HPQ,CORRECTED-UPDATE 2-Apple supplier Cirrus to buy British chip maker Wolfson (Corrects to chip maker from handset maker in first paragraph) ~
LLY,UPDATE 1-Bayer offers animal health assets, cash for Merck's OTC unit -sources FRANKFURT/NEW YORK, April 29 Bayer AG  is offering to swap its animal health assets for Merck & Co Inc's consumer healthcare business, people familiar with the matter said on Tuesday, in a move that could give the German drugmaker a leg up in the $14 billion auction of the Merck business. ~
MRO,U.S. Steel returns to profit on higher prices, cost cuts April 29 United States Steel Corp returned to profit in the first quarter, results on Tuesday showed, helped by higher commercial prices for its products and the impact of the company's cost-cutting program. ~DIARY-U.S. MEETINGS/WEEK AHEAD THOMSON REUTERS, Apr 29,2014 - Corporate Meetings for US companies for Week ahead.         S&P; 500 Earnings - Weekly           S&P; 500 Earnings - Day Ahead        Non S&P; 500 - Weekly               Non S&P; 500 - Day Ahead             ConferenceCall/Webcast - Weekly    ConferenceCall/Webcast - Day        S&P; 500 Earnings - Monthly           Meetings - Day Ahead                Economic Indicators                  Dividends                           Daily earnings hits & misses         Federal Rese ~
MAR.O,UPDATE 1-Marriott profit beats as N America room rates, occupancy rise April 29 Marriott International posted a better-than-expected quarterly profit as increased business travel boosted occupancy and allowed the company to raise room rates in North America. ~Marriott profit jumps as North America room rates, occupancy rise Marriott International Inc , the operator of the Ritz-Carlton and Renaissance hotel chains, reported a 26 percent rise in quarterly profit, helped by higher room rates and occupancy in North America. ~Marriott profit jumps as North America room rates, occupancy rise April 29 Marriott International Inc, the operator of the Ritz-Carlton and Renaissance hotel chains, reported a 26 percent rise in quarterly profit, helped by higher room rates and occupancy in North America. ~
MRK,US STOCKS-Wall St ends up on earnings, rebound in high-growth shares * Indexes up: Dow 0.5 pct, S&P; 0.5 pct, Nasdaq 0.7 pct   (Updates with eBay down after the bell) ~Bayer offers animal health assets, cash for Merck's OTC unit -sources FRANKFURT/NEW YORK Bayer AG  is offering to swap its animal health assets for Merck & Co Inc's  consumer healthcare business, people familiar with the matter said on Tuesday, in a move that could give the German drugmaker a leg up in the $14 billion auction of the Merck business. ~UPDATE 1-Bayer offers animal health assets, cash for Merck's OTC unit -sources FRANKFURT/NEW YORK, April 29 Bayer AG  is offering to swap its animal health assets for Merck & Co Inc's consumer healthcare business, people familiar with the matter said on Tuesday, in a move that could give the German drugmaker a leg up in the $14 billion auction of the Merck business. ~US STOCKS-Wall St ends up on earnings, rebound in high-growth shares * Indexes up: Dow 0.5 pct, S&P; 0.5 pct, Nasdaq 0.7 pct   (Updates to close) ~Bayer offers animal health assets, cash for Merck's OTC unit -sources FRANKFURT/NEW YORK, April 29 Bayer AG  is offering to swap its animal health assets with Merck & Co Inc's consumer healthcare business, people familiar with the matter said on Tuesday, in a move that could give the German drugmaker a leg up in the $14 billion auction of the Merck business. ~Merck first-quarter profit tops estimate, but revenue misses Merck & Co Inc  reported better-than-expected quarterly earnings, helped by sharply lower research spending and asset sales, but revenue came in slightly below expectations. | Video  ~UPDATE 2-Merck 1st-quarter profit tops estimate, but revenue misses April 29 Merck & Co Inc reported better-than-expected quarterly earnings, helped by sharply lower research spending and asset sales, but revenue came in slightly below expectations. ~US STOCKS-Wall St gains with upbeat earnings, more deal activity * Indexes up: Dow 0.6 pct, S&P; 0.5 pct, Nasdaq 0.7 pct   (Updates to afternoon, changes byline) ~
MS,Rosneft says deal to buy trading from Morgan Stanley intact MOSCOW, April 29 Russia's top crude oil producer Rosneft said on Tuesday it aimed to complete deal to buy the majority of global physical oil trading operations from Morgan Stanley in the second half of 2014, as expected. ~U.S. banks to help regulators in tax evasion probe: WSJ The Swiss units of Goldman Sachs Group Inc  and Morgan Stanley  have agreed to hand over details to U.S. authorities about how they may have helped Americans to evade taxes, the Wall Street Journal reported. ~Ireland's eircom hires Goldman, Morgan Stanley for possible listing DUBLIN, April 29 Irish telecoms firm eircom has appointed Goldman Sachs and Morgan Stanley to advise it on a possible stock market listing two weeks after announcing it was considering a third flotation in 15 years. ~
MSI,EU exec says Motorola Mobility broke EU competition rules BRUSSELS, April 29 The European Commission, the European Union's competition watchdog, ruled on Tuesday that Motorola Mobility broke EU competition rules by seeking an injunction against Apple on the basis of a smartphone patent. ~
MYL.A,Exclusive: Allergan eyes new takeover bid for Shire - sources LONDON/NEW YORK Allergan Inc , facing an unsolicited bid from Valeant Pharmaceuticals International Inc , is preparing to approach Shire Plc  about a potential takeover, even though the Irish drugmaker rebuffed a previous overture, people familiar with the matter said on Monday. ~
NFLX.O,Netflix in deal to pay Verizon for faster access LOS ANGELES, April 28 Netflix Inc has reached a deal to pay Verizon Communications Inc for faster delivery of its TV shows and movies, the second arrangement to pay fees for quicker access that the company argues should be free. ~
ORCL.N,Tidemark wins $32 million funding to take on Oracle, SAP SAN FRANCISCO, April 29 Business-intelligence service Tidemark said it has raised another $32 million in funding to help it take on an area once dominated by companies like Oracle and SAP. ~
