LMT,UPDATE 1-Cost to buy F-35 up 2 pct; to operate down 9 pct -Pentagon (Adds details on cost per plane, quotes from general, byline) ~Pentagon sees cost to buy F-35 up 2 pct; operating cost down 9 pct WASHINGTON, April 17 The Pentagon on Thursday forecast the cost of developing and buying Lockheed Martin Corp's F-35 fighter jet at $398.6 billion, up 2 percent from last year, but said the projected cost to operate and maintain the jets was down about 9 percent. ~UPDATE 1-Canada to evaluate fighter-jet options over next several weeks (Adds comments from minister, lists Lockheed competitors, adds background from paragraph 4) ~Canada to take several more weeks to evaluate fighter-jet options OTTAWA, April 17 The Canadian government will take several more weeks to evaluate the options for the much-delayed replacement of its CF-18 fighter jets, Public Works Minister Diane Finley said on Thursday. ~
MAT.O,UPDATE 2-Mattel posts 1st quarterly loss in 5 years as Barbie sales fall * First-qtr net loss $0.03/share vs $0.11 profit year earlier ~Mattel posts quarterly loss as Barbie sales plummet Mattel Inc , the world's largest toymaker, reported a net loss for the first quarter due to a fall in sales of its iconic Barbie dolls and Fisher-Price toys for preschoolers. ~Mattel posts quarterly loss as Barbie sales plummet Mattel Inc , the world's largest toymaker, reported a net loss for the first quarter due to a fall in sales of its iconic Barbie dolls and Fisher-Price toys for preschoolers. ~Mattel posts loss as worldwide sales of Barbie fall April 17 Mattel Inc, the world's largest toymaker, reported a net loss for the first quarter due to a fall in worldwide sales of its Barbie dolls and Fisher-Price toys. ~
MRK,CORRECTED-Merck's ragweed pollen allergy drug gets U.S. approval (Corrects fourth paragraph to say Grastek, not Ragwitek, will compete with Stallergenes' drug) ~
MSFT.O,Microsoft's Xbox One sales cross 5 million SAN FRANCISCO Microsoft Corp has sold over 5 million Xbox One video game consoles to retailers since its launch in November, the company said on Thursday. ~Wall Street Week Ahead: Spring fever brings hope for U.S. earnings NEW YORK Earnings season shifts into high gear next week, and with nearly one-third of S&P; 500 names set to post results, investors hope the news provides a catalyst to buy stocks and leave the market's recent weakness in the dust. ~Chipmaker AMD's quarterly results beat Street, stock jumps SAN FRANCISCO Advanced Micro Devices Inc's first-quarter results beat expectations, sending its shares higher as the chipmaker tries to replace dwindling sales of PC chips with its processors for game consoles. ~UPDATE 2-Chipmaker AMD's quarterly results beat Street, stock jumps SAN FRANCISCO, April 17 Advanced Micro Devices Inc's first-quarter results beat expectations, sending its shares higher as the chipmaker tries to replace dwindling sales of PC chips with its processors for game consoles. ~
MNST.O,Monster Beverage in $16.25 mln 'channel-stuffing' settlement * Shareholders questioned Anheuser distribution arrangement ~
MS,WRAPUP 2-For Morgan Stanley, playing it safe pays off (Rewrites throughout on banks' diverging strategies; adds analyst and investor comments) ~Fitch: Morgan Stanley 1Q'14 Results Benefited from Improved Fixed Income and Commodities Revenues (The following statement was released by the rating agency) NEW YORK, April 17 (Fitch) Morgan Stanley reported strong first-quarter 2014  (1Q'14) operating results which benefited from improved fixed income and  commodities net revenues combined with lower non-compensation expenses. Morgan  Stanley continues to conservatively manage liquidity and funding and reported a  comparatively strong Basel III capital ratio. Morgan Stanley's core profitability improved significantly from the prior  quarte ~Fees fuel 13 percent profit rise at Morgan Stanley wealth unit NEW YORK Morgan Stanley's big bet on wealth management is looking strong as fees, commissions and interest collected by its more than 16,000 brokers fueled a 13 percent rise in the business's first-quarter net income from a year earlier to $423 million, the company said Thursday. ~UPDATE 1-Fees fuel 13 percent profit rise at Morgan Stanley wealth unit NEW YORK, April 17 Morgan Stanley's big bet on wealth management is looking strong as fees, commissions and interest collected by its more than 16,000 brokers fueled a 13 percent rise in the business's first-quarter net income from a year earlier to $423 million, the company said Thursday. ~Amid frigid winter, Goldman, Morgan Stanley see commodity gains LONDON/NEW YORK Goldman Sachs  and Morgan Stanley  both cited stronger commodities trading as a bright spot in the first quarter, aided in part by extraordinary volatility caused by the coldest U.S. winter in three decades. ~UPDATE 2-Amid frigid winter, Goldman, Morgan Stanley see commodity gains * Morgan Stanley says "strong performance" bolstered FICC ~Morgan Stanley Wealth profit seen as proxy for capital return NEW YORK, April 17 Morgan Stanley's big bet on wealth management is looking strong as fees, commissions and interest collected by its more than 16,000 brokers fueled a 13 percent rise in the business's first-quarter net income from a year earlier to $423 million, the company said Thursday. ~WRAPUP 1-For Goldman Sachs and Morgan Stanley, boring is beautiful April 17 Investment banks Morgan Stanley  and Goldman Sachs Group Inc posted better-than-expected quarterly earnings on Thursday, helped by gains in merger advisory and stock underwriting. ~INVESTMENT FOCUS-Pickings for the brave in emerging markets LONDON, April 17 The brave few who waded back into emerging markets in March reaped substantial rewards, but investors say it is too soon to tell whether the recent bounce will become a sustained rally. ~
NOC,UPDATE 1-Two U.S. arms programs face live-or-die reviews after costs jump WASHINGTON, April 17 An unmanned U.S. Navy helicopter built by Northrop Grumman Corp and a precision ship-landing system built by Raytheon Co face mandatory reviews that could lead to their cancellation after quantity reductions drove unit costs sharply higher in 2013, the Pentagon announced on Thursday. ~Two U.S. arms programs face live-or-die reviews after costs jump WASHINGTON, April 17 An unmanned U.S. Navy helicopter built by Northrop Grumman Corp and a precision ship-landing system built by Raytheon Co face mandatory reviews that could lead to their cancellation after quantity reductions drove unit costs sharply higher in 2013, the Pentagon announced on Thursday. ~Northrop CEO urges Congress to pass cybersecurity legislation WASHINGTON, April 17 U.S. weapons maker Northrop Grumman Corp on Thursday urged U.S. lawmakers to enact cybersecurity legislation that would limit the liability of U.S. companies and enable them to take more decisive action to protect their computer networks. ~
OMC,UPDATE 2-China, Europe recovery boosts Publicis Q1 sales * Omnicom merger set to close in Q3, awaits China approval ~Publicis says China, Europe recovery lifts Q1 sales PARIS, April 17 Advertising agency Publicis , which is merging with larger rival Omnicom, achieved 3.3 percent revenue growth on a comparable basis in the first quarter, helped by strong digital sales and an uptick in China and Europe. ~
PEP,UPDATE 2-Snack sales help PepsiCo beat profit estimates; soda steadies April 17 PepsiCo Inc beat profit expectations on Thursday as a booming snacks unit added pep to sales and its struggling North American soda business did better than expected, sending shares up more than 2 percent in premarket trading. ~PepsiCo profit rises as snacks sales rise April 17 PepsiCo Inc on Thursday reported a higher quarterly profit, lifted by sales gains in its snacks business. ~
PFE,Teva, Pfizer settle patent lawsuit over blockbuster painkiller Teva Pharmaceutical Industries Ltd said it settled a patent lawsuit with Pfizer Inc, allowing the Israeli drugmaker to launch a generic version of Pfizer's blockbuster painkiller Celebrex in December. ~Teva, Pfizer settle patent lawsuit over painkiller Celebrex April 17 Teva Pharmaceutical Industries Ltd   said it settled a patent litigation with Pfizer Inc, allowing the Israeli drugmaker to launch a generic version of Pfizer's blockbuster pain medication, Celebrex, in December. ~
RTN,UPDATE 1-Two U.S. arms programs face live-or-die reviews after costs jump WASHINGTON, April 17 An unmanned U.S. Navy helicopter built by Northrop Grumman Corp and a precision ship-landing system built by Raytheon Co face mandatory reviews that could lead to their cancellation after quantity reductions drove unit costs sharply higher in 2013, the Pentagon announced on Thursday. ~Two U.S. arms programs face live-or-die reviews after costs jump WASHINGTON, April 17 An unmanned U.S. Navy helicopter built by Northrop Grumman Corp and a precision ship-landing system built by Raytheon Co face mandatory reviews that could lead to their cancellation after quantity reductions drove unit costs sharply higher in 2013, the Pentagon announced on Thursday. ~
COL,Rockwell Collins looks to join global aircraft tracking task force April 17 Rockwell Collins Inc, maker of a key communications system for jets, is interested in joining a task force on improving global airline tracking to prevent further disappearances of planes like Malaysia Airlines Flight 370, its chief executive said on Thursday. ~UPDATE 2-Rockwell Collins profit falls, but acquisition aids sales * Shares up 1 pct   (Adds company, analyst comments, details on acquisition, share price) ~Rockwell Collins posts lower quarterly profit Rockwell Collins Inc , a maker of avionics and other electronics systems for aircraft, reported a lower quarterly profit on Thursday as its income tax expense rose. ~CORRECTED-UPDATE 1-Rockwell Collins posts lower quarterly profit (Corrects Reuters per-share estimate for full year, in final sentence, to $4.45 from $4.55) ~Rockwell Collins posts lower quarterly profit April 17 Rockwell Collins Inc, a maker of avionics and other electronics systems for aircraft, reported a lower quarterly profit on Thursday as its income tax expense rose. ~
SLB,Schlumberger, Baker Hughes results point to improving North America Oilfield services companies Schlumberger Ltd  and Baker Hughes Inc  reported better-than-expected quarterly profits and signaled an improvement in the North American market, driven by increased drilling in the Gulf of Mexico. ~UPDATE 1-Baker Hughes results beat estimates as N.American revenue jumps April 17 Baker Hughes Inc, the world's third-largest oilfield services company, posted better-than-expected results as revenue in its core North American business rose nearly 7 percent, sending its shares up about 4 percent in premarket trading. ~Schlumberger profit from cont ops jumps 33 pct April 17 Schlumberger Ltd, the world's largest oilfield services company, reported nearly 33 percent rise in quarterly profit from continued operations. ~
TROW.O,Apache CEO, Vermont activist build alliance on climate issues NEW YORK, April 17 Steve Farris runs a $33 billion Texas oil and gas company and turns, for advice, to a bearded Vermont environmentalist. ~
DIS,UPDATE 1-Disney sees operating income growth at cable networks LOS ANGELES, April 17 Walt Disney Co's  cable networks are expected to record  high single-digit growth in operating income and domestic affiliate revenue from fiscal 2014 through 2016, Chief Financial Officer Jay Rasulo told investors on Thursday. ~Disney CFO projects operating income growth at cable networks LOS ANGELES, April 17 Walt Disney Co's  cable networks are expected to record  high single-digit growth in operating income and domestic affiliate revenue from fiscal 2014 through 2016, Chief Financial Officer Jay Rasulo told investors on Thursday. ~
TSN,Post Holdings to buy Michael Foods for $2.45 billion Cereal maker Post Holdings Inc  said it will buy eggs and dairy producer and distributor Michael Foods Inc  for $2.45 billion in its largest-ever deal. ~Market Chatter- Corporate finance press digest April 17 The following corporate finance-related stories were reported by media: ~
UNP,Agricultural product shipments boost Union Pacific profit Union Pacific Corp , the largest publicly traded U.S. railroad, reported a 14 percent rise in quarterly profit as it increased prices and shipped more agricultural products. ~Agricultural product shipments boost Union Pacific profit April 17 Union Pacific Corp, the largest publicly traded U.S. railroad, reported a 14 percent rise in quarterly profit, partly due to a rise in shipments at its agricultural products business. ~
UNH,UPDATE 4-UnitedHealth: New hepatitis C drug costs far more than forecast April 17 UnitedHealth Group Inc, the largest U.S. health insurer, said it spent more than $100 million to cover a pricey new hepatitis C drug from Gilead Sciences Inc in its first three months on the market, an amount that was "multiple" times what it had expected. ~US STOCKS-Wall St edges higher during earnings flurry * Jobless claims rise less than expected; Philly Fed jumps ~BRIEF-UnitedHealth sees government funding cuts to private Medicare at 3 percent to 3.5 percent April 17 UnitedHealth Group Inc :  * Says government funding cuts to private medicare are 3 percent to 3.5 percent ~BRIEF-UnitedHealth CEO sees 2014 costs from healthcare reform, but long-term growth April 17 UnitedHealth Group Inc :  * CEO Stephen Hemsley says healthcare reform law holds long-term growth opportunities  * CEO says commercial insurance pricing pressure intensified in some markets, ~UnitedHealth says first-quarter profit fell due to higher costs April 17 UnitedHealth Group Inc, the largest U.S. health insurer, said on Thursday that first-quarter profit fell due to costs and taxes related to the national healthcare reform law as well as government cuts to Medicare funding. ~
VZ,UPDATE 1-Potential Sprint/T-Mobile deal may prompt U.S. auction rethink * Proposed deal would merge Nos. 3-4 U.S. wireless carriers ~Sprint/T-Mobile merger may prompt U.S. FCC to rewrite auction rules * Planned 2015 spectrum auction rules could put restrictions on largest carriers ~UPDATE 1-U.S. regulator reasserts goal to restrict AT&T;, Verizon in auction (Adds further details of Wheeler's letter, proposed rules and AT&T; opposition) ~U.S. regulator reasserts goal to restrict AT&T;, Verizon in auction WASHINGTON, April 17 The top U.S. telecommunications regulator in a letter to a lawmaker on Thursday reasserted his commitment to help smaller national wireless carriers get access to valuable lower-frequency airwaves in the upcoming spectrum auction. ~
V,BRIEF-Visa calls for redemption all of its 1.200 pct notes due 2017 * Visa Inc - on Sept 11, co called for redemption all of $1.75 billion principal amount outstanding of its 1.200 pct notes due 2017‍​ - SEC filing ~BRIEF-Visa Inc files for three-part senior notes offering of up to $2.5 bln * Visa Inc says files for three-part senior notes offering of up to $2.5 billion - SEC filing‍​ ~Former BoE deputy Hogg to join Visa as Europe unit CEO Visa Inc, the world's largest payments processor, on Thursday named former Bank of England (BoE) deputy governor Charlotte Hogg as chief executive of its Europe division. ~CORRECTED-UPDATE 1-MOVES-Former BoE deputy Hogg to join Visa as Europe unit CEO Sept 7 Visa Inc, the world's largest payments processor, on Thursday named former Bank of England (BoE) deputy governor Charlotte Hogg as chief executive of its Europe division. ~MOVES-Visa names ex-BoE deputy Charlotte Hogg as Europe unit CEO Sept 7 Visa Inc, the world's largest payments processor, on Thursday named Charlotte Hogg as chief executive of its Europe division. ~BRIEF-Visa appoints Charlotte Hogg as CEO of European operations * Visa Inc appoints Charlotte Hogg as chief executive officer of the compan's European operations ~BRIEF-Visa Inc files prospectus supplement for potential three-part senior notes offering * Visa Inc files prospectus supplement for potential three-part senior notes offering; size not disclosed - sec filing‍​ Source text (http://bit.ly/2vLDrIe) Further company coverage: ~BRIEF-Visa enables on the go payments with the new Fitbit Ionic * Visa inc- ‍enabling visa payments on fitbit's smartwatch fitbit ionic​ ~BRIEF-Bridg raises $11 million in Series B funding * Bridg raises $11 million in Series B funding from Morpheus Ventures, March Capital, Visa and NextEquity ~
WMT,Wal-Mart to launch new money transfer service April 17 Wal-Mart Stores Inc said on Thursday it was launching a new domestic money transfer service called "Walmart-2-Walmart" in partnership with Euronet Worldwide Inc subsidiary Ria Money Transfer, competing directly with Western Union Co. ~
XLNX.O,Patent fund handed damaging ruling in lawsuit against investor SAN FRANCISCO, April 17 Patent owner Intellectual Ventures cannot present key damages evidence in a lawsuit against chipmaker Xilinx, a U.S. judge has ruled, which could force an end to the bitter case between IV and one of its investors shortly before trial. ~
