AMZN.O,China's Tencent hits $200 bln market cap for first time BEIJING, April 13 China's Tencent Holdings Ltd  for the first time hit a market cap of more than $200 billion on Monday, making it more valuable than U.S. tech firms like Amazon.com Inc, IBM Corp and Oracle Corp . ~
AAPL.O,IBM launches new health unit, teams up with Apple, J&J;, Medtronic SEATTLE International Business Machines Corp, deepening its partnership with Apple Inc to make use of health information gathered by millions of Apple devices, is creating a unit dedicated to providing data analytics to the healthcare sector. ~IBM launches new health unit, teams up with Apple, J&J;, Medtronic SEATTLE, April 13 International Business Machines Corp, deepening its partnership with Apple Inc  to make use of health information gathered by millions of Apple devices, is creating  a unit dedicated to providing data analytics to the healthcare sector. ~Apple expected to quickly ramp up smartwatch production Apple Inc  is likely to quickly ramp up production of the Apple Watch after strong pre-orders outstripped limited supply, analysts said on Monday. | Video  ~UPDATE 1-Apple expected to quickly ramp up smartwatch production April 13 Apple Inc is likely to quickly ramp up production of the Apple Watch after strong pre-orders outstripped limited supply, analysts said on Monday. ~US STOCKS-Wall St flat with earnings eyed; Apple, Qualcomm lift Nasdaq * Indexes up: Dow 0.17 pct, S&P; 0.15 pct, Nasdaq 0.45 pct   (Updates to open) ~Apple likely to boost watch production quickly - analysts April 13 Apple Inc is likely to quickly ramp production of the Apple Watch after strong pre-orders outstripped limited supply in the first weekend following its launch, some Wall Street analysts said. ~
C,Citigroup names Asia Pacific chief Bird to head global consumer bank NEW YORK, April 13 Citigroup Inc named Stephen Bird, its chief executive for Asia Pacific to be the new head of its global consumer bank, according to a memo from CEO Mike Corbat to employees on Monday. ~Exclusive: ConocoPhillips to launch U.S. asset sales - sources ConocoPhillips  is preparing the sale of noncore oil and gas producing acreage in the United States, in the latest sign that oil majors are becoming more accepting of lower oil prices, according to people familiar with the matter. ~UK's FTSE slips off record highs as mining stocks weaken LONDON, April 13 Britain's top equity index slipped from record highs on Monday, as a pullback in mining stocks due to weak data from big metals consumer China weighed on the market. ~
COP,Exclusive: ConocoPhillips to launch U.S. asset sales - sources ConocoPhillips  is preparing the sale of noncore oil and gas producing acreage in the United States, in the latest sign that oil majors are becoming more accepting of lower oil prices, according to people familiar with the matter. ~
DOW,BRIEF-Downer EDI says offer for Spotless Group now closed * Confirms that its offer for Spotless was not extended and has now closed. Source text for Eikon: Further company coverage: ~BRIEF-Downer EDI posts FY net profit of $181.5 million * FY total revenue and other income from ordinary activities $7.29 billion , up 6.4 percent ~BRIEF-Downer EDI says ‍offer for Spotless Group extended to 28 August 2017​ * ‍Offer for Spotless Group extended to 7pm on Monday, 28 august 2017​ Source text for Eikon: Further company coverage: ~BRIEF-Downer EDI says Spotless ‍offer extended to Aug 21, 2017​ * Spotless ‍offer extended to 7pm on monday, 21 august 2017​ Source text for Eikon: Further company coverage: ~BRIEF-Downer EDI's takeover offer for Spotless Group extended till 7pm (Sydney time) on Aug. 14 * Unconditional takeover offer for Spotless Group extended until 7:00pm (Sydney time) on Monday, 14 August Source text for Eikon: Further company coverage: (bangalore.newsroom@thomsonreuters.com) ~BRIEF-Downer extends takeover offer for Spotless Group * decided to extend Spotless offer period for one week; offer will now remain open for acceptance until 14 august Source text for Eikon: Further company coverage: ~BRIEF-Downer extends Spotless offer to August 7 2017 * ‍Downer has decided to extend offer for Spotless Group holdings to 7 pm on Monday, 7 august 2017​ Source text for Eikon: Further company coverage: ~BRIEF-Downer EDI's stake in Spotless increases to 80.3 pct * Downer's stake in Spotless increases to 80.3 pct Source text for Eikon: Further company coverage: ~BRIEF- Downer EDI Ltd'S stake in Spotless Group increases to 72% * As Downer's shareholding in Spotless is now over 70%, Downer expects that Spotless will be removed from certain S&P;/ASX market indices ~
GPS,New York questions big retailers over 'on-call' staffing New York's attorney general has sent letters to 13 national retailers, including Gap Inc, Target Corp and JC Penney Co Inc, about "on-call shifts" in which workers are told whether to report to work a day or less before a scheduled shift. ~
GE,Deals of the day- Mergers and acquisitions April 13 The following bids, mergers, acquisitions and disposals were reported by 2000 GMT on Monday: ~US STOCKS-Dow, S&P; 500 edge lower as earnings worries deepen * Netflix to raise share authorization in step to split stock ~Abu Dhabi's Mubadala GE Capital says no plans to change shareholdings ABU DHABI, April 13 Mubadala GE Capital, a venture between Abu Dhabi state fund Mubadala and GE Capital, said its ownership and strategy would remain unchanged despite General Electric's decision to divest most of its finance unit. ~
GM,GM mulls $1 billion renovation of technical center near Detroit: Bloomberg NEW YORK General Motors Co  is considering plans to spend as much as $1 billion renovating its Technical Center, a facility that is more than 50 years old, Bloomberg reported. ~GM mulls $1 bln renovation of technical center near Detroit -Bloomberg NEW YORK, April 12 General Motors Co is considering plans to spend as much as $1 billion renovating its Technical Center, a facility that is more than 50 years old, Bloomberg reported. ~
GS,D.E. Shaw in talks to buy Italian NPL business from GS: sources MILAN U.S. investment firm D.E. Shaw has started exclusive talks to buy the Italian non-performing loan business of Archon, a real estate unit of investment bank Goldman Sachs , two sources close to the matter said. ~
INTC.O,Shareholders nudge Altera to reopen talks with Intel - Bloomberg April 13 Several shareholders of chipmaker Altera Corp, including Cadian Capital Management and TIG Advisors, have urged the company to resume takeover talks with Intel Corp, Bloomberg reported, citing people familiar with the matter. ~
IBM,IBM launches new health unit, teams up with Apple, J&J;, Medtronic SEATTLE, April 13 International Business Machines Corp, deepening its partnership with Apple Inc  to make use of health information gathered by millions of Apple devices, is creating  a unit dedicated to providing data analytics to the healthcare sector. ~China's Tencent hits $200 billion market cap for first time BEIJING China's Tencent Holdings Ltd for the first time hit a market cap of more than $200 billion on Monday, making it more valuable than U.S. tech firms like Amazon.com Inc, IBM Corp and Oracle Corp. ~China's Tencent hits $200 bln market cap for first time BEIJING, April 13 China's Tencent Holdings Ltd  for the first time hit a market cap of more than $200 billion on Monday, making it more valuable than U.S. tech firms like Amazon.com Inc, IBM Corp and Oracle Corp . ~
JNJ,IBM launches new health unit, teams up with Apple, J&J;, Medtronic SEATTLE, April 13 International Business Machines Corp, deepening its partnership with Apple Inc  to make use of health information gathered by millions of Apple devices, is creating  a unit dedicated to providing data analytics to the healthcare sector. ~
MCD,UPDATE 1-Yum's upmarket China diner seeks recipe for revival SHANGHAI, April 11 Dimmed lights and colonial-style balconies give little indication that trendy Shanghai eatery Atto Primo is part of global fast-food giant Yum Brands Inc, owner of the KFC and Pizza Hut brands. ~
MDT,IBM launches new health unit, teams up with Apple, J&J;, Medtronic SEATTLE, April 13 International Business Machines Corp, deepening its partnership with Apple Inc  to make use of health information gathered by millions of Apple devices, is creating  a unit dedicated to providing data analytics to the healthcare sector. ~
MS,Morgan Stanley says dollar parity beckons for euro by Q4 LONDON, April 13 The U.S. bank Morgan Stanley has forecast that the euro will sink below parity with the dollar before the end of this year, and election fever will drive down the pound to $1.39 by June. ~
MYL.A,Mylan settles Viagra patent litigation with Pfizer Drugmaker Mylan N.V said it settled a patent litigation with Pfizer Inc related to Viagra, paving the way for the launch of the drug's generic version in the United States once approved. ~UPDATE 1-Mylan settles Viagra patent litigation with Pfizer April 13 Drugmaker Mylan N.V said it settled a patent litigation with Pfizer Inc related to Viagra, paving the way for the launch of the drug's generic version in the United States once approved. ~
NFLX.O,US STOCKS-Wall St ends down as earnings worries deepen * Indexes down: Dow 0.5 pct, S&P; 0.5 pct, Nasdaq 0.2 pct   (Updates to close) ~US STOCKS-Dow, S&P; 500 edge lower as earnings worries deepen * Netflix to raise share authorization in step to split stock ~US STOCKS-Nasdaq near all-time high on lift from tech * Netflix to raise share authorization in step to split stock ~
ORCL.N,China's Tencent hits $200 bln market cap for first time BEIJING, April 13 China's Tencent Holdings Ltd  for the first time hit a market cap of more than $200 billion on Monday, making it more valuable than U.S. tech firms like Amazon.com Inc, IBM Corp and Oracle Corp . ~
PEP,UPDATE 2-Pepsi takes over NBA sponsorship rights from Coke * Terms of the deal were not disclosed   (Changes sourcing, adds details) ~
PFE,Mylan settles Viagra patent litigation with Pfizer Drugmaker Mylan N.V said it settled a patent litigation with Pfizer Inc related to Viagra, paving the way for the launch of the drug's generic version in the United States once approved. ~UPDATE 1-Mylan settles Viagra patent litigation with Pfizer April 13 Drugmaker Mylan N.V said it settled a patent litigation with Pfizer Inc related to Viagra, paving the way for the launch of the drug's generic version in the United States once approved. ~
QCOM.O,Deals of the day- Mergers and acquisitions April 13 The following bids, mergers, acquisitions and disposals were reported by 2000 GMT on Monday: ~Jana Partners pressing Qualcomm to spin off chip business Hedge fund Jana Partners said on Monday that Qualcomm Inc's chip business was "essentially worthless" at current valuations and pressed the company to spin it off from its patent-licensing business to "restore investor confidence." | Video  ~UPDATE 4-Jana Partners pressing Qualcomm to spin off chip business * Jana says chip unit "essentially worthless" at current valuation ~US STOCKS-Nasdaq near all-time high on lift from tech * Netflix to raise share authorization in step to split stock ~US STOCKS-Wall St flat with earnings eyed; Apple, Qualcomm lift Nasdaq * Indexes up: Dow 0.17 pct, S&P; 0.15 pct, Nasdaq 0.45 pct   (Updates to open) ~Investor Jana's Rosenstein wants to 'pull levers' to boost Qualcomm NEW YORK Activist hedge fund manager Barry Rosenstein said on Monday he wants the share price of chip maker Qualcomm  to climb and his hedge fund, Jana Partners, plans to work collaboratively with management to find ways to boost it. ~Investor Jana's Rosenstein wants to 'pull levers' to boost Qualcomm NEW YORK, April 13 Activist hedge fund manager Barry Rosenstein said on Monday he wants the share price of chip maker Qualcomm to climb and his hedge fund, Jana Partners, plans to work collaboratively with management to find ways to boost it. ~REFILE-US STOCKS-Wall St to dip at open after three-day run; earnings eyed April 13 U.S. stocks were set for a slightly lower open after three straight days of gains, as the corporate earnings season was poised to kick into high gear with a slew of reports this week. ~BRIEF-Jana Partners urges Qualcomm to consider spinning off its chip unit * Jana Partners urges Qualcomm to consider spinning off its chip unit from its patent-licensing business - letter to investors ~
COL,Firms propose service-based helicopter training for U.S. military COLORADO SPRINGS, Col., April 13 AgustaWestland, the helicopter unit of Italy's Finmeccanica SpA, Bristow Group, Doss Aviation and Rockwell Collins Inc  on Monday proposed a new service-based system for training U.S. military pilots using AgustaWestland's AW119 single-engine helicopter. ~
SPG,Value in new Sears JV with Simon is redevelopment of mall space NEW YORK, April 13 With Sears Holdings Corp  's second joint venture announcement this month on Monday, one question left to be answered is how much of the struggling mall anchor's property will be devoted to new, and potentially lucrative, retail space. ~
TGT,New York questions big retailers over 'on-call' staffing New York's attorney general has sent letters to 13 national retailers, including Gap Inc, Target Corp and JC Penney Co Inc, about "on-call shifts" in which workers are told whether to report to work a day or less before a scheduled shift. ~
KO,UPDATE 2-Pepsi takes over NBA sponsorship rights from Coke * Terms of the deal were not disclosed   (Changes sourcing, adds details) ~
DIS,Driving instructor killed in Disney World "exotic" car experience ORLANDO, Fla., April 13 The passenger killed in a crash at a Walt Disney World Speedway race-car attraction has been identified as an instructor who was riding in a Lamborghini that hit a guardrail after the driver lost control, according to the Florida Highway Patrol. ~
USB,MOVES-Mark Benskin named managing director of U.S. Bancorp division April 13 The Private Client Reserve, a division of U.S. Bancorp's Wealth Management unit, has appointed Mark Benskin managing director. ~
V,BRIEF-Visa calls for redemption all of its 1.200 pct notes due 2017 * Visa Inc - on Sept 11, co called for redemption all of $1.75 billion principal amount outstanding of its 1.200 pct notes due 2017‍​ - SEC filing ~BRIEF-Visa Inc files for three-part senior notes offering of up to $2.5 bln * Visa Inc says files for three-part senior notes offering of up to $2.5 billion - SEC filing‍​ ~Former BoE deputy Hogg to join Visa as Europe unit CEO Visa Inc, the world's largest payments processor, on Thursday named former Bank of England (BoE) deputy governor Charlotte Hogg as chief executive of its Europe division. ~CORRECTED-UPDATE 1-MOVES-Former BoE deputy Hogg to join Visa as Europe unit CEO Sept 7 Visa Inc, the world's largest payments processor, on Thursday named former Bank of England (BoE) deputy governor Charlotte Hogg as chief executive of its Europe division. ~MOVES-Visa names ex-BoE deputy Charlotte Hogg as Europe unit CEO Sept 7 Visa Inc, the world's largest payments processor, on Thursday named Charlotte Hogg as chief executive of its Europe division. ~BRIEF-Visa appoints Charlotte Hogg as CEO of European operations * Visa Inc appoints Charlotte Hogg as chief executive officer of the compan's European operations ~BRIEF-Visa Inc files prospectus supplement for potential three-part senior notes offering * Visa Inc files prospectus supplement for potential three-part senior notes offering; size not disclosed - sec filing‍​ Source text (http://bit.ly/2vLDrIe) Further company coverage: ~BRIEF-Visa enables on the go payments with the new Fitbit Ionic * Visa inc- ‍enabling visa payments on fitbit's smartwatch fitbit ionic​ ~BRIEF-Bridg raises $11 million in Series B funding * Bridg raises $11 million in Series B funding from Morpheus Ventures, March Capital, Visa and NextEquity ~
YUM,UPDATE 1-Yum's upmarket China diner seeks recipe for revival SHANGHAI, April 11 Dimmed lights and colonial-style balconies give little indication that trendy Shanghai eatery Atto Primo is part of global fast-food giant Yum Brands Inc, owner of the KFC and Pizza Hut brands. ~
ZTS,Zoetis adds 2nd director to board under deal with Pershing Square April 13 Animal health products company Zoetis Inc appointed a second director to its board under its agreement with Bill Ackman's hedge fund Pershing Square Capital Management. ~
