AMZN.O,Amazon gets green light from U.S. regulators for new drone tests Amazon.com Inc has won approval from U.S. federal regulators to test a delivery drone outdoors, less than a month after the e-commerce powerhouse blasted regulators for being slow to approve commercial drone testing. ~Amazon gets green light from U.S. regulators for new drone tests Amazon.com Inc  has won approval from U.S. federal regulators to test a delivery drone outdoors, less than a month after the e-commerce powerhouse blasted regulators for being slow to approve commercial drone testing. ~Amazon gets green light from U.S. regulators for new drone tests April 9 Amazon.com Inc has won approval from U.S. federal regulators to test a delivery drone outdoors, less than a month after the e-commerce powerhouse blasted regulators for being slow to approve commercial drone testing. ~Amazon sues to block alleged fake reviews on its website Amazon.com Inc has sued four websites to stop them from selling fake, positive product reviews. ~Amazon sues to block alleged fake reviews on its website Amazon.com Inc has sued four websites to stop them from selling fake, positive product reviews. ~
AAPL.O,UPDATE 8-Backlogged orders as shoppers get close-up look at Apple Watch * Customers can test watches, order online   (Adds comment from analyst, details from store in San Francisco, closing stock price) ~UK's IG Group launches trading app for Apple Watch Britain's IG Group Holdings Plc said on Friday that it would launch one of the first online trading apps for Apple Inc's smartwatch, in keeping with the trading platform's push to bolster its technology division. ~RBC CEO says tech firms pose threat, eyes start-up partnerships TORONTO Technology companies pose a competitive threat to established lenders, the head of Royal Bank of Canada said on Friday, adding he was keen to work with start-ups to improve the company's mobile offerings. ~US STOCKS-Wall St gains, buoyed by GE divestment plan * Indexes up: Dow 0.21 pct, S&P; 0.22 pct, Nasdaq 0.1 pct   (Updates to open) ~REFILE-US STOCKS-Wall St set to climb at open, buoyed by GE divestment plan April 10 U.S. stocks were poised to edge up at the open on Friday as investors lauded GE's decision to divest the bulk of its high-risk GE Capital business. ~UK's IG Group launches trading app for Apple Watch April 10 Britain's IG Group Holdings Plc  said on Friday that it would launch one of the first online trading apps for Apple Inc's smartwatch, in keeping with the trading platform's push to bolster its technology division. ~In China, knock-off Apple Watches have their own fans SHENZHEN/HONG KONG Lining the glass display cases of Shenzhen's giant tech malls, knock-off versions of Apple Inc's smartwatch were on sale at many stalls, with some Chinese consumers eager to snap them up for a fraction of the cost of the original. ~In China, knock-off Apple Watches have their own fans SHENZHEN/HONG KONG, April 10 Lining the glass display cases of Shenzhen's giant tech malls, knock-off versions of Apple Inc's smartwatch were on sale at many stalls, with some Chinese consumers eager to snap them up for a fraction of the cost of the original. ~
STZ,CORRECTED-UPDATE 1-Constellation Brands' full-year profit forecast in line with estimates (April 9) April 9 Alcoholic beverage maker Constellation Brands Inc forecast a profit for the fiscal year ending February that was largely in line with analysts' estimates and said it would spend more than $1 billion this year to expand its beer business. ~
DOW,BRIEF-Downer EDI says offer for Spotless Group now closed * Confirms that its offer for Spotless was not extended and has now closed. Source text for Eikon: Further company coverage: ~BRIEF-Downer EDI posts FY net profit of $181.5 million * FY total revenue and other income from ordinary activities $7.29 billion , up 6.4 percent ~BRIEF-Downer EDI says ‍offer for Spotless Group extended to 28 August 2017​ * ‍Offer for Spotless Group extended to 7pm on Monday, 28 august 2017​ Source text for Eikon: Further company coverage: ~BRIEF-Downer EDI says Spotless ‍offer extended to Aug 21, 2017​ * Spotless ‍offer extended to 7pm on monday, 21 august 2017​ Source text for Eikon: Further company coverage: ~BRIEF-Downer EDI's takeover offer for Spotless Group extended till 7pm (Sydney time) on Aug. 14 * Unconditional takeover offer for Spotless Group extended until 7:00pm (Sydney time) on Monday, 14 August Source text for Eikon: Further company coverage: (bangalore.newsroom@thomsonreuters.com) ~BRIEF-Downer extends takeover offer for Spotless Group * decided to extend Spotless offer period for one week; offer will now remain open for acceptance until 14 august Source text for Eikon: Further company coverage: ~BRIEF-Downer extends Spotless offer to August 7 2017 * ‍Downer has decided to extend offer for Spotless Group holdings to 7 pm on Monday, 7 august 2017​ Source text for Eikon: Further company coverage: ~BRIEF-Downer EDI's stake in Spotless increases to 80.3 pct * Downer's stake in Spotless increases to 80.3 pct Source text for Eikon: Further company coverage: ~BRIEF- Downer EDI Ltd'S stake in Spotless Group increases to 72% * As Downer's shareholding in Spotless is now over 70%, Downer expects that Spotless will be removed from certain S&P;/ASX market indices ~
F,Deals of the day- Mergers and acquisitions April 10 The following bids, mergers, acquisitions and disposals were reported by 2000 GMT on Friday: ~Ford takes control of Russia joint venture MOSCOW U.S. auto maker Ford Motor Co  said on Friday it had taken control of its Russian venture with Russian car company Sollers  and would provide it with additional financial support. ~UPDATE 1-Ford takes control of Russia joint venture MOSCOW, April 10 U.S. auto maker Ford Motor Co  said on Friday it had taken control of its Russian venture with Russian car company Sollers and would provide it with additional financial support. ~REFILE-Ford to gain control of Russia JV and provide finance MOSCOW, April 10 U.S. auto maker Ford Motor Co  will take control of its Russian venture with Sollers  and provide it with additional financial support, the Russian firm said on Friday. ~
GE,Blackstone swooped on regulation-weary GE to do mega real estate deal April 10 It took Blackstone Group LP less than four weeks after an approach from General Electric Co  to clinch the biggest real estate deal since the financial crisis. Yet the seeds of that deal were planted seven years ago, during the crisis. ~GE to sell bulk of finance unit, return up to $90 billion to investors General Electric Co will shed most of its finance unit and return as much as $90 billion to shareholders as it becomes a “simpler” industrial business instead of an unwieldy hybrid of banking and manufacturing. | Video  ~GE's CEO and his stock win a boost after a long dry spell General Electric Co Chief Executive Jeff Immelt has had a bumpy ride for the past seven years, navigating economic turbulence, swapping in and out of businesses and struggling to energize his sluggish stock. ~GE's CEO and his stock win a boost after a long dry spell April 10 General Electric Co Chief Executive Jeff Immelt has had a bumpy ride for the past seven years, navigating economic turbulence, swapping in and out of businesses and struggling to energize his sluggish stock. ~US STOCKS-GE sparks broad Wall St rally; indexes post weekly gains * GE set for $50 bln buyback plan; shares most active on NYSE ~Deals of the day- Mergers and acquisitions April 10 The following bids, mergers, acquisitions and disposals were reported by 2000 GMT on Friday: ~GE plan further shrinks its money market presence NEW YORK General Electric Co.'s plan to retrench from the finance business will further reduce its already diminishing presence in the U.S. money market, which it has leaned on to fund consumer and business loans. ~GE plan further shrinks its money market presence NEW YORK, April 10 General Electric Co.'s  plan to retrench from the finance business will further reduce its already diminishing presence in the U.S. money market, which it has leaned on to fund consumer and business loans. ~UPDATE 5-GE to sell bulk of finance unit, return up to $90 billion to investors April 10 General Electric Co will shed most of its finance unit and return as much as $90 billion to shareholders as it becomes a "simpler" industrial business instead of an unwieldy hybrid of banking and manufacturing. ~
GS,Goldman, investors file lawsuit in $835 mln BES loan fight LONDON, April 10 Goldman Sachs and investors including hedge fund Elliott Management have joined a legal battle over an $835 million loan made to Banco Espirito Santo weeks before it collapsed last year. ~UPDATE 1-Goldman paid CEO Blankfein $24 mln in 2014 April 10 Goldman Sachs Group Inc awarded Chief Executive Lloyd Blankfein $24 million in compensation for 2014, a 4.3 percent increase from a year earlier. ~Goldman paid CEO Blankfein $24 mln in 2014 April 10 Goldman Sachs Group Inc awarded Chief Executive Lloyd Blankfein $24 million in compensation for 2014, a 4.3 percent increase from a year earlier. ~Goldman widens gap in deal rankings, notching up $119 billion in one week LONDON U.S. investment bank Goldman Sachs has opened up a $100 billion lead in this year’s worldwide M&A; league table after grabbing advisory roles on the top four deals in this week's bumper week for takeovers. ~Goldman widens gap in deal rankings, notching up $119 bln in one week LONDON, April 10 U.S. investment bank Goldman Sachs has opened up a $100 billion lead in this year's worldwide M&A; league table after grabbing advisory roles on the top four deals in this week's bumper week for takeovers. ~
MDLZ.O,Kraft, Mondelz wheat price manipulation hurt traders-U.S. lawsuit April 10 Kraft Foods Group Inc and Mondelz International Inc are being sued in a proposed class action on behalf of wheat futures and options traders for allegedly manipulating the grain's price. ~
MS,Britain's FTSE nears record high as Shire shines LONDON, April 10 Britain's top equity index advanced on Friday, nearing record highs, as real-estate stocks extended gains from a rebound in property prices and drugmaker Shire got a lift from a positive product review. ~Britain's FTSE nears record high as real estate prospers LONDON, April 10 Britain's top equity index advanced on Friday, nearing record highs, as real-estate stocks extended gains from a rebound in property prices and drugmaker Shire got a lift from a positive product review. ~
NFLX.O,Netflix seeks to raise share authorization in step to stock split April 10 Netflix Inc is seeking to increase its share authorization by nearly 30 times, the video streaming service said in a filing with regulators. ~
SYMC.O,Symantec has been exploring Veritas sale for months-sources April 10 Security software maker Symantec Corp  has been seeking buyers for its storage software business, Veritas, or the entire company for several months, sources familiar with the matter said. ~
FOXA.O,News Corp, 21st Century Fox seek World Trade Center base -report NEW YORK, April 10 News Corp and 21st Century Fox, controlled by Rupert Murdoch, are in talks to build a joint headquarters in a new 88-story skyscraper at the World Trade Center in lower Manhattan, The New York Times said on Friday. ~
FOX.O,News Corp, 21st Century Fox seek World Trade Center base -report NEW YORK, April 10 News Corp and 21st Century Fox, controlled by Rupert Murdoch, are in talks to build a joint headquarters in a new 88-story skyscraper at the World Trade Center in lower Manhattan, The New York Times said on Friday. ~
V,BRIEF-Visa calls for redemption all of its 1.200 pct notes due 2017 * Visa Inc - on Sept 11, co called for redemption all of $1.75 billion principal amount outstanding of its 1.200 pct notes due 2017‍​ - SEC filing ~BRIEF-Visa Inc files for three-part senior notes offering of up to $2.5 bln * Visa Inc says files for three-part senior notes offering of up to $2.5 billion - SEC filing‍​ ~Former BoE deputy Hogg to join Visa as Europe unit CEO Visa Inc, the world's largest payments processor, on Thursday named former Bank of England (BoE) deputy governor Charlotte Hogg as chief executive of its Europe division. ~CORRECTED-UPDATE 1-MOVES-Former BoE deputy Hogg to join Visa as Europe unit CEO Sept 7 Visa Inc, the world's largest payments processor, on Thursday named former Bank of England (BoE) deputy governor Charlotte Hogg as chief executive of its Europe division. ~MOVES-Visa names ex-BoE deputy Charlotte Hogg as Europe unit CEO Sept 7 Visa Inc, the world's largest payments processor, on Thursday named Charlotte Hogg as chief executive of its Europe division. ~BRIEF-Visa appoints Charlotte Hogg as CEO of European operations * Visa Inc appoints Charlotte Hogg as chief executive officer of the compan's European operations ~BRIEF-Visa Inc files prospectus supplement for potential three-part senior notes offering * Visa Inc files prospectus supplement for potential three-part senior notes offering; size not disclosed - sec filing‍​ Source text (http://bit.ly/2vLDrIe) Further company coverage: ~BRIEF-Visa enables on the go payments with the new Fitbit Ionic * Visa inc- ‍enabling visa payments on fitbit's smartwatch fitbit ionic​ ~BRIEF-Bridg raises $11 million in Series B funding * Bridg raises $11 million in Series B funding from Morpheus Ventures, March Capital, Visa and NextEquity ~
WMT,UPDATE 1-Wal-Mart says Walton family to sell shares to keep lid on stake April 10 Wal-Mart Stores Inc said the Walton family was putting 6 percent of the retailer's outstanding shares in a newly formed trust for possible sale to offset expected increases in its stake due to stock buybacks and to help fund charitable contributions. ~CORRECTED-OFFICIAL-Wal-Mart says Walton family to sell shares to keep lid on stake April 10 Wal-Mart Stores Inc said the Walton family was putting 6 percent of the retailer's outstanding shares in a newly formed trust for possible sale to offset expected increases in its stake due to stock buybacks and to help fund charitable contributions. ~
WFC,Deals of the day- Mergers and acquisitions April 10 The following bids, mergers, acquisitions and disposals were reported by 2000 GMT on Friday: ~Blackstone to buy Excel Trust for about $2 billion Real estate investment trust Excel Trust Inc  said it would be bought by Blackstone Property Partners LP, part of Blackstone Group LP , for about $2 billion in cash. ~UPDATE 1-Blackstone to buy Excel Trust for about $2 bln April 10 Real estate investment trust Excel Trust Inc said it would be bought by Blackstone Property Partners LP, part of Blackstone Group LP, for about $2 billion in cash. ~GE to sell real estate holdings, sets $50 bln share buyback April 10 General Electric Co said it would sell nearly all of its real estate portfolio to investors including Blackstone Group and Wells Fargo & Co  for $26.5 billion. ~
