SCG,DIARY-U.S. MEETINGS/WEEK AHEAD Thomson Reuters April 28, 2015 - Corporate Meetings for US companies for Week ahead.         S&P; 500 Earnings - MONTH AHEAD     Dividends                            Non S&P; 500 - Weekly             Federal Reserve events               ConferenceCall/Webcast - Weekly  Meetings - Weekly                                Xtra users can see more details on conference calls & webcasts by hovering your mouse  over the RIC, right click, no click on Related Co Data, now click on Co Events.                  ~
SJP.L,Britain's FTSE falls after weak corporate updates, U.S. data LONDON, April 28 Britain's top share index faced its biggest one-day drop in nearly a month on Tuesday, weighed down by a combination of disappointing corporate updates and weak U.S. data. ~UPDATE 2-St James's Place shares fall on net inflows, election caution LONDON, April 28 Shares in British wealth manager St James's Place fell more than 2 percent on Tuesday after it posted slightly below forecast inflows in the first quarter and expressed caution about next week's election. ~St James's Place sees Q1 net inflows of 1.3 bln pounds, up 9 pct LONDON, April 28 British wealth manager St James's Place posted first-quarter net inflows of 1.3 billion pounds ($1.98 billion), it said on Tuesday, up 9 percent from a year earlier. ~
TXT,UPDATE 1-Textron profit, revenue miss estimates as helicopter sales drop April 28 Textron Inc, maker of Beechcraft and Cessna airplanes and Bell helicopters, reported lower-than-expected quarterly revenue and profit as helicopter division sales declined. ~CORRECTED-Textron quarterly profit jumps 50.6 pct April 28 Textron Inc, the maker of Beechcraft and Cessna planes and Bell helicopters, reported a 50.6 percent jump in first-quarter profit. ~
KO,Coca-Cola faces renewed pressure over executive pay NEW YORK/BOSTON, April 28 Coca-Cola Co  faces renewed pressure over its executive pay from large proxy advisory firms ahead of a shareholder meeting on Wednesday and at least two major pension funds disclosed they voted against the company's compensation. ~
HSY,DIARY-U.S. MEETINGS/WEEK AHEAD Thomson Reuters April 28, 2015 - Corporate Meetings for US companies for Week ahead.         S&P; 500 Earnings - MONTH AHEAD     Dividends                            Non S&P; 500 - Weekly             Federal Reserve events               ConferenceCall/Webcast - Weekly  Meetings - Weekly                                Xtra users can see more details on conference calls & webcasts by hovering your mouse  over the RIC, right click, no click on Related Co Data, now click on Co Events.                  ~
TMK,DIARY-U.S. MEETINGS/WEEK AHEAD Thomson Reuters April 28, 2015 - Corporate Meetings for US companies for Week ahead.         S&P; 500 Earnings - MONTH AHEAD     Dividends                            Non S&P; 500 - Weekly             Federal Reserve events               ConferenceCall/Webcast - Weekly  Meetings - Weekly                                Xtra users can see more details on conference calls & webcasts by hovering your mouse  over the RIC, right click, no click on Related Co Data, now click on Co Events.                  ~
TSCO.O,DIARY-U.S. MEETINGS/WEEK AHEAD Thomson Reuters April 28, 2015 - Corporate Meetings for US companies for Week ahead.         S&P; 500 Earnings - MONTH AHEAD     Dividends                            Non S&P; 500 - Weekly             Federal Reserve events               ConferenceCall/Webcast - Weekly  Meetings - Weekly                                Xtra users can see more details on conference calls & webcasts by hovering your mouse  over the RIC, right click, no click on Related Co Data, now click on Co Events.                  ~
TSN,Tyson Foods to end use of human antibiotics in U.S. chickens by 2017 CHICAGO Tyson Foods Inc , the largest U.S. poultry producer, plans to eliminate use of human antibiotics in its chicken flocks by September 2017, one of the most aggressive timetables yet set by an American poultry company. ~UPDATE 1-Tyson Foods to end use of human antibiotics in U.S. chickens by 2017 CHICAGO, April 28 Tyson Foods Inc, the largest U.S. poultry producer, plans to eliminate use of human antibiotics in its chicken flocks by September 2017, one of the most aggressive timetables yet set by an American poultry company. ~CORRECTED-Tyson Foods plans to cut human antibiotics in U.S. chicken flocks by 2017 CHICAGO, April 28 Tyson Foods Inc, the largest U.S. poultry producer, plans to eliminate the use of human antibiotics in its chicken flocks by September 2017 - one of the most aggressive timelines yet set by an American poultry company. ~Tyson Foods plans to cut human antibiotics in U.S. chicken flocks by 2017 CHICAGO Tyson Foods Inc, the largest U.S. poultry producer, plans to eliminate the use of human antibiotics in its chicken flocks by September 2017 - one of the most aggressive timelines yet set by an American poultry company. ~
UPS,UPS profit lifted by pricing, maintains 2015 earnings outlook CHICAGO United Parcel Service Inc  on Tuesday reported higher first-quarter net profit due to price increases and productivity improvements, and reaffirmed its earnings outlook for 2015. ~UPDATE 2-UPS profit lifted by pricing, maintains 2015 earnings outlook CHICAGO, April 28 United Parcel Service Inc  on Tuesday reported higher first-quarter net profit due to price increases and productivity improvements, and reaffirmed its earnings outlook for 2015. ~UPS quarterly profit rises, helped by price increases CHICAGO, April 28 United Parcel Service Inc  on Tuesday reported a higher quarterly net profit, which rose thanks to price increases and productivity improvements. ~
VLO,DIARY-U.S. MEETINGS/WEEK AHEAD Thomson Reuters April 28, 2015 - Corporate Meetings for US companies for Week ahead.         S&P; 500 Earnings - MONTH AHEAD     Dividends                            Non S&P; 500 - Weekly             Federal Reserve events               ConferenceCall/Webcast - Weekly  Meetings - Weekly                                Xtra users can see more details on conference calls & webcasts by hovering your mouse  over the RIC, right click, no click on Related Co Data, now click on Co Events.                  ~
V,BRIEF-Visa calls for redemption all of its 1.200 pct notes due 2017 * Visa Inc - on Sept 11, co called for redemption all of $1.75 billion principal amount outstanding of its 1.200 pct notes due 2017‍​ - SEC filing ~BRIEF-Visa Inc files for three-part senior notes offering of up to $2.5 bln * Visa Inc says files for three-part senior notes offering of up to $2.5 billion - SEC filing‍​ ~Former BoE deputy Hogg to join Visa as Europe unit CEO Visa Inc, the world's largest payments processor, on Thursday named former Bank of England (BoE) deputy governor Charlotte Hogg as chief executive of its Europe division. ~CORRECTED-UPDATE 1-MOVES-Former BoE deputy Hogg to join Visa as Europe unit CEO Sept 7 Visa Inc, the world's largest payments processor, on Thursday named former Bank of England (BoE) deputy governor Charlotte Hogg as chief executive of its Europe division. ~MOVES-Visa names ex-BoE deputy Charlotte Hogg as Europe unit CEO Sept 7 Visa Inc, the world's largest payments processor, on Thursday named Charlotte Hogg as chief executive of its Europe division. ~BRIEF-Visa appoints Charlotte Hogg as CEO of European operations * Visa Inc appoints Charlotte Hogg as chief executive officer of the compan's European operations ~BRIEF-Visa Inc files prospectus supplement for potential three-part senior notes offering * Visa Inc files prospectus supplement for potential three-part senior notes offering; size not disclosed - sec filing‍​ Source text (http://bit.ly/2vLDrIe) Further company coverage: ~BRIEF-Visa enables on the go payments with the new Fitbit Ionic * Visa inc- ‍enabling visa payments on fitbit's smartwatch fitbit ionic​ ~BRIEF-Bridg raises $11 million in Series B funding * Bridg raises $11 million in Series B funding from Morpheus Ventures, March Capital, Visa and NextEquity ~
WHR,Whirlpool quarterly profit boosted by cost cuts and acquisitions CHICAGO, April 28 Whirlpool Corp a rise in quarterly net profit on Tuesday, with cost reductions and recent acquisitions offsetting the impact of the strong U.S. dollar and falling demand in Brazil. ~
