AAL.O,U.S. judge narrows US Airways pricing lawsuit vs Sabre NEW YORK, Jan 7 A federal judge has significantly narrowed an antitrust lawsuit in which US Airways Inc, now part of American Airlines Group Inc, accused Sabre Corp, which distributes airfare information, of charging inflated booking fees and suppressing competition. ~
AMGN.O,UPDATE 1-FDA panel unanimously backs Novartis' copy of Amgen's Neupogen Jan 7 A panel to the U.S. Food and Drug Administration unanimously backed the approval of Novartis AG's   copy of Amgen Inc's blockbuster cancer drug Neupogen, setting the stage for the regulator's first approval of a biosimilar. ~FDA panel unanimously backs Novartis' copy of Amgen's Neupogen Jan 7 A panel to the U.S. Food and Drug Administration unanimously backed the approval of Novartis AG's   copy of Amgen Inc's blockbuster cancer drug Neupogen, paving the way for the regulator's first approval for a biosimilar. ~
APA,Apache sees modest impact on output from Permian freeze HOUSTON, Jan 7 Icy weather in the Permian Basin of Texas that snarled truck traffic, caused power outages and disrupted operations for oil and gas companies at the start of the year is expected to have a small impact on Apache Corp's  output, according to a company spokeswoman. ~
AAPL.O,Audio equipment maker Monster sues Beats over alleged fraud Audio equipment maker Monster LLC has sued Beats Electronics LLC, owned by Apple Inc , over alleged "fraud and deceit" in the way that Beats acquired control of the rights to the popular "Beats by Dr. Dre" headphones. ~Audio equipment maker Monster sues Beats over alleged fraud Jan 6 Audio equipment maker Monster LLC has sued Beats Electronics LLC, owned by Apple Inc, over alleged "fraud and deceit" in the way that Beats acquired control of the rights to the popular "Beats by Dr. Dre" headphones. ~
ADP.O,U.S. private job growth accelerates in December: ADP NEW YORK U.S. private employers added 241,000 jobs in December, beating the median forecasts of analysts and bringing their annual hiring to 2.5 million for 2014, a report by a payrolls processor showed on Wednesday. ~UPDATE 1-U.S. private job growth accelerates in December -ADP NEW YORK, Jan 7 U.S. private employers added 241,000 jobs in December, beating the median forecasts of analysts and bringing their annual hiring to 2.5 million for 2014, a report by a payrolls processor showed on Wednesday. ~US STOCKS-Futures higher after 5-day slide; ADP on tap NEW YORK, Jan 7 U.S. stock index futures rose on Wednesday, putting Wall Street on track to bounce from a five-day slide, ahead of data on the labor market and the minutes from the most recent meeting of the U.S. Federal Reserve. ~FOREX-Euro hits 9-yr low as euro zone prices fall for first time since 2009 LONDON, Jan 7 The euro fell to a new nine-year low against the dollar on Wednesday after data showed the euro zone prices falling for the first time since 2009, piling pressure on the European Central Bank to take bold policy action. ~
CPB,Investment firm 3G Capital scouts new targets: WSJ Investment firm 3G Capital Partners LP is looking at new  acquisition targets after investors pledged about $5 billion to form a new takeover fund, the Wall Street Journal reported, citing people familiar with the matter. ~Investment firm 3G Capital scouts new targets - WSJ Jan 7 Investment firm 3G Capital Partners LP is looking at new  acquisition targets after investors pledged about $5 billion to form a new takeover fund, the Wall Street Journal reported, citing people familiar with the matter. ~PRESS DIGEST - Wall Street Journal - Jan 7 Jan 7 The following are the top stories in the Wall Street Journal. Reuters has not verified these stories and does not vouch for their accuracy. ~
DOW,BRIEF-Downer EDI says offer for Spotless Group now closed * Confirms that its offer for Spotless was not extended and has now closed. Source text for Eikon: Further company coverage: ~BRIEF-Downer EDI posts FY net profit of $181.5 million * FY total revenue and other income from ordinary activities $7.29 billion , up 6.4 percent ~BRIEF-Downer EDI says ‍offer for Spotless Group extended to 28 August 2017​ * ‍Offer for Spotless Group extended to 7pm on Monday, 28 august 2017​ Source text for Eikon: Further company coverage: ~BRIEF-Downer EDI says Spotless ‍offer extended to Aug 21, 2017​ * Spotless ‍offer extended to 7pm on monday, 21 august 2017​ Source text for Eikon: Further company coverage: ~BRIEF-Downer EDI's takeover offer for Spotless Group extended till 7pm (Sydney time) on Aug. 14 * Unconditional takeover offer for Spotless Group extended until 7:00pm (Sydney time) on Monday, 14 August Source text for Eikon: Further company coverage: (bangalore.newsroom@thomsonreuters.com) ~BRIEF-Downer extends takeover offer for Spotless Group * decided to extend Spotless offer period for one week; offer will now remain open for acceptance until 14 august Source text for Eikon: Further company coverage: ~BRIEF-Downer extends Spotless offer to August 7 2017 * ‍Downer has decided to extend offer for Spotless Group holdings to 7 pm on Monday, 7 august 2017​ Source text for Eikon: Further company coverage: ~BRIEF-Downer EDI's stake in Spotless increases to 80.3 pct * Downer's stake in Spotless increases to 80.3 pct Source text for Eikon: Further company coverage: ~BRIEF- Downer EDI Ltd'S stake in Spotless Group increases to 72% * As Downer's shareholding in Spotless is now over 70%, Downer expects that Spotless will be removed from certain S&P;/ASX market indices ~
DPS,UPDATE 1-Keurig cold drink machine to offer Dr Pepper Snapple sodas Jan 7 Keurig Green Mountain Inc will sell Dr Pepper Snapple Group Inc's soda pods for its at-home cold beverage system, Keurig Cold, expected to be launched this year. ~Keurig, Dr Pepper Snapple sign deal for new cold-drink machine -WSJ Jan 7 Keurig Green Mountain Inc, maker of the K-Cup single-serve coffee pod, signed a deal with Dr Pepper Snapple Group Inc to sell capsules that make its sodas in Keurig's planned cold-drink machine, the Wall Street Journal reported. ~
GM,GM cuts price on most Cadillac CTS sedans amid weak demand DETROIT, Jan 7 General Motors Co's luxury Cadillac brand has cut the price most customers will pay for its 2015 CTS to counter slumping demand in the United States for the marquee sedan. ~GM says Opel deliveries in Europe rose 3 percent in 2014 FRANKFURT Deliveries of Opel and Vauxhall, the European brands of General Motors , rose 3 percent in Europe last year to 1.08 million cars, the company said on Wednesday. ~GM says Opel deliveries in Europe rose 3 pct in 2014 FRANKFURT, Jan 7 Deliveries of Opel and Vauxhall, the European brands of General Motors, rose 3 percent in Europe last year to 1.08 million cars, the company said on Wednesday. ~
GS,Goldman Sachs invests in German online spectacles retailer FRANKFURT Goldman Sachs'  private equity arm is taking a roughly 20 percent stake in Mister Spex, Germany's leading online spectacles retailer said on Wednesday. ~Goldman Sachs invests in German online spectacles retailer FRANKFURT, Jan 7 Goldman Sachs' private equity arm is taking a roughly 20 percent stake in Mister Spex, Germany's leading online spectacles retailer said on Wednesday. ~
INTC.O,Intel Corp chief shows wrist-worn drone; promises to employ more women SAN FRANCISCO, Jan 6 Intel Corp Chief Executive Brian Krzanich showed off a computer built into a jacket button and a wristband that transforms into a selfie-snapping flying camera, as the chipmaker extends its push into smart wearable gadgets. ~
LLY,Lilly 2015 revenue forecast falls short of Wall St estimates Jan 7 Eli Lilly and Co, which has been battered in the past three years by competition from generics, forecast 2015 revenue shy of Wall Street expectations. ~
LMT,UPDATE 1-Turkey to order four more F-35 fighter jets - Davutoglu ANKARA, Jan 7 Turkey has decided to order four more of Lockheed Martin's F-35 fighter jets in addition to the two it previously ordered, Prime Minister Ahmet Davutoglu said on Wednesday. ~Turkey to order four more F-35 fighter jets - Davutoglu ANKARA, Jan 7 Turkey has decided to order four more of Lockheed Martin's F-35 fighter jets in addition to the two it previously ordered, Prime Minister Ahmet Davutoglu said on Wednesday. ~U.S. Air Force 'close' to certifying new satellite launch provider WASHINGTON The U.S. Air Force said on Tuesday it was close to certifying a second company to launch military and intelligence satellites into space, and announced a review of the process used to vet new entrants. ~
MCD,U.S. supplier in China food scare takes aim at Shanghai regulator SHANGHAI, Jan 7 U.S. food supplier OSI Group LLC, which came under fire in China last year over allegations it used out-of-date meat, has criticised the handling of the case by the local food regulator, a rare act in China where firms are usually careful not to openly challenge the authorities. ~China regulator to strengthen 'grim' food, drug safety control SHANGHAI Food and drug safety in China is "grim" and will get stronger oversight, the food and drug regulator said on Wednesday, after a series of scares last year hit the reputations of global firms such as McDonald's Corp and Wal-Mart Stores Inc. ~China regulator to strengthen "grim" food, drug safety control SHANGHAI, Jan 7 Food and drug safety in China is "grim" and will get stronger oversight, the food and drug regulator said on Wednesday, after a series of scares last year hit the reputations of global firms such as McDonald's Corp  and Wal-Mart Stores Inc. ~
MON,UPDATE 4-Monsanto profit falls, but less sharply than Wall St expected (Adds information on microbe research, updates share price) ~
BK,MOVES-BNY Mellon names Douglas Shulman senior executive vice president Jan 7 Bank of New York Mellon appointed Douglas Shulman senior executive vice president and global head of client service delivery. ~
V,BRIEF-Visa calls for redemption all of its 1.200 pct notes due 2017 * Visa Inc - on Sept 11, co called for redemption all of $1.75 billion principal amount outstanding of its 1.200 pct notes due 2017‍​ - SEC filing ~BRIEF-Visa Inc files for three-part senior notes offering of up to $2.5 bln * Visa Inc says files for three-part senior notes offering of up to $2.5 billion - SEC filing‍​ ~Former BoE deputy Hogg to join Visa as Europe unit CEO Visa Inc, the world's largest payments processor, on Thursday named former Bank of England (BoE) deputy governor Charlotte Hogg as chief executive of its Europe division. ~CORRECTED-UPDATE 1-MOVES-Former BoE deputy Hogg to join Visa as Europe unit CEO Sept 7 Visa Inc, the world's largest payments processor, on Thursday named former Bank of England (BoE) deputy governor Charlotte Hogg as chief executive of its Europe division. ~MOVES-Visa names ex-BoE deputy Charlotte Hogg as Europe unit CEO Sept 7 Visa Inc, the world's largest payments processor, on Thursday named Charlotte Hogg as chief executive of its Europe division. ~BRIEF-Visa appoints Charlotte Hogg as CEO of European operations * Visa Inc appoints Charlotte Hogg as chief executive officer of the compan's European operations ~BRIEF-Visa Inc files prospectus supplement for potential three-part senior notes offering * Visa Inc files prospectus supplement for potential three-part senior notes offering; size not disclosed - sec filing‍​ Source text (http://bit.ly/2vLDrIe) Further company coverage: ~BRIEF-Visa enables on the go payments with the new Fitbit Ionic * Visa inc- ‍enabling visa payments on fitbit's smartwatch fitbit ionic​ ~BRIEF-Bridg raises $11 million in Series B funding * Bridg raises $11 million in Series B funding from Morpheus Ventures, March Capital, Visa and NextEquity ~
WMT,China regulator to strengthen "grim" food, drug safety control SHANGHAI, Jan 7 Food and drug safety in China is "grim" and will get stronger oversight, the food and drug regulator said on Wednesday, after a series of scares last year hit the reputations of global firms such as McDonald's Corp  and Wal-Mart Stores Inc. ~
YUM,U.S. supplier in China food scare takes aim at Shanghai regulator SHANGHAI, Jan 7 U.S. food supplier OSI Group LLC, which came under fire in China last year over allegations it used out-of-date meat, has criticised the handling of the case by the local food regulator, a rare act in China where firms are usually careful not to openly challenge the authorities. ~
