PG,US STOCKS-Wall St flat as energy offsets weak data, earnings * Dow, S&P; 500, Nasdaq all down less than 0.1 pct   (Updates to late morning and changes comment) ~Procter & Gamble's sales fall for fifth straight quarter Procter & Gamble Co  sales fell for the fifth straight quarter as a stronger dollar took its toll, with currency fluctuations likely to hurt 2015 sales by 6-7 percent. ~UPDATE 3-Procter & Gamble's sales fall for fifth straight quarter April 23 Procter & Gamble Co sales fell for the fifth straight quarter as a stronger dollar took its toll, with currency fluctuations likely to hurt 2015 sales by 6-7 percent. ~US STOCKS-Wall St flat as energy offsets weak data, earnings * Indexes: Dow off 0.1 pct; S&P; 500 and Nasdaq flat   (Updates to open) ~US STOCKS-Wall St to open lower on weak data, earnings * Futures down: Dow 66 pts, S&P; 6 pts, Nasdaq 9 pts   (Adds comment, data, updates prices) ~Procter & Gamble's sales fall for fifth straight quarter April 23 Procter & Gamble Co's sales fell for the fifth quarter in a row, hurt by a stronger dollar and lower demand for its beauty, hair and personal care products. ~
PHM,UPDATE 1-PulteGroup's profit slumps as it sells fewer homes in US Northeast April 23 PulteGroup Inc reported a surprise slide in quarterly profit after home sales fell 28 percent in the pricey U.S. Northeast due to construction delays. ~PulteGroup profit falls 27 pct as it sells fewer homes April 23 PulteGroup Inc reported a surprise 27 percent fall in quarterly profit as it sold fewer homes due to construction delays, sending its shares down 8 percent in premarket trading. ~
RTN,UPDATE 1-Raytheon "really excited" over strength of international orders April 23 U.S. weapons maker Raytheon Co's  chief financial officer said he was "really excited" about the strength of international orders, after the maker of Tomahawk and Amraam missiles reported better-than-expected quarterly sales on Thursday. ~Raytheon sales fall amid weak U.S. defense spending April 23 U.S. weapons maker Raytheon Co, the maker of Tomahawk and Amraam missiles, reported a 4 percent fall in quarterly sales as U.S. defense spending remained weak. ~
LUV,Southwest Airlines earnings nearly triple in first quarter Southwest Airlines Co  on Thursday said its first-quarter profit nearly tripled but forecast a decline in unit revenue for April. ~UPDATE 1-Southwest Airlines earnings nearly triple in first quarter April 23 Southwest Airlines Co on Thursday said its first-quarter profit nearly tripled but forecast a decline in unit revenue for April. ~Southwest Airlines first-quarter profit beats expectations April 23 Southwest Airlines Co on Thursday reported first-quarter profit that slightly topped analysts' expectations as new routes and strong U.S. domestic demand grew its revenue. ~
SBUX.O,Starbucks CFO says prices locked in for 70 percent of 2016 coffee needs NEW YORK Starbucks Corp has locked in prices on 70 percent of 2016 coffee needs at "favorable" levels when compared to its 2015 coffee costs, its chief financial officer said in a call to announce the company's fiscal second-quarter results. ~UPDATE 2-Starbucks' strong results quash growth woes, shares rise April 23 Starbucks Corp said on Thursday sales at its coffee shops in the Americas region grew more than expected, boosted by sales of breakfast sandwiches, lunch and new drinks, such as Flat White. ~Starbucks locks in prices for 70 percent of 2016 coffee needs NEW YORK, April 23 Starbucks has locked in prices on 70 percent of 2016 coffee needs at "favorable" levels when compared to its 2015 coffee costs, chief financial officer Scott Maw said in a call to announce the company's second quarter fiscal year 2015 results. ~Starbucks sees bigger hit from foreign exchange this year Starbucks Corp on Thursday said foreign exchange will take a bigger bite out of revenue and earnings this year than it had forecast. ~Starbucks sees bigger hit from foreign exchange this year April 23 Starbucks Corp on Thursday said foreign exchange will take a bigger bite out of revenue and earnings this year than it had forecast. ~Starbucks quarterly cafe sales top expectations, shares rise April 23 Starbucks Corp said on Thursday sales at its coffee shops in the Americas region grew more than expected, calming concerns about cooling growth and sending shares up 4.4 percent in after-hours trading. ~
HSY,DIARY-U.S. MEETINGS/WEEK AHEAD Thomson Reuters April 23, 2015 - Corporate Meetings for US companies for Week ahead.         S&P; 500 Earnings - MONTH AHEAD     Dividends                            Non S&P; 500 - Weekly             Federal Reserve events               ConferenceCall/Webcast - Weekly  Meetings - Weekly                                Xtra users can see more details on conference calls & webcasts by hovering your mouse  over the RIC, right click, no click on Related Co Data, now click on Co Events.                  ~Hershey revenue, profit miss estimates as China growth slows Hershey Co  reported lower-than-expected quarterly revenue and profit due to weak sales growth in China and higher spending on advertising and marketing. ~UPDATE 1-Hershey revenue, profit miss estimates as China growth slows April 23 Hershey Co reported lower-than-expected quarterly revenue and profit due to weak sales growth in China and higher spending on advertising and marketing. ~Hershey quarterly profit falls 3 pct April 23 Hershey Co reported a 3 percent drop in quarterly profit, hurt by higher costs and weaker-than-expected sales in China. ~
DIS,Disney not running ads promoting FiOS Custom TV in NY NEW YORK, April 23 Verizon Communications Inc  said on Thursday that Walt Disney Co is not running ads promoting the wireless carrier's recently launched Fios Custom TV service on its channels in the New York market. ~CORRECTED-UPDATE 1-ESPN says Verizon made unilateral decision on custom TV offerings April 22 Verizon Communications Inc acted on its own when the company decided how to offer ESPN and other Walt Disney Co channels in smaller custom TV packages, a spokeswoman for ESPN said on Wednesday. ~
TWX,UPDATE 3-Comcast looking to drop Time Warner Cable merger -source * Senator Franken: Collapse would be "huge victory" for consumers   (Recasts with new sourcing; adds quote from advocacy group, background) ~
UNP,UPDATE 2-Weak coal volumes help propel earnings miss at Union Pacific CHICAGO, April 22 Union Pacific Corp  said on Thursday its first quarter results were hurt by a drop in coal volumes and the company warned coal would continue to weigh on its results throughout the year. ~Union Pacific profit rises but misses expectations CHICAGO No. 1 U.S. railroad Union Pacific Corp  on Thursday reported a higher quarterly net profit as lower fuel costs and pricing gains offset falling freight volumes, but results fell short of market expectations. ~Union Pacific quarterly profit rises CHICAGO, April 22 No. 1 U.S. railroad Union Pacific Corp on Thursday reported a higher quarterly net profit, as lower fuel costs and pricing gains offset falling freight volumes. ~
UAL,United Airlines likely will use cash for stock buybacks, fuel hedging - CFO United Continental Holdings Inc  likely will use some of its free cash to finish a $1 billion share buyback program this year and add jet fuel hedge positions for 2016, Chief Financial Officer John Rainey said Thursday during a call with investors. ~UPDATE 2-United Airlines first-quarter profit tops expectations April 23 United Continental Holdings Inc  on Thursday reported first-quarter profit that topped analysts' expectations and cut its capacity forecast for 2015, noting the strong U.S. dollar has weakened demand abroad. ~United Airlines first-quarter profit tops expectations April 23 United Continental Holdings Inc  on Thursday reported first-quarter profit that topped analysts' expectations and forecast a drop in passenger unit revenue of four to six percent this quarter as a strong U.S. dollar has weakened demand abroad. ~
VZ,Disney not running ads promoting FiOS Custom TV in NY NEW YORK, April 23 Verizon Communications Inc  said on Thursday that Walt Disney Co is not running ads promoting the wireless carrier's recently launched Fios Custom TV service on its channels in the New York market. ~CORRECTED-UPDATE 1-ESPN says Verizon made unilateral decision on custom TV offerings April 22 Verizon Communications Inc acted on its own when the company decided how to offer ESPN and other Walt Disney Co channels in smaller custom TV packages, a spokeswoman for ESPN said on Wednesday. ~
V,BRIEF-Visa calls for redemption all of its 1.200 pct notes due 2017 * Visa Inc - on Sept 11, co called for redemption all of $1.75 billion principal amount outstanding of its 1.200 pct notes due 2017‍​ - SEC filing ~BRIEF-Visa Inc files for three-part senior notes offering of up to $2.5 bln * Visa Inc says files for three-part senior notes offering of up to $2.5 billion - SEC filing‍​ ~Former BoE deputy Hogg to join Visa as Europe unit CEO Visa Inc, the world's largest payments processor, on Thursday named former Bank of England (BoE) deputy governor Charlotte Hogg as chief executive of its Europe division. ~CORRECTED-UPDATE 1-MOVES-Former BoE deputy Hogg to join Visa as Europe unit CEO Sept 7 Visa Inc, the world's largest payments processor, on Thursday named former Bank of England (BoE) deputy governor Charlotte Hogg as chief executive of its Europe division. ~MOVES-Visa names ex-BoE deputy Charlotte Hogg as Europe unit CEO Sept 7 Visa Inc, the world's largest payments processor, on Thursday named Charlotte Hogg as chief executive of its Europe division. ~BRIEF-Visa appoints Charlotte Hogg as CEO of European operations * Visa Inc appoints Charlotte Hogg as chief executive officer of the compan's European operations ~BRIEF-Visa Inc files prospectus supplement for potential three-part senior notes offering * Visa Inc files prospectus supplement for potential three-part senior notes offering; size not disclosed - sec filing‍​ Source text (http://bit.ly/2vLDrIe) Further company coverage: ~BRIEF-Visa enables on the go payments with the new Fitbit Ionic * Visa inc- ‍enabling visa payments on fitbit's smartwatch fitbit ionic​ ~BRIEF-Bridg raises $11 million in Series B funding * Bridg raises $11 million in Series B funding from Morpheus Ventures, March Capital, Visa and NextEquity ~
WFC,DIARY-U.S. MEETINGS/WEEK AHEAD Thomson Reuters April 23, 2015 - Corporate Meetings for US companies for Week ahead.         S&P; 500 Earnings - MONTH AHEAD     Dividends                            Non S&P; 500 - Weekly             Federal Reserve events               ConferenceCall/Webcast - Weekly  Meetings - Weekly                                Xtra users can see more details on conference calls & webcasts by hovering your mouse  over the RIC, right click, no click on Related Co Data, now click on Co Events.                  ~
