GOOGL.O,Venture capitalist Doerr testifies in Kleiner sexism case SAN FRANCISCO Venture capitalist John Doerr on Tuesday sought to fend off allegations of sexism at his firm, Kleiner Perkins Caufield & Byers, in testimony in a gender discrimination lawsuit targeting the firm. ~UPDATE 2-Apple plans fix next week for newly uncovered Freak security bug BOSTON, March 3 Apple Inc and Google Inc said on Tuesday that they have developed fixes to mitigate the newly uncovered 'Freak' security flaw affecting mobile devices and Mac computers. ~Venture capitalist John Doerr to testify in sexism case SAN FRANCISCO, March 3 Venture capitalist John Doerr, credited with backing Amazon.com Inc, Google Inc  and many other technology companies, is set to testify on Tuesday in a gender discrimination trial involving his firm, Kleiner Perkins Caufield & Byers. ~EU's antitrust chief has met Google's Schmidt BRUSSELS The European Union's antitrust chief has met Google Executive Chairman Eric Schmidt as she seeks to resolve a four-year investigation into complaints that the Internet search giant abuses its dominance. ~EU's antitrust chief has met Google's Schmidt BRUSSELS, March 3 The European Union's antitrust chief has met Google Executive Chairman Eric Schmidt as she seeks to resolve a four-year investigation into complaints that the Internet search giant abuses its dominance. ~
GOOG.O,Venture capitalist Doerr testifies in Kleiner sexism case SAN FRANCISCO Venture capitalist John Doerr on Tuesday sought to fend off allegations of sexism at his firm, Kleiner Perkins Caufield & Byers, in testimony in a gender discrimination lawsuit targeting the firm. ~UPDATE 2-Apple plans fix next week for newly uncovered Freak security bug BOSTON, March 3 Apple Inc and Google Inc said on Tuesday that they have developed fixes to mitigate the newly uncovered 'Freak' security flaw affecting mobile devices and Mac computers. ~Venture capitalist John Doerr to testify in sexism case SAN FRANCISCO, March 3 Venture capitalist John Doerr, credited with backing Amazon.com Inc, Google Inc  and many other technology companies, is set to testify on Tuesday in a gender discrimination trial involving his firm, Kleiner Perkins Caufield & Byers. ~EU's antitrust chief has met Google's Schmidt BRUSSELS The European Union's antitrust chief has met Google Executive Chairman Eric Schmidt as she seeks to resolve a four-year investigation into complaints that the Internet search giant abuses its dominance. ~EU's antitrust chief has met Google's Schmidt BRUSSELS, March 3 The European Union's antitrust chief has met Google Executive Chairman Eric Schmidt as she seeks to resolve a four-year investigation into complaints that the Internet search giant abuses its dominance. ~
AMZN.O,Venture capitalist Doerr testifies in Kleiner sexism case SAN FRANCISCO Venture capitalist John Doerr on Tuesday sought to fend off allegations of sexism at his firm, Kleiner Perkins Caufield & Byers, in testimony in a gender discrimination lawsuit targeting the firm. ~Venture capitalist John Doerr to testify in sexism case SAN FRANCISCO, March 3 Venture capitalist John Doerr, credited with backing Amazon.com Inc, Google Inc  and many other technology companies, is set to testify on Tuesday in a gender discrimination trial involving his firm, Kleiner Perkins Caufield & Byers. ~UPDATE 1-JD.com tops expectations with 73 pct rise in quarterly revenue * More than one-third of Q4 orders fulfilled by mobile   (Adds details) ~
APC,BRIEF-Anadarko has no plans to access capital markets this year-exec * Exec says company has no plans to access capital markets this year  Further company coverage:    (Reporting By Anna Driver) ~Anadarko Petroleum cuts 2015 capex by a third March 3 Anadarko Petroleum Corp said it would reduce spending by about a third to $5.4 billion-$5.8 billion in 2015, in response to lower oil prices. ~
AAPL.O,Apple edges out Samsung in global smartphone sales: Gartner Apple Inc  sold the most number of smartphones globally in the fourth quarter, overtaking Samsung Electronics Co Ltd  for the first time since 2011, according to research firm Gartner. ~CORRECTED-Apple edges out Samsung in global smartphone sales-Gartner March 3 Apple Inc sold the most number of smartphones globally in the fourth quarter, overtaking Samsung Electronics Co Ltd for the first time since 2011, according to research firm Gartner. ~Apple plans fix next week for newly uncovered Freak security bug BOSTON, March 3 An Apple Inc spokesman said on Tuesday that the company plans to release a fix next week to mitigate the newly uncovered 'Freak' security flaw affecting Safari browsers on its iOS and OS X operating systems. ~UPDATE 1-BMW CEO sees challenges mounting for successor * BMW group sales up 7 pct in Feb. - CEO   (Releads on challenges for incoming CEO, adds comments from CEO and a management board member) ~DIARY-U.S. MEETINGS/WEEK AHEAD Thomson Reuters March 03, 2015 - Corporate Meetings for US companies for Week ahead.         S&P; 500 Earnings - MONTH AHEAD     Dividends                            Non S&P; 500 - Weekly             Federal Reserve events               ConferenceCall/Webcast - Weekly  Meetings - Weekly                                Xtra users can see more details on conference calls & webcasts by hovering your mouse  over the RIC, right click, now click on Related Co Data, now click on Co Events.                 ~
BBY,US STOCKS-Wall St falls from latest records; auto sales soft NEW YORK, March 3 U.S. stocks fell on Tuesday, as the Dow and S&P; retreated from their latest records and the Nasdaq dipped below 5,000 after scaling the milestone level for the first time in 15 years. ~UPDATE 2-Best Buy announces first buyback since 2012; profit jumps March 3 Best Buy Co Inc, the largest U.S. consumer electronics chain, on Tuesday reported higher-than-expected quarterly earnings on a strong holiday season and said it would buy back stock for the first time since 2012. ~US STOCKS-Wall St slips from latest records; Nasdaq below 5,000 NEW YORK, March 3 U.S. stocks edged lower shortly after the open on Tuesday in the wake of the latest records for the Dow and S&P; and the Nasdaq scaling the 5,000 mark for the first time in 15 years. ~REFILE-US STOCKS-Wall St to dip at open after latest records, Nasdaq 5,000 NEW YORK, March 3 U.S. stocks were set for a modestly lower open on Tuesday, after the Dow and S&P; marched to new record highs and the Nasdaq topped the 5,000 mark for the first time in 15 years. ~Best Buy aims to save $400 million over three years CHICAGO Best Buy Co Inc , the largest U.S. consumer electronics chain, said on Tuesday it will launch a new cost savings program in fiscal year 2016, beginning Feb. 1. ~Best Buy aims to save $400 mln over 3 yrs CHICAGO, March 3 Best Buy Co Inc, the largest U.S. consumer electronics chain, said on Tuesday it will launch a new cost savings program in fiscal year 2016, beginning Feb. 1. ~US STOCKS-Futures dip after Dow, S&P; records and Nasdaq 5,000 NEW YORK, March 3 U.S. stock index futures edged lower on Tuesday, after the Dow and S&P; marched to new record highs and the Nasdaq topped the 5,000 mark for the first time in 15 years. ~Best Buy same-store sales up 2 pct March 3 Best Buy Co Inc, the largest U.S. consumer electronics chain, reported a 2 percent rise in quarterly same-store sales, helped by higher sales of large-screen televisions and mobile phones in the holiday shopping season. ~
BLK,Investors pull record $525.8 million from BlackRock bond ETF NEW YORK Investors pulled $525.8 million from BlackRock Inc's iShares Core U.S. Aggregate Bond ETF on Monday, the company said on Tuesday. ~Investors pull record $525.8 million from BlackRock bond ETF NEW YORK, March 3 Investors pulled $525.8 million from BlackRock Inc's iShares Core U.S. Aggregate Bond ETF on Monday, the company said on Tuesday. ~MOVES-BlackRock's Charrington steps down as EMEA exec chairman - memo LONDON, March 3 BlackRock Inc's James Charrington stepped down as  executive chairman in Europe, Middle East and Africa this week after more than two decades at the world's biggest money manager, according to an internal memo seen by Reuters. ~
C,U.S. judge not ready to rule on Argentine bond payments via Citigroup NEW YORK A U.S. judge on Tuesday said he would not yet rule on whether Citigroup Inc can process interest payments by Argentina on bonds issued under its local laws following the country's 2002 default. ~UPDATE 1-U.S. judge not ready to rule on Argentine bond payments via Citigroup NEW YORK, March 3 A U.S. judge on Tuesday said he would not yet rule on whether Citigroup Inc can process interest payments by Argentina on bonds issued under its local laws following the country's 2002 default. ~U.S. judge not ready to rule on Argentine bond payments via Citigroup NEW YORK, March 3 A U.S. judge on Tuesday said he would not yet rule on whether Citigroup Inc can process interest payments by Argentina on bonds issued under its local laws following the country's 2002 default. ~Springleaf to buy Citi's OneMain to become top U.S. subprime lender Springleaf Holdings Inc  said it would buy Citigroup Inc's  OneMain Financial Holdings Inc for $4.25 billion in cash, creating the largest subprime lender in the United States. | Video  ~MOVES-Citigroup set for redundancies in EMEA markets business LONDON, March 3 (IFR) - Citigroup is set to make a round of redundancies within its markets and securities business in the Europe, Middle East and Africa region, according to an internal memo sent to staff yesterday and seen by IFR. ~MOVE-Citigroup set for redundancies in EMEA markets business LONDON, March 3 (IFR) - Citigroup is set to make a round of redundancies within its markets and securities business in the Europe, Middle East and Africa region, according to an internal memo sent to staff yesterday and seen by IFR. ~Citigroup-linked China broker plans $1.6 billion Shanghai IPO SHANGHAI, Mar 3 Orient Securities Company Limited, the joint venture partner of a Citigroup Inc  unit, plans to raise 10 billion yuan ($1.59 billion) in an initial public offering (IPO) on the Shanghai stock exchange, the brokerage said late on Monday. ~Citigroup-linked China broker plans $1.6 bln Shanghai IPO SHANGHAI, Mar 3 Orient Securities Company Limited, the joint venture partner of a Citigroup Inc  unit, plans to raise 10 billion yuan ($1.59 billion) in an initial public offering (IPO) on the Shanghai stock exchange, the brokerage said late on Monday. ~
COP,Oil hedge helps Oando prepay debt after ConocoPhillips' Nigerian deal LAGOS, March 3 Oando Plc has prepaid $238 million out of the $753 million it borrowed to part finance the acquisition of ConocoPhillips' Nigerian oil and gas business, the company said on Tuesday. ~
DOW,BRIEF-Downer EDI says offer for Spotless Group now closed * Confirms that its offer for Spotless was not extended and has now closed. Source text for Eikon: Further company coverage: ~BRIEF-Downer EDI posts FY net profit of $181.5 million * FY total revenue and other income from ordinary activities $7.29 billion , up 6.4 percent ~BRIEF-Downer EDI says ‍offer for Spotless Group extended to 28 August 2017​ * ‍Offer for Spotless Group extended to 7pm on Monday, 28 august 2017​ Source text for Eikon: Further company coverage: ~BRIEF-Downer EDI says Spotless ‍offer extended to Aug 21, 2017​ * Spotless ‍offer extended to 7pm on monday, 21 august 2017​ Source text for Eikon: Further company coverage: ~BRIEF-Downer EDI's takeover offer for Spotless Group extended till 7pm (Sydney time) on Aug. 14 * Unconditional takeover offer for Spotless Group extended until 7:00pm (Sydney time) on Monday, 14 August Source text for Eikon: Further company coverage: (bangalore.newsroom@thomsonreuters.com) ~BRIEF-Downer extends takeover offer for Spotless Group * decided to extend Spotless offer period for one week; offer will now remain open for acceptance until 14 august Source text for Eikon: Further company coverage: ~BRIEF-Downer extends Spotless offer to August 7 2017 * ‍Downer has decided to extend offer for Spotless Group holdings to 7 pm on Monday, 7 august 2017​ Source text for Eikon: Further company coverage: ~BRIEF-Downer EDI's stake in Spotless increases to 80.3 pct * Downer's stake in Spotless increases to 80.3 pct Source text for Eikon: Further company coverage: ~BRIEF- Downer EDI Ltd'S stake in Spotless Group increases to 72% * As Downer's shareholding in Spotless is now over 70%, Downer expects that Spotless will be removed from certain S&P;/ASX market indices ~
XOM,TREASURIES-Bond prices flat on corporate supply, U.S. debt demand NEW YORK, March 3 U.S. Treasuries prices were mostly flat on Tuesday, pressured by corporate bond sales and supported by demand for relatively high U.S. yields, while traders also awaited Friday's U.S. jobs report. ~
FB.O,Facebook's Zuckerberg seeks peace with telcos on Web-for-all push BARCELONA, March 3 Facebook Inc founder Mark Zuckerberg was on hostile turf on Monday as spoke to executives at the world's biggest annual gathering of the mobile industry, renewing attempts to win their backing to help reach billions of users with no Internet access. ~
F,UPDATE 3-Fiat Chrysler Canadian sales edge up in February, topping Ford TORONTO, March 3 Fiat Chrysler Automobiles  topped February sales in Canada, handily beating Ford Motor Co, which posted lower car and truck sales, according to company sales data. ~BRIEF-Ford sees U.S. industry annual sales rate in Feb. in the mid to high 16 mln range including medium, heavy trucks DETROIT, March 3 Ford Motor Co monthly U.S. sales call:  * Says sees U.S. industry annual sales rate in February in the mid to high 16 ~
HPQ,Cybersecurity company Novetta Solutions up for sale -sources March 3 Novetta Solutions LLC, a provider of software and IT services to the U.S. intelligence community, is exploring a sale which could value it at more than $650 million, including debt, according to people familiar with the matter. ~UPDATE 2-Former HP chairman admits 'mistake' in sexism trial SAN FRANCISCO, March 2 Onetime highflying tech executive Ray Lane testified on Monday during a sex discrimination trial involving his former employer, Kleiner Perkins Caufield & Byers, that he made a mistake in judgment involving the harassment of a female venture capitalist at the firm, and that he feared for the woman's safety. ~
IBM,Cybersecurity company Novetta Solutions up for sale -sources March 3 Novetta Solutions LLC, a provider of software and IT services to the U.S. intelligence community, is exploring a sale which could value it at more than $650 million, including debt, according to people familiar with the matter. ~
IVZ,Fund manager Invesco trims stake in Noble Group SINGAPORE, March 3 Invesco Ltd and its subsidiaries have trimmed their voting power in Noble Group Ltd  to under 5 percent, and ceased being a substantial shareholder in the commodity trader, Noble Group said on Tuesday. ~
JPM,JPMorgan to pay $50 million over improper mortgage practices WASHINGTON JPMorgan Chase  will pay $50 million as part of a national settlement agreement to compensate homeowners in bankruptcy over the use of robo-signing and other improper practices, the Department of Justice said on Tuesday. ~UPDATE 1-JPMorgan to pay $50 mln over improper mortgage practices WASHINGTON, March 3 JPMorgan Chase will pay $50 million as part of a national settlement agreement to compensate homeowners in bankruptcy over the use of robo-signing and other improper practices, the Department of Justice said on Tuesday. ~JPMorgan to pay $50 mln over improper mortgage practices -DOJ WASHINGTON, March 3 JPMorgan Chase will pay $50 million as part of a national settlement agreement to compensate homeowners in bankruptcy over the use of robo-signing and other improper practices, the Department of Justice said on Tuesday. ~MOVES-Guggenheim hires healthcare bankers from JPMorgan, BofA - WSJ March 3 Guggenheim Partners has hired Jeff Hoffman and Joseph Kohls as senior managing directors to bolster its healthcare investment banking team, the Wall Street Journal reported. ~
LMT,Cybersecurity company Novetta Solutions up for sale -sources March 3 Novetta Solutions LLC, a provider of software and IT services to the U.S. intelligence community, is exploring a sale which could value it at more than $650 million, including debt, according to people familiar with the matter. ~
MAR.O,Sahara's Grosvenor House hotel in London put up for sale NEW DELHI/MUMBAI London's landmark Grosvenor House hotel has been put up for sale after its owner, part of troubled Indian conglomerate Sahara which has been trying to raise funds for its jailed boss Subrata Roy, was placed into administration by creditors. ~UPDATE 1-Sahara's Grosvenor House hotel in London put up for sale NEW DELHI/MUMBAI, March 3 London's landmark Grosvenor House hotel has been put up for sale after its owner, part of troubled Indian conglomerate Sahara which has been trying to raise funds for its jailed boss Subrata Roy, was placed into administration by creditors. ~
MS,UPDATE 1-Morgan Stanley realigns wealth management -memo NEW YORK, March 3 Morgan Stanley, the biggest U.S. brokerage firm with more than 16,000 financial advisers, elevated Sara Furber to a new position as head of corporate and institutional wealth management and wealth management strategy, the company said in an internal memo on Tuesday. ~Morgan Stanley realigns wealth management -memo NEW YORK, March 3 Morgan Stanley, the biggest U.S. brokerage firm with more than 16,000 financial advisers, elevated Sara Furber to a new position as head of corporate and institutional wealth management and wealth management strategy, the company said in an internal memo on Tuesday. ~DIARY-U.S. MEETINGS/WEEK AHEAD Thomson Reuters March 03, 2015 - Corporate Meetings for US companies for Week ahead.         S&P; 500 Earnings - MONTH AHEAD     Dividends                            Non S&P; 500 - Weekly             Federal Reserve events               ConferenceCall/Webcast - Weekly  Meetings - Weekly                                Xtra users can see more details on conference calls & webcasts by hovering your mouse  over the RIC, right click, now click on Related Co Data, now click on Co Events.                 ~
NTRS.O,ON THE MOVE-Veris Wealth hires adviser from Northern Trust March 3 Wealth management firm Veris Wealth Partners said it hired Jane Swan from Northern Trust Corp  as senior wealth manager. ~
SYK,Stryker's $2 billion buyback plan deflates Smith & Nephew bid hopes LONDON Plans by Stryker  to launch a new $2 billion share buyback program punctured hopes the U.S. surgical implant firm would bid for rival Smith & Nephew , sending shares in the British group some 5 percent lower on Tuesday. ~Smith & Nephew slump knocks FTSE back from record high * Barclays, Glencore slip after updates   (Adds details, quote) ~
TGT,Target to cut thousands of jobs, eyes $2 billion in cost cuts U.S. retailer Target Corp on Tuesday said it planned to cut several thousand jobs, mainly from headquarters locations, as part of a restructuring that will cut $2 billion in costs over two years. ~Target says to cut several thousand positions at headquarters Target Corp  said it would cut several thousand positions over the next two years, mainly from headquarters locations, as part of a restructuring aimed at cutting $2 billion in costs. ~Target says to cut several thousand positions at headquarters March 3 Target Corp said it would cut several thousand positions over the next two years, mainly from headquarters locations, as part of a restructuring aimed at cutting $2 billion in costs.   (Reporting by Nathan Layne; Editing by Chris Reese) ~Target forecasts fiscal-year profit growth, $2 billion for share buybacks March 3 U.S. retailer Target Corp on Tuesday forecast a rise in profit and sales this fiscal year and said it would have the capacity to buy back $2 billion worth of its shares this year. ~Target to revamp groceries to focus on younger shoppers - WSJ March 2 Target Corp has zeroed in on seven grocery categories, including granola, yogurt and craft beer, to attract younger shoppers, urban dwellers, and Hispanics, the Wall Street Journal reported, citing people familiar with the matter. ~
V,BRIEF-Visa calls for redemption all of its 1.200 pct notes due 2017 * Visa Inc - on Sept 11, co called for redemption all of $1.75 billion principal amount outstanding of its 1.200 pct notes due 2017‍​ - SEC filing ~BRIEF-Visa Inc files for three-part senior notes offering of up to $2.5 bln * Visa Inc says files for three-part senior notes offering of up to $2.5 billion - SEC filing‍​ ~Former BoE deputy Hogg to join Visa as Europe unit CEO Visa Inc, the world's largest payments processor, on Thursday named former Bank of England (BoE) deputy governor Charlotte Hogg as chief executive of its Europe division. ~CORRECTED-UPDATE 1-MOVES-Former BoE deputy Hogg to join Visa as Europe unit CEO Sept 7 Visa Inc, the world's largest payments processor, on Thursday named former Bank of England (BoE) deputy governor Charlotte Hogg as chief executive of its Europe division. ~MOVES-Visa names ex-BoE deputy Charlotte Hogg as Europe unit CEO Sept 7 Visa Inc, the world's largest payments processor, on Thursday named Charlotte Hogg as chief executive of its Europe division. ~BRIEF-Visa appoints Charlotte Hogg as CEO of European operations * Visa Inc appoints Charlotte Hogg as chief executive officer of the compan's European operations ~BRIEF-Visa Inc files prospectus supplement for potential three-part senior notes offering * Visa Inc files prospectus supplement for potential three-part senior notes offering; size not disclosed - sec filing‍​ Source text (http://bit.ly/2vLDrIe) Further company coverage: ~BRIEF-Visa enables on the go payments with the new Fitbit Ionic * Visa inc- ‍enabling visa payments on fitbit's smartwatch fitbit ionic​ ~BRIEF-Bridg raises $11 million in Series B funding * Bridg raises $11 million in Series B funding from Morpheus Ventures, March Capital, Visa and NextEquity ~
