AET,Two more U.S. healthcare workers repatriated for Ebola monitoring March 18 The last two members of a group of U.S. healthcare workers whose colleague is being treated for the Ebola virus returned on Wednesday from Sierra Leone to the United States, where they are being monitored for possible exposure to the deadly virus. ~
GOOGL.O,CORRECTED-Tag Heuer unveils smartwatch venture with Intel, Google BASEL, Switzerland, March 19 Tag Heuer, French luxury group LVMH's biggest watch maker, announced a partnership with Google Inc and Intel Corp to create a luxury smartwatch to compete head-on with Apple Inc . ~
GOOG.O,CORRECTED-Tag Heuer unveils smartwatch venture with Intel, Google BASEL, Switzerland, March 19 Tag Heuer, French luxury group LVMH's biggest watch maker, announced a partnership with Google Inc and Intel Corp to create a luxury smartwatch to compete head-on with Apple Inc . ~
AMZN.O,UPDATE 3-U.S. regulators give Amazon go-ahead for drone tests SEATTLE, March 19 Amazon.com Inc has won approval from U.S. federal regulators to test a delivery drone outdoors, as the e-commerce company pursues its goal of sending packages to customers by air, even as it faces public concern about safety and privacy. ~
AMGN.O,UPDATE 2-U.S. judge rejects Amgen bid to block 'biosimilar' Neupogen NEW YORK, March 19 A U.S. judge on Thursday denied Amgen Inc's bid to block the sale of Novartis AG's recently approved "biosimilar" form of Neupogen, Amgen's blockbuster drug used to prevent infections in cancer patients. ~BRIEF-Novartis says it, Amgen want expedited appellate review of Neupogen decision March 19 Novartis AG :  * Says it, Amgen both agreed to seek expedited review by U.S. appeals ~U.S. judge rejects Amgen bid to block biosimilar Neupogen SAN FRANCISCO A U.S. judge on Thursday denied Amgen Inc's bid to block the sale of Novartis AG's  recently approved "biosimilar" form of Neupogen, Amgen's blockbuster drug used to prevent infections in cancer patients. ~U.S. judge rejects Amgen injunction bid against Novartis Sandoz unit SAN FRANCISCO, March 19 A U.S. judge on Thursday denied Amgen Inc's bid for a preliminary injunction against Novartis AG's Sandoz unit over disputed biologic product filgrastim. ~
AAPL.O,UPDATE 2-Tag Heuer, Intel challenge Apple with Android smartwatch BASEL, Switzerland, March 19 Tag Heuer, French luxury group LVMH's biggest watch maker, said it will launch a smartwatch later this year using Google Inc's  Android operating system in a venture with Intel Corp  to compete head-on with the Apple Watch. ~CORRECTED-Tag Heuer unveils smartwatch venture with Intel, Google BASEL, Switzerland, March 19 Tag Heuer, French luxury group LVMH's biggest watch maker, announced a partnership with Google Inc and Intel Corp to create a luxury smartwatch to compete head-on with Apple Inc . ~
T,U.S. court rules AT&T;'s lawyers too late to appeal patent loss NEW YORK AT&T; Inc was too late to appeal a $40 million loss in a  patent infringement case because its lawyers did not read key rulings in time, a federal appeals court said on Thursday. ~U.S. court rules AT&T;'s lawyers too late to appeal patent loss NEW YORK AT&T; Inc was too late to appeal a $40 million loss in a  patent infringement case because its lawyers did not read key rulings in time, a federal appeals court said on Thursday. ~U.S. court rules AT&T;'s lawyers too late to appeal patent loss NEW YORK, March 19 AT&T; Inc was too late to appeal a $40 million loss in a  patent infringement case because its lawyers did not read key rulings in time, a federal appeals court said on Thursday. ~
BA,UPDATE 2-U.S. senators launch bipartisan Export-Import Bank blueprint WASHINGTON, March 19 A bipartisan plan to save the U.S. Export-Import Bank seeks to extend the bank's term until 2019, increase lending to small businesses and overturn limits on coal-fired power plants projects, according to documents released on Thursday. ~Senators release new Export-Import Bank blueprint WASHINGTON A bipartisan plan to save the U.S. Export-Import Bank seeks to extend the bank's term until 2019, increase lending to small businesses and overturn limits on coal-fired power plants projects, according to documents released on Thursday. ~
SCHW.N,American Express, Schwab sign co-branded card deal NEW YORK, March 19 American Express Co,  which recently gave up a co-branded card venture with retailer Costco, said on Thursday that it has made a new deal with brokerage Charles Schwab Corp to issue cards under both of their names. ~
COST.O,American Express, Schwab sign co-branded card deal NEW YORK, March 19 American Express Co,  which recently gave up a co-branded card venture with retailer Costco, said on Thursday that it has made a new deal with brokerage Charles Schwab Corp to issue cards under both of their names. ~
DOW,BRIEF-Downer EDI says offer for Spotless Group now closed * Confirms that its offer for Spotless was not extended and has now closed. Source text for Eikon: Further company coverage: ~BRIEF-Downer EDI posts FY net profit of $181.5 million * FY total revenue and other income from ordinary activities $7.29 billion , up 6.4 percent ~BRIEF-Downer EDI says ‍offer for Spotless Group extended to 28 August 2017​ * ‍Offer for Spotless Group extended to 7pm on Monday, 28 august 2017​ Source text for Eikon: Further company coverage: ~BRIEF-Downer EDI says Spotless ‍offer extended to Aug 21, 2017​ * Spotless ‍offer extended to 7pm on monday, 21 august 2017​ Source text for Eikon: Further company coverage: ~BRIEF-Downer EDI's takeover offer for Spotless Group extended till 7pm (Sydney time) on Aug. 14 * Unconditional takeover offer for Spotless Group extended until 7:00pm (Sydney time) on Monday, 14 August Source text for Eikon: Further company coverage: (bangalore.newsroom@thomsonreuters.com) ~BRIEF-Downer extends takeover offer for Spotless Group * decided to extend Spotless offer period for one week; offer will now remain open for acceptance until 14 august Source text for Eikon: Further company coverage: ~BRIEF-Downer extends Spotless offer to August 7 2017 * ‍Downer has decided to extend offer for Spotless Group holdings to 7 pm on Monday, 7 august 2017​ Source text for Eikon: Further company coverage: ~BRIEF-Downer EDI's stake in Spotless increases to 80.3 pct * Downer's stake in Spotless increases to 80.3 pct Source text for Eikon: Further company coverage: ~BRIEF- Downer EDI Ltd'S stake in Spotless Group increases to 72% * As Downer's shareholding in Spotless is now over 70%, Downer expects that Spotless will be removed from certain S&P;/ASX market indices ~
XOM,New Jersey environmental bills move ahead with Exxon deal pending NEW YORK, March 19 A New Jersey bill that calls for more money from environmental settlements to fund cleanups moved to the full state Assembly on Thursday in the wake of a controversial $225 million deal with Exxon Mobil Corp. ~
GS,UPDATE 2-Allianz hedges stake in CPIC through $700 mln deal with Goldman * CPIC shares close 2.9 pct down following Goldman transaction   (Adds statement from Allianz in 3rd paragraph) ~Allianz in $700 mln deal with Goldman to hedge CPIC stake-terms HONG KONG, March 19 German insurer Allianz  has struck a $700 million deal with Goldman Sachs  to protect most of its stake in China Pacific Insurance Group Co Ltd (CPIC), according to a term sheet of the deal seen by Reuters. ~
INTC.O,UPDATE 2-Tag Heuer, Intel challenge Apple with Android smartwatch BASEL, Switzerland, March 19 Tag Heuer, French luxury group LVMH's biggest watch maker, said it will launch a smartwatch later this year using Google Inc's  Android operating system in a venture with Intel Corp  to compete head-on with the Apple Watch. ~CORRECTED-Tag Heuer unveils smartwatch venture with Intel, Google BASEL, Switzerland, March 19 Tag Heuer, French luxury group LVMH's biggest watch maker, announced a partnership with Google Inc and Intel Corp to create a luxury smartwatch to compete head-on with Apple Inc . ~UPDATE 1-Chip designer ARM sees 20 pct market share in servers by 2020 * Chips would be priced less than leader Intel's   (Adds details, quotes) ~
LEN,US STOCKS-Wall St retreats after Fed-fueled rally; energy falls * Indexes: Dow off 0.38 pct, S&P; off 0.3 pct, Nasdaq up 0.15 pct   (Updates to market open) ~US STOCKS-Wall St poised for slightly lower open * Futures down: Dow 45 pts, S&P; 6.5 pts, Nasdaq 4 pts   (adds market moves, commentary) ~Homebuilder Lennar's profit beat signals improving demand Lennar Corp  reported better-than-expected quarterly profit and revenue as it sold more homes at higher prices, and the company said early signs for the spring selling season indicated demand in the U.S. housing market was improving. ~UPDATE 1-Homebuilder Lennar's profit beat signals improving demand March 19 Lennar Corp reported better-than-expected quarterly profit and revenue as it sold more homes at higher prices, and the company said early signs for the spring selling season indicated demand in the U.S. housing market was improving. ~Lennar Corp's quarterly profit jumps 47 pct March 19 U.S. homebuilder Lennar Corp's  quarterly profit jumped 47 percent as the company sold more homes at higher prices. ~
LMT,Pentagon report sees drop in cost of Lockheed F-35, other weapons WASHINGTON, March 19 The U.S. Defense Department's annual report on weapons programs projects a nearly two percent drop in the cost to buy 2,457 Lockheed Martin Corp  F-35 fighter jets in coming decades, and a modest net decline in 79 major arms programs. ~
MAC,Macerich moves make Simon Property takeover bid tougher NEW YORK, March 19 Whether a ploy to drive bidding higher or an effective roadblock, Macerich Co.'s  moves this week to ward off Simon Property Group Inc's  $14.39 billion hostile takeover gives the target company a stronger defense against a formidable adversary. ~
MS,Morgan Stanley shuffles wealth and securities executives -memo NEW YORK Morgan Stanley has moved three executives into new roles in wealth management and institutional securities as part of its effort to get those two businesses to produce more revenue by collaborating, according to an internal memo viewed by Reuters. ~UPDATE 1-Morgan Stanley shuffles wealth and securities executives -memo NEW YORK, March 19 Morgan Stanley has moved three executives into new roles in wealth management and institutional securities as part of its effort to get those two businesses to produce more revenue by collaborating, according to an internal memo viewed by Reuters. ~Morgan Stanley shuffles wealth and securities executives-memo NEW YORK, March 19 Morgan Stanley has moved three executives into new roles in wealth management and institutional securities as part of its effort to get those two businesses to produce more revenue by collaborating, according to an internal memo viewed by Reuters. ~
NKE,UPDATE 2-Nike profit trumps Street, strong dollar weighs on forecast March 19 Nike Inc's quarterly profit beat market estimates as the world's largest sportswear maker sold more higher margin shoes and apparel, but the company warned Wall Street that the stronger dollar would take a toll on its current quarter. ~Nike profit up 16 pct on higher demand for apparel, shoes March 19 Nike Inc, the world's largest sportswear maker, reported a 16 percent jump in quarterly profit due to higher demand for its apparel and basketball and running shoes. ~
NUE,UPDATE 1-Nucor cuts profit forecast as imports hurt steel prices March 19 Nucor Corp, the No.1 U.S. steelmaker, cut its profit forecast for the first quarter, saying higher imports were hurting steel prices. ~U.S. steelmaker Nucor cuts profit forecast March 19 U.S. steelmaker Nucor Corp cut its first-quarter profit forecast, hurt by a fall in steel prices due to higher imports. ~
SPG,Macerich moves make Simon Property takeover bid tougher NEW YORK, March 19 Whether a ploy to drive bidding higher or an effective roadblock, Macerich Co.'s  moves this week to ward off Simon Property Group Inc's  $14.39 billion hostile takeover gives the target company a stronger defense against a formidable adversary. ~
SBUX.O,UPDATE 1-Starbucks partners drinks maker Tingyi to expand in China * Move could lower costs, spread footprint - analysts   (Recasts, adds joint statement, analyst comment, context) ~
TGT,Target agrees to pay $10 mln to settle lawsuit from data breach WASHINGTON Target Corp has agreed to pay $10 million in a proposed settlement of a class-action lawsuit related to a huge 2013 data breach that consumers say compromised their personal financial information, court documents show. ~UPDATE 2-Target agrees to pay $10 mln to settle lawsuit from data breach WASHINGTON, March 18 Target Corp has agreed to pay $10 million in a proposed settlement of a class-action lawsuit related to a huge 2013 data breach that consumers say compromised their personal financial information, court documents show. ~Target agrees to pay $10 mln to settle lawsuit from data breach -CBS WASHINGTON, March 18 Target Corp has agreed to pay $10 million in a proposed settlement of a class-action lawsuit related to a huge 2013 data breach, CBS News reported on Wednesday, citing a company spokeswoman. ~Target to lift minimum wage to $9 an hour, matching rivals Target Corp next month will raise the minimum wage for all of its workers to $9 an hour, matching moves made by rivals including Wal-Mart Stores Inc and TJX Cos, a source familiar with the matter said. ~UPDATE 4-Target to lift minimum wage to $9 an hour, matching rivals March 18 Target Corp next month will raise the minimum wage for all of its workers to $9 an hour, matching moves made by rivals including Wal-Mart Stores Inc  and TJX Cos, a source familiar with the matter said. ~
BK,UPDATE 3-BNY Mellon to pay $714 million to settle foreign exchange cases March 19 Bank of New York Mellon Corp has agreed to pay $714 million to settle allegations that the bank overcharged pension funds and other clients for foreign exchange services, U.S. federal and state authorities said on Thursday. ~BNY Mellon to pay $714 million to settle foreign exchange cases Bank of New York Mellon Corp has agreed to pay $714 million to resolve cases accusing the bank of overcharging pension funds and other clients for foreign exchange services, U.S. federal and state authorities said on Thursday. ~MOVES-Morgan Stanley, BNY Mellon, Ally Financial March 19 The following financial services industry appointments were announced on Thursday. To inform us of other job changes, email moves@thomsonreuters.com. ~
TJX,UPDATE 4-Target to lift minimum wage to $9 an hour, matching rivals March 18 Target Corp next month will raise the minimum wage for all of its workers to $9 an hour, matching moves made by rivals including Wal-Mart Stores Inc  and TJX Cos, a source familiar with the matter said. ~
FOXA.O,CORRECTED-UPDATE 2-News Corp expands stake in Australia's APN media with $104 mln deal SYDNEY/DUBLIN, March 19 News Corp  increased its stake in Australian media company APN News & Media Ltd, becoming the biggest foreign shareholder in the owner of some of the country's top rated radio shows with a $104 million share purchase. ~News Corp says buys 14.99 pct of Australia's APN News & Media SYDNEY, March 19 News Corp said on Thursday it has increased its stake in Australian media company APN News & Media Ltd from an undisclosed level to 14.99 percent, the maximum shareholding allowed in Australia without a formal takeover offer. ~
FOX.O,CORRECTED-UPDATE 2-News Corp expands stake in Australia's APN media with $104 mln deal SYDNEY/DUBLIN, March 19 News Corp  increased its stake in Australian media company APN News & Media Ltd, becoming the biggest foreign shareholder in the owner of some of the country's top rated radio shows with a $104 million share purchase. ~News Corp says buys 14.99 pct of Australia's APN News & Media SYDNEY, March 19 News Corp said on Thursday it has increased its stake in Australian media company APN News & Media Ltd from an undisclosed level to 14.99 percent, the maximum shareholding allowed in Australia without a formal takeover offer. ~
V,BRIEF-Visa calls for redemption all of its 1.200 pct notes due 2017 * Visa Inc - on Sept 11, co called for redemption all of $1.75 billion principal amount outstanding of its 1.200 pct notes due 2017‍​ - SEC filing ~BRIEF-Visa Inc files for three-part senior notes offering of up to $2.5 bln * Visa Inc says files for three-part senior notes offering of up to $2.5 billion - SEC filing‍​ ~Former BoE deputy Hogg to join Visa as Europe unit CEO Visa Inc, the world's largest payments processor, on Thursday named former Bank of England (BoE) deputy governor Charlotte Hogg as chief executive of its Europe division. ~CORRECTED-UPDATE 1-MOVES-Former BoE deputy Hogg to join Visa as Europe unit CEO Sept 7 Visa Inc, the world's largest payments processor, on Thursday named former Bank of England (BoE) deputy governor Charlotte Hogg as chief executive of its Europe division. ~MOVES-Visa names ex-BoE deputy Charlotte Hogg as Europe unit CEO Sept 7 Visa Inc, the world's largest payments processor, on Thursday named Charlotte Hogg as chief executive of its Europe division. ~BRIEF-Visa appoints Charlotte Hogg as CEO of European operations * Visa Inc appoints Charlotte Hogg as chief executive officer of the compan's European operations ~BRIEF-Visa Inc files prospectus supplement for potential three-part senior notes offering * Visa Inc files prospectus supplement for potential three-part senior notes offering; size not disclosed - sec filing‍​ Source text (http://bit.ly/2vLDrIe) Further company coverage: ~BRIEF-Visa enables on the go payments with the new Fitbit Ionic * Visa inc- ‍enabling visa payments on fitbit's smartwatch fitbit ionic​ ~BRIEF-Bridg raises $11 million in Series B funding * Bridg raises $11 million in Series B funding from Morpheus Ventures, March Capital, Visa and NextEquity ~
WMT,UPDATE 4-Target to lift minimum wage to $9 an hour, matching rivals March 18 Target Corp next month will raise the minimum wage for all of its workers to $9 an hour, matching moves made by rivals including Wal-Mart Stores Inc  and TJX Cos, a source familiar with the matter said. ~
