AET,States line up to scrutinize Aetna's $33 billion Humana deal NEW YORK/WASHINGTON U.S. insurance regulators and state attorneys general are lining up to scrutinize Aetna Inc's proposed $33 billion takeover of rival Humana Inc for potential harm to consumers, complicating what is already expected to be a tough and lengthy review by federal antitrust authorities. ~
AA,US STOCKS-Wall St jumps in broad rally on Greece hopes * Euro zone ministers to meet on Saturday to decide on Greece ~US STOCKS-Wall St rises; Yellen says expects Fed to raise rates this year * Euro zone ministers to meet on Saturday to decide on Greece ~US STOCKS-Wall St higher on hopes of Greek debt deal * Euro zone ministers to meet on Saturday to decide on Greece ~US STOCKS-Wall St opens higher on Greek hopes, China bounce * Euro zone ministers to meet on Saturday to decide on Greece ~
AAL.O,American Airlines lowers plans for U.S. capacity growth American Airlines Group Inc on Friday lowered its plans for capacity growth in the United States, seeming to heed investors' calls to slow its expansion in light of weaker-than-expected travel demand. ~American Airlines lowers plans for U.S. capacity growth July 10 American Airlines Group Inc on Friday lowered its plans for capacity growth in the United States, seeming to heed investors' calls to slow its expansion in light of weaker-than-expected travel demand. ~
BAC,Financial ETF investors look for boost from bank earnings NEW YORK, July 10 With a slew of big banks reporting results next week, the key financial exchange traded fund has been drawing strong inflows, and trading in its options appears bullish. ~
BLK,BlackRock proposes reforms to address bond liquidity concerns July 10 BlackRock Inc is calling for a series of reforms that both regulators and asset managers should consider to address concerns about liquidity in the fixed income market. ~
BA,INSIGHT-Planemakers poised for Iranian buying spree if nuclear deal reached * Long waiting list means Iran may also lease or buy 2nd-hand ~
CMCSA.O,Dear customers: That Minion isn't cursing. Sincerely, McDonald's July 10 McDonald's Corp is standing by its latest Happy Meal toy, denying that its Minions are the foul-mouthed playthings that some of its fast-food customers say they are. ~
DAL,UPDATE 2-Delta, Gol boost air accord in $446 mln stock, debt deal SAO PAULO, July 10 U.S. carrier Delta Air Lines Inc will expand its alliance with Brazil's Gol Linhas Aereas Intelligentes SA  under a $446 million stock and loan agreement, Gol said on Friday in a statement. ~Delta Air Lines pilots reject tentative contract: union Delta Air Lines Inc  pilots have rejected a tentative contract agreement, casting in doubt both the labor deal and the airline's plans to order extra planes from the Boeing Co . ~UPDATE 3-Delta Air Lines pilots reject tentative contract - union July 10 Delta Air Lines Inc pilots have rejected a tentative contract agreement, casting in doubt both the labor deal and the airline's plans to order extra planes from the Boeing Co. ~Delta in $446 mln stock, loan deal to increase stake in Brazil's Gol SAO PAULO, July 10 U.S. carrier Delta Air Lines Inc will expand its alliance with Brazil's Gol Linhas Aereas Intelligentes SA  under a $446 million stock and loan agreement, Gol said on Friday in a statement. ~Delta Air Lines pilots reject tentative contract - union July 10 Delta Air Lines Inc's pilots have voted against a tentative agreement approved by their union and the airline's management, leaving the company without a new contract, the pilots union said Friday. ~
EW,Edwards Lifesciences to buy heart device maker for $400 mln July 10 Edwards Lifesciences Corp said it would buy privately held heart device maker CardiAQ Valve Technologies Inc for up to $400 million to expand its portfolio of less-invasive mitral valve replacement devices. ~
GM,UPDATE 1-GM recalls 780,000 SUVs for possible lift gate issue July 10 General Motors Co said it was recalling nearly 780,000 crossover SUVs, mainly in North America, because their rear power lift gates could suddenly fall and hit people. ~GM recalls 780,000 SUVs for possible lift gate issue - AP July 10 General Motors Co is recalling nearly 780,000 crossover SUVs, mainly in North America, because their rear power lift gates can suddenly fall and hit people, the Associated Press reported. ~
HUM,States line up to scrutinize Aetna's $33 billion Humana deal NEW YORK/WASHINGTON U.S. insurance regulators and state attorneys general are lining up to scrutinize Aetna Inc's proposed $33 billion takeover of rival Humana Inc for potential harm to consumers, complicating what is already expected to be a tough and lengthy review by federal antitrust authorities. ~
JPM,Financial ETF investors look for boost from bank earnings NEW YORK, July 10 With a slew of big banks reporting results next week, the key financial exchange traded fund has been drawing strong inflows, and trading in its options appears bullish. ~What to Watch in the Week Ahead and on Monday, July 13 The stock market this quarter doesn't get its usual one-week on-ramp to earnings season, instead getting hit with JPMorgan, Wells Fargo, Intel, Netflix, Google, General Electric Co and Honeywell, all in one week. Add in the political yelling that has become the semi-annual Federal Reserve Chair Janet Yellen's testimony and the ongoing craziness that is Greece's potential exit from the euro zone - to say nothing of China's turmoil - and it should be a lively week for markets, and one that will li ~U.S. banks may start readying for harder times in loan books NEW YORK U.S. banks may start preparing for higher loan losses in the coming quarters, after plunging oil prices have made oil producers more likely to default on loans, analysts said. ~U.S. banks may start readying for harder times in loan books -analysts NEW YORK, July 10 U.S. banks may start preparing for higher loan losses in the coming quarters, after plunging oil prices have made oil producers more likely to default on loans, analysts said. ~
LMT,Lockheed in the lead to buy Sikorsky from United Tech-source July 10 Lockheed Martin Corp is the leading candidate to buy United Technologies Corp's  Sikorsky helicopter unit in a deal that could value the business at more than $8 billion, a source familiar with the situation said on Friday. ~
MCD,Dear customers: That Minion isn't cursing. Sincerely, McDonald's July 10 McDonald's Corp is standing by its latest Happy Meal toy, denying that its Minions are the foul-mouthed playthings that some of its fast-food customers say they are. ~
MS,UPDATE 1-Shell buys Morgan Stanley's Europe gas and power trade book LONDON, July 10 Royal Dutch Shell has acquired Morgan Stanley's European gas and power trading book as the U.S. bank continues its exit from the sector. ~Taiwan's Far EasTone to buy China Network Systems for $2.3 bln -source HONG KONG, July 10 Taiwan's Far Eastone Telecommunications Co Ltd and Morgan Stanley's  private equity division will buy cable TV operator China Network Systems (CNS) for $2.3 billion, a source with direct knowledge of the transaction told Reuters on Friday. ~
CRM,HGGC to buy European software company Selligent: sources Middle market private equity firm HGGC is expected to announce an acquisition of a European automated marketing software company called Selligent for an undisclosed sum, two people familiar with the matter said on Friday. ~
TGT,Minnesota banks on higher taxes, minimum wage as script for growth MINNEAPOLIS It is too early to tell how a recent round of tax hikes and a minimum wage increase will play out in Minnesota, a state where liberal and conservative forces have often swapped control and policies. ~
UTX,Lockheed in the lead to buy Sikorsky from United Tech-source July 10 Lockheed Martin Corp is the leading candidate to buy United Technologies Corp's  Sikorsky helicopter unit in a deal that could value the business at more than $8 billion, a source familiar with the situation said on Friday. ~
WBA.O,Walgreen to pay $22.4 million in N.Y. Medicaid improper billing case NEW YORK Walgreen Co has reached a $22.4 million settlement with the New York attorney general resolving claims that a unit improperly billed the government for reimbursement for a pediatric drug. ~Walgreen to pay $22.4 million in N.Y. Medicaid improper billing case NEW YORK, July 9 Walgreen Co has reached a $22.4 million settlement with the New York attorney general resolving claims that a unit improperly billed the government for reimbursement for a pediatric drug. ~
