MO,Altria welcomes SABMiller's willingness to accept AB InBev offer Oct 13 SABMiller Plc shareholder Altria Group said it was pleased that the brewer was willing to accept larger rival Anheuser-Busch InBev's new offer worth more than $100 billion. ~
AMGN.O,Merck cholesterol drug's odds dim after Lilly failure Oct 12 The odds that Merck & Co's  high-stakes cholesterol drug will succeed have dropped dramatically after Eli Lilly and Co said its similar medicine failed to reduce heart attacks and strokes, top U.S. heart doctors said. ~
AAPL.O,Apple loses patent lawsuit to University of Wisconsin, faces hefty damages NEW YORK Apple Inc could be facing up to $862 million in damages after a U.S. jury on Tuesday found the iPhone maker used technology owned by the University of Wisconsin-Madison's licensing arm without permission in chips found in many of its most popular devices. ~UPDATE 1-Apple loses patent lawsuit to Univ. of Wisconsin, faces hefty damages NEW YORK, Oct 13 Apple Inc could be facing up to $862 million in damages after a U.S. jury on Tuesday found the iPhone maker used technology owned by the University of Wisconsin-Madison's licensing arm without permission in chips found in many of its most popular devices. ~Federal Circuit greenlights $548 million Samsung payout to Apple Apple is another step closer to finally receiving the more than $548 million it is owed by Samsung for infringing its patents and designs on the iPhone, after a last-ditch effort to hold off the payment failed on Tuesday in the nation's top patent court. ~U.S. judge says Apple e-books antitrust monitor's term to end NEW YORK A U.S. judge on Tuesday agreed to not extend the term of a court-appointed monitor assigned to review Apple Inc's antitrust compliance program despite the difficult environment the monitor faced in dealing with the iPad maker. ~U.S. judge says Apple e-books antitrust monitor's term to end NEW YORK A U.S. judge on Tuesday agreed to not extend the term of a court-appointed monitor assigned to review Apple Inc's antitrust compliance program despite the difficult environment the monitor faced in dealing with the iPad maker. ~UPDATE 1-U.S. judge says Apple e-books antitrust monitor's term to end NEW YORK, Oct 13 A U.S. judge on Tuesday agreed to not extend the term of a court-appointed monitor assigned to review Apple Inc's antitrust compliance program despite the difficult environment the monitor faced in dealing with the iPad maker. ~Reuters Business News Schedule at 1230 GMT/0830 AM ET BRUSSELS/LONDON - The world's two biggest brewers agree to create a company making almost a third of the world's beer after SABMiller accepted an offer worth more than $100 billion from larger rival Anheuser-Busch InBev. (SABMILLER-M&A;/A B I (UPDATE 5), moving shortly, by Philip Blenkinsop and Martinne Geller, 830 words) ~U.S. says Apple e-books antitrust monitor no longer needed NEW YORK, Oct 13 The U.S. Justice Department has determined that Apple Inc has implemented significant improvements to its antitrust compliance program and that a court-appointed monitor's term does not need extended, according to a court filing. ~
BLK,End of an era: Mutual fund companies no longer a market bright spot NEW YORK, Oct 13 The era of making a broad bet on mutual fund companies as a way to play America's self-funded retirement boom appears to have ended. ~BlackRock plans new social-impact mutual fund NEW YORK, Oct 12 BlackRock Inc will launch a new mutual fund on Tuesday that targets clients who want to boost the social impact of their investments, not just their returns. ~
BA,Repaired SpaceX rocket to fly by early December, company says JERUSALEM, Oct 13 Space Exploration Technologies, or SpaceX, expects to return a repaired and upgraded Falcon 9 rocket to flight around the start of December, a company vice president said, less than six months after one exploded shortly after liftoff. ~BRIEF-Intracom Holdings unit Intracom Defense Electronics extends agreement with BOEING * Its unit Intracom Defense Electronics extends agreement with BOEING ~
C,Citi dials down risky block trading amid market turmoil NEW YORK Over the summer, as the U.S. stock market wobbled and then plunged 4 percent in a day, Citigroup  made a tough choice: to dial down risk-taking in the bank's capital markets group. ~Citi dials down risky block trading amid market turmoil NEW YORK, Oct 13 Over the summer, as the U.S. stock market wobbled and then plunged 4 percent in a day, Citigroup  made a tough choice: to dial down risk-taking in the bank's capital markets group. ~
COP,UPDATE 1-Conoco changes bylaws to allow proxy access -filing HOUSTON, Oct 13 ConocoPhillips, the largest U.S. independent oil and gas company, on Tuesday said its board amended its bylaws to allow minority shareholders to nominate directors. ~
ETR,Entergy to close Massachusetts Pilgrim nuclear plant by 2019 Oct 13 Entergy Corp said Tuesday it will close its Pilgrim nuclear power plant in Massachusetts no later than June 1, 2019, because of poor market conditions, reduced revenues and increased operational costs. ~
BEN,End of an era: Mutual fund companies no longer a market bright spot NEW YORK, Oct 13 The era of making a broad bet on mutual fund companies as a way to play America's self-funded retirement boom appears to have ended. ~
FCX,Indonesia wants more royalties from Freeport for longer contract JAKARTA, Oct 13 Freeport-McMoRan Inc  should significantly increase the amount it pays in royalty payments to the Indonesian government if it wants to extend a contract to operate one of the world's biggest copper mines, a cabinet minister said on Tuesday. ~
GE,UPDATE 2-GE to sell $30 bln specialty finance business to Wells Fargo Oct 13 General Electric Co took a big step on Tuesday in its plan to unload most of its financing operations, saying it has agreed to sell commercial lending and leasing businesses worth more than $30 billion to Wells Fargo & Co. ~GE to sell $30 bln specialty finance business to Wells Fargo Oct 13 General Electric Co said it would sell its commercial lending and leasing businesses, worth more than $30 billion, to Wells Fargo & Co. ~
INTC.O,UPDATE 3-Intel says data center business to grow less than expected * Sees Q4 revenue of $14.8 bln, plus or minus $500 mln   (Adds details, analyst comment) ~Intel profit falls 6.3 pct Oct 13 Intel Corp reported a 6.3 percent fall in quarterly profit on Tuesday, weighed down by continued weak demand for chips used in personal computers. ~
IBM,UAE's Etihad Airways signs $700 mln IT deal with IBM ABU DHABI, Oct 13 Abu Dhabi's Etihad Airways has signed a 10-year $700 million deal with IBM for a range of information technology services and infrastructure, the companies said on Tuesday. ~
JNJ,J&J; says its diabetes drug should have same survival edge as Lilly's Johnson & Johnson  said the proven ability of Eli Lilly and Co's  rival Jardiance diabetes drug to save lives in a large clinical trial is a benefit that will likely be seen in the entire class of drugs, including J&J;'s own approved Invokana treatment. ~J&J; says Jardiance survival benefit likely to be seen by Invokana Oct 13 Johnson & Johnson said on Tuesday that the ability of Eli Lilly and Co's rival Jardiance diabetes drug to save lives in a large clinical trial is likely to benefit the entire class of drugs, including J&J;'s own approved Invokana treatment. ~UPDATE 3-J&J; 3rd-quarter sales miss mark, hurt by strong dollar * Share buyback of up to $10 bln   (Adds analyst comment, product sales data , updates stock price) ~Strong dollar eats into J&J; quarterly sales Oct 13 Johnson & Johnson reported a 7.4 percent fall in quarterly sales as the impact of a strong dollar more than offset higher sales of its mainstay older drugs. ~Johnson & Johnson plans to buy back shares up to $10 billion Drugmaker Johnson & Johnson  said it plans to buy back up to $10 billion of common stock over time. ~Johnson & Johnson to buy back shares up to $10 bln Oct 13 Drugmaker Johnson & Johnson said it would buy back up to $10 billion of common stock over time. ~
JPM,UPDATE 4-Weak trading hits JPMorgan, profit falls in three core businesses * Shares little changed in extended trading   (Adds details, updates shares) ~JPMorgan quarterly profit jumps 22.3 pct Oct 13 JPMorgan Chase & Co, the biggest U.S. bank by assets, reported a 22.3 percent rise in quarterly profit as lower costs and a smaller provision for credit losses made up for weaker trading revenue. ~JPMorgan goes on a diet to appease regulators NEW YORK JPMorgan Chase & Co , which has grown by more than 50 percent since the start of the financial crisis, is going on a diet. ~JPMorgan goes on a diet to appease regulators NEW YORK, Oct 13 JPMorgan Chase & Co, which has grown by more than 50 percent since the start of the financial crisis, is going on a diet. ~UPDATE 5-Barclays set to name former JPMorgan banker Staley as new CEO * Shares dip 2.6 pct in weak banking sector   (Adds statement from Barclays, updates shares) ~
LMT,Sikorsky takeover will not affect helicopter program -U.S. Army WASHINGTON, Oct 13 The pending takeover of United Technologies Corp's Sikorsky Aircraft by Lockheed Martin Corp will not affect prototype work on an aircraft that will replace thousands of helicopters, U.S. Army acquisitions chief Heidi Shyu said on Tuesday. ~
MU.O,UPDATE 2-Micron, Western Digital in buyout talks with SanDisk-Bloomberg Oct 13 Chipmaker Micron Technology Inc  and hard disk drive maker Western Digital Corp are in talks with memory chip maker SanDisk Corp about a possible acquisition, Bloomberg reported on Tuesday. ~Sandisk in buyout talks with Micron, Western Digital - Bloomberg Oct 13 Micron Technology Inc and Western Digital Corp are in talks with chipmaker Sandisk Corp  about a possible acquisition, Bloomberg reported. ~China's Tsinghua Unigroup hires head of Micron's Taiwan JV: source BEIJING/TAIPEI Chinese state-backed technology conglomerate Tsinghua Unigroup has hired Charles Kau, the chief of Micron Technology Inc's Taiwanese joint venture, as its global executive vice president, a person familiar with the matter said. ~UPDATE 1-China's Tsinghua Unigroup hires head of Micron's Taiwan JV - source * Move seen giving Tsinghua foothold in deal talks with Micron   (Adds comments from new Nanya president and background) ~China's Tsinghua Unigroup hires head of Micron's Taiwan JV - source TAIPEI/BEIJING, Oct 13 Chinese state-backed technology conglomerate Tsinghua Unigroup has hired Charles Kau, the chief of Micron Technology Inc's Taiwanese joint venture, as its global executive vice president, a person familiar with the matter said. ~
MSFT.O,UPDATE 2-Licence sales help SAP operating profit to beat forecasts * Still sees 2015 operating profit of 5.6-5.9 bln euros   (Rewrites, adds shares, analyst comment, detail) ~
TAP,Mega beer deal offers Molson Coors a bigger swig of U.S. market NEW YORK A deal between the world's two biggest brewers gives smaller rival Molson Coors Brewing Co  a rare chance to bulk up in the United States, provided it can come up with the cash, according to industry bankers and analysts. ~Mega beer deal offers Molson Coors a bigger swig of U.S. market NEW YORK, Oct 13 A deal between the world's two biggest brewers gives smaller rival Molson Coors Brewing Co  a rare chance to bulk up in the United States, provided it can come up with the cash, according to industry bankers and analysts. ~
MDLZ.O,UPDATE 1-SEC prepares civil charges against Mondelez in Cadbury probe-WSJ Oct 13 The Securities and Exchange Commission is preparing to file civil charges against Oreo cookies maker Mondelez International Inc in connection with a long-running investigation of payments its Cadbury unit made in India, the Wall Street Journal reported, citing people familiar with the matter. ~SEC prepares civil charges against Mondelez in Cadbury probe-WSJ Oct 13 The Securities and Exchange Commission is preparing to file civil charges against Oreo cookies maker Mondelez International Inc in connection with a long-running investigation of payments its Cadbury unit made in India, the Wall Street Journal reported, citing people familiar with the matter. ~
MYL.A,UPDATE 1-Irish takeover panel rejects Perrigo's request over Mylan offer (Adds details, background)     Oct 13 The Irish Takeover Panel said on Tuesday that it had rejected generic drugmaker Perrigo Company Plc's  request to declare Mylan NV's unsolicited tender offer lapsed.     The offer from Mylan remains "lawful and valid and fully capable of acceptance" by all Perrigo shareholders including Israeli ones, the takeover panel said.      Netherlands-based Mylan has offered $75 in cash and 2.3 Mylan shares for each Perrigo share, a combination now wort ~Irish takeover panel rejects Perrigo's request over Mylan offer Oct 13 The Irish Takeover Panel said on Tuesday that it had rejected Perrigo Company Plc's request to declare Mylan NV's unsolicited tender offer lapsed. ~BRIEF-Irish Takeover Panel rejects Perrigo application to declare Mylan offer lapsed * Perrigo recently made an application to Panel requesting Panel to declare Mylan's offer of Sept. 14, 2015 lapsed ~
PRGO.N,UPDATE 1-Irish takeover panel rejects Perrigo's request over Mylan offer (Adds details, background)     Oct 13 The Irish Takeover Panel said on Tuesday that it had rejected generic drugmaker Perrigo Company Plc's  request to declare Mylan NV's unsolicited tender offer lapsed.     The offer from Mylan remains "lawful and valid and fully capable of acceptance" by all Perrigo shareholders including Israeli ones, the takeover panel said.      Netherlands-based Mylan has offered $75 in cash and 2.3 Mylan shares for each Perrigo share, a combination now wort ~Irish takeover panel rejects Perrigo's request over Mylan offer Oct 13 The Irish Takeover Panel said on Tuesday that it had rejected Perrigo Company Plc's request to declare Mylan NV's unsolicited tender offer lapsed. ~BRIEF-Irish Takeover Panel rejects Perrigo application to declare Mylan offer lapsed * Perrigo recently made an application to Panel requesting Panel to declare Mylan's offer of Sept. 14, 2015 lapsed ~
PFE,Exclusive: India battles big pharma over cough syrup abuse, reducing supplies NEW DELHI Indian regulators are privately pressuring major drug firms to better police how they sell popular codeine-based cough syrups to tackle smuggling and addiction, a move that is reducing supplies of a medicine doctors say is an effective treatment. ~
REGN.O,Merck cholesterol drug's odds dim after Lilly failure Oct 12 The odds that Merck & Co's  high-stakes cholesterol drug will succeed have dropped dramatically after Eli Lilly and Co said its similar medicine failed to reduce heart attacks and strokes, top U.S. heart doctors said. ~
SPLS.O,Staples' limits severance benefits for senior executives Oct 13 Office supplies retailer Staples Inc  said on Tuesday that it would limit severance benefits payments for senior its executives. ~
TROW.O,End of an era: Mutual fund companies no longer a market bright spot NEW YORK, Oct 13 The era of making a broad bet on mutual fund companies as a way to play America's self-funded retirement boom appears to have ended. ~
UTX,Sikorsky takeover will not affect helicopter program -U.S. Army WASHINGTON, Oct 13 The pending takeover of United Technologies Corp's Sikorsky Aircraft by Lockheed Martin Corp will not affect prototype work on an aircraft that will replace thousands of helicopters, U.S. Army acquisitions chief Heidi Shyu said on Tuesday. ~
WFC,MOVES-Wells Fargo affiliate hires two advisers from Raymond James Oct 13 Wells Fargo Advisors Financial Network, an affiliate of Wells Fargo & Co, said it has hired two advisers from financial services company Raymond James  with more than $142 million in assets under management. ~
