ABBV.N,AbbVie wins U.S. approval for Parkinson's treatment The U.S. Food and Drug Administration approved AbbVie Inc's treatment for Parkinson's disease. ~CORRECTED-UPDATE 1-AbbVie wins U.S. approval for Parkinson's treatment Jan 12 The U.S. Food and Drug Administration approved AbbVie Inc's treatment for Parkinson's disease. ~CORRECTED-AbbVie wins U.S. approval for Parkinson's treatment Jan 12 The U.S. Food and Drug Administration approved AbbVie Inc's treatment for Parkinson's disease. ~Breakingviews: Shire gambles AbbVie break fee on risky $5 bln deal LONDON (Reuters Breakingviews) - Shire is gambling its AbbVie break fee on risky M&A.; The Dublin-based pharma group has agreed to buy U.S. peer NPS to expand in lucrative rare drugs. The 51 percent premium is covered almost entirely by compensation from the collapse of Shire's sale to larger American rival AbbVie last year. That doesn't much mitigate the risk of doing a deal ahead of a key regulatory ruling. ~
ADBE.O,Disney, Sony, DreamWorks seek to throw out anti-poaching lawsuit Jan 12 Walt Disney Co, Sony Corp  and DreamWorks Animation SKG Inc urged a federal judge to throw out a antitrust lawsuit accusing them of conspiring not to poach each other's animators in order to keep wages down. ~
AA,Alcoa CFO says overall aluminum price to remain stable NEW YORK, Jan 12 Alcoa's Chief Financial Officer William Oplinger said in the company's fourth-quarter earnings call on Monday that the all-in aluminum price, including benchmark future prices and regional premiums, would remain "similar to the market situation that we have today." ~Alcoa swings to profit, sees strong demand for aerospace CHICAGO Metals company Alcoa Inc  on Monday reported higher-than-expected quarterly profit, swinging from a year-earlier loss due to a boost from automotive demand, higher aluminum prices and lower energy costs. ~UPDATE 2-Alcoa swings to profit, sees strong demand for aerospace CHICAGO, Jan 12 Metals company Alcoa Inc  on Monday reported higher-than-expected quarterly profit, swinging from a year-earlier loss due to a boost from automotive demand, higher aluminum prices and lower energy costs. ~Alcoa sees global aluminum deficit shrinking in 2015 NEW YORK, Jan 12 The global aluminum deficit will shrink to 38,000 tonnes in 2015 as more than 5 million tonnes of new capacity partially offsets rising demand, Alcoa  said in a presentation on Monday after reporting higher-than-expected fourth-quarter profit. ~US STOCKS-Wall St falls; energy shares dragged down further by oil * Indexes off: Dow 0.5 pct, S&P; 0.8 pct, Nasdaq 0.8 pct   (Updates to close) ~Alcoa swings to quarterly profit as restructuring proceeds CHICAGO, Jan 12 Metals company Alcoa Inc  on Monday reported a higher-than-expected quarterly profit excluding restructuring costs, as the firm continued its transition toward more lucrative automotive and aerospace products and away from high-cost smelting facilities. ~
GOOGL.O,Disney, Sony, DreamWorks seek to throw out anti-poaching lawsuit Walt Disney Co, Sony Corp and DreamWorks Animation SKG Inc urged a federal judge to throw out a antitrust lawsuit accusing them of conspiring not to poach each other's animators in order to keep wages down. ~Disney, Sony, DreamWorks seek to throw out anti-poaching lawsuit Jan 12 Walt Disney Co, Sony Corp  and DreamWorks Animation SKG Inc urged a federal judge to throw out a antitrust lawsuit accusing them of conspiring not to poach each other's animators in order to keep wages down. ~Microsoft, Google tangle over Windows security patch SEATTLE Microsoft Corp has complained publicly about tech rival Google Inc revealing a security flaw in its Windows 8.1 system just days before Microsoft was scheduled to roll out a fix for the problem, potentially exposing users to hacking. ~Microsoft, Google tangle over Windows security patch SEATTLE, Jan 12 Microsoft Corp has complained publicly about tech rival Google Inc  revealing a security flaw in its Windows 8.1 system just days before Microsoft was scheduled to roll out a fix for the problem, potentially exposing users to hacking. ~U.S. justices seek Obama administration views on Google-Oracle dispute WASHINGTON The Supreme Court on Monday asked the U.S. government to weigh in on whether the justices should hear a closely watched copyright dispute between Google Inc and Oracle Corp over software used to design Google's Android smartphone operating system. ~Supreme Court seek Obama administration views on Google-Oracle dispute WASHINGTON The Supreme Court on Monday asked the U.S. government to weigh in on whether the justices should hear a closely watched copyright dispute between Google Inc and Oracle Corp over software used to design Google’s Android smartphone operating system. ~U.S. justices seek Obama administration views on Google-Oracle dispute WASHINGTON, Jan 12 The Supreme Court on Monday asked the U.S. government to weigh in on whether the justices should hear a closely watched copyright dispute between Google Inc and Oracle Corp over software used to design Google's Android smartphone operating system. ~BRIEF-Telegate signs contract prolongation with Google * Signs contract prolongation with Google : partnership will be extended further in 2015 ~
GOOG.O,Disney, Sony, DreamWorks seek to throw out anti-poaching lawsuit Walt Disney Co, Sony Corp and DreamWorks Animation SKG Inc urged a federal judge to throw out a antitrust lawsuit accusing them of conspiring not to poach each other's animators in order to keep wages down. ~Disney, Sony, DreamWorks seek to throw out anti-poaching lawsuit Jan 12 Walt Disney Co, Sony Corp  and DreamWorks Animation SKG Inc urged a federal judge to throw out a antitrust lawsuit accusing them of conspiring not to poach each other's animators in order to keep wages down. ~Microsoft, Google tangle over Windows security patch SEATTLE Microsoft Corp has complained publicly about tech rival Google Inc revealing a security flaw in its Windows 8.1 system just days before Microsoft was scheduled to roll out a fix for the problem, potentially exposing users to hacking. ~Microsoft, Google tangle over Windows security patch SEATTLE, Jan 12 Microsoft Corp has complained publicly about tech rival Google Inc  revealing a security flaw in its Windows 8.1 system just days before Microsoft was scheduled to roll out a fix for the problem, potentially exposing users to hacking. ~U.S. justices seek Obama administration views on Google-Oracle dispute WASHINGTON The Supreme Court on Monday asked the U.S. government to weigh in on whether the justices should hear a closely watched copyright dispute between Google Inc and Oracle Corp over software used to design Google's Android smartphone operating system. ~Supreme Court seek Obama administration views on Google-Oracle dispute WASHINGTON The Supreme Court on Monday asked the U.S. government to weigh in on whether the justices should hear a closely watched copyright dispute between Google Inc and Oracle Corp over software used to design Google’s Android smartphone operating system. ~U.S. justices seek Obama administration views on Google-Oracle dispute WASHINGTON, Jan 12 The Supreme Court on Monday asked the U.S. government to weigh in on whether the justices should hear a closely watched copyright dispute between Google Inc and Oracle Corp over software used to design Google's Android smartphone operating system. ~BRIEF-Telegate signs contract prolongation with Google * Signs contract prolongation with Google : partnership will be extended further in 2015 ~
AMZN.O,Amazon's Golden Globes give it new credibility in Hollywood SAN FRANCISCO/LOS ANGELES, Jan 12 Amazon.com Inc's success at Sunday's Golden Globe Awards may help it win over two key audiences: Hollywood's A-list talent and the shopping customers the retailer wants to join its Prime membership program. ~New shows 'Transparent', 'The Affair' take top TV Golden Globes BEVERLY HILLS, Calif. Two fresh new series, Showtime's "The Affair" and Amazon's "Transparent," were catapulted into the spotlight on Sunday at Hollywood's Golden Globe awards, taking home the night's honors for best television drama and comedy. ~New shows 'Transparent', 'The Affair' take top TV Golden Globes BEVERLY HILLS, Calif., Jan 11 Two fresh new series, Showtime's "The Affair" and Amazon's "Transparent," were catapulted into the spotlight on Sunday at Hollywood's Golden Globe awards, taking home the night's honors for best television drama and comedy. ~
ABC,AmerisourceBergen enters animal health market with $2.5 billion deal Medicines distributor AmerisourceBergen Corp  will buy MWI Veterinary Supply Inc  for about $2.5 billion to enter the fast-growing animal health products distribution business as pet ownership rises in the United States. ~UPDATE 2-AmerisourceBergen enters animal health market with $2.5 bln deal * AmericansourceBergen down 1.4 pct   (Adds analysts comments; updates shares) ~Fitch Places AmerisourceBergen's Long-term Ratings on Negative Watch (The following statement was released by the rating agency) CHICAGO, January 12 (Fitch) Fitch Ratings has placed the long-term ratings of  AmerisourceBergen Corp. (NYSE: ABC), including the Issuer Default Rating (IDR),  on Rating Watch Negative. The short-term 'F2' ratings are affirmed. A full list  of rating actions, which apply to $2 billion of outstanding debt as of Sept. 30,  2014, follows at the end of this release. The rating actions follow ABC's announced acquisition of MWI Veterinary Sup ~AmerisourceBergen to buy MWI Veterinary for about $2.5 bln Pharmaceutical products distributor AmerisourceBergen Corp said it will buy MWI Veterinary Supply Inc for about $2.5 billion to enter the market for animal health products distribution. ~AmerisourceBergen to acquire MWI Veterinary Supply for about $2.5 bln Jan 12 Pharmaceutical products distributor AmerisourceBergen Corp said it will buy MWI Veterinary Supply Inc, an animal health products distributor, for about 2.5 billion. ~
AAPL.O,Disney, Sony, DreamWorks seek to throw out anti-poaching lawsuit Jan 12 Walt Disney Co, Sony Corp  and DreamWorks Animation SKG Inc urged a federal judge to throw out a antitrust lawsuit accusing them of conspiring not to poach each other's animators in order to keep wages down. ~
BIIB.O,Biogen to buy private U.K. company with chronic pain drug Jan 11 Biogen Idec Inc on Sunday said it would buy small, privately-held Convergence Pharmaceuticals to acquire the U.K.-based company's portfolio of experimental drugs for chronic nerve pain. ~
BMY,Merck, Bristol heat up immunotherapy race in lung cancer Jan 12 Bristol-Myers Squibb and Merck & Co broke further away from rival drugmakers in the race to treat lung cancer with a new generation of immune system therapies, adding pressure on the likes of Roche and AstraZeneca to play catch-up. ~Bristol-Myers says panel finds Opdivo lung cancer study meets endpoint Bristol-Myers Squibb Co said the independent data monitoring committee concluded that a late stage study evaluating Opdivo versus docetaxel in previously treated patients with advanced, squamous cell non-small cell lung cancer met its endpoint. ~Bristol-Myers says panel finds Opdivo lung cancer study meets endpoint Jan 11 Bristol-Myers Squibb Co said the independent data monitoring committee concluded that a late stage study evaluating Opdivo versus docetaxel in previously treated patients with advanced, squamous cell non-small cell lung cancer met its endpoint. ~
CBS,Stephen Colbert's 'Late Show' set for September debut, CBS says LOS ANGELES, Jan 12 Stephen Colbert will debut as the new host of CBS Corp's "Late Show," on Sept. 8, the U.S. broadcast television network said on Monday. ~
C,European stocks rise, buoyed by chemical and health shares * FTSEurofirst 300 up 0.5 pct, bouncing back from Friday's fall ~
DLTR.O,Dollar Tree expects to shed less than 300 stores to buy Family Dollar Discount chain Dollar Tree Inc said it expects to divest fewer than 300 stores to satisfy U.S. regulators scrutinizing its proposed takeover of Family Dollar Stores Inc, and had already identified potential buyers. ~Dollar Tree expects to shed less than 300 stores to buy Family Dollar Jan 12 Discount chain Dollar Tree Inc  said it expects to divest fewer than 300 stores to satisfy U.S. regulators scrutinizing its proposed takeover of Family Dollar Stores Inc, and had already identified potential buyers. ~UPDATE 3-Dollar Tree expects to shed less than 300 stores to buy Family Dollar * Family Dollar seeks Jan. 22 vote   (Adds details on FTC wanting Dollar General divestitures) ~UPDATE 2-Dollar Tree expects to shed less than 300 stores to buy Family Dollar * Family Dollar seeks Jan. 22 vote   (Adds analysts' comments, details) ~Dollar Tree expects to divest less than 300 stores to buy Family Dollar Jan 12 Discount store chain Dollar Tree Inc  said it expects to divest less than 300 stores to buy larger rival Family Dollar Stores Inc, and had already identified potential buyers. ~
DOW,BRIEF-Downer EDI says offer for Spotless Group now closed * Confirms that its offer for Spotless was not extended and has now closed. Source text for Eikon: Further company coverage: ~BRIEF-Downer EDI posts FY net profit of $181.5 million * FY total revenue and other income from ordinary activities $7.29 billion , up 6.4 percent ~BRIEF-Downer EDI says ‍offer for Spotless Group extended to 28 August 2017​ * ‍Offer for Spotless Group extended to 7pm on Monday, 28 august 2017​ Source text for Eikon: Further company coverage: ~BRIEF-Downer EDI says Spotless ‍offer extended to Aug 21, 2017​ * Spotless ‍offer extended to 7pm on monday, 21 august 2017​ Source text for Eikon: Further company coverage: ~BRIEF-Downer EDI's takeover offer for Spotless Group extended till 7pm (Sydney time) on Aug. 14 * Unconditional takeover offer for Spotless Group extended until 7:00pm (Sydney time) on Monday, 14 August Source text for Eikon: Further company coverage: (bangalore.newsroom@thomsonreuters.com) ~BRIEF-Downer extends takeover offer for Spotless Group * decided to extend Spotless offer period for one week; offer will now remain open for acceptance until 14 august Source text for Eikon: Further company coverage: ~BRIEF-Downer extends Spotless offer to August 7 2017 * ‍Downer has decided to extend offer for Spotless Group holdings to 7 pm on Monday, 7 august 2017​ Source text for Eikon: Further company coverage: ~BRIEF-Downer EDI's stake in Spotless increases to 80.3 pct * Downer's stake in Spotless increases to 80.3 pct Source text for Eikon: Further company coverage: ~BRIEF- Downer EDI Ltd'S stake in Spotless Group increases to 72% * As Downer's shareholding in Spotless is now over 70%, Downer expects that Spotless will be removed from certain S&P;/ASX market indices ~
FB.O,Exclusive: Facebook, Xiaomi discussed possible investment in the Chinese smartphone maker HONG KONG/BEIJING Mark Zuckerberg and Xiaomi Inc CEO Lei Jun discussed a potential investment by Facebook in China's top smartphone maker ahead of its $1.1 billion fundraising last month, but a deal never materialized, several people with knowledge of the matter told Reuters. ~
F,GM hopes new Volt plug-in helps EVs get out of low gear DETROIT General Motors Co on Monday will unveil its next-generation Chevrolet Volt plug-in hybrid and is expected to restate a commitment to build an affordable long-range electric car, doubling down in a segment with scant sales and even skimpier profits. ~
GM,Cadillac plans $12 bln product blitz over 5 yrs -brand president DETROIT, Jan 12 General Motors Co's  Cadillac brand plans a $12 billion new model offensive over the next five years that will include eight vehicles, including five in segments where it does not  currently compete, Cadillac chief Johan de Nysschen said at the Detroit auto show on Monday. ~Auto industry's past and future collide in Detroit DETROIT For Detroit’s first auto show of the 21st Century in January 2000, General Motors announced "the largest auto show exhibit ever in North America" to usher in the new Millennium. | Video  ~GM gets 141 more claims for faulty ignition switch compensation General Motors Co received 141 additional claims for compensation for ignition switch defects in its cars in the past week, bringing the total to 2,710, according to the official administering the compensation program. ~GM gets 141 more claims for faulty ignition switch compensation General Motors Co received 141 additional claims for compensation for ignition switch defects in its cars in the past week, bringing the total to 2,710, according to the official administering the compensation program. ~GM gets 141 more claims for faulty ignition switch compensation Jan 12 General Motors Co received 141 additional claims for compensation for ignition switch defects in its cars in the past week, bringing the total to 2,710, according to the official administering the compensation program. ~GM shows Bolt electric vehicle concept with 200-mile driving range DETROIT General Motors Co on Monday showed its Chevrolet Bolt concept car with an electric driving range of more than 200 miles and a $30,000 price tag, offering a view into where the U.S. automaker is pushing in development of electric vehicles (EV). ~GM shows Bolt electric vehicle concept with 200-mile driving range DETROIT, Jan 12 General Motors Co on Monday showed its Chevrolet Bolt concept car with an electric driving range of more than 200 miles and a $30,000 price tag, offering a view into where the U.S. automaker is pushing in development of electric vehicles (EV). ~FEATURE-Auto industry's past and future collide in Detroit DETROIT, Jan 12 For Detroit's first auto show of the 21st Century in January 2000, General Motors announced "the largest auto show exhibit ever in North America" to usher in the new Millennium. ~GM hopes new Volt plug-in helps EVs get out of low gear DETROIT General Motors Co on Monday will unveil its next-generation Chevrolet Volt plug-in hybrid and is expected to restate a commitment to build an affordable long-range electric car, doubling down in a segment with scant sales and even skimpier profits. ~
GS,UPDATE 9-Oil dives anew, falling 5 pct on Goldman downgrade, outages * Goldman cuts 3-month Brent forecast to $42 from $80   (Adds settlement and comment) ~U.S. top court declines to hear Gupta's appeal over officer ban WASHINGTON The U.S. Supreme Court on Monday rejected former Goldman Sachs Group director Rajat Gupta’s challenge to a permanent ban from acting as a public company officer. ~U.S. top court declines to hear Gupta's appeal over officer ban WASHINGTON The U.S. Supreme Court on Monday rejected former Goldman Sachs Group director Rajat Gupta's challenge to a permanent ban from acting as a public company officer. ~U.S. top court declines to hear Gupta's appeal over officer ban WASHINGTON, Jan 12 The U.S. Supreme Court on Monday rejected former Goldman Sachs Group director Rajat Gupta's challenge to a permanent ban from acting as a public company officer. ~Goldman Sachs slashes oil price forecasts LONDON U.S. bank Goldman Sachs slashed it oil forecasts on Monday, saying fuel prices needed to stay low for much longer in order to curb production and end a global supply glut. ~Ireland appoints Goldman Sachs to advise on AIB sale DUBLIN Ireland has appointed Goldman Sachs to advise on the sale of AIB, finance minister Michael Noonan wrote on Monday, as the state looks to recover all 21 billion euros ($24.9 billion) spent on rescuing the country's second-largest bank by assets. ~UPDATE 1-Ireland appoints Goldman Sachs to advise on AIB sale DUBLIN, Jan 12 Ireland has appointed Goldman Sachs to advise on the sale of AIB, finance minister Michael Noonan wrote on Monday, as the state looks to recover all 21 billion euros ($24.9 billion) spent on rescuing the country's second-largest bank by assets. ~CORRECTED-Ireland appoints Goldman Sachs to advise on AIB sale DUBLIN, Jan 12 Ireland has appointed Goldman Sachs to advise on the sale of AIB, finance minister Michael Noonan wrote on Monday, as the state looks to recover all 21 billion euros ($24.9 billion) spent on rescuing the country's second-largest bank by assets. ~OPEC price war in Asia intensifies as oil falls below $50 * Goldman cuts 2015 Brent outlook to $50.40, WTI to $47.15/bbl ~
INTC.O,Disney, Sony, DreamWorks seek to throw out anti-poaching lawsuit Jan 12 Walt Disney Co, Sony Corp  and DreamWorks Animation SKG Inc urged a federal judge to throw out a antitrust lawsuit accusing them of conspiring not to poach each other's animators in order to keep wages down. ~
JNJ,J&J; strikes Alzheimer's research deal with Swiss firm AC Immune LONDON/ZURICH Johnson & Johnson boosted its research efforts into battling Alzheimer's on Monday, striking a deal potentially worth more than $500 million to develop anti-tau vaccines with Swiss biotech firm AC Immune. ~UPDATE 2-J&J; strikes Alzheimer's research deal with Swiss firm AC Immune * CEO says listing is among options for company's future   (Adds comments from AC Immune CEO) ~AC Immune strikes up to $509 mln Alzheimer's deal with J&J; Jan 12 Swiss biotech firm AC Immune said on Monday it had struck an exclusive worldwide license agreement potentially worth up to $509 million with Johnson & Johnson  to develop so-called anti-Tau vaccines for Alzheimer's disease. ~
KMI,REFILE-As oil plummets, how much pain still looms for US energy firms? NEW YORK, Jan 12 With nearly a quarter of U.S. energy shares' value wiped out by oil's six-month slide, investors are wondering if the sector has taken enough punishment and whether it is time to pile back in ahead of earnings reports later this month. ~
MA,MasterCard moves card processing in Russia to local system - cbank MOSCOW, Jan 12 International credit and debit card company MasterCard has agreed to transfer card processing inside Russia to the local state-owned system, Russia's Central Bank said on Monday. ~
MRK,Merck, Bristol heat up immunotherapy race in lung cancer Jan 12 Bristol-Myers Squibb and Merck & Co broke further away from rival drugmakers in the race to treat lung cancer with a new generation of immune system therapies, adding pressure on the likes of Roche and AstraZeneca to play catch-up. ~Merck speeds up drug-submission plans for Hep C, lung cancer Merck & Co said it would fast track its plans to submit new drugs for hepatitis C and lung cancer for regulatory approval. ~UPDATE 1-Merck speeds up drug-submission plans for Hep C, lung cancer Jan 12 Merck & Co said it would fast track its plans to submit new drugs for hepatitis C and lung cancer for regulatory approval. ~Merck speeds up drug-submission plans for Hep C, lung cancer -WSJ Jan 12 Merck & Co has put on fast track its plans to submit new drugs for hepatitis C and lung cancer for regulatory approval, in an attempt to close the gap with competitors in two lucrative segments, the Wall Street Journal reported. ~
MSFT.O,Microsoft, Google tangle over Windows security patch SEATTLE, Jan 12 Microsoft Corp has complained publicly about tech rival Google Inc  revealing a security flaw in its Windows 8.1 system just days before Microsoft was scheduled to roll out a fix for the problem, potentially exposing users to hacking. ~
MDLZ.O,Outrage in Britain as Cadbury owner tweaks Creme Egg recipe LONDON, Jan 12 Mondelez International, maker of Cadbury Creme Eggs, has tweaked the recipe of the chocolate shell of its gooey treats ahead of their main Easter selling season, sparking an angry response in Cadbury's home market of Britain. ~
ORCL.N,UPDATE 3-SAP profit holds up in fourth quarter as cloud shift accelerates * Q4 op profit up 1 pct, broadly in line with Reuters poll avg ~U.S. justices seek Obama administration views on Google-Oracle dispute WASHINGTON The Supreme Court on Monday asked the U.S. government to weigh in on whether the justices should hear a closely watched copyright dispute between Google Inc and Oracle Corp over software used to design Google's Android smartphone operating system. ~U.S. justices seek Obama administration views on Google-Oracle dispute WASHINGTON, Jan 12 The Supreme Court on Monday asked the U.S. government to weigh in on whether the justices should hear a closely watched copyright dispute between Google Inc and Oracle Corp over software used to design Google's Android smartphone operating system. ~RPT-INSIGHT-Ellison's backing helps Kurian's star to rise at Oracle NEW YORK, Jan 12 Every Tuesday and Wednesday at around 2 pm, Larry Ellison, the founder of Oracle Corp, gathers his lieutenants in the board room on the top floor of the software giant's headquarters in Redwood City, California to hear engineers present new products and strategies. ~INSIGHT-Ellison's backing helps Kurian's star to rise at Oracle NEW YORK, Jan 12 Every Tuesday and Wednesday at around 2 pm, Larry Ellison, the founder of Oracle Corp, gathers his lieutenants in the board room on the top floor of the software giant's headquarters in Redwood City, California to hear engineers present new products and strategies. ~
PFE,Pfizer partners with DNA research firm to study lupus disease Jan 12 Privately held 23andMe Inc said Pfizer Inc would have access to its research services, helping the pharmaceutical giant better understand the lupus disease. ~
REGN.O,UPDATE 1-Sanofi, Regeneron submit new cholesterol drug to EMA for review PARIS, Jan 12 The European Medicines Agency has agreed to review an application by Sanofi and Regeneron for their cholesterol-lowering drug alirocumab, the pharmaceutical groups said in a statement on Monday. ~Sanofi, Regeneron submit new cholesterol drug to EMA for review PARIS, Jan 12 The European Medicines Agency has agreed to review an application by Sanofi and Regeneron for their cholesterol-lowering drug alirocumab, the pharmaceutical groups said in a statement. ~
