AGN,UPDATE 3-Actavis to take Allergan name, reflecting brand-drug focus NEW YORK, Feb 18 Actavis Plc, a generic drugmaker that has been steadily acquiring branded medicines, said it will change its name to Allergan Inc after it completes its planned $66 billion purchase of the Botox maker, signaling its growing focus on patent-protected drugs. ~
GOOGL.O,BRIEF-Expert System becomes technology partner of Google Cloud Platform * Reported on Tuesday that it has joined Google's  partner program as technology partner of the Google Cloud platform ~
GOOG.O,BRIEF-Expert System becomes technology partner of Google Cloud Platform * Reported on Tuesday that it has joined Google's  partner program as technology partner of the Google Cloud platform ~
AAPL.O,CORRECTED-HIGHLIGHTS-Top U.S. hedge funds cut Apple stakes ahead of all-time high NEW YORK, Feb 17 Top U.S. hedge fund management firms, including David Einhorn's Greenlight Capital and Philippe Laffont's Coatue Management, reduced their stakes in Apple Inc  during the fourth quarter, ahead of the iPhone maker's strong rally in 2015, according to regulatory filings. ~Soros bet on Devon Energy, Transocean ahead of oil price rise NEW YORK Soros Fund Management LLC took new positions in the energy sector in the fourth quarter, including stakes in Devon Energy Corp and Transocean Ltd, a regulatory filing showed Tuesday. ~Soros bet on Devon Energy, Transocean ahead of oil price rise NEW YORK, Feb 17 Soros Fund Management LLC took new positions in the energy sector in the fourth quarter, including stakes in Devon Energy Corp and Transocean Ltd , a regulatory filing showed Tuesday. ~Top U.S. hedge funds cut Apple stakes ahead of all-time high NEW YORK Top U.S. hedge fund management firms, including David Einhorn's Greenlight Capital and Philippe Laffont's Coatue Management, reduced their stakes in Apple Inc during the fourth quarter, ahead of the iPhone maker's strong rally in 2015, according to regulatory filings. ~
BLL,Ball Corp, Rexam deal likely this week - WSJ Feb 18 Beverage can maker Ball Corp is close to a deal to buy UK-based Rexam Plc this week, according to people familiar with the matter, the Wall Street Journal reported. ~
BAC,Top U.S. hedge funds cut Apple stakes ahead of all-time high NEW YORK Top U.S. hedge fund management firms, including David Einhorn's Greenlight Capital and Philippe Laffont's Coatue Management, reduced their stakes in Apple Inc during the fourth quarter, ahead of the iPhone maker's strong rally in 2015, according to regulatory filings. ~
BRKa.N,US STOCKS-Wall St edges back from record, investors await Fed * Indexes down: Dow, S&P; 500 0.3 pct, Nasdaq 0.1 pct   (Updates to midday trading) ~US STOCKS-Wall St pulls back from record, investors await Fed * Dow, S&P; 500 down 0.2 pct, Nasdaq flat   (Updates to market open) ~US STOCKS-Futures point to quiet open with S&P; at record * Futures down: Dow 20 pts, S&P; 3.25 pts, Nasdaq 2.5 pts   (Updates prices, adds data) ~US STOCKS-Futures flat as Greece clarity sought; S&P; at record * Dow flat, S&P; down 1.25 pt, Nasdaq up 1.5 pt   (Updates prices, adds Garmin outlook) ~US STOCKS-Futures flat as Greece clarity sought; S&P; at record NEW YORK, Feb 18 U.S. stock index futures were flat on Wednesday, a day after the S&P; 500 ended above 2,100 for the first time ever, as investors waited to see whether a debt deal would be reached with Greece. ~UPDATE 1-Buffett's Berkshire builds Deere stake, dumps Exxon NEW YORK, Feb 17 Warren Buffett's Berkshire Hathaway Inc on Tuesday disclosed a 5 percent stake in agricultural equipment maker Deere & Co and said it shed a $3.74 billion investment in oil company Exxon Mobil Corp  as oil prices plunged. ~
BA,UPDATE 1-Boeing CEO vows to maintain cash to shareholders, 777 production rate Feb 18 Boeing Co will keep returning significant cash to shareholders and will not cut production of wide-body 777 jetliners as it shifts to a new version later this decade, Chief Executive Officer Jim McNerney said on Wednesday. ~Boeing CEO vows to maintain cash to shareholders; 777 production rate Feb 18 Boeing Co will keep returning significant cash to shareholders and is confident that it won't cut production of its widebody 777 jetliner as it shifts to a new version later this decade, Chief Executive Officer Jim McNerney said on Wednesday. ~
CAT,Caterpillar reports SEC investigation of cash movement The movement of cash among Caterpillar Inc's U.S. and foreign subsidiaries is being investigated by U.S. authorities, the company said in a regulatory filing on Tuesday. ~
CELG.O,U.S. FDA approves new use for Celgene's cancer drug Revlimid WASHINGTON, Feb 18 The U.S. Food and Drug Administration has expanded the authorized use of Celgene Corp's  cancer drug Revlimid to include newly diagnosed patients with multiple myeloma, the company said on Wednesday. ~
C,UPDATE 1-Citigroup to set aside $100 bln to fund green initiatives Feb 18 Citigroup Inc said it would set aside $100 billion to fund environmental projects over the next decade, doubling the amount it had earmarked for such projects in 2007. ~Citigroup to set aside $100 bln to fund green initiatives Feb 18 Citigroup Inc said it would set aside $100 billion to fund environmental projects over the next decade, doubling the amount it had earmarked for such projects in 2007. ~
DE,US STOCKS-Wall St edges back from record, investors await Fed * Indexes down: Dow, S&P; 500 0.3 pct, Nasdaq 0.1 pct   (Updates to midday trading) ~US STOCKS-Wall St pulls back from record, investors await Fed * Dow, S&P; 500 down 0.2 pct, Nasdaq flat   (Updates to market open) ~DIARY-U.S. MEETINGS/WEEK AHEAD Thomson Reuters Feb 18, 2015 - Corporate Meetings for US companies for Week ahead.         S&P; 500 Earnings - MONTH AHEAD     Dividends                            Non S&P; 500 - Weekly             Federal Reserve events               ConferenceCall/Webcast - Weekly  Meetings - Weekly                                Xtra users can see more details on conference calls & webcasts by hovering your mouse  over the RIC, right click, now click on Related Co Data, now click on Co Events.                   ~UPDATE 1-Buffett's Berkshire builds Deere stake, dumps Exxon NEW YORK, Feb 17 Warren Buffett's Berkshire Hathaway Inc on Tuesday disclosed a 5 percent stake in agricultural equipment maker Deere & Co and said it shed a $3.74 billion investment in oil company Exxon Mobil Corp  as oil prices plunged. ~
DVN,Soros bet on Devon Energy, Transocean ahead of oil price rise NEW YORK, Feb 17 Soros Fund Management LLC took new positions in the energy sector in the fourth quarter, including stakes in Devon Energy Corp and Transocean Ltd , a regulatory filing showed Tuesday. ~
DOW,BRIEF-Downer EDI says offer for Spotless Group now closed * Confirms that its offer for Spotless was not extended and has now closed. Source text for Eikon: Further company coverage: ~BRIEF-Downer EDI posts FY net profit of $181.5 million * FY total revenue and other income from ordinary activities $7.29 billion , up 6.4 percent ~BRIEF-Downer EDI says ‍offer for Spotless Group extended to 28 August 2017​ * ‍Offer for Spotless Group extended to 7pm on Monday, 28 august 2017​ Source text for Eikon: Further company coverage: ~BRIEF-Downer EDI says Spotless ‍offer extended to Aug 21, 2017​ * Spotless ‍offer extended to 7pm on monday, 21 august 2017​ Source text for Eikon: Further company coverage: ~BRIEF-Downer EDI's takeover offer for Spotless Group extended till 7pm (Sydney time) on Aug. 14 * Unconditional takeover offer for Spotless Group extended until 7:00pm (Sydney time) on Monday, 14 August Source text for Eikon: Further company coverage: (bangalore.newsroom@thomsonreuters.com) ~BRIEF-Downer extends takeover offer for Spotless Group * decided to extend Spotless offer period for one week; offer will now remain open for acceptance until 14 august Source text for Eikon: Further company coverage: ~BRIEF-Downer extends Spotless offer to August 7 2017 * ‍Downer has decided to extend offer for Spotless Group holdings to 7 pm on Monday, 7 august 2017​ Source text for Eikon: Further company coverage: ~BRIEF-Downer EDI's stake in Spotless increases to 80.3 pct * Downer's stake in Spotless increases to 80.3 pct Source text for Eikon: Further company coverage: ~BRIEF- Downer EDI Ltd'S stake in Spotless Group increases to 72% * As Downer's shareholding in Spotless is now over 70%, Downer expects that Spotless will be removed from certain S&P;/ASX market indices ~
DUK,REFILE-UPDATE 3-Duke Energy close to settling with US govt over coal ash spill Feb 18 Duke Energy Corp said it could reach a settlement with the U.S. government in the "next several days" over a federal grand jury probe into a coal ash spill in North Carolina's Dan River last February. ~Duke Energy close to settling with U.S. gov't over coal ash spill Duke Energy Corp said it could reach a settlement with the U.S. government in the "next several days" over a federal grand jury probe into a coal ash spill in North Carolina's Dan River last February. ~Duke Energy quarterly profit falls due to tax charge Feb 18 Duke Energy Corp, the largest U.S. power company by market value, reported an 86 percent fall in quarterly profit, hurt mainly by a tax charge to repatriate foreign earnings. ~
EBAY.O,Billionaire Carl Icahn added 446,000 eBay shares in 4th qtr NEW YORK, Feb 17 Billionaire activist Carl Icahn slightly boosted his exposure to  eBay Inc by roughly $25 million in the fourth quarter, according to a regulatory filing on Tuesday. ~
EOG,UPDATE 1-EOG Resources profit widely misses expectations; shares drop WILLISTON, N.D., Feb 18 Oil and natural gas producer EOG Resources Inc posted a quarterly profit far below Wall Street's expectations on Wednesday and slashed its 2015 budget, marking the latest energy giant to fall victim to plunging crude prices. ~EOG Resources profit drops on cheap crude, 2015 budget slashed WILLISTON, N.D., Feb 18 Oil and natural gas producer EOG Resources Inc said on Wednesday its quarterly profit fell 23 percent on falling crude oil prices, prompting the company to slash its 2015 budget. ~
XOM,UPDATE 3-California gasoline differentials spike after refinery explosion -traders SAN FRANCISCO, Feb 18 A crippling explosion at Exxon Mobil Corp's Torrance, California, refinery sent wholesale gasoline differentials in the Los Angeles market to their highest level since September 2013, according to Reuters data. ~Explosion at Exxon Mobil refinery in Torrance, California, injures four TORRANCE, Calif. An explosion and fire ripped through a gasoline processing unit at an Exxon Mobil refinery in Torrance, California, near Los Angeles on Wednesday, slightly injuring four workers and shattering windows of surrounding buildings, authorities said. ~Exxon Torrance refinery FCC shut, to remain down during probe -regulators NEW YORK Exxon Mobil Corp's fluid catalytic cracker at its refinery in Torrance, California, was shut down following an explosion Wednesday, and will remain down while investigators determine the cause, regulators said. ~UPDATE 5-Explosion at Exxon Mobil refinery in Torrance, Calif., injures 4 TORRANCE, Calif., Feb 18 An explosion and fire ripped through a gasoline processing unit at an Exxon Mobil  refinery in Torrance, California, near Los Angeles on Wednesday, slightly injuring four workers and shattering windows of surrounding buildings, authorities said. ~US STOCKS-Wall St ends nearly flat; Fed minutes support * Dow down 0.1 pct; S&P; 500 down 0.03 pct, Nasdaq up 0.1 pct   (Updates to close) ~US STOCKS-Wall St dips; briefly trims losses after Fed minutes * Dow down 0.2 pct; S&P; 500 down 0.2 pct, Nasdaq down 0.1 pct   (Updates to after Fed minutes) ~California gasoline differentials jump on refinery explosion  - traders NEW YORK, Feb 18 March-delivery CARBOB gasoline in the Los Angeles wholesale market jumped on news of a refinery fire at Exxon Mobil Corp.'s Torrance, California, plant on Wednesday morning, traders said. ~Schools told to 'shelter in place' after incident at Exxon Torrance refinery Students in about 30 schools were told to shelter in place after a possible incident at Exxon Mobil Corp's  Torrance, California, refinery on Wednesday, a report on the CBS Los Angeles news website said. ~Exxon's Torrance suffered structural damage - local media Feb 18 Exxon Mobil Corp's 149,500 barrels per day Torrance, California refinery suffered structural damage following a blast on Wednesday morning, local news network ABC7.com reported on its website. ~
GRMN.O,Garmin expects stronger dollar to slow growth Garmin Ltd , a maker of GPS-based gadgets, said a stronger dollar would slow revenue growth and forecast a profit below market estimates for the full year. ~UPDATE 2-Garmin expects stronger dollar to slow growth Feb 18 Garmin Ltd, a maker of GPS-based gadgets, said a stronger dollar would slow revenue growth and forecast a profit below market estimates for the full year. ~US STOCKS-Futures flat as Greece clarity sought; S&P; at record * Dow flat, S&P; down 1.25 pt, Nasdaq up 1.5 pt   (Updates prices, adds Garmin outlook) ~Navigation gear maker Garmin revenue rises 5.7 pct Feb 18 Garmin Ltd, a maker of GPS-based gadgets, reported a 5.7 percent rise in quarterly revenue, helped by strong sales of its fitness products. ~
GM,RPT-Weaker loonie no savior for ailing Canada auto sector, execs say TORONTO, Feb 17 A strong Canadian dollar has wounded the country's auto manufacturing sector over the last decade, but the currency's recent drop to a near six-year low is unlikely to spur a rush of new investment, say senior industry executives. ~UPDATE 1-Buffett's Berkshire builds Deere stake, dumps Exxon NEW YORK, Feb 17 Warren Buffett's Berkshire Hathaway Inc on Tuesday disclosed a 5 percent stake in agricultural equipment maker Deere & Co and said it shed a $3.74 billion investment in oil company Exxon Mobil Corp  as oil prices plunged. ~
GS,UPDATE 1-Citigroup to set aside $100 bln to fund green initiatives Feb 18 Citigroup Inc said it would set aside $100 billion to fund environmental projects over the next decade, doubling the amount it had earmarked for such projects in 2007. ~Citigroup to set aside $100 bln to fund green initiatives Feb 18 Citigroup Inc said it would set aside $100 billion to fund environmental projects over the next decade, doubling the amount it had earmarked for such projects in 2007. ~
INTC.O,Soros bet on Devon Energy, Transocean ahead of oil price rise NEW YORK, Feb 17 Soros Fund Management LLC took new positions in the energy sector in the fourth quarter, including stakes in Devon Energy Corp and Transocean Ltd , a regulatory filing showed Tuesday. ~
JPM,ON THE MOVE-J.P. Morgan Securities hires eight advisers since fall NEW YORK, Feb 18 J.P. Morgan Securities, JPMorgan Chase & Co's boutique wealth management business, said on Wednesday it hired eight advisers in the last six months who together managed $2 billion in assets at their old firms. ~Georgia's TBC Bank reports 28 pct rise in 2014 profit TBILISI, Feb 18 Georgia's TBC Bank, the country's largest retail bank, reported on Wednesday a 27.5 percent rise in its 2014 net profit to 158.5 million lari ($85 million). ~JPMorgan reviewing size of trading units: Bloomberg JPMorgan Chase & Co  is considering shrinking some of its trading businesses as it expects a new federal reserve proposal to make these businesses less profitable, Bloomberg reported. ~JPMorgan reviewing size of trading units - Bloomberg Feb 18 JPMorgan Chase & Co is considering shrinking some of its trading businesses as it expects a new federal reserve proposal to make these businesses less profitable, Bloomberg reported. ~
LM,MOVES-Legg Mason builds out ETF business with two hires Feb 18 Asset manager Legg Mason Inc hired mutual fund company Vanguard Group's executives, Rick Genoni and Brandon Clark, to boost its exchange-traded funds business. ~
LMT,Lockheed says technology investments cut cost of F-35 jets WASHINGTON Lockheed Martin Corp said a series of manufacturing changes and technology investments were already driving down the cost of the F-35 fighter jet, and the savings were set to triple in the ninth batch of jets to be produced. ~Lockheed says technology investments cut cost of F-35 jets WASHINGTON, Feb 18 Lockheed Martin Corp  said a series of manufacturing changes and technology investments were already driving down the cost of the F-35 fighter jet, and the savings were set to triple in the ninth batch of jets to be produced. ~Lockheed cites issue with F-35 software, no delay in Marine target combat use WASHINGTON Lockheed Martin Corp may need to update the 2B software needed for the F-35 fighter jet to deal with issues that arose during testing, but that should not delay the Marine Corp's plan to declare the jet ready for combat use in July, the head of the company's aeronautics division said Wednesday. ~Lockheed cites issue with F-35 software, no delay in Marine target combat use WASHINGTON, Feb 18 Lockheed Martin Corp  may need to update the 2B software needed for the F-35 fighter jet to deal with issues that arose during testing, but that should not delay the Marine Corp's plan to declare the jet ready for combat use in July, the head of the company's aeronautics division said Wednesday. ~
MRO,Marathon Oil slashes spending a 2nd time, says profit up Feb 18 Marathon Oil Corp on Wednesday cut its 2015 budget by another 20 percent to $3.5 billion and said its fourth-quarter profit rose, boosted by a gain related to the sale of oil and gas properties in Angola and Norway. ~
MAR.O,UPDATE 5-Hilton forecast disappoints, Marriott profit beats * Hilton expects 1st-qtr earnings/shr $0.10-$0.12 vs est. $0.15 ~
MDT,R&D;, sales untouched as Medtronic folds in Covidien: CEO Medtronic Plc  plans no cuts in research and development or its sales staff as the medical device maker begins the process of integrating its $49.9 billion acquisition of Covidien Plc, Chief Executive Omar Ishrak said on Tuesday. ~
MSFT.O,InterDigital loses another round in patent fight WASHINGTON, Feb 18 InterDigital Inc, a patent licensing firm, lost an infringement fight on Wednesday as a U.S. appeals court ruled that wireless phones made by Nokia, since purchased by Microsoft, and ZTE Corp  do not infringe on InterDigital patents. ~
SYY,Sysco hires lawyers for possible merger fight with regulator WASHINGTON Food distributing company Sysco Corp  has hired top Washington litigators to defend itself if U.S. regulators file a lawsuit to stop its merger with rival US Foods , two sources close to the deal said on Wednesday. ~Sysco hires lawers for possible merger fight with regulator WASHINGTON, Feb 18 Food distributing company Sysco Corp has hired top Washington litigators to defend itself if U.S. regulators file a lawsuit to stop its merger with rival US Foods, two sources close to the deal said on Wednesday. ~
KO,Ball Corp, Rexam deal likely this week - WSJ Feb 18 Beverage can maker Ball Corp is close to a deal to buy UK-based Rexam Plc this week, according to people familiar with the matter, the Wall Street Journal reported. ~Mexican Coke bottler Arca reports 23 pct jump in 4th-qtr profit MEXICO CITY, Feb 18 Arca Continental, Mexico's No. 2 Coca-Cola bottler, on Wednesday reported a 23 percent jump in fourth-quarter profit, as it charged more for its drinks and sales volume increased. ~Britain's FTSE stalls after touching 15-year peak * Greek deal hopes underpin financials   (Adds detail, updates prices) ~Britain's FTSE stalls after touching 15-year peak * Coca-Cola HBC falls away on Russia tensions   (Adds quotes, details) ~Coca-Cola HBC says cautious on Greece but not cutting investment ATHENS, Feb 18 Swiss based Coca-Cola HBC (CC HBC), the world's second-largest bottler of Coca-Cola drinks, is cautious on Greece due to the macroeconomic and political uncertainty in the country but is committed to investing in the country, its chief executive said on Wednesday. ~Coca-Cola HBC's Q4 profit down 11.4 pct, sees challenging year * Lowers target for 2013-2015 free cash flow to 1.1-1.2 bln eur ~BRIEF-Coca-Cola HBC sees 'challenging' year after Q4 profit falls * In q4, fx-neutral net sales revenue per unit case continued to improve, bringing full-year increase to 2.5% ~
HSY,Hershey plans to use simpler ingredients in products Feb 18 Hershey Co said it would start using simpler ingredients in its chocolate bars and kisses brands, the latest chocolate maker yielding to U.S. consumers' concerns about the quality and sourcing of food. ~
UPS,NYC and state sue UPS for illegally shipping cigarettes New York City and New York state sued United Parcel Service Inc. on Wednesday, seeking over $180 million in damages and penalties against the shipping company for allegedly delivering nearly 700,000 cartons of untaxed cigarettes across the state. ~UPDATE 1-NYC and state sue UPS for illegally shipping cigarettes NEW YORK, Feb 18 New York City and New York state sued United Parcel Service Inc. on Wednesday, seeking over $180 million in damages and penalties against the shipping company for allegedly delivering nearly 700,000 cartons of untaxed cigarettes across the state. ~NYC and state to sue UPS for illegally shipping cigarettes NEW YORK, Feb 18 New York city and state plan to sue United Parcel Service Inc. on Wednesday, seeking over $180 million in damages and penalties against the shipping company for allegedly delivering nearly 700,000 cartons of untaxed cigarettes across the state. ~
UTX,UPDATE 1-United Tech CEO eyes acquisitions internationally, at least $5 bln Feb 18 United Technologies Corp's chief executive officer said on Wednesday that he was interested in international deals that would use the company's "trapped cash" overseas, as the U.S. conglomerate focuses on exploring acquisition opportunities of at least $5 billion. ~United Tech CEO says seeks international deal to use "trapped cash" Feb 18 United Technologies Corp's chief executive said on Wednesday that he would "love to do" an international deal to use the company's "trapped cash" overseas, as the U.S. conglomerate focuses on exploring larger acquisition opportunities. ~
VZ,T-Mobile presses U.S. to change rules for sale of airwaves WASHINGTON T-Mobile's chief executive on Wednesday called the recent U.S. auction of airwaves "a disaster" for American consumers as he took aim at rules that allowed Dish Network Corp to partner with companies that may qualify for some $13 billion in discounts. ~T-Mobile presses U.S. to change rules for sale of airwaves WASHINGTON, Feb 18 T-Mobile's chief executive on Wednesday called the recent U.S. auction of airwaves "a disaster" for American consumers as he took aim at rules that allowed Dish Network Corp to partner with companies that may qualify for some $13 billion in discounts. ~
V,BRIEF-Visa calls for redemption all of its 1.200 pct notes due 2017 * Visa Inc - on Sept 11, co called for redemption all of $1.75 billion principal amount outstanding of its 1.200 pct notes due 2017‍​ - SEC filing ~BRIEF-Visa Inc files for three-part senior notes offering of up to $2.5 bln * Visa Inc says files for three-part senior notes offering of up to $2.5 billion - SEC filing‍​ ~Former BoE deputy Hogg to join Visa as Europe unit CEO Visa Inc, the world's largest payments processor, on Thursday named former Bank of England (BoE) deputy governor Charlotte Hogg as chief executive of its Europe division. ~CORRECTED-UPDATE 1-MOVES-Former BoE deputy Hogg to join Visa as Europe unit CEO Sept 7 Visa Inc, the world's largest payments processor, on Thursday named former Bank of England (BoE) deputy governor Charlotte Hogg as chief executive of its Europe division. ~MOVES-Visa names ex-BoE deputy Charlotte Hogg as Europe unit CEO Sept 7 Visa Inc, the world's largest payments processor, on Thursday named Charlotte Hogg as chief executive of its Europe division. ~BRIEF-Visa appoints Charlotte Hogg as CEO of European operations * Visa Inc appoints Charlotte Hogg as chief executive officer of the compan's European operations ~BRIEF-Visa Inc files prospectus supplement for potential three-part senior notes offering * Visa Inc files prospectus supplement for potential three-part senior notes offering; size not disclosed - sec filing‍​ Source text (http://bit.ly/2vLDrIe) Further company coverage: ~BRIEF-Visa enables on the go payments with the new Fitbit Ionic * Visa inc- ‍enabling visa payments on fitbit's smartwatch fitbit ionic​ ~BRIEF-Bridg raises $11 million in Series B funding * Bridg raises $11 million in Series B funding from Morpheus Ventures, March Capital, Visa and NextEquity ~
WU,TransferWise launches U.S. money transfer service, eyes more markets LONDON, Feb 18 British online money transfer business TransferWise launched its U.S. operation on Tuesday, the first step of an international expansion that will use $58 million in new backing to compete with the likes of Western Union and MoneyGram. ~
