AAPL.O,US STOCKS-Apple drags Wall St lower as S&P; 500 clings to gain for 2015 * Pep Boys down; Bridgestone pulls out and Icahn agrees to buy ~Apple to pay Italy 318 mln euros, sign tax deal - source Apple Inc will pay Italy's tax office 318 million euros ($348 million) to settle a dispute over allegations it failed to pay taxes for six years, a source with direct knowledge of the matter said on Wednesday. ~Apple to pay Italy 318 million euros, sign tax deal - source MILAN Apple Inc will pay Italy's tax office 318 million euros ($348 million) to settle a dispute over allegations it failed to pay taxes for six years, a source with direct knowledge of the matter said on Wednesday. ~UPDATE 3-Apple to pay Italy 318 mln euros, sign tax deal - source * Apple facing tax scrutiny in several countries   (Adds previous comment from Apple on taxes; recasts first paragraph) ~US STOCKS-Retreating crude, Apple drag Wall St lower * Indexes down: Dow 0.29 pct, S&P; 0.35 pct, Nasdaq 0.37 pct   (Updates to early afternoon) ~US STOCKS-Wall St lower as Brent retreats, Apple drags * Indexes down: Dow 0.18 pct, S&P; 0.25 pct, Nasdaq 0.32 pct   (Adds details, updates prices) ~Apple to pay Italy 318 mln euros, sign tax deal MILAN, Dec 30 U.S. tech giant Apple will pay the Italian tax office 318 million euros ($348 million) to settle a dispute and sign an accord early next year on how to manage its tax liabilities from 2015 onwards, a source close to the matter said on Wednesday. ~Italy tax office reaches deal with Apple MILAN Italy's tax office said on Wednesday it had reached a deal with U.S. tech giant Apple in a dispute over taxes but declined to comment on details of the settlement. ~
BLK,BlackRock sells Kuala Lumpur mall to Malaysia's Pavilion KUALA LUMPUR, Dec 30 BlackRock, the world's largest asset manager, said on Wednesday it has sold a luxury shopping mall in central Kuala Lumpur to Malaysia's Pavilion Real Estate Investment Trust (Pavilion REIT) for 160 million ringgit ($37.33 million). ~
DOW,BRIEF-Downer EDI says offer for Spotless Group now closed * Confirms that its offer for Spotless was not extended and has now closed. Source text for Eikon: Further company coverage: ~BRIEF-Downer EDI posts FY net profit of $181.5 million * FY total revenue and other income from ordinary activities $7.29 billion , up 6.4 percent ~BRIEF-Downer EDI says ‍offer for Spotless Group extended to 28 August 2017​ * ‍Offer for Spotless Group extended to 7pm on Monday, 28 august 2017​ Source text for Eikon: Further company coverage: ~BRIEF-Downer EDI says Spotless ‍offer extended to Aug 21, 2017​ * Spotless ‍offer extended to 7pm on monday, 21 august 2017​ Source text for Eikon: Further company coverage: ~BRIEF-Downer EDI's takeover offer for Spotless Group extended till 7pm (Sydney time) on Aug. 14 * Unconditional takeover offer for Spotless Group extended until 7:00pm (Sydney time) on Monday, 14 August Source text for Eikon: Further company coverage: (bangalore.newsroom@thomsonreuters.com) ~BRIEF-Downer extends takeover offer for Spotless Group * decided to extend Spotless offer period for one week; offer will now remain open for acceptance until 14 august Source text for Eikon: Further company coverage: ~BRIEF-Downer extends Spotless offer to August 7 2017 * ‍Downer has decided to extend offer for Spotless Group holdings to 7 pm on Monday, 7 august 2017​ Source text for Eikon: Further company coverage: ~BRIEF-Downer EDI's stake in Spotless increases to 80.3 pct * Downer's stake in Spotless increases to 80.3 pct Source text for Eikon: Further company coverage: ~BRIEF- Downer EDI Ltd'S stake in Spotless Group increases to 72% * As Downer's shareholding in Spotless is now over 70%, Downer expects that Spotless will be removed from certain S&P;/ASX market indices ~
FB.O,Facebook's Free Basics service suspended in Egypt CAIRO, Dec 30 A Facebook-sponsored  service that offers limited free Internet access was suspended in Egypt on Wednesday after a permit required from the government was not renewed, an official from the Telecommunications Ministry told Reuters. ~Facebook must face shareholder class actions over IPO NEW YORK A federal judge has certified two shareholder class actions accusing Facebook Inc of hiding concerns about its growth forecasts prior to the social media company's May 2012 initial public offering. | Video  ~Year's best U.S. global stock fund sees emerging markets rallying in 2016 NEW YORK The year's top-performing U.S.-listed global equities fund as rated by Morningstar sees Asian and emerging market stocks as undervalued and primed to outperform in 2016. ~UPDATE 1-Year's best U.S. global stock fund sees emerging markets rallying in 2016 NEW YORK, Dec 30 The year's top-performing U.S.-listed global equities fund as rated by Morningstar sees Asian and emerging market stocks as undervalued and primed to outperform in 2016. ~Year's best global stock fund sees emerging markets rallying in 2016 NEW YORK, Dec 30 The year's top-performing global equities fund as rated by Morningstar sees Asian and emerging market stocks as undervalued and primed to outperform in 2016. ~Facebook must face shareholder class actions over IPO NEW YORK A federal judge has certified two shareholder class actions accusing Facebook Inc of hiding concerns about its growth forecasts prior to the social media company's May 2012 initial public offering. ~Facebook lawsuit against fugitive's lawyers is thrown out NEW YORK A New York state appeals court on Tuesday threw out Facebook Inc's unusual malicious prosecution lawsuit against DLA Piper and two other law firms that have represented a fugitive who claimed a 50 percent stake in the social media company. ~UPDATE 1-Facebook must face shareholder class actions over IPO NEW YORK, Dec 29 A federal judge has certified two shareholder class actions accusing Facebook Inc of hiding concerns about its growth forecasts prior to the social media company's May 2012 initial public offering. ~
GE,GE separates renewable energy from power unit Dec 30 General Electric Co said it would separate its renewable energy business from its power unit, following the acquisition of Alstom's energy business. ~
LMT,Lockheed wins more than $1 billion contract for C-130J aircraft Dec 30 Lockheed Martin Corp has been awarded a contract worth more than $1 billion for 32 C-130J aircraft, the Pentagon said on Wednesday. ~
V,BRIEF-Visa calls for redemption all of its 1.200 pct notes due 2017 * Visa Inc - on Sept 11, co called for redemption all of $1.75 billion principal amount outstanding of its 1.200 pct notes due 2017‍​ - SEC filing ~BRIEF-Visa Inc files for three-part senior notes offering of up to $2.5 bln * Visa Inc says files for three-part senior notes offering of up to $2.5 billion - SEC filing‍​ ~Former BoE deputy Hogg to join Visa as Europe unit CEO Visa Inc, the world's largest payments processor, on Thursday named former Bank of England (BoE) deputy governor Charlotte Hogg as chief executive of its Europe division. ~CORRECTED-UPDATE 1-MOVES-Former BoE deputy Hogg to join Visa as Europe unit CEO Sept 7 Visa Inc, the world's largest payments processor, on Thursday named former Bank of England (BoE) deputy governor Charlotte Hogg as chief executive of its Europe division. ~MOVES-Visa names ex-BoE deputy Charlotte Hogg as Europe unit CEO Sept 7 Visa Inc, the world's largest payments processor, on Thursday named Charlotte Hogg as chief executive of its Europe division. ~BRIEF-Visa appoints Charlotte Hogg as CEO of European operations * Visa Inc appoints Charlotte Hogg as chief executive officer of the compan's European operations ~BRIEF-Visa Inc files prospectus supplement for potential three-part senior notes offering * Visa Inc files prospectus supplement for potential three-part senior notes offering; size not disclosed - sec filing‍​ Source text (http://bit.ly/2vLDrIe) Further company coverage: ~BRIEF-Visa enables on the go payments with the new Fitbit Ionic * Visa inc- ‍enabling visa payments on fitbit's smartwatch fitbit ionic​ ~BRIEF-Bridg raises $11 million in Series B funding * Bridg raises $11 million in Series B funding from Morpheus Ventures, March Capital, Visa and NextEquity ~
