ANTM.N,Anthem offers free identity-theft protection after breach Feb 11 Anthem Inc said on Wednesday its millions of customers can sign up for free credit monitoring and identity-theft protection services this week following a massive cyber attack involving stolen U.S. Social Security numbers, birth dates and sensitive health information. ~U.S. states say Anthem too slow to inform customers of breach BOSTON Ten U.S. states have sent a letter to Anthem Inc complaining that the company has been too slow in notifying consumers that they were victims of a massive data breach disclosed last week. ~UPDATE 2-U.S. states say Anthem too slow to inform customers of breach BOSTON, Feb 10 Ten U.S. states have sent a letter to Anthem Inc complaining that the company has been too slow in notifying consumers that they were victims of a massive data breach disclosed last week. ~
AAPL.O,US STOCKS-Wall St ends flat while investors await Greece, Ukraine news * Indexes: Dow off 0.04 pct, S&P; flat, Nasdaq up 0.28 pct   (Updates to late afternoon, adds commentary) ~Icahn values Apple at more than $1 trillion Activist investor and major Apple Inc shareholder Carl Icahn said the iPhone maker's stock should be trading at $216, far above its record high of $124.92 hit on Wednesday. ~UPDATE 1-Icahn values Apple at more than $1 trillion Feb 11 Activist investor and major Apple Inc  shareholder Carl Icahn said the iPhone maker's stock should be trading at $216, far above its record high of $124.92 hit on Wednesday. ~US STOCKS SNAPSHOT-Wall St ends near flat; Apple gains late NEW YORK, Feb 11 U.S. stocks closed flat on Wednesday as concern about Greece and Ukraine was offset by gains in shares of Apple. ~Icahn values Apple at more than $1 trillion Feb 11 Activist investor Carl Icahn said Apple Inc's stock should be trading at $216, far above its record high of $124.92 hit on Wednesday. ~US STOCKS-Wall St flat before Greek deal talks; Apple lifts Nasdaq * Indexes: Dow off 0.23 pct, S&P; off 0.01 pct, Nasdaq up 0.39 pct   (Updates to late morning, updates earnings data) ~US STOCKS-Wall St little changed ahead of Greek deal talks * Indexes off: Dow off 0.28 pct, S&P; 0.07 pct, Nasdaq up 0.21 pct   (Updates to market open) ~US STOCKS-Wall St set for flat open; Greek deal talks on tap * Futures: Dow down 30 pts, S&P; off 1.5 pts, Nasdaq up 2 pts   (Adds quote, updates prices) ~US STOCKS-Futures little changed ahead of Greek debt talks NEW YORK, Feb 11 U.S. stock index futures were little changed on Wednesday, after the S&P; 500 climbed to its highest level of the year and ahead of a meeting of euro zone finance ministers to discuss plans for Greece's debt. ~
AMAT.O,UPDATE 2-Applied Materials hurt by low demand for chipmaking machinery Feb 11 Applied Materials Inc said new orders in its business that makes semiconductor equipment and made-to-order chips fell in the first quarter due to weak demand from foundry customers. ~Applied Materials revenue rises 7.7 pct Feb 11 Chip-equipment maker Applied Materials Inc reported a 7.7 percent rise in quarterly revenue as contract chip manufacturers spent more on technology used to make smartphone and memory chips. ~
BAC,BofA's U.S. banking unit helped fund tax-minimization trades-WSJ Feb 11 Bank of America Corp used its government-backed U.S. banking unit for years to finance controversial trades that helped clients avoid taxes, the Wall Street Journal reported, citing internal documents and people familiar with the matter. ~BRIEF-Bank of America's U.S. deposit-taking unit financed tax trades -WSJ * Federally insured U.S. banking unit financed tax trades for hedge funds, others, Wall Street Journal says ~
BLK,BlackRock president Kapito predicts stocks will still go up Feb 11 BlackRock President Rob Kapito said on Wednesday that he is still bullish on equities despite the current high valuations in the market. ~
BA,Boeing to send more 737 MAX, 777X work to South Carolina plant NORTH CHARLESTON, S.C. Boeing Co  will send more work to a new aircraft component plant in South Carolina than it had previously announced, company executives said on Wednesday, as the planemaker seeks to reduce labor costs. ~Boeing to send more 737 MAX, 777X work to S. Carolina plant NORTH CHARLESTON, S.C., Feb 11 Boeing Co  will send more work to a new aircraft component plant in South Carolina than it had previously announced, company executives said on Wednesday, as the planemaker seeks to reduce labor costs. ~Boeing revamps defense, space unit to tighten programs WASHINGTON Boeing Co on Wednesday announced a major restructuring of its defense and space business to tighten oversight of the troubled $52 billion KC-46A aerial tanker and other key development programs, cut costs and keep programs on schedule. ~Boeing revamps defense, space unit to tighten programs WASHINGTON, Feb 11 Boeing Co on Wednesday announced a major restructuring of its defense and space business to tighten oversight of the troubled $52 billion KC-46A aerial tanker and other key development programs, cut costs and keep programs on schedule. ~American Airlines says to fly Dreamliner from Dallas to Beijing, Buenos Aires Feb 11 American Airlines Group Inc said Wednesday that it will launch newly acquired Boeing Co  787 Dreamliners into service to Beijing, China, and Buenos Aires, Argentina, from its Dallas hub beginning on June 2 and June 4, respectively. ~
CSCO.O,UPDATE 3-Robust switching sales power strong quarter for Cisco * Shares rise 5.6 pct in extended trading   (Adds analyst comments) ~Cisco revenue rises 7 pct on higher demand for switches, routers Feb 11 Network equipment maker Cisco Systems Inc CSCO.O reported a 7 percent rise in quarterly revenue, helped by higher demand for switching equipment and routers. ~
C,MOVES-Citigroup hires Swann as technology head for cards, payments businesses Feb 11 Citigroup Inc hired Matt Swann to be head of technology for its global cards and payments businesses, a Citigroup spokeswoman said on Wednesday. ~MOVES-Rahman to head corporate finance Sub-Sahara Africa at Citi LONDON, Feb 11 (IFR) - Citigroup has appointed Aziz Rahman as head of corporate finance for Sub-Saharan Africa. Subject to work permit approvals in South Africa, he will take up the role on April 1, reporting to head of Africa banking Amin Manekia. ~
DOW,BRIEF-Downer EDI says offer for Spotless Group now closed * Confirms that its offer for Spotless was not extended and has now closed. Source text for Eikon: Further company coverage: ~BRIEF-Downer EDI posts FY net profit of $181.5 million * FY total revenue and other income from ordinary activities $7.29 billion , up 6.4 percent ~BRIEF-Downer EDI says ‍offer for Spotless Group extended to 28 August 2017​ * ‍Offer for Spotless Group extended to 7pm on Monday, 28 august 2017​ Source text for Eikon: Further company coverage: ~BRIEF-Downer EDI says Spotless ‍offer extended to Aug 21, 2017​ * Spotless ‍offer extended to 7pm on monday, 21 august 2017​ Source text for Eikon: Further company coverage: ~BRIEF-Downer EDI's takeover offer for Spotless Group extended till 7pm (Sydney time) on Aug. 14 * Unconditional takeover offer for Spotless Group extended until 7:00pm (Sydney time) on Monday, 14 August Source text for Eikon: Further company coverage: (bangalore.newsroom@thomsonreuters.com) ~BRIEF-Downer extends takeover offer for Spotless Group * decided to extend Spotless offer period for one week; offer will now remain open for acceptance until 14 august Source text for Eikon: Further company coverage: ~BRIEF-Downer extends Spotless offer to August 7 2017 * ‍Downer has decided to extend offer for Spotless Group holdings to 7 pm on Monday, 7 august 2017​ Source text for Eikon: Further company coverage: ~BRIEF-Downer EDI's stake in Spotless increases to 80.3 pct * Downer's stake in Spotless increases to 80.3 pct Source text for Eikon: Further company coverage: ~BRIEF- Downer EDI Ltd'S stake in Spotless Group increases to 72% * As Downer's shareholding in Spotless is now over 70%, Downer expects that Spotless will be removed from certain S&P;/ASX market indices ~
GE,UPDATE 1-General Electric to allow shareholders to nominate directors WASHINGTON, Feb 11 General Electric Co  will allow shareholders to nominate their own corporate directors, becoming one of the few companies to adopt proxy access reforms in a move that could pave the way for others. ~General Electric to allow shareholders to nominate directors WASHINGTON, Feb 11 General Electric Co.  changed its bylaws earlier this month to create an easier path for shareholders to nominate directors to its corporate board, the company disclosed in a filing on Wednesday. ~
GM,UPDATE 3-Venezuela bonds tumble as investors spurn new forex system CARACAS/NEW YORK, Feb 11 Venezuela's dollar-denominated bonds tumbled on Wednesday after the government announced a new foreign exchange platform that was seen as insufficient to resolve an economic crisis and ease fears of a possible bond default. ~
GS,MOVES-Goldman names Gordon investment banking services chairman -memo NEW YORK, Feb 11 Goldman Sachs Group Inc  promoted media and telecommunications banker Andry Gordon to become global chairman of investment banking services, according to an internal memo  sent to investment banking staff on Wednesday. ~MOVES-Goldman names duo private equity advisory global co-heads Feb 11 Goldman Sachs Group Inc on Wednesday named Alison Mass and Alasdair Warren global co-heads of its financial sponsors group, which advises private equity firms on their deals, according to an internal memo. ~
JNJ,J&J; drops bid to probe plaintiff solicitation in mesh cases NEW YORK Johnson & Johnson dropped its request to investigate the source of what it said were illegal phone calls that may have resulted in baseless lawsuits over transvaginal mesh devices against its Ethicon Inc subsidiary. ~UPDATE 1-J&J; drops bid to probe plaintiff solicitation in mesh cases NEW YORK, Feb 11 Johnson & Johnson  dropped its request to investigate the source of what it said were illegal phone calls that may have resulted in baseless lawsuits over transvaginal mesh devices against its Ethicon Inc subsidiary. ~J&J; drops bid to probe plaintiff solicitation in mesh cases NEW YORK, Feb 11 Johnson & Johnson has dropped its request to investigate the source of what it said were illegal phone calls that may have resulted in baseless lawsuits over transvaginal mesh devices against its Ethicon Inc subsidiary. ~
K,DIARY-U.S. MEETINGS/WEEK AHEAD Thomson Reuters Feb 11, 2015 - Corporate Meetings for US companies for Week ahead.         S&P; 500 Earnings - MONTH AHEAD     Dividends                            Non S&P; 500 - Weekly             Federal Reserve events               ConferenceCall/Webcast - Weekly  Meetings - Weekly                                Xtra users can see more details on conference calls & webcasts by hovering your mouse  over the RIC, right click, now click on Related Co Data, now click on Co Events.                   ~
MET,UPDATE 1-MetLife's profit beats estimates on investment gains Feb 11 United State's largest life insurer MetLife Inc reported a better-than-expected quarterly profit due to gains from investments and derivatives, reflecting falling interest rates and a rising dollar. ~MetLife's quarterly profit rises 70 percent Feb 11 Largest U.S. life insurer MetLife Inc's  quarterly profit jumped about 70 percent, helped by gains from investments and derivatives. ~
MDLZ.O,UPDATE 2-Mondelez beats profit forecast, sees higher margin in 2015 Feb 11 Mondelez International Inc, the maker of Cadbury chocolate and Oreo cookies, reported a better-than-expected adjusted quarterly profit and said it expects cost cuts to boost its full-year adjusted operating margin in 2015. ~Mondelez profit falls 72 pct as sales fall in all regions Feb 11 Mondelez International Inc, the maker of Cadbury chocolate and Oreo cookies, reported a near 72 percent fall in quarterly profit as sales across all key markets fell. ~
MS,Morgan Stanley hires David Bokman for new wealth post NEW YORK David Bokman, a trusts and estates lawyer who most recently served as chief advisory officer of GenSpring Family Offices in Atlanta, has joined Morgan Stanley Wealth Management in a newly created role running "ultra high net worth resources" in its Private Wealth Management unit. ~CORRECTED-ON THE MOVE-Morgan Stanley hires David Bokman for new wealth post NEW YORK, Feb 11 David Bokman, a trusts and estates lawyer who most recently served as chief advisory officer of GenSpring Family Offices in Atlanta, has joined Morgan Stanley Wealth Management in a newly created role running "ultra high net worth resources" in its Private Wealth Management unit. ~ON THE MOVE-Merrill Lynch gets billion-dollar broker from Morgan Stanley NEW YORK, Feb 11 Following the high-profile move of a top team of Bank of America Merrill Lynch brokers to rival Morgan Stanley last month, Merrill Lynch bounced back on Wednesday with the announcement it hired a nine-broker team away from Morgan Stanley that managed more than $1 billion in assets. ~
NVDA.O,UPDATE 2-Nvidia's fiscal 4th-quarter results beat estimates, stock rises SAN FRANCISCO, Feb 11 Nvidia Corp on Wednesday posted higher quarterly results that beat Wall Street expectations, sending its shares higher as the graphics chipmaker sought to sharpen its focus on high-end automobiles. ~Nvidia's fiscal 4th-quarter revenue beats estimates SAN FRANCISCO, Feb 11 Nvidia Corp on Wednesday posted higher fiscal fourth-quarter revenue that beat Wall Street's expectations as the graphics chipmaker increased its focus on high-end automobiles. ~
PEP,US STOCKS-Wall St dips as investors eye Greece and Ukraine talks * Indexes: Dow off 0.37 pct, S&P; off 0.28 pct, Nasdaq up 0.1 pct   (Updates to late afternoon, adds commentary) ~US STOCKS-Wall St dips as investors eye Greece and Ukraine talks * Indexes down: Dow 0.55 pct, S&P; 0.45 pct, Nasdaq 0.08   (Updates to afternoon, adds commentary) ~PepsiCo profit beats estimates; $12 billion buyback planned PepsiCo Inc  on Wednesday reported a higher-than-expected quarterly  profit, helped by increased sales at its Frito-Lay snack business, and said it would buy back up to $12 billion in stock by 2018. | Video  ~US STOCKS-Wall St flat before Greek deal talks; Apple lifts Nasdaq * Indexes: Dow off 0.23 pct, S&P; off 0.01 pct, Nasdaq up 0.39 pct   (Updates to late morning, updates earnings data) ~UPDATE 3-PepsiCo profit beats estimates; $12 billion buyback planned Feb 11 PepsiCo Inc on Wednesday reported a higher-than-expected quarterly  profit, helped by increased sales at its Frito-Lay snack business, and said it would buy back up to $12 billion in stock by 2018. ~US STOCKS-Wall St little changed ahead of Greek deal talks * Indexes off: Dow off 0.28 pct, S&P; 0.07 pct, Nasdaq up 0.21 pct   (Updates to market open) ~US STOCKS-Wall St set for flat open; Greek deal talks on tap * Futures: Dow down 30 pts, S&P; off 1.5 pts, Nasdaq up 2 pts   (Adds quote, updates prices) ~US STOCKS-Futures little changed ahead of Greek debt talks NEW YORK, Feb 11 U.S. stock index futures were little changed on Wednesday, after the S&P; 500 climbed to its highest level of the year and ahead of a meeting of euro zone finance ministers to discuss plans for Greece's debt. ~PepsiCo quarterly revenue falls 1 pct Feb 11 PepsiCo Inc, the maker of Mountain Dew and Tropicana beverages, reported a 1 percent fall in quarterly revenue as a stronger dollar hurt revenue from international markets. ~
PG,UPDATE 3-Venezuela bonds tumble as investors spurn new forex system CARACAS/NEW YORK, Feb 11 Venezuela's dollar-denominated bonds tumbled on Wednesday after the government announced a new foreign exchange platform that was seen as insufficient to resolve an economic crisis and ease fears of a possible bond default. ~UPDATE 4-Venezuela creates new 'free' currency system, devaluation seen CARACAS, Feb 10 Venezuela launched a "free" foreign exchange platform on Tuesday that will likely devalue the bolivar in efforts to bolster state coffers amid tumbling oil revenue, although it risks causing a spike in already soaring inflation. ~
BK,MOVES- Pimco, Citigroup, BNY Mellon, Societe Generale, Goldman Sachs Feb 11 The following financial services industry appointments were announced on Wednesday. To inform us of other job changes, email moves@thomsonreuters.com. ~MOVES-BNY Mellon names new senior wealth director Feb 11 Bank of New York Mellon Corp named Judy Barton as a senior wealth director for business development in its Dallas office. ~
HSY,YOUR MONEY-Is organic chocolate worth the price? Feb 11 If you plunk down some big bucks for organic chocolate this Valentine's Day, your sweetie may or may not be impressed. ~
MOS,Mosaic profit nearly triples on strong fertilizer demand U.S. fertilizer company Mosaic Co's  fourth-quarter profit nearly tripled, helped by strong demand for phosphates and potash. ~Mosaic quarterly profit nearly triples Feb 11 U.S. fertilizer company Mosaic Co  said on Wednesday its quarterly profit nearly tripled, helped by a gain of 10 cents per share and strong demand for phosphates and potash. ~
TMO,Strong dollar, low oil remain net positives -Fed's Fisher NEW YORK, Feb 11 Short-term currency moves should not drive the Federal Reserve's policy decisions and, for now, the strong dollar and low global oil prices are a net positive for the U.S. economy, Dallas Fed President Richard Fisher said on Wednesday. ~
TWX,UPDATE 2-Time Warner profit beats as revenue rises in Turner, HBO units Feb 11 Time Warner Inc reported a better-than-expected quarterly profit, helped by higher subscription fees for channels under its Turner Broadcasting and HBO units. ~Time Warner profit falls 27 pct on weak studio revenue Feb 11 Time Warner Inc reported a 27 percent fall in quarterly profit, hurt by a decline in revenue in its Warner Bros movie studio business. ~
TRIP.O,UPDATE 1-Higher advertising, subscription revenue boosts TripAdvisor Feb 11 Travel review website operator TripAdvisor Inc reported better-than-expected quarterly revenue as the company earned more from click-based advertising and subscriptions. ~TripAdvisor's quarterly profit jumps 80 pct Feb 11 Travel review website operator TripAdvisor Inc reported an 80 percent jump in quarterly profit, driven by higher advertising and subscription revenue. ~
V,BRIEF-Visa calls for redemption all of its 1.200 pct notes due 2017 * Visa Inc - on Sept 11, co called for redemption all of $1.75 billion principal amount outstanding of its 1.200 pct notes due 2017‍​ - SEC filing ~BRIEF-Visa Inc files for three-part senior notes offering of up to $2.5 bln * Visa Inc says files for three-part senior notes offering of up to $2.5 billion - SEC filing‍​ ~Former BoE deputy Hogg to join Visa as Europe unit CEO Visa Inc, the world's largest payments processor, on Thursday named former Bank of England (BoE) deputy governor Charlotte Hogg as chief executive of its Europe division. ~CORRECTED-UPDATE 1-MOVES-Former BoE deputy Hogg to join Visa as Europe unit CEO Sept 7 Visa Inc, the world's largest payments processor, on Thursday named former Bank of England (BoE) deputy governor Charlotte Hogg as chief executive of its Europe division. ~MOVES-Visa names ex-BoE deputy Charlotte Hogg as Europe unit CEO Sept 7 Visa Inc, the world's largest payments processor, on Thursday named Charlotte Hogg as chief executive of its Europe division. ~BRIEF-Visa appoints Charlotte Hogg as CEO of European operations * Visa Inc appoints Charlotte Hogg as chief executive officer of the compan's European operations ~BRIEF-Visa Inc files prospectus supplement for potential three-part senior notes offering * Visa Inc files prospectus supplement for potential three-part senior notes offering; size not disclosed - sec filing‍​ Source text (http://bit.ly/2vLDrIe) Further company coverage: ~BRIEF-Visa enables on the go payments with the new Fitbit Ionic * Visa inc- ‍enabling visa payments on fitbit's smartwatch fitbit ionic​ ~BRIEF-Bridg raises $11 million in Series B funding * Bridg raises $11 million in Series B funding from Morpheus Ventures, March Capital, Visa and NextEquity ~
WMT,Wal-Mart says to invest $269 million in Canada Wal-Mart Stores Inc  said it would invest about C$340 million ($269 million) this fiscal year to expand in Canada, lower than what it had budgeted for last year. ~UPDATE 1-Wal-Mart says to invest C$340 mln in Canada Feb 11 Wal-Mart Stores Inc said it would invest about C$340 million ($269.16 million) this fiscal year to expand in Canada, lower than what it had budgeted for last year. ~Wal-Mart says to invest C$340 mln in Canada Feb 11 Wal-Mart Stores Inc said it would invest about C$340 million ($269.16 million) to boost its presence in Canada this fiscal year. ~
