AET,Health insurer Aetna's medical costs are low, boosting profit Aetna Inc , the third-largest U.S. health insurer, on Tuesday reported first-quarter profit that beat analyst expectations and said spending on medical claims in the first quarter remained low. ~UPDATE 2-Health insurer Aetna's medical costs are low, boosting profit April 28 Aetna Inc, the third-largest U.S. health insurer, on Tuesday reported first-quarter profit that beat analyst expectations and said spending on medical claims in the first quarter remained low. ~Health insurer Aetna's profit rises as it adds more members April 28 Aetna Inc, the third-largest U.S. health insurer,  reported a 16.8 percent rise in first-quarter profit as it added 122,000 more members compared with the fourth quarter. ~
AKAM.O,UPDATE 1- Strong dollar hurts Akamai's profit forecast, shares fall April 28 Akamai Technologies Inc, whose service helps speed up delivery of online content, forecast current-quarter profit below analysts' expectations, citing a stronger dollar. ~Akamai's quarterly revenue rises 16 pct April 28 Akamai Technologies Inc, whose service helps speed up delivery of online content, reported a 16 percent rise in quarterly revenue, helped by higher demand for its media and security products. ~
ALB,DIARY-U.S. MEETINGS/WEEK AHEAD Thomson Reuters April 28, 2015 - Corporate Meetings for US companies for Week ahead.         S&P; 500 Earnings - MONTH AHEAD     Dividends                            Non S&P; 500 - Weekly             Federal Reserve events               ConferenceCall/Webcast - Weekly  Meetings - Weekly                                Xtra users can see more details on conference calls & webcasts by hovering your mouse  over the RIC, right click, no click on Related Co Data, now click on Co Events.                  ~
AAPL.O,U.S. shares rebound; oil pares gains after Iran ship seizure NEW YORK Two of three major U.S. stock indexes rose modestly on Tuesday as Merck posted strong earnings and IBM raised its dividend, while European stocks slid on weak corporate results and oil prices were flat to lower on expectations that U.S. crude stockpiles have reached record highs. ~Dow, S&P; 500 end up with Merck, IBM; Nasdaq slips with Apple The Dow and S&P; 500 ended a volatile session higher on Tuesday, helped by strong earnings from Merck and gains in IBM after it boosted its dividend, while the Nasdaq fell with Apple. ~US STOCKS-Dow, S&P; 500 end up with Merck, IBM; Nasdaq slips with Apple * Dow up 0.4 pct, S&P; up 0.28 pct, Nasdaq down 0.1 pct   (Updates to close) ~US STOCKS SNAPSHOT-Dow, S&P; 500 end higher; Nasdaq down with Apple NEW YORK, April 28 The Dow and S&P; 500 ended a volatile session higher on Tuesday, helped by strong earnings from Merck and gains in IBM after it boosted its dividend, while the Nasdaq fell with Apple. ~US STOCKS-Wall St edges up with Merck, IBM; Nasdaq slips with Apple * Dow up 0.3 pct, S&P; up 0.2 pct, Nasdaq down 0.04 pct   (Updates to late afternoon) ~U.S. 1st qtr earnings on track for slight gain NEW YORK, April 28 U.S. earnings are on track to post a slight gain for the first quarter following stronger-than-expected results from companies like Apple , reversing forecasts for the first quarterly profit decline since 2009. ~US STOCKS-Wall St moves higher after erratic early trading * Indexes up: Dow 0.4 pct, S&P; 0.3 pct, Nasdaq 0.2 pct   (Updates to early afternoon, changes comment) ~Apple's blockbuster quarter eases doubts about growth Apple Inc's  blowout second quarter, coming after record iPhone sales in the holiday shopping season, laid to rest doubts that the company could sustain its scorching pace of growth. | Video  ~Icahn says Apple still undervalued Apple Inc  remains undervalued and misunderstood, activist investor Carl Icahn tweeted, even as the company posted stellar quarterly results on Monday. | Video  ~
AMAT.O,Tokyo Electron shares sink after takeover by Applied Materials scrapped TOKYO, April 28 Tokyo Electron Ltd  shares plunged 15 percent on Tuesday to a six-month low after U.S. regulatory opposition forced the scrapping of its planned takeover by U.S.-based Applied Materials Inc. ~
BLL,DIARY-U.S. MEETINGS/WEEK AHEAD Thomson Reuters April 28, 2015 - Corporate Meetings for US companies for Week ahead.         S&P; 500 Earnings - MONTH AHEAD     Dividends                            Non S&P; 500 - Weekly             Federal Reserve events               ConferenceCall/Webcast - Weekly  Meetings - Weekly                                Xtra users can see more details on conference calls & webcasts by hovering your mouse  over the RIC, right click, no click on Related Co Data, now click on Co Events.                  ~
BAC,UPDATE 2-SEC investigates customer protection violation by Bank of America-WSJ April 28 The U.S. Securities and Exchange Commission is investigating whether Bank of America Corp  violated customer-protection rules and put retail-brokerage funds at risk to increase profits, the Wall Street Journal reported, citing people familiar with the matter. ~SEC investigates customer protection violation by Bank of America-WSJ April 28 The Securities and Exchange Commission is investigating whether Bank of America Corp violated customer-protection rules and put retail-brokerage funds at risk to increase profits, the Wall Street Journal reported, citing people familiar with the matter. ~
BA,Boeing looks to car industry expert for jet production savings Boeing  plans to use newer and more standardised  manufacturing techniques for its new 777X jetliner, paving the way for "significant" savings as it gradually feeds the changes back into existing assembly lines, a senior executive said. ~
BSX,Boston Scientific reaches first transvaginal mesh settlement Boston Scientific Corp on Tuesday said it reached its first settlement agreement to resolve a portion of the legal claims it faces involving its transvaginal mesh product to treat urinary incontinence. ~UPDATE 1-Boston Scientific reaches first transvaginal mesh settlement April 28 Boston Scientific Corp on Tuesday said it reached its first settlement agreement to resolve a portion of the legal claims it faces involving its transvaginal mesh product to treat urinary incontinence. ~Boston Scientific says to settle some transvaginal mesh cases April 28 Boston Scientific Corp on Tuesday said it has reached an agreement to settle a portion of the legal claims it faces involving its transvaginal mesh product to treat urinary incontinence. ~Boston Scientific says reaches conditional settlement in some transvaginal mesh cases April 28 Boston scientific says it reached conditional agreement to settle some transvaginal mesh cases Boston scientific says it will pay about $119 million to resolve 2,970 cases Boston scientific says it increased its product liability reserves for transvaginal mesh litigation Boston scientific says reserves cover known and estimated future cases   (Reporting by Susan Kelly in Chicago) ~UPDATE 1-Boston Scientific cuts full-year forecast as legal costs weigh April 28 Medical device maker Boston Scientific Corp cut its full-year revenue and profit forecasts as it continues to bear the brunt of charges from a number of lawsuits. ~Boston Scientific posts loss on litigation costs April 28 Medical device maker Boston Scientific Corp reported a quarterly net loss due to one-time charges, including litigation costs of $193 million. ~
BMY,Strong Merck cancer drug sales upstage rival Bristol-Myers Investors betting that Bristol-Myers Squibb will emerge as the leading player in a hot new class of cancer drugs hit the pause button on Tuesday as a rival therapy from Merck & Co showed much higher sales. ~UPDATE 1-FDA approves generic versions of antipsychotic drug Abilify April 28 The U.S. Food and Drug Administration said it approved the first copycat versions of Otsuka Pharmaceutical Co Ltd's antipsychotic drug, Abilify. ~High-profile Bristol cancer drug disappoints, shares off Bristol-Myers Squibb Co  on Tuesday reported first-quarter sales of its new cancer immunotherapy Opdivo that were about half of those for a rival medicine from Merck & Co , and its shares fell 2 percent. ~UPDATE 2-High-profile Bristol cancer drug disappoints, shares off April 28 Bristol-Myers Squibb Co on Tuesday reported first-quarter sales of its new cancer immunotherapy Opdivo that were about half of those for a rival medicine from Merck & Co, and its shares fell 2 percent. ~DIARY-U.S. MEETINGS/WEEK AHEAD Thomson Reuters April 28, 2015 - Corporate Meetings for US companies for Week ahead.         S&P; 500 Earnings - MONTH AHEAD     Dividends                            Non S&P; 500 - Weekly             Federal Reserve events               ConferenceCall/Webcast - Weekly  Meetings - Weekly                                Xtra users can see more details on conference calls & webcasts by hovering your mouse  over the RIC, right click, no click on Related Co Data, now click on Co Events.                  ~Bristol-Myers tops forecasts, helped by Abilify royalty adjustment April 28 Bristol-Myers Squibb Co  reported better than expected quarterly results, helped by cost cuts and a higher estimate of royalties owed the company from sales of its Abilify schizophrenia treatment. ~
CNC,DIARY-U.S. MEETINGS/WEEK AHEAD Thomson Reuters April 28, 2015 - Corporate Meetings for US companies for Week ahead.         S&P; 500 Earnings - MONTH AHEAD     Dividends                            Non S&P; 500 - Weekly             Federal Reserve events               ConferenceCall/Webcast - Weekly  Meetings - Weekly                                Xtra users can see more details on conference calls & webcasts by hovering your mouse  over the RIC, right click, no click on Related Co Data, now click on Co Events.                  ~
CVX,DIARY-U.S. MEETINGS/WEEK AHEAD Thomson Reuters April 28, 2015 - Corporate Meetings for US companies for Week ahead.         S&P; 500 Earnings - MONTH AHEAD     Dividends                            Non S&P; 500 - Weekly             Federal Reserve events               ConferenceCall/Webcast - Weekly  Meetings - Weekly                                Xtra users can see more details on conference calls & webcasts by hovering your mouse  over the RIC, right click, no click on Related Co Data, now click on Co Events.                  ~
CB,DIARY-U.S. MEETINGS/WEEK AHEAD Thomson Reuters April 28, 2015 - Corporate Meetings for US companies for Week ahead.         S&P; 500 Earnings - MONTH AHEAD     Dividends                            Non S&P; 500 - Weekly             Federal Reserve events               ConferenceCall/Webcast - Weekly  Meetings - Weekly                                Xtra users can see more details on conference calls & webcasts by hovering your mouse  over the RIC, right click, no click on Related Co Data, now click on Co Events.                  ~
C,UPDATE 1-Citigroup leaders win shareholder support as stock lags NEW YORK, April 28 Citigroup Inc  shareholders re-elected directors and overwhelmingly sided with the board on proposals at their annual meeting on Tuesday even as their stock traded for less than the company thinks it is worth. ~Citigroup shareholders endorse executive pay NEW YORK, April 28 Citigroup Inc  shareholders overwhelmingly approved a resolution endorsing the company's executive pay for this past year at the company's annual meeting on Tuesday. ~
CMS,DIARY-U.S. MEETINGS/WEEK AHEAD Thomson Reuters April 28, 2015 - Corporate Meetings for US companies for Week ahead.         S&P; 500 Earnings - MONTH AHEAD     Dividends                            Non S&P; 500 - Weekly             Federal Reserve events               ConferenceCall/Webcast - Weekly  Meetings - Weekly                                Xtra users can see more details on conference calls & webcasts by hovering your mouse  over the RIC, right click, no click on Related Co Data, now click on Co Events.                  ~
COH,UPDATE 3-Coach faces tough turnaround as N.America sales worsen * Shares down as much as 8.8 pct   (Adds analysts comments, forecast; updates shares) ~Handbag maker Coach's sales fall 15.5 pct April 28 Coach Inc, the maker of Poppy handbags, reported a 15.5 percent decline in quarterly revenue as sales in North America, its biggest market, fell for the seventh straight quarter. ~
GLW,UPDATE 1-Corning expects Gorilla Glass sales to remain strong April 28 Corning Inc the supplier of Gorilla glass to Apple Inc and Samsung Electronics Co Ltd, said it expects to sell more LCD glass in the second quarter. ~Specialty glass maker Corning's core net sales rise 4.5 pct April 28 Corning Inc, the supplier of Gorilla glass to Apple Inc and Samsung Electronics Co Ltd, reported a 4.5 percent rise in quarterly core net sales, helped by higher demand for its glass used in TVs and smartphones. ~
DOW,BRIEF-Downer EDI says offer for Spotless Group now closed * Confirms that its offer for Spotless was not extended and has now closed. Source text for Eikon: Further company coverage: ~BRIEF-Downer EDI posts FY net profit of $181.5 million * FY total revenue and other income from ordinary activities $7.29 billion , up 6.4 percent ~BRIEF-Downer EDI says ‍offer for Spotless Group extended to 28 August 2017​ * ‍Offer for Spotless Group extended to 7pm on Monday, 28 august 2017​ Source text for Eikon: Further company coverage: ~BRIEF-Downer EDI says Spotless ‍offer extended to Aug 21, 2017​ * Spotless ‍offer extended to 7pm on monday, 21 august 2017​ Source text for Eikon: Further company coverage: ~BRIEF-Downer EDI's takeover offer for Spotless Group extended till 7pm (Sydney time) on Aug. 14 * Unconditional takeover offer for Spotless Group extended until 7:00pm (Sydney time) on Monday, 14 August Source text for Eikon: Further company coverage: (bangalore.newsroom@thomsonreuters.com) ~BRIEF-Downer extends takeover offer for Spotless Group * decided to extend Spotless offer period for one week; offer will now remain open for acceptance until 14 august Source text for Eikon: Further company coverage: ~BRIEF-Downer extends Spotless offer to August 7 2017 * ‍Downer has decided to extend offer for Spotless Group holdings to 7 pm on Monday, 7 august 2017​ Source text for Eikon: Further company coverage: ~BRIEF-Downer EDI's stake in Spotless increases to 80.3 pct * Downer's stake in Spotless increases to 80.3 pct Source text for Eikon: Further company coverage: ~BRIEF- Downer EDI Ltd'S stake in Spotless Group increases to 72% * As Downer's shareholding in Spotless is now over 70%, Downer expects that Spotless will be removed from certain S&P;/ASX market indices ~
EBAY.O,PayPal extends One Touch payment to online transactions CHICAGO, April 28 PayPal, eBay Inc's  electronic payments division, said on Tuesday it will extend its single-touch payment service from mobile devices to online transactions to try to reduce the $4 trillion in merchandise abandoned in retailers' online shopping carts every year due to complicated checkout procedures. ~
EXC,DIARY-U.S. MEETINGS/WEEK AHEAD Thomson Reuters April 28, 2015 - Corporate Meetings for US companies for Week ahead.         S&P; 500 Earnings - MONTH AHEAD     Dividends                            Non S&P; 500 - Weekly             Federal Reserve events               ConferenceCall/Webcast - Weekly  Meetings - Weekly                                Xtra users can see more details on conference calls & webcasts by hovering your mouse  over the RIC, right click, no click on Related Co Data, now click on Co Events.                  ~
FLR,DIARY-U.S. MEETINGS/WEEK AHEAD Thomson Reuters April 28, 2015 - Corporate Meetings for US companies for Week ahead.         S&P; 500 Earnings - MONTH AHEAD     Dividends                            Non S&P; 500 - Weekly             Federal Reserve events               ConferenceCall/Webcast - Weekly  Meetings - Weekly                                Xtra users can see more details on conference calls & webcasts by hovering your mouse  over the RIC, right click, no click on Related Co Data, now click on Co Events.                  ~
FMC,DIARY-U.S. MEETINGS/WEEK AHEAD Thomson Reuters April 28, 2015 - Corporate Meetings for US companies for Week ahead.         S&P; 500 Earnings - MONTH AHEAD     Dividends                            Non S&P; 500 - Weekly             Federal Reserve events               ConferenceCall/Webcast - Weekly  Meetings - Weekly                                Xtra users can see more details on conference calls & webcasts by hovering your mouse  over the RIC, right click, no click on Related Co Data, now click on Co Events.                  ~
F,REFILE-GLOBAL MARKETS-Earnings weigh on shares, oil rises on Iran ship seizure NEW YORK, April 28 Disappointing corporate earnings handed European shares their biggest daily decline in over a week on Tuesday and left U.S. stocks little changed, while Iran's seizure of a cargo ship in the Gulf lifted oil prices. ~UPDATE 4-Ford 1st-qtr profit misses expectations, 2015 profit outlook affirmed DEARBORN, Mich., April 28 Ford Motor Co  reported a first-quarter profit that was less than analysts expected, selling fewer vehicles in North America as it worked to increase production of the redesigned F-150 pickup truck, and losing money in South America. ~BRIEF-Ford Motor Q1 earnings $0.23 per share * Q1 net income $924 million or $0.23 a share versus $989 million or $0.24 a share ~
GS,Defense lawyer for ex-Goldman Sachs programmer requests mistrial NEW YORK, April 28 The defense attorney for a former Goldman Sachs Group Inc programmer accused of stealing the investment bank's high-frequency trading code has asked a Manhattan judge for a mistrial. ~
IBM,US STOCKS-Dow, S&P; 500 end up with Merck, IBM; Nasdaq slips with Apple * Dow up 0.4 pct, S&P; up 0.28 pct, Nasdaq down 0.1 pct   (Updates to close) ~US STOCKS-Wall St edges up with Merck, IBM; Nasdaq slips with Apple * Dow up 0.3 pct, S&P; up 0.2 pct, Nasdaq down 0.04 pct   (Updates to late afternoon) ~GLOBAL MARKETS-U.S. shares edge higher; oil pares gains after Iran ship seizure NEW YORK, April 28 U.S. shares rebounded in afternoon trading on Tuesday, boosted by strong earnings from Merck and a dividend hike by IBM, while oil prices pared gains on expectations that U.S. crude stockpiles have reached record highs. ~
IRM,Iron Mountain to buy Recall Holdings for about $2.2 billion Document and data storage services company Iron Mountain Inc  said it will buy Australia-listed data protection services provider Recall Holdings Ltd  for about $2.2 billion in cash and stock. ~Iron Mountain to buy Recall Holdings for about $2.2 bln April 28 Document and data storage services company Iron Mountain Inc said it will buy Australia-listed data protection services provider Recall Holdings Ltd for about $2.2 billion in cash and stock. ~
JPM,'We're looking' at HQ issues, Standard Chartered says LONDON Asia-focused bank Standard Chartered  said the location of its headquarters is under constant review and a big increase in a tax on banks in Britain meant it was watching the situation closely. | Video  ~
KMB,DIARY-U.S. MEETINGS/WEEK AHEAD Thomson Reuters April 28, 2015 - Corporate Meetings for US companies for Week ahead.         S&P; 500 Earnings - MONTH AHEAD     Dividends                            Non S&P; 500 - Weekly             Federal Reserve events               ConferenceCall/Webcast - Weekly  Meetings - Weekly                                Xtra users can see more details on conference calls & webcasts by hovering your mouse  over the RIC, right click, no click on Related Co Data, now click on Co Events.                  ~
MPC,DIARY-U.S. MEETINGS/WEEK AHEAD Thomson Reuters April 28, 2015 - Corporate Meetings for US companies for Week ahead.         S&P; 500 Earnings - MONTH AHEAD     Dividends                            Non S&P; 500 - Weekly             Federal Reserve events               ConferenceCall/Webcast - Weekly  Meetings - Weekly                                Xtra users can see more details on conference calls & webcasts by hovering your mouse  over the RIC, right click, no click on Related Co Data, now click on Co Events.                  ~
MAS,DIARY-U.S. MEETINGS/WEEK AHEAD Thomson Reuters April 28, 2015 - Corporate Meetings for US companies for Week ahead.         S&P; 500 Earnings - MONTH AHEAD     Dividends                            Non S&P; 500 - Weekly             Federal Reserve events               ConferenceCall/Webcast - Weekly  Meetings - Weekly                                Xtra users can see more details on conference calls & webcasts by hovering your mouse  over the RIC, right click, no click on Related Co Data, now click on Co Events.                  ~
MCD,CORRECTED-Tyson Foods plans to cut human antibiotics in U.S. chicken flocks by 2017 CHICAGO, April 28 Tyson Foods Inc, the largest U.S. poultry producer, plans to eliminate the use of human antibiotics in its chicken flocks by September 2017 - one of the most aggressive timelines yet set by an American poultry company. ~Tyson Foods plans to cut human antibiotics in U.S. chicken flocks by 2017 CHICAGO Tyson Foods Inc, the largest U.S. poultry producer, plans to eliminate the use of human antibiotics in its chicken flocks by September 2017 - one of the most aggressive timelines yet set by an American poultry company. ~
MRK,Strong Merck cancer drug sales upstage rival Bristol-Myers Investors betting that Bristol-Myers Squibb will emerge as the leading player in a hot new class of cancer drugs hit the pause button on Tuesday as a rival therapy from Merck & Co showed much higher sales. ~GLOBAL MARKETS-U.S. shares rebound; oil pares gains after Iran ship seizure NEW YORK, April 28 Two of three major U.S. stock indexes rose modestly on Tuesday as Merck posted strong earnings and IBM raised its dividend, while European stocks slid on weak corporate results and oil prices were flat to lower on expectations that U.S. crude stockpiles have reached record highs. ~Dow, S&P; 500 end up with Merck, IBM; Nasdaq slips with Apple The Dow and S&P; 500 ended a volatile session higher on Tuesday, helped by strong earnings from Merck and gains in IBM after it boosted its dividend, while the Nasdaq fell with Apple. ~US STOCKS-Dow, S&P; 500 end up with Merck, IBM; Nasdaq slips with Apple * Dow up 0.4 pct, S&P; up 0.28 pct, Nasdaq down 0.1 pct   (Updates to close) ~US STOCKS-Wall St edges up with Merck, IBM; Nasdaq slips with Apple * Dow up 0.3 pct, S&P; up 0.2 pct, Nasdaq down 0.04 pct   (Updates to late afternoon) ~GLOBAL MARKETS-U.S. shares edge higher; oil pares gains after Iran ship seizure NEW YORK, April 28 U.S. shares rebounded in afternoon trading on Tuesday, boosted by strong earnings from Merck and a dividend hike by IBM, while oil prices pared gains on expectations that U.S. crude stockpiles have reached record highs. ~US STOCKS-Wall St moves higher after erratic early trading * Indexes up: Dow 0.4 pct, S&P; 0.3 pct, Nasdaq 0.2 pct   (Updates to early afternoon, changes comment) ~Merck shares jump on strong earnings, Januvia safety data Merck & Co's  shares jumped almost 5 percent after the U.S. drugmaker reported better-than-expected quarterly results and released favorable data late Monday about the safety of its Januvia diabetes drug. | Video  ~US STOCKS-Wall St reverses course to trade higher * Indexes up: Dow 0.3 pct, S&P; 0.2 pct, Nasdaq 0.2 pct   (Adds details, comment, updates prices) ~
NOV,UPDATE 1-National Oilwell forecasts declining revenue April 28 National Oilwell Varco Inc, the largest U.S. oilfield equipment maker, reported lower-than-expected quarterly revenue and forecast declining revenue for the next few quarters as weak oil prices reduce drilling activity. ~National Oilwell profit drops 47 pct, hurt by charges April 28 National Oilwell Varco Inc, the largest U.S. oilfield equipment maker, posted a 47.4 percent drop in quarterly profit, mainly hurt by $200 million in charges. ~
OXY,DIARY-U.S. MEETINGS/WEEK AHEAD Thomson Reuters April 28, 2015 - Corporate Meetings for US companies for Week ahead.         S&P; 500 Earnings - MONTH AHEAD     Dividends                            Non S&P; 500 - Weekly             Federal Reserve events               ConferenceCall/Webcast - Weekly  Meetings - Weekly                                Xtra users can see more details on conference calls & webcasts by hovering your mouse  over the RIC, right click, no click on Related Co Data, now click on Co Events.                  ~
ORCL.N,UPDATE 1-S.Korea investigating Oracle over software bundling SEOUL, April 28 South Korea's antitrust body said on Tuesday that it is investigating U.S. database firm Oracle Corp over whether its practice of bundling new software offerings into maintenance services contracts is anticompetitive behaviour. ~S.Korea antitrust body investigating Oracle for software bundling SEOUL, April 28 South Korea's antitrust body said on Tuesday that it is investigating U.S. database services provider Oracle Corp for bundling its new software offerings into maintenance services contracts with customers. ~
PFE,UPDATE 1-Pfizer cuts full-year forecast on stronger dollar April 28 U.S. drugmaker Pfizer Inc cut its full-year revenue and profit forecast, blaming a stronger dollar. ~Pfizer quarterly revenue falls on stronger dollar April 28 Pfizer Inc reported a 4 percent fall in quarterly revenue, hurt by a stronger dollar. ~
QCOM.O,UPDATE 1-S.Korea investigating Oracle over software bundling SEOUL, April 28 South Korea's antitrust body said on Tuesday that it is investigating U.S. database firm Oracle Corp over whether its practice of bundling new software offerings into maintenance services contracts is anticompetitive behaviour. ~
