ADBE.O,UPDATE 1-Adobe joins tech industry push in increasing maternity, parental leave NEW YORK, Aug 10 Software company Adobe Systems Inc. said on Monday it is doubling the maternity leave it grants, making it the third company in the U.S. technology industry in a week to give new parents more paid time off. ~Adobe joins tech industry push in raising maternity, parental leave NEW YORK, Aug 10 Software company Adobe Systems Inc. said on Monday it is doubling the maternity leave it grants, making it the third company in the U.S. technology industry in a week to give new parents more paid time off. ~
AES,AES, Grupo Bal to invest up to $2.5 bln in Mexico energy sector MEXICO CITY, Aug 10 A new partnership between U.S.-based power company AES Corp and Mexico's Grupo Bal launched on Monday will invest up to $2.5 billion over the next five years mostly in Mexico's newly opened power sector, a top AES executive said in an interview. ~
GOOGL.O,Google morphs into Alphabet Inc, investors cheer clarity SAN FRANCISCO Google Inc  announced a major shake-up of its operating structure on Monday, creating a holding company called Alphabet which will contain subsidiaries to separate its core web advertising business from newer ventures like driverless cars. | Video  ~UPDATE 3-Google morphs into Alphabet Inc, investors cheer clarity SAN FRANCISCO Aug 10 Google Inc  announced a major shake-up of its operating structure on Monday, creating a holding company called Alphabet which will contain subsidiaries to separate its core web advertising business from newer ventures like driverless cars. ~Wall St. rallies with energy, materials; Google jumps after the bell U.S. stocks climbed on Monday, giving the S&P; 500 its biggest increase since May as indexes rebounded sharply from last week's losses, buoyed by gains in commodity-related shares and optimism over Warren Buffett's latest deal. ~US STOCKS-Wall St rallies with energy, materials; Google jumps after the bell * Google up after closing bell, announces new operating structure ~Google Inc to become Alphabet Inc in shakeup Aug 10 Google Inc is changing its operating structure by setting up a new company called Alphabet Inc, which will include the search business and a number of other units. ~
GOOG.O,Google morphs into Alphabet Inc, investors cheer clarity SAN FRANCISCO Google Inc  announced a major shake-up of its operating structure on Monday, creating a holding company called Alphabet which will contain subsidiaries to separate its core web advertising business from newer ventures like driverless cars. | Video  ~UPDATE 3-Google morphs into Alphabet Inc, investors cheer clarity SAN FRANCISCO Aug 10 Google Inc  announced a major shake-up of its operating structure on Monday, creating a holding company called Alphabet which will contain subsidiaries to separate its core web advertising business from newer ventures like driverless cars. ~Wall St. rallies with energy, materials; Google jumps after the bell U.S. stocks climbed on Monday, giving the S&P; 500 its biggest increase since May as indexes rebounded sharply from last week's losses, buoyed by gains in commodity-related shares and optimism over Warren Buffett's latest deal. ~US STOCKS-Wall St rallies with energy, materials; Google jumps after the bell * Google up after closing bell, announces new operating structure ~Google Inc to become Alphabet Inc in shakeup Aug 10 Google Inc is changing its operating structure by setting up a new company called Alphabet Inc, which will include the search business and a number of other units. ~
AAPL.O,Xiaomi ties up with Taiwan's Foxconn to assemble smartphones in India MUMBAI China's Xiaomi Inc [XTC.UL] has joined forces with Taiwan-based tech giant Foxconn to start assembling phones in India, seeking to cut costs and grab a bigger slice of the world's third-largest smartphone market. ~UPDATE 2-Xiaomi ties up with Taiwan's Foxconn to assemble smartphones in India * New facility will help Xiaomi better manage inventory   (Adds fresh exec comments, context on India smartphone market, details) ~
BRKa.N,Buffett bets Precision can deliver long-term as aircraft sales grow HOUSTON Warren Buffett’s $32.3 billion deal for Precision Castparts Corp  shows his willingness to overlook repeated operational stumbles at the company to place a long-term bet on the growth of global air travel. ~Buffett bets Precision can deliver long-term as aircraft sales grow HOUSTON, Aug 10 Warren Buffett's $32.3 billion deal for Precision Castparts Corp shows his willingness to overlook repeated operational stumbles at the company to place a long-term bet on the growth of global air travel. ~US STOCKS-Wall St rallies with energy, materials; Google jumps after the bell * Google up after closing bell, announces new operating structure ~Kraft and Heinz sales fall in final quarter before merger Kraft Heinz Co , the packaged food company formed by the merger of ketchup maker H.J. Heinz Co and Kraft Foods Group Inc, said sales fell 4.9 percent at Kraft and 4.1 percent at ketchup maker Heinz in the last quarter before the merger was completed. ~UPDATE 1-Kraft and Heinz sales fall in final quarter before merger Aug 10 Kraft Heinz Co, the packaged food company formed by the merger of ketchup maker H.J. Heinz Co and Kraft Foods Group Inc, said sales fell 4.9 percent at Kraft and 4.1 percent at ketchup maker Heinz in the last quarter before the merger was completed. ~Sales at Kraft, Heinz fall in 1st qtrly results as merged company Aug 10 Kraft Heinz Co, formed from the merger of Ketchup maker H.J. Heinz Co and packaged food company Kraft Foods Group Inc, said sales fell 4.9 percent at Kraft and 4.1 percent at Heinz in its first quarterly results as a combined company. ~US STOCKS-Wall St jumps with energy, materials; Berkshire deal a boost * Indexes up: Dow 1.4 pct, S&P; 1.3 pct, Nasdaq 1.2 pct   (Updates to close) ~Deals of the day- Mergers and acquisitions Aug 10 The following bids, mergers, acquisitions and disposals were reported by 2000 GMT on Monday: ~US STOCKS-Wall St rises with energy, materials; Berkshire deal a boost * Indexes up: Dow 1.4 pct, S&P; 1.3 pct, Nasdaq 1.2 pct   (Updates to late afternoon, changes byline) ~
BLK,MOVES-BlackRock names Jan Bratteberg head of Nordics iShares business Aug 10 BlackRock Inc, the world's largest money manager, named Jan Bratteberg as head of its iShares business in the Nordics. ~
C,Citigroup in US$13.5 mln settlement over defunct CSO hedge fund NEW YORK Citigroup Inc agreed to pay $13.5 million to settle a lawsuit accusing the bank of deceiving investors into remaining in its Corporate Special Opportunities hedge fund, only to suffer big losses when the fund was liquidated in November 2008, court papers filed on Monday show ~Citigroup in US$13.5 mln settlement over defunct CSO hedge fund NEW YORK, Aug 10 Citigroup Inc agreed to pay $13.5 million to settle a lawsuit accusing the bank of deceiving investors into remaining in its Corporate Special Opportunities hedge fund, only to suffer big losses when the fund was liquidated in November 2008, court papers filed on Monday show ~MOVES- Standard Chartered, Citigroup, Berenberg, BlackRock Aug 10 The following financial services industry appointments were announced on Monday. To inform us of other job changes, email moves@thomsonreuters.com. ~MOVES-Citigroup poaches Nomura's Americas ECM head Roti LONDON, Aug 10 (IFR) - Citigroup has hired Stephen Roti from Nomura to be the bank's global head of corporate equity derivatives. He will be based in New York and reports to global head of equity derivatives James Boyle, global head of capital markets origination Tyler Dickson, and corporate sales head Andres Recoder. ~
FCX,Freeport-McMoRan outlines $1 bln equity issue plan TORONTO, Aug 10 Freeport-McMoRan Inc may issue up to $1 billion in common shares, the diversified miner said on Monday in a regulatory filing, a decision that highlights how sliding commodity prices are deepening woes of mining and energy companies. ~
GM,CORRECTED-Brazil GM plant on strike; Mercedes eyes job cuts SAO PAULO, Aug 10 A strike on Monday paralyzed work at a General Motors plant in Brazil and a nearby Daimler truck factory threatened job cuts as labor tensions boiled over in a slumping market. ~DIARY-U.S. MEETINGS/WEEK AHEAD Thomson Reuters August 10, 2015 - Corporate Meetings for US companies for Week ahead.         S&P; 500 Earnings - MONTH AHEAD     Dividends                            Non S&P; 500 - Weekly             Federal Reserve events               ConferenceCall/Webcast - Weekly  Meetings - Weekly                                Xtra users can see more details on conference calls & webcasts by hovering your mouse  over the RIC, right click, no click on Related Co Data, now click on Co Events.                 ~
IBM,US STOCKS-Wall St rises on Berkshire deal, China stimulus hopes * Indexes up: Dow 1.3 pct, S&P; 1.1 pct, Nasdaq 0.9 pct   (Adds details, changes comment, updates prices) ~US STOCKS-Wall St rises as Berkshire deal points to M&A; endurance * Indexes up: Dow 0.98 pct, S&P; 0.96 pct, Nasdaq 1.12 pct   (Updates to open) ~US STOCKS-Wall St set to open up after Berkshire deal * Futures up: Dow 129 pts, S&P; 15 pts, Nasdaq 30 pts   (Adds details, comment, updates prices) ~
MNK,CORRECTED-UPDATE 4-Mallinckrodt buys immunotherapy maker Therakos in $1.33 bln deal Aug 10 Drugmaker Mallinckrodt Plc agreed to buy immunotherapy company Therakos Inc in a $1.33 billion deal, its second major acquisition this year to bolster its presence in hospitals. ~
PFE,Shire CEO steps up drive to get Baxalta board talking LONDON, Aug 10 Shire Chief Executive Flemming Ornskov is stepping up his campaign to get Baxalta  to the negotiating table as he pushes the benefits a $30 billion takeover offer to the U.S. biotech company's shareholders. ~
PG,UPDATE 5-Buffett pays high price for Precision Castparts Aug 10 Warren Buffett is paying a hefty price for the biggest bet of his career as his Berkshire Hathaway Inc  has agreed to buy Precision Castparts Corp, valuing the maker of aerospace and other parts at $32.3 billion. ~
REGN.O,Sanofi teams up with Evotec, Apeiron to develop immuno-oncology pills PARIS, Aug 10 Sanofi is teaming up with Germany's Evotec and Austrian biotech firm Apeiron Biologics to develop a new type of immune system-boosting cancer medicine that could be given as tablets to fight both solid tumours and blood cancers. ~
