BA,Boeing production czar says planemaker won't repeat errors SEATTLE Boeing Co  is well-positioned to hit record production targets for its popular 737 jetliner by 2018, having learned from past mistakes, the head of its industrial system told Reuters. ~INTERVIEW-Boeing production czar says planemaker won't repeat errors SEATTLE, March 15 Boeing Co is well-positioned to hit record production targets for its popular 737 jetliner by 2018, having learned from past mistakes, the head of its industrial system told Reuters. ~
CMCSA.O,Rand Paul woos donors and hackers at tech conference AUSTIN, Tx., March 16 As his likely rivals spent the weekend shaking hands in New Hampshire, potential Republican candidate Rand Paul flew to Texas to court the software developers and entrepreneurs who are likely to play a central role in the 2016 election. ~
DOW,BRIEF-Downer EDI says offer for Spotless Group now closed * Confirms that its offer for Spotless was not extended and has now closed. Source text for Eikon: Further company coverage: ~BRIEF-Downer EDI posts FY net profit of $181.5 million * FY total revenue and other income from ordinary activities $7.29 billion , up 6.4 percent ~BRIEF-Downer EDI says ‍offer for Spotless Group extended to 28 August 2017​ * ‍Offer for Spotless Group extended to 7pm on Monday, 28 august 2017​ Source text for Eikon: Further company coverage: ~BRIEF-Downer EDI says Spotless ‍offer extended to Aug 21, 2017​ * Spotless ‍offer extended to 7pm on monday, 21 august 2017​ Source text for Eikon: Further company coverage: ~BRIEF-Downer EDI's takeover offer for Spotless Group extended till 7pm (Sydney time) on Aug. 14 * Unconditional takeover offer for Spotless Group extended until 7:00pm (Sydney time) on Monday, 14 August Source text for Eikon: Further company coverage: (bangalore.newsroom@thomsonreuters.com) ~BRIEF-Downer extends takeover offer for Spotless Group * decided to extend Spotless offer period for one week; offer will now remain open for acceptance until 14 august Source text for Eikon: Further company coverage: ~BRIEF-Downer extends Spotless offer to August 7 2017 * ‍Downer has decided to extend offer for Spotless Group holdings to 7 pm on Monday, 7 august 2017​ Source text for Eikon: Further company coverage: ~BRIEF-Downer EDI's stake in Spotless increases to 80.3 pct * Downer's stake in Spotless increases to 80.3 pct Source text for Eikon: Further company coverage: ~BRIEF- Downer EDI Ltd'S stake in Spotless Group increases to 72% * As Downer's shareholding in Spotless is now over 70%, Downer expects that Spotless will be removed from certain S&P;/ASX market indices ~
FCX,Credit Suisse settles Freeport-McMoRan litigation for $16.25 mln March 16 Credit Suisse Group Inc will pay $10 million in cash and provide $6.25 million worth of advisory work to Freeport-McMoRan Inc to settle allegations it contributed to the natural resources company having overpaid significantly for two oil and gas companies. ~
GE,GE's Immelt touts value of conglomerate's scale to investors March 16 General Electric Co Chief Executive Officer Jeff Immelt is sticking by his company's model for housing diverse businesses under one roof at a time when other U.S. conglomerates are looking at hiving off units to please investors. ~Bouygues delays nomination of GE's Gaymard to board PARIS Bouygues  said on Monday that it had postponed a proposal for Clara Gaymard, head of General Electric  in France, to join the board of the French construction group. ~Bouygues delays nomination of GE's Gaymard to board PARIS, March 16 Bouygues said on Monday that it had postponed a proposal for Clara Gaymard, head of General Electric in France, to join the board of the French construction group. ~
GM,GM gets 4,342 total claims for faulty ignition switch compensation General Motors Co has received 4,342 claims for compensation related to ignition switch defects in its cars, according to the lawyer overseeing the compensation program. ~GM gets 4,342 total claims for faulty ignition switch compensation March 16 General Motors Co has received 4,342 claims for compensation related to ignition switch defects in its cars, according to the lawyer overseeing the compensation program. ~
JNJ,UPDATE 1-Pharmacyclics cancer drug successful as combination therapy - independent panel March 16 An independent panel recommended unblinding a late-stage study testing Pharmacyclics Inc  and Johnson & Johnson's Imbruvica, after the treatment was successful against two similar forms of cancer in combination with other drugs. ~CORRECTED-Independent panel recommends unblinding study after Imbruvica shows clear benefit March 16 An independent panel recommended unblinding a late-stage study testing Pharmacyclics Inc  and Johnson & Johnson's Imbruvica, after the treatment was successful in treating two types of cancer in combination with other drugs. ~
MCD,McDonald's workers claim hazardous conditions in 19 U.S. cities McDonald's Corp restaurant workers from 19 U.S. cities complained to regulators on Monday that their working conditions are hazardous and have led to severe burns from hot grills and fryer oil. ~UPDATE 1-McDonald's workers claim hazardous conditions in 19 U.S. cities March 16 McDonald's Corp restaurant workers from 19 U.S. cities complained to regulators on Monday that their working conditions are hazardous and have led to severe burns from hot grills and fryer oil. ~McDonald's workers claim hazardous conditions in 19 U.S. cities March 16 McDonald's restaurant workers from 19 U.S. cities said on Monday they have filed 28 health and safety complaints with federal and state regulators, alleging hazardous working conditions that led to severe burns from hot grills and fryer oil. ~
MS,Rosneft working on giant oil deal with trader Trafigura - sources MOSCOW/LONDON Trading house Trafigura is set to become the largest exporter of oil from Russian state-owned energy major Rosneft under a deal it is negotiating with the sanctions-hit company, industry sources told Reuters. ~
RTN,UPDATE 1-Raytheon in talks to buy Websense Inc - Bloomberg March 16 U.S. arms maker Raytheon Co is in talks to buy network-security company Websense Inc, owned by private-equity firm Vista Equity Partners LLC, Bloomberg reported citing people familiar with the matter. ~Raytheon in talks to buy Websense Inc - Bloomberg March 16 U.S. arms maker Raytheon Co is in talks to buy network-security company Websense Inc, owned by private-equity firm Vista Equity Partners LLC, Bloomberg reported citing people familiar with the matter. ~
VZ,Rand Paul woos donors and hackers at tech conference AUSTIN, Tx., March 16 As his likely rivals spent the weekend shaking hands in New Hampshire, potential Republican candidate Rand Paul flew to Texas to court the software developers and entrepreneurs who are likely to play a central role in the 2016 election. ~
V,BRIEF-Visa calls for redemption all of its 1.200 pct notes due 2017 * Visa Inc - on Sept 11, co called for redemption all of $1.75 billion principal amount outstanding of its 1.200 pct notes due 2017‍​ - SEC filing ~BRIEF-Visa Inc files for three-part senior notes offering of up to $2.5 bln * Visa Inc says files for three-part senior notes offering of up to $2.5 billion - SEC filing‍​ ~Former BoE deputy Hogg to join Visa as Europe unit CEO Visa Inc, the world's largest payments processor, on Thursday named former Bank of England (BoE) deputy governor Charlotte Hogg as chief executive of its Europe division. ~CORRECTED-UPDATE 1-MOVES-Former BoE deputy Hogg to join Visa as Europe unit CEO Sept 7 Visa Inc, the world's largest payments processor, on Thursday named former Bank of England (BoE) deputy governor Charlotte Hogg as chief executive of its Europe division. ~MOVES-Visa names ex-BoE deputy Charlotte Hogg as Europe unit CEO Sept 7 Visa Inc, the world's largest payments processor, on Thursday named Charlotte Hogg as chief executive of its Europe division. ~BRIEF-Visa appoints Charlotte Hogg as CEO of European operations * Visa Inc appoints Charlotte Hogg as chief executive officer of the compan's European operations ~BRIEF-Visa Inc files prospectus supplement for potential three-part senior notes offering * Visa Inc files prospectus supplement for potential three-part senior notes offering; size not disclosed - sec filing‍​ Source text (http://bit.ly/2vLDrIe) Further company coverage: ~BRIEF-Visa enables on the go payments with the new Fitbit Ionic * Visa inc- ‍enabling visa payments on fitbit's smartwatch fitbit ionic​ ~BRIEF-Bridg raises $11 million in Series B funding * Bridg raises $11 million in Series B funding from Morpheus Ventures, March Capital, Visa and NextEquity ~
