GOOGL.O,PRESS DIGEST- New York Times business news - March 20 March 20 The following are the top stories on the New York Times business pages. Reuters has not verified these stories and does not vouch for their accuracy. ~
GOOG.O,PRESS DIGEST- New York Times business news - March 20 March 20 The following are the top stories on the New York Times business pages. Reuters has not verified these stories and does not vouch for their accuracy. ~
AAPL.O,US STOCKS-Wall St rises on Nike, lower dollar; Nasdaq hits 15-yr high * Indexes rise: Dow and S&P; 0.9 percent, Nasdaq 0.7 percent   (Updates close with energy shares up, Apple down, latest volume) ~
BIIB.O,UPDATE 1-Biogen's Alzheimer's drug slows mental decline in early study March 20 An experimental drug from Biogen Idec Inc became the  first Alzheimer's treatment to significantly slow cognitive decline and reduce what is believed to be brain-destroying plaque in patients with early and mild forms of the disease, according to a small study likely to reignite hopes of a treatment. ~US STOCKS-Wall St set for higher open as Nike provides lift * Futures up: Dow 148 pts, S&P; 15 pts, Nasdaq 36 pts   (Adds quote, updates prices) ~
BLK,German watchdog slaps 3.25 mln euro fine on BlackRock FRANKFURT, March 20 German financial market watchdog Bafin has imposed a 3.25 million euro ($3.47 million) fine - the regulator's largest ever - on investment manager BlackRock for publishing faulty corporate voting rights disclosures. ~
BA,Turkish Airlines raises $328 mln for Boeing 777s ISTANBUL, March 20 Turkish Airlines  has raised $328.3 million through dollar-denominated certificates to finance three Boeing 777-300ER aircraft, it said, the first time the carrier has raised funds through capital markets. ~Senators launch bipartisan Export-Import Bank blueprint WASHINGTON A bipartisan plan to save the U.S. Export-Import Bank seeks to extend the bank's term until 2019, increase lending to small businesses and overturn limits on coal-fired power plant projects. ~UPDATE 3-U.S. senators launch bipartisan Export-Import Bank blueprint WASHINGTON, March 19 A bipartisan plan to save the U.S. Export-Import Bank seeks to extend the bank's term until 2019, increase lending to small businesses and overturn limits on coal-fired power plant projects. ~
DRI,CORRECTED-UPDATE 3-Darden seeks property deals, Olive Garden turnaround March 20 Darden Restaurants Inc said on Friday it was looking for ways to "create value" from its real estate, as management installed after last year's activist investor-led coup reported continued traffic declines at its flagship Olive Garden chain. ~BRIEF-Olive Garden parent Darden says exploring all real estate options LOS ANGELES, March 20 * Darden Restaurants Inc  exploring options for real estate, including sale and leaseback deals * Darden says has secured letters of intent or contracts on the majority of 31 listed properties at cap rates well below 6 percent * Darden has listed its Orlando, Florida, headquarters, options include sale and leaseback * Darden says real estate proceeds will be used to repay debt and improve credit profile * Darden says has identified $90-$100 mln of potential cost ~
DOW,BRIEF-Downer EDI says offer for Spotless Group now closed * Confirms that its offer for Spotless was not extended and has now closed. Source text for Eikon: Further company coverage: ~BRIEF-Downer EDI posts FY net profit of $181.5 million * FY total revenue and other income from ordinary activities $7.29 billion , up 6.4 percent ~BRIEF-Downer EDI says ‍offer for Spotless Group extended to 28 August 2017​ * ‍Offer for Spotless Group extended to 7pm on Monday, 28 august 2017​ Source text for Eikon: Further company coverage: ~BRIEF-Downer EDI says Spotless ‍offer extended to Aug 21, 2017​ * Spotless ‍offer extended to 7pm on monday, 21 august 2017​ Source text for Eikon: Further company coverage: ~BRIEF-Downer EDI's takeover offer for Spotless Group extended till 7pm (Sydney time) on Aug. 14 * Unconditional takeover offer for Spotless Group extended until 7:00pm (Sydney time) on Monday, 14 August Source text for Eikon: Further company coverage: (bangalore.newsroom@thomsonreuters.com) ~BRIEF-Downer extends takeover offer for Spotless Group * decided to extend Spotless offer period for one week; offer will now remain open for acceptance until 14 august Source text for Eikon: Further company coverage: ~BRIEF-Downer extends Spotless offer to August 7 2017 * ‍Downer has decided to extend offer for Spotless Group holdings to 7 pm on Monday, 7 august 2017​ Source text for Eikon: Further company coverage: ~BRIEF-Downer EDI's stake in Spotless increases to 80.3 pct * Downer's stake in Spotless increases to 80.3 pct Source text for Eikon: Further company coverage: ~BRIEF- Downer EDI Ltd'S stake in Spotless Group increases to 72% * As Downer's shareholding in Spotless is now over 70%, Downer expects that Spotless will be removed from certain S&P;/ASX market indices ~
FCX,Freeport Indonesia output stoppage enters 5th day as talks continue JAKARTA, March 20 A blockade by workers at Freeport-McMoRan Inc's Indonesian mine extended into a fifth day on Friday, a union official said, with output still halted but maintenance workers allowed into the Grasberg site by protestors. ~
GS,UPDATE 1-Goldman, UBS join ex-"fixing" banks for new LBMA gold price * ICE Benchmark Administration operating new process   (Adds background, comment) ~Goldman Sachs, UBS named as participants in new LBMA gold price-ICE LONDON, March 20 Goldman Sachs and UBS will join the four existing members of the gold "fix", which ended on Thursday, in setting the new London Bullion Market Association (LBMA) Gold Price benchmark, Intercontinental Exchange said on Friday. ~
MAC,UPDATE 4-Simon says: Macerich offer "best and final" * Simon Property will not nominate directors to Macerich board ~Simon Property raises offer for Macerich to $95.50/share March 20 Simon Property Group Inc, the largest U.S. shopping mall owner, raised its offer for smaller rival Macerich Co to $95.50 per share in cash and stock. ~
MRK,Merck KGaA's deputy chief Oschmann set to become CEO - Manager Magazin FRANKFURT, March 20 Germany's Merck KGaA  will promote its deputy chief executive, Stefan Oschmann, to the top job next year to replace Karl-Ludwig Kley, Manager Magazin reported on Friday, citing company sources. ~
MON,Monsanto weed killer can 'probably' cause cancer -World Health Organization CHICAGO, March 20 The world's most widely-used weed killer can "probably" cause cancer, the World Health Organization said on Friday. ~
NKE,US STOCKS-Wall St rises on Nike, lower dollar; Nasdaq hits 15-yr high * Indexes rise: Dow and S&P; 0.9 percent, Nasdaq 0.7 percent   (Updates close with energy shares up, Apple down, latest volume) ~US STOCKS-Wall St rises on Nike, lower dollar; snaps 3-week string of losses * Indexes rise: Dow and S&P; 0.9 percent, Nasdaq 0.7 percent   (Updates to close) ~US STOCKS-Wall St rises on Nike, lower dollar; set to snap 3 weeks of losses * Indexes up: Dow 1.3 pct, S&P; 1.1 pct, Nasdaq 1 pct   (Updates to early afternoon) ~GLOBAL MARKETS-Decline in U.S. dollar lifts oil, stocks * European stocks helped after Athens' assurances   (Updates to afternoon trading, recasts lead and adds Nike results) ~US STOCKS-Wall St rises on Nike, biotechs; set to snap 3-week skid * Indexes up: Dow 1.08 pct, S&P; 0.98 pct, Nasdaq 0.87 pct   (Updates to late morning) ~US STOCKS-Wall St climbs on Nike, biotech lift * Indexes up: Dow 0.78 pct, S&P; 0.68 pct, Nasdaq 0.7 pct   (Updates to market open) ~US STOCKS SNAPSHOT-Biotech, Nike lift Wall St at open NEW YORK, March 20 U.S. stocks rose at the open on Friday, with the S&P; 500 on track to snap a three-week losing streak, lifted by strong earnings at Nike and by another strong showing from the biotech sector. ~US STOCKS-Wall St set for higher open as Nike provides lift * Futures up: Dow 148 pts, S&P; 15 pts, Nasdaq 36 pts   (Adds quote, updates prices) ~
SPG,Deals of the day- Mergers and acquisitions March 20 The following bids, mergers, acquisitions and disposals were reported by 1440 GMT on Friday: ~Simon Property raises offer for Macerich to $95.50/share March 20 Simon Property Group Inc, the largest U.S. shopping mall owner, raised its offer for smaller rival Macerich Co to $95.50 per share in cash and stock. ~
TGT,After Target wage hike, labor groups turn to drugstore chains CHICAGO, March 20 Some labor groups looking to broaden their push for minimum wage hikes after success at big U.S. retailers including Target Corp, are preparing to take on drugstore chains. ~
TIF,UPDATE 4-Tiffany's sales fall for first time in 5 years on strong dollar March 20 Tiffany & Co's quarterly sales fell for the first time in five years and are expected to decline further as a strong dollar not only keeps tourists away from its flagship New York jewelry store but also reduces the value of sales overseas. ~REFILE-UPDATE 3-Tiffany's sales fall for first time in 5 years on strong dollar March 20 Tiffany & Co's quarterly sales fell for the first time in five years and are expected to decline further as a strong dollar not only keeps tourists away from its flagship New York jewelry store but also reduces the value of sales overseas. ~
V,BRIEF-Visa calls for redemption all of its 1.200 pct notes due 2017 * Visa Inc - on Sept 11, co called for redemption all of $1.75 billion principal amount outstanding of its 1.200 pct notes due 2017‍​ - SEC filing ~BRIEF-Visa Inc files for three-part senior notes offering of up to $2.5 bln * Visa Inc says files for three-part senior notes offering of up to $2.5 billion - SEC filing‍​ ~Former BoE deputy Hogg to join Visa as Europe unit CEO Visa Inc, the world's largest payments processor, on Thursday named former Bank of England (BoE) deputy governor Charlotte Hogg as chief executive of its Europe division. ~CORRECTED-UPDATE 1-MOVES-Former BoE deputy Hogg to join Visa as Europe unit CEO Sept 7 Visa Inc, the world's largest payments processor, on Thursday named former Bank of England (BoE) deputy governor Charlotte Hogg as chief executive of its Europe division. ~MOVES-Visa names ex-BoE deputy Charlotte Hogg as Europe unit CEO Sept 7 Visa Inc, the world's largest payments processor, on Thursday named Charlotte Hogg as chief executive of its Europe division. ~BRIEF-Visa appoints Charlotte Hogg as CEO of European operations * Visa Inc appoints Charlotte Hogg as chief executive officer of the compan's European operations ~BRIEF-Visa Inc files prospectus supplement for potential three-part senior notes offering * Visa Inc files prospectus supplement for potential three-part senior notes offering; size not disclosed - sec filing‍​ Source text (http://bit.ly/2vLDrIe) Further company coverage: ~BRIEF-Visa enables on the go payments with the new Fitbit Ionic * Visa inc- ‍enabling visa payments on fitbit's smartwatch fitbit ionic​ ~BRIEF-Bridg raises $11 million in Series B funding * Bridg raises $11 million in Series B funding from Morpheus Ventures, March Capital, Visa and NextEquity ~
WMT,SEC to allow vote on Wal-Mart independent chairman shareholder proposal March 20 Wal-Mart Stores Inc failed to block a vote on a shareholder resolution calling for an independent board chairman, allowing it to return to the ballot for the third straight year at its annual shareholder meeting in June. ~Kids of comedian killed in Tracy Morgan crash get $10 mln settlement NEW YORK The children of the comedian James McNair, who was killed in a  highway crash that injured fellow comic Tracy Morgan, have reached a $10 million out-of-court-settlement with Wal-Mart Stores Inc, according to court documents. ~Kids of comedian killed in Tracy Morgan crash get $10 million settlement NEW YORK The children of the comedian James McNair, who was killed in a  highway crash that injured fellow comic Tracy Morgan, have reached a $10 million out-of-court-settlement with Wal-Mart Stores Inc, according to court documents. ~UPDATE 3-Kids of comedian killed in Tracy Morgan crash get $10 mln settlement NEW YORK, March 20 The children of the comedian James McNair, who was killed in a  highway crash that injured fellow comic Tracy Morgan, have reached a $10 million out-of-court-settlement with Wal-Mart Stores Inc, according to court documents. ~Wal-Mart reaches settlement with children of comedian killed in crash The children of the comedian James McNair, who was killed in a  highway crash that injured fellow comic Tracy Morgan, have reached a settlement with Wal-Mart, the company confirmed on Friday. ~UPDATE 1-Wal-Mart reaches settlement with children of comedian killed in crash March 20 The children of the comedian James McNair, who was killed in a  highway crash that injured fellow comic Tracy Morgan, have reached a settlement with Wal-Mart , the company confirmed on Friday. ~Children of comedian killed in crash with Wal-Mart truck win $10 mln settlment-AP March 20 The children of the comedian James McNair, who was killed in a  road crash that injured fellow comic Tracy Morgan, won a $10 million settlement with Wal-Mart , according to the Associated Press, citing documents filed in New York's Westchester County. ~
