ABBV.N,PBM EnvisionRx chooses Gilead hepatitis C drugs for its formulary Jan 26 Pharmacy benefits manager EnvisionRx said on Monday it reached an agreement to provide its customers with Gilead Sciences Inc's hepatitis C drugs on an exclusive basis, the latest Gilead victory in a market share battle with AbbVie over their new treatments for the liver destroying virus. ~
AAL.O,American Airlines Group canceling flights from major northeast hubs Jan 26 American Airlines Group has canceled all late afternoon and evening flights scheduled for Monday from the New York area, Philadelphia and Boston as a major winter storm bears down on the northeast, spokeswoman Andrea Huguely said. ~
AMGN.O,Regeneron/Sanofi cholesterol drug gets FDA priority review Jan 26 Regeneron Pharmaceuticals on Monday said U.S. health regulators accepted its application to review a potent  cholesterol drug on a priority basis, potentially giving it the upper hand in a fierce race with Amgen  to bring a new medicine from the promising class to market. ~
AAPL.O,Samsung Elec to be main chip supplier for next iPhone-S.Korea paper SEOUL, Jan 26 South Korea's Samsung Electronics Co Ltd will be the main supplier of processors powering Apple Inc's next iPhone, Maeil Business Newspaper reported on Monday, citing unidentified sources in the semiconductor industry. ~
T,AT&T; to buy NII Holdings' wireless business in Mexico AT&T; Inc  said on Monday it would buy bankrupt NII Holdings Inc's  wireless business in Mexico for $1.875 billion in a move to create a larger Mexican wireless player that will have a better chance of competing with No. 1 America Movil . ~UPDATE 3-AT&T; to buy NII Holdings' wireless business in Mexico Jan 26 AT&T; Inc said on Monday it would buy bankrupt NII Holdings Inc's wireless business in Mexico for $1.875 billion in a move to create a larger Mexican wireless player that will have a better chance of competing with No. 1 America Movil. ~AT&T; to buy NII Holdings' wireless business in Mexico Jan 26 AT&T; Inc said it will buy bankrupt NII Holdings Inc's wireless business in Mexico for $1.875 billion, less outstanding net debt. ~Cablevision to launch WiFi phone service for data-hungry users SAN FRANCISCO Cablevision System Corp said on Monday it would launch in February a wireless Internet phone service to give users an alternative to pricier data plans from cellular companies such as AT&T; and Verizon. ~Cablevision to launch WiFi phone service for data-hungry users SAN FRANCISCO, Jan 26 Cablevision System Corp  said on Monday it would launch in February a wireless Internet phone service to give users an alternative to pricier data plans from cellular companies such as AT&T; and Verizon. ~
BA,UPDATE 1-U.S. govt unveils goal to move Medicare away from fee-for-service WASHINGTON, Jan 26 The Obama administration on Monday unveiled an ambitious plan to control health costs by moving the $2.9 trillion U.S. health systems away from costly fee-for-service medicine, beginning with the Medicare program for the elderly and disabled. ~
DHI,US STOCKS-Wall St rises after Greek elections; energy climbs * Indexes up: Dow 0.03 pct, S&P; 500 up 0.26 pct, Nasdaq up 0.29 pct   (Updates to close) ~US STOCKS-Wall St flat after Greek leftists' victory; energy stocks up * Indexes: Dow flat, S&P; 500 up 0.1 pct, Nasdaq up 0.2 pct   (Updates to early afternoon trading) ~US STOCKS-Wall St flat after leftists win Greek elections * Dow down 0.1 pct, S&P; 500 and Nasdaq flat   (Updates to midday trading) ~US STOCKS-Wall St flat after leftists win Greek elections * Indexes: Dow and S&P; 500 flat, Nasdaq up 0.1 pct   (Updates to mid-morning trading) ~Higher home sales boost D.R. Horton's revenue D.R. Horton Inc , the largest U.S. homebuilder by number of homes sold, reported a higher-than-expected 37 percent jump in quarterly revenue as it delivered more homes. ~UPDATE 1-Higher home sales boost D.R. Horton's revenue Jan 26 D.R. Horton Inc, the largest U.S. homebuilder by number of homes sold, reported a higher-than-expected 37 percent jump in quarterly revenue as it delivered more homes. ~D.R. Horton revenue jumps on higher home sales Jan 26 D.R. Horton Inc, the largest U.S. homebuilder by number of homes sold, reported a 37 percent rise in quarterly revenue as it delivered more homes. ~
DOW,BRIEF-Downer EDI says offer for Spotless Group now closed * Confirms that its offer for Spotless was not extended and has now closed. Source text for Eikon: Further company coverage: ~BRIEF-Downer EDI posts FY net profit of $181.5 million * FY total revenue and other income from ordinary activities $7.29 billion , up 6.4 percent ~BRIEF-Downer EDI says ‍offer for Spotless Group extended to 28 August 2017​ * ‍Offer for Spotless Group extended to 7pm on Monday, 28 august 2017​ Source text for Eikon: Further company coverage: ~BRIEF-Downer EDI says Spotless ‍offer extended to Aug 21, 2017​ * Spotless ‍offer extended to 7pm on monday, 21 august 2017​ Source text for Eikon: Further company coverage: ~BRIEF-Downer EDI's takeover offer for Spotless Group extended till 7pm (Sydney time) on Aug. 14 * Unconditional takeover offer for Spotless Group extended until 7:00pm (Sydney time) on Monday, 14 August Source text for Eikon: Further company coverage: (bangalore.newsroom@thomsonreuters.com) ~BRIEF-Downer extends takeover offer for Spotless Group * decided to extend Spotless offer period for one week; offer will now remain open for acceptance until 14 august Source text for Eikon: Further company coverage: ~BRIEF-Downer extends Spotless offer to August 7 2017 * ‍Downer has decided to extend offer for Spotless Group holdings to 7 pm on Monday, 7 august 2017​ Source text for Eikon: Further company coverage: ~BRIEF-Downer EDI's stake in Spotless increases to 80.3 pct * Downer's stake in Spotless increases to 80.3 pct Source text for Eikon: Further company coverage: ~BRIEF- Downer EDI Ltd'S stake in Spotless Group increases to 72% * As Downer's shareholding in Spotless is now over 70%, Downer expects that Spotless will be removed from certain S&P;/ASX market indices ~
FB.O,Oculus VR forms in-house studio for virtual reality movies PARK CITY, Utah, Jan 26 Facebook Inc's  Oculus VR is getting into movies with an in-house studio dedicated to making virtual reality films and will be showing a short movie on Monday, the company said. ~UPDATE 1-Turkish court orders Facebook to block pages insulting Mohammad - media ANKARA, Jan 26 A Turkish court has ordered Facebook to block a number of pages deemed insulting to the Prophet Mohammad, threatening to stop access to the whole social networking site if it does not comply, state broadcaster TRT reported. ~
GM,J.D. Power sees January U.S. auto sales rising 12.4 percent DETROIT, Jan 26 January U.S. auto sales will rise 12.4 percent from a relatively low base a year ago, industry consultants J.D. Power and LMC Automotive said on Monday. ~
GILD.O,PBM EnvisionRx chooses Gilead hepatitis C drugs for its formulary Jan 26 Pharmacy benefits manager EnvisionRx said on Monday it reached an agreement to provide its customers with Gilead Sciences Inc's hepatitis C drugs on an exclusive basis, the latest Gilead victory in a market share battle with AbbVie over their new treatments for the liver destroying virus. ~
HES,Hess slashes 2015 budget by 16 percent amidst cheap oil WILLISTON, N.D., Jan 26 Oil and natural gas producer Hess Corp cut its 2015 capital budget by 16 percent from last year's levels on Monday, saying the cuts should help the company safeguard its growth projects amidst low commodity prices. ~
IBM,Analysis: NY insider trading ruling tests prosecutors beyond Wall Street NEW YORK A court ruling that sharply curtailed the ability of prosecutors including Manhattan U.S. Attorney Preet Bharara to pursue insider trading cases is increasingly testing regulators' abilities across the country. ~NY insider trading ruling tests prosecutors beyond Wall Street NEW YORK A court ruling that sharply curtailed the ability of prosecutors including Manhattan U.S. Attorney Preet Bharara to pursue insider trading cases is increasingly testing regulators' abilities across the country. ~NY insider trading ruling tests prosecutors beyond Wall Street NEW YORK A court ruling that sharply curtailed the ability of prosecutors including Manhattan U.S. Attorney Preet Bharara to pursue insider trading cases is increasingly testing regulators' abilities across the country. ~
IP,UPDATE 4-Rock-Tenn, MeadWestvaco to merge, create packaging giant * Shares of both companies hit record highs   (Add Breakingviews link, updates shares) ~Packaging companies Rock-Tenn, MeadWestvaco to merge Packaging companies Rock-Tenn Co and MeadWestvaco Corp will combine to form a company worth $16 billion to take on market leader International Paper Co  as demand for corrugated boxes surges in North America. ~
KMB,CORRECTED-Diaper wars: Kimberly to take on P&G; through innovation, higher ad spend (Jan 23) Jan 23 Kimberly-Clark Corp is set to increase advertising and promotional spending for its diapers and launch new products in an escalating war with bigger rival Procter and Gamble Co in North America. ~
KMI,Energy Transfer Partners to buy Regency unit for $11 billion Pipeline company Energy Transfer Partners LP  said on Monday it would buy affiliate Regency Energy Partners LP  for about $11 billion, the latest example of master limited partnerships (MLP) trying to simplify their structures and lift returns. ~UPDATE 2-Energy Transfer Partners to buy Regency unit for $11 bln Jan 26 Pipeline company Energy Transfer Partners LP said on Monday it would buy affiliate Regency Energy Partners LP for about $11 billion, the latest example of master limited partnerships (MLP) trying to simplify their structures and lift returns. ~
MMC,Former Marsh executives' lawsuit over severance dismissed after bid-rigging probe NEW YORK A lawsuit by two former Marsh & McLennan Cos managing directors seeking severance pay and stock awards after they were exonerated in a bid-rigging probe was dismissed by a judge on Monday. ~Former Marsh executives' lawsuit over severance dismissed after bid-rigging probe NEW YORK, Jan 26 A lawsuit by two former Marsh & McLennan Cos managing directors seeking severance pay and stock awards after they were exonerated in a bid-rigging probe was dismissed by a judge on Monday. ~
MAT.O,Mattel says Bryan Stockton resigns as CEO Jan 26 Toymaker Mattel Inc said Bryan Stockton had resigned as chief executive and chairman. ~
MSFT.O,Microsoft sees currency cutting revenue growth by 4 percent this quarter SEATTLE Microsoft Corp's Chief Financial Officer said on Monday that she expected the company's fiscal third-quarter revenue growth to be cut by four percent by unfavorable currency exchange rates, assuming the U.S. dollar continues its strong run. ~Microsoft sees currency cutting revenue growth by 4 pct this quarter SEATTLE, Jan 26 Microsoft Corp's Chief Financial Officer said on Monday that she expected the company's fiscal third-quarter revenue growth to be cut by four percent by unfavorable currency exchange rates, assuming the U.S. dollar continues its strong run. ~UPDATE 2-Microsoft profit falls on sluggish Windows, currency pressure SEATTLE, Jan 26 Microsoft Corp on Monday reported a fall in its quarterly profit that was in line with Wall Street forecasts, as sluggish personal computer sales dampened demand for Windows software and the company struggled with the impact of the strong U.S. dollar. ~Microsoft profit falls on sluggish Windows demand, tax charge SEATTLE, Jan 26 Microsoft Corp said on Monday fiscal second-quarter profit fell, as sluggish personal computer sales dampened demand for Windows software and the company had a one-time tax expense relating to an audit in the United States. ~India honors Bill Gates with civilian award NEW DELHI India conferred one of its highest civilian awards on billionaire philanthropist and Microsoft co-founder Bill Gates and his wife Melinda for their work to improve health in developing countries. ~India honours Bill Gates with civilian award NEW DELHI, Jan 26 India conferred one of its highest civilian awards on billionaire philanthropist and Microsoft co-founder Bill Gates and his wife Melinda for their work to improve health in developing countries. ~
NSC,Norfolk Southern profit dips on declining coal volumes CHICAGO, Jan 26 Norfolk Southern Corp, the No. 4 U.S. railroad, on Monday said quarterly profit fell slightly due to falling coal volumes. ~
PFE,Pfizer cuts vaccine price for poor as GAVI group seeks $7.5 bln LONDON, Jan 26 Pfizer is to cut the price of its pneumococcal vaccine Prevenar 13 by 6 percent to $3.10 per dose in poor countries as part of a commitment to the GAVI global vaccines alliance, the U.S. drugmaker said on Monday. ~What to Watch in the Day Ahead - Tuesday, Jan. 27 (The Day Ahead is an email and PDF publication that includes the day's major stories and events, analyses and other features. To receive The Day Ahead, Eikon users can register at . Thomson One users can register at RT/DAY/US. All times in ET/GMT)  Apple Inc is expected to report one of its strongest quarters ever, helped by strong unit sales of its larger-screen iPhone 6 and 6 Plus. The new iPhones are helping Apple chip away at Samsung Electronics' dominant position in its home turf of South K ~RPT - INSIGHT-Safety concerns cloud early promise of powerful new cancer drugs NEW YORK, Jan 26 A new wave of experimental cancer drugs that directly recruit the immune system's powerful T cells are proving to be immensely effective weapons against tumors, potentially transforming the $100 billion global market for drugs that fight the disease. ~Safety concerns cloud early promise of powerful new cancer drugs NEW YORK A new wave of experimental cancer drugs that directly recruit the immune system's powerful T cells are proving to be immensely effective weapons against tumors, potentially transforming the $100 billion global market for drugs that fight the disease. ~INSIGHT-Safety concerns cloud early promise of powerful new cancer drugs NEW YORK, Jan 26 A new wave of experimental cancer drugs that directly recruit the immune system's powerful T cells are proving to be immensely effective weapons against tumors, potentially transforming the $100 billion global market for drugs that fight the disease. ~
PG,CORRECTED-Diaper wars: Kimberly to take on P&G; through innovation, higher ad spend (Jan 23) Jan 23 Kimberly-Clark Corp is set to increase advertising and promotional spending for its diapers and launch new products in an escalating war with bigger rival Procter and Gamble Co in North America. ~
REGN.O,Regeneron/Sanofi cholesterol drug gets FDA priority review Jan 26 Regeneron Pharmaceuticals on Monday said U.S. health regulators accepted its application to review a potent  cholesterol drug on a priority basis, potentially giving it the upper hand in a fierce race with Amgen  to bring a new medicine from the promising class to market. ~
STX.O,UPDATE 3-Weak retail business in Europe hits Seagate revenue * Shares fall almost 12 pct   (Adds analyst comments, updates share movement) ~
TEL,TE Connectivity nears deal to sell network business to CommScope -WSJ Jan 26 Swiss electronics company TE Connectivity Ltd is said to be nearing a deal to sell its network equipment unit to CommScope Holding Co Inc for about $3 billion, the Wall Street Journal reported, citing people familiar with the matter. ~
TXN.O,UPDATE 2-Texas Instruments' profit rises, helped by auto industry SAN FRANCISCO, Jan 26 Texas Instruments Inc  reported higher fourth-quarter results on Monday and gave a revenue outlook for the current quarter in line with expectations, helped by growing demand for chips from the auto industry. ~Texas Instruments 4th-qtr revenue slightly exceeds Wall St view SAN FRANCISCO, Jan 26 Texas Instruments Inc  posted fourth-quarter revenue of $3.27 billion, up 8 percent from the year-ago period and slightly above Wall Street forecasts as it deepened its focus on analog and embedded chips. ~
KO,UK's FTSE lags continental peers amid commodity selloff LONDON, Jan 26 Britain's top share index recovered late on Monday, helped by a rebound in energy shares, although hefty falls in Greece-exposed Coca-Cola HBC  capped gains. ~
UTX,UPDATE 2-United Tech cuts 2015 forecasts on currency worries Jan 26 United Technologies Corp on Monday cut its full-year outlook because of the negative impact of a stronger dollar even as the U.S. conglomerate reported higher quarterly earnings on a rise in profit at its aerospace businesses. ~United Tech profit rises, but cuts 2015 view on currency worries Jan 26 United Technologies Corp said on Monday that quarterly earnings edged up, helped by higher profit at its aerospace businesses, but the U.S. conglomerate cut its full-year outlook because of a negative impact of the stronger dollar. ~
VZ,UPDATE 1-Verizon to pay $5 mln for problems with calls to U.S. rural areas WASHINGTON, Jan 26 Verizon Communications Inc  will pay a $2 million fine and spend $3 million on compliance programs to settle a government inquiry into calls not going through to some customers in rural areas, U.S. regulators said on Monday. ~U.S. govt unveils goal to move Medicare away from fee-for-service WASHINGTON The Obama administration on Monday unveiled an ambitious plan to control health costs by moving the $2.9 trillion U.S. health systems away from costly fee-for-service medicine, beginning with the Medicare program for the elderly and disabled. ~UPDATE 1-U.S. govt unveils goal to move Medicare away from fee-for-service WASHINGTON, Jan 26 The Obama administration on Monday unveiled an ambitious plan to control health costs by moving the $2.9 trillion U.S. health systems away from costly fee-for-service medicine, beginning with the Medicare program for the elderly and disabled. ~Verizon agrees to $5 mln settlement over rural call completion WASHINGTON, Jan 26 Verizon Communications Inc will pay a $2 million fine and commit $3 million to a new compliance program to settle a U.S. government inquiry into low call answer rates to numerous rural areas, the Federal Communications Commission said on Monday. ~Cablevision to launch WiFi phone service for data-hungry users SAN FRANCISCO Cablevision System Corp said on Monday it would launch in February a wireless Internet phone service to give users an alternative to pricier data plans from cellular companies such as AT&T; and Verizon. ~Cablevision to launch WiFi phone service for data-hungry users SAN FRANCISCO, Jan 26 Cablevision System Corp  said on Monday it would launch in February a wireless Internet phone service to give users an alternative to pricier data plans from cellular companies such as AT&T; and Verizon. ~
V,BRIEF-Visa calls for redemption all of its 1.200 pct notes due 2017 * Visa Inc - on Sept 11, co called for redemption all of $1.75 billion principal amount outstanding of its 1.200 pct notes due 2017‍​ - SEC filing ~BRIEF-Visa Inc files for three-part senior notes offering of up to $2.5 bln * Visa Inc says files for three-part senior notes offering of up to $2.5 billion - SEC filing‍​ ~Former BoE deputy Hogg to join Visa as Europe unit CEO Visa Inc, the world's largest payments processor, on Thursday named former Bank of England (BoE) deputy governor Charlotte Hogg as chief executive of its Europe division. ~CORRECTED-UPDATE 1-MOVES-Former BoE deputy Hogg to join Visa as Europe unit CEO Sept 7 Visa Inc, the world's largest payments processor, on Thursday named former Bank of England (BoE) deputy governor Charlotte Hogg as chief executive of its Europe division. ~MOVES-Visa names ex-BoE deputy Charlotte Hogg as Europe unit CEO Sept 7 Visa Inc, the world's largest payments processor, on Thursday named Charlotte Hogg as chief executive of its Europe division. ~BRIEF-Visa appoints Charlotte Hogg as CEO of European operations * Visa Inc appoints Charlotte Hogg as chief executive officer of the compan's European operations ~BRIEF-Visa Inc files prospectus supplement for potential three-part senior notes offering * Visa Inc files prospectus supplement for potential three-part senior notes offering; size not disclosed - sec filing‍​ Source text (http://bit.ly/2vLDrIe) Further company coverage: ~BRIEF-Visa enables on the go payments with the new Fitbit Ionic * Visa inc- ‍enabling visa payments on fitbit's smartwatch fitbit ionic​ ~BRIEF-Bridg raises $11 million in Series B funding * Bridg raises $11 million in Series B funding from Morpheus Ventures, March Capital, Visa and NextEquity ~
