MMM,Market darling 3M sees stock stumble with lowered outlook April 23 For two years, 3M Co has been among the best bets in industrial stocks, with analysts swooning over its financial performance and desire to return cash to shareholders. That momentum stalled on Thursday. ~3M cuts full-year profit outlook as strong dollar bites sales U.S. manufacturer 3M Co  posted a 0.7 percent decline in quarterly net income on Thursday and cut its full-year profit forecast as the strong dollar bites into sales more than it previously projected. ~UPDATE 2-3M cuts full-year profit outlook as strong dollar bites sales April 23 U.S. manufacturer 3M Co posted a 0.7 percent decline in quarterly net income on Thursday and cut its full-year profit forecast as the strong dollar bites into sales more than it previously projected. ~3M cuts full-year profit outlook as strong dollar bites sales April 23 U.S. manufacturer 3M Co posted slightly lower quarterly net income on Thursday and cut its full-year profit forecast as the strong dollar bites into sales more than it previously forecast. ~
ABBV.N,CORRECTED-UPDATE 1-Drugmaker AbbVie's profit beats estimates on strong Humira sales April 23 U.S. drugmaker AbbVie Inc  reported better-than-expected quarterly profit and revenue, driven by strong sales of its arthritis drug, Humira. ~Drugmaker AbbVie profit rises on sales of Humira April 23 U.S. drugmaker AbbVie Inc  reported a 4 percent rise in quarterly profit, driven by strong sales of its arthritis drug, Humira. ~
APD,Air Products JV gets $2 bln contract for world's biggest industrial gas plant KHOBAR, Saudi Arabia, April 23 A joint venture between Saudi Arabia's Acwa Holding and U.S.-based Air Products  has been awarded a contract to build, own and operate the world's largest industrial gas complex by Saudi Aramco, a statement said on Thursday. ~
ALK,UPDATE 1-Alaska Air Group first-quarter profit tops expectations April 23 Alaska Air Group Inc on Thursday reported first-quarter profit that topped analysts' expectations helped by lower fuel costs. ~Alaska Air Group first-quarter profit tops expectations April 23 Alaska Air Group Inc on Thursday reported first-quarter profit that topped analysts' expectations helped by lower fuel costs. ~
GOOGL.O,US STOCKS-Nasdaq sets closing record (Adds details on volume, quote, Google, Amazon, Microsoft up after the bell)     * Nasdaq tops March 10, 2000, high of 5,048.62     * S&P; 500 hits intraday record high     * Indexes: Dow up 0.11 pct, S&P; up 0.24 pct, Nasdaq up 0.41 pct      By Caroline Valetkevitch     April 23 The Nasdaq Composite, the U.S. market index most closely associated with technology stocks, closed at an all-time high on Thursday, surpassing a 2000 record set just before the dotcom crash.     Its new rec ~Factbox: Nasdaq's 'Cubes' ETF reaps Nasdaq's big run The Nasdaq's alter ego, the PowerShares QQQ fund, has been the go-to exchange-traded fund for individual investors, pension funds, foreign insurers, sovereign wealth funds, and just about anyone else who has ever had the desire to tap technology sector growth for a quick trade or a long hold. ~Google first-quarter revenue rises 12 pct April 23 Google Inc's first-quarter revenue jumped 12 percent, helped by an 11 percent increase in ad sales. ~German engineers need software to head off technology firms FRANKFURT If customers of Germany's Harting Group, a maker of industrial plugs and sockets, want bespoke products, they can buy them -- if they're prepared to assemble them from a kit themselves. ~RPT-German engineers need software to head off technology firms FRANKFURT, April 23 If customers of Germany's Harting Group, a maker of industrial plugs and sockets, want bespoke products, they can buy them -- if they're prepared to assemble them from a kit themselves. ~As YouTube marks 10th year, Facebook emerges as video threat April 23 It's 10 years to the day since the first clip ("Me at the Zoo") was uploaded on YouTube, and the service - now owned by Google Inc - has dominated online video-sharing ever since. ~
GOOG.O,US STOCKS-Nasdaq sets closing record (Adds details on volume, quote, Google, Amazon, Microsoft up after the bell)     * Nasdaq tops March 10, 2000, high of 5,048.62     * S&P; 500 hits intraday record high     * Indexes: Dow up 0.11 pct, S&P; up 0.24 pct, Nasdaq up 0.41 pct      By Caroline Valetkevitch     April 23 The Nasdaq Composite, the U.S. market index most closely associated with technology stocks, closed at an all-time high on Thursday, surpassing a 2000 record set just before the dotcom crash.     Its new rec ~Factbox: Nasdaq's 'Cubes' ETF reaps Nasdaq's big run The Nasdaq's alter ego, the PowerShares QQQ fund, has been the go-to exchange-traded fund for individual investors, pension funds, foreign insurers, sovereign wealth funds, and just about anyone else who has ever had the desire to tap technology sector growth for a quick trade or a long hold. ~Google first-quarter revenue rises 12 pct April 23 Google Inc's first-quarter revenue jumped 12 percent, helped by an 11 percent increase in ad sales. ~German engineers need software to head off technology firms FRANKFURT If customers of Germany's Harting Group, a maker of industrial plugs and sockets, want bespoke products, they can buy them -- if they're prepared to assemble them from a kit themselves. ~RPT-German engineers need software to head off technology firms FRANKFURT, April 23 If customers of Germany's Harting Group, a maker of industrial plugs and sockets, want bespoke products, they can buy them -- if they're prepared to assemble them from a kit themselves. ~As YouTube marks 10th year, Facebook emerges as video threat April 23 It's 10 years to the day since the first clip ("Me at the Zoo") was uploaded on YouTube, and the service - now owned by Google Inc - has dominated online video-sharing ever since. ~
AMZN.O,UPDATE 3-Amazon revenue beats, cloud computing more profitable than expected April 23 Amazon.com Inc's first-quarter revenue grew more than expected as rising sales in North America and its burgeoning cloud-computing services unit offset new business investments, boosting its shares nearly 7 percent. ~Amazon's quarterly revenue rises 15 pct April 23 E-commerce company Amazon.com Inc's  quarterly revenue rose 15 percent, helped by higher revenue from North America, its biggest market, and its fast-growing cloud-computing services unit. ~As Amazon parties on, some large fund managers take their leave NEW YORK For many years, investors have been very tolerant as Amazon.com has sacrificed profits for rapid growth in sales and as it built new businesses. That patience may finally be wearing thin. ~UPDATE 1-As Amazon parties on, some large fund managers take their leave NEW YORK, April 22 For many years, investors have been very tolerant as Amazon.com has sacrificed profits for rapid growth in sales and as it built new businesses. That patience may finally be wearing thin. ~As Amazon parties on, some large fund managers take their leave NEW YORK, April 22 For many years, investors have been very tolerant as Amazon.com has sacrificed profits for rapid growth in sales and as it built new businesses. That patience may finally be wearing thin. ~
AIG,AIG in $40 million accord over crisis-era retirement plan losses NEW YORK American International Group Inc has reached a $40 million settlement of claims it should not have let employees invest their retirement savings in company stock as the insurer headed into the 2008 financial crisis, which nearly caused its collapse. ~UPDATE 1-AIG in $40 mln accord over crisis-era retirement plan losses NEW YORK, April 23 American International Group Inc has reached a $40 million settlement of claims it should not have let employees invest their retirement savings in company stock as the insurer headed into the 2008 financial crisis, which nearly caused its collapse. ~AIG reaches $40 mln settlement over retirement plans NEW YORK, April 23 American International Group Inc has reached a $40 million settlement of claims that it should not have offered company stock as an investment option in its retirement plans, because the stock was an imprudent investment. ~
AAPL.O,Factbox: Nasdaq's 'Cubes' ETF reaps Nasdaq's big run The Nasdaq's alter ego, the PowerShares QQQ fund, has been the go-to exchange-traded fund for individual investors, pension funds, foreign insurers, sovereign wealth funds, and just about anyone else who has ever had the desire to tap technology sector growth for a quick trade or a long hold. ~BRIEF-Ericsson CEO: Ambition to settle patent dispute with Apple outside court * CEO says ambition in patent dispute with Apple is to settle outside court.   Further company coverage: ~Cost of Galaxy's battle against iPhone on the rise SEOUL, Samsung Electronics  has pulled out all the stops on its new Galaxy smartphones, but their modest prices compared to the latest iPhones throw an uneasy spotlight on the long-term cost of fighting Apple's  premium branding. ~Apple tests smartwatch market with quiet debut of Cook's first product NEW YORK The Apple Watch will launch with a whisper rather than a bang on Friday, an unusual start for the company that may reflect early uncertainty about demand for Apple Inc boss Tim Cook's first new product. ~Apple tests smartwatch market with quiet debut of Cook's first product NEW YORK, April 22 The Apple Watch will launch with a whisper rather than a bang on Friday, an unusual start for the company that may reflect early uncertainty about demand for Apple Inc boss Tim Cook's first new product. ~
T,DIARY-U.S. MEETINGS/WEEK AHEAD Thomson Reuters April 23, 2015 - Corporate Meetings for US companies for Week ahead.         S&P; 500 Earnings - MONTH AHEAD     Dividends                            Non S&P; 500 - Weekly             Federal Reserve events               ConferenceCall/Webcast - Weekly  Meetings - Weekly                                Xtra users can see more details on conference calls & webcasts by hovering your mouse  over the RIC, right click, no click on Related Co Data, now click on Co Events.                  ~
BAC,How Wall Street came out on gay marriage WASHINGTON On March 6, the day of the U.S. Supreme Court's deadline for legal briefs backing same-sex marriage, gay rights activists quietly celebrated a victory on Wall Street. ~RPT-INSIGHT-How Wall Street came out on gay marriage WASHINGTON, April 23 On March 6, the day of the U.S. Supreme Court's deadline for legal briefs backing same-sex marriage, gay rights activists quietly celebrated a victory on Wall Street. ~INSIGHT-How Wall Street came out on gay marriage WASHINGTON, April 23 On March 6, the day of the U.S. Supreme Court's deadline for legal briefs backing same-sex marriage, gay rights activists quietly celebrated a victory on Wall Street. ~
BA,Boeing CEO warns of job relocations if U.S. Ex-Im Bank disappears WASHINGTON, April 23 Boeing Co may have to relocate U.S.-based engineering and manufacturing jobs overseas if Congress eliminates funding for the U.S. Export-Import Bank, Chief Executive Jim McNerney said on Thursday. ~United Airlines swaps 10 Boeing Dreamliners for 777-300ER jets United Airlines said Thursday that it has swapped 10 orders of Boeing Co  787 Dreamliners for 10 larger 777-300ER jets, marking a victory for the plane manufacturer as it seeks to sell out the 777 planes before their production ends. ~UPDATE 2-United Airlines swaps 10 Boeing Dreamliners for 777-300ER jets April 23 United Airlines said Thursday that it has swapped 10 orders of Boeing Co 787 Dreamliners for 10 larger 777-300ER jets, marking a victory for the plane manufacturer as it seeks to sell out the 777 planes before their production ends. ~DIARY-U.S. MEETINGS/WEEK AHEAD Thomson Reuters April 23, 2015 - Corporate Meetings for US companies for Week ahead.         S&P; 500 Earnings - MONTH AHEAD     Dividends                            Non S&P; 500 - Weekly             Federal Reserve events               ConferenceCall/Webcast - Weekly  Meetings - Weekly                                Xtra users can see more details on conference calls & webcasts by hovering your mouse  over the RIC, right click, no click on Related Co Data, now click on Co Events.                  ~
CAT,UPDATE 3-Caterpillar sees challenges in strong dollar, weak oil, unrest CHICAGO, April 23 Caterpillar Inc on Thursday gave a somber outlook for the rest of 2015, facing stiffening competition thanks to the strong U.S. dollar, weak oil prices bringing a tough energy equipment market and geopolitical tensions posing risks to growth. ~REFILE-Caterpillar quarterly profit rises CHICAGO, April 23 Caterpillar Inc on Thursday reported a higher quarterly net profit despite a dip in revenue, citing a boost from the strong U.S. dollar on imported goods, especially from Japan, and a pre-tax gain from the sale of a third-party logistics business. ~
SCHW.N,UPDATE 1-Schwab CEO praises fast 'robo advisor' start, laments low rates NEW YORK, April 23 Charles Schwab Corp's  automated investment product has attracted $1.5 billion of assets in over 23,000 accounts in its first six weeks, about 20 percent of whom are new clients, Chief Executive Officer Walt Bettinger told analysts on Thursday. ~Schwab CEO praises fast 'robo advisor' start, laments low trading NEW YORK, April 23 Charles Schwab Corp's  automated investment product has attracted $1.5 billion of assets in over 23,000 accounts in its first six weeks, about 20 percent of whom are new clients, Chief Executive Officer Walt Bettinger told analysts on Thursday. ~
CMCSA.O,Comcast looking to drop Time Warner Cable merger: source NEW YORK/WASHINGTON Comcast Corp's board was meeting late on Thursday to finalize plans to abandon its proposed $45 billion merger with  Time Warner Cable Inc, according to a person directly familiar with the matter. | Video  ~UPDATE 3-Comcast looking to drop Time Warner Cable merger -source * Senator Franken: Collapse would be "huge victory" for consumers   (Recasts with new sourcing; adds quote from advocacy group, background) ~Comcast's board meets to drop Time Warner Cable bid -source April 23 Comcast Corp's board was meeting late on Thursday to finalize plans to abandon its $45 billion merger agreement with  Time Warner Cable Inc, according to a person directly familiar with the matter. ~Deals of the day- Mergers and acquisitions April 23 The following bids, mergers, acquisitions and disposals were reported by 2000 GMT on Thursday: ~PRESS DIGEST- New York Times business news - April 23 April 23 The following are the top stories on the New York Times business pages. Reuters has not verified these stories and does not vouch for their accuracy. ~FCC staff recommends hearing for proposed Comcast-Time Warner Cable merger - WSJ WASHINGTON The U.S. Federal Communications Commission's staff has recommended that the agency designate Comcast Corp's proposed $45 billion acquisition of Time Warner Cable Inc for a hearing, the Wall Street Journal reported on Wednesday, calling it a significant setback for the deal. ~UPDATE 2-U.S. FCC staff recommends hearing for proposed Comcast-Time Warner Cable merger -WSJ WASHINGTON, April 22 The U.S. Federal Communications Commission's staff has recommended that the agency designate Comcast Corp's proposed $45 billion acquisition of Time Warner Cable Inc for a hearing, the Wall Street Journal reported on Wednesday, calling it a significant setback for the deal. ~
DOW,BRIEF-Downer EDI says offer for Spotless Group now closed * Confirms that its offer for Spotless was not extended and has now closed. Source text for Eikon: Further company coverage: ~BRIEF-Downer EDI posts FY net profit of $181.5 million * FY total revenue and other income from ordinary activities $7.29 billion , up 6.4 percent ~BRIEF-Downer EDI says ‍offer for Spotless Group extended to 28 August 2017​ * ‍Offer for Spotless Group extended to 7pm on Monday, 28 august 2017​ Source text for Eikon: Further company coverage: ~BRIEF-Downer EDI says Spotless ‍offer extended to Aug 21, 2017​ * Spotless ‍offer extended to 7pm on monday, 21 august 2017​ Source text for Eikon: Further company coverage: ~BRIEF-Downer EDI's takeover offer for Spotless Group extended till 7pm (Sydney time) on Aug. 14 * Unconditional takeover offer for Spotless Group extended until 7:00pm (Sydney time) on Monday, 14 August Source text for Eikon: Further company coverage: (bangalore.newsroom@thomsonreuters.com) ~BRIEF-Downer extends takeover offer for Spotless Group * decided to extend Spotless offer period for one week; offer will now remain open for acceptance until 14 august Source text for Eikon: Further company coverage: ~BRIEF-Downer extends Spotless offer to August 7 2017 * ‍Downer has decided to extend offer for Spotless Group holdings to 7 pm on Monday, 7 august 2017​ Source text for Eikon: Further company coverage: ~BRIEF-Downer EDI's stake in Spotless increases to 80.3 pct * Downer's stake in Spotless increases to 80.3 pct Source text for Eikon: Further company coverage: ~BRIEF- Downer EDI Ltd'S stake in Spotless Group increases to 72% * As Downer's shareholding in Spotless is now over 70%, Downer expects that Spotless will be removed from certain S&P;/ASX market indices ~
ETFC.O,Discount brokerage E*Trade Financial's profit plunges 59 pct April 23 Discount brokerage E*Trade Financial Corp's quarterly profit plunged about 59 percent, hurt by lower commissions from trading services. ~
EW,Edwards Lifesciences 1st-qtr net profit doubles, sales rise 13 pct April 23 Medical device maker Edwards Lifesciences Corp said on Thursday quarterly net earnings doubled due to strong heart valve sales and a positive impact from foreign exchange. ~
FB.O,UPDATE 1-Nasdaq to settle Facebook IPO lawsuit for $26.5 million NEW YORK, April 23 In a first for a U.S. stock exchange, Nasdaq OMX Group on Thursday agreed to pay $26.5 million to settle a class-action lawsuit involving its bungling of Facebook Inc's $16 billion initial public offering, the plaintiffs' lawyers said. ~
F,As sales of small cars dip, Ford to lay off about 700 workers at Michigan plant DETROIT, April 23 Ford Motor Co said on Thursday it will lay off about 700 workers at a Detroit-area plant making compact and compact hybrid cars, responding to a dip in demand for such vehicles amid lower gasoline prices. ~
FCX,Miner Freeport-McMoRan reports first-quarter loss on charges TORONTO, April 23 U.S. miner and oil producer Freeport-McMoRan Inc reported a first-quarter loss on Thursday, as it recorded one-time charges of $2.4 billion, mainly for the reduction of the carrying value of its oil and gas properties. ~
GM,GM first-quarter profit misses estimates on South America, Russia weakness DETROIT General Motors posted a smaller-than-expected quarterly profit on Thursday on weakness in South America and Russia and a higher tax rate, sending shares down 3.5 percent. | Video  ~Pricing pressure in U.S., China raises fears about future profits DETROIT The strength of the U.S. and China economies has helped companies like General Motors Co offset weakness in others parts of the world, but growing pricing pressure in those lucrative markets could be a warning sign for future profits. ~Pricing pressure in U.S., China raises fears about future profits DETROIT, April 23 The strength of the U.S. and China economies has helped companies like General Motors Co  offset weakness in others parts of the world, but growing pricing pressure in those lucrative markets could be a warning sign for future profits. ~UPDATE 3-GM 1st-qtr profit misses estimates on South America, Russia weakness DETROIT, April 23 General Motors posted a smaller-than-expected quarterly profit on Thursday on weakness in South America and Russia and a higher tax rate, sending shares down 3.5 percent. ~Auto lender GM Financial revenue jumps 23 percent General Motors Financial Co Inc, the auto financing arm of General Motors Co , reported a 23 percent jump in quarterly revenue, as it benefited from the automaker's efforts to bolster its lending operations. ~Auto lender GM Financial revenue jumps 23 pct April 23 General Motors Financial Co Inc, the auto financing arm of General Motors Co, reported a 23 percent jump in quarterly revenue, as it benefited from the automaker's efforts to bolster its lending operations. ~GM posts weaker-than-expected quarterly profit DETROIT, April 23 General Motors Co on Thursday posted a weaker-than-expected quarterly profit as weakness in South America and Russia hurt demand and the company's tax rate came in higher than expected. ~
GS,Goldman Sachs Asset Management to buy Pacific Life business NEW YORK Goldman Sachs Group Inc's  Asset Management plans to acquire the Pacific Global Advisors solutions business from Pacific Life Insurance Co , the company said on Thursday. ~Goldman Sachs Asset Management to buy Pacific Life business NEW YORK, April 23 Goldman Sachs Group Inc's  Asset Management plans to acquire the Pacific Global Advisors solutions business from Pacific Life Insurance Co , the company said on Thursday. ~
GT.O,Goodyear to spend $550 million on tire plant in Mexico - source MEXICO CITY, April 22 Goodyear Tire & Rubber Co  is planning to spend $550 million on a new tire plant in Mexico, a person familiar with the matter said, the latest in a string of investment pledges in the country's booming auto sector. ~
HP,Helmerich & Payne profit beats on strong demand for high-tech rigs April 23 Oil and gas driller Helmerich & Payne Inc reported a better-than-expected quarterly profit as demand for its high-tech rigs remained resilient despite the slump in crude prices. ~
JCI,CORRECTED-UPDATE 1-Johnson Controls' 2nd-qtr revenue falls as dollar hurts April 23 Johnson Controls Inc, the largest U.S. auto parts supplier, reported a 3 percent fall in quarterly revenue, hurt by a stronger dollar. ~Johnson Controls profit doubles in 2nd qtr April 23 Johnson Controls Inc, the largest U.S. auto parts supplier, reported a 103 percent rise in quarterly profit as margins rose. ~
LLY,Lilly profit falls 27 percent, hurt by strong dollar April 23 Eli Lilly and Co reported a 27 percent fall in quarterly profit, hurt by a stronger dollar. ~
MSFT.O,Factbox: Nasdaq's 'Cubes' ETF reaps Nasdaq's big run The Nasdaq's alter ego, the PowerShares QQQ fund, has been the go-to exchange-traded fund for individual investors, pension funds, foreign insurers, sovereign wealth funds, and just about anyone else who has ever had the desire to tap technology sector growth for a quick trade or a long hold. ~Microsoft profit, revenue beats Wall Street view; shares up Microsoft Corp on Thursday reported revenue and profit above Wall Street expectations, as sales of its hardware and cloud-computing services helped to offset a decline in the company's core Windows business. ~UPDATE 2-Microsoft profit, revenue beats Wall St view; shares up April 23 Microsoft Corp on Thursday reported revenue and profit above Wall Street expectations, as sales of its hardware and cloud-computing services helped to offset a decline in the company's core Windows business. ~Microsoft profit, revenue beats Wall Street view April 23 Microsoft Corp on Thursday reported revenue and profit above Wall Street expectations, as sales of its hardware and cloud-computing products helped to offset a decline in its core Windows business. ~
MS,ON THE MOVE-Wells Fargo hires advisers from Morgan Stanley, Edward Jones April 23    Wells Fargo Advisors, the brokerage unit of Wells Fargo & Co, added eight advisers from Morgan Stanley and brokerage firm Edward Jones. ~Morgan Stanley's Australia property arm worth at least $2.3 billion after early bids - source SYDNEY Morgan Stanley's  sale of its Australian real estate unit, Investa Property Group, is expected to fetch more than A$3 billion ($2.3 billion) and has attracted more than 20 bids, a source with direct knowledge of the deal told Reuters. ~
NEM,UPDATE 1-Newmont Mining posts profit well ahead of estimate April 23 Newmont Mining Corp, the world's No. 2 gold miner,  reported an adjusted quarterly profit that was double the analysts' average estimate, helped by lower costs. ~Miner Newmont's adjusted profit rises 89 percent April 23 Newmont Mining Corp, the world's No. 2 gold producer, reported an 89 percent rise in first-quarter adjusted profit on Thursday, helped by lower costs and higher copper production. ~
NUE,Steelmaker Nucor's profit falls 39 pct April 23 Nucor Corp, the No. 1 U.S. steelmaker by market value, reported a 39 percent drop in quarterly profit, hurt by lower selling prices. ~
PEP,US STOCKS-Wall St flat as energy offsets weak data, earnings * Dow, S&P; 500, Nasdaq all down less than 0.1 pct   (Updates to late morning and changes comment) ~PepsiCo profit beats estimates on stronger Frito-Lay demand PepsiCo Inc reported better-than-expected first-quarter profit, helped by stronger demand for its Frito-Lay snacks in North America and price increases in its beverage business. ~UPDATE 2-PepsiCo profit beats estimates on stronger Frito-Lay demand April 23 PepsiCo Inc reported better-than-expected first-quarter profit, helped by stronger demand for its Frito-Lay snacks in North America and price increases in its beverage business. ~US STOCKS-Wall St flat as energy offsets weak data, earnings * Indexes: Dow off 0.1 pct; S&P; 500 and Nasdaq flat   (Updates to open) ~US STOCKS-Wall St to open lower on weak data, earnings * Futures down: Dow 66 pts, S&P; 6 pts, Nasdaq 9 pts   (Adds comment, data, updates prices) ~PepsiCo quarterly revenue falls 3.2 pct on strong dollar April 23 PepsiCo Inc said its quarterly revenue fell 3.2 percent, largely due to a strong dollar. ~
