AA,Alcoa queries US regulator over bid to reform LME policy WASHINGTON, June 8 Metals producer Alcoa Inc  on Monday challenged the U.S. commodities regulator's authority to intervene in a contentious overhaul of the London Metal Exchange's warehouse policy that has caused an unprecedented drop in aluminum prices. ~
GOOGL.O,ON THE MOVE-BlackRock taps Google scientist to help big data push June 8 BlackRock Inc, the world's largest asset manager, has hired Bill MacCartney, a former senior Google research scientist, as a managing director, joining its scientific-active equity team, a company spokesman confirmed to Reuters. ~Apple said to build high-speed data network: Bloomberg Apple Inc is setting up a high-speed network and upgrading how it builds data centers, to compete better with Amazon.com Inc, Google Inc and Microsoft Corp in cloud services, Bloomberg reported, citing people familiar with the plans. ~CORRECTED-Auction.com-Situs deal aims to move commercial property beyond local arena NEW YORK, June 8 Auction.com, an online marketplace for property backed by Google Inc and real estate mogul Barry Sternlicht, signed a deal with a commercial real estate advisory firm to provide due diligence in a step to enhance its services and help move sales further beyond the local arena. ~
GOOG.O,ON THE MOVE-BlackRock taps Google scientist to help big data push June 8 BlackRock Inc, the world's largest asset manager, has hired Bill MacCartney, a former senior Google research scientist, as a managing director, joining its scientific-active equity team, a company spokesman confirmed to Reuters. ~Apple said to build high-speed data network: Bloomberg Apple Inc is setting up a high-speed network and upgrading how it builds data centers, to compete better with Amazon.com Inc, Google Inc and Microsoft Corp in cloud services, Bloomberg reported, citing people familiar with the plans. ~CORRECTED-Auction.com-Situs deal aims to move commercial property beyond local arena NEW YORK, June 8 Auction.com, an online marketplace for property backed by Google Inc and real estate mogul Barry Sternlicht, signed a deal with a commercial real estate advisory firm to provide due diligence in a step to enhance its services and help move sales further beyond the local arena. ~
ADI.O,More deals seen in chips as Internet of Things blooms NEW YORK/SEATTLE, June 8  With the biggest year in chip deals since 2000 not even halfway through, mid-sized semiconductor makers appear to be prime takeover targets as the largest players look to round out their capabilities and turn their focus to chips for cars, watches and other devices, making the "Internet of Things" a reality. ~
AAPL.O,Apple to offer Apple Pay in UK in July, backed by banks, retailers BERLIN Apple Inc plans to introduce its mobile payments service to the UK next month, supported by major banks and high-street retailers and the operator of the London Underground, the technology company said on Monday. ~Apple muscles into streaming music market SAN FRANCISCO Apple launched Apple Music on Monday, a $9.99-a-month streaming music service that may not differ dramatically from competitors but comes with Apple's deep music roots, global brand and hundreds of millions of iTunes customers. | Video  ~UPDATE 6-Apple muscles into streaming music market SAN FRANCISCO, June 8 Apple launched Apple Music on Monday, a $9.99-a-month streaming music service that may not differ dramatically from competitors but comes with Apple's deep music roots, global brand and hundreds of millions of iTunes customers. ~Apple hit with patent lawsuit over Apple Watch Apple Inc, a frequent target of patent infringement lawsuits over its iPhone and iPad devices, now faces intellectual property claims on its newest product, the Apple Watch. ~Apple to offer Apple Pay in UK in July, backed by banks, retailers BERLIN, June 8 Apple Inc plans to introduce its mobile payments service to the UK next month, supported by major banks and high-street retailers and the operator of the London Underground, the technology company said on Monday. ~Apple said to build high-speed data network: Bloomberg Apple Inc is setting up a high-speed network and upgrading how it builds data centers, to compete better with Amazon.com Inc, Google Inc and Microsoft Corp in cloud services, Bloomberg reported, citing people familiar with the plans. ~US STOCKS-Wall St loses ground as investors eye September rate hike * Indexes down: Dow 0.33 pct, S&P; 0.50 pct, Nasdaq 0.94 pct   (Updates to mid-afternoon) ~US STOCKS-Wall St down on rate hike timing worries * Indexes down: Dow 0.23 pct, S&P; 0.34 pct, Nasdaq 0.59 pct   (Updates to early afternoon) ~Apple expected to focus on watch, music at developer conference June 8 Apple is expected to unveil a new music service and better tools to build apps for its smartwatch at its annual gathering of developers in San Francisco on Monday. ~
BLK,ON THE MOVE-BlackRock taps Google scientist to help big data push June 8 BlackRock Inc, the world's largest asset manager, has hired Bill MacCartney, a former senior Google research scientist, as a managing director, joining its scientific-active equity team, a company spokesman confirmed to Reuters. ~
C,Ecobank names Citigroup executive Ayeyemi as new CEO ACCRA, June 8 Pan-African bank Ecobank Transnational Incorporated  has named Ade Ayeyemi as its new group chief executive. ~
DAL,UPDATE 1-Delta Air Lines looks to strengthen global partnerships MIAMI, June 8 Delta Air Lines Inc is hoping to strengthen partnerships with carriers in South Korea, Mexico and Brazil, and it has been approached about investing in Japan's bankrupt Skymark Airlines, Delta's president Ed Bastian told reporters Monday. ~Deals of the day- Mergers and acquisitions June 8 The following bids, mergers, acquisitions and disposals were reported by 2000 GMT on Monday: ~Airlines have $3.7 bln ticket sales cash trapped in Venezuela -IATA MIAMI, June 8 Airlines have $3.7 billion of cash from ticket sales trapped in Venezuela because of currency controls in the South American country, the International Air Transport Association said on Monday. ~
XOM,UPDATE 1-Century-old Guyana-Venezuela border spat flares after Exxon find GEORGETOWN, Guyana, June 8 Guyana's new government attacked on Monday a territorial decree by Venezuelan President Nicolas Maduro as an attempt to annex its waters following an oil discovery. ~
GE,UPDATE 4-GE close to selling private equity lender to top Canada pension fund * CPPIB deal to include GE's Antares Capital business -source ~
GM,UPDATE 1-Brazil auto industry sees steepest downturn in 17 years SAO PAULO, June 8 Brazil's auto industry is expecting this year's downturn to be its worst since 1998, according to estimates on Monday by national automakers association Anfavea, which slashed its 2015 outlook for the second time in two months. ~DIARY-U.S. MEETINGS/WEEK AHEAD Thomson Reuters June 8, 2015 - Corporate Meetings for US companies for Week ahead.         S&P; 500 Earnings - MONTH AHEAD     Dividends                            Non S&P; 500 - Weekly             Federal Reserve events               ConferenceCall/Webcast - Weekly  Meetings - Weekly                                Xtra users can see more details on conference calls & webcasts by hovering your mouse  over the RIC, right click, no click on Related Co Data, now click on Co Events.             ** For ~
MCD,UPDATE 3-McDonald's European meal deals help offset weak U.S. May sales June 8 McDonald's Corp posted a smaller-than-expected drop in worldwide sales at established restaurants in May after a lift from value meal deals in Europe helped offset continued weakness in the United States, its top market for profit. ~US STOCKS-Wall St set to open modestly lower as rate hike timing weighs * Futures down: Dow 14 pts, S&P; 3.25 pts, Nasdaq 7 pts   (Adds details, comment, updates prices) ~McDonald's May comparable sales decline smaller than expected June 8 McDonald's Corp posted a smaller-than-expected decline in worldwide sales at established restaurants in May as strong sales in Europe more than offset a decline in the United States. ~
MON,Monsanto courts Syngenta investors to win deal support ZURICH/FRANKFURT Monsanto is hosting meetings across Europe to woo shareholders in Syngenta after the Swiss seed and crop chemical firm rejected a second takeover approach from its U.S. rival on Monday. | Video  ~UPDATE 2-Monsanto courts Syngenta investors to win deal support * Syngenta still rebuffs proposal after break-up fee added   (Releads, adds investor quotes, meeting details) ~Deutsche Bank and Diageo outperform weaker European stock markets LONDON, June 8 European shares fell on Monday, weighed down by a drop in agrochemicals group Syngenta  although Deutsche Bank outperformed to surge higher after boardroom changes. ~Swiss stocks - Factors to watch on June 8 ZURICH, June 8 The following are some of the main factors expected to affect Swiss stocks on Monday: ~Monsanto offers $2 billion fee to Syngenta as it pursues takeover NEW YORK U.S. agrochemicals firm Monsanto Co has offered to pay a $2 billion reverse break-up fee to Syngenta AG if it cannot obtain global regulatory approvals for an acquisition, it said in a statement on Sunday. ~Monsanto offers $2 billion fee to Syngenta as it pursues takeover NEW YORK, June 7 U.S. agrochemicals firm Monsanto Co has offered to pay a $2 billion reverse break-up fee to Syngenta AG if it cannot obtain global regulatory approvals for an acquisition, it said in a statement on Sunday. ~
MYL.A,UPDATE 2-Teva bosses issue riposte to Mylan, praise takeover plan AMSTERDAM, June 8 Executives at Israeli drugmaker Teva sent an open letter to takeover target Mylan on Monday, saying they remain committed to a deal and reiterated that Teva's $40 billion takeover proposal would benefit shareholders of both firms. ~Teva bosses say remain committed to Mylan takeover AMSTERDAM, June 8 Top executives at Israeli drugmaker Teva sent an open letter to takeover target Mylan on Monday, saying they remained committed to striking a deal and reasserting that Teva's $82-per-share offer would benefit shareholders of both firms. ~
NEM,UPDATE 2-Gold miner Newmont to buy Colorado mine from AngloGold June 8 Newmont Mining Corp has agreed to buy the Cripple Creek & Victor gold mine in Colorado from AngloGold Ashanti Ltd for $820 million, giving the world's No. 2 gold producer an expanding asset in a mining-friendly jurisdiction. ~Gold miner Newmont agrees to buy Colorado mine from AngloGold June 8 Newmont Mining Corp said on Monday it has agreed to buy the Cripple Creek & Victor gold mine in Colorado from AngloGold Ashanti Ltd for $820 million plus a net smelter royalty. ~
RTN,UPDATE 1-U.S., Japan say first test of Raytheon's new SM-3 missile a success WASHINGTON, June 7 The United States and Japan announced on Sunday the first live-fire test of Raytheon Co's  new Standard Missile-3 (SM-3) Block IIA missile that is being jointly developed by the two countries for several billion dollars. ~
LUV,Airlines hit headwinds from investors as they try to capture growth June 8 Major U.S. airlines' shares tumbled on Monday amid fears that the carriers are grabbing for market share at the expense of profits. ~
SBUX.O,UPDATE 3-McDonald's European meal deals help offset weak U.S. May sales June 8 McDonald's Corp posted a smaller-than-expected drop in worldwide sales at established restaurants in May after a lift from value meal deals in Europe helped offset continued weakness in the United States, its top market for profit. ~
TSN,U.S. Supreme Court takes up Tyson Foods class action challenge WASHINGTON The U.S. Supreme Court on Monday agreed to take up Tyson Foods Inc's challenge to an almost $5.8 million judgment awarded against the company over worker pay at an Iowa meat-processing facility in a case that gives the nine justices a new chance to curb class action litigation. ~UPDATE 2-U.S. Supreme Court takes up Tyson Foods class action challenge WASHINGTON, June 8 The U.S. Supreme Court on Monday agreed to take up Tyson Foods Inc's challenge to an almost $5.8 million judgment awarded against the company over worker pay at an Iowa meat-processing facility in a case that gives the nine justices a new chance to curb class action litigation. ~U.S. Supreme Court to hear new Tyson Foods class action case WASHINGTON, June 8 The U.S. Supreme Court on Monday agreed to take up Tyson Foods Inc's challenge to an almost $5.8 million judgment awarded against the company over worker pay at an Iowa meat processing facility. ~
UAL,United Airlines: unit rev to fall in lower half of previous guidance June 8 United Continental Holdings Inc  said on Monday that quarterly passenger revenue per available seat mile, which measures sales relative to the capacity and distance of its flights, will fall in the bottom half of its previous guidance. ~
UTX,Airbus watching whether UTC will sell Sikorsky helicopter unit HERZLIYA, Israel, June 8 Airbus is "watching with interest" to see whether United Technologies Corp (UTC) puts its Sikorsky helicopter business up for sale, the head of Airbus' U.S. division said on Monday. ~
