GOOGL.O,UPDATE 4-Microsoft hands display ads to AOL, maps to Uber SEATTLE, June 29 Microsoft Corp said on Monday it will hand over its display advertising business to AOL Inc and sell some map-generating technology to ride-hailing app company Uber, as it slims down its money-losing online operations. ~CORRECTED-Two rival self-driving cars have close call in California MOUNTAIN VIEW, Calif., June 25 Two self-driving prototype cars, one operated by Google Inc and the other by Delphi Automotive Plc, had a close call on a Silicon Valley street earlier this week, a Delphi executive told Reuters on Thursday. ~U.S. top court declines to hear Google appeal in Oracle Java fight WASHINGTON/SAN FRANCISCO Oracle Corp  won a major legal victory on Monday in a closely watched copyright case involving the company's Java programing language as the U.S. Supreme Court declined to hear Google Inc's  appeal. ~Google has until August 17 to reply to EU antitrust charges BRUSSELS Google Inc  has been given until mid-August to head off EU charges of abusing its market power in a dozen EU countries and stave off a possible billion-euro fine. ~UPDATE 1-Google has until Aug. 17 to reply to EU antitrust charges BRUSSELS, June 29 Google Inc has been given until mid-August to head off EU charges of abusing its market power in a dozen EU countries and stave off a possible billion-euro fine. ~U.S. top court declines to hear Google appeal in Oracle Java fight WASHINGTON/SAN FRANCISCO Oracle Corp  won a major legal victory on Monday in a closely watched copyright case involving the company's Java programming language as the U.S. Supreme Court declined to hear Google Inc's  appeal. ~UPDATE 3-U.S. top court declines to hear Google appeal in Oracle Java fight WASHINGTON/SAN FRANCISCO, June 29 Oracle Corp  won a major legal victory on Monday in a closely watched copyright case involving the company's Java programming language as the U.S. Supreme Court declined to hear Google Inc's  appeal. ~U.S. Supreme Court declines to hear Google appeal in Oracle software fight WASHINGTON, June 29 The U.S. Supreme Court on Monday declined to hear Google Inc's appeal in a major software copyright case, leaving intact a ruling that would allow Oracle Corp to charge licensing fees for the use of some of its Java programming language. ~
GOOG.O,UPDATE 4-Microsoft hands display ads to AOL, maps to Uber SEATTLE, June 29 Microsoft Corp said on Monday it will hand over its display advertising business to AOL Inc and sell some map-generating technology to ride-hailing app company Uber, as it slims down its money-losing online operations. ~CORRECTED-Two rival self-driving cars have close call in California MOUNTAIN VIEW, Calif., June 25 Two self-driving prototype cars, one operated by Google Inc and the other by Delphi Automotive Plc, had a close call on a Silicon Valley street earlier this week, a Delphi executive told Reuters on Thursday. ~U.S. top court declines to hear Google appeal in Oracle Java fight WASHINGTON/SAN FRANCISCO Oracle Corp  won a major legal victory on Monday in a closely watched copyright case involving the company's Java programing language as the U.S. Supreme Court declined to hear Google Inc's  appeal. ~Google has until August 17 to reply to EU antitrust charges BRUSSELS Google Inc  has been given until mid-August to head off EU charges of abusing its market power in a dozen EU countries and stave off a possible billion-euro fine. ~UPDATE 1-Google has until Aug. 17 to reply to EU antitrust charges BRUSSELS, June 29 Google Inc has been given until mid-August to head off EU charges of abusing its market power in a dozen EU countries and stave off a possible billion-euro fine. ~U.S. top court declines to hear Google appeal in Oracle Java fight WASHINGTON/SAN FRANCISCO Oracle Corp  won a major legal victory on Monday in a closely watched copyright case involving the company's Java programming language as the U.S. Supreme Court declined to hear Google Inc's  appeal. ~UPDATE 3-U.S. top court declines to hear Google appeal in Oracle Java fight WASHINGTON/SAN FRANCISCO, June 29 Oracle Corp  won a major legal victory on Monday in a closely watched copyright case involving the company's Java programming language as the U.S. Supreme Court declined to hear Google Inc's  appeal. ~U.S. Supreme Court declines to hear Google appeal in Oracle software fight WASHINGTON, June 29 The U.S. Supreme Court on Monday declined to hear Google Inc's appeal in a major software copyright case, leaving intact a ruling that would allow Oracle Corp to charge licensing fees for the use of some of its Java programming language. ~
AMZN.O,Big business on winning side in U.S. top court's major rulings WASHINGTON Big business was on the winning side in the U.S. Supreme Court's two major cases of the year, with hundreds of employers pushing hard in favor of gay marriage and the healthcare industry backing the insurance subsidies available under Obamacare. ~Amazon to offer loans to sellers in China, 7 other countries CHICAGO Amazon.com Inc will launch its business loan program for small sellers later this year in eight more countries including China, where credit is becoming a key factor in competing for new vendors and grabbing market share. ~
APH,UPDATE 1-Amphenol Corp offers to buy FCI Asia for $1.28 bln June 29 Amphenol Corp, a maker of electronic and fiber optic connectors, said it made a binding offer to acquire Singapore-based electronic connectors maker FCI Asia Pte Ltd for $1.28 billion to strengthen its telecom products business. ~Amphenol Corp offers to buy FCI Asia for $1.28 bln June 29 Amphenol Corp, a maker of fiber optic cables and related devices, said it had made a binding offer to acquire Singaporean electronic connectors maker FCI Asia Pte Ltd for $1.28 billion. ~
APC,U.S. Supreme Court rejects BP, Anadarko over Deepwater Horizon spill penalties WASHINGTON The U.S. Supreme Court on Monday rejected bids by BP Plc and Anadarko Petroleum Corp  to avoid penalties under federal pollution law in connection with the 2010 Gulf of Mexico oil spill. ~UPDATE 1-U.S. Supreme Court rejects BP, Anadarko over Deepwater Horizon spill penalties WASHINGTON, June 29 The U.S. Supreme Court on Monday rejected bids by BP Plc and Anadarko Petroleum Corp to avoid penalties under federal pollution law in connection with the 2010 Gulf of Mexico oil spill. ~U.S. Supreme Court rejects BP, Anadarko over Deepwater Horizon spill penalties WASHINGTON, June 29 The U.S. Supreme Court on Monday rejected bids by BP Plc and Anadarko Petroleum Corp to avoid penalties under federal pollution law in connection with the 2010 Gulf of Mexico oil spill. ~
T,AT&T;, DirecTv extend "termination date" for second time June 29 AT&T; Inc, the No. 2 U.S. telecom company, said it has extended the "termination date" of the merger agreement with satellite TV provider DirecTV for "a short period of time", the second time in two months. ~
BRKa.N,Heinz executives to dominate Kraft Heinz leadership June 29 The leadership of Kraft Heinz Co will be dominated by former executives of H.J. Heinz Co after that company merges with Kraft Foods Group Inc, both companies said. ~
CELG.O,UPDATE 2-Celgene to invest $1 bln in Juno to partner in cancer therapies June 29 Celgene Corp on Monday launched a 10-year partnership with Juno Therapeutics, announcing a $1 billion investment aimed at bringing to market Juno technologies that harness the immune system to treat cancer and autoimmune diseases. ~REFILE-Celgene, Juno collaborate to develop cancer therapies June 29 Celgene Corp and Juno Therapeutics Inc said they signed a deal to develop and commercialize immunotherapies for the treatment of cancer and autoimmune diseases. ~
CVX,Oil companies played hardball in bid to defeat climate outsiders HOUSTON Petty legal filings. Diversionary ballot measures. Counting abstentions as no votes. These are just some of the tactics U.S. oil companies used this spring to quash efforts by investors to win the right to nominate climate experts for board seats. ~
CI,DEALS-Second-quarter M&A; close to record amid mega deals NEW YORK/LONDON, June 29 Mergers and acquisitions (M&A;) worldwide in the second quarter of 2015 almost matched the record set in the second quarter of 2007, according to preliminary Thomson Reuters data, as big companies turned to deals to boost their market share. ~
DISCA.O,CORRECTED-UPDATE 2-Olympics-Discovery buys European broadcast rights to Games from 2018-2024 PARIS, June 29 Discovery Communications  has agreed to pay 1.3 billion euros ($1.4 billion) to screen the Olympic Games from 2018 to 2024 across Europe, beating national public broadcasters that have traditionally shown the event. ~CORRECTED-Olympics- Discovery wins European broadcast rights to Games from 2018-2024 PARIS, June 29 Discovery Communications , the parent of television channel Eurosport, has agreed to pay 1.3 billion euros  ($1.4 billion) to screen the Olympic Games from 2018 to 2024 across Europe, beating out national public broadcasters who have traditionally shown the event. ~
DISCK.O,CORRECTED-UPDATE 2-Olympics-Discovery buys European broadcast rights to Games from 2018-2024 PARIS, June 29 Discovery Communications  has agreed to pay 1.3 billion euros ($1.4 billion) to screen the Olympic Games from 2018 to 2024 across Europe, beating national public broadcasters that have traditionally shown the event. ~CORRECTED-Olympics- Discovery wins European broadcast rights to Games from 2018-2024 PARIS, June 29 Discovery Communications , the parent of television channel Eurosport, has agreed to pay 1.3 billion euros  ($1.4 billion) to screen the Olympic Games from 2018 to 2024 across Europe, beating out national public broadcasters who have traditionally shown the event. ~
GE,CANADA STOCKS-TSX dives as Greece crisis spurs bank selloff TORONTO, June 29 Canada's main stock index fell more than 1.5 percent on Monday  as investors fretted about the impact if Greece exits the euro, with banks taking the brunt of the losses and gold miners listed among the few gainers. ~GE to sell its global fleet assets to Element and Arval TORONTO General Electric  on Monday said it agreed to sell its fleet management arm in the United States, Mexico, Australia and New Zealand to Canada's Element Financial  for $6.9 billion, moving it a step further in its plan to shed financial assets. ~UPDATE 2-GE to sell its global fleet assets to Element and Arval TORONTO, June 29 General Electric on Monday said it agreed to sell its fleet management arm in the United States, Mexico, Australia and New Zealand to Canada's Element Financial for $6.9 billion, moving it a step further in its plan to shed financial assets. ~RPT-Element to buy majority of GE Capital's fleet ops for C$8.6 bln June 29 Canada's Element Financial Corp  said it has entered into an agreement with General Electric  to acquire GE Capital's fleet management operations in the United States, Mexico, Australia and New Zealand for C$8.6 billion ($6.98 billion)in cash. ~Element to buy majority of GE Capital's fleet ops for C$8.6 bln June 29 Canada's Element Financial Corp  said it has entered into an agreement with General Electric  to acquire GE Capital's fleet management operations in the United States, Mexico, Australia and New Zealand for C$8.6 billion ($6.98 billion)in cash. ~
MNK,Boehringer's Roxane Labs draws bid from Hikma, Mallinckrodt- Bloomberg June 29 Jordan's Hikma Pharmaceuticals Plc  has emerged as a bidder for German drugmaker Boehringer Ingelheim's generics unit Roxane Labs, Bloomberg reported, citing people familiar with the matter. ~
MET,MetLife accuses U.S. risk panel of secrecy; demands access to records WASHINGTON MetLife asked a federal judge on Monday to force the U.S. government to hand over 500 pages of confidential records that relate to financial regulators' decision to designate the insurance giant as systemically important. ~MetLife accuses U.S. risk panel of secrecy; demands access to records WASHINGTON, June 29 MetLife asked a federal judge on Monday to force the U.S. government to hand over 500 pages of confidential records that relate to financial regulators' decision to designate the insurance giant as systemically important. ~
MSFT.O,UPDATE 4-Microsoft hands display ads to AOL, maps to Uber SEATTLE, June 29 Microsoft Corp said on Monday it will hand over its display advertising business to AOL Inc and sell some map-generating technology to ride-hailing app company Uber, as it slims down its money-losing online operations. ~Microsoft to drop display ad business, cut 1200 jobs - Bloomberg June 29 Microsoft Corp will close its web display advertising business, handing operations over to AOL Inc and AppNexus Inc and cutting about 1,200 jobs, Bloomberg reported. ~
ORCL.N,U.S. top court declines to hear Google appeal in Oracle Java fight WASHINGTON/SAN FRANCISCO Oracle Corp  won a major legal victory on Monday in a closely watched copyright case involving the company's Java programming language as the U.S. Supreme Court declined to hear Google Inc's  appeal. ~UPDATE 3-U.S. top court declines to hear Google appeal in Oracle Java fight WASHINGTON/SAN FRANCISCO, June 29 Oracle Corp  won a major legal victory on Monday in a closely watched copyright case involving the company's Java programming language as the U.S. Supreme Court declined to hear Google Inc's  appeal. ~U.S. Supreme Court declines to hear Google appeal in Oracle software fight WASHINGTON, June 29 The U.S. Supreme Court on Monday declined to hear Google Inc's appeal in a major software copyright case, leaving intact a ruling that would allow Oracle Corp to charge licensing fees for the use of some of its Java programming language. ~
SYY,U.S. food distributor Sysco drops plan to merge with US Foods Following a successful government lawsuit to block the deal, Sysco Corp, the biggest U.S. food distribution company, dropped plans to merge with US Foods, its biggest rival, Sysco said on Monday. ~Food distributor Sysco drops plan to merge with US Foods WASHINGTON Following a successful government lawsuit to block the deal, Sysco Corp , the biggest U.S. food distribution company, dropped plans to merge with US Foods, its biggest rival, Sysco said on Monday. ~UPDATE 3-U.S. food distributor Sysco drops plan to merge with US Foods WASHINGTON, June 29 Following a successful government lawsuit to block the deal, Sysco Corp, the biggest U.S. food distribution company, dropped plans to merge with US Foods, its biggest rival, Sysco said on Monday. ~U.S. food distributor Sysco scraps controversial plan to merge with biggest rival WASHINGTON, June 29 Sysco Corp, the biggest U.S. food distribution company, has scrapped a controversial plan to merge with US Foods, its biggest rival, the company announced on Monday. ~
WBA.O,Walgreen settles Medicaid false billing case in New York NEW YORK Walgreen Co will pay $2.55 million to settle charges by New York's attorney general that a pharmacy unit improperly billed Medicaid for costly drugs to treat hemophilia patients, without proof that it actually delivered the drugs to those patients. ~Walgreen settles Medicaid false billing case in New York NEW YORK, June 29 Walgreen Co will pay $2.55 million to settle charges by New York's attorney general that a pharmacy unit improperly billed Medicaid for costly drugs to treat hemophilia patients, without proof that it actually delivered the drugs to those patients. ~
WMB,DEALS-Second-quarter M&A; close to record amid mega deals NEW YORK/LONDON, June 29 Mergers and acquisitions (M&A;) worldwide in the second quarter of 2015 almost matched the record set in the second quarter of 2007, according to preliminary Thomson Reuters data, as big companies turned to deals to boost their market share. ~
