AET,UPDATE 1-NIH center to admit U.S. healthcare worker with Ebola March 12 The U.S. National Institutes of Health will admit to its hospital on Friday a U.S. healthcare worker who tested positive for the Ebola virus while working in Sierra Leone. ~NIH says to admit U.S. healthcare worker infected with Ebola March 12 The U.S. National Institutes of Health said it plans to admit a U.S. healthcare worker on Friday who has tested positive for Ebola while working in Sierra Leone. ~
GOOGL.O,UPDATE 2-Indian firms could get boost from Google, Alibaba MUMBAI, March 11 Two Indian firms could get a boost from tech majors in what might turn out to be the first direct investment in the country by Google Inc and Alibaba. ~
GOOG.O,UPDATE 2-Indian firms could get boost from Google, Alibaba MUMBAI, March 11 Two Indian firms could get a boost from tech majors in what might turn out to be the first direct investment in the country by Google Inc and Alibaba. ~
AMZN.O,Alibaba hiring in Amazon, Microsoft backyard as U.S. cloud unit expands BEIJING China's Alibaba Group Holding Ltd, the world's largest e-commerce firm, has begun hunting staff in Seattle, home turf of Amazon.com Inc and Microsoft Corp, focusing on savvy cloud computing hires as it ramps up U.S. operations. ~Alibaba hiring in Amazon, Microsoft backyard as US cloud unit expands BEIJING, March 12 China's Alibaba Group Holding Ltd, the world's largest e-commerce firm, has begun hunting staff in Seattle, home turf of Amazon.com Inc  and Microsoft Corp, focusing on savvy cloud computing hires as it ramps up U.S. operations. ~
BA,UPDATE 2-UTC to weigh splitting off of Sikorsky helicopter unit March 11 United Technologies Corp will explore spinning off its Sikorsky helicopter unit, in the first major move by the company's new chief executive officer to overhaul the U.S. conglomerate's portfolio of businesses. ~
BMY,UPDATE 1-FDA to review re-submitted Bristol-Myers hepatitis C drug March 12 U.S. regulators have accepted Bristol-Myers Squibb Co's re-submitted marketing application for an experimental hepatitis C treatment after the drugmaker was forced last year to withdraw its initial request. ~FDA to review re-submitted Bristol-Myers hepatitis C drug March 12 Bristol-Myers Squibb Co said U.S. regulators have accepted the company's re-submitted marketing application for an experimental treatment for hepatitis C, following the drugmaker's decision last year to pull back its initial marketing request. ~
C,UPDATE 5-Argentina dealt setback by U.S. judge over Citigroup bond payments NEW YORK A federal judge on Thursday said Citigroup Inc cannot process interest payments by Argentina on some bonds issued under that country's law, a defeat for the cash-strapped nation as it attempts to re-enter international debt markets. ~UPDATE 5-Argentina dealt setback by U.S. judge over Citigroup bond payments NEW YORK, March 12 A federal judge on Thursday said Citigroup Inc cannot process interest payments by Argentina on some bonds issued under that country's law, a defeat for the cash-strapped nation as it attempts to re-enter international debt markets. ~BRIEF-Citigroup asks U.S. judge to stay order blocking bank from processing some Argentina bond payments March 12 Citigroup Inc :  * Asks U.S. judge not to enforce his order earlier Thursday to block bank from ~BRIEF-Argentina disappointed in US court ruling blocking Citigroup bond payment processing--US lawyer March 12 Citigroup Inc :  * U.S. lawyer for Argentina says country will pursue appellate options after ~Citigroup cannot process some Argentina bond payments-US judge NEW YORK, March 12 A federal judge on Thursday said Citigroup Inc cannot process interest payments by Argentina on some bonds issued under that country's law, a defeat for the cash-strapped nation as it tries to reenter international debt markets. ~BRIEF-U.S. judge blocks Citigroup from processing some Argentina bond payments March 12 Citigroup Inc :  * U.S. judge rejects Citigroup Inc request to vacate injunction against ~Citi's Corbat says stress test efforts "far from over" March 12 Citigroup Inc Chief Executive Mike Corbat told employees that the bank's stress test work is "far from over", despite the Federal Reserve raising no objections to Citi's capital plan. ~
COST.O,RPT - INSIGHT-KFC faces pressure after McDonald's says no antibiotics in chicken LOS ANGELES/CHICAGO, March 12 KFC, the world's largest chain of fried chicken restaurants, may face pressure from consumer and environmental groups to change how its poultry are raised after McDonald's Corp said it would switch to chicken raised without human antibiotics. ~
DG,Dollar General board in process of identifying chairman's successor CHICAGO, March 12 Discount retailer Dollar General Stores Inc Chairman and Chief Executive Rick Dreiling said the company's board is in the process of identifying his successor. ~UPDATE 2-Dollar General to speed up new store openings as rivals merge March 12 Dollar General Stores Inc said on Thursday it plans to accelerate new store rollouts in a bid to bolster its position among U.S. discount retailers after failing to upend a merger agreement between rivals Family Dollar  and Dollar Tree. ~
DOW,BRIEF-Downer EDI says offer for Spotless Group now closed * Confirms that its offer for Spotless was not extended and has now closed. Source text for Eikon: Further company coverage: ~BRIEF-Downer EDI posts FY net profit of $181.5 million * FY total revenue and other income from ordinary activities $7.29 billion , up 6.4 percent ~BRIEF-Downer EDI says ‍offer for Spotless Group extended to 28 August 2017​ * ‍Offer for Spotless Group extended to 7pm on Monday, 28 august 2017​ Source text for Eikon: Further company coverage: ~BRIEF-Downer EDI says Spotless ‍offer extended to Aug 21, 2017​ * Spotless ‍offer extended to 7pm on monday, 21 august 2017​ Source text for Eikon: Further company coverage: ~BRIEF-Downer EDI's takeover offer for Spotless Group extended till 7pm (Sydney time) on Aug. 14 * Unconditional takeover offer for Spotless Group extended until 7:00pm (Sydney time) on Monday, 14 August Source text for Eikon: Further company coverage: (bangalore.newsroom@thomsonreuters.com) ~BRIEF-Downer extends takeover offer for Spotless Group * decided to extend Spotless offer period for one week; offer will now remain open for acceptance until 14 august Source text for Eikon: Further company coverage: ~BRIEF-Downer extends Spotless offer to August 7 2017 * ‍Downer has decided to extend offer for Spotless Group holdings to 7 pm on Monday, 7 august 2017​ Source text for Eikon: Further company coverage: ~BRIEF-Downer EDI's stake in Spotless increases to 80.3 pct * Downer's stake in Spotless increases to 80.3 pct Source text for Eikon: Further company coverage: ~BRIEF- Downer EDI Ltd'S stake in Spotless Group increases to 72% * As Downer's shareholding in Spotless is now over 70%, Downer expects that Spotless will be removed from certain S&P;/ASX market indices ~
EFX,UPDATE 1-UK retailer Philip Green offloads BHS to buyout firm LONDON, March 12 British retailer Philip Green said on Thursday his struggling department store chain BHS had been acquired by buyout firm Retail Acquisitions. ~UK retailer Philip Green's BHS sold to Retail Acquisitions LONDON, March 12 British retailer Philip Green said on Thursday his struggling department store chain BHS had been acquired by buyout firm Retail Acquisitions. ~
GM,GM recalls about 64,000 Chevrolet Volt hybrids - Automotive News March 12 General Motors Co is recalling about 64,000 Chevrolet Volt hybrid electric cars for a software update to prevent carbon monoxide buildup when a driver forgets to shut off the vehicle, Automotive News reported on Thursday, citing a statement from the company. ~GM to cut Chevy, GMC powertrain warranty to 60,000 miles DETROIT General Motors Co  said on Thursday it plans to cut its powertrain warranty on Chevrolet and GMC vehicles for the 2016 model year because the offer was not a strong enough selling point. ~GM to cut Chevy, GMC powertrain warranty to 60,000 miles-report DETROIT, March 12 General Motors Co plans to cut its powertrain warranty on Chevrolet and GMC vehicles for the 2016 model year because the offer was not a strong enough selling point, Automotive News reported on Thursday. ~
GILD.O,UPDATE 1-FDA to review re-submitted Bristol-Myers hepatitis C drug March 12 U.S. regulators have accepted Bristol-Myers Squibb Co's re-submitted marketing application for an experimental hepatitis C treatment after the drugmaker was forced last year to withdraw its initial request. ~
INTC.O,CORRECTED-UPDATE 4-Intel cuts revenue forecast as desktop demand weakens March 12 Intel Corp slashed nearly $1 billion from its first-quarter revenue forecast as small businesses put off upgrading their personal computers, sending the chipmaker's shares down more than 5 percent. ~US STOCKS-Wall St bounces back in broad rally; bank shares gain * Indexes up: Dow 1.5 pct, S&P; 1.3 pct, Nasdaq 0.9 pct   (Updates close with latest volume, Disney, Mattel shares up) ~US STOCKS-Wall St bounces back in broad rally; bank shares gain * Indexes up: Dow 1.5 pct, S&P; 1.3 pct, Nasdaq 0.9 pct   (Updates to close) ~US STOCKS-Wall St bounces back in broad rally; bank shares gain * Indexes up: Dow 1.2 pct, S&P; 1 pct, Nasdaq 0.7 pct   (Updates to late afternoon) ~Fitch: Intel Outlook Could Signal PC Market Hasn't Stabilized (The following statement was released by the rating agency) CHICAGO, March 12 (Fitch) Intel's negative pre-announcement this morning  suggests the end of support for Windows XP was a more significant factor than  previously estimated in last year's perceived stabilizing personal computer (PC)  demand, according to Fitch Ratings. Consequently, extended PC refresh cycles may  result in a resumption of negative PC sales growth. Intel Thursday changed its first-quarter revenue outlook as a function  ~US STOCKS-Wall St up 1 pct in broad rally; Intel weighs on Nasdaq * Indexes up: Dow 1 pct, S&P; 0.9 pct, Nasdaq 0.5 pct   (Updates to afternoon trading) ~US STOCKS-Wall St up in broad rally, but Intel weighs on Nasdaq * Indexes up: Dow 0.9 pct, S&P; 0.8 pct, Nasdaq 0.4 pct   (Updates to mid-morning trading) ~US STOCKS-Wall St up after recent declines; Intel weighs * Indexes up: Dow 0.9 pct, S&P; 0.7 pct, Nasdaq 0.3 pct   (Updates to market open, adds Intel outlook) ~US STOCKS SNAPSHOT-Wall St opens higher, Intel weighs on Nasdaq March 12 U.S. stocks opened higher on Thursday, rebounding after two days of declines, though shares of Intel Corp weighed on Nasdaq after the company warned that first-quarter revenue would be weaker than expected. ~
IBM,BRIEF-EVRY to cooperate with IBM on mobile applications services * To cooperate with IBM on development, deployment and management of mobile application solutions in the Nordic market  Source text for Eikon:  Further company coverage:    (Gdynia Newsroom) ~
JNJ,Johnson & Johnson sues Glaxo over allergy ads as spring nears NEW YORK Johnson & Johnson sued rival drugmaker GlaxoSmithKline PLC on Thursday, alleging that Glaxo is trying to unlawfully grab market share with false advertising at the start of spring allergy season in the United States. ~Johnson & Johnson sues Glaxo over allergy ads as spring nears NEW YORK, March 12 Johnson & Johnson  sued rival drugmaker GlaxoSmithKline PLC on Thursday, alleging that Glaxo is trying to unlawfully grab market share with false advertising at the start of spring allergy season in the United States. ~
MCD,RPT - INSIGHT-KFC faces pressure after McDonald's says no antibiotics in chicken LOS ANGELES/CHICAGO, March 12 KFC, the world's largest chain of fried chicken restaurants, may face pressure from consumer and environmental groups to change how its poultry are raised after McDonald's Corp said it would switch to chicken raised without human antibiotics. ~
TXT,Takeover of UTC's Sikorsky helicopter unit seen less likely, for now March 12 United Technologies Corp's  Sikorsky helicopter unit could be acquired by another big defense company, but the potential for a big tax bill means the maker of Black Hawk helicopters will more likely be spun off into a standalone company, analysts said. ~UTC to weigh splitting off of Sikorsky helicopter unit United Technologies Corp  will explore spinning off its Sikorsky helicopter unit, in the first major move by the company's new chief executive officer to overhaul the U.S. conglomerate's portfolio of businesses. ~
KO,UPDATE 2-Coke CEO declines bonus as company performance falls short March 12 Coca-Cola Co said on Thursday its chief executive declined a $2.5 million bonus in 2014 while other top-level employees received lower-than-expected compensation as the world's largest soda maker struggles to boost revenues amid sluggish demand for soft drinks. ~Coke CEO took 23 pct higher compensation last year March 12 Coca-Cola Co said Chief Executive Muhtar Kent earned $25.2 million in compensation in 2014, about 23 percent higher than the previous year. ~
DIS,Disney feeds 'Frozen' frenzy with news of sequel LOS ANGELES The Walt Disney Co has started work on a sequel to "Frozen," the best-selling animated movie of all time and a global merchandising phenomenon that helped push the media giant to record profits. | Video  ~US STOCKS-Wall St bounces back in broad rally; bank shares gain * Indexes up: Dow 1.5 pct, S&P; 1.3 pct, Nasdaq 0.9 pct   (Updates close with latest volume, Disney, Mattel shares up) ~UPDATE 1-Disney feeds 'Frozen' frenzy with news of sequel LOS ANGELES, March 12 The Walt Disney Co  has started work on a sequel to "Frozen," the best-selling animated movie of all time and a global merchandising phenomenon that helped push the media giant to record profits. ~BRIEF-Disney CEO sees no material impact from net neutrality changes * Disney CEO Iger says changes to net neutrality rules will not have a material impact on the company  Source text for Eikon:  Further company coverage:    (Reporting By Lisa Richwine) ~Disney shareholders re-elect board, reject chair/CEO split March 12 Walt Disney Co shareholders re-elected Chief Executive Officer Bob Iger and nine other directors and defeated a proposal to split the chairman and CEO roles at the media giant, according to preliminary vote tallies released on Thursday. ~Disney to release 'Star Wars: Episode VIII' in May 2017 March 12 Walt Disney Co will release the eighth installment in the "Star Wars" sci-fi film series on May 26, 2017, Chief Executive Bob Iger said on Thursday. ~DIARY-U.S. MEETINGS/WEEK AHEAD Thomson Reuters March 12, 2015 - Corporate Meetings for US companies for Week ahead.         S&P; 500 Earnings - MONTH AHEAD     Dividends                            Non S&P; 500 - Weekly             Federal Reserve events               ConferenceCall/Webcast - Weekly  Meetings - Weekly                                Xtra users can see more details on conference calls & webcasts by hovering your mouse  over the RIC, right click, now click on Related Co Data, now click on Co Events.                 ~
TSN,RPT - INSIGHT-KFC faces pressure after McDonald's says no antibiotics in chicken LOS ANGELES/CHICAGO, March 12 KFC, the world's largest chain of fried chicken restaurants, may face pressure from consumer and environmental groups to change how its poultry are raised after McDonald's Corp said it would switch to chicken raised without human antibiotics. ~UPDATE 2-Highly pathogenic bird flu confirmed in Arkansas turkeys -USDA   ~
UTX,UPDATE 1-United Tech CEO: Sale of Sikorsky would be hard due to taxes NEW YORK, March 12 United Technologies Corp's  chief executive officer said on Thursday that a sale of its Sikorsky helicopter unit would be "very hard" due to the heavy tax liability that would come with such a disposition. ~United Tech CEO: Sale of Sikorsky would be hard due to taxes NEW YORK, March 12 United Technologies Corp's  chief executive officer said on Thursday that a sale of its Sikorsky helicopter unit would be "very hard" due to the heavy tax liability that would come with such a disposition. ~Sikorsky sees oil customers pass on options amid price slide NEW YORK, March 12 Oil and gas customers of helicopter company Sikorsky have passed on options for aircraft amid the sharp slide in oil prices, the president of the United Technologies Corp unit said on Thursday. ~United Technologies CEO sees $1 billion in acquisitions in 2015 NEW YORK United Technologies Corp's  chief executive officer said on Thursday that the company will spend $1 billion on acquisitions this year, "maybe a little bit more," even as he eyes bigger targets. ~UPDATE 1-United Technologies CEO sees $1 bln in acquisitions in 2015 NEW YORK, March 12 United Technologies Corp's  chief executive officer said on Thursday that the company will spend $1 billion on acquisitions this year, "maybe a little bit more," even as he eyes bigger targets. ~United Technologies CEO sees $1 bln in acquisitions in 2015 NEW YORK, March 12 United Technologies Corp's  chief executive officer said on Thursday that the company will spend $1 billion on acquisitions this year, "maybe a little bit more." ~UTC to weigh splitting off of Sikorsky helicopter unit United Technologies Corp  will explore spinning off its Sikorsky helicopter unit, in the first major move by the company's new chief executive officer to overhaul the U.S. conglomerate's portfolio of businesses. ~UPDATE 2-UTC to weigh splitting off of Sikorsky helicopter unit March 11 United Technologies Corp will explore spinning off its Sikorsky helicopter unit, in the first major move by the company's new chief executive officer to overhaul the U.S. conglomerate's portfolio of businesses. ~
V,BRIEF-Visa calls for redemption all of its 1.200 pct notes due 2017 * Visa Inc - on Sept 11, co called for redemption all of $1.75 billion principal amount outstanding of its 1.200 pct notes due 2017‍​ - SEC filing ~BRIEF-Visa Inc files for three-part senior notes offering of up to $2.5 bln * Visa Inc says files for three-part senior notes offering of up to $2.5 billion - SEC filing‍​ ~Former BoE deputy Hogg to join Visa as Europe unit CEO Visa Inc, the world's largest payments processor, on Thursday named former Bank of England (BoE) deputy governor Charlotte Hogg as chief executive of its Europe division. ~CORRECTED-UPDATE 1-MOVES-Former BoE deputy Hogg to join Visa as Europe unit CEO Sept 7 Visa Inc, the world's largest payments processor, on Thursday named former Bank of England (BoE) deputy governor Charlotte Hogg as chief executive of its Europe division. ~MOVES-Visa names ex-BoE deputy Charlotte Hogg as Europe unit CEO Sept 7 Visa Inc, the world's largest payments processor, on Thursday named Charlotte Hogg as chief executive of its Europe division. ~BRIEF-Visa appoints Charlotte Hogg as CEO of European operations * Visa Inc appoints Charlotte Hogg as chief executive officer of the compan's European operations ~BRIEF-Visa Inc files prospectus supplement for potential three-part senior notes offering * Visa Inc files prospectus supplement for potential three-part senior notes offering; size not disclosed - sec filing‍​ Source text (http://bit.ly/2vLDrIe) Further company coverage: ~BRIEF-Visa enables on the go payments with the new Fitbit Ionic * Visa inc- ‍enabling visa payments on fitbit's smartwatch fitbit ionic​ ~BRIEF-Bridg raises $11 million in Series B funding * Bridg raises $11 million in Series B funding from Morpheus Ventures, March Capital, Visa and NextEquity ~
WBA.O,Walgreens Boots CEO expects to do more deals in US LONDON, March 12 Stefano Pessina, the billionaire investor who engineered the deal that created pharmacy giant Walgreens Boots Alliance Inc., said he could imagine doing more deals in the United States as the healthcare system is shaken up by Obamacare. ~
