AAPL.O,UPDATE 2-Apple shares drop below $100 for first time since August Jan 6 Apple Inc shares dropped below $100 for the first time in nearly five months on Wednesday following reports of slowing shipments of the iPhone 6S and 6S Plus. ~Streaming music in U.S. up 93 percent in 2015; Adele tops album sales LOS ANGELES U.S. music consumers almost doubled their use of streaming services in 2015, with Apple Inc's new Apple music platform helping boost volume a record 93 percent, Nielsen Music said on Wednesday. ~CORRECTED-Apple shares drop below $100 for first time since August Jan 6 Apple Inc shares on Wednesday dropped below $100 for the first time in nearly five months following reports of slowing shipments of its iPhone 6S and 6S Plus. ~Streaming music in U.S. up 93 pct in 2015; Adele tops album sales LOS ANGELES, Jan 6 U.S. music consumers almost doubled their use of streaming services in 2015, with Apple Inc's new Apple music platform helping boost volume a record 93 percent, Nielsen Music said on Wednesday. ~Top Apple supplier plans rare holiday as output fears rattle investors TAIPEI Foxconn, which assembles most of Apple Inc's  latest iPhones, will cut working hours over the week-long Lunar New Year holiday, a person familiar with the matter said, in a rare move that analysts interpreted as a sign of softening demand. | Video  ~Top Apple supplier plans rare holiday as output fears rattle investors TAIPEI Foxconn, which assembles most of Apple Inc's latest iPhones, will cut working hours over the week-long Lunar New Year holiday, a person familiar with the matter said, in a rare move that analysts interpreted as a sign of softening demand. | Video  ~UPDATE 7-Top Apple supplier plans rare holiday as output fears rattle investors * Reports add to increasing concern over iPhone slowdown   (Adds details on holiday season App Store sales) ~Apple reports over $1.1 billion in App Store sales in holiday season Apple Inc said customers spent over $1.1 billion on apps and in-app purchases in the two weeks ending Jan. 3, setting a record for holiday season sales. ~Apple reports over $1.1 bln in App Store sales in holiday season Jan 6 Apple Inc said customers spent over $1.1 billion on apps and in-app purchases in the two weeks ending Jan. 3, setting a record for holiday season sales. ~
AN,INTERVIEW-AutoNation CEO warns automakers not to push sales by incentives LAS VEGAS, Jan 6 The head of the largest U.S. auto dealer group warned on Wednesday that automakers and dealers must avoid the problems in the years immediately following 2000, when lofty incentives kept sales volume high but cut profits. ~AutoNation CEO warns automakers not to push sales by incentives LAS VEGAS, Jan 6 The head of the largest U.S. auto dealer group on Wednesday warned that automakers and dealers will have to be disciplined in order to avoid problems experienced in the years following 2000 when profits were cut by lofty incentives that kept sales volume high. ~
BRKa.N,EU clears Berkshire's acquisition of Precision Castparts BRUSSELS The European Commission said on Wednesday it had approved Berkshire Hathaway's planned $32.3 billion acquisition of Precision Castparts Corp, a maker of aerospace and other parts. ~EU clears Berkshire's acquisition of Precision Castparts BRUSSELS, Jan 6 The European Commission said on Wednesday it had approved Berkshire Hathaway's planned $32.3 billion acquisition of Precision Castparts Corp, a maker of aerospace and other parts. ~
SCHW.N,Schwab 'robo adviser' grows to $5.3 billion in its debut year NEW YORK, Jan 6 Charles Schwab Corp's  automated investment service grew about 29 percent to $5.3 billion at the end of the fourth-quarter, rising despite volatile U.S. financial markets, a spokeswoman said Wednesday. ~
CMG,Chipotle hit with federal subpoena over California norovirus outbreak Chipotle Mexican Grill Inc , under scrutiny for months over outbreaks of foodborne illness across several U.S. states, said on Wednesday it was served with a subpoena in a federal criminal probe linked to a norovirus case in California last year. ~UPDATE 4-Chipotle hit with federal subpoena over California norovirus outbreak * Announces $300 million share buyback   (Adds details on investigation, California lawsuit) ~Chipotle receives subpoena in relation to norovirus incident Jan 6 Chipotle Mexican Grill Inc said it was served with a subpoena from a federal court in relation to a criminal investigation into a norovirus incident that occurred at its restaurant in Simi Valley, California in August. ~
DOW,BRIEF-Downer EDI says offer for Spotless Group now closed * Confirms that its offer for Spotless was not extended and has now closed. Source text for Eikon: Further company coverage: ~BRIEF-Downer EDI posts FY net profit of $181.5 million * FY total revenue and other income from ordinary activities $7.29 billion , up 6.4 percent ~BRIEF-Downer EDI says ‍offer for Spotless Group extended to 28 August 2017​ * ‍Offer for Spotless Group extended to 7pm on Monday, 28 august 2017​ Source text for Eikon: Further company coverage: ~BRIEF-Downer EDI says Spotless ‍offer extended to Aug 21, 2017​ * Spotless ‍offer extended to 7pm on monday, 21 august 2017​ Source text for Eikon: Further company coverage: ~BRIEF-Downer EDI's takeover offer for Spotless Group extended till 7pm (Sydney time) on Aug. 14 * Unconditional takeover offer for Spotless Group extended until 7:00pm (Sydney time) on Monday, 14 August Source text for Eikon: Further company coverage: (bangalore.newsroom@thomsonreuters.com) ~BRIEF-Downer extends takeover offer for Spotless Group * decided to extend Spotless offer period for one week; offer will now remain open for acceptance until 14 august Source text for Eikon: Further company coverage: ~BRIEF-Downer extends Spotless offer to August 7 2017 * ‍Downer has decided to extend offer for Spotless Group holdings to 7 pm on Monday, 7 august 2017​ Source text for Eikon: Further company coverage: ~BRIEF-Downer EDI's stake in Spotless increases to 80.3 pct * Downer's stake in Spotless increases to 80.3 pct Source text for Eikon: Further company coverage: ~BRIEF- Downer EDI Ltd'S stake in Spotless Group increases to 72% * As Downer's shareholding in Spotless is now over 70%, Downer expects that Spotless will be removed from certain S&P;/ASX market indices ~
FB.O,Facebook's Oculus prices Rift virtual reality headset at $599 Jan 6 Oculus, the virtual reality company owned by Facebook Inc, said the Rift, its much-awaited virtual reality headset, is priced at $599. ~Message apps pose growing risk for China securities regulator SHANGHAI/NEW YORK A growing number of China's retail investors are opening trading accounts on messaging and social media app WeChat, and some institutional investors are even using it to instruct brokers, making it harder for regulators to monitor trades and spot illegal activity, traders and investors told Reuters. | Video  ~
GM,GM says will not use 'over-the-air' upgrades on safety systems LAS VEGAS, Jan 6 General Motors Co will not use 'over-the-air' upgrades, a way of remotely updating software on its vehicles, for safety-critical vehicle systems such as brakes, the automaker's product development chief said on Wednesday, signaling a different approach from electric car maker Tesla Motors Inc. ~GM China auto sales rise 5.2 percent in 2015 BEIJING General Motors Co's  vehicle sales in China rose 5.2 percent to 3.61 million in 2015, the U.S. carmaker said on Wednesday. ~GM says 2015 China sales up 5.2 pct y/y BEIJING, Jan 6 General Motors Co and its Chinese joint venture partners sold 3.61 million vehicles in China in 2015, up 5.2 percent from the previous year, the U.S. carmaker said on Wednesday. ~
JPM,Funds run by Brazil's Gávea post solid returns as currency bets pay off SAO PAULO/NEW YORK Two hedge funds run by Brazilian investment firm Gávea Investimentos Ltda posted double-digit returns last year as bets on slumping currencies in Brazil and Asia helped offset losses from Latin American investments. ~Funds run by Brazil's Gávea post solid returns as currency bets pay off SAO PAULO/NEW YORK, Jan 6 Two hedge funds run by Brazilian investment firm Gávea Investimentos Ltda posted double-digit returns last year as bets on slumping currencies in Brazil and Asia helped offset losses from Latin American investments. ~JPMorgan to pay $4 million for false statements about broker pay: SEC JP Morgan Chase & Co's brokerage unit will pay $4 million to settle allegations it misled customers about how it paid brokers, the U.S. Securities and Exchange Commission said on Wednesday. ~UPDATE 1-JPMorgan to pay $4 mln for false statements about broker pay -SEC Jan 6 JP Morgan Chase & Co's brokerage unit will pay $4 million to settle allegations it misled customers about how it paid brokers, the U.S. Securities and Exchange Commission said on Wednesday. ~JPMorgan's Dimon, others defeat Madoff fraud appeal NEW YORK JPMorgan Chase & Co shareholders cannot pursue a lawsuit to force Chief Executive Jamie Dimon and other officials to pay damages to the largest U.S. bank for their alleged ignorance of red flags signaling Bernard Madoff's Ponzi scheme, a federal appeals court ruled on Wednesday. ~JPMorgan to pay $4 mln for false statements about broker pay -SEC Jan 6 JP Morgan Chase & Co's brokerage unit will pay $4 million to settle allegations it misled customers about the form of compensation it paid to brokers, the U.S. Securities and Exchange Commission said on Wednesday. ~JPMorgan's Dimon, others defeat Madoff fraud appeal NEW YORK JPMorgan Chase & Co  shareholders cannot pursue a lawsuit to force Chief Executive Jamie Dimon and other officials to pay damages to the largest U.S. bank for their alleged ignorance of red flags signaling Bernard Madoff's Ponzi scheme, a federal appeals court ruled on Wednesday. ~JPMorgan's Dimon, others defeat Madoff fraud appeal NEW YORK, Jan 6 JPMorgan Chase & Co  shareholders cannot pursue a lawsuit to force Chief Executive Jamie Dimon and other officials to pay damages to the largest U.S. bank for their alleged ignorance of red flags signaling Bernard Madoff's Ponzi scheme, a federal appeals court ruled on Wednesday. ~
MTB,M&T;'s Wilmington Trust indicted over loans Jan 6 Wilmington Trust Co has been indicted as part of a criminal case against four former executives charged with concealing problematic loans after the financial crisis, federal prosecutors said on Wednesday. ~
M,Macy's lowers earnings forecast; to cut jobs Department store chain Macy's Inc, which lowered its full-year earnings expectations for the second time, said it would cut jobs and consolidate its operations, starting early 2016. ~Macy's to shut stores, cut jobs Jan 6 Department store chain Macy's Inc  said it would shut some stores and cut jobs, starting early 2016. ~
MON,Monsanto to slash 1,000 more jobs, total planned cuts at 3,600 Monsanto Co plans to slash another 1,000 jobs worldwide, bringing total planned cuts to 3,600, or about 16 percent of its global workforce, according to a filing Wednesday with the U.S. Securities and Exchange Commission. ~UPDATE 2-Monsanto increases job cuts as corn, chemical sales slump Jan 6 Monsanto Co said a souring farm economy and currency woes will push its 2016 earnings to the lower end of expectations, while a cost-cutting drive will lead the world's largest seed company to slash more jobs. ~UPDATE 1-Monsanto to slash 1,000 more jobs, total planned cuts at 3,600 Jan 6 Monsanto Co plans to slash another 1,000 jobs worldwide, bringing total planned cuts to 3,600, or about 16 percent of its global workforce, according to a filing Wednesday with the U.S. Securities and Exchange Commission. ~BRIEF-Novozymes, Monsanto to launch corn inoculant in 2017 * Says researchers from Monsanto and Novozymes see progress in U.S. field tests, plan to launch corn inoculant in 2017 ~Monsanto to cut additional 1,000 jobs, bringing total planned job cuts to 3,600 CHICAGO, Jan 6 Monsanto Co plans to cut an additional 1,000 employees worldwide, bringing its total planned job cuts to 3,600 or about 16 percent of the company's global workforce, according to a filing Wednesday with the federal Securities and Exchange Commission. ~Monsanto's profit falls on lower seed prices, strong dollar Jan 6 Monsanto Co, the world's largest seed company, reported a quarterly loss, compared with a profit a year earlier, hurt by lower corn prices and a strong dollar. ~
MS,Morgan Stanley names Kelleher president; Fleming leaving bank: memo Morgan Stanley  has promoted its head of institutional securities, Colm Kelleher, to president, prompting Greg Fleming, the head of wealth management, to leave the bank. ~Morgan Stanley wealth head Fleming to leave bank -memo   ~
NFLX.O,UPDATE 2-Netflix goes global, reaches most countries except China Jan 6 Netflix Inc's video-streaming service went live in more than 130 countries on Wednesday, covering almost the entire globe except China, in a huge global push by Chief Executive Reed Hastings to counter slowing growth in the United States. ~BRIEF-Netflix CEO on China: 'we are very patient' * Netflix CEO Reed Hastings, in interview, says he hopes to bring service to China in 2016 'but you never know' ~Netflix to stream in almost all countries, skips China Jan 6 Video streaming company Netflix Inc  on Wednesday launched its services in 130 countries, covering almost the entire globe except China, as part of efforts to counter slowing growth in the United States. ~Netflix launches in India, plans start at 500 rupees Netflix Inc launched operations in India on Wednesday, with plans starting at 500 rupees ($7.50) per month, as the U.S.-based video streaming company pushes ahead with its global expansion plans. ~Netflix launches in India, plans start at 500 rupees Netflix Inc  launched operations in India on Wednesday, with plans starting at 500 rupees ($7.50) per month, as the U.S.-based video streaming company pushes ahead with its global expansion plans. ~UPDATE 1-Netflix launches in India, plans start at 500 rupees Jan 6 Netflix Inc launched operations in India on Wednesday, with plans starting at 500 rupees ($7.50) per month, as the U.S.-based video streaming company pushes ahead with its global expansion plans. ~Netflix launches in India, plans start at 500 rupees Jan 6 Netflix Inc launched operations in India on Wednesday, with plans starting at 500 rupees ($7.50) per month. ~
NSC,UPDATE 2-US House Democrats urge rejection of CP bid for Norfolk Southern WASHINGTON, Jan 6 Two senior Democrats in the U.S. House of Representatives urged federal regulators on Wednesday to reject any acquisition of railroad operator Norfolk Southern Corp by Canadian Pacific Railway Ltd. ~CORRECTED-US House Democrats urge rejection of CP bid for Norfolk Southern WASHINGTON, Jan 6 Two senior Democrats in the U.S. House of Representatives urged federal regulators on Wednesday to reject any acquisition of railroad operator Norfolk Southern Corp by Canadian Pacific Railway Co.    (Reporting by David Morgan; Editing by Chizu Nomiyama) ~
NVDA.O,UPDATE 2-Nvidia says Volvo is first customer for new autonomous drive computer LAS VEGAS, Jan 5 Nvidia Corp. unveiled a new, lunchbox-size super-computer for self-driving cars and said Volvo Car Group will be the new device's first customer. ~
LUV,UPDATE 1-Spirit Airlines appoints new CEO, seen as M&A; harbinger Jan 5 Spirit Airlines Inc on Tuesday named board member Robert Fornaro as chief executive officer in a move analysts say may nudge it towards a merger with Frontier Airlines and improve its results after a year of unit revenue decline. ~
KO,Coca-Cola blames ad agency for map showing Crimea as part of Russia MOSCOW/KIEV, Jan 5 U.S. drinks firm Coca-Cola  on Wednesday blamed a marketing agency for a map used in an online advertising campaign that showed Crimea to be part of Russia and which drew protests and threats of a boycott from angry Ukrainians. ~
DIS,New 'Star Wars' film to set all-time North American box office record Blockbuster movie "Star Wars: The Force Awakens" will pass "Avatar" on Wednesday to become the top-selling film of all time in the United States and Canada, Walt Disney Co said. ~UPDATE 1-New 'Star Wars' film to set all-time N. American box office record Jan 6 Blockbuster movie "Star Wars: The Force Awakens" will pass "Avatar" on Wednesday to become the top-selling film of all time in the United States and Canada, Walt Disney Co said. ~
UAL,United Airlines CEO has heart transplant, may return later than expected Jan 6 United Continental Holdings Inc  said in a news release that Chief Executive Oscar Munoz underwent a heart transplant on Wednesday and may return to the helm of the second-largest U.S. airline later than expected. ~
V,BRIEF-Visa calls for redemption all of its 1.200 pct notes due 2017 * Visa Inc - on Sept 11, co called for redemption all of $1.75 billion principal amount outstanding of its 1.200 pct notes due 2017‍​ - SEC filing ~BRIEF-Visa Inc files for three-part senior notes offering of up to $2.5 bln * Visa Inc says files for three-part senior notes offering of up to $2.5 billion - SEC filing‍​ ~Former BoE deputy Hogg to join Visa as Europe unit CEO Visa Inc, the world's largest payments processor, on Thursday named former Bank of England (BoE) deputy governor Charlotte Hogg as chief executive of its Europe division. ~CORRECTED-UPDATE 1-MOVES-Former BoE deputy Hogg to join Visa as Europe unit CEO Sept 7 Visa Inc, the world's largest payments processor, on Thursday named former Bank of England (BoE) deputy governor Charlotte Hogg as chief executive of its Europe division. ~MOVES-Visa names ex-BoE deputy Charlotte Hogg as Europe unit CEO Sept 7 Visa Inc, the world's largest payments processor, on Thursday named Charlotte Hogg as chief executive of its Europe division. ~BRIEF-Visa appoints Charlotte Hogg as CEO of European operations * Visa Inc appoints Charlotte Hogg as chief executive officer of the compan's European operations ~BRIEF-Visa Inc files prospectus supplement for potential three-part senior notes offering * Visa Inc files prospectus supplement for potential three-part senior notes offering; size not disclosed - sec filing‍​ Source text (http://bit.ly/2vLDrIe) Further company coverage: ~BRIEF-Visa enables on the go payments with the new Fitbit Ionic * Visa inc- ‍enabling visa payments on fitbit's smartwatch fitbit ionic​ ~BRIEF-Bridg raises $11 million in Series B funding * Bridg raises $11 million in Series B funding from Morpheus Ventures, March Capital, Visa and NextEquity ~
WMT,UPDATE 2-Chile regulator accuses Cencosud, Wal-Mart, SMU of price-fixing SANTIAGO, Jan 6 Chile's competition regulator on Wednesday accused supermarket chains Cencosud and SMU  and the local unit of Wal-Mart Stores Inc of participating in a price-fixing scheme involving fresh chicken. ~Chile regulator accuses Cencosud, Wal-Mart, SMU of price-fixing-media SANTIAGO, Jan 6 Chile's competition regulator accused supermarket chains Cencosud and SMU  and the local unit of Wal-Mart Stores Inc of participating in a price-fixing scheme involving fresh chicken, local media reported on Wednesday. ~
