AMZN.O,GoPro halts sale of HERO5 camera on Amazon Oct 13 Wearable camera maker GoPro Inc  said on Thursday it temporarily stopped selling its latest HERO5 camera model on Amazon.com Inc in the United States as the company negotiates pricing with the online retailer. ~UPDATE 1-Amazon to hire 120,000 temporary workers for holiday season Oct 13 Amazon.com Inc said it would hire more than 120,000 seasonal workers in the United States for the holiday season, 20 percent more than last year, highlighting the growing threat the e-commerce giant poses to traditional retailers. ~Amazon to hire 120,000 temporary workers for holiday season Oct 13 Amazon.com Inc said on Thursday it would hire more than 120,000 seasonal employees across its fulfillment centers, sortation centers and customer service sites in the United States in the upcoming holiday season. ~BRIEF-Amazon creating 120,000 seasonal jobs in customer fulfillment, customer service this holiday season * Amazon creating 120,000 seasonal jobs in customer fulfillment and customer service this holiday season  Source text for Eikon:  Further company coverage: ~
BA,Boeing opens first commercial aircraft plant in St. Louis Boeing Co  said on Thursday it opened its first commercial airplane plant in St. Louis that is expected to add about 700 jobs by early 2020, when the company is scheduled to start deliveries of the 777X. ~Boeing opens first commercial aircraft plant in St. Louis Oct 13 Boeing Co said on Thursday it opened its first commercial airplane plant in St. Louis that is expected to add about 700 jobs by early 2020, when the company is scheduled to start deliveries of the 777X. ~BRIEF-Air Lease Corporation announces lease placement of six new Boeing 737 Max 8 Aircraft * Air Lease Corporation announces lease placement of six new Boeing 737 Max 8 Aircraft and the option to lease five additional 737 Max 8s with lot polish airlines ~
CVX,Chevron plans to start Gorgon condensate sales this month -sources SINGAPORE, Oct 13 Chevron Corp could this month start selling condensate produced at the Australian Gorgon gas field, trade sources said on Thursday. ~Chevron confirms is in discussions for potential Bangladesh sale DHAKA Chevron Corp  confirmed that the company is in "commercial discussions" regarding its Bangladesh assets, as the second-largest U.S. energy company moves forward with plans to sell assets amid a prolonged slump in energy prices. ~Chevron confirms is in discussions for potential Bangladesh sale DHAKA, Oct 13 Chevron Corp confirmed that the company is in "commercial discussions" regarding its Bangladesh assets, as the second-largest U.S. energy company moves forward with plans to sell assets amid a prolonged slump in energy prices. ~
C,Fitch: Santander Rio's Ratings Unaffected on Agreement to Acquire Citi Argentina's Retail Business (The following statement was released by the rating agency) NEW YORK/SANTIAGO, October 13 (Fitch) Fitch Ratings sees no impact on  Argentina's Banco Santander Rio's (Santander Rio) ratings after it announced on  Oct. 10, 2016 an agreement to acquire Citibank Argentina's consumer finance  business. With this acquisition, Santander Rio will consolidate its position as the  largest private sector bank in Argentina. The acquired operations include  roughly ARS10.600 million in loans, ARS16.200 in de ~
CAG,Lamb Weston expects full-year sales to rise in low-single digits Oct 13 Lamb Weston, the frozen potato business that ConAgra Foods Inc is spinning off, expects net sales to rise in the low-single digits in percentage terms in the year ending May, the company said in its first investor day conference on Thursday. ~
CSX.O,UPDATE 1-CSX CEO says coal volumes set to decline further CHICAGO, Oct 13 U.S. coal freight volumes, in decline for close to two years,  will fall further, though the slowing pace of drop should ease the shock to U.S. railroads, the top executive of No. 3 U.S. railroad CSX Corp said on Thursday. ~CSX takes revenue, freight volume hit, but beats expectations CHICAGO No. 3 U.S. railroad CSX Corp  on Wednesday reported a lower quarterly net profit that was hurt by an 8 percent drop in revenue and freight volumes, but came in above market expectations and sent its stock up nearly 3 percent. ~
DE,Deere responds to U.S. Justice Dept move to block acquisition Deere & Co said its proposal to buy Precision Planting, an agricultural equipment and technology company, will increase consumer choice and directly benefit growers, in a response filed on Wednesday to the U.S. Department of Justice's lawsuit to block the acquisition. ~Deere responds to U.S. Justice Dept move to block acquisition Oct 13 Deere & Co said its proposal to buy Precision Planting, an agricultural equipment and technology company, will increase consumer choice and directly benefit growers, in a response filed on Wednesday to the U.S. Department of Justice's lawsuit to block the acquisition. ~
DAL,UPDATE 3-Delta profit tops view, plans to curb flight capacity Oct 13 Delta Air Lines Inc on Thursday said it will add fewer seats for purchase than usual in early 2017 to prop up fares, reacting to a deluge of flights from rivals that is squeezing its profit margins. ~BRIEF-Delta Air Lines CEO says is cautiously optimistic about economic growth going into 2017- CNBC * Delta Air Lines CEO Ed Bastian on CNBC- cautiously optimistic about economic growth going into 2017 ~Delta Air Lines Q3 profit tops estimates Oct 13 Delta Air Lines Inc on Thursday reported a third-quarter profit above analysts' expectations and said moves to curb its growth in flight capacity will help offset the future decline of a closely watched revenue measure. ~BRIEF-Delta Air Lines CEO Ed Bastian says demand was really strong this quarter - CNBC * Delta Air Lines CEO Ed Bastian on CNBC- demand was really strong this quarter; had some of the co's strongest days in its history this summer ~BRIEF-Delta Air Lines reports September quarter profit * Delta Air Lines Inc sees december 2016 quarter operating margin 14 pct - 16 pct ~
DISCA.O,BRIEF-Discovery Communications partners with Group Nine Media, announces $100 mln investment * Discovery Communications announces $100 million investment and strategic partnership with newly formed digital content holding company: Group Nine Media ~
DISCK.O,BRIEF-Discovery Communications partners with Group Nine Media, announces $100 mln investment * Discovery Communications announces $100 million investment and strategic partnership with newly formed digital content holding company: Group Nine Media ~
DPS,PepsiCo nears deal to acquire probiotic drinks company KeVita: sources PepsiCo Inc  is nearing a deal to acquire sparkling probiotic U.S. drinks company KeVita Inc, people familiar with the matter said on Thursday, in the latest push by the carbonated beverage giant to diversify its soft drinks business. ~UPDATE 1-PepsiCo nears deal to acquire probiotic drinks company KeVita - sources Oct 13 PepsiCo Inc is nearing a deal to acquire sparkling probiotic U.S. drinks company KeVita Inc, people familiar with the matter said on Thursday, in the latest push by the carbonated beverage giant to diversify its soft drinks business. ~
GS,Goldman targets credit-card borrowers with new lending business NEW YORK Goldman Sachs Group Inc  has launched a new online lending business that targets borrowers saddled with credit card debt, the bank said on Thursday. ~UPDATE 1-Goldman targets credit-card borrowers with new lending business NEW YORK, Oct 13 Goldman Sachs Group Inc  has launched a new online lending business that targets borrowers saddled with credit card debt, the bank said on Thursday. ~Goldman targets credit-card borrowers with new lending business NEW YORK, Oct 13 Goldman Sachs Group Inc  has launched a new online lending business that targets borrowers saddled with credit-card debt, the bank said on Thursday. ~
HOG,Harley-Davidson eyes Asian riders to rev up growth SINGAPORE, Oct 13 U.S. motorcycle maker Harley-Davidson Inc plans to boost its focus on Asia to accelerate growth by entering new countries and expanding its dealerships, its chief executive said, as it seeks to become less dependent on its home market. ~
HPQ,CORRECTED-HP Inc to cut 3000-4000 jobs over next three years Oct 13 HP Inc, the hardware business of former Hewlett-Packard Co, said it expects to cut about 3000 to 4000 jobs over the next three years. ~
JNJ,How Fidelity's owners get richer at everyday investors' expense   ~
K,UPDATE 1-Kellogg to buy controlling stake in Brazilian food group Parati Oct 13 Kellogg Co said it would buy a controlling stake in privately held Brazilian food group Parati for about 1.38 billion reais ($428 million) in cash to expand in emerging markets. ~RPT-Kellogg to buy controlling shareholder of Brazil's Parati Group Oct 13 Corn Flakes maker Kellogg Co said on Thursday it would buy Ritmo Investimentos, the controlling shareholder of Brazilian biscuit maker Parati Group, for about 1.38 billion reais ($428.44 million) to expand its presence in emerging markets. ~Kellogg to buy controlling shareholder of Brazil's Parati Group Oct 13 Corn Flakes maker Kellogg Co said on Thursday it would buy Ritmo Investimentos, the controlling shareholder of Brazilian biscuit maker Parati Group, for about 1.38 billion reais ($428.44 million) to expand its presence in emerging markets. ~BRIEF-Kellogg Co to acquire Ritmo Investimentos for R$1.38 bln, or roughly US$429 mln * Kellogg Company enters into agreement to acquire Ritmo Investimentos, controlling shareholder of iconic Brazilian food company Parati ~
MU.O,Micron's first-quarter guidance weighs on shares   ~
MON,Bayer's medical skin creams draw suitors Lupin, BC Partners -sources FRANKFURT, Oct 13 Bayer has short-listed India's Lupin and  investor BC Partners as prospective buyers of medical skin cream assets in a potential 1 billion euro ($1.1 billion) deal, several people familiar with the sale told Reuters. ~
NKE,Nike to become official kit supplier of Chelsea FC Oct 13 Nike Inc said on Thursday it signed a long-term deal with top English football club Chelsea FC, becoming its official kit supplier from the 2017-18 season. ~BRIEF-Nike to be official kit supplier to Chelsea FC from 2017/18 season * Chelsea Football Club announces new technical partnership with Nike ~
PFE,UPDATE 1-U.S. targets corporate tax-reduction strategy with new regulation WASHINGTON, Oct 13 The Obama administration, in its latest bid to prevent American companies from minimizing U.S. taxes by rebasing abroad, issued final rules on Thursday to combat a key tax-reduction technique known as earnings stripping. ~UPDATE 1-Pfizer loses appeal in UK patent case over use of Lyrica drug for pain LONDON, Oct 13 Pfizer suffered a setback in Britain on Thursday when the Court of Appeal in London ruled against it in a patent case over the use of its $5 billion-a-year drug Lyrica for pain relief. ~Pfizer loses appeal in UK patent case over use of Lyrica drug for pain LONDON, Oct 13 Pfizer suffered a setback in Britain on Thursday when the Court of Appeal in London ruled against it in a patent case over the use of its $5 billion-a-year drug Lyrica for pain relief. ~
SWK,Stanley Black & Decker working with Goldman on sale of locks unit-sources Oct 13 Power tool maker Stanley Black & Decker Inc is working with investment bank Goldman Sachs Group Inc on a sale process for its mechanical locks business, which could fetch as much as $1 billion, according to people familiar with the matter. ~
HSY,CORRECTED-OFFICIAL-Mobile ad startup MediaBrix to triple revenue by 2018 Oct 13 MediaBrix, a fast-growing startup whose software delivers "moment-based" mobile advertising, is going after one of the most difficult demographics in the ad business - teens. ~
FOXA.O,Almost 30 pct of Sky shareholders oppose James Murdoch as chairman LONDON, Oct 13 Almost 30 percent of voting shareholders at Sky opposed the appointment of James Murdoch as chairman of the European pay TV group on Thursday, with some saying he was too closely linked to the group's largest investor, owned by his father Rupert. ~
FOX.O,Almost 30 pct of Sky shareholders oppose James Murdoch as chairman LONDON, Oct 13 Almost 30 percent of voting shareholders at Sky opposed the appointment of James Murdoch as chairman of the European pay TV group on Thursday, with some saying he was too closely linked to the group's largest investor, owned by his father Rupert. ~
VZ,UPDATE 3-Verizon says Yahoo hack 'material,' could affect deal WASHINGTON, Oct 13 Verizon Communications Inc  said on Thursday it has a "reasonable basis" to believe Yahoo Inc's massive data breach of email accounts represents a material impact that could allow Verizon to withdraw from its $4.83 billion deal to buy the technology company. ~CORRECTED-Verizon believes Yahoo email hacking 'material,' could affect deal WASHINGTON, Oct 13 Verizon Communications Inc  general counsel, Craig Silliman, said on Thursday the company has a "reasonable basis" to believe that Yahoo Inc's  massive data breach of at least 500 million email accounts represents a material impact that could allow Verizon to withdraw from its $4.83 billion deal to buy Yahoo. ~UPDATE 3-Verizon closing call centers in five U.S. states, 3,200 jobs affected Oct 13 Verizon Communications Inc said on Thursday it plans to close call centers in five states, including its home state of New York, as the No. 1 wireless company trims head count and reorganizes operations in a saturated wireless market. ~Verizon to close call centers in 5 states Oct 13 Verizon Communications Inc, the No. 1 U.S. wireless company, said on Thursday it would close call centers in five states, including its home state of New York. ~BRIEF-Verizon is closing call centers in five states, including home state of New York - NYT * Verizon is closing call centers in five states, including its home state of new york - NYT ~
WFC,Wells Fargo complaints show flaws in federal whistleblower program WASHINGTON, Oct 13 Former Wells Fargo & Co  general manager Claudia Ponce de Leon filed a whistleblower complaint in December 2011 with federal labor regulators, alleging she was fired for telling superiors about employees opening unauthorized accounts. ~Wells Fargo complaints show flaws in federal whistleblower program WASHINGTON, Oct 13 Former Wells Fargo & Co  general manager Claudia Ponce de Leon filed a whistleblower complaint in December 2011 with federal labor regulators, alleging she was fired for telling superiors about employees opening unauthorized accounts. ~Old problems overshadow new era at Wells Fargo The Tim Sloan era has begun at Wells Fargo  but the old problems remain. ~Old problems overshadow new era at Wells Fargo NEW YORK The Tim Sloan era has begun at Wells Fargo  but the old problems remain. ~UPDATE 1-Old problems overshadow new era at Wells Fargo NEW YORK, Oct 13 The Tim Sloan era has begun at Wells Fargo but the old problems remain. ~RPT-Wells Fargo's new CEO faces immediate test NEW YORK, Oct 13 Tim Sloan will not have much time to prepare his pitch for Wall Street. ~Commentary: Why the Wells Fargo bank scandals would be a step up for some consumers The Wells Fargo scandal over the bank’s opening fake credit card and bank accounts for unwitting customers continues to stoke populist outrage. ~Wells Fargo's new CEO faces immediate test NEW YORK, Oct 13 Tim Sloan will not have much time to prepare his pitch for Wall Street. ~Wells Fargo CEO John Stumpf quits, replaced by Tim Sloan NEW YORK Wells Fargo & Co's veteran chairman and chief executive officer, John Stumpf, abruptly departed on Wednesday bowing to  pressure over its sales tactics that has damaged the bank's reputation and put Wall Street under renewed scrutiny. ~
XRX,Xerox sued by large investor over plan to split company One of Xerox Corp's largest shareholders sued the copier maker to block its plan for spinning off its document outsourcing business into a new publicly traded company. ~Xerox sued by large investor over plan to split company Oct 13 One of Xerox Corp's largest shareholders sued the copier maker to block its plan for spinning off its document outsourcing business into a new publicly traded company. ~BRIEF-Xerox's largest individual shareholder sues to block split of company - CNBC, citing DJ * Darwin Deason, Xerox's largest individual shareholder, sues to block split of company - CNBC, citing Dow Jones ~
