AMZN.O,Amazon says some warrants in Air Transport Services exercisable by July 8  (This March 18 story corrects headline and paragraph 1 to say that Amazon has warrants to buy 9.99 percent stake in Air Transport Services, not that it has bought that stake) ~CORRECTED-Amazon says some warrants in Air Transport Services exercisable by July 8 (March 18) March 18 Amazon.com Inc said it has warrants to buy a stake in Air Transport Services Group Inc , 9.99 percent of which will become exercisable as of July 8 or when Air Transport holds its shareholder meeting - whichever comes first. (http://1.usa.gov/1Zb30XF) ~
ANTM.N,Health insurer Anthem sues Express Scripts over drug pricing Health insurer Anthem Inc said it had sued pharmacy benefit manager Express Scripts Holding Co  to recover damages from drug pricing it believes was too high. ~Health insurer Anthem sues Express Scripts over drug pricing Health insurer Anthem Inc said it had sued pharmacy benefit manager Express Scripts Holding Co to recover damages from drug pricing it believes was too high. ~UPDATE 2-Health insurer Anthem sues Express Scripts over drug pricing March 21 Health insurer Anthem Inc said it had sued pharmacy benefit manager Express Scripts Holding Co  to recover damages from drug pricing it believes was too high. ~Health insurer Anthem files suit against Express Scripts March 21 Health insurer Anthem Inc said it filed a lawsuit against pharmacy benefit manager Express Scripts Holding Co to recover damages for pharmacy pricing that was higher than competitive benchmark pricing. ~
AAPL.O,U.S. top court agrees to hear Samsung-Apple patent fight The U.S. Supreme Court on Monday stepped into the high-profile patent fight between the world's two fiercest smartphone rivals, Apple and Samsung, agreeing to hear Samsung's appeal of what it contends were excessive penalties for copying the patented designs of the iPhone. ~U.S. top court agrees to hear Samsung-Apple patent fight The U.S. Supreme Court on Monday stepped into the high-profile patent fight between the world's two fiercest smartphone rivals, Apple and Samsung, agreeing to hear Samsung's appeal of what it contends were excessive penalties for copying the patented designs of the iPhone. ~UPDATE 3-U.S. top court agrees to hear Samsung-Apple patent fight March 21 The U.S. Supreme Court on Monday stepped into the high-profile patent fight between the world's two fiercest smartphone rivals, Apple and Samsung, agreeing to hear Samsung's appeal of what it contends were excessive penalties for copying the patented designs of the iPhone. ~UPDATE 7-Apple hopes small is big again as iPhone SE debuts CUPERTINO, Calif., March 21 Apple Inc  on Monday launched its least expensive iPhone, the $399 iPhone SE, filling a hole in its product lineup with a small-screen model that targets new customers in emerging markets and fans of smaller phones as the company tries to reverse falling phone sales. ~U.S. top court agrees to hear Samsung-Apple patent fight WASHINGTON, March 21 The U.S. Supreme Court on Monday stepped into the high-profile patent fight between the world's two fiercest smartphone rivals, Apple and Samsung, agreeing to hear Samsung's appeal of what it contends were excessive penalties for copying the patented designs of the iPhone. ~RPT-Smaller iPhone expected Monday as Apple counters drop in phone sales SAN FRANCISCO, March 21    Apple Inc  is expected to launch a smaller, cheaper iPhone on Monday aimed at emerging markets and possibly China, the world's biggest buyer of smartphones, as it looks to reverse a decline in worldwide sales of its most important product. ~Smaller iPhone expected Monday as Apple counters drop in phone sales SAN FRANCISCO, March 21    Apple Inc  is expected to launch a smaller, cheaper iPhone on Monday aimed at emerging markets and possibly China, the world's biggest buyer of smartphones, as it looks to reverse a decline in worldwide sales of its most important product. ~
CCL,Carnival Corp gets Cuba's approval to begin cruises March 21 Cruise operator Carnival Corp  said on Monday it received approval from Cuban authorities to begin operations to the country, starting May 1. ~BRIEF-Carnival Corp says Fathom granted approval by Cuba to cruise from U.S. to Cuba * Carnival corporation's fathom granted approval by cuba to cruise from u.s. To cuba  Source text for Eikon:  Further company coverage: ~
DOW,BRIEF-Downer EDI says offer for Spotless Group now closed * Confirms that its offer for Spotless was not extended and has now closed. Source text for Eikon: Further company coverage: ~BRIEF-Downer EDI posts FY net profit of $181.5 million * FY total revenue and other income from ordinary activities $7.29 billion , up 6.4 percent ~BRIEF-Downer EDI says ‍offer for Spotless Group extended to 28 August 2017​ * ‍Offer for Spotless Group extended to 7pm on Monday, 28 august 2017​ Source text for Eikon: Further company coverage: ~BRIEF-Downer EDI says Spotless ‍offer extended to Aug 21, 2017​ * Spotless ‍offer extended to 7pm on monday, 21 august 2017​ Source text for Eikon: Further company coverage: ~BRIEF-Downer EDI's takeover offer for Spotless Group extended till 7pm (Sydney time) on Aug. 14 * Unconditional takeover offer for Spotless Group extended until 7:00pm (Sydney time) on Monday, 14 August Source text for Eikon: Further company coverage: (bangalore.newsroom@thomsonreuters.com) ~BRIEF-Downer extends takeover offer for Spotless Group * decided to extend Spotless offer period for one week; offer will now remain open for acceptance until 14 august Source text for Eikon: Further company coverage: ~BRIEF-Downer extends Spotless offer to August 7 2017 * ‍Downer has decided to extend offer for Spotless Group holdings to 7 pm on Monday, 7 august 2017​ Source text for Eikon: Further company coverage: ~BRIEF-Downer EDI's stake in Spotless increases to 80.3 pct * Downer's stake in Spotless increases to 80.3 pct Source text for Eikon: Further company coverage: ~BRIEF- Downer EDI Ltd'S stake in Spotless Group increases to 72% * As Downer's shareholding in Spotless is now over 70%, Downer expects that Spotless will be removed from certain S&P;/ASX market indices ~
ESRX.O,Health insurer Anthem sues Express Scripts over drug pricing Health insurer Anthem Inc said it had sued pharmacy benefit manager Express Scripts Holding Co to recover damages from drug pricing it believes was too high. ~UPDATE 2-Health insurer Anthem sues Express Scripts over drug pricing March 21 Health insurer Anthem Inc said it had sued pharmacy benefit manager Express Scripts Holding Co  to recover damages from drug pricing it believes was too high. ~Health insurer Anthem files suit against Express Scripts March 21 Health insurer Anthem Inc said it filed a lawsuit against pharmacy benefit manager Express Scripts Holding Co to recover damages for pharmacy pricing that was higher than competitive benchmark pricing. ~
GM,Exclusive: Lyft drivers, if employees, owed millions more - court documents SAN FRANCISCO Drivers who worked for ride-hailing service Lyft in California during the past four years would have been entitled to an estimated $126 million in expense reimbursements had they been employees rather than contractors, court documents show. ~UPDATE 1-GM says China investment plans on track despite maturing auto market * Will introduce 60 fresh models by 2020   (Adds executives' quotes, context) ~GM targets big jump in South Korea sales to alleviate production woes YANGPYEONG, South Korea General Motors Co  said it is aiming to boost its South Korean sales by one fifth and attain market share of more than 10 percent, part of efforts to revive output at one of its key Asia production bases. ~GM targets big jump in S.Korea sales to alleviate production woes YANGPYEONG, South Korea, March 21 General Motors Co said it is aiming to boost its South Korean sales by one fifth and attain market share of more than 10 percent, part of efforts to revive output at one of its key Asia production bases. ~GM's China chief says Chinese car market to grow 3-5 pct/yr till 2020 BEIJING, March 21 General Motors Co (GM)  expects to see China's car market to grow 3-5 percent every year until 2020, its China chief Matt Tsien said on Monday. ~
GS,Goldman Sachs plans to close Geneva office: spokesman ZURICH Goldman Sachs  is looking to close its Geneva private banking branch, a spokesman for the U.S. bank said on Monday. ~Goldman Sachs plans to close Geneva office -spokesman ZURICH, March 21 Goldman Sachs is looking to close its Geneva private banking branch, a spokesman for the U.S. bank said on Monday. ~Rouble to rise almost 10 pct to 62/dollar in 12 months-Goldman LONDON, March 21 Investment bank Goldman Sachs said on Monday it was raising its forecasts for the rouble, predicting it would trade at 62 per dollar in 12 months time, almost 10 percent stronger than current levels. ~UPDATE 1-Fed approves Goldman acquisition of GE Capital's U.S. online deposits March 21 Goldman Sachs Group Inc received permission on Monday to complete its $17 billion acquisition of GE Capital Bank's U.S. online deposits. ~Fed approves Goldman acquisition of GE Capital's U.S. online deposits March 21 Goldman Sachs Group Inc received permission on Monday to complete its $17 billion acquisition of GE Capital Bank's U.S. online deposits. ~
HAL,Halliburton-Baker Hughes deal faces delay again, EU wants more info Oilfield services provider Halliburton Co's plan to acquire smaller rival Baker Hughes faces more delay after European Union antitrust regulators halted their investigation into the $35 billion deal for the second time. ~UPDATE 1-Halliburton-Baker Hughes deal faces delay again, EU wants more info March 21 Oilfield services provider Halliburton Co's plan to acquire smaller rival Baker Hughes  faces more delay after European Union antitrust regulators halted their investigation into the $35 billion deal for the second time. ~
JNJ,UK cost agency backs J&J; cancer drug in change of heart LONDON, March 21 A cancer drug originally discovered in Britain has finally been endorsed for treating advanced prostate cancer before chemotherapy on the country's state health service in a change of heart by the cost agency NICE. ~
MAR.O,US STOCKS-Wall St flat as Fed still dominates investor sentiment * Dow up 0.16 pct, S&P; up 0.13 pct, Nasdaq up 0.27 pct   (Updates to afternoon) ~US STOCKS-Wall St flat as investors pause after 5-week rally * Dow up 0.08 pct, S&P; down 0.05 pct, Nasdaq up 0.05 pct   (Updates to early afternoon) ~US STOCKS-Wall St flat as fall in energy offset by health stocks * Indexes up: Dow 0.15 pct, S&P; 0.05 pct, Nasdaq 0.19 pct   (Adds details, changes comment, updates prices) ~US STOCKS-Wall St flat as investors seek growth catalysts * Dow down 0.06 pct, S&P; down 0.07 pct, Nasdaq up 0.03 pct   (Updates to open) ~BRIEF-Marriott expects Starwood deal to be "slightly dilutive" in 2016 - Conf call * Expect $250 million synergies from Starwood deal to be realized by 2018, if not before - Conf call ~US STOCKS-Wall St set to open little changed as investors pause * Futures down: Dow 14 pts, S&P; 2 pts, Nasdaq 5 pts   (Adds details, comment, updates prices) ~BRIEF-Marriott International and Starwood to adjourn respective stockholder meeting for deal until April 8 * Co,Starwood agreed to convene stockholder meeting for deal on march 28;to immediately adjourn such meeting until april 8  Source text - http://1.usa.gov/25ff4vd Further company coverage:     (Bengaluru Newsroom: +1 646 223 8780) ~BRIEF-Marriott international and Starwood Hotels & Resorts Worldwide sign amended merger agreement * Revised terms value Starwood at $79.53 per share or $13.6 billion ~Sheraton-owner Starwood accepts higher offer from Marriott March 21 Marriott International Inc said it made a higher offer for Starwood Hotels and Resorts Worldwide Inc that was accepted by the owner of the Sheraton and Westin hotel brands. ~
MON,Bayer shares jump on Monsanto crop science interest FRANKFURT, March 21 Shares in German drugs and pesticides maker Bayer rose more than 5 percent on Monday after sources close to the matter told Reuters that Monsanto was interested in a deal with its crop science business. ~
NFLX.O,Vivendi eyeing Mediaset contents deal not group -Berlusconi to radio MILAN, March 21 Vivendi is interested to collaborate with Mediaset on content, but the French media group is not after the Italian broadcaster, former prime minister Silvio Berlusconi, whose family controls Mediaset, told a radio station on Monday. ~
SLB,UPDATE 1-Schlumberger expects Q1 revenue to fall 15 pct from Q4 March 21 Schlumberger Ltd, the world's largest oilfield services provider, said revenue in the current quarter is expected to fall 15 percent from the fourth, as spending cuts by oil producers take a toll. ~
SHW,Sherwin-Williams paint company to buy Valspar for $9.3 billion The Sherwin-Williams Co  has agreed to acquire rival U.S. paint company Valspar Corp , the companies said on Sunday, in an all-cash deal valued at about $9.3 billion. ~UPDATE 6-Sherwin-Williams paint company to buy Valspar for $9.3 bln March 20 The Sherwin-Williams Co has agreed to acquire rival U.S. paint company Valspar Corp, the companies said on Sunday, in an all-cash deal valued at about $9.3 billion. ~
BK,UPDATE 1-BNY Mellon to pay $3 mln after Mass. probe of funds glitch March 21 Bank of New York Mellon Corp has agreed to pay $3 million in settling a state investigation into problems it faced in calculating net asset values on some 1,200 mutual funds last August, Massachusetts' top securities regulator said on Monday. ~
TMO,Affymetrix rejects rival bid, supports Thermo Fisher merger March 20 U.S. gene-testing company Affymetrix Inc's board on Sunday rejected a $1.5 billion bid by Origin Technologies Corp, saying it stood by a $1.3 billion merger deal with Thermo Fisher Scientific Inc. ~
VZ,BRIEF-Verizon communications inc - "see protecting an open internet as a business imperative that is inextricably tied to our future success" * "see protecting an open internet as a business imperative that is inextricably tied to our future success"  Source text for Eikon:  Further company coverage:    (Bengaluru Newsroom: +1 646 223 8780) ~BRIEF-Verizon announces early participation results and upsizing of its tender offer for all series of Waterfall notes * Verizon Communications Inc says has increased Waterfall cap from $4 billion aggregate purchase price to $5.5 billion aggregate purchase price ~RPT-Blackstone makes quiet sale ahead of FCC airwaves auction NEW YORK, March 20 A quiet decision by private equity firm Blackstone Group LP to recently sell three TV stations may foreshadow uncertain returns for some selling TV airwaves and lower wireless demand in the U.S. government's upcoming spectrum auction, industry watchers say. ~
V,BRIEF-Visa calls for redemption all of its 1.200 pct notes due 2017 * Visa Inc - on Sept 11, co called for redemption all of $1.75 billion principal amount outstanding of its 1.200 pct notes due 2017‍​ - SEC filing ~BRIEF-Visa Inc files for three-part senior notes offering of up to $2.5 bln * Visa Inc says files for three-part senior notes offering of up to $2.5 billion - SEC filing‍​ ~Former BoE deputy Hogg to join Visa as Europe unit CEO Visa Inc, the world's largest payments processor, on Thursday named former Bank of England (BoE) deputy governor Charlotte Hogg as chief executive of its Europe division. ~CORRECTED-UPDATE 1-MOVES-Former BoE deputy Hogg to join Visa as Europe unit CEO Sept 7 Visa Inc, the world's largest payments processor, on Thursday named former Bank of England (BoE) deputy governor Charlotte Hogg as chief executive of its Europe division. ~MOVES-Visa names ex-BoE deputy Charlotte Hogg as Europe unit CEO Sept 7 Visa Inc, the world's largest payments processor, on Thursday named Charlotte Hogg as chief executive of its Europe division. ~BRIEF-Visa appoints Charlotte Hogg as CEO of European operations * Visa Inc appoints Charlotte Hogg as chief executive officer of the compan's European operations ~BRIEF-Visa Inc files prospectus supplement for potential three-part senior notes offering * Visa Inc files prospectus supplement for potential three-part senior notes offering; size not disclosed - sec filing‍​ Source text (http://bit.ly/2vLDrIe) Further company coverage: ~BRIEF-Visa enables on the go payments with the new Fitbit Ionic * Visa inc- ‍enabling visa payments on fitbit's smartwatch fitbit ionic​ ~BRIEF-Bridg raises $11 million in Series B funding * Bridg raises $11 million in Series B funding from Morpheus Ventures, March Capital, Visa and NextEquity ~
WU,UPDATE 1-Western Union says to expand in Cuba March 21 Western Union Co said on Monday it would expand in Cuba, at a time when U.S. President Barack Obama started a historic Cuba tour as the two countries attempt to rebuild their bilateral relationship. ~
