ABT,FDA advisers to weigh risks of Abbott's dissolving stent March 14 U.S. government scientists have raised questions about the potential risks to patients of heart attacks and blood clots from Abbott Laboratories' novel coronary stent that dissolves after it is implanted. ~Indian court grants Pfizer temporary relief on cough syrup ban An Indian court granted U.S. drugmaker Pfizer   an interim injunction on a ban on its popular cough syrup Corex, days after the government ordered it to be prohibited citing a potential risk to humans. ~Indian court grants Pfizer temporary relief on cough syrup ban MUMBAI/NEW DELHI An Indian court granted U.S. drugmaker Pfizer   an interim injunction on a ban on its popular cough syrup Corex, days after the government ordered it to be prohibited citing a potential risk to humans. ~UPDATE 4-Indian court grants Pfizer temporary relief on cough syrup ban * Pfizer says banned syrup brought in $26 mln in Apr-Dec   (Adds statement from Pfizer's India unit) ~CORRECTED-UPDATE 3-Indian court grants Pfizer stay on ban of popular cough syrup MUMBAI/NEW DELHI, March 14 An Indian court granted U.S. pharmaceuticals firm Pfizer Inc's   Indian unit a stay order on Monday, pending a further hearing, on a government ban on its popular cough syrup Corex, two lawyers representing the drugmaker told Reuters. ~Antibiotic combination marketed by Abbott in India on list of banned drugs MUMBAI A powerful antibiotic combination that is marketed in India by U.S. pharmaceutical giant Abbott Laboratories is among 344 drug combinations that have been banned by the Indian health authorities. ~Abbott India says to comply with government order on drugs ban NEW DELHI U.S.-pharmaceutical giant Abbott Laboratories' India unit   will comply with all legal requirements of a government order that bans more than 300 combination drugs in the country, a company spokesman said on Monday. ~Abbott India says to comply with government order on drugs ban NEW DELHI, March 14 U.S.-pharmaceutical giant Abbott Laboratories' India unit  will comply with all legal requirements of a government order that bans more than 300 combination drugs in the country, a company spokesman said on Monday. ~
BAC,Bank of America wins round in ongoing pension-plan dispute A federal court sided with Bank of America Corp in a long-running battle over employee pensions on Friday, scheduling a November trial to determine whether the bank retained profits from a discredited investment strategy that led to a $10 million fine from the Internal Revenue Service. ~
CBS,Viacom shareholders re-elect directors, reject voting rights proposal MIAMI A substantial majority of Viacom Inc's  independent shareholders on Monday voted to re-elect the media company's directors and rejected a move to extend voting rights to all shareholders, going against recommendations by the leading proxy advisory firm. ~UPDATE 4-Viacom shareholders re-elect directors, reject voting rights proposal MIAMI, March 14 A substantial majority of Viacom Inc's independent shareholders on Monday voted to re-elect the media company's directors and rejected a move to extend voting rights to all shareholders, going against recommendations by the leading proxy advisory firm. ~Viacom shareholders re-elect directors, reject voting rights proposal MIAMI A substantial majority of Viacom Inc's  independent shareholders on Monday voted to re-elect the media company's directors and rejected a move to extend voting rights to all shareholders, going against recommendations by the leading proxy advisory firm. ~BRIEF-Viacom CEO says Sumner Redstone enjoying life and getting best medical care * Ceo dauman says did not seek to be in charge of Sumner Redstone's health care directive ~Viacom shareholders re-elect directors, reject voting rights proposal March 14 Viacom Inc investors re-elected the media company's directors and rejected a proposal to extend voting rights to all shareholders despite recommendations by the leading proxy advisory firm to withhold support for some directors and approve the proposal. ~
DOW,BRIEF-Downer EDI says offer for Spotless Group now closed * Confirms that its offer for Spotless was not extended and has now closed. Source text for Eikon: Further company coverage: ~BRIEF-Downer EDI posts FY net profit of $181.5 million * FY total revenue and other income from ordinary activities $7.29 billion , up 6.4 percent ~BRIEF-Downer EDI says ‍offer for Spotless Group extended to 28 August 2017​ * ‍Offer for Spotless Group extended to 7pm on Monday, 28 august 2017​ Source text for Eikon: Further company coverage: ~BRIEF-Downer EDI says Spotless ‍offer extended to Aug 21, 2017​ * Spotless ‍offer extended to 7pm on monday, 21 august 2017​ Source text for Eikon: Further company coverage: ~BRIEF-Downer EDI's takeover offer for Spotless Group extended till 7pm (Sydney time) on Aug. 14 * Unconditional takeover offer for Spotless Group extended until 7:00pm (Sydney time) on Monday, 14 August Source text for Eikon: Further company coverage: (bangalore.newsroom@thomsonreuters.com) ~BRIEF-Downer extends takeover offer for Spotless Group * decided to extend Spotless offer period for one week; offer will now remain open for acceptance until 14 august Source text for Eikon: Further company coverage: ~BRIEF-Downer extends Spotless offer to August 7 2017 * ‍Downer has decided to extend offer for Spotless Group holdings to 7 pm on Monday, 7 august 2017​ Source text for Eikon: Further company coverage: ~BRIEF-Downer EDI's stake in Spotless increases to 80.3 pct * Downer's stake in Spotless increases to 80.3 pct Source text for Eikon: Further company coverage: ~BRIEF- Downer EDI Ltd'S stake in Spotless Group increases to 72% * As Downer's shareholding in Spotless is now over 70%, Downer expects that Spotless will be removed from certain S&P;/ASX market indices ~
F,Early March gains in auto sector shares may prove fleeting NEW YORK, March 14 Auto stocks have come roaring out of the gate in the last month, but the gains may be short-lived as analysts and investors show signs of souring on the sector. ~
GM,Early March gains in auto sector shares may prove fleeting NEW YORK, March 14 Auto stocks have come roaring out of the gate in the last month, but the gains may be short-lived as analysts and investors show signs of souring on the sector. ~RPT-Plaintiffs face critical legal tests in GM ignition-switch cases NEW YORK, March 14 People suing General Motors Co over a faulty ignition switch will get two chances in a Manhattan court this week to argue that the U.S. automaker should be held accountable for injuries, deaths and lost vehicle value. ~Plaintiffs face critical legal tests in GM ignition-switch cases NEW YORK People suing General Motors Co  over a faulty ignition switch will get two chances in a Manhattan court this week to argue that the U.S. automaker should be held accountable for injuries, deaths and lost vehicle value. ~Plaintiffs face critical legal tests in GM ignition-switch cases NEW YORK, March 14 People suing General Motors Co over a faulty ignition switch will get two chances in a Manhattan court this week to argue that the U.S. automaker should be held accountable for injuries, deaths and lost vehicle value. ~
GS,REFILE-Goldman revamps electronic stock trading to catch rival NEW YORK, March 14 Raj Mahajan achieved a rare feat when he rejoined Goldman Sachs Group Inc last year with the coveted title of partner, the Wall Street bank's highest rank. Then he got to work on fixing the pipes. ~
K,FDA investigating graphic video linked to Kellogg factory March 14 Breakfast cereals maker Kellogg Co  said federal regulators are conducting a criminal investigation of a video that surfaced on Friday showing a man filming himself urinating on one of its factory assembly lines. ~
MAR.O,BRIEF-Marriott International says reaffirms commitment to merge with Starwood Hotels * Will monitor development as it and Starwood continue to work toward closing of its transaction ~
PFE,Indian court grants Pfizer temporary relief on cough syrup ban MUMBAI/NEW DELHI An Indian court granted U.S. drugmaker Pfizer   an interim injunction on a ban on its popular cough syrup Corex, days after the government ordered it to be prohibited citing a potential risk to humans. ~UPDATE 4-Indian court grants Pfizer temporary relief on cough syrup ban * Pfizer says banned syrup brought in $26 mln in Apr-Dec   (Adds statement from Pfizer's India unit) ~CORRECTED-UPDATE 3-Indian court grants Pfizer stay on ban of popular cough syrup MUMBAI/NEW DELHI, March 14 An Indian court granted U.S. pharmaceuticals firm Pfizer Inc's   Indian unit a stay order on Monday, pending a further hearing, on a government ban on its popular cough syrup Corex, two lawyers representing the drugmaker told Reuters. ~Pfizer stops selling popular Corex cough syrup in India after ban MUMBAI, March 14 U.S. pharmaceutical giant Pfizer Inc's India unit said on Monday it had stopped selling its popular Corex cough syrup, after regulators banned it saying it was likely to pose a risk to humans. ~
UAL,Activist investors question United Airlines CEO's board role, pay NEW YORK, March 14 The two hedge funds that launched a boardroom fight with United Continental Holdings Inc  last week oppose the airline's plans to give Chief Executive Oscar Munoz the additional role of chairman and have concerns about his compensation, according to a person familiar with the matter. ~
VZ,New York Times' editorial page editor Andrew Rosenthal to step down New York Times Co said on Monday Andrew Rosenthal would step down as the newspaper's editorial page editor in late April, and would be succeeded by James Bennet, editor-in-chief of the Atlantic. ~
V,BRIEF-Visa calls for redemption all of its 1.200 pct notes due 2017 * Visa Inc - on Sept 11, co called for redemption all of $1.75 billion principal amount outstanding of its 1.200 pct notes due 2017‍​ - SEC filing ~BRIEF-Visa Inc files for three-part senior notes offering of up to $2.5 bln * Visa Inc says files for three-part senior notes offering of up to $2.5 billion - SEC filing‍​ ~Former BoE deputy Hogg to join Visa as Europe unit CEO Visa Inc, the world's largest payments processor, on Thursday named former Bank of England (BoE) deputy governor Charlotte Hogg as chief executive of its Europe division. ~CORRECTED-UPDATE 1-MOVES-Former BoE deputy Hogg to join Visa as Europe unit CEO Sept 7 Visa Inc, the world's largest payments processor, on Thursday named former Bank of England (BoE) deputy governor Charlotte Hogg as chief executive of its Europe division. ~MOVES-Visa names ex-BoE deputy Charlotte Hogg as Europe unit CEO Sept 7 Visa Inc, the world's largest payments processor, on Thursday named Charlotte Hogg as chief executive of its Europe division. ~BRIEF-Visa appoints Charlotte Hogg as CEO of European operations * Visa Inc appoints Charlotte Hogg as chief executive officer of the compan's European operations ~BRIEF-Visa Inc files prospectus supplement for potential three-part senior notes offering * Visa Inc files prospectus supplement for potential three-part senior notes offering; size not disclosed - sec filing‍​ Source text (http://bit.ly/2vLDrIe) Further company coverage: ~BRIEF-Visa enables on the go payments with the new Fitbit Ionic * Visa inc- ‍enabling visa payments on fitbit's smartwatch fitbit ionic​ ~BRIEF-Bridg raises $11 million in Series B funding * Bridg raises $11 million in Series B funding from Morpheus Ventures, March Capital, Visa and NextEquity ~
