GOOGL.O,Timeline: Google wins some, loses some in global antitrust battles FRANKFURT For more than a decade, Internet search and advertising giant Google, now a unit of holding company Alphabet Inc, has sparred with competitors in an expanding range of industries from Internet to media to telecoms to automobiles. ~TIMELINE-Google wins some, loses some in global antitrust battles FRANKFURT, April 19 For more than a decade, Internet search and advertising giant Google, now a unit of holding company Alphabet Inc, has sparred with competitors in an expanding range of industries from Internet to media to telecoms to automobiles. ~
GOOG.O,Timeline: Google wins some, loses some in global antitrust battles FRANKFURT For more than a decade, Internet search and advertising giant Google, now a unit of holding company Alphabet Inc, has sparred with competitors in an expanding range of industries from Internet to media to telecoms to automobiles. ~TIMELINE-Google wins some, loses some in global antitrust battles FRANKFURT, April 19 For more than a decade, Internet search and advertising giant Google, now a unit of holding company Alphabet Inc, has sparred with competitors in an expanding range of industries from Internet to media to telecoms to automobiles. ~
ANTM.N,UPDATE 1-Express Scripts says Anthem negotiated in bad faith - court filing April 19 Pharmacy benefit manager Express Scripts Holding Co has accused Anthem Inc of negotiating their contract in bad faith and is seeking a court order that the health insurer has no right to demand lower drug prices. ~Express Scripts says Anthem negotiated in bad faith -court filing April 19 Pharmacy benefit manager Express Scripts Holding Co has accused Anthem Inc of negotiating their contract in bad faith and is seeking a court order that the health insurer has no right to demand lower drug prices. ~
AAPL.O,CORRECTED-Apple updates MacBook with faster processors April 19 Apple Inc on Tuesday updated its 12-inch MacBook line of laptops with faster processors, among other features, and made it available in rose gold color. ~BRIEF-Apple hires former tesla engineer Chris Porritt to electric car team- FT * Apple hires former Tesla engineer Chris Porritt to electric car team - FT, citing sources  Source : (http://bit.ly/1XHey3R)   (Bengaluru Newsroom +91 80 6749-1130; within U.S. +1 646 223 8780) ~BRIEF-Apple says updated Macbook with new processors, longer battery life * Apple inc says updates Macbook with latest processors, longer battery life & new rose gold finish ~BRIEF-Marathon Patent Group says Apple to pay $24.9 mln in settlement - sec filing * On April 18, 2016, Apple, Inc. And Dynamic Advances LLC, unit of Co entered into a settlement agreement ~
BAC,Big U.S. banks grapple with costs as they face an ominous 2016 April 19 Five large U.S. banks cut more than $5 billion from their expenses during the first three months of the year, but it was still not enough to stop the financial bleeding in what was by many measures the worst quarter for Wall Street since the financial crisis. ~
BA,Textron says it wins Boeing 777X flight simulator contract April 19 A unit of U.S. industrial conglomerate Textron Inc said on Tuesday it has won a contract from Boeing Co to design and manufacture flight simulators for 777X aircraft. ~MIDEAST STOCKS - Factors to watch - April 19 DUBAI, April 19 Here are some factors that may affect Middle East stock markets on Tuesday. Reuters has not verified the press reports and does not vouch for their accuracy. ~
CBS,UPDATE 3-Viacom warns Dish TV viewers of blackout if contract not renewed April 19 Viacom Inc on Tuesday began alerting Dish Network Corp's satellite TV subscribers that they might soon lose its networks, including Comedy Central, Nickelodeon and MTV, as an agreement between the companies is set to expire Wednesday night. ~Viacom carriage deal with Dish to expire Wednesday night April 19 Viacom Inc's carriage deal with Dish Network Corp is scheduled to expire at the end of the day Wednesday and there is no agreement in sight, a Viacom spokesman told Reuters Tuesday. ~
CVX,Chevron to sell Hawaii refinery to private equity group HOUSTON Chevron Corp has signed an agreement to sell its Hawaii refinery to private equity firm One Rock Capital Partners, ending a more-than six year quest to sell an asset not considered core to its business. ~BRIEF-One Rock Capital Partners to acquire downstream assets from Chevron in Hawaii * One rock capital partners to acquire downstream assets from chevron in hawaii ~Exclusive: Chevron seeks buyers for Myanmar gas assets worth $1.3 billion - sources HONG KONG/SINGAPORE U.S. oil and gas major Chevron Corp has put its Myanmar gas block stakes worth an estimated $1.3 billion up for sale, banking sources familiar with the matter said, in what would mark the biggest M&A; transaction involving the country's assets. ~
CI,UnitedHealth's Obamacare exit adds pricing pressure on rivals NEW YORK, April 19 UnitedHealth Group Inc's  decision to exit most of its Obamacare health insurance exchanges next year means rivals will need to raise prices further to prop up an unprofitable business, healthcare analysts and policy experts said on Tuesday. ~
CSCO.O,UPDATE 1-Hyundai Motor, Cisco to team up on Internet-connected car technology * Auto and tech firms partnering on connected car technologies ~Hyundai Motor, Cisco to team up on Internet-connected car technology SEOUL, April 19 Hyundai Motor said on Tuesday that it will partner with Cisco Systems to develop Internet-connected car technology, the latest alliance between auto and tech firms to  expand services that hook cars up to the Internet. ~
COST.O,Teamsters recommends members approve new Costco contract Teamsters unions representing 16,000 workers of Costco Wholesale Corp recommended their members approve a new contract offer from the retailer, a month after urging they reject an earlier proposal due to a long-running disagreement over pension plans. ~Teamsters recommends members approve new Costco contract Teamsters unions representing 16,000 workers of Costco Wholesale Corp  recommended their members approve a new contract offer from the retailer, a month after urging they reject an earlier proposal due to a long-running disagreement over pension plans. ~Teamsters recommends members approve new Costco contract April 19 Teamsters unions representing 16,000 workers of Costco Wholesale Corp recommended their members approve a new contract offer from the retailer, a month after urging they reject an earlier proposal due to a long-running disagreement over pension plans. ~
DFS,BRIEF-Discover Financial Services Q1 EPS $1.35 * Reported net income of $575 million or $1.35 per diluted share for q1 of 2016 ~BRIEF-Discover Financial Services qtrly provision for loan losses of $423 million increased $35 million from prior year * Qtrly provision for loan losses of $423 million increased $35 million from prior year ~
DOW,BRIEF-Downer EDI says offer for Spotless Group now closed * Confirms that its offer for Spotless was not extended and has now closed. Source text for Eikon: Further company coverage: ~BRIEF-Downer EDI posts FY net profit of $181.5 million * FY total revenue and other income from ordinary activities $7.29 billion , up 6.4 percent ~BRIEF-Downer EDI says ‍offer for Spotless Group extended to 28 August 2017​ * ‍Offer for Spotless Group extended to 7pm on Monday, 28 august 2017​ Source text for Eikon: Further company coverage: ~BRIEF-Downer EDI says Spotless ‍offer extended to Aug 21, 2017​ * Spotless ‍offer extended to 7pm on monday, 21 august 2017​ Source text for Eikon: Further company coverage: ~BRIEF-Downer EDI's takeover offer for Spotless Group extended till 7pm (Sydney time) on Aug. 14 * Unconditional takeover offer for Spotless Group extended until 7:00pm (Sydney time) on Monday, 14 August Source text for Eikon: Further company coverage: (bangalore.newsroom@thomsonreuters.com) ~BRIEF-Downer extends takeover offer for Spotless Group * decided to extend Spotless offer period for one week; offer will now remain open for acceptance until 14 august Source text for Eikon: Further company coverage: ~BRIEF-Downer extends Spotless offer to August 7 2017 * ‍Downer has decided to extend offer for Spotless Group holdings to 7 pm on Monday, 7 august 2017​ Source text for Eikon: Further company coverage: ~BRIEF-Downer EDI's stake in Spotless increases to 80.3 pct * Downer's stake in Spotless increases to 80.3 pct Source text for Eikon: Further company coverage: ~BRIEF- Downer EDI Ltd'S stake in Spotless Group increases to 72% * As Downer's shareholding in Spotless is now over 70%, Downer expects that Spotless will be removed from certain S&P;/ASX market indices ~
ESRX.O,UPDATE 1-Express Scripts says Anthem negotiated in bad faith - court filing April 19 Pharmacy benefit manager Express Scripts Holding Co has accused Anthem Inc of negotiating their contract in bad faith and is seeking a court order that the health insurer has no right to demand lower drug prices. ~Express Scripts says Anthem negotiated in bad faith -court filing April 19 Pharmacy benefit manager Express Scripts Holding Co has accused Anthem Inc of negotiating their contract in bad faith and is seeking a court order that the health insurer has no right to demand lower drug prices. ~
XOM,BRIEF-Exxon Mobil starts oil production at Julia oil field in Gulf of Mexico * Exxonmobil starts production at Julia oil field in the Gulf of Mexico ~RPT-Nigeria's NNPC fights for oil cargoes as revenue squeeze bites LONDON/ABUJA, April 18 Nigeria's state oil company is in a standoff with energy giants ExxonMobil  and Royal Dutch Shell over ownership of physical crude cargoes as the West African nation seeks to shore up its creaking budget. ~
F,Temp workers at small Ohio auto supplier plant join UAW -union April 19 Detroit Chassis, a company that supplies axles to Ford Motor Co, agreed to let temporary workers at an Ohio plant join the United Auto Workers union after they threatened a strike that could have hit production of large Ford pickup trucks at a nearby plant, the UAW said on Tuesday. ~
GS,EXCLUSIVE-Bass Pro teams up with Goldman for Cabela's bid -sources April 19 Privately held outdoor retailer Bass Pro Shops has partnered with Goldman Sachs Group Inc's  private equity arm to make an offer for U.S. hunting and fishing store chain Cabela's Inc, according to people familiar with the matter. ~UPDATE 5-Goldman posts weakest results in 4 years, revenue tumbles 40 pct * Shares rise 2 pct   (Recasts story, adds details from analyst call, updates share price) ~BRIEF-Goldman Sachs reports 1st-qtr earnings per share of $2.68 * Goldman Sachs reports first quarter earnings per common share of $2.68 ~Goldman Sachs profit slumps for fourth straight quarter April 19 Goldman Sachs Group Inc's profit slumped for the fourth straight quarter as market volatility hit the company's bond trading and investment banking businesses. ~
HOG,UPDATE 2-Harley shares dip despite higher-than-expected results April 19 U.S. motorcycle maker Harley-Davidson Inc beat Wall Street estimates with its first-quarter sales and earnings, but shares dipped amid concern about the company's eroding U.S. market share, rising bike inventories and higher marketing costs. ~Harley-Davidson posts lower quarterly net income as U.S. sales slip April 19 Harley-Davidson Inc on Tuesday posted lower quarterly net income as sales of new motorcycles declined in the United States, its biggest market. ~
HUM,UnitedHealth's Obamacare exit adds pricing pressure on rivals NEW YORK, April 19 UnitedHealth Group Inc's  decision to exit most of its Obamacare health insurance exchanges next year means rivals will need to raise prices further to prop up an unprofitable business, healthcare analysts and policy experts said on Tuesday. ~
INTC.O,BRIEF-Intel Q1 GAAP revenue of $13.7 bln, Non-GAAP revenue of $13.8 bln * Intel reports GAAP revenue of $13.7 billion; Non-GAAP revenue of $13.8 billion ~BRIEF-Intel announces reduction of up to 12,000 positions globally * Intel announces restructuring initiative to accelerate transformation ~Intel says to cut 12,000 jobs globally April 19 Intel Corp said it would cut 12,000 jobs globally, or 11 percent of its workforce. ~
IBM,IBM reports worst revenue in 14 years, shares slide International Business Machines Corp  reported its worst quarterly revenue in 14 years as results from newer businesses including cloud and mobile computing failed to offset declines in its traditional businesses, sending shares down nearly 5 percent in extended trading. ~UPDATE 3-IBM reports worst revenue in 14 years, shares slide * Shares down 5 pct in extended trading   (Adds analyst comment) ~
ISRG.O,Intuitive Surgical first-quarter profit beats expectations April 19 Intuitive Surgical Inc on Tuesday reported a first-quarter profit that topped Wall Street expectations, helped by expanded use of its da Vinci surgical robots in U.S. general surgery procedures. ~
JNJ,UPDATE 3-J&J; shares hit new high on strong drug sales, weaker dollar April 19 Johnson & Johnson beat quarterly earnings forecasts on strong prescription drug revenue and a weakening dollar, and it reassured investors that it did not expect its blockbuster Remicade arthritis drug to face U.S. competition this year. ~J&J; first-quarter sales rise marginally April 19 Johnson & Johnson reported a 0.6 percent rise in first-quarter sales, constrained by the strong dollar and Venezuela's currency devaluation. ~
LLL,Textron says it wins Boeing 777X flight simulator contract April 19 A unit of U.S. industrial conglomerate Textron Inc said on Tuesday it has won a contract from Boeing Co to design and manufacture flight simulators for 777X aircraft. ~
NEM,What to Watch in the Day Ahead - Wednesday, April 20 (The Day Ahead is an email and PDF publication that includes the day's major stories and events, analyses and other features. To receive The Day Ahead, Eikon users can register at . Thomson One users can register at RT/DAY/US. All times in ET/GMT)  The Coca-Cola Co is expected to report first-quarter revenue slightly above analysts' expectations, according to Thomson Reuters StarMine data. The world's largest soda maker has been aggressively cutting costs to cushion the impact of a strong dollar ~
NTRS.O,BRIEF-Northern Trust Q1 earnings per share $1.01 * Q1 earnings per share view $0.95 -- Thomson Reuters I/B/E/S ~
OMC,UPDATE 3-Higher ad spending in N.America boosts Omnicom, Publicis April 19 Omnicom Group Inc and Publicis , the world's No.2 and No.3 advertising agencies, reported higher quarterly revenue on Tuesday, boosted by spending in North America. ~BRIEF-Omnicom Group reports Q1 earnings per share $0.90 * Q1 earnings per share view $0.87 -- Thomson Reuters I/B/E/S ~
SRE,RPT-California governor, agencies face legal claims in gas blowout LOS ANGELES, April 18 Hundreds of Los Angeles homeowners who live near the site of the worst U.S. methane leak have filed claims against state regulators and the governor, seeking $3.5 million each in damages for government failures they blame for the gas blowout. ~California governor, agencies face legal claims in gas blowout LOS ANGELES Hundreds of Los Angeles homeowners who live near the site of the worst U.S. methane leak have filed claims against state regulators and the governor, seeking $3.5 million each in damages for government failures they blame for the gas blowout. ~California governor, agencies face legal claims in gas blowout LOS ANGELES, April 18 Hundreds of Los Angeles homeowners who live near the site of the worst U.S. methane leak have filed claims against state regulators and the governor, seeking $3.5 million each in damages for government failures they blame for the gas blowout. ~
TXT,Textron says it wins Boeing 777X flight simulator contract April 19 A unit of U.S. industrial conglomerate Textron Inc said on Tuesday it has won a contract from Boeing Co to design and manufacture flight simulators for 777X aircraft. ~
UNH,UPDATE 3-UnitedHealth plans to exit Obamacare exchanges April 19 U.S. health insurer UnitedHealth Group Inc on Tuesday said it would largely exit the Obamacare individual insurance market in 2017, citing expectations for mounting losses from the program. ~UnitedHealth to exit all but a handful of Obamacare exchanges in 2017: CEO NEW YORK UnitedHealth Group Inc  Chief Executive Officer Steven Hemsley said on Tuesday that the company would largely exit the Obamacare exchange market in 2017, following through on a warning he had given late last year that costs appeared to be unsustainable. ~UnitedHealth to exit all but a handful of Obamacare exchanges in 2017 -CEO NEW YORK, April 19 UnitedHealth Group Inc  Chief Executive Officer Steven Hemsley said on Tuesday that the company would largely exit the Obamacare exchange market in 2017, following through on a warning he had given late last year that costs appeared to be unsustainable. ~BRIEF-Unitedhealth Group reports Q1 adjusted earnings per share $1.81 * Q1 earnings per share view $1.72 -- Thomson Reuters I/B/E/S ~Health insurer UnitedHealth reports higher profit April 19 Health insurer UnitedHealth Group Inc  reported a 14 percent rise in quarterly profit helped by strength in its Optum business which offers healthcare services and drug benefit plans. ~
V,BRIEF-Visa calls for redemption all of its 1.200 pct notes due 2017 * Visa Inc - on Sept 11, co called for redemption all of $1.75 billion principal amount outstanding of its 1.200 pct notes due 2017‍​ - SEC filing ~BRIEF-Visa Inc files for three-part senior notes offering of up to $2.5 bln * Visa Inc says files for three-part senior notes offering of up to $2.5 billion - SEC filing‍​ ~Former BoE deputy Hogg to join Visa as Europe unit CEO Visa Inc, the world's largest payments processor, on Thursday named former Bank of England (BoE) deputy governor Charlotte Hogg as chief executive of its Europe division. ~CORRECTED-UPDATE 1-MOVES-Former BoE deputy Hogg to join Visa as Europe unit CEO Sept 7 Visa Inc, the world's largest payments processor, on Thursday named former Bank of England (BoE) deputy governor Charlotte Hogg as chief executive of its Europe division. ~MOVES-Visa names ex-BoE deputy Charlotte Hogg as Europe unit CEO Sept 7 Visa Inc, the world's largest payments processor, on Thursday named Charlotte Hogg as chief executive of its Europe division. ~BRIEF-Visa appoints Charlotte Hogg as CEO of European operations * Visa Inc appoints Charlotte Hogg as chief executive officer of the compan's European operations ~BRIEF-Visa Inc files prospectus supplement for potential three-part senior notes offering * Visa Inc files prospectus supplement for potential three-part senior notes offering; size not disclosed - sec filing‍​ Source text (http://bit.ly/2vLDrIe) Further company coverage: ~BRIEF-Visa enables on the go payments with the new Fitbit Ionic * Visa inc- ‍enabling visa payments on fitbit's smartwatch fitbit ionic​ ~BRIEF-Bridg raises $11 million in Series B funding * Bridg raises $11 million in Series B funding from Morpheus Ventures, March Capital, Visa and NextEquity ~
WFC,BRIEF-Wells Fargo names Kristi Mitchem president, CEO, head of Wells Fargo asset management * Kristi Mitchem has been appointed president, chief executive officer, and head of Wells Fargo asset management ~
YUM,China sovereign fund to seek majority control of Yum unit-Bloomberg April 18 China Investment Corp, China's state-owned sovereign wealth fund, is backing a group of investors who have expressed interest in buying a majority stake in Yum Brands Inc's China unit, Bloomberg reported, citing people with knowledge of the matter. ~BRIEF-China sovereign fund to seek control of $8 bln Yum unit - Bloomberg * China sovereign fund to seek control of $8 bln Yum unit - Bloomberg ~
