ABBV.N,AbbVie's hepatitis C treatment shows promise Nov 11 Drugmaker AbbVie Inc said on Friday its experimental fixed-dose combination to treat certain hepatitis C virus patients achieved high sustained viral response (SVR) rates after eight weeks of treatment. ~
AMZN.O,BRIEF-Amazon.com's UK website to launch Black Friday sale from Nov 14-Nov 25 * Amazon.co.uk  to launch the black Friday sale from 00:00 on Monday 14th November until 23:59 on Friday 25th November  Source text : http://bit.ly/2eOjd6p Further company coverage: ~
AAL.O,UPDATE 1-U.S. airlines say outage linked to tech glitch at Sabre resolved Nov 11 American Airlines Group Inc and Alaska Air Group Inc said on Friday an outage related to a technical issue at reservation services provider Sabre Corp's  computer systems has been resolved. ~U.S. airlines face brief computer outage Nov 11 American Airlines Group Inc and Alaska Air Group Inc on Friday experienced a brief computer outage caused due to a technical issue at reservation vendor Sabre Corp. ~BRIEF-American Airlines says Sabre technical issue that impacted multiple carriershas been resolved * American Airlines says earlier today, Sabre had brief technical issue that impacted multiple carriers, issue has been resolved- Spokesman  Further company coverage: ~
AAPL.O,Taiwan's Hon Hai falls in early trade TAIPEI, Nov 11 Shares in Taiwan's Hon Hai Precision Industry Co opened more than 2 percent lower on Friday, in line with broader market weakness. ~
BRKa.N,Berkshire sets record as Trump boosts prospects, Buffett's wealth Nov 11 Berkshire Hathaway Inc shares posted one of their best weeks in years, soaring 9.5 percent and touching a record high, even though Chairman Warren Buffett's choice for the White House, Hillary Clinton, was defeated by Donald Trump. ~Buffett breaks silence on Wells Fargo bogus account scandal Wells Fargo & Co made a "terrible mistake" by keeping in place sales goals that "corrupted people", billionaire investor Warren Buffett told CNN in an interview, in his first public comment on the bogus account scandal at the bank. ~Buffett breaks silence on Wells Fargo bogus account scandal Nov 11 Wells Fargo & Co made a "terrible mistake" by keeping in place sales goals that "corrupted people", billionaire investor Warren Buffett told CNN in an interview, in his first public comment on the bogus account scandal at the bank. ~
DUK,Duke Energy agrees to pay $27 million to settle 2012 CEO firing Duke Energy Corp has agreed to pay $27 million to settle a lawsuit over the power producer's abrupt firing of its newly installed chief executive in 2012. ~Duke Energy agrees to pay $27 mln to settle 2012 CEO firing Nov 11 Duke Energy Corp has agreed to pay $27 million to settle a lawsuit over the power producer's abrupt firing of its newly installed chief executive in 2012. ~BRIEF-Duke Energy plans to excavate 34 coal ash basins * Company plans to excavate 34 coal ash basins and "safely cap" another 18 basins across its fleet ~
FB.O,UPDATE 1-Facebook fixes glitch that turned profiles into memorial pages Nov 11 Facebook Inc said on Friday a glitch that changed profiles of several users, including that of Chief Executive Mark Zuckerberg, to memorial pages had been resolved. ~Twitter impresses advertisers with BuzzFeed U.S. election livestream Twitter Inc  said it was able to deliver more viewers than promised to advertisers on a U.S. election night livestream, good news for the microblogging site as it tries to ward off growing competition for ad dollars from Snapchat and Instagram. ~UPDATE 1-Twitter impresses advertisers with BuzzFeed U.S. election livestream Nov 11 Twitter Inc said it was able to deliver more viewers than promised to advertisers on a U.S. election night livestream, good news for the microblogging site as it tries to ward off growing competition for ad dollars from Snapchat and Instagram. ~Facebook to stop ethnicity-based targeting for some ads Facebook Inc said on Friday it would no longer allow certain advertisers to exclude racial or ethnic groups when placing ads on its service, following criticism that the practice was discriminatory. ~Facebook to stop ethnicity-based targeting for some ads Nov 11 Facebook Inc said on Friday it would stop advertisers from using its ethnicity-based ad-targeting feature on some ads, following criticism that advertisers could misuse the tool. ~Facebook to stop ethnicity-based targeting for some ads Nov 11 Facebook Inc said on Friday it would stop advertisers from using its ethnicity-based ad-targeting feature on some ads, following criticism that advertisers could misuse the tool. ~
NVDA.O,US STOCKS-Wall St rally sputters in Dow's best week since 2011 * Dow down 0.02 pct, S&P; down 0.34 pct, Nasdaq up 0.22 pct   (Updates to afternoon) ~Nvidia posts biggest quarterly revenue growth in six years; shares soar  (This Nov. 10, 2016 story was refiled to correct the quarter in paragraph 12 to "third" from "second") ~CORRECTED-UPDATE 2-Nvidia posts biggest qtrly revenue growth in 6 yrs; shares soar Nov 10 Nvidia Corp reported its biggest quarterly revenue growth in more than six years as demand soared for its gaming chips used in personal computers. ~
PFE,Pfizer offers cut-price pneumonia shot for humanitarian crises LONDON U.S. pharmaceuticals giant Pfizer is to offer its pneumococcal vaccine at the lowest possible price to non-governmental organizations seeking to protect vulnerable people from illness in humanitarian crises. ~Pfizer offers cut-price pneumonia shot for humanitarian crises LONDON, Nov 11 U.S. pharmaceuticals giant Pfizer  is to offer its pneumococcal vaccine at the lowest possible price to non-governmental organisations seeking to protect vulnerable people from illness in humanitarian crises. ~BRIEF-Pfizer announces major expansion of humanitarian assistance program * Pfizer announces major expansion of humanitarian assistance program ~
LUV,UPDATE 1-U.S. airlines say outage linked to tech glitch at Sabre resolved Nov 11 American Airlines Group Inc and Alaska Air Group Inc said on Friday an outage related to a technical issue at reservation services provider Sabre Corp's  computer systems has been resolved. ~
DIS,UPDATE 4-Disney promises earnings growth next two years, shares rise Nov 10 Walt Disney Co executives promised earnings growth for the next two years, easing investor concerns over a quarterly drop in ad sales and subscribers at its ESPN sports network, sending the media company's shares up in after-hours trading. ~
WFC,Buffett breaks silence on Wells Fargo bogus account scandal Nov 11 Wells Fargo & Co made a "terrible mistake" by keeping in place sales goals that "corrupted people", billionaire investor Warren Buffett told CNN in an interview, in his first public comment on the bogus account scandal at the bank. ~
