ALXN.O,UPDATE 1-UK cost agency queries value of $700,000-a-year Alexion drug LONDON, Feb 18 An enzyme treatment from Alexion Pharmaceuticals costing 491,992 pounds ($704,630) a year may be worth using in babies with a rare disorder but does not represent good value for all patients, Britain's healthcare cost watchdog said. ~UK cost agency queries value of $700,000-a-year Alexion drug LONDON, Feb 18 An enzyme treatment from Alexion Pharmaceuticals costing 491,992 pounds ($704,630) a year may be worth using in babies with a rare disorder but does not represent good value for all patients, Britain's healthcare cost watchdog said. ~
AMZN.O,Amazon.com to open new fulfillment center in UK LONDON Amazon.com said on Thursday it planned to open a new fulfillment center in Britain, creating 500 new jobs over three years, as the e-commerce company expands its European business. ~Amazon.com to open new fulfillment centre in UK LONDON, Feb 18 Amazon.com said on Thursday it planned to open a new fulfillment centre in Britain, creating 500 new jobs over three years, as the e-commerce company expands its European business. ~
AAPL.O,Republicans chide Apple over order on shooter's phone WASHINGTON Prominent Republicans criticized Apple Inc  on Wednesday for opposing a government request for help hacking into an iPhone belonging to one of the San Bernardino attackers, calling the issue tough but important to boosting national security. | Video  ~Apple CEO opposes court order to help FBI unlock iPhone Apple Inc  Chief Executive Tim Cook said his company opposed a demand from a U.S. judge to help the FBI break into an iPhone recovered from one of the San Bernardino shooters. | Video  ~
AMAT.O,UPDATE 2-Applied Materials sees China demand boosting growth Feb 18 Applied Materials Inc, the world's largest supplier of tools used to make semiconductor chips, forecast higher-than-expected profit and revenue for the current quarter, helped by rising demand in China. ~CORRECTED-Applied Materials current-quarter forecast beats estimates Feb 18 Applied Materials Inc, the world's largest maker of machinery used to make semiconductor chips, forecast a higher-than-expected profit for the current quarter, sending its shares up 7.3 percent. ~
BLK,Banks build ETF businesses as growth stalls in bond trading Feb 18 Wall Street banks are ramping up businesses that trade exchange-traded funds full of bonds, a bright spot of growth at an otherwise bleak time for trading but one that may carry unappreciated risk. ~
BA,UPDATE 1-Boeing engineers overwhelmingly back new labor contracts Feb 17 Boeing Co's engineers' union ratified six-year labor contracts by a wide margin on Wednesday, a vote that ensures stability during a period when the planemaker is bringing out new versions of its two most profitable jetliners, the 737 and the 777. ~Boeing engineers' union overwhelmingly backs new labor contracts Feb 18 Boeing Co's engineers' union ratified six-year labor contracts by a wide margin on Wednesday, a vote that ensures stability during a period when Boeing is bringing out new versions of its two most profitable jetliners. ~
CAT,Finning International swings to loss; to cut more jobs Feb 18 Canada's Finning International Inc , the world's biggest dealer of Caterpillar Inc  equipment, swung to a quarterly loss and said it would cut more jobs. ~
C,UPDATE 1-Citi raises CEO Corbat's pay by 27 pct in 2015 Feb 18 Citigroup Inc raised Chief Executive Michael Corbat's pay by an estimated 27 percent in 2015, a year in which the bank's profit more than doubled. ~Citi raises CEO Corbat's pay by 27 pct in 2015 Feb 18 Citigroup Inc raised Chief Executive Michael Corbat's pay by an estimated 27 percent in 2015, a year in which the bank's profit more than doubled. ~Citigroup plans to exit retail banking in Argentina, Brazil - Bloomberg Citigroup Inc  plans to exit retail banking in Argentina and Brazil, Bloomberg reported, citing a person familiar with the matter. ~UPDATE 1-Citigroup plans to exit retail banking in Argentina, Brazil - Bbg Feb 18 Citigroup Inc plans to exit retail banking in Argentina and Brazil, Bloomberg reported, citing a person familiar with the matter. ~Citigroup plans to exit retail banking in Argentina, Brazil-Bloomberg Feb 18 Citigroup Inc plans to exit retail banking in Argentina and Brazil, Bloomberg reported, citing a person familiar with the matter. ~
DVN,UPDATE 1-Devon stock sale surprises Wall Street after CEO downplays need HOUSTON, Feb 18 It was a head fake that left Wall Street scratching its head. ~Devon Energy's upsized stock sale points to strong investor appetite Devon Energy Corp's  upsized $1.5 billion public share offering - the latest in a series of stock sales by U.S. oil producers - shows that companies with high quality assets and low debt are still able to attract investors. ~
DOW,BRIEF-Downer EDI says offer for Spotless Group now closed * Confirms that its offer for Spotless was not extended and has now closed. Source text for Eikon: Further company coverage: ~BRIEF-Downer EDI posts FY net profit of $181.5 million * FY total revenue and other income from ordinary activities $7.29 billion , up 6.4 percent ~BRIEF-Downer EDI says ‍offer for Spotless Group extended to 28 August 2017​ * ‍Offer for Spotless Group extended to 7pm on Monday, 28 august 2017​ Source text for Eikon: Further company coverage: ~BRIEF-Downer EDI says Spotless ‍offer extended to Aug 21, 2017​ * Spotless ‍offer extended to 7pm on monday, 21 august 2017​ Source text for Eikon: Further company coverage: ~BRIEF-Downer EDI's takeover offer for Spotless Group extended till 7pm (Sydney time) on Aug. 14 * Unconditional takeover offer for Spotless Group extended until 7:00pm (Sydney time) on Monday, 14 August Source text for Eikon: Further company coverage: (bangalore.newsroom@thomsonreuters.com) ~BRIEF-Downer extends takeover offer for Spotless Group * decided to extend Spotless offer period for one week; offer will now remain open for acceptance until 14 august Source text for Eikon: Further company coverage: ~BRIEF-Downer extends Spotless offer to August 7 2017 * ‍Downer has decided to extend offer for Spotless Group holdings to 7 pm on Monday, 7 august 2017​ Source text for Eikon: Further company coverage: ~BRIEF-Downer EDI's stake in Spotless increases to 80.3 pct * Downer's stake in Spotless increases to 80.3 pct Source text for Eikon: Further company coverage: ~BRIEF- Downer EDI Ltd'S stake in Spotless Group increases to 72% * As Downer's shareholding in Spotless is now over 70%, Downer expects that Spotless will be removed from certain S&P;/ASX market indices ~
DUK,UPDATE 2-Duke Energy profit misses, hurt by warm winter * Sees 2016 earnings/shr $4.50-$4.70 vs est $4.66   (Adds CEO comments, details) ~
F,UPDATE 2-Geely's Volvo upbeat on 2016 after sales and profit rise * Sees growth in all top auto markets in 2016   (Adds CEO, analyst, background) ~
GM,Fitch Rates General Motors' Proposed Notes 'BBB-' (The following statement was released by the rating agency) CHICAGO, February 18 (Fitch) Fitch Ratings has assigned a rating of 'BBB-' to  General Motors Company's (GM) proposed issuance of $2 billion in senior  unsecured notes. The Issuer Default Rating (IDR) for GM is 'BBB-' and its Rating  Outlook is Stable. A full list of the ratings of GM and its subsidiaries is included at the end of  this release. The proposed notes will be issued in two series: approximately $1 billion due in  2036 and a ~
IBM,IBM to acquire Truven Health Analytics for $2.6 billion International Business Machines Corp  said on Thursday it plans to acquire Truven Health Analytics, a provider of healthcare data and analytics, for $2.6 billion, marking its fourth major health data-related deal in the past year. ~BRIEF-IBM Watson Health to acquire Truven Health Analytics for $2.6 bln * IBM Watson Health says plans to acquire Truven Health Analytics for $2.6 billion  Source text for Eikon:  Further company coverage: ~IBM to buy data company Truven Health Analytics for $2.6 bln Feb 18 International Business Machines Corp  said it would buy Truven Health Analytics, a provider of cloud-based healthcare data, for $2.6 billion, the company's fourth major health-related acquisition since launching the Watson Health unit in April last year. ~IBM to acquire Truven Health Analytics for $2.6 billion Feb 18 International Business Machines Corp  said on Thursday it plans to acquire Truven Health Analytics, a provider of healthcare data and analytics, for $2.6 billion, marking its fourth major health data-related deal in the past year. ~
MAR.O,Marriott revenue rises 4 percent Hotel chain Marriott International Inc  reported a 4 percent rise in quarterly revenue, boosted by higher room rates in North America. ~
PG,P&G; needs to be more agile, says new CEO Taylor Feb 18 Procter & Gamble Co needs to be more nimble in its decision-making, Chief Executive David Taylor said in his first interaction with analysts after taking the helm in November. ~
V,BRIEF-Visa calls for redemption all of its 1.200 pct notes due 2017 * Visa Inc - on Sept 11, co called for redemption all of $1.75 billion principal amount outstanding of its 1.200 pct notes due 2017‍​ - SEC filing ~BRIEF-Visa Inc files for three-part senior notes offering of up to $2.5 bln * Visa Inc says files for three-part senior notes offering of up to $2.5 billion - SEC filing‍​ ~Former BoE deputy Hogg to join Visa as Europe unit CEO Visa Inc, the world's largest payments processor, on Thursday named former Bank of England (BoE) deputy governor Charlotte Hogg as chief executive of its Europe division. ~CORRECTED-UPDATE 1-MOVES-Former BoE deputy Hogg to join Visa as Europe unit CEO Sept 7 Visa Inc, the world's largest payments processor, on Thursday named former Bank of England (BoE) deputy governor Charlotte Hogg as chief executive of its Europe division. ~MOVES-Visa names ex-BoE deputy Charlotte Hogg as Europe unit CEO Sept 7 Visa Inc, the world's largest payments processor, on Thursday named Charlotte Hogg as chief executive of its Europe division. ~BRIEF-Visa appoints Charlotte Hogg as CEO of European operations * Visa Inc appoints Charlotte Hogg as chief executive officer of the compan's European operations ~BRIEF-Visa Inc files prospectus supplement for potential three-part senior notes offering * Visa Inc files prospectus supplement for potential three-part senior notes offering; size not disclosed - sec filing‍​ Source text (http://bit.ly/2vLDrIe) Further company coverage: ~BRIEF-Visa enables on the go payments with the new Fitbit Ionic * Visa inc- ‍enabling visa payments on fitbit's smartwatch fitbit ionic​ ~BRIEF-Bridg raises $11 million in Series B funding * Bridg raises $11 million in Series B funding from Morpheus Ventures, March Capital, Visa and NextEquity ~
WMT,UPDATE 4-Wal-Mart forecasts tepid sales growth; stock slides Feb 18 Wal-Mart Stores Inc on Thursday reported a lower quarterly profit and gave a lackluster sales outlook as declining prices for grocery products and sluggish apparel demand took a toll, and its shares fell more than 3 percent. ~CORRECTED-Wal-Mart quarterly earnings fall; U.S. sales edge up Feb 18 Wal-Mart Stores Inc on Thursday reported a decline in quarterly earnings as it booked a modest increase in sales at existing stores. ~British supermarket Asda Q4 sales deteriorate further LONDON, Feb 18 Supermarket chain Asda, the British arm of Wal-Mart, reported a 5.8 percent decline in underlying sales on Thursday in a further deterioration of its performance as it continues to lose shoppers to German discounters Aldi and Lidl. ~Wal-Mart aims to improve scheduling for U.S. workers Wal-Mart Stores  said on Wednesday it would start offering fixed shifts and unveiled other details of planned scheduling changes aimed at retaining and motivating its rank-and-file workers. ~
