AA,Alcoa gets $470 million aluminum contract from Embraer aircraft U.S. metal company Alcoa Inc has won a long-term $470 million contract to provide aluminum sheet and plate for Brazilian aircraft maker Embraer SA's E2 model, which is scheduled to enter service in 2018, they said on Thursday. ~BRIEF-Alcoa awarded multi-year, $470 mln contract with Embraer * Alcoa awarded multi-year, $470 million contract with Embraer ~Alcoa gets $470 million aluminum contract from Embraer aircraft June 30 U.S. metal company Alcoa Inc has won a long-term $470 million contract to provide aluminum sheet and plate for Brazilian aircraft maker Embraer SA's  E2 model, which is scheduled to enter service in 2018, they said on Thursday. ~
AMZN.O,Visa, MasterCard $7.25 billion settlement with retailers is thrown out NEW YORK A federal appeals court on Thursday threw out a $7.25 billion (5.48 billion pounds) antitrust settlement reached by Visa Inc  and MasterCard Inc  with millions of retailers that accused the card networks of improperly fixing credit and debit card fees. ~Visa, MasterCard $7.25 bln settlement with retailers is thrown out NEW YORK A federal appeals court on Thursday threw out a $7.25 billion antitrust settlement reached by Visa Inc and MasterCard Inc with millions of retailers that accused the card networks of improperly fixing credit and debit card fees. ~UPDATE 5-Visa, MasterCard $7.25 bln settlement with retailers is thrown out NEW YORK, June 30 A federal appeals court on Thursday threw out a $7.25 billion antitrust settlement reached by Visa Inc and MasterCard Inc with millions of retailers that accused the card networks of improperly fixing credit and debit card fees. ~
AAPL.O,BRIEF-Nike appoints Tim Cook as lead independent director of Board * Nike, Inc. And Phil Knight complete planned chairman succession ~
CVX,UPDATE 1-Strategic Fuel Fund's bid for Chevron South Africa assets faces probe JOHANNESBURG, June 30 South Africa's state-owned Strategic Fuel Fund (SFF) will face an investigation by its shareholder for making a bid to buy Chevron's local assets without seeking clearance, a government official said on Thursday. ~Strategic Fuel Fund's bid for Chevron assets not approved - S.Africa govt JOHANNESBURG, June 30 South Africa's energy department said on Thursday the state-owned Strategic Fuel Fund's (SFF) had not been cleared to make an offer to buy 75 percent of Chevron's refinery and other downstream assets. ~BRIEF-S.Africa's energy department to investigate SFF's offer for Chevron assets * Notes with concern concern the reports regarding the SFF's expression of interest in the Chevron assets ~UPDATE 2-South Africa's Strategic Fuel Fund bids for Chevron refinery JOHANNESBURG, June 29 South Africa's state-owned Strategic Fuel Fund (SFF) said on Wednesday it had offered to buy Chevron's majority stake in the country's oil refinery in Cape Town and other downstream assets as well as those in neighbouring countries. ~
CAG,UPDATE 3-ConAgra reports lower quarterly sales and earnings June 30 ConAgra Foods Inc on Thursday reported a 9.5 percent drop in quarterly net sales, missing analysts' estimates as demand weakened for its consumer foods, which include Chef Boyardee pasta and Hunt's ketchup. ~BRIEF-ConAgra Foods Q4 loss per share $0.07 from cont ops * Qtrly consumer foods segment posted sales of approximately $1.7 billion, down 12 percent ~ConAgra quarterly sales drop 9.5 pct, miss analyst estimate June 30 ConAgra Foods Inc quarterly net sales fell 9.5 percent, missing analysts' estimates, as demand weakened for its consumer foods, which include Chef Boyardee pasta and Hunt's ketchup. ~
STZ,Memorial Day beer sales drive Constellation's results Constellation Brands Inc  reported a bigger-than-expected 15 percent jump in quarterly net sales, helped by higher demand for its Corona and Modelo beers during the Memorial Day weekend. ~UPDATE 1-Memorial Day beer sales drive Constellation's results June 30 Constellation Brands Inc  reported a bigger-than-expected 15 percent jump in quarterly net sales, helped by higher demand for its Corona and Modelo beers during the Memorial Day weekend. ~Constellation Brands net sales jump 15 pct June 30 Constellation Brands Inc  reported a 15 percent jump in quarterly net sales, helped by higher demand for its Corona and Modelo beer brands during the Memorial Day weekend, the second largest beer sales period in the United States. ~
COST.O,Visa, MasterCard $7.25 billion settlement with retailers is thrown out NEW YORK A federal appeals court on Thursday threw out a $7.25 billion (5.48 billion pounds) antitrust settlement reached by Visa Inc  and MasterCard Inc  with millions of retailers that accused the card networks of improperly fixing credit and debit card fees. ~Visa, MasterCard $7.25 bln settlement with retailers is thrown out NEW YORK A federal appeals court on Thursday threw out a $7.25 billion antitrust settlement reached by Visa Inc and MasterCard Inc with millions of retailers that accused the card networks of improperly fixing credit and debit card fees. ~UPDATE 5-Visa, MasterCard $7.25 bln settlement with retailers is thrown out NEW YORK, June 30 A federal appeals court on Thursday threw out a $7.25 billion antitrust settlement reached by Visa Inc and MasterCard Inc with millions of retailers that accused the card networks of improperly fixing credit and debit card fees. ~
DRI,UPDATE 2-Darden Restaurants quarterly sales disappoint, shares slide June 30 Darden Restaurants Inc reported lower-than-expected quarterly sales as fewer customers visited its flagship Olive Garden restaurants, and shares tumbled as much as 5 percent. ~Olive Garden owner Darden's sales miss estimates June 30 Darden Restaurants Inc reported lower-than-expected quarterly sales as fewer customers visited its Olive Garden restaurants. ~
XOM,InterOil gets unsolicited takeover offer from unnamed bidder InterOil Corp , which agreed last month to be acquired by Australia's Oil Search Ltd , said it received an unsolicited offer from an unnamed bidder, with whom it would engage in further talks. ~U.S. Virgin Islands to withdraw subpoena in climate probe into Exxon HOUSTON The U.S. Virgin Islands' attorney general on Wednesday agreed to withdraw a sweeping subpoena issued against Exxon Mobil Corp as part of a push by a coalition of state prosecutors to try to investigate whether the world's largest publicly traded oil company misled the public about climate change risks. ~
F,Alcoa gets $470 million aluminum contract from Embraer aircraft June 30 U.S. metal company Alcoa Inc has won a long-term $470 million contract to provide aluminum sheet and plate for Brazilian aircraft maker Embraer SA's  E2 model, which is scheduled to enter service in 2018, they said on Thursday. ~
GD,General Dynamics wins $640 million Pentagon contract WASHINGTON, June 30 General Dynamics Corp's  National Steel and Shipbuilding Co division is being awarded a $640 million contract for the detail design and construction of a T-AO 205 Class Fleet Replenishment Oiler, the Pentagon said on Thursday. ~
GE,General Electric wins $919 million Pentagon contract WASHINGTON, June 30 General Electric Co's  GE Aviation unit has been awarded a $919 million cost-plus-incentive-fee contract for designing, fabricating, integrating and testing turbofan adaptive engines, the Pentagon said on Thursday. ~
GM,CORRECTED-GM economist:no Brexit impact to US auto market now; more UK car production possible DETROIT, June 29 It is too soon to measure the impact of the British vote to leave the EU on General Motors Co  but the decision will likely not have much effect on the company in its home market, GM's chief economist said on Wednesday. ~
GS,Goldman exec tells Libya fund trial that offering prostitutes 'unacceptable' LONDON, June 30 A Goldman Sachs executive's alleged arranging of prostitutes for himself and the brother of a decision-maker at Libya's sovereign wealth fund was completely unacceptable behaviour for an employee of the bank, the first witness called by Goldman told a court on Thursday. ~Exclusive: Credit Suisse plans on raising stake in Chinese joint venture - sources HONG KONG Credit Suisse is planning to boost its stake in its Chinese securities joint venture to the maximum permissible 49 percent, which would make it the first foreign bank to take advantage of relaxed Chinese investment rules introduced four years ago, three people with direct knowledge of the matter said. | Video  ~Global banks sink in AsiaPac first-half ECM rankings; fees down 33 percent HONG KONG Global investment banks tumbled in league table rankings for equity capital market (ECM) deals in Asia Pacific in the first half of 2016, as share offerings outside China that they typically rely on dried up, preliminary Thomson Reuters data showed. ~
HPQ,BRIEF-AP-HP and IntegraGen agree to research partnership * Announced on Wednesday that Greater Paris University Hospitals, AP-HP and IntegraGen agree to a research partnership to develop a common platform for high-throughput sequencing ~
JNJ,Fitch Affirms Johnson & Johnson's IDR at 'AAA'; Outlook Stable (The following statement was released by the rating agency) CHICAGO, June 30 (Fitch) Fitch Ratings has affirmed Johnson & Johnson's (JNJ)  Issuer Default Rating at 'AAA'. The Rating Outlook is Stable. A complete list of  Fitch's rating actions follow at the end of this press release. KEY RATING DRIVERS The company's 'AAA' rating reflects the following: --Potential biosimilar competition for Remicade in the U.S. in  late-2016/early-2017 and adverse foreign exchange movement will weigh on  revenue ~
MA,Visa, MasterCard $7.25 billion settlement with retailers is thrown out NEW YORK A federal appeals court on Thursday threw out a $7.25 billion antitrust settlement reached by Visa Inc  and MasterCard Inc  with millions of retailers that accused the card networks of improperly fixing credit and debit card fees. ~Visa, MasterCard $7.25 billion settlement with retailers is thrown out NEW YORK A federal appeals court on Thursday threw out a $7.25 billion (5.48 billion pounds) antitrust settlement reached by Visa Inc  and MasterCard Inc  with millions of retailers that accused the card networks of improperly fixing credit and debit card fees. ~Visa, MasterCard antitrust settlement with merchants is voided NEW YORK, June 30 A federal appeals court on Thursday threw out a $7.25 billion antitrust settlement among Visa Inc, MasterCard Inc and millions of retailers over credit card fees. ~
MDT,NuVasive settles spinal surgery patent fight with Medtronic Medical device maker NuVasive Inc will pay rival Medtronic Plc $45 million to settle a longstanding patent fight related to spinal surgery technology, NuVasive said on Thursday. ~UPDATE 1-NuVasive settles spinal surgery patent fight with Medtronic June 30 Medical device maker NuVasive Inc  will pay rival Medtronic Plc $45 million to settle a longstanding patent fight related to spinal surgery technology, NuVasive said on Thursday. ~BRIEF-Nuvasive agrees to settle patent litigation with Medtronic * Nuvasive and Medtronic reached agreement on terms for settlement of previously disclosed patent infringement lawsuits ~
MRK,3rd Circuit to weigh Fosamax warning lawsuits against Merck Lawyers for longtime users of an osteoporosis drug will ask a federal appeals court on Thursday to revive their claims that Merck & Co., Inc. waited too long to warn of the risk of unusual leg fractures associated with its use. ~
MU.O,UPDATE 3-Chipmaker Micron to cut jobs after turnaround plans dashed * Shares drop 7.6 pct in extended trading   (Adds analyst comment, job cut details, updates shares) ~BRIEF-Micron Technology sees Q4 non-gaap revenue of $2.9 bln-$3.2 bln * Q4 earnings per share view $0.03, revenue view $3.20 billion -- Thomson Reuters I/B/E/S  Source text for Eikon: (http://bit.ly/29exHL0) Further company coverage:    (Bengaluru Newsroom: +1-646-223-8780) ~BRIEF-Micron Technology Q3 non-gaap loss per share $0.08 * Plans to implement a cost savings program in which it expects to save approximately $80 million per quarter in fiscal 2017 ~Chipmaker Micron to cut jobs, reports drop in Q3 sales June 30 Memory-chip maker Micron Technology Inc  said it would implement a restructuring plan to lower costs by focusing on fewer projects, job cuts and other measures. ~
TAP,UPDATE 1-Brexit fuels worries about expected U.S. earnings recovery NEW YORK/SAN FRANCISCO, June 30 Foreign exchange volatility and economic uncertainty after Britain's vote to leave the European Union have imperiled a projected profit rebound in the United States, where companies have been stuck in an earnings recession since last year. ~Brexit fuels worries about expected U.S. earnings recovery NEW YORK/SAN FRANCISCO, June 30 Foreign exchange volatility and economic uncertainty after Britain's vote to leave the European Union have imperiled a projected profit rebound in the United States, where companies have been stuck in an earnings recession since last year. ~
MDLZ.O,BRIEF-Mondelez bid $107 per share for Hershey in cash plus stock offer - CNBC * Mondelez bid $107 per share for Hershey in cash plus stock offer - CNBC, citing sources    (Bengaluru Newsroom: +1 646 223 8780) ~Mondelez makes takeover bid for Hershey-WSJ June 30 Mondelez International Inc, the maker of Oreo cookies and Cadbury chocolates, has made a takeover bid for Hershey Co, the Wall Street Journal reported. (http://on.wsj.com/297J3lL) ~
MON,German stocks - Factors to watch on June 30 BERLIN, June 30 The DAX top-30 index  looked set to open 0.3 percent lower on Thursday, according to premarket data from brokerage Lang & Schwarz at 0639 GMT. ~
NKE,RPT-INSIGHT-Under Armour leads Olympic marketing shake-up after "rule 40" changes June 29 Against a backdrop of the iconic five rings, legendary swimmer Michael Phelps sat on a United States Olympic Committee stage at a March media event in Los Angeles, telling reporters why he had arrived fashionably late. ~
ORCL.N,US high-grade bounces back quickly after Brexit NEW YORK, June 30 (IFR) - The US high-grade market roared back to life this week with big deals from Molson Coors and Oracle that got a warm welcome from investors clamoring for paper after a bit of a drought. ~
QCOM.O,Qualcomm files 17 new complaints in China courts against smartphone maker Meizu SHANGHAI Qualcomm Inc has filed 17 fresh complaints in China against Meizu Technology Co, stepping up its battle with the Chinese smartphone maker after the two were unable to reach a licensing accord in the U.S. tech giant's biggest market. ~Qualcomm files 17 new complaints in China courts against smartphone maker Meizu SHANGHAI, June 30 Qualcomm Inc has filed 17 fresh complaints in China against Meizu Technology Co, stepping up its battle with the Chinese smartphone maker after the two were unable to reach a licensing accord in the U.S. tech giant's biggest market. ~
SBUX.O,Starbucks accused of slashing employee work hours amid cost cuts LOS ANGELES An online petition accusing Starbucks Corp of "extreme" cutbacks in work hours at its U.S. cafes, hurting both employee morale and customer service, has been signed by more than 9,000 people. ~UPDATE 1-Starbucks accused of slashing employee work hours amid cost cuts LOS ANGELES, June 30 An online petition accusing Starbucks Corp of "extreme" cutbacks in work hours at its U.S. cafes, hurting both employee morale and customer service, has been signed by more than 9,000 people. ~Starbucks workers petition for more hours amid labor cuts LOS ANGELES, June 30 Nearly 9,000 Starbucks Corp  workers and supporters have signed an online petition saying that the company has made "extreme labor cuts" at U.S. cafes, hurting employee morale as well as customer service. ~
BK,Bank of NY Mellon settles $312 million claim tied to Sentinel fraud Bank of New York Mellon Corp has agreed to end eight years of litigation in which it sought unsuccessfully to recoup $312 million it lent a Chicago-area money manager that collapsed in 2007, and whose former chief is now in prison for fraud. ~Bank of NY Mellon settles $312 mln claim tied to Sentinel fraud June 30 Bank of New York Mellon Corp has agreed to end eight years of litigation in which it sought unsuccessfully to recoup $312 million it lent a Chicago-area money manager that collapsed in 2007, and whose former chief is now in prison for fraud. ~
HSY,BRIEF-Hershey rejects Mondelez takeover proposal - CNBC, citing DJ June 30 Hershey Rejects Mondelez Takeover Proposal ~BRIEF-Mondelez bid $107 per share for Hershey in cash plus stock offer - CNBC * Mondelez bid $107 per share for Hershey in cash plus stock offer - CNBC, citing sources    (Bengaluru Newsroom: +1 646 223 8780) ~BRIEF-Mondelez pledging to protect jobs following merger, rename company Hershey- WSJ * Mondelez is pledging to protect jobs following merger, locate its global chocolate headquarters in Hershey, Pa, rename company Hershey - WSJ  Source text : (http://on.wsj.com/29fPnYo)   (Bengaluru Newsroom: +1 646 223 8780) ~Mondelez makes takeover bid for Hershey-WSJ June 30 Mondelez International Inc, the maker of Oreo cookies and Cadbury chocolates, has made a takeover bid for Hershey Co, the Wall Street Journal reported. (http://on.wsj.com/297J3lL) ~BRIEF-Mondelez has made takeover bid for Hershey- CNBC, citing DJ * Mondelez has made takeover bid for Hershey- CNBC, citing DJ    (Bengaluru Newsroom) ~
FOXA.O,BRIEF-News Corp, Wireless agree on terms of cash offer * Offer values entire existing issued and to be issued share capital of Wireless at approximately £220.3 million ~News Corp offers to buy UK's Wireless Group for about $296 mln June 30 News Corp has agreed to buy London-listed broadcaster Wireless Group in a 220.3 million pound ($296 million) deal, which will give the U.S. media company access to the UK and Ireland radio markets. ~
FOX.O,BRIEF-News Corp, Wireless agree on terms of cash offer * Offer values entire existing issued and to be issued share capital of Wireless at approximately £220.3 million ~News Corp offers to buy UK's Wireless Group for about $296 mln June 30 News Corp has agreed to buy London-listed broadcaster Wireless Group in a 220.3 million pound ($296 million) deal, which will give the U.S. media company access to the UK and Ireland radio markets. ~
UPS,UPS reaches tentative five-year deal with pilots union ATLANTA United Parcel Service Inc  has reached a tentative five-year agreement with its pilots' union after nearly five years of talks, the world's largest package delivery company said on Thursday. ~UPS reaches tentative five-year deal with pilots union ATLANTA, June 30 United Parcel Service Inc  has reached a tentative five-year agreement with its pilots' union after nearly five years of talks, the world's largest package delivery company said on Thursday. ~BRIEF-Independent Pilots Association announces tentative agreement on 5-yr labor contract with UPS * UPS, pilots reach tentative agreement on new labor contract ~
UTX,United Technologies unit wins $873 mln U.S. defense contract -Pentagon WASHINGTON, June 30 United Technologies Corp  unit Pratt and Whitney has been awarded an $873.17 million cost-plus-incentive-fee contract to design, make, integrate and test turbofan adaptive aircraft engines, the Pentagon said on Thursday.   (Reporting by Eric Walsh; Editing by Eric Beech) ~
V,Visa, MasterCard $7.25 billion settlement with retailers is thrown out NEW YORK A federal appeals court on Thursday threw out a $7.25 billion (5.48 billion pounds) antitrust settlement reached by Visa Inc  and MasterCard Inc  with millions of retailers that accused the card networks of improperly fixing credit and debit card fees. ~Visa, MasterCard $7.25 bln settlement with retailers is thrown out NEW YORK A federal appeals court on Thursday threw out a $7.25 billion antitrust settlement reached by Visa Inc and MasterCard Inc with millions of retailers that accused the card networks of improperly fixing credit and debit card fees. ~UPDATE 5-Visa, MasterCard $7.25 bln settlement with retailers is thrown out NEW YORK, June 30 A federal appeals court on Thursday threw out a $7.25 billion antitrust settlement reached by Visa Inc and MasterCard Inc with millions of retailers that accused the card networks of improperly fixing credit and debit card fees. ~
