CVX,OMV agrees to sell 30 pct stake in British Rosebank field to Suncor VIENNA, Aug 9 Austrian energy group OMV  has agreed to sell most of its 50 percent stake in the British Rosebank field to Canada's Suncor Energy for as much as $215 million, OMV said on Tuesday. ~
COH,UPDATE 2-Coach sales miss as it tightens supply to department stores * Shares down 2 pct premarket   (Adds details; updates shares) ~BRIEF-Coach Inc Q4 EPS $0.29 * Q4 earnings per share view $0.41 -- Thomson Reuters I/B/E/S ~Handbag maker Coach's North America comparable sales rise 2 pct Aug 9 Coach Inc's quarterly sales rose 2 percent at North America stores open at least a year, the first rise in over three years, as the handbag maker offered fewer promotions. ~
EQT,UPDATE 2-EQT to buy patient satisfaction survey provider Press Ganey NEW YORK, Aug 9 Press Ganey Holdings Inc , a provider of patient satisfaction surveys to healthcare firms, said on Tuesday it agreed to be bought by Swedish private equity group EQT in a deal valued at about $2.35 billion. ~Deals of the day- Mergers and acquisitions Aug 9 The following bids, mergers, acquisitions and disposals were reported by 1300 GMT on Tuesday: ~PE firm EQT to buy Press Ganey in $2.35 bln deal Aug 9 Press Ganey Holdings Inc, a provider of patient satisfaction surveys to healthcare firms, said on Tuesday it had agreed to be acquired by private equity group EQT in a deal valued at about $2.35 billion. ~BRIEF-Press Ganey agrees to be acquired by EQT * Press Ganey enters into definitive agreement to be acquired by EQT ~
EXC,BRIEF-Exelon posts Q2 GAAP earnings per share of $0.29 * Q2 earnings per share view $0.56 -- Thomson Reuters I/B/E/S ~
FCX,UPDATE 2-Indonesian ministry recommends renewing Freeport export permit JAKARTA, Aug 9 Indonesia's mining ministry recommended on Tuesday that Freeport-McMoran Inc's  Indonesian unit be granted a new permit to export copper concentrates until Jan. 11, 2017, an official said. ~Freeport hopes will soon get Indonesia copper export extension JAKARTA, Aug 9 Freeport-McMoRan Inc has not yet received an extension to its Indonesian copper export permit, which expired on Monday, but hopes the government will issue one soon, a company spokesman said on Tuesday. ~
GPS,CORRECTED-Gap shares slump as July sales disappoint, but analysts upbeat Aug 9 Shares of apparel retailer Gap Inc  fell more than 7 percent in early trading on Tuesday, a day after the company reported a drop in sales for July, but analysts were largely positive about the company's prospects. ~Gap shares slump as July sales disappoint, but analysts upbeat Shares of apparel retailer Gap Inc  fell more than 7 percent in early trading on Tuesday, a day after the company reported a drop in sales for July, but analysts were largely positive about the company's prospects. ~U.S. RESEARCH ROUNDUP-Microchip Technology, Gap, Hornbeck Offshore Aug 9 Wall Street securities analysts revised their ratings and price targets on several U.S. companies, including Bojangles and WebMD Health, on Tuesday.           HIGHLIGHTS      * Gap Inc        : Deutsche Bank, SunTrust Robinson raise target price on the stock      * Hornbeck Offshore        : Barclays cuts target price to $8 from $10; equal weight      * Bojangles Inc         : Jefferies, Piper Jaffray cut target price on stock      * Microchip Technology Inc         : Credit Su ~
INTC.O,Intel to buy artificial intelligence firm Nervana Systems Aug 9 Intel Corp said on Tuesday it would acquire startup Nervana Systems as the world's largest chipmaker bolsters its artificial intelligence capabilities. ~BRIEF-Intel says to buy Nervana Systems * Signed definitive agreement to acquire Nervana Systems to add to Intel's artificial intelligence portfolio  Source text : http://intel.ly/2bhcVZR Further company coverage: ~
KIM,Fitch Rates Kimco's Senior Unsecured Bonds due 2026 'BBB+' (The following statement was released by the rating agency) NEW YORK, August 09 (Fitch) Fitch Ratings has assigned a 'BBB+' rating to the  senior unsecured notes due 2026 issued by Kimco Realty Corporation (NYSE: KIM).  Net proceeds are expected to be used for the redemption of the $290.9 million  aggregate principal amount of outstanding 5.70% senior notes due May 1, 2017  (the 2017 notes), with the remainder, if any, to be used for general corporate  purposes. A full list of Fitch's current ra ~BRIEF-Kimco Realty files for potential notes offering * Files for potential notes offering; size not disclosed - SEC filing  Source text for Eikon:  Further company coverage: ~
PPL,BRIEF-PPL Corp reports Q2 GAAP earnings per share $0.71 * Q2 earnings per share view $0.53 -- Thomson Reuters I/B/E/S ~
SPGI.N,Several U.S. states unprepared for a recession -S&P; NEW YORK, Aug 9 Several U.S. states studied by S&P; Global Ratings are ill-equipped to deal with an economic recession, hampered by the slow rebound in U.S. economic growth after the damage wrought by the Great Recession. ~
DIS,UPDATE 4-Disney beats estimates, buys video streaming stake to lure web viewers Aug 9 Walt Disney Co's quarterly profit and revenue on Tuesday beat analysts' estimates fueled by movie studio hits, and the media company said it was taking a stake in a streaming video technology company to sell more content directly to consumers. ~BRIEF-The Walt Disney Co Q3 earnings per share $1.62 excluding items * The walt disney company reports third quarter and nine months earnings for fiscal 2016 ~BRIEF-The Walt Disney Company acquires minority stake in Bamtech * Under terms of transaction, disney will pay $1 billion in two installments ~Disney revenue jumps 9 pct Aug 9 Walt Disney Co reported a 9 percent rise in quarterly revenue, fueled by the box-office success of "The Jungle Book". ~
YUM,Shareholders press Yum for stricter antibiotics policy LOS ANGELES Yum Brands Inc  investors on Tuesday filed a shareholder proposal requesting that it quickly phase out harmful antibiotic use in its meat supply, taking aim at the practices of the company's KFC fried chicken chain. ~Shareholders press Yum for stricter antibiotics policy LOS ANGELES, Aug 9 Yum Brands Inc  investors on Tuesday filed a shareholder proposal requesting that it quickly phase out harmful antibiotic use in its meat supply, taking aim at the practices of the company's KFC fried chicken chain. ~
