AMGN.O,UPDATE 2-Amgen beats Sanofi, Regeneron at cholesterol drug trial March 16 A federal jury upheld the validity of two Amgen Inc patents related to the company's newly-approved drug to reduce bad cholesterol, in a defeat for Sanofi SA and Regeneron Pharmaceuticals Inc, which make a rival drug. ~
AAPL.O,German court rules against Apple in video streaming patent case March 16 A German court has ruled against Apple Inc in a case over video streaming patents, handing Kudelski's OpenTV unit a victory in its ongoing intellectual property licensing campaign against major technology companies. ~EU regulators want more info on Apple's Irish tax deal BRUSSELS/DUBLIN - European Union antitrust regulators have asked Ireland to provide further details on the country's tax deal with Apple before deciding whether this constitutes illegal state aid to the iPhone maker. ~EU regulators want more info on Apple's Irish tax deal BRUSSELS/DUBLIN, March 16 - European Union antitrust regulators have asked Ireland to provide further details on the country's tax deal with Apple before deciding whether this constitutes illegal state aid to the iPhone maker. ~Apple: U.S. founders would be 'appalled' by DOJ iPhone request SAN FRANCISCO/WASHINGTON The U.S. founding fathers "would be appalled" by a Department of Justice request to unlock an encrypted iPhone, Apple Inc  said on Tuesday in its final brief before a court showdown next week. | Video  ~UPDATE 1-Japan Display to shut 2 Japan LCD lines, take $123 mln charge * Aims to start OLED production from 2018   (Adds background on Apple and Sharp) ~Taiwan stocks rise; Apple suppliers up March 16 Taiwan stocks rose on Wednesday, cheered by gains in Apple Inc's  suppliers following the iPhone maker's strong rise on Wall Street overnight. ~
BLK,BlackRock's Obsidian fund extends losses this year March 16 BlackRock Inc's $1.9 billion Obsidian hedge fund posted a negative 7.5 percent year-to-date return through March 4, HSBC data showed. ~
BA,Lockheed says U.S. bomber win appears based solely on cost WASHINGTON, March 15 Northrop Grumman Corp's  bid to build a new U.S. bomber appears to have won the multibillion-dollar competition solely on the basis of cost, said a top executive with Lockheed Martin Corp, whose team led by Boeing Co lost the bidding. ~
CBS,Viacom looks to name lead independent director to board Viacom Inc is looking to name a lead independent director, most likely one of its existing board members, and could make an announcement within the next few days, two sources familiar with the situation told Reuters, as the media company faces investor questions about its corporate governance. ~
CMG,UPDATE 1-Chipotle mulls more food giveaways as customers slowly return March 16 Chipotle Mexican Grill Inc  could give away roughly 9 million burritos as it fights to win back customers following several food safety mishaps that have dented its sales. ~Chipotle mulls more food giveaways as customers slowly return March 16 Chipotle Mexican Grill Inc has recovered about one-third of sales lost to a string of food safety lapses last year, and more free offers may be forthcoming as part of its turnaround strategy, executives said at a conference on Wednesday. ~BRIEF-Chipotle has recovered about on-third of lost sales-executive * Has recovered about one-third of sales lost following food safety scares-executive ~Free burritos lure Chipotle loyalists, but will sales follow? LOS ANGELES Cesar Trejo broke his Chipotle habit after the chain's string of food safety lapses last year. This week, a free food offer lured him back, along with the urging of three friends who had returned without getting sick. ~Chipotle mulls stepping back from some food-safety changes - WSJ March 15 Chipotle Mexican Grill Inc is contemplating stepping back from some food-safety changes it had pushed for a month ago after a series of disease outbreaks, the WSJ reported, citing people familiar with the matter. ~
C,UPDATE 1-JPMorgan, Citi shareholders to vote on potential breakup plans March 16 Shareholders of JPMorgan Chase & Co  and Citigroup Inc will get to vote on whether their banks should consider breaking into smaller pieces. ~J.P.Morgan, Citi shareholders to vote on potential breakup plans - WSJ March 16 Shareholders of J.P.Morgan Chase & Co  and Citigroup Inc will get to vote on whether the two banks should break up into smaller pieces, the Wall Street Journal reported, citing people familiar with the matter. ~Santander Brasil eyes Citigroup unit to grow wealthy clientele: executive RIO DE JANEIRO Banco Santander Brasil SA  is eyeing a potential bid for Citigroup Inc's  local subsidiary, as the largest foreign lender in the country seeks to expand into banking for wealthy clients, a senior executive said on Wednesday. ~UPDATE 1-Santander Brasil eyes Citigroup unit to grow wealthy clientele - executive RIO DE JANEIRO, March 16 Banco Santander Brasil SA is eyeing a potential bid for Citigroup Inc's  local subsidiary, as the largest foreign lender in the country seeks to expand into banking for wealthy clients, a senior executive said on Wednesday. ~Citigroup CEO Corbat gets 27 percent pay hike Citigroup Inc raised Chief Executive Michael Corbat's pay by about 27 percent in 2015, a year in which the bank's profit more than doubled. ~Citigroup CEO Corbat gets 27 pct pay hike March 16 Citigroup Inc raised Chief Executive Michael Corbat's pay by about 27 percent in 2015, a year in which the bank's profit more than doubled. ~Santander Brasil considers Citigroup unit as part of M&A; strategy RIO DE JANEIRO, March 16 Banco Santander Brasil SA is looking at all possible acquisition alternatives to grow in the country, including Citigroup Inc's  local unit, which was recently put up for sale, a senior executive said on Wednesday. ~
DOW,BRIEF-Downer EDI says offer for Spotless Group now closed * Confirms that its offer for Spotless was not extended and has now closed. Source text for Eikon: Further company coverage: ~BRIEF-Downer EDI posts FY net profit of $181.5 million * FY total revenue and other income from ordinary activities $7.29 billion , up 6.4 percent ~BRIEF-Downer EDI says ‍offer for Spotless Group extended to 28 August 2017​ * ‍Offer for Spotless Group extended to 7pm on Monday, 28 august 2017​ Source text for Eikon: Further company coverage: ~BRIEF-Downer EDI says Spotless ‍offer extended to Aug 21, 2017​ * Spotless ‍offer extended to 7pm on monday, 21 august 2017​ Source text for Eikon: Further company coverage: ~BRIEF-Downer EDI's takeover offer for Spotless Group extended till 7pm (Sydney time) on Aug. 14 * Unconditional takeover offer for Spotless Group extended until 7:00pm (Sydney time) on Monday, 14 August Source text for Eikon: Further company coverage: (bangalore.newsroom@thomsonreuters.com) ~BRIEF-Downer extends takeover offer for Spotless Group * decided to extend Spotless offer period for one week; offer will now remain open for acceptance until 14 august Source text for Eikon: Further company coverage: ~BRIEF-Downer extends Spotless offer to August 7 2017 * ‍Downer has decided to extend offer for Spotless Group holdings to 7 pm on Monday, 7 august 2017​ Source text for Eikon: Further company coverage: ~BRIEF-Downer EDI's stake in Spotless increases to 80.3 pct * Downer's stake in Spotless increases to 80.3 pct Source text for Eikon: Further company coverage: ~BRIEF- Downer EDI Ltd'S stake in Spotless Group increases to 72% * As Downer's shareholding in Spotless is now over 70%, Downer expects that Spotless will be removed from certain S&P;/ASX market indices ~
FDX,UPDATE 2-Robust FedEx fiscal 2016 outlook sends stock up 5.0 percent CHICAGO, March 16 Package delivery company FedEx Corp forecast better than expected full year earnings and reported fiscal third quarter earnings that also beat analysts expectations, sending its stock up 5.0 percent in after-hours trade on Wednesday. ~
F,Major automakers to announce pact to install auto-braking systems by 2022 WASHINGTON, March 16 Major automakers will announce Thursday they have agreed to install automatic emergency braking systems in nearly all vehicles by September 2022, three sources briefed on the plans said. ~
GM,Major automakers to announce pact to install auto-braking systems by 2022 WASHINGTON Major automakers will announce Thursday they have agreed to install automatic emergency braking systems in nearly all U.S. vehicles by September 2022, three sources briefed on the plans said. ~REFILE-UPDATE 1-Major automakers to announce pact to install auto-braking systems by 2022 WASHINGTON, March 16 Major automakers will announce Thursday they have agreed to install automatic emergency braking systems in nearly all U.S. vehicles by September 2022, three sources briefed on the plans said. ~Major automakers to announce pact to install auto-braking systems by 2022 WASHINGTON, March 16 Major automakers will announce Thursday they have agreed to install automatic emergency braking systems in nearly all vehicles by September 2022, three sources briefed on the plans said. ~
GS,Ex-New York Fed employee avoids prison for Goldman Sachs leaks NEW YORK A former Federal Reserve Bank of New York employee was spared prison on Wednesday, disappointing prosecutors who said his leaking of confidential documents to a friend at Goldman Sachs Group Inc  justified time behind bars. ~Ex-New York Fed employee avoids prison for Goldman Sachs leaks NEW YORK, March 16 A former Federal Reserve Bank of New York employee was spared prison on Wednesday, disappointing prosecutors who said his leaking of confidential documents to a friend at Goldman Sachs Group Inc  justified time behind bars. ~Corrigan retires from Goldman Sachs, a friend and foe of Paul Volcker E. Gerald Corrigan has gotten used to big change during his career in government and on Wall Street. ~CORRECTED-Corrigan retires from Goldman Sachs, a friend and foe of Paul Volcker March 15 E. Gerald Corrigan has gotten used to big change during his career in government and on Wall Street. ~
JPM,J.P.Morgan, Citi shareholders to vote on potential breakup plans - WSJ March 16 Shareholders of J.P.Morgan Chase & Co  and Citigroup Inc will get to vote on whether the two banks should break up into smaller pieces, the Wall Street Journal reported, citing people familiar with the matter. ~
LMT,Lockheed says U.S. bomber win appears based solely on cost WASHINGTON, March 15 Northrop Grumman Corp's  bid to build a new U.S. bomber appears to have won the multibillion-dollar competition solely on the basis of cost, said a top executive with Lockheed Martin Corp, whose team led by Boeing Co lost the bidding. ~Lockheed CEO still likes Sikorsky despite slumping sales to energy sector WASHINGTON Lockheed Martin Corp  has "no regrets" about buying Sikorsky for $9 billion even though sliding oil prices have taken a bigger bite than expected from the company's commercial helicopter sales, Chief Executive Marillyn Hewson said Tuesday. ~Lockheed Martin to invest more in hypersonic aircraft: CEO WASHINGTON Lockheed Martin Corp  will continue to invest in technology to develop hypersonic aircraft that can respond to security threats much more quickly than current fighter jets, Chief Executive Officer Marillyn Hewson said on Tuesday. ~UPDATE 2-Lockheed CEO still likes Sikorsky despite slumping sales to energy sector WASHINGTON, March 15 Lockheed Martin Corp  has "no regrets" about buying Sikorsky for $9 billion even though sliding oil prices have taken a bigger bite than expected from the company's commercial helicopter sales, Chief Executive Marillyn Hewson said Tuesday. ~
NOC,Lockheed says U.S. bomber win appears based solely on cost WASHINGTON, March 15 Northrop Grumman Corp's  bid to build a new U.S. bomber appears to have won the multibillion-dollar competition solely on the basis of cost, said a top executive with Lockheed Martin Corp, whose team led by Boeing Co lost the bidding. ~
UTX,UPDATE 2-Lockheed CEO still likes Sikorsky despite slumping sales to energy sector WASHINGTON, March 15 Lockheed Martin Corp  has "no regrets" about buying Sikorsky for $9 billion even though sliding oil prices have taken a bigger bite than expected from the company's commercial helicopter sales, Chief Executive Marillyn Hewson said Tuesday. ~
V,BRIEF-Visa calls for redemption all of its 1.200 pct notes due 2017 * Visa Inc - on Sept 11, co called for redemption all of $1.75 billion principal amount outstanding of its 1.200 pct notes due 2017‍​ - SEC filing ~BRIEF-Visa Inc files for three-part senior notes offering of up to $2.5 bln * Visa Inc says files for three-part senior notes offering of up to $2.5 billion - SEC filing‍​ ~Former BoE deputy Hogg to join Visa as Europe unit CEO Visa Inc, the world's largest payments processor, on Thursday named former Bank of England (BoE) deputy governor Charlotte Hogg as chief executive of its Europe division. ~CORRECTED-UPDATE 1-MOVES-Former BoE deputy Hogg to join Visa as Europe unit CEO Sept 7 Visa Inc, the world's largest payments processor, on Thursday named former Bank of England (BoE) deputy governor Charlotte Hogg as chief executive of its Europe division. ~MOVES-Visa names ex-BoE deputy Charlotte Hogg as Europe unit CEO Sept 7 Visa Inc, the world's largest payments processor, on Thursday named Charlotte Hogg as chief executive of its Europe division. ~BRIEF-Visa appoints Charlotte Hogg as CEO of European operations * Visa Inc appoints Charlotte Hogg as chief executive officer of the compan's European operations ~BRIEF-Visa Inc files prospectus supplement for potential three-part senior notes offering * Visa Inc files prospectus supplement for potential three-part senior notes offering; size not disclosed - sec filing‍​ Source text (http://bit.ly/2vLDrIe) Further company coverage: ~BRIEF-Visa enables on the go payments with the new Fitbit Ionic * Visa inc- ‍enabling visa payments on fitbit's smartwatch fitbit ionic​ ~BRIEF-Bridg raises $11 million in Series B funding * Bridg raises $11 million in Series B funding from Morpheus Ventures, March Capital, Visa and NextEquity ~
WFC,BRIEF-Wells Fargo CEO John Stumpf's fy 2015 total compensation was $19.3 mln * Says cfo john shrewsberry's 2015 total compensation was $9.1 million versus $7.4 million in 2014 - sec filing ~Wells Fargo CEO's pay unchanged at $19.3 mln March 16 Wells Fargo & Co Chairman and Chief Executive John Stumpf's 2015 compensation was unchanged from a year earlier. ~Wells Fargo hires former JPMorgan Asia banking head for global push March 16 Wells Fargo & Co has hired Thomas DuCharme, former co-head of Asia-Pacific banking at JPMorgan Chase & Co, to help with its global expansion, a spokeswoman for the San Francisco-based bank said on Wednesday. ~BRIEF-Kraton Performance Polymers - Unit enters supplemental indenture with Wells Fargo bank * Unit Kraton Polymers and its wholly-owned subsidiaries,  entered into a supplemental indenture with Wells Fargo bank ~
