ABBV.N,Roche, AbbVie get U.S. priority review status for leukemia drug ZURICH Roche said on Tuesday that the U.S. Food and Drug Administration has granted 'priority review' status for its venetoclax drug for the treatment of a blood cancer, which it is developing with partner AbbVie. ~
AGN,Pfizer, Allergan say combined drug pipeline 'underappreciated' NEW YORK, Jan 12 The research chiefs of betrothed drugmakers Pfizer Inc and Allergan say the proposed combination of their experimental drugs deserves more credit, including potential blockbuster treatments for schizophrenia and depression. ~Bond investors hope AB InBev will wet their whistles NEW YORK, Jan 12 (IFR) - Investors could easily soak up a US$60bn bond from AB InBev if the beer giant wants to sell that much debt this week to help fund its acquisition of rival brewer SABMiller. ~BRIEF-Allergan research chief says Pfizer immuno-oncology pipeline underappreciated * Pfizer says its experimental off-the-shelf CAR T cell therapies for cancer may have major advantages over personalized CAR T cells ~
GOOGL.O,UPDATE 1-Google will add more partners for self-driving cars-exec DETROIT, Jan 12 Alphabet Inc's Google  wants to form more partnerships with established automakers and suppliers this year to accelerate its work on self-driving cars, the head of the Google project said on Tuesday. ~Ford Chairman: 'We are in an experimental stage' DETROIT Ford Motor Co  Chairman Bill Ford said on Monday the automaker is open to more than one approach to building its businesses based on mobile internet connections and alternatives to traditional car ownership, including mergers and acquisitions, partnerships and going it alone. ~
GOOG.O,UPDATE 1-Google will add more partners for self-driving cars-exec DETROIT, Jan 12 Alphabet Inc's Google  wants to form more partnerships with established automakers and suppliers this year to accelerate its work on self-driving cars, the head of the Google project said on Tuesday. ~Ford Chairman: 'We are in an experimental stage' DETROIT Ford Motor Co  Chairman Bill Ford said on Monday the automaker is open to more than one approach to building its businesses based on mobile internet connections and alternatives to traditional car ownership, including mergers and acquisitions, partnerships and going it alone. ~
AAL.O,American Airlines writes off $592 mln trapped in Venezuela Jan 12 American Airlines Group Inc on Tuesday said it has written off more than half a billion dollars in revenue stuck in Venezuela because of currency controls. ~
ANTM.N,Health insurer Anthem expects higher profit for 2016 Health insurer Anthem Inc, which is buying rival Cigna Corp, said it expected its adjusted net income to rise to over $10.80 per share in 2016 from $10.16 estimated for 2015. ~UPDATE 1-Health insurer Anthem expects higher profit for 2016 Jan 12 Health insurer Anthem Inc, which is buying rival Cigna Corp, said it expected its adjusted net income to rise to over $10.80 per share in 2016 from $10.16 estimated for 2015. ~Health insurer Anthem expects higher profit for 2016 Jan 12 Health insurer Anthem Inc said on Tuesday it expected an adjusted net income of more than $10.80 per share for 2016 compared with $10.16 estimated for 2015. ~
BLK,UPDATE 1-BlackRock reshuffles senior leadership of investment teams -memo NEW YORK, Jan 12 BlackRock Inc on Tuesday informed staff that it was reshuffling the managers of some of its most important investment units, including its stock and bond-picking businesses, according to an internal memo seen by Reuters. ~BlackRock reshuffles senior leadership of investment teams NEW YORK, Jan 12 BlackRock Inc on Tuesday said it reshuffled the managers of some of its most important investment units, including its stock and bond picking businesses, according to a memo seen by Reuters. ~BBVA Compass signs pact with BlackRock's robo-adviser BBVA Compass, a unit of Spain's BBVA group, said it signed an agreement with BlackRock Inc's "robo-adviser", FutureAdvisor, to help expand its automated investment advisory services. ~BBVA Compass signs pact with BlackRock's robo-adviser Jan 12 BBVA Compass, a unit of Spain's BBVA group, said it signed an agreement with BlackRock Inc's  "robo-adviser", FutureAdvisor, to help expand its automated investment advisory services. ~
BA,Airbus beats Boeing in 2015 order race, lags on deliveries PARIS, Jan 12 European planemaker Airbus beat Boeing in the race for new business last year, but remained behind on deliveries as Boeing extended its lead as the world's largest jetmaker. ~
CI,Health insurer Anthem expects higher profit for 2016 Health insurer Anthem Inc, which is buying rival Cigna Corp, said it expected its adjusted net income to rise to over $10.80 per share in 2016 from $10.16 estimated for 2015. ~UPDATE 1-Health insurer Anthem expects higher profit for 2016 Jan 12 Health insurer Anthem Inc, which is buying rival Cigna Corp, said it expected its adjusted net income to rise to over $10.80 per share in 2016 from $10.16 estimated for 2015. ~
CSX.O,UPDATE 1-CSX Q4 profit falls on lower freight volumes CHICAGO, Jan 12 No. 3 U.S. railroad CSX Corp  on Tuesday reported a lower quarterly net profit, citing a drop in freight volumes, and said the weak global economy and U.S. industrial markets would weigh on results in the coming year. ~CSX Q4 profit falls on lower freight volumes CHICAGO, Jan 12 No. 3 U.S. railroad CSX Corp  on Tuesday reported a lower quarterly net profit citing a drop in freight volumes, especially a 32 percent decline in the amount of coal hauled. ~
DOW,BRIEF-Downer EDI says offer for Spotless Group now closed * Confirms that its offer for Spotless was not extended and has now closed. Source text for Eikon: Further company coverage: ~BRIEF-Downer EDI posts FY net profit of $181.5 million * FY total revenue and other income from ordinary activities $7.29 billion , up 6.4 percent ~BRIEF-Downer EDI says ‍offer for Spotless Group extended to 28 August 2017​ * ‍Offer for Spotless Group extended to 7pm on Monday, 28 august 2017​ Source text for Eikon: Further company coverage: ~BRIEF-Downer EDI says Spotless ‍offer extended to Aug 21, 2017​ * Spotless ‍offer extended to 7pm on monday, 21 august 2017​ Source text for Eikon: Further company coverage: ~BRIEF-Downer EDI's takeover offer for Spotless Group extended till 7pm (Sydney time) on Aug. 14 * Unconditional takeover offer for Spotless Group extended until 7:00pm (Sydney time) on Monday, 14 August Source text for Eikon: Further company coverage: (bangalore.newsroom@thomsonreuters.com) ~BRIEF-Downer extends takeover offer for Spotless Group * decided to extend Spotless offer period for one week; offer will now remain open for acceptance until 14 august Source text for Eikon: Further company coverage: ~BRIEF-Downer extends Spotless offer to August 7 2017 * ‍Downer has decided to extend offer for Spotless Group holdings to 7 pm on Monday, 7 august 2017​ Source text for Eikon: Further company coverage: ~BRIEF-Downer EDI's stake in Spotless increases to 80.3 pct * Downer's stake in Spotless increases to 80.3 pct Source text for Eikon: Further company coverage: ~BRIEF- Downer EDI Ltd'S stake in Spotless Group increases to 72% * As Downer's shareholding in Spotless is now over 70%, Downer expects that Spotless will be removed from certain S&P;/ASX market indices ~
XOM,Europe refiners rush to make more gasoline after diesel hangover LONDON, Jan 12 After years of building up diesel production, European oil refiners are using every trick in the book to maximize gasoline output to meet unabated global demand as the two fuels stage a sharp reversal of fortune. ~
F,Ford declares new $1 billion dividend, expects to earn at least $10 billion in 2016 Ford Motor Co  said on Tuesday it was declaring a $1 billion supplemental cash dividend and that it expected to have operating profit of at least $10 billion in 2016, roughly the same as its earnings in 2015. ~Ford declares new $1 billion dividend, expects to earn at least $10 billion in 2016 Jan 12 Ford Motor Co said on Tuesday it was declaring a $1 billion supplemental cash dividend and that it expected to have operating profit of at least $10 billion in 2016, roughly the same as its earnings in 2015. ~Ford unveils resurrected Lincoln Continental, targets China market Jan 12 Ford Motor Co unveiled on Tuesday a new luxury flagship full-size Continental sedan aimed at Chinese and American consumers. ~Nigeria's "bad bank" AMCON seeks bids for stake in Peugeot plant LAGOS, Jan 12 Nigeria's state-backed AMCON "bad bank" said on Tuesday it plans to sell its majority stake in Peugeot Automobile Nigeria (PAN) Limited, a local joint venture with the major French automaker, and is seeking bids from investors. ~Exclusive: U.S., major automakers to announce safety accord Friday - sources DETROIT The U.S. government and a group of global automakers are set to unveil a voluntary agreement at the Detroit auto show on Friday aimed at improving auto industry safety and spurring culture changes, according to company and government officials. ~Ford Chairman: 'We are in an experimental stage' DETROIT Ford Motor Co  Chairman Bill Ford said on Monday the automaker is open to more than one approach to building its businesses based on mobile internet connections and alternatives to traditional car ownership, including mergers and acquisitions, partnerships and going it alone. ~
GM,New York jury hears claim GM concealed ignition switch defect NEW YORK General Motors Co should pay for concealing an ignition switch defect from its customers that has been linked to nearly 400 injuries and deaths, a lawyer for an Oklahoma man injured in a car crash told a Manhattan jury on Tuesday. ~New York jury hears claim GM concealed ignition switch defect NEW YORK, Jan 12 General Motors Co should pay for concealing an ignition switch defect from its customers that has been linked to nearly 400 injuries and deaths, a lawyer for an Oklahoma man injured in a car crash told a Manhattan jury on Tuesday. ~Ford unveils resurrected Lincoln Continental, targets China market Jan 12 Ford Motor Co unveiled on Tuesday a new luxury flagship full-size Continental sedan aimed at Chinese and American consumers. ~Exclusive: U.S., major automakers to announce safety accord Friday - sources DETROIT The U.S. government and a group of global automakers are set to unveil a voluntary agreement at the Detroit auto show on Friday aimed at improving auto industry safety and spurring culture changes, according to company and government officials. ~Detroit's auto industry is changed, but not as Washington planned DETROIT When U.S. President Barack Obama visits Detroit's annual auto show on Jan. 20, exactly one year before he leaves office, he is expected to tout how much the industry has changed since he orchestrated a federally funded rescue in 2009.   | Video  ~
HAL,EU opens probe into Halliburton's planned purchase of Baker Hughes BRUSSELS The European Commission said on Tuesday it had launched an in-depth investigation into Halliburton's  planned purchase of its oilfield services rival Baker Hughes . ~UPDATE 1-EU probes Halliburton's planned purchase of Baker Hughes BRUSSELS, Jan 12 The European Commission said on Tuesday it had launched an in-depth investigation into oilfield services provider Halliburton's planned purchase of its smaller rival Baker Hughes. ~REFILE-CORRECTED-EU opens probe into Halliburton's planned purchase of Baker Hughes BRUSSELS, Jan 12 The European Commission said on Tuesday it had launched an in-depth investigation into Halliburton's planned purchase of its oilfield services rival Baker Hughes. ~
LNC,Ford unveils resurrected Lincoln Continental, targets China market Jan 12 Ford Motor Co unveiled on Tuesday a new luxury flagship full-size Continental sedan aimed at Chinese and American consumers. ~
MCD,UPDATE 3-Italian groups seek EU antitrust probe into McDonald's * EU already looking into McDonald's tax deal with Luxembourg ~
MRK,Merck, BioLineRX to study drug combo to fight pancreatic cancer JERUSALEM, Jan 12 Israeli biopharmaceutical company BioLineRX Ltd said on Tuesday it would collaborate with U.S. industry heavyweight Merck to test a combination of drugs for the treatment of pancreatic cancer. ~
MET,Metlife plans to separate U.S. retail business; shares rise Metlife Inc , the largest U.S. life insurer, said it plans to separate a substantial portion of its U.S. retail business. ~Metlife plans to separate U.S. retail business Jan 12 Metlife Inc, the largest U.S. life insurer, plans to separate a substantial portion of its U.S. retail segment. ~
NSC,Norfolk Southern to consolidate Virginia units to cut costs Jan 12 U.S. railroad operator Norfolk Southern Corp, which has repeatedly rejected Canadian Pacific Railway Ltd's takeover bid, said it will consolidate its Virginia and Pocahontas units, to cut costs and support growth. ~
PFE,Pfizer, Allergan say combined drug pipeline 'underappreciated' NEW YORK, Jan 12 The research chiefs of betrothed drugmakers Pfizer Inc and Allergan say the proposed combination of their experimental drugs deserves more credit, including potential blockbuster treatments for schizophrenia and depression. ~BRIEF-Allergan research chief says Pfizer immuno-oncology pipeline underappreciated * Pfizer says its experimental off-the-shelf CAR T cell therapies for cancer may have major advantages over personalized CAR T cells ~
DIS,Shanghai Disneyland set to open in June Jan 12 Walt Disney Co's theme park in Shanghai is slated to open on June 16, the company said on Tuesday. ~
TWX,Icahn says he does not have any position in Time Warner Jan 12 Billionaire activist investor Carl Icahn said on Tuesday he did own any stake in media company Time Warner Inc. ~Deals of the day-Mergers and acquisitions Jan 12 The following bids, mergers, acquisitions and disposals were reported by 2100 GMT on Tuesday: ~Bewkes against HBO spinoff, open to Time Warner sale: NY Post Time Warner Inc  Chief Executive Jeff Bewkes is against a sale or a spinoff of premium cable channel HBO, but hinted he would be open to a sale of the whole company, the New York Post reported, citing sources. ~Bewkes against HBO spinoff, open to Time Warner sale - NY Post Jan 12 Time Warner Inc Chief Executive Jeff Bewkes is against a sale or a spinoff of premium cable channel HBO, but hinted he would be open to a sale of the whole company, the New York Post reported, citing sources. ~Icahn buying up Time Warner shares: sources Billionaire activist investor Carl Icahn is building an equity stake in Time Warner Inc , people familiar with the matter said on Monday. ~CORRECTED-UPDATE 2-Icahn buying up Time Warner shares - sources Jan 11 Billionaire activist investor Carl Icahn is building an equity stake in Time Warner Inc, people familiar with the matter said on Monday. ~Icahn buying up Time Warner shares - sources Jan 11 Billionaire activist investor Carl Icahn is building an equity stake in Time Warner Inc, people familiar with the matter said on Monday, in a move that could lead to a major shake-up of the media conglomerate. ~
FOXA.O,Rupert Murdoch, Jerry Hall announce engagement Jan 12 Media baron Rupert Murdoch announced his engagement to former supermodel Jerry Hall in an advertisement published on Tuesday in The Times newspaper, which is owned by Murdoch's News Corp. ~
FOX.O,Rupert Murdoch, Jerry Hall announce engagement Jan 12 Media baron Rupert Murdoch announced his engagement to former supermodel Jerry Hall in an advertisement published on Tuesday in The Times newspaper, which is owned by Murdoch's News Corp. ~
V,BRIEF-Visa calls for redemption all of its 1.200 pct notes due 2017 * Visa Inc - on Sept 11, co called for redemption all of $1.75 billion principal amount outstanding of its 1.200 pct notes due 2017‍​ - SEC filing ~BRIEF-Visa Inc files for three-part senior notes offering of up to $2.5 bln * Visa Inc says files for three-part senior notes offering of up to $2.5 billion - SEC filing‍​ ~Former BoE deputy Hogg to join Visa as Europe unit CEO Visa Inc, the world's largest payments processor, on Thursday named former Bank of England (BoE) deputy governor Charlotte Hogg as chief executive of its Europe division. ~CORRECTED-UPDATE 1-MOVES-Former BoE deputy Hogg to join Visa as Europe unit CEO Sept 7 Visa Inc, the world's largest payments processor, on Thursday named former Bank of England (BoE) deputy governor Charlotte Hogg as chief executive of its Europe division. ~MOVES-Visa names ex-BoE deputy Charlotte Hogg as Europe unit CEO Sept 7 Visa Inc, the world's largest payments processor, on Thursday named Charlotte Hogg as chief executive of its Europe division. ~BRIEF-Visa appoints Charlotte Hogg as CEO of European operations * Visa Inc appoints Charlotte Hogg as chief executive officer of the compan's European operations ~BRIEF-Visa Inc files prospectus supplement for potential three-part senior notes offering * Visa Inc files prospectus supplement for potential three-part senior notes offering; size not disclosed - sec filing‍​ Source text (http://bit.ly/2vLDrIe) Further company coverage: ~BRIEF-Visa enables on the go payments with the new Fitbit Ionic * Visa inc- ‍enabling visa payments on fitbit's smartwatch fitbit ionic​ ~BRIEF-Bridg raises $11 million in Series B funding * Bridg raises $11 million in Series B funding from Morpheus Ventures, March Capital, Visa and NextEquity ~
YUM,UPDATE 1-Yum says China same-store sales rise 1 pct in December Jan 12 Yum Brands Inc, which is spinning off its China business, said December same-store sales increased 1 percent in the country, helped by a 5 percent rise at KFC. ~Yum Brands says China same-store sales rose slightly in December Jan 12 Yum Brands Inc estimated a 1 percent growth in December same-store sales in its China division, in its final monthly sales release before the business is spun off. ~
