AET,Alibaba's new payment system lets virtual reality shoppers pay by nodding HONG KONG, Oct 12 Alibaba Group Holdings'  finance arm on Wednesday demonstrated a payment service that will allow virtual reality shoppers to pay for things in future just by nodding their heads. ~
AAPL.O,Apple-Samsung iPhone patent feud leaves U.S. top court struggling WASHINGTON The fierce, big-money patent fight between Apple and Samsung left the U.S. Supreme Court groping for a solution on Tuesday, as the justices puzzled over how to discern the value of individual design elements in a complex product like an iPhone. ~
BA,China Southern Airlines to buy 12 Boeing jets worth about $3 billion SINGAPORE China Southern Airlines , the country's largest carrier by fleet size, has signed an agreement with Boeing  to buy a dozen B787-9 jets worth $3.3 billion in the latest sign of booming Chinese demand for air travel. ~China Southern Airlines to buy 12 Boeing jets worth about $3 bln SINGAPORE, Oct 12 China Southern Airlines   , the country's largest carrier by fleet size, has signed an agreement with Boeing to buy a dozen B787-9 jets worth $3.3 billion in the latest sign of booming Chinese demand for air travel. ~
CSCO.O,UPDATE 3-Ericsson crisis deepens as profits plunge 94 pct * Shares tumble more than 15 percent, hit 8-year low   (Adds more CEO, analyst comments, background, updates shares) ~
CSX.O,CORRECTED-UPDATE 1-CSX takes revenue, freight volume hit, but beats expectations CHICAGO, Oct 12 No. 3 U.S. railroad CSX Corp  on Wednesday reported a lower quarterly net profit that was hurt by an 8 percent drop in revenue and freight volumes, but came in above market expectations and sent its stock up nearly 3 percent. ~CORRECTED-CSX 3rd qtr profit falls on lower revenue, coal volumes down 21 pct CHICAGO, Oct 12 No. 3 U.S. railroad CSX Corp  on Wednesday reported a lower quarterly net profit, citing an 8 percent drop in revenue and freight volumes, with coal freight down 21 percent in the three months ended Sept. 30. ~BRIEF-CSX Corp Q3 earnings per share $0.48 * Q3 earnings per share view $0.45 -- Thomson Reuters I/B/E/S ~
GM,UPDATE 1-GM ventures into China car-sharing with investment in app developer * No deal value disclosed   (Adds GM comment on venture and possible tie-in with its Maven car-sharing service) ~GM ventures into China car-sharing with investment in app developer BEIJING, Oct 12 U.S. automaker General Motors Co  made its first investment in a Chinese car-sharing start up, the company said on Tuesday, as its attempt to reshape itself as a mobility solutions company spreads around the globe. ~
GS,Basel publishes final rules to tackle "too big to fail" banks LONDON, Oct 12 Global regulators have published final rules that aim to limit the impact on financial markets if mega banks run into trouble. ~BRIEF-Hastings Investco, Goldman Sachs disclose 40 pct stake in Hastings -filing * Hastings Investco and Goldman Sachs disclose voting rights of 40.12 percent with transaction on Oct 7 - filing  Source text for Eikon:  Further company coverage:    (Bengaluru Newsroom: +91 806 749 1136) ~
HUM,CORRECTED-UPDATE 2-Humana says government cut in Medicare ratings will impact 2018 Oct 12 Health insurer Humana Inc on Wednesday said a U.S. government health department cut its quality rating on Humana Medicare plans that currently enroll more than 1 million people, which could affect how much the government pays the insurer in 2018. ~Humana raises 2016 earnings forecast Oct 12 Health insurer Humana Inc on Wednesday raised its full-year earnings forecast, primarily due to better-than-projected performance in its Medicare Advantage business. ~
NFLX.O,More viewers subscribing to multiple streaming services -survey NEW YORK, Oct 12 As the number of streaming video services proliferate, about 16 percent of U.S. video viewers have signed up for more than one online streaming service, up from 10 percent three years ago, according to a report from market research firm GfK SE. ~
NWL,UPDATE 2-Stanley Black & Decker to buy Newell's tool business * Deal to add 15 cents/shr to Stanley Black's EPS in first year ~CORRECTED-UPDATE 1-Stanley Black & Decker to buy Newell's tool business Oct 12 Power tool maker Stanley Black & Decker Inc said it would buy Newell Brands Inc's tool business for $1.95 billion, adding brands such as Irwin and Lenox to its lineup. ~Stanley Black & Decker to buy Newell Brands tool business Oct 12 Power tools maker Stanley Black & Decker Inc said on Wednesday it would buy Newell Brands Inc's  tool business for $1.95 billion in cash. ~BRIEF-Newell Brands to sell its tools business to Stanley Black & Decker for $1.95 bln * Newell Brands announces agreement to sell tools brands to Stanley Black & Decker ~
ORCL.N,BRIEF-Oracle says court ordered Rimini to pay Oracle $27.7 mln in patent infringement case * Oracle -  United States District Court for District Of Nevada issued 2 rulings in Oracle's litigation against Rimini Street and its CEO Seth Ravin ~
SWK,BRIEF-Stanley Black & Decker-Newell deal does not preclude it from doing a deal in another part of biz portfolio - Conf call * Says the Newell tool biz deal does not preclude it from doing an acquisition in another part of its biz portfolio - Conf call  Further company coverage: ~Stanley Black & Decker to buy Newell's tool business Power tool maker Stanley Black & Decker Inc  said it would buy Newell Brands Inc's  tool business for $1.95 billion, adding brands such as Irwin and Lenox to its lineup. ~BRIEF-Stanley Black & Decker to buy Newell Brands tools business for $1.95 bln * Stanley Black & Decker to acquire tools business of Newell Brands ~Stanley Black & Decker to buy Newell Brands tool business Oct 12 Power tools maker Stanley Black & Decker Inc said on Wednesday it would buy Newell Brands Inc's  tool business for $1.95 billion in cash. ~BRIEF-Newell Brands to sell its tools business to Stanley Black & Decker for $1.95 bln * Newell Brands announces agreement to sell tools brands to Stanley Black & Decker ~
VZ,Civil liberties group urges Verizon to shore up Yahoo user protection SAN FRANCISCO, Oct 12 An international civil liberties group that has worked with web companies on human rights and surveillance issues is asking Verizon Communications Inc to examine a secret email scanning program run by its acquisition target Yahoo Inc and improve on its user protection record. ~
WFC,SEC questioned Wells Fargo about cross-selling in 2014 WASHINGTON The U.S. Securities and Exchange Commission raised questions about Wells Fargo & Co's  aggressive cross-selling in late 2014, according to regulatory paperwork, almost two years before officials settled with the bank for opening phony accounts. ~U.S. SEC questioned Wells Fargo about cross-selling in 2014 WASHINGTON, Oct 12 The U.S. Securities and Exchange Commission raised questions about Wells Fargo & Co's  aggressive cross-selling in late 2014, according to regulatory paperwork, almost two years before officials settled with the bank for opening phony accounts. ~Wells Fargo CEO John Stumpf retires, replaced by Tim Sloan NEW YORK, Oct 12 Wells Fargo & Co  chairman and chief executive officer, John Stumpf, will retire and the board of directors has chosen Tim Sloan as the new CEO, the U.S. West Coast-based bank said on Wednesday. ~Wells Fargo CEO John Stumpf retires, Tim Sloan to take over Oct 12 Wells Fargo & Co said on Wednesday Chairman and CEO John Stumpf has retired, and President Tim Sloan will take over as chief executive.     (Reporting By Sudarshan Varadhan in Bengaluru; Editing by Don Sebastian) ~Wells Fargo faces costly overhaul of bankrupt sales culture Embroiled in a scandal over unauthorized customer accounts, Wells Fargo & Co  faces a steep challenge in overhauling its hard-charging sales culture without gutting profits. | Video  ~
WY,Weyerhaeuser explores sale of Uruguay timber business Real estate investment trust Weyerhaeuser Co  said it was exploring strategic alternatives, including a possible sale, for its timberlands and manufacturing operations in Uruguay. ~Weyerhaeuser explores sale of Uruguay timber business Oct 12 Real estate investment trust Weyerhaeuser Co said it was exploring strategic alternatives, including a possible sale, for its timberlands and manufacturing operations in Uruguay. ~BRIEF-Weyerhaeuser to explore strategic alternatives for its Uruguay Timberlands, manufacturing business * Weyerhaeuser to explore strategic alternatives for its Uruguay timberlands and manufacturing business ~
YUM,BRIEF-Yum Brands CEO Greg Creed says Dominos did a much better job of technology - CNBC * Yum Brands CEO Greg Creed on CNBC- Dominos did a much better job of technology, and we have to catch up ~
