ABT,BRIEF-China clears Abbott's acquisition of Alere * People's Republic of China clears Abbott acquisition of Alere ~
ALK,UPDATE 1-Alaska Air CEO says hard to predict when Virgin deal will close Oct 20 Alaska Air Group Inc's chief executive said on Thursday it was hard to predict when its deal to buy Virgin America Inc will receive approval from the U.S. Justice Department, which is considering the impact of the latest airline merger on competition and airfares. ~Alaska Air CEO says hard to predict when Virgin deal will close Oct 20 Alaska Air Group Inc's chief executive said on an analyst call Thursday that it is hard to predict when the U.S. Justice Department will approve the company's acquisition of Virgin America Inc, but he hopes it will be soon. ~BRIEF-Alaska Air Group reports Q3 results * Alaska Air Group Inc - Q3 total operating revenue $ 1,566 million versus $1,515 million ~
GOOGL.O,Investment banks scramble to fill top jobs in Italy LONDON Headhunters are trying to lure Italian bankers in London back to jobs at home, hoping to use Britain's vote to leave the EU as leverage to fill a string of vacancies at investment banks in Europe's fourth largest economy. ~Google signs CBS, in talks with others on web TV: sources Alphabet Inc's  Google has reached an agreement with CBS Corp  to carry the network on its planned web TV service and is in advanced talks with 21st Century Fox , Walt Disney Co  and Viacom Inc  to distribute their channels, people with knowledge of the talks told Reuters on Wednesday. ~UPDATE 3-Google signs CBS, in talks with others on web TV -sources Oct 19 Alphabet Inc's Google has reached an agreement with CBS Corp to carry the network on its planned web TV service and is in advanced talks with 21st Century Fox, Walt Disney Co and Viacom Inc  to distribute their channels, people with knowledge of the talks told Reuters on Wednesday. ~
GOOG.O,Investment banks scramble to fill top jobs in Italy LONDON Headhunters are trying to lure Italian bankers in London back to jobs at home, hoping to use Britain's vote to leave the EU as leverage to fill a string of vacancies at investment banks in Europe's fourth largest economy. ~Google signs CBS, in talks with others on web TV: sources Alphabet Inc's  Google has reached an agreement with CBS Corp  to carry the network on its planned web TV service and is in advanced talks with 21st Century Fox , Walt Disney Co  and Viacom Inc  to distribute their channels, people with knowledge of the talks told Reuters on Wednesday. ~UPDATE 3-Google signs CBS, in talks with others on web TV -sources Oct 19 Alphabet Inc's Google has reached an agreement with CBS Corp to carry the network on its planned web TV service and is in advanced talks with 21st Century Fox, Walt Disney Co and Viacom Inc  to distribute their channels, people with knowledge of the talks told Reuters on Wednesday. ~
AAL.O,UPDATE 3-American Airlines profit margin forecast disappoints Oct 20 American Airlines Group Inc  shares dipped on Thursday after the carrier said cheap airfares and higher wages will squeeze profits in the current quarter. ~BRIEF-American Airlines Group Q3 GAAP earnings per share $1.40 * Q3 revenue $10.6 billion versus I/B/E/S view $10.54 billion ~American Airlines revenue falls 1.1 pct Oct 20 American Airlines Group Inc  reported a 1.1 percent drop in quarterly revenue as a crowded market hurt ticket sales. ~
T,PRESS DIGEST- Wall Street Journal - Oct 20 Oct 20 The following are the top stories in the Wall Street Journal. Reuters has not verified these stories and does not vouch for their accuracy. ~Google signs CBS, in talks with others on web TV: sources Alphabet Inc's  Google has reached an agreement with CBS Corp  to carry the network on its planned web TV service and is in advanced talks with 21st Century Fox , Walt Disney Co  and Viacom Inc  to distribute their channels, people with knowledge of the talks told Reuters on Wednesday. ~UPDATE 3-Google signs CBS, in talks with others on web TV -sources Oct 19 Alphabet Inc's Google has reached an agreement with CBS Corp to carry the network on its planned web TV service and is in advanced talks with 21st Century Fox, Walt Disney Co and Viacom Inc  to distribute their channels, people with knowledge of the talks told Reuters on Wednesday. ~
BMY,UPDATE 2-Roche bets on new cancer drugs to offset patent expiries * Keeps full-year outlook   (Adds CEO, analyst comment, updates shares) ~
CMCSA.O,UPDATE 3-Google signs CBS, in talks with others on web TV -sources Oct 19 Alphabet Inc's Google has reached an agreement with CBS Corp to carry the network on its planned web TV service and is in advanced talks with 21st Century Fox, Walt Disney Co and Viacom Inc  to distribute their channels, people with knowledge of the talks told Reuters on Wednesday. ~
FTI,FMC Technologies to pay $2.5 million for accounting violations: SEC WASHINGTON Energy technology company FMC Technologies Inc will pay a $2.5 million penalty to settle charges that it overstated profits in one of its business segments, the U.S. Securities and Exchange Commission said on Thursday. ~UPDATE 1-FMC Technologies to pay $2.5 mln for accounting violations -SEC WASHINGTON, Oct 20 Energy technology company FMC Technologies Inc will pay a $2.5 million penalty to settle charges that it overstated profits in one of its business segments, the U.S. Securities and Exchange Commission said on Thursday. ~FMC Technologies to pay $2.5 mln over overstating profits -U.S. SEC WASHINGTON, Oct 20 Houston-based technology solutions company FMC Technologies Inc will pay a $2.5 million penalty to settle charges that it overstated profits in one of its business segments, U.S. regulators said. ~BRIEF-Technip-FMC merger could be concluded at the start of 2017 - CEO * Thierry Pilenko says merger with FMC Technologies could be concluded at the start of 2017 ~
F,Jaguar Land Rover and Ford test connected cars in Britain LONDON, Oct 21 Jaguar Land Rover, Ford and Tata Motors are testing connected cars which can communicate with each other using technology designed to speed up journeys and cut accidents, the first such trials in Britain. ~
GE,BRIEF-GE invests in GAMA-TÜRKERLER JV to develop two healthcare PPPs in Turkey * GE invests in GAMA-TÜRKERLER JV to develop two major healthcare PPPs in Turkey; OPIC, EBRD and EDC to provide financing for transformational hospital project ~
GILD.O,BRIEF-Gilead announces SVR12 rates from four phase 3 studies of combination of Sofosbuvir, Velpatasvir And Voxilaprevir * Gilead announces SVR12 rates from four phase 3 studies of a once-daily, fixed-dose combination of Sofosbuvir, Velpatasvir and Voxilaprevir in treatment-naïve and treatment-experienced genotype 1-6 chronic HCV-infected patients ~
GS,JPMorgan in talks to sell out of Chinese securities JV HONG KONG JPMorgan Chase & Co is in talks to sell out of a Chinese securities joint venture with First Capital Securities Co Ltd in what would be the first departure by a top-tier global investment bank from China's securities segment. ~JPMorgan in talks to sell out of Chinese securities JV HONG KONG JPMorgan Chase & Co is in talks to sell out of a Chinese securities joint venture with First Capital Securities Co Ltd in what would be the first departure by a top-tier global investment bank from China's securities segment. ~UPDATE 2-JPMorgan in talks to sell out of Chinese securities JV * Exit would be first by a top-tier global investment bank   (Adds details, comments, background on Chinese securities JVs) ~
INTC.O,UPDATE 2-EU court adviser backs Intel fight against record EU fine LUXEMBOURG/BRUSSELS, Oct 20 Intel's  fight against a record 1.06 billion euro  ($1.16 billion) EU antitrust fine received a boost on Thursday when a top Europe court adviser questioned whether the U.S. chipmaker's actions had really harmed competition. ~EU court adviser backs Intel appeal against EU fine LUXEMBOURG, Oct 20 A lower court should review U.S. chipmaker Intel's challenge against a record 1.06-billion-euro ($1.16 billion) fine levied by EU antitrust regulators seven years ago, an adviser to Europe's top court said on Thursday. ~
JPM,JPMorgan in talks to sell out of Chinese securities JV HONG KONG JPMorgan Chase & Co is in talks to sell out of a Chinese securities joint venture with First Capital Securities Co Ltd in what would be the first departure by a top-tier global investment bank from China's securities segment. ~First Capital in talks to buy JPMorgan stake in Chinese securities JV HONG KONG, Oct 20 Chinese broker First Capital Securities Co Ltd said on Thursday it is in talks with JPMorgan Chase & Co over the purchase of the U.S. bank's minority stake in a Chinese joint venture. ~
MRK,EU mergers and takeovers (Oct 20) BRUSSELS, Oct 20 The following are mergers under review by the European Commission and a brief guide to the EU merger process: ~UPDATE 2-Roche bets on new cancer drugs to offset patent expiries * Keeps full-year outlook   (Adds CEO, analyst comment, updates shares) ~
MSFT.O,UPDATE 4-Microsoft shares hit high as cloud business flies above estimates Oct 20 Microsoft Corp said sales of its flagship cloud product doubled in its first quarter, propelling earnings above analysts' estimates and sending its shares to an all-time high, breaking past a level hit in 1999 at the peak of the tech stock bubble. ~BRIEF-Microsoft reports Q1 GAAP earnings of $0.60 per share * Quarterly diluted earnings per share was $0.60 GAAP, and $0.76 non-GAAP ~Microsoft adjusted revenue rises 3.1 pct Oct 20 Microsoft Corp reported a 3.1 percent rise in adjusted revenue on Thursday as growth in its cloud business helped offset weakness in the personal computer market. ~
MS,Morgan Stanley, Citi vying to clear yuan trades in U.S.: executive  (This October 19 story makes clear in paragraph 3 that Xu is head of Bank of China in New York) ~
NUE,REFILE-UPDATE 1-Higher steel prices lift Nucor profit but lower Q4 earnings seen DETROIT, Oct 20 Steelmaker Nucor Corp on Thursday reported a higher net profit in the third quarter, as its average steel price per ton increased 2 percent over the same period last year. ~Nucor third-quarter profit rises on higher steel prices DETROIT, Oct 20 Steelmaker Nucor Corp on Thursday reported a higher quarterly net profit, as its average steel price per ton increased 2 percent over the same period last year. ~BRIEF-Nucor Corp reports Q3 results * Nucor reports results for third quarter and nine months of 2016 ~
PYPL.O,UPDATE 3-PayPal's shares rally on revenue beat, margin forecast * Expects adj. oper margin to be stable or grow in next 3 yrs ~BRIEF-Paypal Holdings Q3 non-GAAP earnings per share $0.35 * Q3 revenue $2.667 billion versus I/B/E/S view $2.65 billion ~
PPG,BRIEF-PPG Industries Q3 loss per share $0.75 from continuing operations * Q3 adjusted earnings per share $1.56 from continuing operations ~
PHM,UPDATE 2-Pulte sees margin hit from rising land, labor costs * Shares fall as much as 6 pct   (Adds details from conference call, shares) ~BRIEF-PulteGroup may face production delivery delays in some areas * Expects Q4 and 2017 margins to be in range of 20.5% to 21% - conf call ~BRIEF-Pultegroup reports Q3 earnings per share $0.37 * Q3 earnings per share view $0.44 -- Thomson Reuters I/B/E/S ~Homebuilder PulteGroup's revenue rises 28.9 pct Oct 20 U.S. homebuilder PulteGroup Inc  reported a 28.9 percent rise in quarterly revenue as it sold more homes at higher prices. ~
SLB,UPDATE 2-Schlumberger profit beats as North America activity ramps up * Excluding Cameron, N. America land revenue up 14 pct   (Adds analyst comments, details) ~Schlumberger reports 17 pct fall in revenue Oct 20Schlumberger Ltd, the world's No.1 oilfield services provider, reported a 17 percent fall in quarterly revenue, hurt by weaker drilling activity and pricing pressure. ~
SBUX.O,Starbucks plans new 'Reserve' targets in super-premium battle Starbucks Corp  Chief Executive Howard Schultz on Thursday unveiled new growth plans for the chain's upscale Reserve brand as it fights off competition from super-premium coffee rivals like Blue Bottle and Intelligentsia. ~Starbucks plans new 'Reserve' targets in super-premium battle Oct 20 Starbucks Corp Chief Executive Howard Schultz on Thursday unveiled new growth plans for the chain's upscale Reserve brand as it fights off competition from super-premium coffee rivals like Blue Bottle and Intelligentsia. ~
TXT,UPDATE 3-Textron to restructure aviation business as biz jet slump persists Oct 20 Textron Inc said on Thursday it would restructure its aviation business, which makes Cessna aircraft, citing a "stubbornly soft" market for business jets. ~BRIEF-Textron says decided to take additional restructuring actions * Textron Inc decided to take additional restructuring actions, principally headcount reductions, in Textron aviation segment ~Textron revenue rises 2.2 pct on higher business jets sales Oct 20 Textron Inc, the maker of Cessna aircraft and Bell Helicopters, reported a 2.2 rise in quarterly revenue, helped by higher business jets sales. ~
BK,UPDATE 2-BNY Mellon profit beats estimates as costs fall Oct 20 Bank of New York Mellon Corp  reported a better-than-expected quarterly profit as expenses dropped 1.4 percent, and the world's largest custody bank said on Thursday it expected costs to drop as much as 2 percent in 2016. ~CORRECTED-UPDATE 1-BNY Mellon profit beats estimates on lower costs Oct 20 Bank of New York Mellon Corp  reported a better-than-expected 18.8 percent jump in quarterly profit, helped by lower costs and a rise in net interest revenue. ~BRIEF-Bank of New York Mellon Q3 non-GAAP earnings per share $0.90 * BNY Mellon reports third quarter earnings of $974 million or $0.90 per common share ~BNY Mellon profit rises nearly 19 pct Oct 20 Bank of New York Mellon Corp on Thursday said third-quarter profit increased 18.8 percent as net interest revenue rose and expenses fell. ~
TRV,GLOBAL MARKETS-Dollar hits 7-mth high on ECB's Draghi, pressures oil, stocks * Global gauge of equities hits one-week high, then falls   (Updates to U.S. market close) ~UPDATE 1-Insurer Travelers reports 22.8 pct fall in profit Oct 20 Property and casualty insurer Travelers Cos Inc reported a 22.8 percent fall in quarterly net profit on Thursday as gains from underwriting declined. ~Insurer Travelers reports 22.8 pct fall in profit Oct 20 Property and casualty insurer Travelers Cos Inc reported a 22.8 percent fall in quarterly net profit due to weaker underwriting. ~
DIS,UPDATE 2-Mediaset says Vivendi ends interim management accord over pay-TV unit * Broadcaster's interim management limits spending   (Adds Mediaset statement, recasts lead) ~Google signs CBS, in talks with others on web TV: sources Alphabet Inc's  Google has reached an agreement with CBS Corp  to carry the network on its planned web TV service and is in advanced talks with 21st Century Fox , Walt Disney Co  and Viacom Inc  to distribute their channels, people with knowledge of the talks told Reuters on Wednesday. ~UPDATE 3-Google signs CBS, in talks with others on web TV -sources Oct 19 Alphabet Inc's Google has reached an agreement with CBS Corp to carry the network on its planned web TV service and is in advanced talks with 21st Century Fox, Walt Disney Co and Viacom Inc  to distribute their channels, people with knowledge of the talks told Reuters on Wednesday. ~
TWX,Google signs CBS, in talks with others on web TV: sources Alphabet Inc's  Google has reached an agreement with CBS Corp  to carry the network on its planned web TV service and is in advanced talks with 21st Century Fox , Walt Disney Co  and Viacom Inc  to distribute their channels, people with knowledge of the talks told Reuters on Wednesday. ~UPDATE 3-Google signs CBS, in talks with others on web TV -sources Oct 19 Alphabet Inc's Google has reached an agreement with CBS Corp to carry the network on its planned web TV service and is in advanced talks with 21st Century Fox, Walt Disney Co and Viacom Inc  to distribute their channels, people with knowledge of the talks told Reuters on Wednesday. ~
UNP,Despite U.S. campaign rhetoric, Union Pacific CEO upbeat on TPP DETROIT The top executive of railroad Union Pacific Corp said on Thursday that despite negative election campaign rhetoric about free trade agreements, they have benefited the U.S. economy and he is optimistic Congress will pass the Trans Pacific Partnership. ~UPDATE 4-Falling freight hurts Union Pacific 3rd-qtr profit; stock slides DETROIT, Oct 20 Union Pacific Corp  reported a lower-than-expected quarterly profit as freight volumes declined and it forecast a further drop in the current period due partly to the strong U.S. dollar and soft demand for consumer goods. ~BRIEF-Union Pacific Q3 EPS $1.36 * Q3 earnings per share view $1.40 -- Thomson Reuters I/B/E/S ~Union Pacific Q3 profit falls as freight volumes drop 6 percent DETROIT, Oct 20 No. 1 U.S. railroad Union Pacific Corp on Thursday reported a lower quarterly net profit, citing a 6 percent drop in freight volumes amid a 14 percent decline in coal. ~
VAR,Varian Medical Systems draws well-timed option bets NEW YORK, Oct 20 Bullish options on Varian Medical Systems Inc stock saw unusually heavy buying on Thursday before the shares spiked on an unsubstantiated report that General Electric could be in talks with the medical devices company about a possible takeover. ~
VZ,GLOBAL MARKETS-Dollar hits 7-mth high on ECB's Draghi, pressures oil, stocks * Global gauge of equities hits one-week high, then falls   (Updates to U.S. market close) ~US STOCKS-Wall St dips as Verizon drags; AmEx curbs losses * Dow up 0.09 pct, S&P; down 0.11 pct, Nasdaq down 0.15 pct   (Updates to late afternoon, changes byline) ~UPDATE 4-Verizon revenue drops as subscriber additions disappoint Oct 20 Verizon Communications Inc added fewer than expected wireless subscribers in the third quarter due to intense competition, and indicated it may renegotiate a deal to buy Yahoo Inc after a breach of Yahoo user email accounts. ~US STOCKS-Wall St falls as weak earnings dent optimism; oil drags * Indexes down: Dow 0.36 pct, S&P; 0.42 pct, Nasdaq 0.48 pct   (Adds details, comments, updates prices) ~US STOCKS-Wall St flat amid mixed earnings reports * Indexes down: Dow 0.02 pct, S&P; 0.1 pct, Nasdaq 0.1 pct   (Updates to open) ~BRIEF-Verizon Q3 adj non-GAAP earnings per share $1.01 * Q3 revenue $30.9 billion versus I/B/E/S view $31.14 billion ~Verizon reports 6.7 pct fall in 3rd-qtr revenue Oct 20 Verizon Communications Inc, the No. 1 U.S. wireless carrier that has agreed to buy Yahoo Inc's  core business, reported a 6.7 percent drop in quarterly revenue on Thursday as it discounted heavily to attract subscribers. ~
WMT,Wal-Mart to open Sam's Club on JD.com Oct 20 Wal-Mart Stores Inc said it was launching its warehouse retail business Sam's Club and a store for imported products on JD.com Inc's platform, three months after the world's largest retailer took a stake in the no. 2 Chinese e-commerce company. ~
WBA.O,Walgreens sees Rite Aid deal closing in early 2017 Drugstore chain Walgreens  said it expected its Rite Aid acquisition  to close three months later than planned, and included the smaller rival's profit in its full-year forecast, suggesting the company expected the deal to win regulatory approval. ~UPDATE 3-Walgreens sees Rite Aid deal closing in early 2017 * Forecasts FY adj. profit of $4.85-$5.20/shr, includes Rite Aid ~BRIEF-Walgreens CEO on conf call- Included some part of Rite Aid potential profit in our guidance, confident about this deal * On conf call-  seeing impact of action in tobacco where we have reduced base and visibility,  focusing on helping customers who want to stop smoking ~Walgreens profit jumps, Rite Aid deal seen closing in 2017 Oct 20 Walgreens Boots Alliance Inc, the largest U.S. drugstore operator by store count, reported a jump in quarterly profit, helped by cost-cutting and said it now expected its acquisition of Rite Aid Corp to close in early 2017. ~BRIEF-Walgreens Boots Alliance posts Q4 adjusted earnings $1.07/share * Walgreens Boots Alliance reports fourth quarter and fiscal 2016 results ~BRIEF-Walgreens Boots Alliance and Rite Aid report extension of merger agreement end date * Companies now expect transaction will close in early calendar 2017. ~
WFC,UPDATE 1-Bank rewards must promote good conduct -Fed's Dudley NEW YORK, Oct 20 Banks need to continue to monitor the way they reward employees to ensure they promote good conduct, one of the top U.S. financial regulators said on Thursday. ~Wells scandal shows bank culture still a problem -Fed's Dudley NEW YORK, Oct 19 The scandal at Wells Fargo & Co , which opened millions of unauthorized accounts, "underscores that we have a lot more work" to do to fix the culture within big U.S. banks, one of the country's top financial regulators said on Wednesday. ~
