BBT,TRUMP TEAM SAYS NO CABINET LEVEL ANNOUNCEMENTS UNTIL AFTER THE WEEKEND TRUMP TEAM SAYS NO CABINET LEVEL ANNOUNCEMENTS UNTIL AFTER THE WEEKEND ~
COP,Norway approves hike in Troll's 2016 oil output quota-letter OSLO, Nov 25 Norway's oil and energy ministry has approved a hike in the 2016 oil output quota of the North Sea Troll field to 46.5 million barrels from 41.7 million, giving it the highest output level since 2009, document obtained by Reuters showed on Friday. ~
DAL,Delta pilots oppose big regional jets, could be issue for Embraer, Mitsubishi MONTREAL Delta Air Lines Inc  pilots are expected to keep existing rules in their new labor contract that prevent the U.S. No. 2 carrier from flying aircraft above a certain weight on regional routes, in a blow to Embraer SA  and Mitsubishi Heavy Industries Ltd , whose latest models exceed that limit. ~UPDATE 1-Delta pilots oppose big regional jets, could be issue for Embraer, Mitsubishi MONTREAL, Nov 25 Delta Air Lines Inc  pilots are expected to keep existing rules in their new labor contract that prevent the U.S. No. 2 carrier from flying aircraft above a certain weight on regional routes, in a blow to Embraer SA and Mitsubishi Heavy Industries Ltd , whose latest models exceed that limit. ~Delta pilots oppose larger regional aircraft, in blow to Embraer -sources MONTREAL, Nov 25 Delta Air Lines Inc  pilots are expected to keep existing rules in their new labor contract that prevent the U.S. No. 2 carrier from flying aircraft above a certain weight on regional routes, in a blow to Embraer SA and Mitsubishi Heavy Industries Ltd , whose latest models exceed that limit. ~
GGP,Brazil's Aliansce considering mall M&A;, sees prices as high SAO PAULO, Nov 25 Aliansce Shopping Centers SA is eyeing several acquisition targets across Brazil's mall industry as a way to fuel growth in the near term, although prices seem too stretched at this point, Chief Executive Officer Renato Rique said on Friday. ~
GS,Bids for Goldman-backed Daesung Gases due soon, deal seen worth $1.3 bln SEOUL, Nov 25 South Korea's Daesung Industrial Gases, nearly half-owned by Goldman Sachs, will be put up for auction with first-round bids due in early December - a deal reportedly worth about 1.5 trillion won ($1.3 billion). ~
IBM,IBM 'failed' on Australia's census - Australian PM SYDNEY, Nov 25 International Business Machines Corp failed in its handling of the A$10 million ($7.4 million) IT contract for Australia's first predominantly online census, Australian Prime Minister Malcolm Turnbull said on Friday. ~
JNJ,Actelion confirms Johnson & Johnson approach ZURICH Actelion  has confirmed it has been approached by Johnson & Johnson  about a possible transaction to take over the Swiss drugmaker. ~Actelion confirms Johnson & Johnson approach ZURICH, Nov 25 Actelion has confirmed it has been approached by Johnson & Johnson about a possible transaction to take over the Swiss drugmaker. ~Actelion shares surge on reported J&J; takeover approach ZURICH/FRANKFURT, Nov 25 Shares in Actelion Ltd  jumped as much as 19 percent to record highs on Friday on reports that U.S. healthcare company Johnson & Johnson  was interested in a takeover of the fast-growing Swiss biotechnology firm. ~European shares head for 3rd week of gains, Actelion leads LONDON, Nov 25 European shares edged higher on Friday, heading for their third straight week of gains, with drugmakers leading the market after Swiss biotechnology firm Actelion surged on a report of a takeover approach by Johnson & Johnson. ~J&J; makes takeover approach for Swiss drugmaker Actelion: Bloomberg U.S. healthcare company Johnson & Johnson has approached Swiss biotechnology firm Actelion Ltd about a potential takeover, Bloomberg reported on Thursday, citing people it said were familiar with the matter. ~European shares edge lower but head for 3rd week of gains LONDON, Nov 25 European shares edged lower in early trading on Friday, with weaker oil prices hurting energy stocks and Italian lenders dragging down European banking index. ~UPDATE 3-J&J; makes takeover approach for Swiss drugmaker Actelion - Bloomberg Nov 25 U.S. healthcare company Johnson & Johnson  has approached Swiss biotechnology firm Actelion Ltd  about a potential takeover, Bloomberg reported on Thursday, citing people it said were familiar with the matter. ~Costly leukemia pill wins UK green light after price cut LONDON A costly blood cancer pill sold in Europe by Johnson & Johnson will be made routinely available to certain patients in Britain with chronic lymphocytic leukemia, after the U.S. company agreed to cut the price. ~
M,BRIEF-Macy's CEO Terry Lundgren on CNBC - Apparel sales picking up on Thanksgiving Day , Black Friday * Macy's CEO Terry Lundgren on CNBC - Seeing apparel sales picking up on Thanksgiving Day , Black Friday ~
SBUX.O,UPDATE 2-India's Tata Steel removes Cyrus Mistry as chairman * EGM on Dec. 21 to remove Mistry as Tata Steel director   (Adds details from source, background) ~
WFC,Wells Fargo employees sue over funds in retirement plans Wells Fargo & Co  faces a new U.S. lawsuit claiming that it funneled more than $3 billion of employee retirement savings into expensive, underperforming proprietary mutual funds to enrich itself. ~Wells Fargo employees sue over funds in retirement plans Nov 25 Wells Fargo & Co faces a new U.S. lawsuit claiming that it funneled more than $3 billion of employee retirement savings into expensive, underperforming proprietary mutual funds to enrich itself. ~Wells Fargo asks U.S. court to dismiss account scandal lawsuit NEW YORK Wells Fargo & Co has asked a U.S. court to order dozens of customers who are suing the bank over the opening of unauthorized accounts to resolve their disputes in private arbitrations instead of court, according to legal documents. ~Wells Fargo asks U.S. court to dismiss account scandal lawsuit NEW YORK Wells Fargo & Co  has asked a U.S. court to order dozens of customers who are suing the bank over the opening of unauthorized accounts to resolve their disputes in private arbitrations instead of court, according to legal documents. ~UPDATE 2-Wells Fargo asks U.S. court to dismiss account scandal lawsuit NEW YORK, Nov 24 Wells Fargo & Co has asked a U.S. court to order dozens of customers who are suing the bank over the opening of unauthorized accounts to resolve their disputes in private arbitrations instead of court, according to legal documents. ~
