ABT,EU mergers and takeovers (Nov 3) BRUSSELS, Nov 3 The following are mergers under review by the European Commission and a brief guide to the EU merger process: ~Abbott offers EU concessions over $25 billion St. Jude deal BRUSSELS Medical device maker Abbott Laboratories  has offered concessions in an attempt to secure EU antitrust approval for its $25 billion bid for St Jude Medical Inc , according to the European Commision. ~Abbott offers EU concessions over $25 bln St Jude deal BRUSSELS, Nov 3 Medical device maker Abbott Laboratories has offered concessions in an attempt to secure EU antitrust approval for its $25 billion bid for St Jude Medical Inc, according to the European Commision. ~
ATVI.O,Activision raises full-year forecast, Q3 revenue tops estimates Nov 3 Activision Blizzard Inc reported higher-than-expected revenue for the third quarter, boosted by the success of its "World of Warcraft: Legion" and "Overwatch" videogames as well as its acquisition of "Candy Crush" mobile game-maker King. ~
APA,UPDATE 1-Oil producer Apache posts smaller-than-expected loss Nov 3 Oil and gas producer Apache Corp  reported a smaller-than-expected quarterly loss as the company's cost-cutting measures helped offset weak oil prices. ~BRIEF-Apache Qtrly revenue $1.44 billion versus $1.53 billion * Reported a loss of $607 million or $1.60 per diluted common share during the third quarter of 2016 ~Oil and gas producer Apache reports smaller quarterly loss Nov 3 Oil and gas producer Apache Corp's  quarterly loss narrowed as the company recorded a smaller charge, mainly related to asset impairments. ~
BA,Boeing wins $479 mln U.S. defense contract -Pentagon WASHINGTON, Nov 3 Boeing Co has been awarded a $478.79 million contract for engineering manufacturing and development of a Passive/Active Warning and Survivability System for the F-15 Eagle fighter jet, the Pentagon said on Thursday. ~
CBS,UPDATE 3-CBS results top Street, Viacom merger exploration at early stage Nov 3 CBS Corp, owner of the most-watched U.S. television network, reported results that exceeded Wall Street expectations and said it was still in the early stages of exploring a merger with Viacom Inc, a deal favored by its controlling shareholders. ~CBS Corp revenue rises 4.3 percent Nov 3 CBS Corp, owner of the most-watched U.S. TV network, reported a 4.3 percent rise in quarterly revenue, helped by increase in fees from CBS-affiliated stations as well as growth from digital distribution platforms. ~Viacom in talks to buy Telefonica's Telefe for around $385 million: sources Viacom Inc , the owner of Comedy Central, Nickelodeon and MTV, is in talks to acquire Argentine broadcaster Television Federal SA from phone carrier Telefonica SA  for up to $385 million, according to people familiar with the deal. ~Viacom in talks to buy Telefonica's Telefe for around $385 million -sources Nov 3 Viacom Inc, the owner of Comedy Central, Nickelodeon and MTV, is in talks to acquire Argentine broadcaster Television Federal SA from phone carrier Telefonica SA for up to $385 million, according to people familiar with the deal. ~
CHK,Chesapeake Energy expects to exit 2017, 2018 with higher output U.S. natural gas producer Chesapeake Energy Corp  reported a surprise adjusted profit, helped by lower expenses, and said it expects to exit the next two years at higher production rates. ~UPDATE 3-Chesapeake Energy expects to exit 2017, 2018 with higher output Nov 3 U.S. natural gas producer Chesapeake Energy Corp reported a surprise adjusted profit, helped by lower expenses, and said it expects to exit the next two years at higher production rates. ~Natgas producer Chesapeake posts smaller quarterly loss Nov 3 U.S. natural gas producer Chesapeake Energy Corp <CHK.N reported a smaller quarterly loss, compared with a year ago, when it wrote down the value of some oil and gas assets by $5.42 billion. ~
CVX,Enel pulls out of bidding for Chevron's Indonesian geothermal assets PARIS, Nov 3 Italy's biggest utility Enel  has decided not to bid for Indonesian geothermal assets being sold by U.S. energy giant Chevron Corp, Enel's CEO said on Thursday. ~Indonesia's PLN pulls out of bid for Chevron geothermal units JAKARTA Indonesia's PT Perusahaan Listrik Negara (PLN)[PLNEG.UL] has opted out of a tender for geothermal assets on offer from U.S. energy giant Chevron Corp, citing governance concerns, an official at the state electricity utility said on Thursday. ~Indonesia's PLN pulls out of bid for Chevron geothermal units JAKARTA, Nov 3 Indonesia's PT Perusahaan Listrik Negara (PLN) has opted out of a tender for geothermal assets on offer from U.S. energy giant Chevron Corp, citing governance concerns, an official at the state electricity utility said on Thursday. ~
CI,Health insurer Cigna won't expand Obamacare to more states Health insurer Cigna Corp  said on Thursday it would not expand its individual Obamacare plans into more states next year, joining an industry pullback from the struggling business. ~UPDATE 3-Health insurer Cigna won't expand Obamacare to more states Nov 3 Health insurer Cigna Corp said on Thursday it would not expand its individual Obamacare plans into more states next year, joining an industry pullback from the struggling business. ~BRIEF-Cigna Q3 adjusted operating earnings per share $1.94 * Projected adjusted income from operations per share is now estimated to be in range of $7.80 to $8.05 in 2016 ~U.S. health insurer Cigna's revenue rises 5.2 pct Nov 3 U.S. health insurer Cigna Corp  reported a 5.2 percent rise in quarterly revenue as it added more members to its commercial business. ~
C,MOVES-Citi appoints Maria Hackley global co-head of industrials Nov 3 Maria Hackley has been appointed global co-head of the industrials group at Citigroup Inc, according to an internal memo obtained by Reuters. ~
CMCSA.O,UPDATE 3-CBS results top Street, Viacom merger exploration at early stage Nov 3 CBS Corp, owner of the most-watched U.S. television network, reported results that exceeded Wall Street expectations and said it was still in the early stages of exploring a merger with Viacom Inc, a deal favored by its controlling shareholders. ~
CVS,CVS Health to cut about 600 jobs over next two months Nov 3 CVS Health Corp said it would cut about 600 jobs, mostly at its corporate offices in Rhode Island, Illinois and Arizona over the next two months, citing an increasingly competitive environment. ~BRIEF-CVS Health says eliminating small percentage of positions in Nov and Dec 2016 * CVS Health Corp - eliminating a small percentage of positions at CVS health in November and December 2016 ~BRIEF-CVS Health Inc to eliminate 600 jobs - WSJ, citing statement * CVS Health Inc to eliminate 600 jobs - WSJ, citing statement ~
DOW,Australia watchdog has concerns on Du Pont, Dow merger SYDNEY, Nov 3 Australia's corporate watchdog said on Thursday it had competition concerns about the planned $130 billion merger  between DuPont and Dow Chemical Co  and was in touch with overseas regulators on the deal. ~
DD,Australia watchdog has concerns on Du Pont, Dow merger SYDNEY, Nov 3 Australia's corporate watchdog said on Thursday it had competition concerns about the planned $130 billion merger  between DuPont and Dow Chemical Co  and was in touch with overseas regulators on the deal. ~
EOG,EOG Resources posts smaller quarterly loss Nov 3 Oil producer EOG Resources Inc's  loss in the third quarter was smaller than a year earlier the company took an impairment charge of more than $6 billion. ~BRIEF-EOG Resources announces third quarter 2016 results * EOG Resources Inc - Increases 2020 crude oil production CAGR outlook to 15 to 25 percent ~
FB.O,Stocks slip on U.S. election nerves; pound up on Brexit ruling NEW YORK Global equity prices drifted lower on Thursday as worries about the U.S. presidential election continued to weigh on investor sentiment, while sterling rose after a UK court ruled that the British government needed Parliament's approval to trigger Brexit. ~GLOBAL MARKETS-Stocks slip on U.S. election nerves; pound up on Brexit ruling * Oil prices dip down on inventory boost, OPEC skepticism   (Adds U.S. markets close; updates throughout) ~US STOCKS-S&P; 500 losing streak runs to 8 days as Facebook weighs * Indexes down: Dow 0.16 pct, S&P; 0.44 pct, Nasdaq 0.92 pct   (Updates to close of U.S. markets) ~US STOCKS SNAPSHOT-S&P; 500 falls for 8th straight session NEW YORK, Nov 3 The S&P; 500 fell for an eighth straight session on Thursday, its longest losing streak since the 2008 financial crisis, as Facebook shares weighed and investors grappled with uncertainty over next week's U.S. presidential election. ~US STOCKS-Facebook drags on Wall St; S&P; 500 set to extend losing streak * Indexes down: Dow 0.02 pct, S&P; 0.29 pct, Nasdaq 0.69 pct   (Updates to late afternoon) ~Drop in Facebook's stock makes for good time to connect: analysts Facebook Inc's  shares fell as much as 5.5 percent in early trading on Thursday, wiping out about $20 billion of market value. | Video  ~US STOCKS-U.S. stocks dip as Facebook, election worries weigh * Indexes down: Dow 0.10 pct, S&P; 0.31 pct, Nasdaq 0.61 pct   (Updates to early afternoon) ~Goldman, JPMorgan, Morgan Stanley defeat appeal over Facebook IPO Goldman Sachs Group Inc, JPMorgan Chase & Co and Morgan Stanley need not forfeit their estimated $100 million of profit from trading Facebook Inc  stock soon after underwriting its May 2012 initial public offering, a federal appeals court said on Thursday. ~Goldman, JPMorgan, Morgan Stanley defeat appeal over Facebook IPO NEW YORK Goldman Sachs Group Inc , JPMorgan Chase & Co  and Morgan Stanley  need not forfeit their estimated $100 million of profit from trading Facebook Inc  stock soon after underwriting its May 2012 initial public offering, a federal appeals court said on Thursday. ~
F,UPDATE 3-American Axle's $1.6 bln Metaldyne buy to help grow beyond GM * Deal expected to close in first half of 2017   (Adds Breakingviews link, updates share prices) ~
GM,Ford Canada posts decline in October sales in delayed results TORONTO Ford Motor Co.  reported weaker Canadian sales for October on Wednesday, weighed down by a sharp drop in car sales and sluggish truck performance. ~Ford Canada posts decline in October sales in delayed results TORONTO, Nov 2 Ford Motor Co. reported weaker Canadian sales for October on Wednesday, weighed down by a sharp drop in car sales and sluggish truck performance. ~
GS,Goldman Sachs, Paulson settle fraud lawsuit over Abacus NEW YORK Goldman Sachs Group Inc  has settled a 2011 lawsuit claiming the investment bank fraudulently induced a bond insurer to guarantee payments on the doomed Abacus collateralized debt obligation ahead of the financial crisis. ~Goldman Sachs, Paulson settle fraud lawsuit over Abacus NEW YORK, Nov 3 Goldman Sachs Group Inc  has settled a 2011 lawsuit claiming the investment bank fraudulently induced a bond insurer to guarantee payments on the doomed Abacus collateralized debt obligation ahead of the financial crisis. ~Trump wants ex-Goldman partner Mnuchin to run U.S. Treasury: Fox Business WASHINGTON Republican Donald Trump wants his campaign finance chairman, Steven Mnuchin, to be his Treasury secretary if he wins next week's U.S. presidential election, Fox Business Network reported on Thursday, citing sources. ~MOVES-Deutsche's Leake heads to Goldman Sachs LONDON, Nov 3 (IFR) - Goldman Sachs has hired Tom Leake to run EMEA equity structuring, based in London. Leake joins from Deutsche Bank where he was global head of the equity structuring group. ~BRIEF-Goldman Sachs updates on top end of legal loss estimate at Sept-end * Goldman Sachs Group Inc - Estimates upper end of reasonably possible aggregate legal loss of about $1.7 billion in excess of the aggregate reserves as of September-end ~
IBM,Thai Kasikornbank, IBM join forces on blockchain network BANGKOK, Nov 3 Thailand's Kasikornbank Pcl  has joined with the Thai unit of International Business Machines Corp to develop blockchain services in a bid to save costs and speed up transaction process, the companies said on Thursday. ~
JPM,JPMorgan plants digital payment flag at Wal-Mart NEW YORK, Nov 3 JPMorgan Chase & Co is putting its "Chase Pay" digital wallet on Wal-Mart's website and in the retailer's Walmart Pay app, hoping to give customers more ways to make purchases without cash, a bank executive said on Thursday. ~BRIEF-JPMorgan expects card net revenue rate to dip to around 10 percent in Q4 * JPMorgan expects card net revenue rate to dip to around 10 percent in Q4, then rebound in 2017- Executive ~
KHC.O,UPDATE 1-Kraft Heinz 3rd-qtr sales dip 1.5 pct, below estimates Nov 3 Kraft Heinz Co, the maker of Velveeta cheese, Heinz ketchup and Oscar Mayer meats, reported on Thursday quarterly sales fell 1.5 percent, as the company continues to cope with changing consumer tastes. ~BRIEF-Kraft Heinz sets regular quarterly dividend of $0.60per share * Sets regular quarterly dividend of $0.60per share  Source text for Eikon:  Further company coverage: ~Kraft Heinz sales fall 1.5 pct Nov 3 Kraft Heinz Co, the maker of Velveeta cheese, Heinz ketchup and Oscar Mayer meats, reported a 1.5 percent fall in quarterly adjusted sales, hit by a stronger dollar and pricing pressure in Europe. ~BRIEF-Kraft Heinz Q3 sales $6.3 bln vs. I/B/E/S view $6.3 bln * Kraft Heinz Co qtrly pro forma net sales $6,267 million versus $6,363 million last year ~
MYL.A,BRIEF-Biocon says EMA accepts for review Mylan's regulatory submission for insulin glargine * Mylan and Biocon announce regulatory submission for insulin glargine accepted for review by European Medicines Agency ~BRIEF-Strides Shasun, Mylan agree to settle regulatory, general claims on Agila deal * Strides Shasun Ltd says co, Mylan agree to settle regulatory and general claims on Agila transaction ~
QRVO.O,BRIEF-Qorvo announces $500 million share repurchase program * New repurchase program includes approximately $159 million authorized on a prior program that was set to expire on november 4, 2016 ~
SBUX.O,UPDATE 4-Starbucks posts higher quarterly revenue, issues cautious forecast Nov 3 Starbucks Corp reported better-than-expected quarterly results on Thursday, as sales in the U.S.-dominated Americas region soothed concerns that the world's biggest coffee seller had succumbed to a broader restaurant slump. ~BRIEF-Starbucks Corp - board approves 25% increase in quarterly dividend * Starbucks Corp - board of directors approves 25% increase in quarterly dividend to $0.25 per share  Source text for Eikon:  Further company coverage: ~Starbucks has locked in two-thirds of 2017 coffee needs NEW YORK Starbucks Corp has locked in two-thirds of its fiscal 2017 coffee needs and expects prices will be "a little" favorable, but likely offset by foreign exchange pressures, Chief Financial Officer Scott Maw said on Thursday. ~Starbucks Americas region same-store sales meet expectations Nov 3 Starbucks Corp reported sales at established U.S. cafes that matched analysts' expectations, sending its shares up almost 4 percent in extended trading. ~
SYMC.O,BRIEF-Symantec announces CFO transition * Symantec Corp - Thomas Seifert, exec-VP and Chief Financial Officer, has informed board of directors of his plans to step down as CFO ~
TGT,Target's leadership shakeup continues, grocery chief steps down CHICAGO, Nov 2 Target Corp said on Wednesday its grocery chief is stepping down, as the retailer struggles to overhaul a key business and attract more shoppers to visit its grocery aisles. ~
UNH,UPDATE 3-Health insurer Cigna won't expand Obamacare to more states Nov 3 Health insurer Cigna Corp said on Thursday it would not expand its individual Obamacare plans into more states next year, joining an industry pullback from the struggling business. ~
WMT,JPMorgan plants digital payment flag at Wal-Mart NEW YORK, Nov 3 JPMorgan Chase & Co is putting its "Chase Pay" digital wallet on Wal-Mart's website and in the retailer's Walmart Pay app, hoping to give customers more ways to make purchases without cash, a bank executive said on Thursday. ~BRIEF-Walmart to accept Chase Pay * Chase - Walmart  will accept chase pay on walmart.com, within Walmart mobile application and in its stores through Walmart pay app  Source text for Eikon:  Further company coverage: ~
WFC,Pennsylvania Treasury suspends Wells Fargo from trading Nov 3 Pennsylvania Treasurer Timothy Reese said on Thursday that he suspended Wells Fargo & Co from any treasury investment or trading activities in the state for a year because of its "fraudulent" accounts scandal. ~BRIEF-Pennsylvania Treasurer suspends Wells Fargo from any Treasury investment for one year * Pa treasury suspends wells fargo from investment and trading activities ~Wells Fargo CEO sees 'relatively quick' review of sales practices Wells Fargo & Co's  CEO Tim Sloan said on Thursday a comprehensive review of the bank's sales practices would be done 'relatively quickly' and unveiled a series of immediate changes at the bank's retail unit under new division boss Mary Mack. ~Wells Fargo leaders discuss ongoing review to address sales problems Nov 3 Wells Fargo & Co CEO Tim Sloan and retail banking head Mary Mack announced further steps to address sales problems. SLOAN SAYS OCTOBER SALES METRICS WILL BE SOFTER THAN SEPTEMER CEO SLOAN: WE EXPECT EFFICIENCY RATIO TO REMAIN AT ELEVATED LEVEL CEO SAYS INDEPENDENT CONSULTANT WILL REVIEW SALES PRACTICES ACROSS COMPANY, BEYOND WHAT IS REQUIRED BY CONSENT ORDER CEO SAYS BANK ASSISTING TEAM MEMBERS WHO WERE FIRED FOR NOT MEETING SALES GOALS MACK SAYS SHE WILL FOCUS WITH NEW RISK MA ~Wells Fargo says litigation costs could exceed provisions by $1.7 billion Wells Fargo & Co, under fire for its sales tactics, said on Thursday its litigation costs could rise as much as $1.7 billion more than the amount it had already earmarked in provisions. ~Wells Fargo says litigation costs could exceed provisions by $1.7 bln Nov 3 Wells Fargo & Co, under fire for its sales tactics, said on Thursday its litigation costs could rise as much as $1.7 billion more than the amount it had already earmarked in provisions. ~
