LLY,US STOCKS-Strong earnings boost S&P;, Dow; Alphabet drags Nasdaq * Dow up 0.49 pct, S&P; up 0.34 pct, Nasdaq down 0.06 pct (Adds details, changes comment, updates prices) ~BRIEF-Eli lilly says seeks external early cancer assets * Eli Lilly says intends to be more active seeking external preclinical and early stage immuno-oncology assets ~Drugmaker Lilly's profit jumps 35 percent July 25 Eli Lilly and Co on Tuesday reported a 35 percent rise in quarterly profit as the U.S. drugmaker benefited from higher sales of its diabetes treatment Trulicity as well as its psoriasis drug Taltz. ~
MCD,Custom burgers, $1 drinks boost McDonald's sales; shares jump McDonald's Corp  on Tuesday posted its biggest jump in global sales at established restaurants in five years, helped by stronger traffic worldwide and U.S. initiatives including drink specials and custom sandwiches. | Video  ~US STOCKS-S&P; hits record on strong earnings; Alphabet drags Nasdaq * Indexes up: Dow 0.59 pct, S&P; 0.39 pct, Nasdaq 0.07 pct (Updates to early afternoon) ~UPDATE 4-Custom burgers, $1 drinks boost McDonald's sales; shares jump July 25 McDonald's Corp on Tuesday posted its biggest jump in global sales at established restaurants in five years, helped by stronger traffic worldwide and U.S. initiatives including drink specials and custom sandwiches. ~US STOCKS-McDonald's, Caterpillar power S&P; to record * Dow up 0.46 pct, S&P; up 0.28 pct, Nasdaq down 0.21 pct (Updates to open) ~US STOCKS SNAPSHOT-S&P; hits record; Alphabet weighs on Nasdaq July 25 The S&P; hit a record high, while the Dow opened higher on Tuesday, helped by strong earnings from Caterpillar and McDonald's, but Google-parent Alphabet weighed on the tech-heavy Nasdaq. ~BRIEF-McDonald's sees 2017 capex of about $1.7 billion * Says company expects net restaurant additions to add approximately 1 percentage point to 2017 systemwide sales growth‍​ ~BRIEF-Mcdonald's reports Q2 earnings per share $1.70 * Q2 earnings per share view $1.62 -- Thomson Reuters I/B/E/S ~McDonald's U.S. same-restaurant sales beat estimates July 25 McDonald's Corp on Tuesday reported a better-than-expected increase in quarterly sales at established U.S. restaurants, helped by promotions on beverages as well as the launch of signature crafted sandwiches. ~
MCK,Three US state treasurers seek change in McKesson exec pay policy July 25 U.S. state treasurers from Illinois, Pennsylvania and West Virginia on Tuesday urged drug distributor McKesson Corp to appoint an independent chair and link executive pay with progress in combating opioid epidemic. ~BRIEF-Three U.S. state treasurers ask McKesson to help address opioid epidemic July 25 State Treasurers of Illinois, Pennsylvania and West Virginia: ~
MRK,BRIEF-Merck's investigational NNRTI, doravirine, meets primary efficacy endpoint * Merck's investigational NNRTI, doravirine, meets primary efficacy endpoint of non-inferiority to efavirenz, both in combination with other antiretroviral agents, in pivotal phase 3 trial for treatment of hiv-1 infection ~
KORS.N,Michael Kors to buy luxury shoemaker Jimmy Choo for $1.2 billion LONDON U.S. retailer Michael Kors  agreed to buy luxury shoemaker Jimmy Choo  for $1.2 billion, snapping up a British company whose towering stilettos have been made famous by celebrity customers from Princess Diana to Kendall Jenner. | Video  ~UPDATE 3-Michael Kors to buy luxury shoemaker Jimmy Choo for $1.2 bln * Jimmy Choo shares up 17 pct, Kors shares down 1.2 pct (Adds details from conference call, background, analyst comment) ~BRIEF-Michael Kors believes Jimmy Choo brand can more than double its sales to $1 bln annually * Michael Kors- believes Jimmy Choo brand can more than double its sales to $1 billion annually - conf call ~Michael Kors to buy luxury shoemaker Jimmy Choo for $1.2 billion LONDON, July 25 Michael Kors has agreed to take over luxury retailer Jimmy Choo for 896 million pounds ($1.17 billion), it said on Tuesday. ~
NEM,UPDATE 3-Rising gold production pushes Newmont past profit estimates * Shares up as much as 7.7 pct, hit 5-mth high (Adds details from conference call, updates shares) ~BRIEF-Newmont reports Q2 EPS $0.46, produces 1.4 mln ounces of gold * Q2 revenue $1.875 billion versus i/b/e/s view $1.77 billion ~Gold miner Newmont's adjusted quarterly profit jumps 60 pct July 25 Newmont Mining Corp, the world's second-biggest gold producer by market value, reported a 60 percent jump in adjusted quarterly profit on Tuesday, as production improved. ~
NLSN.N,Nielsen to track Hulu Live TV, YouTube TV viewing in U.S. ratings July 25 Nielsen Holdings Plc will begin including Hulu Live TV and Google's YouTube TV viewing in its TV ratings in the United States in an effort to capture the shift from traditional broadcast to watching shows on laptops or smartphones, the company said on Tuesday. ~BRIEF-Nielsen Holdings enters agreement with JD.com * Nielsen holdings plc -  strategic cooperation agreement with jd.com formalizing collaborative launch of a multi-touch attribution offering in china ~
PFE,Adviser charged with insider trading on Pfizer-King deal pleads guilty NEW YORK A Long Island, New York, investment adviser accused of engaging in insider trading after being tipped off about Pfizer Inc's $3.6 billion acquisition of King Pharmaceuticals Inc pleaded guilty on Tuesday, federal prosecutors said. ~Adviser charged with insider trading on Pfizer-King deal pleads guilty NEW YORK, July 25 A Long Island, New York, investment adviser accused of engaging in insider trading after being tipped off about Pfizer Inc's $3.6 billion acquisition of King Pharmaceuticals Inc pleaded guilty on Tuesday, federal prosecutors said. ~
PPG,Akzo Nobel to lose chairman who fought off PPG takeover AMSTERDAM Dutch paintmaker Akzo Nobel's  chairman will step down next April, having angered some major investors by fighting off a 26.3 billion euro ($30.6 billion) takeover bid by U.S. rival PPG Industries . | Video  ~UPDATE 3-Akzo Nobel to lose chairman who fought off PPG takeover * Akzo Nobel Q2 results fall short of expectations (Updates with reaction from Elliott Advisors) ~Akzo Nobel will hold extra shareholders' meeting on Sept. 8 AMSTERDAM, July 25 Dutch paint maker Akzo Nobel on Tuesday said it would hold an extra shareholders meeting on Sept 8, on the appointment of a new CEO and to explain its rejection of a 26.3 billion euro ($30.63 billion) takeover bid by U.S. rival PPG Industries. (Reporting by Bart Meijer; Editing by Himani Sarkar) ~
PHM,UPDATE 3-PulteGroup trims margin forecast on discounts, higher lumber prices July 25 PulteGroup Inc cut its full-year gross margin forecast, mainly due to increased discounting in its Pulte brand amid increased competition and higher lumber prices following wildfires in Canada. ~BRIEF-Pultegroup expects to deliver 5,400-5,600 homes in Q3 * Lumber tariffs, forest fires in Canadian province to put pressure on H2 - conf call Further company coverage: ~BRIEF-PulteGroup Q2 adjusted earnings per share $0.47 * Pultegroup inc - qtrly ‍home sale revenues increased 12% to $2.0 billion​ ~U.S. homebuilder PulteGroup's revenue rises 12 pct July 25 U.S. homebuilder PulteGroup Inc on Tuesday reported a 12.3 percent rise in quarterly revenue as it sold more homes at higher average prices, benefiting from a robust housing market. ~
QCOM.O,Israel's Prospera raises $15 mln in round led by Qualcomm Ventures TEL AVIV, July 25 Israeli digital farming company Prospera said on Tuesday it raised $15 million in a funding round led by Qualcomm Ventures, the investment arm of Qualcomm Inc. ~
STX.O,BRIEF-Seagate Technology appoints Dave Mosley as CEO effective October 1 * Seagate Technology Plc says has unanimously voted to appoint Dave Mosley, co's president and chief operating officer, as CEO effective October 1 ~BRIEF-Seagate Technology Q4 revenue $2.4 billion * Seagate Technology reports fiscal fourth quarter and fiscal year 2017 financial results ~
TROW.O,BRIEF-T. Rowe Price group Q2 reports Q2 earnings per share $1.50 including items * Q2 earnings per share view $1.30 -- Thomson Reuters I/B/E/S ~
TXN.O,UPDATE 1-Texas Instruments' profit beats on automotive, industrial demand July 25 Texas Instruments Inc reported a better-than-expected quarterly profit as the company benefited from higher demand for its chips from automotive and industrial customers. ~BRIEF-Texas Instruments Q2 earnings per share $1.03 * Q2 earnings per share view $0.96 -- Thomson Reuters I/B/E/S ~Texas Instruments reports 12.8 pct rise in quarterly revenue July 25 Texas Instruments Inc reported a 12.8 percent rise in quarterly revenue on Tuesday as it benefited from higher demand for its chips from automotive and industrial customers. ~
DIS,UPDATE 1-ABC News to target millennials with social video partnership July 25 Walt Disney Co's ABC News launched a partnership on Tuesday with ATTN:, a video news site focused on younger audiences, to co-produce videos for social media including Facebook Inc's Instagram and for Twitter Inc. ~ABC News to target millennials with social video partnership July 25 Walt Disney Co's ABC News on Tuesday launched a partnership with millennial-focused video news site ATTN: to co-produce videos for social media including Facebook Inc's Instagram and for Twitter Inc. ~
TWX,Democrats take aim at big companies in economic blueprint WASHINGTON U.S. Democrats unveiled an economic platform on Monday that included plans to address unfair market competition, rising pharmaceuticals costs and stagnant wages. | Video  ~
TSS,BRIEF-TSYS signs payments agreement with monetary llc * Total System Services Inc -  has signed an exclusive long-term agreement with Monetary Llc for point-of-sale industry ~
UTX,United Tech CEO says battle with plane makers could push up prices United Technologies Corp  may need to raise prices on its engines and other aerospace products if plane makers such as Boeing Co  and Airbus SE  push too aggressively into the business of selling parts and service, United Tech's  chief executive officer said on Tuesday. ~United Tech CEO says battle with plane makers could push up prices July 25 United Technologies Corp may need to raise prices on its engines and other aerospace products if plane makers such as Boeing Co and Airbus SE push too aggressively into the business of selling parts and service, United Tech's  chief executive officer said on Tuesday. ~BRIEF-UTC reports Q2 EPS $1.80 * Q2 earnings per share view $1.78 -- Thomson Reuters I/B/E/S ~United Tech quarterly revenue rises 2.7 percent July 25 United Technologies Corp, the maker of Otis Elevators, Pratt & Whitney engines and Carrier air conditioners, reported a 2.7 percent rise in quarterly revenue, helped by higher sales in three of its four business units. ~
WMT,GSK hires ex-Wal-Mart executive to transform tech operations LONDON, July 25 GlaxoSmithKline said on Tuesday it had appointed former Wal-Mart Stores executive Karenann Terrell to the new senior position of chief digital and technology officer. ~BRIEF-Walmart and JD.com expand strategic cooperation * Walmart says expanding their cooperation to further integrate their platforms, supply chains and customer resources in china ~
WBA.O,BRIEF-Walgreens Boots Alliance to enter into long-term global supply agreement with Fareva * Walgreens Boots Alliance to enter into long-term global supply agreement with Fareva ~
WFC,BRIEF-Wells Fargo & Company increases common dividend * Wells Fargo & Co - ‍third-quarter dividend represents an increase of $.01 per share, or 3 percent, from prior quarter​ Source text for Eikon: Further company coverage: ~
WDC.O,UPDATE 1-Toshiba board to meet Wednesday, weigh offers for chip unit - source * Toshiba also weighing offers from Western Digital, Foxconn -source (Adds details on auction, bidders) ~Toshiba board to meet Wednesday, weigh offers for chip unit -source TOKYO, July 25 Toshiba Corp's board is set to meet on Wednesday to weigh three offers for its chip unit, including bids from Western Digital and Taiwan's Foxconn in addition to one by a consortium which was previously a clear favourite, a source familiar with the matter said. ~
