BRKa.N,High-stakes vote on Wells Fargo board also tests proxy adviser ISS BOSTON A high-stakes shareholder vote at Wells Fargo & Co  next week will determine whether the bank has done enough to retain investor confidence after its phony-account scandal, and whether a leading proxy adviser wields enough clout to help oust most of its board. ~
CVX,DEALTALK-Canada's oil sands acquisition pool dwindles as global firms flee CALGARY, Alberta/TORONTO April 21 As international energy companies retreat from the Canadian oil sands sector because of depressed oil prices, a fast-shrinking universe of potential buyers may leave some stranded in the high-cost, capital-intensive sector. ~
DOW,BRIEF-Downer EDI says offer for Spotless Group now closed * Confirms that its offer for Spotless was not extended and has now closed. Source text for Eikon: Further company coverage: ~BRIEF-Downer EDI posts FY net profit of $181.5 million * FY total revenue and other income from ordinary activities $7.29 billion , up 6.4 percent ~BRIEF-Downer EDI says ‍offer for Spotless Group extended to 28 August 2017​ * ‍Offer for Spotless Group extended to 7pm on Monday, 28 august 2017​ Source text for Eikon: Further company coverage: ~BRIEF-Downer EDI says Spotless ‍offer extended to Aug 21, 2017​ * Spotless ‍offer extended to 7pm on monday, 21 august 2017​ Source text for Eikon: Further company coverage: ~BRIEF-Downer EDI's takeover offer for Spotless Group extended till 7pm (Sydney time) on Aug. 14 * Unconditional takeover offer for Spotless Group extended until 7:00pm (Sydney time) on Monday, 14 August Source text for Eikon: Further company coverage: (bangalore.newsroom@thomsonreuters.com) ~BRIEF-Downer extends takeover offer for Spotless Group * decided to extend Spotless offer period for one week; offer will now remain open for acceptance until 14 august Source text for Eikon: Further company coverage: ~BRIEF-Downer extends Spotless offer to August 7 2017 * ‍Downer has decided to extend offer for Spotless Group holdings to 7 pm on Monday, 7 august 2017​ Source text for Eikon: Further company coverage: ~BRIEF-Downer EDI's stake in Spotless increases to 80.3 pct * Downer's stake in Spotless increases to 80.3 pct Source text for Eikon: Further company coverage: ~BRIEF- Downer EDI Ltd'S stake in Spotless Group increases to 72% * As Downer's shareholding in Spotless is now over 70%, Downer expects that Spotless will be removed from certain S&P;/ASX market indices ~
XOM,Highlights: The Trump presidency on April 21 at 6:12 p.m. EDT/2212 GMT Highlights for U.S. President Donald Trump's administration on Friday: ~UPDATE 2-U.S. will not give Exxon permission to drill in Russia WASHINGTON/SPRING, Tx., April 21 The United States will not make an exception for American companies, including oil major Exxon Mobil Corp, seeking to drill in areas prohibited by U.S. sanctions on Russia, Treasury Secretary Steven Mnuchin said on Friday. ~Friday Morning Briefing Pyongyang’s preparing for a military celebration. That’s putting Seoul on high alert. ~Exxon probe is unconstitutional, Republican prosecutors say NEW YORK A group of 11 Republican state attorneys general are protesting an investigation into whether Exxon Mobil Corp.  violated consumer protection laws when selling fossil fuel products, according to a court filing. ~
GE,UPDATE 4-GE shares fall on cash, business worries though profit beats NEW YORK, April 21 General Electric Co reported quarterly sales and adjusted earnings results that beat analysts estimates on Friday, but its shares fell on concerns about some of its industrial businesses and its cash outflow. ~ABB, Schneider Electric bid for General Electric unit: sources European engineering groups ABB Ltd  and Schneider Electric SE  are competing for General Electric Co's  industrial solutions division, which could fetch as much as $3 billion, according to people familiar with the matter. ~ABB, Schneider Electric bid for General Electric unit -sources April 21 European engineering groups ABB Ltd and Schneider Electric SE are competing for General Electric Co's industrial solutions division, which could fetch as much as $3 billion, according to people familiar with the matter. ~General electric CEO says 'we see global growth accelerating' NEW YORK The head of General Electric said on Friday that the global economy is picking up speed even though the natural resources sector remains slow. ~General electric CEO says "we see global growth accelerating" NEW YORK, April 21 The head of General Electric said on Friday that the global economy is picking up speed even though the natural resources sector remains slow. ~GE revenue falls 1 percent April 21 General Electric Co reported a 1 percent decline in quarterly revenue on Friday, hurt by lower sales in its oil and gas and lighting businesses. ~BRIEF-General Electric reports Q1 continuing operations EPS (GAAP) of $0.10 * Says reaffirm 2017 operating framework for industrial operating + verticals EPS, organic revenue growth and industrial operating margin expansion ~
GM,BRIEF-Greenlight Capital seeking General Motors shareholders' support to elect Greenlight's three director nominees * Greenlight Capital - Seeking GM shareholders' support to elect Greenlight's three director nominees Leo Hindery, Vinit Sethi and William Thorndike Source text: [http://bit.ly/2owVfhF] Further company coverage: ~
HON,UPDATE 3-Honeywell profit beats; shares hit record high * Shares hit record high at $128.30 (Adds details from CFO interview; Updates shares) ~BRIEF-Honeywell says improving oil and gas markets will drive continued growth - Conf call * Says orders for its PMT unit, which caters to the energy industry, have been "very strong" ~Honeywell's profit rises 9 percent April 21 Diversified U.S. manufacturer Honeywell International Inc reported a 9 percent rise in quarterly profit, helped by higher-than-expected sales in its aerospace and energy businesses. ~
IPG,UPDATE 1-Ad company Interpublic's quarterly revenue misses estimates April 21 Advertising company Interpublic Group of Cos reported quarterly revenue that missed analysts' estimates as a tough economic environment slowed international growth. ~Ad company Interpublic's quarterly revenue rises marginally April 21 Interpublic Group of Cos reported a marginal rise in quarterly revenue as the advertising company's sales in the United States grew despite a tough economic environment. ~BRIEF-Interpublic Q1 earnings per share $0.05 * Q1 earnings per share view $0.03 -- Thomson Reuters I/B/E/S ~
KSU,UPDATE 2-Kansas City Southern beats expectations, stock dips on Mexico uncertainty April 21 Regional U.S. railroad Kansas City Southern beat expectations for first-quarter earnings, reporting a 36 percent jump in quarterly profit driven by an increase in overall carload volumes, including a significant rise in energy revenue. ~BRIEF-Kansas City Southern Q1 earnings per share $1.38 * Kansas City Southern reports record first quarter revenues, carloads, operating income, operating ratio and earnings per share ~Kansas City Southern profit jumps 36 pct as volumes rise April 21 Regional U.S. railroad Kansas City Southern reported a 36 percent jump in quarterly net profit on Friday, driven by an increase in overall carload volumes. ~
LLY,EMA panel recommends nod for Sanofi, Regeneron's arthritis drug April 21 A European Medicines Agency panel said on Friday it recommended granting marketing approval to Sanofi and Regeneron's experimental drug to treat rheumatoid arthritis. ~
MRK,BRIEF-Atara bio announces collaboration with Merck * Atara Bio announces collaboration with Merck to evaluate keytruda (pembrolizumab) in combination with ATA129 in nasopharyngeal carcinoma (NPC) ~
MS,BRIEF-Morgan Stanley says Klaus Kleinfeld resigned from co's board * Morgan Stanley says on April 21, 2017, Klaus Kleinfeld resigned from Morgan Stanley's board of directors, effective immediately Source text - http://bit.ly/2oSo2kh Further company coverage: ~
NFLX.O,PRESS DIGEST- British Business - April 21 April 21 The following are the top stories on the business pages of British newspapers. Reuters has not verified these stories and does not vouch for their accuracy. ~
JWN,U.S. retailers bet on Congress over Bolivia to thwart Trump  border tax issue CHICAGO Target Corp , Wal-Mart Stores Inc  and other retailers are shelving considerations to move supply bases closer to the United States in the face of a possible border tax, banking instead on killing support for the tax idea in Congress. ~UPDATE 1-U.S. retailers bet on Congress over Bolivia to thwart Trump  border tax issue CHICAGO, April 21 Target Corp, Wal-Mart Stores Inc and other retailers are shelving considerations to move supply bases closer to the United States in the face of a possible border tax, banking instead on killing support for the tax idea in Congress. ~U.S. retailers bet on Congress over Bolivia to thwart Trump border tax issue CHICAGO, April 21 Target Corp, Wal-Mart Stores Inc and other retailers are shelving considerations to move supply bases closer to the United States in the face of a possible border tax, banking instead on killing support for the tax idea in Congress. President Donald Trump's administration plans to impose a 20 percent tax on imports, a levy that, industry officials said, could raise U.S. consumer prices by as much as 25 percent. Last week, the President said he favored an 'import tax ~
REGN.O,EMA panel recommends nod for Sanofi, Regeneron's arthritis drug April 21 A European Medicines Agency panel said on Friday it recommended granting marketing approval to Sanofi and Regeneron's experimental drug to treat rheumatoid arthritis. ~
COL,UPDATE 3-Rockwell Collins lifts FY sales outlook to reflect B/E Aerospace deal April 21 Rockwell Collins Inc's second-quarter revenue beat analysts' estimates and the aircraft components maker raised its full-year revenue forecast to reflect the impact of its recently closed acquisition of aircraft interiors maker B/E Aerospace. ~CORRECTED-UPDATE 2-Rockwell Collins raises fiscal-year revenue forecast April 21 Aircraft component maker Rockwell Collins Inc raised its fiscal-year revenue forecast but gave a lower-than-expected profit outlook as it incorporated the acquisition of aircraft interiors maker B/E Aerospace into its results. ~BRIEF-Rockwell Collins Q2 EPS $1.27 from continuing operations * Rockwell Collins reports second quarter financial results and provides updated fiscal year 2017 financial guidance ~REFILE-Rockwell Collins revenue rises 2.4 pct April 21 Aircraft component maker Rockwell Collins Inc reported a 2.4 percent rise in quarterly revenue, helped by higher sales in its government systems and information management services units. ~
SLB,UPDATE 4-Schlumberger expects reactivation costs to squeeze margins * Q2, Q3 margin growth to lag Q1 - analyst (Adds Breakingviews link) ~BRIEF-Schlumberger says "activity has now reached bottom in all regions" * Schlumberger says "activity has now reached bottom in all regions" - conf call ~BRIEF-Schlumberger says do not expect significant sequential growth from Middle East over coming quarters * Schlumberger sees strength in activity in North Sea, Russia and Caspian regions in coming quarters as the winter season ends, new projects start up ~BRIEF-Schlumberger says continued to experience payment delays, primarily from customers in Latin America * Schlumberger says continued to experience payment delays, primarily from customers in Latin America ~Schlumberger posts first revenue rise in 9 quarters as drilling recovers April 21Schlumberger NV reported a 5.7 percent rise in revenue, the first increase after eight quarters, as a recovery in crude prices spurred shale drilling after a more than two-year slump. ~
SBUX.O,UPDATE 1-Starbucks' Unicorn Frappuccino sparks backlash from baristas NEW YORK, April 21 Starbucks baristas have taken to social media to complain about  the coffee chain's entry into the latest food craze: Unicorn Frappuccino. ~REFILE -Starbucks Unicorn Frappuccino sparks backlash from baristas NEW YORK, April 21 Starbucks baristas have taken to social media to complain about  the coffee chain's entry into the latest food craze: Unicorn Frappuccino. ~
STT,High-stakes vote on Wells Fargo board also tests proxy adviser ISS BOSTON A high-stakes shareholder vote at Wells Fargo & Co  next week will determine whether the bank has done enough to retain investor confidence after its phony-account scandal, and whether a leading proxy adviser wields enough clout to help oust most of its board. ~
UAL,BRIEF-United Continental Holdings CEO's 2016 compensation was $18.7 mln * United Continental Holdings Inc - CEO Oscar Munoz's 2016 total compensation was $18.7 million which includes stock awards of $13.8 million - sec filing ~BRIEF-United Airlines enters second amendment to employment agreement with CEO Oscar Munoz * United Continental Holdings - on april 21, co, united airlines entered second amendment to employment agreement with ceo oscar munoz - sec filing ~
V,BRIEF-Visa calls for redemption all of its 1.200 pct notes due 2017 * Visa Inc - on Sept 11, co called for redemption all of $1.75 billion principal amount outstanding of its 1.200 pct notes due 2017‍​ - SEC filing ~BRIEF-Visa Inc files for three-part senior notes offering of up to $2.5 bln * Visa Inc says files for three-part senior notes offering of up to $2.5 billion - SEC filing‍​ ~Former BoE deputy Hogg to join Visa as Europe unit CEO Visa Inc, the world's largest payments processor, on Thursday named former Bank of England (BoE) deputy governor Charlotte Hogg as chief executive of its Europe division. ~CORRECTED-UPDATE 1-MOVES-Former BoE deputy Hogg to join Visa as Europe unit CEO Sept 7 Visa Inc, the world's largest payments processor, on Thursday named former Bank of England (BoE) deputy governor Charlotte Hogg as chief executive of its Europe division. ~MOVES-Visa names ex-BoE deputy Charlotte Hogg as Europe unit CEO Sept 7 Visa Inc, the world's largest payments processor, on Thursday named Charlotte Hogg as chief executive of its Europe division. ~BRIEF-Visa appoints Charlotte Hogg as CEO of European operations * Visa Inc appoints Charlotte Hogg as chief executive officer of the compan's European operations ~BRIEF-Visa Inc files prospectus supplement for potential three-part senior notes offering * Visa Inc files prospectus supplement for potential three-part senior notes offering; size not disclosed - sec filing‍​ Source text (http://bit.ly/2vLDrIe) Further company coverage: ~BRIEF-Visa enables on the go payments with the new Fitbit Ionic * Visa inc- ‍enabling visa payments on fitbit's smartwatch fitbit ionic​ ~BRIEF-Bridg raises $11 million in Series B funding * Bridg raises $11 million in Series B funding from Morpheus Ventures, March Capital, Visa and NextEquity ~
WMT,U.S. retailers bet on Congress over Bolivia to thwart Trump border tax issue CHICAGO Target Corp, Wal-Mart Stores Inc and other retailers are shelving considerations to move supply bases closer to the United States in the face of a possible border tax, banking instead on killing support for the tax idea in Congress. President Donald Trump's administration plans to impose a 20 percent tax on imports, a levy that, industry officials said, could raise U.S. consumer prices by as much as 25 percent. Last week, the President said he favored an 'import tax' that cou ~U.S. retailers bet on Congress over Bolivia to thwart Trump  border tax issue CHICAGO Target Corp , Wal-Mart Stores Inc  and other retailers are shelving considerations to move supply bases closer to the United States in the face of a possible border tax, banking instead on killing support for the tax idea in Congress. ~U.S. retailers bet on Congress over Bolivia to thwart Trump border tax issue CHICAGO, April 21 Target Corp, Wal-Mart Stores Inc and other retailers are shelving considerations to move supply bases closer to the United States in the face of a possible border tax, banking instead on killing support for the tax idea in Congress. President Donald Trump's administration plans to impose a 20 percent tax on imports, a levy that, industry officials said, could raise U.S. consumer prices by as much as 25 percent. Last week, the President said he favored an 'import tax ~
WFC,National Bank invests C$6 million in robo-adviser Nest Wealth TORONTO National Bank of Canada is investing C$6 million in Canadian robo-adviser startup Nest Wealth and will license the financial technology company's digital wealth management platform, the companies said on Friday. ~National Bank invests C$6 mln in robo-adviser Nest Wealth TORONTO, April 21 National Bank of Canada is investing C$6 million in Canadian robo-adviser startup Nest Wealth and will license the financial technology company's digital wealth management platform, the companies said on Friday. ~Wells Fargo expands settlement to include more customer accounts Wells Fargo & Co  said it would expand its class action settlement related to the lender's retail sales practices to include customer accounts as early as May 2002. ~Wells Fargo expands settlement to include more customer accounts April 21 Wells Fargo & Co said it would expand its class action settlement related to the lender's retail sales practices to include customer accounts as early as May 2002. ~BRIEF-Wells Fargo expands class-action settlement for retail sales practices * Wells Fargo expands class-action settlement for retail sales practices to $142 million, adds accounts as early as May 2002 ~High-stakes vote on Wells Fargo board also tests proxy adviser ISS BOSTON A high-stakes shareholder vote at Wells Fargo & Co  next week will determine whether the bank has done enough to retain investor confidence after its phony-account scandal, and whether a leading proxy adviser wields enough clout to help oust most of its board. ~
