AMZN.O,UPDATE 1-Amazon China partner tells users to stop using illegal VPNs BEIJING/SHANGHAI, Aug 2 A Chinese partner of global e-commerce firm Amazon.com Inc has told customers to stop using illegal virtual private networks (VPNs), which can circumvent internet censorship. ~Freight forwarder DSV pins growth hope on e-commerce COPENHAGEN Danish freight forwarder DSV  will invest more to meet rising demand for services such as e-commerce and address competition from new players including Amazon.com  which is seeking a greater role in the logistics supply chain. ~Freight forwarder DSV pins growth hope on e-commerce COPENHAGEN, July 27 Danish freight forwarder DSV will invest more to meet rising demand for services such as e-commerce and address competition from new players including Amazon.com which is seeking a greater role in the logistics supply chain. ~Amazon China partner tells users to stop using illegal VPNs BEIJING/SHANGHAI, Aug 2 A Chinese partner of global e-commerce firm Amazon.com Inc has told customers to end the use of illegal virtual private networks (VPNs), which can allow users to circumvent internet censorship. ~
AAL.O,UPDATE 2-Qatar Airways reverses decision to buy into American Airlines NEW YORK, Aug 2 Qatar Airways will not proceed with its proposed financial investment in American Airlines Group Inc, reversing an earlier decision to build a stake of up to 4.75 percent in the U.S. carrier. ~Perks? No! U.S. flyers prefer the cheap seats: Reuters/Ipsos poll NEW YORK U.S. airlines striving to boost profitability are up against an army of penny-pinching customers who would rather sit in a dreaded middle seat than pay more to fly, says a Reuters/Ipsos opinion poll released on Wednesday. ~Qatar Airways reverses decision to buy into American Airlines NEW YORK, Aug 2 Qatar Airways will not proceed with its proposed financial investment in American Airlines , reversing an earlier decision to build a stake of up to 4.75 percent in the U.S. carrier, the state-owned airline said in a statement. ~
ANTM.N,Express Scripts wins dismissal of lawsuit over Anthem ties NEW YORK A federal judge has dismissed a lawsuit in which Express Scripts Holding Co  shareholders accused the pharmacy benefits manager of inflating its share price by hiding its deteriorating relationship with its largest customer, Anthem Inc . ~Express Scripts wins dismissal of lawsuit over Anthem ties NEW YORK, Aug 2 A federal judge has dismissed a lawsuit in which Express Scripts Holding Co shareholders accused the pharmacy benefits manager of inflating its share price by hiding its deteriorating relationship with its largest customer, Anthem Inc. ~Anthem to cut back Obamacare plan offerings in California U.S. health insurer Anthem Inc is pulling back from 16 of 19 pricing regions in California where it offered Obamacare options this year, state officials said on Tuesday. ~
AAPL.O,Dow cracks 22,000, Apple hits record high The Dow climbed above the 22,000 mark for the first time on Wednesday, buoyed by Apple's healthy quarterly iPhone sales, while weakness in other tech stocks held back the Nasdaq and S&P; 500. | Video  ~ANALYSIS-Dow pole vaults 22,000, but beware the landing NEW YORK, Aug 2 The blue-chip Dow Jones Industrial Average closed over the 22,000 mark for the first time on Wednesday, but investor fears about the sustainability of the gains took the shine off the round number milestone. ~FACTBOX-Dow crosses 22,000 mark: facts & figures  (Updates data to closing levels, adds graphic)     By Chuck Mikolajczak     NEW YORK, Aug 2 After a seven-session winning streak that included six straight record highs, the Dow Jones Industrial Average broke above the 22,000 level on Wednesday, powered by gains in Apple Inc          after the largest U.S. company by market capitalization reported earnings.     The 30-stock index recently marked its fifth straight month of gains and has advanced for eight consecutive quarters, its l ~Dow closes above 22,000 for first time; dollar soft NEW YORK A gauge of world stocks edged lower on Wednesday even as Wall Street's venerable Dow Jones Industrial Average topped the 22,000 barrier on strength in Apple  shares, while the U.S. dollar held near 15-month lows on doubts about another rate hike this year. | Video  ~GLOBAL MARKETS-Dow closes above 22,000 for first time; dollar soft * Dollar holds at 15-month lows (Updates with close of U.S. markets) ~ANALYSIS-Dow pole vaults 22,000, but beware the landing NEW YORK, Aug 2 The blue chip Dow Jones Industrial Average vaulted over the 22,000 mark for the first time on Wednesday, but investor fears about the sustainability of the gains took the shine off the round number milestone. ~GLOBAL MARKETS-Stocks dip after Dow breaks 22,000; dollar soft * Dollar holds at 15-month lows (Updates close of European markets) ~FACTBOX-Dow crosses 22,000 mark: facts & figures     NEW YORK, Aug 2 After a six-session winning streak that included five record highs, the Dow Jones Industrial Average broke above the 22,000 level, powered by gains in Apple Inc          after the largest U.S. company by market capitalization reported earnings.      The 30-stock index recently marked its fifth straight month of gains and has advanced for eight consecutive quarters, its longest streak since an 11-quarter run from 1995 to 1996.     Below is a list of facts about the ~Cyclicals slump drags European shares down as banks miss expectations LONDON Miners and banks led a sell-off among cyclical sectors weighing on the European market on Wednesday, while semiconductor firms' shares were up. ~
T,Pay TV channel Starz criticizes AT&T; plan to buy Time Warner WASHINGTON, Aug 2 The premium movie channel Starz criticized AT&T;'s plan to buy Time Warner Inc on Wednesday, saying the megadeal would give AT&T; the clout to steer customers away from Starz and toward its own premium channels. ~"Wonder Woman" lifts Time Warner profit Aug 2 Time Warner Inc, which is in the process of being bought by AT&T; Inc, reported an 11.6 percent rise in quarterly profit, helped by the success of its latest superhero movie "Wonder Woman". ~
AN,UPDATE 1-AutoNation profit falls on lower vehicle sales Aug 2 AutoNation Inc, the largest U.S. auto retail chain, on Wednesday reported a 21.8-percent fall in quarterly profit, hurt by lower new vehicle sales, and the company's shares fell 4.4 percent in early New York trading. ~BRIEF-AutoNation Q2 earnings per share $0.86 from continuing operations * Awarded jaguar land rover add-point, with expected annual revenue of about $130 million ~BRIEF-AutoNation reports Q2 SHR from cont ops $0.86 * AutoNation Inc Says Q2 SHR from cont ops $0.86; Q2 Revenue $5.28 bln VS $5.44 bln ~AutoNation profit falls 21.8 pct on lower vehicle sales Aug 2 AutoNation Inc, the largest U.S. auto retail chain, on Wednesday reported a 21.8 percent fall in quarterly profit hurt by lower new vehicle sales. ~
BA,BRIEF-Boeing announces ‍investment in C360 Technologies * Boeing announces ‍investment in C360 Technologies, a Pittsburgh-based company focusing on 360° video and augmented/virtual reality ​ Source text for Eikon: Further company coverage: ~BRIEF-Boeing files for sale of up to 14.4 mln shares of co's common stock by selling stockholder * Boeing files prospectus that relates to sale, from time to time, of up to 14.4 million shares of co's common stock - SEC filing ~RPT-UPDATE 4-Spirit AeroSystems' shares soar on Boeing deal Aug 2 Spirit AeroSystems Holdings Inc's shares hit a record high after it reached a tentative agreement with Boeing Co on pricing terms related to parts it supplies for aircraft such as the 787 Dreamliner. ~Spirit AeroSystems' shares soar on Boeing deal Spirit AeroSystems Holdings Inc's  shares hit a record high after it reached a tentative agreement with Boeing Co  on pricing terms related to parts it supplies for aircraft such as the 787 Dreamliner. ~UPDATE 4-Spirit AeroSystems' shares soar on Boeing deal * Q2 profit, revenue beat Street (Adds details; updates shares) ~Spirit AeroSystems reaches agreement with Boeing Aug 2 Aircraft parts maker Spirit AeroSystems Holdings Inc said it reached an agreement with Boeing Co , its biggest customer, on pricing issues related to aircraft programs such as the single-aisle 737 MAX and the 787 Dreamliner. ~BRIEF-Spirit Aerosystems reports Q2 loss per share of $0.48 * Spirit Aerosystems announces strong second quarter 2017 operating results; signs MOU for long-term agreement with boeing to settle open issues; increases share repurchase authorization up to $1 billion; raises 2017 cash from operations and free cash flow* guidan ~BRIEF-Boeing and Jaxa to flight-test technology to improve safety * Boeing and Jaxa to flight-test technology to improve safety ~
CAH,Cardinal Health's dismal forecast drags rivals, drugmakers down Cardinal Health Inc forecast fiscal year 2018 profit well below analyst estimates, highlighting the drag on drug distributors and generic drugmakers due to stubbornly low generic drug prices. ~UPDATE 3-Cardinal Health's dismal forecast drags rivals, drugmakers down * Expects fiscal year 2018 profit to be $4.85-$5.10 per share ~BRIEF-Cardinal Health says exploring strategic alternatives for its service and distribution business in China - Conf Call * Cardinal Health CFO sees fiscal-year 2018 revenue in mid-single digit percent growth versus prior year - Conf Call ~US drug distributor Cardinal Health's profit dips 17.7 pct Aug 2 U.S. drug distributor Cardinal Health reported a 17.7 percent decline in quarterly profit on Wednesday, hurt by weak generic drug prices. ~
CF,UPDATE 1-Fertilizer maker CF Industries posts 93.6 pct plunge in profit Aug 2 U.S. fertilizer producer CF Industries Holdings Inc reported a 93.6 percent fall in quarterly profit on Wednesday and said it expects nitrogen pricing to be challenged through 2017 and into 2018. ~
CXO,UPDATE 1-Concho profit beats expectation, boosts production forecast HOUSTON, Aug 2 U.S. shale oil producer Concho Resources Inc posted a better-than-expected quarterly profit on Wednesday, helped by higher crude prices that led it to boost its output forecast for the year. ~BRIEF-Concho Resources Q2 adj earnings per share $0.52 * Q2 earnings per share view $0.43 -- Thomson Reuters I/B/E/S ~Concho swings to quarterly profit, raises oil production forecast HOUSTON, Aug 2 U.S. shale oil producer Concho Resources Inc said on Wednesday it swung to a second-quarter profit on higher crude prices. ~
CSX.O,UPDATE 4-Freight train cars burning after derailment in Pennsylvania; residents flee Hyndman, Pa., Aug 2 Rail cars carrying gas and sulfur on a CSX Corp freight train skidded off the tracks and burst into flames on Wednesday in a small Pennsylvania town, forcing hundreds of residents to flee their homes as firefighters fought the blaze. ~CSX freight train derails in Pennsylvania Aug 2 CSX Corp said a freight train derailed in southern Pennsylvania on Wednesday. ~
CVS,BRIEF-Orexo says Zubsolv gains preferred position on CVS Caremark 2018 formulary * Zubsolv gains preferred position on CVS Caremark 2018 formulary ~
DLPH.N,UPDATE 3-Delphi Automotive raises full-year profit, revenue forecasts Aug 2 Vehicle component maker Delphi Automotive Plc raised its full-year forecasts, driven by a strong second quarter and growth prospects in electrification and safety systems, including those being developed for self-driving vehicles. ~Delphi Automotive profit jumps 43 pct Aug 2 Vehicle component maker Delphi Automotive Plc reported a 43 percent rise in quarterly profit, benefiting from continued automaker interest as it helps develop technology for self-driving vehicles. ~
DAL,Perks? No! U.S. flyers prefer the cheap seats -Reuters/Ipsos poll NEW YORK, Aug 2 U.S. airlines striving to boost profitability are up against an army of penny-pinching customers who would rather sit in a dreaded middle seat than pay more to fly, says a Reuters/Ipsos opinion poll released on Wednesday. ~
ESRX.O,Express Scripts wins dismissal of lawsuit over Anthem ties NEW YORK A federal judge has dismissed a lawsuit in which Express Scripts Holding Co  shareholders accused the pharmacy benefits manager of inflating its share price by hiding its deteriorating relationship with its largest customer, Anthem Inc . ~Express Scripts wins dismissal of lawsuit over Anthem ties NEW YORK, Aug 2 A federal judge has dismissed a lawsuit in which Express Scripts Holding Co shareholders accused the pharmacy benefits manager of inflating its share price by hiding its deteriorating relationship with its largest customer, Anthem Inc. ~
XOM,BP's west Africa partner Kosmos to list in London by end-September LONDON, Aug 2 Kosmos Energy, which is exploring for gas offshore Senegal and Mauritania with oil major BP, will list on the London Stock Exchange by the end of September in a bid to attract more European investors, it said on Wednesday. ~
GRMN.O,UPDATE 3-Garmin beats profit estimates as outdoor device sales soar * 2nd-qtr adj profit 88 cents/shr vs est 81 (Adds analyst comment) ~BRIEF-Garmin Ltd Q2 EPS $0.91 * Garmin reports second quarter revenue and earnings growth; raises guidance ~Garmin's quarterly profit rises 6.1 pct Aug 2Garmin Ltd, a maker of GPS-based gadgets, reported a 6.1 percent rise in quarterly profit on Wednesday, as strong sales of its fitness products more than offset weak demand for navigation products used in automobiles. ~
GGP,U.S. retail REITs cannot find upside despite strong numbers NEW YORK, Aug 2 For an industry under siege by e-commerce and searching for relief, mall owner GGP Inc's announcement earlier on Wednesday that it is shelving plans to explore asset sales hit the stock hard and underscored the struggles facing brick-and-mortar retailers. ~Shares of mall owner GGP drop after halting strategic alternative plan NEW YORK Shares of GGP Inc , a large owner of malls and regional shopping centers, fell sharply on Wednesday after the company said it would stay the course and not sell assets following a board review of all "strategic alternatives" announced in May. ~BRIEF-GGP Inc Q2 EPS $0.13 * GGP Inc sees full year net income per share attributable to GGP $0.58 to $0.62 ~
GS,CORRECTED-Goldman, Tennenbaum buy Singapore-based solar power company Conergy SINGAPORE, Aug 2 U.S. private equity funds Tennenbaum Capital Partners LLC (TCP) and Goldman Sachs BDC (GSBD) have bought solar energy company Conergy Asia & ME Pte Ltd and its subsidiaries, Conergy said on Wednesday. ~
GWW,BRIEF-Grainger announces retirement of Jim Ryan as board chairman * Grainger announces retirement of Jim Ryan as board chairman ~
HAS.O,Exclusive: Hasbro ends talks to buy Lions Gate Entertainment - sources Hasbro Inc, the maker of games ranging from Monopoly to foam Nerf balls, has ended talks to acquire U.S. movie studio and entertainment company Lions Gate Entertainment Corp, people familiar with the matter said on Wednesday. ~
HUM,UPDATE 4-Humana shares gain as 2018 Medicare Advantage outlook improves Aug 2 U.S. health insurer Humana Inc on Wednesday said that  it now anticipated a higher percentage of customers will be in its most profitable Medicare Advantage plans for the elderly and people with disabilities in 2018, sending shares up more than 4 percent. ~Health insurer Humana's pretax quarterly profit rises 64 pct Aug 2 U.S. health insurer Humana Inc posted a 64 percent rise in quarterly pretax income on Wednesday, as it added members in its Medicare Advantage business, which sells plans to the elderly and to people with disabilities. ~
ILMN.O,CORRECTED-UPDATE 1-Illumina shares sparkle on strong demand for new gene tech Aug 2 Shares of Illumina Inc surged nearly 14 percent on Wednesday, a day after the company raised its 2017 revenue forecast on strong demand for its new gene-sequencing technology. ~Illumina shares sparkle on demand for new gene tech Aug 2 Shares of Illumina Inc surged nearly 12 percent on Wednesday, a day after the company raised its full-year revenue forecast on higher-than-expected demand for its new gene-sequencing technology. ~
JEC,Jacobs Engineering to boost government business with CH2M buy Jacobs Engineering Group Inc , which designs highways, bridges and airports, said it would buy rival CH2M Hill Cos Ltd in a $3.27 billion cash-and-stock deal to bolster its reach in the high-margin government services and infrastructure sectors. ~UPDATE 3-Jacobs Engineering to boost government business with CH2M buy Aug 2 Jacobs Engineering Group Inc, which designs highways, bridges and airports, said it would buy rival CH2M Hill Cos Ltd in a $3.27 billion cash-and-stock deal to bolster its reach in the high-margin government services and infrastructure sectors. ~BRIEF-Jacobs Engineering Group says expects Q3 GAAP EPS of $0.74 * Jacobs Engineering Group Inc - believe that our expectations for sequential revenue growth during Q3 will materialize ~BRIEF-Jacobs Engineering CH2M may be required to pay co termination fee $85.4 million * Jacobs Engineering - ‍upon merger termination under certain circumstances, CH2M may be required to pay co termination fee $85.4 million - SEC filing Source text for Eikon: (http://bit.ly/2f72RZ8) Further company coverage: ~BRIEF-Jacobs Engineering to acquire CH2M Hill * Jacobs to acquire CH2M to create premier $15 billion global solutions provider ~
JNJ,UPDATE 1-U.S. FDA panel votes against approval of J&J; arthritis drug Aug 2 The benefits of Johnson & Johnson's experimental rheumatoid arthritis drug sirukumab do not outweigh the risks, an advisory panel to the U.S. Food and Drug Administration concluded on Wednesday. ~U.S. FDA panel votes against approval of J&J; arthritis drug Aug 2 The benefits of Johnson & Johnson's experimental rheumatoid arthritis drug sirukumab do not outweigh the risks and it should not be approved, an advisory panel to the U.S. Food and Drug Administration concluded on Wednesday. ~
JPM,UPDATE 2-U.S. orders JPMorgan Chase to pay $4.6 mln over checking account reports WASHINGTON, Aug 2 The U.S. Consumer Financial Protection Bureau said on Wednesday it had ordered JPMorgan Chase & Co to pay $4.6 million for allegedly failing to make sure it reported accurate information for checking account screening reports. ~U.S. orders JPMorgan Chase to pay $4.6 mln over checking account reports WASHINGTON, Aug 2 The U.S. Consumer Financial Protection Bureau said on Wednesday it had ordered JPMorgan Chase & Co to pay $4.6 million for allegedly failing to make sure it reported accurate information for checking account screening reports. ~
KIM,U.S. retail REITs cannot find upside despite strong numbers NEW YORK, Aug 2 For an industry under siege by e-commerce and searching for relief, mall owner GGP Inc's announcement earlier on Wednesday that it is shelving plans to explore asset sales hit the stock hard and underscored the struggles facing brick-and-mortar retailers. ~
MRO,UPDATE 1-Marathon Oil cuts capital budget after posting quarterly loss Aug 2 U.S. oil producer Marathon Oil Corp cuts its 2017 capital budget on Wednesday after posting a quarterly loss that fell in line with Wall Street's expectations. ~Marathon Oil posts quarterly loss, trims capital budget Aug 2 U.S. oil producer Marathon Oil Corp posted a quarterly loss on Tuesday and cut its 2017 capital budget, but raised its forecast for shale output this year. ~
MET,UPDATE 1-U.S. court puts MetLife 'too big to fail' case on indefinite pause WASHINGTON, Aug 2 Any legal decision on whether the largest U.S. life insurer MetLife Inc should be labeled "too big to fail" will probably come after the Trump administration defines its stance on the designation. ~MetLife beats profit estimates on strong underwriting MetLife Inc , the largest U.S. life insurer, posted a better-than-expected quarterly operating profit, helped by stronger underwriting in all its businesses. ~UPDATE 1-MetLife beats profit estimates on strong underwriting Aug 2 MetLife Inc, the largest U.S. life insurer, posted a better-than-expected quarterly operating profit, helped by stronger underwriting in all its businesses. ~BRIEF-Metlife Q2 earnings per share $0.77 * Q2 earnings per share view $1.28 -- Thomson Reuters I/B/E/S ~MetLife profit rises on smaller derivative losses Aug 2 MetLife Inc's quarterly profit surged compared with a year earlier, when the largest U.S. life insurer booked $1.4 billion in net derivative losses. ~
MDLZ.O,REFILE-UPDATE 3-Outsider replaces long-time CEO at Oreo cookie maker Mondelez Aug 2 Mondelez International Inc on Wednesday named the head of Canadian frozen foods maker McCain Foods to succeed its long-time chief as the snack firm battles declining profits and activist investors. ~BRIEF-Mondelēz International Q2 earnings per share $0.32 * Mondelēz International reports Q2 results and increases quarterly dividend ~BRIEF-Dirk Van de Put to become CEO of Mondelēz International * Dirk Van de Put to become CEO of Mondelēz International as long-time CEO Irene Rosenfeld retires ~Mondelez appoints Dirk Van de Put to succeed Irene Rosenfeld as CEO Aug 2 Oreo cookies maker Mondelez International Inc said it appointed Dirk Van de Put, the current chief executive of Canadian frozen food maker McCain Foods, to succeed Irene Rosenfeld as the company's chief executive from November 2017. ~
MS,Enel working with Morgan Stanley to sell Panama assets - sources MILAN/LONDON, Aug 2 Italy's top utility Enel is working with Morgan Stanley to sell its Fortuna hydroelectric plant in Panama as part of broader disposal plans, three sources with knowledge of the matter told Reuters. ~
OXY,Occidental Petroleum's profit beats as prices for chemicals jump U.S. oil producer Occidental Petroleum Corp posted a better-than-expected quarterly profit on Wednesday, helped in part by a price hike at its chemical division. ~UPDATE 1-Occidental Petroleum's profit beats as prices for chemicals jump Aug 2 U.S. oil producer Occidental Petroleum Corp posted a better-than-expected quarterly profit on Wednesday, helped in part by a price hike at its chemical division. ~Occidental Petroleum swings to quarterly profit Aug 2 U.S. oil producer Occidental Petroleum Corp said on Wednesday it swung to a profit in the second quarter, helped by a rise in oil prices. ~
PFE,CORRECTED-BRIEF-Pfizer reports second-quarter results (Aug 1) * Q2 earnings per share view $0.66 -- Thomson Reuters I/B/E/S ~
PXD,Rising gas output drags down shares of U.S. shale leader Pioneer HOUSTON, Aug 2 Shares of Pioneer Natural Resources Co plunged on Wednesday after the U.S. shale producer cut its oil-production growth forecast and said it would pump more natural gas this year, spooking investors. ~
PRU,CORRECTED-Prudential Financial's quarterly profit nearly halves Aug 2Prudential Financial Inc, the No. 2 U.S. life insurer, posted a 47 percent slump in quarterly profit, hurt by higher investment losses and related charges. ~BRIEF-Prudential Financial Inc Q2 earnings per share $1.12 * Prudential Financial, Inc announces second quarter 2017 results ~
SYMC.O,BRIEF-Digicert to acquire Symantec's website security, related PKI solutions * Digicert to acquire Symantec's website security and related PKI solutions ~Symantec reports 33 percent rise in revenue Aug 2 Symantec Corp reported a 33 percent rise in quarterly revenue on Wednesday, helped by strong demand for its cyber security products. ~Symantec to sell Web certificates business to Thoma Bravo: sources Cyber security company Symantec Corp  has agreed to sell its business that helps verify the identity of websites to buyout firm Thoma Bravo LLC, people familiar with the matter said on Wednesday, a move that extricates it from a feud with Alphabet Inc's Google . ~Symantec to sell Web certificates business to Thoma Bravo -sources Aug 2 Cyber security company Symantec Corp has agreed to sell its business that helps verify the identity of websites to buyout firm Thoma Bravo LLC, people familiar with the matter said on Wednesday, a move that extricates it from a feud with Alphabet Inc's Google. ~
KO,Israeli taxman seeks $45 million from Coca Cola over royalties: report JERUSALEM Israel's Tax Authority wants Coca-Cola to pay some 160 million shekels ($45 million) in taxes on royalties that the global beverage giant receives from its local franchise for use of the brand name in Israel, local newspapers reported. ~Israeli taxman seeks $45 mln from Coca Cola over royalties -report JERUSALEM, Aug 2 Israel's Tax Authority wants Coca-Cola to pay some 160 million shekels ($45 million) in taxes on royalties that the global beverage giant receives from its local franchise for use of the brand name in Israel, local newspapers reported. ~
MOS,UPDATE 1-Fertilizer maker CF Industries posts 93.6 pct plunge in profit Aug 2 U.S. fertilizer producer CF Industries Holdings Inc reported a 93.6 percent fall in quarterly profit on Wednesday and said it expects nitrogen pricing to be challenged through 2017 and into 2018. ~
TWX,Pay TV channel Starz criticizes AT&T; plan to buy Time Warner WASHINGTON, Aug 2 The premium movie channel Starz criticized AT&T;'s plan to buy Time Warner Inc on Wednesday, saying the megadeal would give AT&T; the clout to steer customers away from Starz and toward its own premium channels. ~BRIEF-Time Warner reaffirms 2017 full-year business outlook * FY2017 earnings per share view $6.03, revenue view $30.90 billion -- Thomson Reuters I/B/E/S ~BRIEF-Time Warner Q2 earnings per share $1.34 * Q2 adjusted earnings per share $1.33 from continuing operations ~"Wonder Woman" lifts Time Warner profit Aug 2 Time Warner Inc, which is in the process of being bought by AT&T; Inc, reported an 11.6 percent rise in quarterly profit, helped by the success of its latest superhero movie "Wonder Woman". ~
