ABBV.N,AbbVie's drug for all types of hepatitis C wins EU approval July 28 AbbVie Inc said on Friday it had received European approval to market its drug for treatment of all six major forms of hepatitis C. ~BRIEF-EC grants Abbvie's Maviret marketing authorization for treatment of Chronic Hepatitis C * European Commission grants Abbvie's Maviret (glecaprevir/pibrentasvir) marketing authorization for the treatment of Chronic Hepatitis C in all major genotypes (GT1-6) ~AbbVie to remain cautious on drug pricing, shares fall AbbVie Inc's  said it would be cautious with drug pricing, especially for Humira, the world's biggest selling drug, sending its shares down 2 percent, despite the drugmaker's quarterly profit narrowly beating estimates. ~UPDATE 3-AbbVie to remain cautious on drug pricing, shares fall * Co reiterates 2017 adjusted profit forecast (Adds conference call details, shares) ~BRIEF-Abbvie CEO says "big" M&A; is something that is not fundamental to their strategy * Abbvie CFO: humira u.s. Sales increased 18 percent compared to the prior year, driven by low double-digit prescription growth plus price. ~Roche leukaemia drug gets FDA breakthrough therapy designation ZURICH Roche Holding AG's Venclexta has won breakthrough therapy designation in acute myeloid leukaemia (AML) from the U.S. Food and Drug Administration, the Swiss drugmaker said on Friday. ~Roche leukaemia drug gets FDA breakthrough therapy designation ZURICH, July 28 Roche Holding AG's Venclexta has won breakthrough therapy designation in acute myeloid leukaemia (AML) from the U.S. Food and Drug Administration, the Swiss drugmaker said on Friday. ~AbbVie's profit rises 19 pct on Humira demand July 28 U.S. drugmaker AbbVie Inc reported an 18.9 percent rise in quarterly profit on Friday on strong demand for its flagship rheumatoid arthritis drug, Humira. ~
AMZN.O,Stocks edge lower as some earnings disappoint; oil rises NEW YORK Stock markets fell worldwide on Friday as results from some big U.S. companies disappointed and tobacco shares dropped, while oil prices had their biggest weekly percentage rise this year. ~US STOCKS-S&P; 500 dented by earnings; Dow hits record high * Dow up 0.15 pct, S&P; down 0.13 pct, Nasdaq down 0.12 pct (Updates with close of U.S. market) ~US STOCKS-S&P; 500 knocked lower after earnings wave * Dow up 0.11 pct, S&P; down 0.16 pct, Nasdaq down 0.07 pct (Updates to late afternoon) ~Roomba vacuum maker iRobot betting big on the 'smart' home The Roomba robotic vacuum has been whizzing across floors for years, but its future may lie more in collecting data than dirt. ~Roomba vacuum maker iRobot betting big on the 'smart' home  (This July 24 story corrects paragraph 6 to read "share maps for free with customer consent" instead of "sell maps") ~US STOCKS-S&P; lower as Amazon, tobacco stocks drag; Dow, Nasdaq flat * Indexes down: Dow 0.01 pct, S&P; 0.23 pct, Nasdaq 0.08 pct (Updates to early afternoon) ~CORRECTED-Roomba vacuum maker iRobot betting big on the 'smart' home July 24 The Roomba robotic vacuum has been whizzing across floors for years, but its future may lie more in collecting data than dirt. ~GLOBAL MARKETS-Stocks fall with tobacco shares, Amazon; oil climbs * Dollar falls against the euro (Updates with U.S. markets; changes byline, dateline; previous LONDON) ~
AAL.O,UPDATE 2-American Airlines revenue, adjusted profit beats forecasts July 28 American Airlines Group Inc on Friday reported quarterly revenue and adjusted profit that beat analyst projections, helped by strong passenger demand and improving average fares. ~BRIEF-American Airlines Group reports Q2 adjusted earnings of $1.92/shr * Q2 earnings per share view $1.87 -- Thomson Reuters I/B/E/S ~American Airlines revenue rises 7.2 pct July 28 American Airlines Group Inc reported a 7.2 percent rise in quarterly revenue, helped by strong passenger demand and improving average fares. ~
ANTM.N,UPDATE 1-Hundreds of U.S. counties at risk for no Obamacare insurer in 2018 NEW YORK, July 28 With Republican efforts to dismantle Obamacare in disarray, hundreds of U.S. counties are at risk of losing access to private health coverage in 2018 as insurers consider pulling out of those markets in the coming months. ~
AAPL.O,Roomba vacuum maker iRobot betting big on the 'smart' home The Roomba robotic vacuum has been whizzing across floors for years, but its future may lie more in collecting data than dirt. ~Roomba vacuum maker iRobot betting big on the 'smart' home  (This July 24 story corrects paragraph 6 to read "share maps for free with customer consent" instead of "sell maps") ~CORRECTED-Roomba vacuum maker iRobot betting big on the 'smart' home July 24 The Roomba robotic vacuum has been whizzing across floors for years, but its future may lie more in collecting data than dirt. ~Sharp returns to Q1 profit on Foxconn's cost-cut drive, beats estimates TOKYO, July 28 Japan's Sharp Corp reported its third consecutive quarter of net profit on Friday, staying on track to achieve its first annual profit in four years following a cost-cutting drive under Taiwanese owner Foxconn. ~
T,AT&T; executives to run combined company after Time Warner deal NEW YORK, July 28 AT&T; Inc said on Friday that its executives will head its media and wireless businesses following the close of its $85.4 billion acquisition of Time Warner Inc. ~Factbox: More subscribers abandon pay-TV in the second quarter Five of the largest U.S. pay-TV providers posted subscriber losses during the second quarter as younger viewers increasingly cut the cord and moved to "skinny bundles," or cheaper packages with select channels, and Internet streaming services like Netflix or Hulu. ~
ADP.O,BRIEF-Vinci will try to play a role if opportunity arises on ADP- CEO July 28 Vinci CEO Xavier Huillard tells a news conference: ~
BAC,Morgan Stanley, RBC, others settle currency rigging lawsuit in U.S. NEW YORK, July 28 Morgan Stanley, Royal Bank of Canada and three other banks agreed to pay a combined $111.2 million to settle U.S. litigation accusing them of rigging prices in the roughly $5 trillion-a-day foreign exchange market. ~
CVX,WRAPUP 2-Exxon Mobil profit disappoints Wall Street, Chevron shines HOUSTON, July 28 Exxon Mobil Corp posted a rare earnings miss on Friday, the only international oil producer to do so last quarter, as production slipped in its African and Canadian operations. ~Chevron swings to quarterly profit as costs drop Chevron Corp  swung to a quarterly profit on Friday, helped largely by resurgence in oil and gas production as prices jumped and costs slipped. | Video  ~BRIEF-Chevron sees steady growth in Permian Shale operations * Still expects first production from Tengiz expansion in Kazakhstan in 2022 ~UPDATE 1-Chevron swings to quarterly profit as costs drop July 28 Chevron Corp swung to a quarterly profit on Friday, helped largely by resurgence in oil and gas production as prices jumped and costs slipped. ~BRIEF-Chevron Q2 earnings per share $0.77 * Q2 earnings per share view $0.87 -- Thomson Reuters I/B/E/S ~Chevron swings to quarterly profit as costs drop July 28 U.S. oil producer Chevron Corp swung to a quarterly profit on Friday as some costs fell and production jumped. ~
CSX.O,Regulator letter to railroad CSX highlights customer complaints DETROIT, July 28 A letter from the top U.S. rail regulator to CSX Corp this week highlights growing customer dissatisfaction with the No. 3 U.S. railroad's service problems since its new chief executive officer Hunter Harrison was appointed to the spot amid investor and analyst fanfare in March. ~
DAL,Air France-KLM agrees option for Virgin Atlantic ownership in event of hard Brexit BERLIN, July 28 Air France-KLM, Delta Air Lines and Virgin Atlantic have agreed a so-called 'put' option with Virgin Group that allows Virgin Atlantic to remain in majority UK ownership in the event of a hard Brexit. ~UPDATE 1-Air France-KLM upbeat on pricing as bookings improve BERLIN, July 28 Air France-KLM offered more optimism than rivals on pricing for the rest of the year, after good travel demand resulted in better than expected second-quarter profit. ~Delta, Air France-KLM, Virgin rejig Atlantic alliances PARIS/NEW YORK Delta Air Lines , Air France-KLM  and Virgin Atlantic unveiled plans on Thursday to combine two overlapping transatlantic joint-ventures, supported by equity deals worth $1 billion, as airlines brace for more competition. ~China Eastern buys 10 pct Air France KLM stake to boost European presence SINGAPORE, July 28 China Eastern Airlines Corp Ltd said on Friday it would buy a 10 percent stake in European carrier Air France KLM SA and form a strategic partnership to improve its presence in the China-Europe market. ~
XOM,WRAPUP 2-Exxon Mobil profit disappoints Wall Street, Chevron shines HOUSTON, July 28 Exxon Mobil Corp posted a rare earnings miss on Friday, the only international oil producer to do so last quarter, as production slipped in its African and Canadian operations. ~Exxon profit nearly doubles, but falls short of expectations Exxon Mobil Corp , the world's largest publicly traded oil producer, said on Friday its quarterly profit nearly doubled on surging margins at its operations outside the United States, but results fell shy of Wall Street's expectations. ~BRIEF-Exxon calls Qatar LNG 'very important partnership' * Says it expects to add 3 drilling rigs to Permian Basin acreage by end of August, bringing rig count there to 19 ~UPDATE 1-Exxon profit nearly doubles, but falls short of expectations July 28 Exxon Mobil Corp, the world's largest publicly traded oil producer, said on Friday its quarterly profit nearly doubled on surging margins at its operations outside the United States, but results fell shy of Wall Street's expectations. ~BRIEF-Exxon Mobil reports Q2 earnings per share $0.78 * Q2 earnings per share view $0.84 -- Thomson Reuters I/B/E/S ~Exxon Mobil quarterly profit nearly doubles July 28 Exxon Mobil Corp, the world's largest publicly traded oil producer, said on Friday its quarterly profit nearly doubled on surging margins at its operations outside the United States. ~
GE,UPDATE 2-Baker Hughes quarterly loss narrows; expects slower activity in H2 July 28 Oilfield services provider Baker Hughes , now part of General Electric Co, expects growth in North American onshore activity to decelerate in the second half of this year, the company said on Friday in a filing. ~Baker Hughes posts smaller loss in second quarter July 28 Oilfield services provider Baker Hughes , now part of General Electric Co, on Friday reported a smaller quarterly loss compared with a year earlier, when it incurred restructuring charges. ~
GILD.O,UPDATE 3-AbbVie to remain cautious on drug pricing, shares fall * Co reiterates 2017 adjusted profit forecast (Adds conference call details, shares) ~
GT.O,Goodyear Tire sales miss on weaker demand, rising competition Goodyear Tire & Rubber Co , the largest U.S. tire maker, reported lower-than-expected quarterly sales as demand for tires weakened, and slashed its full-year forecast for tire unit sales and segment operating income. ~UPDATE 2-Goodyear Tire sales miss on weaker demand, rising competition * Slashes FY forecasts for tire sales, segment operating income ~Goodyear Tire profit falls 27.2 pct as sales slip July 28 Goodyear Tire & Rubber Co, the largest U.S. tire maker, reported a 27.2 percent fall in quarterly profit, partly due to lower sales in its top two markets. ~
HON,Honeywell wins $409 million U.S. defense contract -Pentagon WASHINGTON, July 28 Honeywell International Inc was awarded a $409 million contract for the Next Generation Thermal, Power, and Controls  program, "a multiple government agency and industry joint effort to develop revolutionary and innovative technologies by 2024 timeframe," the Pentagon said in a statement on Friday. ~BRIEF-Honeywell International sets regular quarterly dividend of $0.665 per share * Sets regular quarterly dividend of $0.665per share Source text for Eikon: Further company coverage: ~
JPM,UPDATE 1-JPMorgan plans cost cuts in Sapphire Reserve card unit -WSJ July 28 JPMorgan Chase & Co is pushing for fresh cost cuts of about $200 million in the unit that oversees Sapphire Reserve credit card, the Wall Street Journal reported on Friday. ~JPMorgan plans cost cuts in Sapphire Reserve card unit -WSJ July 28 JPMorgan Chase & Co is pushing for fresh cost cuts of about $200 million in the unit that oversees Sapphire Reserve credit card, the Wall Street Journal reported on Friday. ~BRIEF-J P Morgan Chase to be 100 pct reliant on renewable energy by 2020 * J P Morgan Chase to be 100 percent reliant on renewable energy by 2020; announces $200 billion clean energy financing commitment ~
LMT,UPDATE 1-Lockheed Martin given $3.7 bln interim payment for 50 F-35s -Pentagon WASHINGTON, July 28 Lockheed Martin Corp was awarded a $3.7 billion interim payment for fifty F-35 jet fighters that are earmarked for non-U.S. customers, the Pentagon said on Friday. ~Lockheed Martin given $3.7 bln interim payment for 50 F-35s -Pentagon WASHINGTON, July 28 Lockheed Martin Corp was awarded a $3.7 billion interim payment for a batch of 50 F-35 fighter jets earmarked for non-U.S. customers, the Pentagon said on Friday. ~
MRK,UPDATE 3-AbbVie to remain cautious on drug pricing, shares fall * Co reiterates 2017 adjusted profit forecast (Adds conference call details, shares) ~UPDATE 4-Merck says cyber attack halted production, will hurt profits NEW YORK/LAS VEGAS, July 28 Drug and vaccine maker Merck & Co Inc said it suffered a worldwide disruption of its operations when it was the victim of an international cyber attack in June, halting production of its drugs, which will hurt its profits for the rest of the year. ~CORRECTED-UPDATE 1-Bayer cuts profit forecast after consumer health headache FRANKFURT, July 27 Bayer, which is buying U.S. seeds company Monsanto, cut its forecast for operating profit growth this year to below 10 percent after declines in sales of consumer health products in the United States and crop chemicals in Brazil. ~BRIEF-Merck reports Q2 non-GAAP earnings of $1.01/shr * Q2 earnings per share view $0.87 -- Thomson Reuters I/B/E/S ~Merck profit soars 61.5 pct as Keytruda sales surge July 28 Merck & Co Inc reported a 61.5 percent jump in quarterly profit on Friday as demand jumped for its key immuno-oncology drug, Keytruda. ~
MET,CORRECTED-U.S. regulators weigh future of appeal in MetLife case WASHINGTON, July 28 The top U.S. financial regulators ventured into uncharted legal territory on Friday, as they weighed the future of their appeal in a long-running case over their labeling of MetLife Inc as "too big to fail." ~
MS,Morgan Stanley, RBC, others settle currency rigging lawsuit in U.S. NEW YORK, July 28 Morgan Stanley, Royal Bank of Canada and three other banks agreed to pay a combined $111.2 million to settle U.S. litigation accusing them of rigging prices in the roughly $5 trillion-a-day foreign exchange market. ~BRIEF-Morgan Stanley appoints ex-Thomson Reuters' CEO Glocer as independent lead director of board * Morgan Stanley says announced that Thomas Glocer has been appointed independent lead director of Morgan Stanley's board of directors ~
NFLX.O,Factbox: More subscribers abandon pay-TV in the second quarter Five of the largest U.S. pay-TV providers posted subscriber losses during the second quarter as younger viewers increasingly cut the cord and moved to "skinny bundles," or cheaper packages with select channels, and Internet streaming services like Netflix or Hulu. ~
PFE,DIARY-U.S. earnings week ahead     July 28 Diary of U.S. (.SPX) corporate earnings for the week ahead.         ** Please Note - All times given are in U.S. EST unless otherwise stated **                  U.S. EARNINGS    Start Date   Start      Company                         RIC      Event Name               Time                                                  31-Jul-2017  BMO        Roper Technologies Inc          ROP.N    Q2 2017 Roper Technologies Inc Earnings Release  31-Jul-2017  BMO        Affiliated Manag ~
PX,UPDATE 2-Linde says Praxair merger process on track * Linde Q2 operating profit beats consensus (Recasts, adds CFO comment, Praxair comment) ~Linde confirms outlook; no update on Praxair merger FRANKFURT, July 28 German industrial gases group Linde beat expectations with a 2 percent increase in second-quarter operating profit driven by its core gases division and confirmed its full-year outlook on Friday. ~
COL,UPDATE 2-Rockwell Collins shares jump as results beat forecast July 28 Aircraft components maker Rockwell Collins Inc on Friday posted adjusted earnings that beat expectations, sending its shares up sharply after its first results including recently acquired aircraft interiors maker B/E Aerospace. ~BRIEF-Rockwell Collins reports third quarter financial results * Q3 earnings per share view $1.58 -- Thomson Reuters I/B/E/S ~Rockwell Collins revenue jumps 57 pct July 28 Aircraft components maker Rockwell Collins Inc reported a 57 percent rise in quarterly revenue as it gained from the acquisition of aircraft interiors maker B/E Aerospace. ~
SLB,Ecuador says clinches new payment deal with Schlumberger QUITO, July 27 Ecuador said on Thursday it had successfully negotiated a payment plan with Schlumberger , although it did not specify if the deal included reimbursement for roughly $850 million owed to the oil service company. ~
SBUX.O,US STOCKS-S&P; 500 dented by earnings; Dow hits record high * Dow up 0.15 pct, S&P; down 0.13 pct, Nasdaq down 0.12 pct (Updates with close of U.S. market) ~US STOCKS-S&P; 500 knocked lower after earnings wave * Dow up 0.11 pct, S&P; down 0.16 pct, Nasdaq down 0.07 pct (Updates to late afternoon) ~US STOCKS-S&P; lower as Amazon, tobacco stocks drag; Dow, Nasdaq flat * Indexes down: Dow 0.01 pct, S&P; 0.23 pct, Nasdaq 0.08 pct (Updates to early afternoon) ~UPDATE 1-Starbucks shares tumble on fears of slowing US growth July 28 Starbucks Corp's shares were on track for their worst one-day decline in five years on Friday as the coffee chain's latest quarterly report triggered concerns of a slowdown in sales in the United States, its biggest market. ~US STOCKS-Wall St dragged lower by Amazon, tobacco stocks * Indexes down: Dow 0.05 pct, S&P; 0.35 pct, Nasdaq 0.43 pct (Adds details, changes comment, updates prices) ~Starbucks puts spotlight on China as U.S. growth cools LOS ANGELES Starbucks Corp's  new chief executive said the world's biggest coffee chain is making a long-term investment in China, amid worries that growth from its dominant U.S. market is cooling. | Video  ~
TWX,AT&T; executives to run combined company after Time Warner deal NEW YORK, July 28 AT&T; Inc said on Friday that its executives will head its media and wireless businesses following the close of its $85.4 billion acquisition of Time Warner Inc. ~
URI,BRIEF-United Rentals announces pricing of $925 mln of 4.875 pct senior notes due 2028 * United Rentals announces pricing of $925 million of 4.875 pct senior notes due 2028 ~BRIEF-United Rentals unit is offering $925 mln principal amount of senior notes due 2028 * United Rentals announces proposed offering of $925 million of senior notes due 2028 ~
VTR,BRIEF-Ventas reports 2017 second quarter results * Q2 earnings per share view $0.45 -- Thomson Reuters I/B/E/S ~
WMT,UPDATE 1-Walmart Chile workers vote to go on strike SANTIAGO, July 28 The union representing workers at Lider, Wal-Mart Stores Inc's main supermarket chain in Chile, said on Friday they had voted to go on strike for higher pay. ~Walmart Chile workers vote to go on strike SANTIAGO, July 28 The union representing workers at Lider, Wal-Mart Stores Inc's main supermarket chain in Chile, said on Friday they had voted to go on strike for higher pay. ~
WFC,Wells Fargo faces angry questions after new sales abuses uncovered NEW YORK, July 28 New revelations that Wells Fargo & Co spent years enrolling unknowing borrowers in costly auto insurance has put the bank under new pressure to answer for a months-long scandal over sales practices that have harmed millions of Americans. ~U.S. Senator Warren calls on Fed to remove Wells Fargo board members WASHINGTON U.S. Senator Elizabeth Warren called on Federal Reserve Chair Janet Yellen to remove members of Wells Fargo & Co's board after revelations the company improperly charged customers for auto insurance. ~Senator Warren calls on Fed to remove Wells Fargo board members WASHINGTON U.S. Senator Elizabeth Warren called on Federal Reserve Chair Janet Yellen to remove members of Wells Fargo & Co's board after revelations the company improperly charged customers for auto insurance. ~U.S. Senator Warren calls on Fed to remove Wells Fargo board members WASHINGTON, July 28 U.S. Senator Elizabeth Warren called on Federal Reserve Chair Janet Yellen to remove members of Wells Fargo & Co's board after revelations the company improperly charged customers for auto insurance. ~Wells scandals show rolling back financial reforms dangerous: Democratic senator WASHINGTON The U.S. Senate Banking Committee's top Democrat said on Friday that the latest Wells Fargo & Co  scandal, where customers were wrongly charged, shows that regulatory reforms resulting from the financial crisis should not be dismantled. ~New York City Comptroller Stringer calls for new chairman at Wells Fargo BOSTON New York City Comptroller Scott Stringer on Friday called on Wells Fargo & Co  to replace its chairman Stephen Sanger after the bank said customers were wrongly charged for auto loan insurance. ~New York City Comptroller Stringer calls for new chairman at Wells Fargo BOSTON, July 28 New York City Comptroller Scott Stringer on Friday called on Wells Fargo & Co to replace its chairman Stephen Sanger after the bank said customers were wrongly charged for auto loan insurance. ~Wells Fargo to refund $80 million to customers hit by car loan insurance Wells Fargo and Co said it would reimburse about $80 million to 570,000 customers who may have been charged wrongly due to issues related to auto collateral protection insurance (CPI) policies. ~UPDATE 1-Wells Fargo to refund $80 mln to customers hit by car loan insurance July 27 Wells Fargo and Co said it would reimburse about $80 million to 570,000 customers who may have been charged wrongly due to issues related to auto collateral protection insurance (CPI) policies. ~
WDC.O,Toshiba to give Western Digital notice on closing memory sale Toshiba Corp  has agreed to give Western Digital Corp  two weeks' notice before closing any sale of a memory chip unit that would involve transferring joint venture shares that Western Digital claims give it a say in the $18 billion sale of the unit. ~UPDATE 2-Toshiba to give Western Digital notice on closing memory sale July 28 Toshiba Corp has agreed to give Western Digital Corp two weeks' notice before closing any sale of a memory chip unit that would involve transferring joint venture shares that Western Digital claims give it a say in the $18 billion sale of the unit. ~BRIEF-Toshiba comments on benefits of joint stipulation with SanDisk * Toshiba - Co and SanDisk/Western Digital have reached agreement that removes need for further action by court on SanDisk's request for preliminary injunction ~Toshiba to give Western Digital notice on closing memory sale July 28 Toshiba Corp has agreed to give Western Digital Corp two weeks' notice before closing any sale of a memory chip unit that would involve transferring joint venture shares that Western Digital claims give it a say in the $18 billion sale of the unit. ~
