AET,Aetna CEO says acquisitions aimed directly at size not on its list NEW YORK, May 22 Aetna Inc Chief Executive Mark Bertolini said on Monday that growing through acquisitions in its existing business lines is "not high on our list" after its deal with Humana Inc failed. ~
GOOGL.O,EU to conclude Google antitrust cases in next few months OXFORD, England EU antitrust regulators will rule in the "next few months" whether Alphabet's Google abused its dominance of internet searches and other areas, a senior European Commission official said on Monday, an outcome that could lead to a hefty fine. ~EU to conclude Google antitrust cases in next few months OXFORD, England, May 22 EU antitrust regulators will rule in the "next few months" whether Alphabet's Google abused its dominance of internet searches and other areas, a senior European Commission official said on Monday, an outcome that could lead to a hefty fine. ~
GOOG.O,EU to conclude Google antitrust cases in next few months OXFORD, England EU antitrust regulators will rule in the "next few months" whether Alphabet's Google abused its dominance of internet searches and other areas, a senior European Commission official said on Monday, an outcome that could lead to a hefty fine. ~EU to conclude Google antitrust cases in next few months OXFORD, England, May 22 EU antitrust regulators will rule in the "next few months" whether Alphabet's Google abused its dominance of internet searches and other areas, a senior European Commission official said on Monday, an outcome that could lead to a hefty fine. ~
BRKa.N,Ukrainian hacker gets prison in U.S. insider trading case A Ukrainian computer hacker was sentenced on Monday to 2-1/2 years in prison over his role in a global scheme to conduct insider trading based on stolen, yet-to-be-published corporate news releases, U.S. prosecutors said. ~CORRECTED-Ukrainian hacker gets prison in U.S. insider trading case May 22 A Ukrainian computer hacker was sentenced on Monday to 2-1/2 years in prison over his role in a global scheme to conduct insider trading based on stolen, yet-to-be-published corporate news releases, U.S. prosecutors said. ~
BA,Boeing wins $1.09 billion U.S. defense contract -Pentagon WASHINGTON, May 22 Boeing Co was awarded a $1.09 billion undefinitized modification to a previously awarded contract for the procurement of Redesigned Kill Vehicle development, the Pentagon said in a statement on Monday. ~BRIEF-Viasat says got contract from Boeing to deliver KOR-24A small tactical terminals for integration onto Boeing's AV-8B Harrier attack aircraft * Boeing taps viasat's small tactical terminal for the u.s. Marine corps' av-8b harrier attack aircraft program ~BRIEF-Triumph and Boeing sign MOA on expanded partnership * MOA supports Triumph's participation in Boeing's growth platforms within their commercial aircraft, defense programs Source text for Eikon: Further company coverage: ~UPDATE 2-China, Russia set up wide-body jet firm in new challenge to Boeing, Airbus * Aim to take 10 pct of market from Boeing 787, Airbus A350 (Adds quotes, details of JV) ~PRESS DIGEST- Canada - May 22 May 22 The following are the top stories from selected Canadian newspapers. Reuters has not verified these stories and does not vouch for their accuracy. ~China, Russia formalise Shanghai JV to build wide-body jet SHANGHAI, May 22 China and Russia on Monday completed the formal registration of a joint venture to build a proposed wide-body jet, kickstarting the full-scale development of a programme that ultimately aims to compete with Boeing and Airbus. ~
CBS,Soccer-Arsenal owner Kroenke says his shares in club not for sale May 22 Arsenal majority owner Stan Kroenke's KSE (Kroenke Sports & Entertainment) UK Inc said on Monday its shares in the Premier League club were not for sale after media reports that the club's second-largest investor had made an offer to buy out Kroenke. ~
CELG.O,UPDATE 2-Celgene MS drug clears key trial, but disability data falls short May 22 Celgene Corp's multiple sclerosis drug met the main goal of reducing annualized relapse rate, compared with Biogen Inc's Avonex, in a second late-stage trial, but failed to outperform Avonex in slowing disability progression rate. ~Celgene's multiple sclerosis drug succeeds in late-stage trial May 22 Celgene Corp said its oral drug to treat relapsing multiple sclerosis met the main goal of reducing annualized relapse rate, when compared to Biogen Inc's Avonex, in a second late-stage study. ~BRIEF-Celgene announces positive results from radiance * Celgene announces positive results from radiance, the second pivotal phase III trial of oral ozanimod in patients with relapsing multiple sclerosis ~
CHK,BRIEF-Chesapeake Energy announces private placement of $750 mln of senior notes * Chesapeake Energy Corporation announces private placement of $750,000,000 of senior notes ~
C,BRIEF-Citi issues statement on settlement with U.S. DOJ related to Banamex USA * Citi statement on settlement with U.S. Department of Justice ~U.S. Justice Dept., Citigroup settle probe into Banamex USA NEW YORK The U.S. Department of Justice and Citigroup Inc  said on Monday that they have settled a criminal investigation into violations of anti-money laundering rules and the Bank Secrecy Act at the bank's Banamex USA unit. ~UPDATE 1-U.S. Justice Dept., Citigroup settle probe into Banamex USA NEW YORK, May 22 The U.S. Department of Justice and Citigroup Inc said on Monday that they have settled a criminal investigation into violations of anti-money laundering rules and the Bank Secrecy Act at the bank's Banamex USA unit. ~U.S. Justice Dept, Citigroup settle last of Banamex probe NEW YORK, May 22 The U.S. Department of Justice and Citigroup Inc said on Monday that they have settled a criminal investigation into violations of anti-money laundering rules and the Bank Secrecy Act at the bank's Banamex USA unit. ~BRIEF-Nasdaq and Citi announce pioneering blockchain and global banking integration * Nasdaq and Citi announce pioneering blockchain and global banking integration Source text for Eikon: Further company coverage: ~
XOM,BRIEF-Exxon Mobil completes new polyethylene lines at Mont Belvieu plastics plant * Exxon Mobil completes new polyethylene lines at Mont Belvieu plastics plant ~Ahead of Exxon's annual meeting, climate activists gain ground BOSTON Shareholder activists focused on climate issues are gaining traction in their push to have large energy companies and utilities take account of the impact rising global temperatures could have on their businesses. ~Ahead of Exxon's annual meeting, climate activists gain ground BOSTON, May 22 Shareholder activists focused on climate issues are gaining traction in their push to have large energy companies and utilities take account of the impact rising global temperatures could have on their businesses. ~
FB.O,Facebook leaked documents show types of content it allows -Guardian May 21 Leaked Facebook Inc documents show how the social media company moderates issues such as hate speech, terrorism, pornography and self-harm on its platform, the Guardian reported, citing internal guidelines seen by the newspaper. ~
F,UPDATE 9-Ford names Hackett as CEO to tackle car rivals, Silicon Valley WASHINGTON/DEARBORN, Mich., May 22 Ford Motor Co abruptly named James Hackett as chief executive on Monday, responding to investors' growing unease about the U.S. automaker's slumping stock price and its ability to counter threats from longtime rivals and Silicon Valley. ~New Ford CEO Hackett transformed Steelcase, football program DETROIT Ford Motor Co's  new chief executive officer transformed office furniture maker Steelcase Inc  into a global leader, but in Michigan, he may be more revered as the man who turned around a troubled college football program. ~CEO ejection hardly gets Ford back in the race SHANGHAI (Reuters Breakingviews) - Ford Motor’s many flubs under Mark Fields were becoming existential for the $43 billion carmaker’s founding family. Two weeks ago, a majority of those shareholders not named Ford voted to abolish the family's super-voting stock. The Fords took the hint, and the chief executive is now leaving. But naming a 62-year-old from the furniture trade to replace him hints at how unprepared the family was for a revolt. ~Ford confirms it is ousting CEO, naming new chief executive WASHINGTON Ford Motor Co confirmed Monday it is ousting its chief executive Mark Fields and replacing him with the head of the company's unit overseeing self-driving car efforts. ~Ford confirms it is ousting CEO, naming new chief executive WASHINGTON, May 22 Ford Motor Co confirmed Monday it is ousting its chief executive Mark Fields and replacing him with the head of the company's unit overseeing self-driving car efforts. ~BRIEF-Ford appoints Jim Hackett as president and CEO * Ford appoints Jim Hackett as CEO to strengthen operations, transform for future; Farley, Hinrichs, Klevorn take on new roles ~BRIEF-Ford to conduct news conference * Says will host a news conference at 9:45 A.M. EDT today at Ford world headquarters Source text for Eikon: Further company coverage: ~CORRECTED-Ford to replace CEO Mark Fields with James Hackett - Forbes May 22 Ford Motor Co Chief Executive Mark Fields will leave the carmaker as part of a shake-up that includes other top executive changes, Forbes reported late on Sunday, citing a person familiar with the situation. ~BRIEF-Ford Motor CEO Mark Fields leaving co, to be replaced by James Hackett - Forbes * Ford Motor CEO Mark Fields leaving co, and to be replaced by head of its Ford Smart Mobility LLC subsidiary, James Hackett - Forbes Source: http://bit.ly/2qKrDSB Further company coverage: ~
GD,REFILE-US STOCKS-Wall St gains as defense, tech stocks rise May 22 U.S. stocks rose on Monday, boosted by technology shares and by defense companies, which rose after the United States and Saudi Arabia signed a multi-billion dollar arms deal. ~US STOCKS-Wall St extends gains as defense, tech stocks rise * Indexes up: Dow 0.46 pct, S&P; 0.48 pct, Nasdaq 0.69 pct (Updates to early afternoon) ~
GE,GE to face probe related to LM Wind Power deal - Bloomberg May 22 General Electric Co is being investigated by the European Union for providing misleading information during a merger review, Bloomberg reported on Monday, citing two people familiar with the case. ~BRIEF-GE said to face probe for misleading EU over $1.7 bln deal- Bloomberg, citing sources * GE said to face probe for misleading EU over $1.7 billion deal- Bloomberg, citing sources ~
IBM,UK Stocks-Factors to watch on May 22     May 22 Britain's FTSE 100 index is seen opening up 15 points at 7,486 on Monday, according to financial bookmakers.           * M&S;:  Britain's Marks & Spencer is expected to report a renewed decline in clothing and homeware sales in its latest quarter, dampening the euphoria of the previous three months when it reported a first increase in nearly two years.     * BT: Italian investigators have seized documents from the Milan offices of International Business Machines Corp as par ~
LLY,CORRECTED-U.S., China accelerate beef talks; deal possible by early June CHICAGO, May 19 Talks on restarting U.S. beef exports to China are moving fast and final details should be in place by early June, the U.S. Department of Agriculture said on Friday, allowing American farmers to vie for business that has been lost by rival Brazil. ~U.S., China accelerate beef talks; deal possible by early June  (This version of the May 19th story corrects paragraphs 2 and 18 to show China will likely test for residue of beta-agonists in beef instead of banning beef from cattle fed the drugs) ~CORRECTED-RPT-U.S., China accelerate beef talks; deal possible by early June CHICAGO, May 19 Talks on restarting U.S. beef exports to China are moving fast and final details should be in place by early June, the U.S. Department of Agriculture said on Friday, allowing American farmers to vie for business that has been lost by rival Brazil. ~CORRECTED-U.S., China accelerate beef talks; deal possible by early June CHICAGO, May 19 Talks on restarting U.S. beef exports to China are moving fast and final details should be in place by early June, the U.S. Department of Agriculture said on Friday, allowing American farmers to vie for business that has been lost by rival Brazil. ~
LMT,REFILE-US STOCKS-Wall St gains as defense, tech stocks rise May 22 U.S. stocks rose on Monday, boosted by technology shares and by defense companies, which rose after the United States and Saudi Arabia signed a multi-billion dollar arms deal. ~US STOCKS-Wall St extends gains as defense, tech stocks rise * Indexes up: Dow 0.46 pct, S&P; 0.48 pct, Nasdaq 0.69 pct (Updates to early afternoon) ~
MRK,BRIEF-Ablynx to receive 15 million euros milestone payment * NOVEL NANOBODY TO START CLINICAL DEVELOPMENT IN OSTEOARTHRITIS - ABLYNX TO RECEIVE €15 MILLION MILESTONE PAYMENT ~
MS,Morgan Stanley shareholders approve executive compensation plan PURCHASE, N.Y. Morgan Stanley's  executive compensation plan received the support of over 90 percent of its shareholders at the bank's annual meeting in its Purchase, New York wealth management headquarters on Monday. ~UPDATE 1-Morgan Stanley shareholders approve executive compensation plan PURCHASE, N.Y., May 22 Morgan Stanley's executive compensation plan received the support of over 90 percent of its shareholders at the bank's annual meeting in its Purchase, New York wealth management headquarters on Monday. ~Morgan Stanley shareholders approve executive compensation plan PURCHASE, N.Y., May 22 Morgan Stanley's executive compensation plan received the support of over 90 percent of its shareholders at the bank's annual meeting in its Purchase, New York wealth management headquarters on Monday. ~
PPG,Shareholders go to court seeking to oust Akzo chairman AMSTERDAM Akzo Nobel  shareholders angered by the Dulux paint maker's rejection of a 26.3 billion euro ($29.5 billion) takeover proposal from U.S. rival PPG Industries  took their fight to an Amsterdam court on Monday. | Video  ~UPDATE 3-Shareholders go to court seeking to oust Akzo chairman * Court ruling expected May 29 (Adds Akzo reaction, judge's questions, court to rule May 29) ~Shareholders take Akzo Nobel to court in effort to aid PPG takeover AMSTERDAM, May 22 Akzo Nobel shareholders angered by the Dutch paint maker's rejection of a 26.3 billion euro ($29.5 billion) takeover offer from U.S. rival PPG Industries go to court on Monday seeking a pivotal victory in the continuing battle. ~
PPL,Ahead of Exxon's annual meeting, climate activists gain ground BOSTON Shareholder activists focused on climate issues are gaining traction in their push to have large energy companies and utilities take account of the impact rising global temperatures could have on their businesses. ~Ahead of Exxon's annual meeting, climate activists gain ground BOSTON, May 22 Shareholder activists focused on climate issues are gaining traction in their push to have large energy companies and utilities take account of the impact rising global temperatures could have on their businesses. ~
REGN.O,Regeneron, Sanofi rheumatoid arthritis drug wins U.S. approval The U.S. Food and Drug Administration approved Regeneron Pharmaceuticals and Sanofi's biotech drug for adults with moderate to severe rheumatoid arthritis, the two companies said on Monday. ~Regeneron, Sanofi rheumatoid arthritis drug wins U.S. approval May 22 The U.S. Food and Drug Administration approved Regeneron Pharmaceuticals and Sanofi's biotech drug for adults with moderate to severe rheumatoid arthritis, the two companies said on Monday. ~BRIEF-Regeneron, Sanofi RA drug wins FDA nod; co's price it at $39,000/patient/yr * Regeneron and sanofi announce fda approval of kevzara® (sarilumab) for the treatment of moderately to severely active rheumatoid arthritis in adult patients ~
KO,BRIEF-The Coca-Cola company announces cash tender offer and consent solicitation * The Coca-Cola company announces cash tender offer and consent solicitation ~
FOXA.O,Scandal-plagued Fox News hit with more lawsuits in U.S. court Fox News was hit with new sexual harassment and discrimination lawsuits on Monday, adding to the catalog of complaints that has rattled the U.S. cable news network and its corporate parent 21st Century Fox Inc . ~Scandal-plagued Fox News hit with more lawsuits in U.S. court May 22 Fox News was hit with new sexual harassment and discrimination lawsuits on Monday, adding to the catalog of complaints that has rattled the U.S. cable news network and its corporate parent 21st Century Fox Inc. ~
FOX.O,Scandal-plagued Fox News hit with more lawsuits in U.S. court Fox News was hit with new sexual harassment and discrimination lawsuits on Monday, adding to the catalog of complaints that has rattled the U.S. cable news network and its corporate parent 21st Century Fox Inc . ~Scandal-plagued Fox News hit with more lawsuits in U.S. court May 22 Fox News was hit with new sexual harassment and discrimination lawsuits on Monday, adding to the catalog of complaints that has rattled the U.S. cable news network and its corporate parent 21st Century Fox Inc. ~
UTX,BRIEF-UAC aims to complete maiden flight, first delivery of wide-body jet between 2025-2028 May 22 Russia's United Aircraft Corp (UAC) president Yuri Slyusar said in Shanghai on Monday: ~
