ABT,UPDATE 3-Abbott profit forecast gets a lift from St. Jude integration * Shares rise as much as 2.8 pct to $50.83 (Adds conference call details; updates shares) ~Abbott's quarterly profit halves as costs soar July 20 Diversified healthcare company Abbott Laboratories reported a 55 percent drop in quarterly profit on Thursday, hurt by higher costs. ~
AET,UPDATE 11-Republicans meet late into night as Trump demands new U.S. healthcare plan * Vote to open repeal debate next week (Updates with Republican meeting; adds Senator Corker on McCain) ~
AMZN.O,Deals of the day-Mergers and acquisitions July 20 The following bids, mergers, acquisitions and disposals were reported by 2000 GMT on Thursday: ~US STOCKS-S&P;, Dow flat as retailers weigh; Nasdaq edges higher * Dow off 0.08 pct, S&P; up 0.08 pct, Nasdaq up 0.16 pct (Updates to early afternoon) ~RPT-UPDATE 2-Sears to sell Kenmore appliances on Amazon; shares jump July 20 Sears Holdings Corp's shares soared as much as 24 percent after the struggling retailer said it would sell its Kenmore home appliances on Amazon.com and integrate the brand's smart gadgets with the online giant's Alexa digital assistant. ~UPDATE 2-Sears to sell Kenmore appliances on Amazon; shares jump * Deal could provide modest boost to sales - analysts (Adds details, analyst comment) ~US STOCKS-Wall St flat as consumer stocks, weak earnings weigh * Dow off 0.05 pct, S&P; up 0.03 pct, Nasdaq down 0.04 pct (Adds details, changes comment, updates prices) ~BRIEF-Sears Holdings Corp ‍announces launch of kenmore products on Amazon.Com​ * Sears Holdings Corp - ‍announced launch of kenmore products on Amazon.Com​ ~Sears to sell Kenmore appliances on Amazon July 20 Sears Holdings Corp said its Kenmore brand of home appliances would now be available on Amazon.com, sending the struggling retailer's shares up 7 percent in premarket trading on Thursday. ~
AAPL.O,Patent lawyer for Apple dies after battle with cancer San Francisco-based intellectual property lawyer Rachel Krevans, who represented Apple Inc in its smartphone patent fight with Samsung Electronics Co, died on Wednesday from cancer. ~Tech group sides with Apple in Qualcomm's iPhone ban dispute A group representing major technology companies has aligned itself against Qualcomm Inc in its legal dispute with Apple Inc by calling on regulators to reject Qualcomm's bid to ban the import of iPhones. ~Tech group sides with Apple in Qualcomm's iPhone ban dispute July 20 A group representing major technology companies has aligned itself against Qualcomm Inc in its legal dispute with Apple Inc by calling on regulators to reject Qualcomm's bid to ban the import of iPhones. ~UPDATE 1-Taiwan's solid June export orders point to H2 momentum * June export orders +13.0 pct vs 7.55 pct Reuters poll f'cast ~
BAX,U.S. FTC approves Baxter's acquisition of Claris business with condition WASHINGTON, July 20 Baxter International Inc and Claris Lifesciences Ltd have agreed to divest two types of pharmaceutical products to settle U.S. Federal Trade Commission charges that Baxter's proposed acquisition of Claris’ injectable drugs business is anticompetitive, the agency said on Thursday. ~
BBY,US STOCKS-S&P;, Dow flat as retailers weigh; Nasdaq edges higher * Dow off 0.08 pct, S&P; up 0.08 pct, Nasdaq up 0.16 pct (Updates to early afternoon) ~
BLK,BRIEF-Serco appoints Blackrock for a 1.5 bln stg liability driven investing portfolio * Trustees of Serco pension scheme have appointed Blackrock to manage its liability driven investing (LDI) portfolio ~
BA,Oman Air in talks with Airbus, Boeing to expand wide-body fleet to 25 jets KUALA LUMPUR, July 20 Oman's national airline is in talks with planemakers Airbus and Boeing to expand its wide-body fleet to 25 jets and hopes to conclude the deal in the next two to three months, its chief executive said on Thursday. ~
CMG,UPDATE 3-Chipotle shares fall on Norovirus, rodent incidents BOSTON, July 20 Chipotle Mexican Grill Inc shares fell to a four-year low on Thursday after testing confirmed Norovirus in a customer who ate at one of the chain's Virginia restaurants and a video of rodents crawling on the floor of a Dallas shop went viral. ~Chipotle Virginia customer tested positive for Norovirus -official BOSTON Testing has confirmed Norovirus in a customer who ate at the Virginia Chipotle Mexican Grill Inc restaurant that was briefly closed earlier this week following multiple reports of diners falling ill, a county health department official said on Thursday. ~Chipotle Virginia customer tested positive for norovirus -official BOSTON, July 20 Testing has confirmed norovirus in a customer who ate at the Virginia Chipotle Mexican Grill Inc restaurant that was briefly closed earlier this week following multiple reports of diners falling ill, a county health department official told Reuters on Thursday. ~
CSCO.O,Arista loses bid to lift import ban in Cisco battle July 20 The U.S. government on Thursday dealt Arista Networks Inc a loss in its technology dispute with Cisco Systems Inc and refused to set aside an order blocking importation of some of Arista's network switches. ~
C,UPDATE 2-Citigroup, Deutsche Bank beef up Frankfurt presence in Brexit response LONDON/FRANKFURT, July 20 Two global banks, Citigroup and Deutsche Bank, are beefing up their presence in Frankfurt to deal with the impact of Britain leaving the European Union. ~Citigroup sees slightly lower returns from branded cards business NEW YORK Citigroup Inc  trimmed its outlook on Friday for the profitability of its North American branded credit cards business to a 2.15 percent return on assets from 2.25 percent. ~UPDATE 1-Citigroup sees slightly lower returns from branded cards business NEW YORK, July 20 Citigroup Inc trimmed its outlook on Friday for the profitability of its North American branded credit cards business to a 2.15 percent return on assets from 2.25 percent. ~Citigroup sees slightly lower returns from branded cards business NEW YORK, July 20 Citigroup Inc trimmed its outlook on Friday for the profitability of its North American branded credit cards business to a 2.15 percent return on assets from 2.25 percent. ~BRIEF-Citi and PayPal expand partnership to deliver enhanced payments experience * Citi and PayPal expand partnership to deliver enhanced payments experience ~Citi plans EU broker-dealer in Frankfurt after Brexit LONDON, July 19 (IFR) - US bank Citigroup said it will set up a broker-dealer in Frankfurt for its European Union operations when Britain leaves the European Union, joining other Wall Street rivals choosing to move staff to the German financial centre. ~Citigroup says may need to create 150 jobs in EU due to Brexit LONDON, July 20 U.S. bank Citigroup said on Thursday that it may need to create 150 new jobs in the European Union to deal with the impact of Britain leaving the bloc, as it confirmed it would headquarter its EU trading operations in Frankfurt. ~
CMA,Bombardier wins dismissal of Comerica aircraft payments lawsuit NEW YORK Bombardier Inc  has won the dismissal of a U.S. lawsuit in which Comerica Inc  sought millions of dollars after the Canadian aircraft maker was unable to find buyers for four planes whose leases had expired. ~Bombardier wins dismissal of Comerica aircraft payments lawsuit NEW YORK, July 20 Bombardier Inc has won the dismissal of a U.S. lawsuit in which Comerica Inc sought millions of dollars after the Canadian aircraft maker was unable to find buyers for four planes whose leases had expired. ~BRIEF-Dragonwave announces receipt of repayment demand and notice of intention to enforce security * Dragonwave announces receipt of repayment demand and notice of intention to enforce security from comerica bank ~
GLW,Corning vows new jobs as part of Trump's "Made in America" week NEW YORK, July 20 Corning Inc said at an event with U.S. President Donald Trump on Thursday that it plans to spend $500 million and create 1,000 jobs in the United States making a new kind of glass for vials and cartridges to hold injectable drugs. ~
DAL,Delta proceeds with New York's LaGuardia $4 bln project without Goldman NEW YORK, July 20 Transportation officials on Thursday approved a revised $4 billion plan from Delta Air Lines to renovate its terminal at New York's LaGuardia Airport after Goldman, Sachs & Co, a financial partner in the project, exited the deal. ~
DISCA.O,Liberty Media discusses potential deal with Univision -source July 19 U.S. Spanish-language broadcaster Univision Communications Inc held early-stage talks with John Malone's Liberty Media Corp, after he expressed interest in an acquisition or significant investment, a person familiar with the matter said on Wednesday. ~
DISCK.O,Liberty Media discusses potential deal with Univision -source July 19 U.S. Spanish-language broadcaster Univision Communications Inc held early-stage talks with John Malone's Liberty Media Corp, after he expressed interest in an acquisition or significant investment, a person familiar with the matter said on Wednesday. ~
DOW,Bunge overhaul is latest shake-up for struggling grain sector CHICAGO, July 19 Global grain trader Bunge Ltd's sweeping plans to overhaul its business and cut costs may not be enough to compensate for weak earnings and could still leave it vulnerable to a new bid from diversified rival Glencore PLC. ~
EBAY.O,UPDATE 3-EBay shares fall on tepid adjusted profit forecast July 20 EBay Inc warned on Thursday that adjusted profit this quarter could fall below analysts' estimates, as it continues to invest in marketing and revamping its platforms to attract more shoppers, sending its shares down more than 5 percent. ~BRIEF-Ebay reports Q2 non-GAAP earnings of $0.45/shr from continuing operations * Q2 non-GAAP earnings per share $0.45 from continuing operations ~Ebay's profit plunges 94 pct July 20 EBay Inc on Thursday reported a nearly 94 percent fall in quarterly profit, hurt by higher expenses as well as income tax provisions. ~
XOM,UPDATE 3-Exxon sues U.S. over fine levied for Russia deal under Tillerson WASHINGTON/HOUSTON, July 20 Exxon Mobil Corp sued the U.S. government on Thursday, blasting as "unlawful" and "capricious" a $2 million fine levied against it for a three-year-old oil joint venture with Russia's Rosneft . ~BRIEF-Exxon Mobil to challenge finding by OFAC that it violated U.S. sanctions against Russia in 2014​ * Says ‍launched legal challenge to finding by treasury department's office of foreign assets control that it violated U.S. sanctions against Russia in 2014​ ~U.S. fines Exxon Mobil over Ukraine-related sanctions violations WASHINGTON, July 20 The U.S. Treasury Department on Thursday announced a civil penalty against Exxon Mobil Corp and its U.S. subsidiaries for violating sanctions regulations related to Ukraine in May 2014, fining the global oil company $2 million. ~
FDX,BRIEF-Fedex general counsel and secretary to retire September 2017 * Fedex Corp Executive Vice President, General Counsel and Secretary, Christine P. Richards, to retire September 30, 2017 ~BRIEF-Fedex freight drivers reject Teamsters in Pennsylvania * City and road drivers in Croydon voted to decertify teamsters union as their bargaining representative Source text for Eikon: Further company coverage: ~
F,Ford's 'golden noses' seek edge in slowing China car market NANJING, China While Western drivers like the 'new car' smell fresh off the production line, Chinese would rather their cars didn't smell of anything - a cultural divide that's testing car makers seeking an edge to revive sales in the world's biggest auto market. | Video  ~Volvo Cars profit rises, plans tech-sharing Geely venture STOCKHOLM Sweden's Volvo Cars sold more vehicles in Europe and China in the first half that helped drive up earnings 21 percent and said it would set up a joint venture with its Chinese parent to share technology with other brands in the Geely group. ~UPDATE 1-Volvo Cars profit rises, plans tech-sharing Geely venture STOCKHOLM, July 20 Sweden's Volvo Cars sold more vehicles in Europe and China in the first half that helped drive up earnings 21 percent and said it would set up a joint venture with its Chinese parent to share technology with other brands in the Geely group. ~
GS,Delta proceeds with New York's LaGuardia $4 bln project without Goldman NEW YORK, July 20 Transportation officials on Thursday approved a revised $4 billion plan from Delta Air Lines to renovate its terminal at New York's LaGuardia Airport after Goldman, Sachs & Co, a financial partner in the project, exited the deal. ~Factbox: Impact on banks from Britain's vote to leave the EU Global banks have said they could move thousands of jobs out of Britain to prepare for Brexit, the country's planned exit from the European Union. ~Goldman's rotten trading quarter is a familiar smell on Wall Street Big Wall Street banks have spent billions of dollars and untold man-hours in recent years transforming their trading desks from hedge-fund like operations trading on their own account into market-making businesses offering a price based on what customers want to buy or sell. ~
HOG,U.S. Justice Department drops $3 million Harley-Davidson emissions penalty WASHINGTON The Justice Department on Thursday announced it has dropped a requirement that Harley-Davidson Inc spend $3 million to reduce air pollution as part of a settlement the Obama administration announced in August. ~U.S. Justice Department drops $3M Harley-Davidson emissions penalty WASHINGTON, July 20 The Justice Department on Thursday announced it has dropped a requirement that Harley-Davidson Inc spend $3 million to reduce air pollution as part of a settlement the Obama administration announced in August. ~
HPE,Blackstone raising at least $3 billion in first Asia PE fund: sources HONG KONG Blackstone Group LP is seeking to raise up to $3 billion in its first Pan-Asia buyout fund for investments in sectors including high-end manufacturing and healthcare, people familiar with the plan told Reuters. ~UPDATE 1-Blackstone raising at least $3 bln in first Asia PE fund-sources * Fund size not finalised, could be bigger than $3 bln-source ~Blackstone raising at least $3 bln in first Asia PE fund * Fund size not finalised, could be bigger than $3 bln-source ~
HD,US STOCKS-S&P;, Dow flat as retailers weigh; Nasdaq edges higher * Dow off 0.08 pct, S&P; up 0.08 pct, Nasdaq up 0.16 pct (Updates to early afternoon) ~
INTC.O,Tech group sides with Apple in Qualcomm's iPhone ban dispute A group representing major technology companies has aligned itself against Qualcomm Inc in its legal dispute with Apple Inc by calling on regulators to reject Qualcomm's bid to ban the import of iPhones. ~Tech group sides with Apple in Qualcomm's iPhone ban dispute July 20 A group representing major technology companies has aligned itself against Qualcomm Inc in its legal dispute with Apple Inc by calling on regulators to reject Qualcomm's bid to ban the import of iPhones. ~
ISRG.O,UPDATE 1-Intuitive Surgical profit beats Wall Street estimates July 20 Intuitive Surgical Inc on Thursday reported a higher-than-expected second-quarter profit, citing increased sales of its da Vinci surgical robots. ~Intuitive Surgical second-quarter net profit rises 20 percent July 20 Intuitive Surgical Inc on Thursday said its second-quarter net income rose 20 percent due to higher sales of its da Vinci surgical robots as well as an accounting change. ~BRIEF-Intuitive Surgical announces Q2 GAAP earnings per share $5.77 * Q2 earnings per share view $5.79 -- Thomson Reuters I/B/E/S ~
JPM,PayPal to partner with JPMorgan July 20 PayPal Inc said on Thursday it would partner with JPMorgan Chase & Co, allowing the bank's customers to link their Chase Pay and PayPal accounts. ~BRIEF-JPMorgan Chase and PayPal strike payments partnership * JPMorgan Chase and PayPal strike payments partnership to enhance payments online, in app and in store ~
KEY,UPDATE 2-KeyCorp's 2017 loan forecast casts cloud over profit beat July 20 U.S. regional bank KeyCorp said it expects average loans at the end of 2017 to be at the low end of its previous forecast, sending shares down as much as 4.7 percent. ~BRIEF-KeyCorp sees full year 2017 net interest income $3.8 bln-$3.9 bln * Keycorp sees net interest income for full year 2017 in range of $3.8 billion to $3.9 billion - sec filing ~BRIEF-Keycorp reports Q2 net income of $393 million, or $.36 per common share * Q2 allowance for loan and lease losses $870 million versus $854 million ~KeyCorp's 2nd-qtr profit more than doubles July 20 U.S. regional bank KeyCorp's profit more than doubled in the second quarter as total interest income rose 63.3 percent. ~
LLL,L3 Technologies CEO to retire, COO to take over Aerospace communication systems provider L3 Technologies Inc  said on Wednesday that Chief Executive Officer (CEO) Michael Strianese would retire and Christopher Kubasik, who is currently the chief operating officer (COO), would succeed him. ~L3 Technologies CEO to retire, COO to take over July 19 Aerospace communication systems provider L3 Technologies Inc said on Wednesday that Chief Executive Officer (CEO)Michael Strianese would retire and Christopher Kubasik, who is currently the chief operating officer (COO), would succeed him. ~BRIEF-L3 Technologies' CEO Michael Strianese to retire * L3 chairman and CEO Michael T. Strianese announces plan to retire; board elects Christopher E. Kubasik as CEO ~
MRK,FDA tentatively approves Merck's copycat of Sanofi's Lantus Merck and Co Inc said on Thursday the U.S. Food and Drug Administration (FDA) tentatively approved its biosimilar version of French drugmaker Sanofi SA's blockbuster diabetes treatment, Lantus. ~BRIEF-Merck announces U.S. FDA grants tentative approval for Lusduna™ Nexvue™ * Merck announces U.S. FDA grants tentative approval for Lusduna™ Nexvue™ (insulin glargine injection), a follow-on biologic basal insulin ~
MSFT.O,BRIEF-Microsoft's Q4 ‍diluted GAAP earnings per share $0.83 * Microsoft - qtrly ‍diluted earnings per share was $0.83 GAAP, and $0.98 non-GAAP​ ~Microsoft's quarterly profit more than doubles July 20 Microsoft Corp reported a quarterly profit that more than doubled, helped by a tax benefit and strong growth in its cloud business. ~BRIEF-Microsoft quarterly results press release Please click on the link below for Microsoft's quarterly earnings press release: Source text: ~
MON,Bunge overhaul is latest shake-up for struggling grain sector CHICAGO Global grain trader Bunge Ltd's sweeping plans to overhaul its business and cut costs may not be enough to compensate for weak earnings and could still leave it vulnerable to a new bid from diversified rival Glencore PLC. ~Bunge overhaul is latest shake-up for struggling grain sector CHICAGO, July 19 Global grain trader Bunge Ltd's sweeping plans to overhaul its business and cut costs may not be enough to compensate for weak earnings and could still leave it vulnerable to a new bid from diversified rival Glencore PLC. ~
OMC,UPDATE 2-Omnicom results top Street on UK, Europe growth July 20 Omnicom Group Inc reported better-than-expected quarterly results as the No. 1 U.S. advertising company benefited from higher spending from businesses in Europe and the United Kingdom. ~BRIEF-Omnicom Group reports Q2 and year-to-date 2017 results * Omnicom Group reports second quarter and year-to-date 2017 results ~Omnicom reports 2.4 pct fall in revenue July 20 Omnicom Group Inc, the No.1 U.S. advertising company, reported a 2.4 percent decline in quarterly revenue on Thursday, hurt by slower growth in North America. ~
ORCL.N,UPDATE 2-Cloud services lift SAP sales but costs tether profit growth FRANKFURT, July 20 Newer cloud services powered a rise in second-quarter revenue at Germany's SAP but higher costs curbed profit growth, results from Europe's most valuable technology firm showed on Thursday. ~
PYPL.O,BRIEF-JPMorgan Chase and PayPal strike payments partnership * JPMorgan Chase and PayPal strike payments partnership to enhance payments online, in app and in store ~
PPG,BRIEF-PPG approves 13 pct dividend increase to 45 cents per share * PPG directors approve 13-percent dividend increase to 45 cents per share Source text for Eikon: Further company coverage: ~BRIEF-PPG appoints Gary Heminger to board of directors * PPG Industries Inc - Gary R. Heminger, chairman and ceo of Marathon Petroleum Corporation, has been elected to join its board of directors Source text for Eikon: Further company coverage: ~BRIEF-PPG reports Q2 earnings per share $1.95 from continuing operations * Q2 earnings per share view $1.82 -- Thomson Reuters I/B/E/S ~
PG,UPDATE 3-Unilever lifts margin target as industry pressure mounts * Anglo-Dutch firm's London-listed shares up 1.2 pct (Adds comments on activism, links to other stories) ~
PRU,UPDATE 1-Prudential Financial to reorganize U.S. businesses July 20 Life insurer Prudential Financial Inc said on Thursday that it would reorganize its U.S. businesses, placing five units into three groups, each aligned with different customer needs. ~Prudential Financial to reorganize U.S. businesses July 20 Life insurer Prudential Financial Inc said on Thursday it would reorganize its U.S. businesses, bringing the units down to three from five. ~
QCOM.O,Tech group sides with Apple in Qualcomm's iPhone ban dispute A group representing major technology companies has aligned itself against Qualcomm Inc in its legal dispute with Apple Inc by calling on regulators to reject Qualcomm's bid to ban the import of iPhones. ~Tech group sides with Apple in Qualcomm's iPhone ban dispute July 20 A group representing major technology companies has aligned itself against Qualcomm Inc in its legal dispute with Apple Inc by calling on regulators to reject Qualcomm's bid to ban the import of iPhones. ~US STOCKS-Wall St flat as home improvement retailers get Amazoned * Dow down 0.13 pct, S&P; 500 down 0.02 pct, Nasdaq up 0.08 pct (Updates to market close, changes byline) ~
SLB,Schlumberger to buy majority stake in Russia's Eurasia Drilling July 21 Russia's Eurasia Drilling Company Ltd said on Thursday it would sell a 51 percent stake in the company to the world's No. 1 oilfield services provider, U.S.-based Schlumberger NV. ~BRIEF-Eurasia Drilling says shareholders have agreed to sell to Schlumberger 51 pct of total issued share capital of the company * Eurasia Drilling Company Ltd - co's shareholders have agreed to sell to Schlumberger 51 percent of the total issued share capital of the company ~
SNI.O,Liberty Media discusses potential deal with Univision -source July 19 U.S. Spanish-language broadcaster Univision Communications Inc held early-stage talks with John Malone's Liberty Media Corp, after he expressed interest in an acquisition or significant investment, a person familiar with the matter said on Wednesday. ~
BK,UPDATE 1-BNY Mellon profit beats on higher fees and interest rates July 20 Bank of New York Mellon Corp, the world's largest custodian bank, reported a higher-than-expected quarterly profit, helped by an increase in clearing services fees and a rise in interest rates. ~BRIEF-Bank of New York Mellon Q2 earnings per share $0.88 * Qtrly provision for credit losses was a credit of $7 million versus a credit of $9 million ~CORRECTED-BNY Mellon profit gets boost from higher interest rates July 20 Bank of New York Mellon Corp reported a higher-than-expected rise in quarterly profit, helped by an increase in interest rates. ~
TRV,Travelers' quarterly profit falls on higher catastrophe losses July 20 Property and casualty insurer Travelers Cos Inc reported a 10.4 percent fall in quarterly profit on Thursday, hurt by higher catastrophe losses and lower underwriting gains. ~BRIEF-Travelers Companies Q2 earnings of $2.11 per share * Q2 earnings per share $2.11; Q2 core earnings per share $1.92 ~
FOXA.O,UPDATE 1-Murdoch made to wait few more weeks for Britain's Fox-Sky decision LONDON, July 20 Rupert Murdoch will have to wait a few more weeks to know whether Twenty-First Century Fox's bid for Sky will be referred for a lengthy British investigation. ~Britain still likely to refer Murdoch's Sky deal for further scrutiny LONDON, July 20 Britain said on Thursday it still intended to refer Rupert Murdoch's bid to buy pay-TV group Sky for further scrutiny to assess whether it would give the media mogul too much influence. ~UK to give update on Fox-Sky merger on Thursday: opposition Labour Party LONDON The British government will update parliament on Thursday on the next steps in Twenty-First Century Fox's bid for European pay-TV group Sky, the opposition Labour Party said on Twitter. ~UK to give update on Fox-Sky merger on Thursday -opposition Labour Party LONDON, July 20 The British government will update parliament on Thursday on the next steps in Twenty-First Century Fox's bid for European pay-TV group Sky , the opposition Labour Party said on Twitter. ~
