MMM,BRIEF-3M reports Q2 EPS $2.58 * 3M delivers second-quarter sales of $7.8 billion and earnings of $2.58 per share; company updates its 2017 outlook ~
ADBE.O,ADOBE SYSTEMS WILL END SUPPORT FOR WIDELY USED FLASH MULTIMEDIA SOFTWARE BY 2020 ADOBE SYSTEMS WILL END SUPPORT FOR WIDELY USED FLASH MULTIMEDIA SOFTWARE BY 2020 ~
AKAM.O,Akamai current-quarter forecasts miss estimates, shares fall Akamai Technologies Inc, which helps speed up content delivery over the internet, forecast current-quarter revenue and profit that missed Wall Street estimates, sending its shares down about 7 percent in after-hours trading on Tuesday. ~UPDATE 1-Akamai current-quarter forecasts miss estimates, shares fall July 25 Akamai Technologies Inc, which helps speed up content delivery over the internet, forecast current-quarter revenue and profit that missed Wall Street estimates, sending its shares down about 7 percent in after-hours trading on Tuesday. ~Akamai posts 21.5 pct fall in quarterly profit July 25 Akamai Technologies Inc, which helps speed up content delivery over the internet, reported a 21.5 percent fall in quarterly profit on Tuesday, hurt by higher costs. ~BRIEF-Akamai Technologies reports Q2 earnings per share $0.33 * Q2 earnings per share view $0.60 -- Thomson Reuters I/B/E/S ~
GOOGL.O,UPDATE 1-Google Canada head exits, company names interim head TORONTO, July 25 Alphabet Inc said on Tuesday that the head of its Google Canada operations, Sam Sebastian, has left the company. ~Adobe to pull plug on Flash, ending an era SAN FRANCISCO Adobe Systems Inc's Flash, a once-ubiquitous technology used to power most of the media content found online, will be retired at the end of 2020, the software company announced Tuesday. ~ADOBE SYSTEMS WILL END SUPPORT FOR WIDELY USED FLASH MULTIMEDIA SOFTWARE BY 2020 ADOBE SYSTEMS WILL END SUPPORT FOR WIDELY USED FLASH MULTIMEDIA SOFTWARE BY 2020 ~Investors unhappy as Alphabet shells out more to drive traffic There are very few things that make Alphabet Inc's  investors unhappy. A rising TAC - the cost of driving traffic to its site - is one of them. ~US STOCKS-McDonald's, Caterpillar power S&P; to record * Dow up 0.46 pct, S&P; up 0.28 pct, Nasdaq down 0.21 pct (Updates to open) ~Investors unhappy as Alphabet shells out more to drive traffic July 25 There are very few things that make Alphabet Inc's investors unhappy. A rising TAC - the cost of driving traffic to its site - is one of them. ~Alphabet adds to cash pile despite higher costs, antitrust fine SAN FRANCISCO Alphabet Inc reported a 21 percent jump in quarterly revenue on Monday, maintaining a growth rate that is rarely seen among companies its size and suggesting the big sales gains enjoyed recently by the other Internet firms are not done yet. | Video  ~UPDATE 4-Alphabet adds to cash pile despite higher costs, antitrust fine SAN FRANCISCO, July 24 Alphabet Inc reported a 21 percent jump in quarterly revenue on Monday, maintaining a growth rate that is rarely seen among companies its size and suggesting the big sales gains enjoyed recently by the other Internet firms are not done yet. ~
GOOG.O,UPDATE 1-Google Canada head exits, company names interim head TORONTO, July 25 Alphabet Inc said on Tuesday that the head of its Google Canada operations, Sam Sebastian, has left the company. ~Adobe to pull plug on Flash, ending an era SAN FRANCISCO Adobe Systems Inc's Flash, a once-ubiquitous technology used to power most of the media content found online, will be retired at the end of 2020, the software company announced Tuesday. ~ADOBE SYSTEMS WILL END SUPPORT FOR WIDELY USED FLASH MULTIMEDIA SOFTWARE BY 2020 ADOBE SYSTEMS WILL END SUPPORT FOR WIDELY USED FLASH MULTIMEDIA SOFTWARE BY 2020 ~Investors unhappy as Alphabet shells out more to drive traffic There are very few things that make Alphabet Inc's  investors unhappy. A rising TAC - the cost of driving traffic to its site - is one of them. ~US STOCKS-McDonald's, Caterpillar power S&P; to record * Dow up 0.46 pct, S&P; up 0.28 pct, Nasdaq down 0.21 pct (Updates to open) ~Investors unhappy as Alphabet shells out more to drive traffic July 25 There are very few things that make Alphabet Inc's investors unhappy. A rising TAC - the cost of driving traffic to its site - is one of them. ~Alphabet adds to cash pile despite higher costs, antitrust fine SAN FRANCISCO Alphabet Inc reported a 21 percent jump in quarterly revenue on Monday, maintaining a growth rate that is rarely seen among companies its size and suggesting the big sales gains enjoyed recently by the other Internet firms are not done yet. | Video  ~UPDATE 4-Alphabet adds to cash pile despite higher costs, antitrust fine SAN FRANCISCO, July 24 Alphabet Inc reported a 21 percent jump in quarterly revenue on Monday, maintaining a growth rate that is rarely seen among companies its size and suggesting the big sales gains enjoyed recently by the other Internet firms are not done yet. ~
AMZN.O,Retailers disregard Amazon at their peril - AlixPartners Few of the largest U.S. retailers are prepared to compete effectively with online marketplace Amazon.com as it roils their industry and helps fuel its bankruptcies, according to the AlixPartners consulting firm. ~Activist hedge funds pull hard on the M&A; lever NEW YORK Of all the demands that activist hedge funds make, one has emerged as a clear favorite over the past year: asking the management of a company they target to put up the "for sale" sign. ~Amazon has no problem hiring in UK despite Brexit uncertainties LONDON Amazon  has had no problem hiring staff in Britain and plans an extra 450 high tech jobs, its UK boss said, despite the uncertain status of non-British European Union nationals. ~RPT-Activist hedge funds pull hard on the M&A; lever NEW YORK, July 25 Of all the demands that activist hedge funds make, one has emerged as a clear favorite over the past year: asking the management of a company they target to put up the "for sale" sign. ~Activist hedge funds pull hard on the M&A; lever NEW YORK, July 25 Of all the demands that activist hedge funds make, one has emerged as a clear favorite over the past year: asking the management of a company they target to put up the "for sale" sign. ~
AMGN.O,UPDATE 2-Amgen 2nd-quarter profit tops Street view, shares fall July 25 Amgen Inc on Tuesday reported higher-than-expected second-quarter profit and raised its 2017 earnings forecast with strong sales growth in newer products for multiple myeloma and osteoporosis. ~CORRECTED-UPDATE 1-Amgen 2nd-quarter profit tops Street view, shares fall July 25 Amgen Inc on Tuesday reported higher-than-expected second-quarter profit and raised its 2017 earnings forecast as  growth in newer products helped offset declines in established blockbuster medicines. ~BRIEF-Amgen Q2 GAAP shr $2.91 * Q2 gaap earnings per share $2.91; q2 non-gaap earnings per share $3.27; q2 total revenue $5.81 billion versus $5.69 billion ~BRIEF-Amgen Q2 GAAP shr $2.91 * Q2 earnings per share view $3.11 -- Thomson Reuters I/B/E/S ~Amgen 2nd quarter profit tops Street estimates, raises forecast July 25 Amgen Inc on Tuesday reported higher-than-expected second-quarter profit and raised its 2017 earnings forecast as strong growth in newer products helped offset declines in established blockbuster medicines. ~
APC,UPDATE 9-Oil rallies 3 percent as U.S. shale shows signs of slowdown * U.S. crude oil stocks fall 10 mln bbls -API (Adds API data, adds context) ~
AAPL.O,UPDATE 1-Apple CEO promised to build 3 'big' plants in US, Trump tells WSJ July 25 Apple Inc Chief Executive Tim Cook has committed to build three big manufacturing plants in the United States, the Wall Street Journal quoted U.S. President Donald Trump as saying. ~BRIEF-Trump says Apple CEO has promised to build three manufacturing plants in U.S. - WSJ * Trump says Apple CEO has promised to build three manufacturing plants in U.S. - WSJ ~Apple CEO promised Trump to build 3 manufacturing plants in U.S. - WSJ July 25 Apple Inc Chief Executive Tim Cook has committed to build three big manufacturing plants in the United States, the Wall Street Journal quoted U.S. President Donald Trump as saying. ~Qualcomm accuses tech group of 'misdirecting' trade regulators Qualcomm Inc  fired back in its case against Apple Inc  on Monday, accusing its critics of waging a "coordinated effort aimed at misdirecting" trade regulators. ~
T,UPDATE 3-AT&T;'s quarterly profit tops Wall St estimates, shares rise NEW YORK, July 25 AT&T; Inc's quarterly profit topped Wall Street estimates on Tuesday as the No. 2 U.S. wireless carrier lowered operating costs and introduced new promotions bundling video with phone service that helped it compete in a fierce market for customers. ~AT&T;'s quarterly profit tops Wall St estimates NEW YORK, July 25 AT&T; Inc's quarterly profit topped Wall Street estimates on Tuesday as the No. 2 U.S. wireless carrier introduced new promotions that bundle video with phone service to lure customers. ~BRIEF-AT&T; reports Q2 earnings per share $0.63 * Q2 revenue $39.8 billion versus I/B/E/S view $39.79 billion ~Fitch Rates Crown Castle's Notes Offering 'BBB-'; Outlook Stable (The following statement was released by the rating agency) NEW YORK, July 25 (Fitch) Fitch Ratings has assigned a 'BBB-' rating to Crown Castle International Corp.'s (Crown) offering of senior unsecured notes due in 2024 and senior unsecured notes due in 2027, in each case subject to market and other conditions. Net proceeds from the offering will be used to finance the debt portion of Crown's acquisition of LTS Group Holdings LLC (Lightower). On July 18, 2017, Crown announced a definitive agre ~Democrats take aim at big companies in economic blueprint WASHINGTON U.S. Democrats unveiled an economic platform on Monday that included plans to address unfair market competition, rising pharmaceuticals costs and stagnant wages. | Video  ~
BRKa.N,BRIEF-Home Capital fully repays $2 bln Berkshire Hathaway backed credit facility; completes commercial mortgage asset sale * Home Capital fully repays $2 billion Berkshire Hathaway backed credit facility; completes commercial mortgage asset sale ~
BIIB.O,After strong quarter, Biogen rolls out growth strategy Biogen Inc laid out long-term plans to strengthen its mainstay multiple sclerosis (MS) business, develop more neuroscience drugs and shop for late-stage assets, after reporting robust second-quarter results on Tuesday. ~UPDATE 3-After strong quarter, Biogen rolls out growth strategy * Spinraza sales of $203 mln smash analyst estimates of $70 mln ~BRIEF-Biogen CEO: "we will explore deals of all sizes" * Biogen CEO: "overall, we maintain our global market share in multiple sclerosis (treatments)" ~US STOCKS-Caterpillar, McDonald's to lift S&P;, Dow at open * Futures up: Dow 96 pts, S&P; 6.5 pts, Nasdaq 5 pts (Adds details, comment, updates prices) ~BRIEF-Biogen reports Q2 EPS $4.07 * Biogen reports record quarterly revenues of $3.1 billion, raises full year revenue guidance ~Biogen revenue rises 6.4 pct on Spinraza demand July 25 U.S. drugmaker Biogen Inc reported a 6.4 percent rise in quarterly revenue, driven by strong demand for its recently approved spinal muscular atrophy drug, Spinraza. ~
BLK,Blackrock, Lightsource target 1 bln stg UK solar power portfolio LONDON, July 25 Asset manager Blackrock and solar energy firm Lightsource have agreed to jointly create a 1 billion pound ($1.3 billion) portfolio of solar power assets in Britain over the next three years, the two companies said on Tuesday. ~BRIEF-Lightsource and BlackRock to buy UK solar power assets worth 1 bln stg * LIGHTSOURCE AND BLACKROCK REAL ASSETS TARGET A GBP 1 BILLION UK SOLAR PARTNERSHIP ~Novo Banco launches debt swap to conclude sale LISBON, July 25 Portugal's state-rescued Novo Banco has launched a debt swap to boost its capital ratio, the last step to concluding its sale to U.S. private equity firm Lone Star. ~
BA,BRIEF-Boeing and Dassault Systèmes announce extended partnership * BOEING EXTENDS USE OF DASSAULT SYSTÈMES TO INCLUDE 3DEXPERIENCE PLATFORM FOR MANUFACTURING OPERATIONS MANAGEMENT AND PRODUCT LIFECYCLE MANAGEMENT Source text for Eikon: Further company coverage: (Gdynia Newsroom) ~
CAT,US STOCKS-S&P; 500 jumps to record high on busy earnings day * Indexes up: Dow 0.6 pct, S&P; 0.41 pct, Nasdaq 0.18 pct (Updates to late afternoon) ~US STOCKS-S&P; hits record on strong earnings; Alphabet drags Nasdaq * Indexes up: Dow 0.59 pct, S&P; 0.39 pct, Nasdaq 0.07 pct (Updates to early afternoon) ~UPDATE 4-Caterpillar bulldozes expectations, raises 2017 forecast again * Shares hit more than 5-year high (Adds comments from conference call) ~US STOCKS-Strong earnings boost S&P;, Dow; Alphabet drags Nasdaq * Dow up 0.49 pct, S&P; up 0.34 pct, Nasdaq down 0.06 pct (Adds details, changes comment, updates prices) ~US STOCKS-Caterpillar, McDonald's to lift S&P;, Dow at open * Futures up: Dow 96 pts, S&P; 6.5 pts, Nasdaq 5 pts (Adds details, comment, updates prices) ~BRIEF-Caterpillar ‍now expects to incur about $1.2 billion of restructuring costs in 2017​ * Q2 earnings per share view $1.26 -- Thomson Reuters I/B/E/S ~Caterpillar posts 46 pct rise in profit, boosts forecast July 25 Caterpillar Inc reported a 46 percent jump in quarterly profit on Tuesday, helped by strength in its construction and resources businesses, and raised its profit outlook for the year. ~
CELG.O,Celgene to pay $280 mln to settle off-label marketing case The U.S. Justice Department said on Tuesday that Celgene Corp had agreed to pay $280 million to settle a lawsuit that accused the company of promoting its cancer drugs Revlimid and Thalomid for off-label uses. ~Celgene to pay $280 mln to settle off-label marketing case July 25 The U.S. Justice Department said on Tuesday that Celgene Corp had agreed to pay $280 million to settle a lawsuit that accused the company of promoting its cancer drugs Revlimid and Thalomid for off-label uses. ~
CNC,UPDATE 3-Strong Obamacare business boosts Centene's quarterly results * Shares rise as much as 4.2 pct (Adds conference call comments, details; updates shares) ~BRIEF-Centene Corp reports Q2 adjusted earnings per share $1.59 * Centene corporation reports 2017 second quarter results & raises 2017 guidance ~Health insurer Centene's quarterly profit jumps 49.4 pct July 25 Health insurer Centene Corp reported a 49.4 percent increase in quarterly profit on Tuesday, driven by higher enrollments in its Medicaid plans for low-income families. ~
CMG,Chipotle profit doubles, shares rise LOS ANGELES, July 25 Chipotle Mexican Grill Inc's profit more than doubled in the latest second quarter, sending shares of the burrito seller up more than 2 percent in after-hours trading on Tuesday. ~
C,UPDATE 4-Citigroup sets new focus on growth at first investor day since crisis NEW YORK, July 25 Citigroup Inc management outlined an ambitious plan on Tuesday to grow profits and return at least $60 billion to shareholders, setting a new tone at the first major conference the bank has held for investors in over nine years. ~Deals of the day-Mergers and acquisitions July 25 The following bids, mergers, acquisitions and disposals were reported by 2020 GMT on Tuesday: ~UPDATE 2-9mobile asks Citi, Standard Bank to find new investors - source LAGOS, July 25 9mobile, the mobile operator formerly known as Etisalat Nigeria, has appointed Citigroup and Standard Bank to find an investor to buy into the firm and three companies have shown interest, a banking source close to the deal said on Tuesday. ~Former Etisalat Nigeria, 9mobile, appoints Citi, Standard Bank to find new investors LAGOS, July 25 9mobile, formerly Etisalat Nigeria, has appointed Citigroup and South Africa's Standard Bank to manage a sale process for the telecoms company and has received interest from three investors, a banking source close to the deal said on Tuesday. ~Michael Kors to buy luxury shoemaker Jimmy Choo for $1.2 billion LONDON U.S. retailer Michael Kors  agreed to buy luxury shoemaker Jimmy Choo  for $1.2 billion, snapping up a British company whose towering stilettos have been made famous by celebrity customers from Princess Diana to Kendall Jenner. | Video  ~UPDATE 3-Michael Kors to buy luxury shoemaker Jimmy Choo for $1.2 bln * Jimmy Choo shares up 17 pct, Kors shares down 1.2 pct (Adds details from conference call, background, analyst comment) ~RPT-Citigroup hosts investors for first time since the financial crisis NEW YORK, July 25 For the first time since receiving three government bailouts during the 2007-2009 financial crisis, Citigroup Inc on Tuesday is holding a day-long conference for investors, marking another step in the recovery of what was once the biggest U.S. bank. ~Citigroup hosts investors for first time since the financial crisis NEW YORK, July 25 For the first time since receiving three government bailouts during the 2007-2009 financial crisis, Citigroup Inc on Tuesday is holding a day-long conference for investors, marking another step in the recovery of what was once the biggest U.S. bank. ~
CMCSA.O,UPDATE 1-ABC News to target millennials with social video partnership July 25 Walt Disney Co's ABC News launched a partnership on Tuesday with ATTN:, a video news site focused on younger audiences, to co-produce videos for social media including Facebook Inc's Instagram and for Twitter Inc. ~ABC News to target millennials with social video partnership July 25 Walt Disney Co's ABC News on Tuesday launched a partnership with millennial-focused video news site ATTN: to co-produce videos for social media including Facebook Inc's Instagram and for Twitter Inc. ~
DD,UPDATE 2-Strength in farm business powers DuPont's results beat * Shares hit record high of $86.36 (Adds conference call details, shares) ~BRIEF-Dupont says Q2 crop protection sales up 10 pct - conf call * Dupont says in the second quarter, crop protection sales were up 10 percent and seed sales up 6 percent - conf call Further company coverage: ~BRIEF-Dupont says in agriculture segment, H2 North America farm-level income expected to be pressured * Dupont - in agriculture segment, North America farm-level income is expected to continue to be pressured in H2 2017 - Presentation‍​ ~BRIEF-Dupont's Q2 operating earnings per share $1.38 * Q2 GAAP earnings per share $0.97 from continuing operations ~DuPont posts 15.5 pct fall in second-quarter profit July 25 Chemicals and seeds company DuPont , which is merging with Dow Chemical, reported a 15.5 percent fall in quarterly profit on higher costs. ~
EXC,U.S. judge refuses to halt New York nuclear power plant subsidies NEW YORK, July 25 A federal judge on Tuesday dismissed a lawsuit by energy companies and trade groups to stop New York Governor Andrew Cuomo from providing billions of dollars in subsidies to prop up struggling nuclear power plants in the state. ~
FB.O,ABC News to target millennials with social video partnership Walt Disney Co's  ABC News launched a partnership on Tuesday with ATTN:, a video news site focused on younger audiences, to co-produce videos for social media including Facebook Inc's  Instagram and for Twitter Inc . ~UPDATE 1-ABC News to target millennials with social video partnership July 25 Walt Disney Co's ABC News launched a partnership on Tuesday with ATTN:, a video news site focused on younger audiences, to co-produce videos for social media including Facebook Inc's Instagram and for Twitter Inc. ~EU increases pressure on Facebook, Google and Twitter over user terms BRUSSELS European Union authorities have increased pressure on Facebook, Twitter and Google to amend their user terms to bring them in line with EU law after proposals submitted by the tech giants were considered insufficient. ~
FCX,UPDATE 3-Freeport stock soars 15 pct on copper prices, permit progress TORONTO, July 25 Freeport-McMoRan Inc shares jumped to a 16-month high on Tuesday, as soaring metal prices and progress in a long-running, costly permit dispute with Indonesia buoyed the world's biggest publicly traded copper miner. ~BRIEF-Freeport sees mining deal with Indonesia, but challenges -CEO * Contract talks with Indonesia "very active", "mutual sense of optimism" agreement can be reached -CEO Richard Adkerson ~BRIEF-Freeport-McMoRan reports Q2 adj. EPS $0.17; copper sales of 942 mln pounds * Freeport-McMoRan reports second-quarter and six-month 2017 results ~Miner Freeport posts profit, "encouraged" by Indonesia talks TORONTO, July 25 Freeport-McMoRan Inc reported a second-quarter adjusted profit on Tuesday and said it was encouraged by recent progress in talks with Indonesia to resolve a lengthy permit dispute for its massive Grasberg mine. ~
GM,UPDATE 5-GM promises to cut high inventory as profit beats expectations DETROIT, July 25 General Motors Co on Tuesday reported a better-than-expected quarterly net profit, helped by cost cuts, and promised to cut production in the second half to curtail its burgeoning U.S. inventory of unsold vehicles. ~BRIEF-GM says not experienced supply interruptions from Takata insolvency proceedings * Company has not experienced any supply interruptions arising from Takata initiating formal insolvency proceedings - SEC filing‍​ ~BRIEF-General Motors reports Q2 earnings per share from cont ops of $1.60 * Q2 adjusted earnings per share from continuing operations $1.89 ~General Motors quarterly profit falls DETROIT, July 25 General Motors Co on Tuesday reported a lower quarterly net profit from continuing operations due to lower vehicle sales and restructuring charges, but results beat Wall Street expectations. ~
GS,China's HNA taps Goldman for planned Pactera U.S. IPO - sources HONG KONG, July 25 HNA Group, the Chinese airline-to-banking conglomerate, has tapped investment bank Goldman Sachs to list Pactera, the Beijing-based IT outsourcing firm it bought from private equity firm Blackstone, sources familiar with the matter said. ~Saudi Arabia hires Goldman for Riyadh airport's stake sale-sources DUBAI, July 25 Saudi Arabia's government has hired Goldman Sachs to manage the sale of a stake in Riyadh airport, the first major privatisation of an airport in the kingdom, three sources familiar with the matter said. ~BRIEF-Goldman Sachs invests $35 mln to accelerate growth of beqom * Goldman Sachs invests $35 million to accelerate growth of beqom Source text for Eikon: Further company coverage: ~
HAL,UPDATE 4-Caterpillar bulldozes expectations, raises 2017 forecast again * Shares hit more than 5-year high (Adds comments from conference call) ~
HCA,UPDATE 3-HCA Healthcare slumps as profit misses on weak patient volumes * Shares down 4 pct, smaller rivals also fall (Adds conference call details, analysts comments) ~BRIEF-Hca healthcare says results challenged by softer managed care and exchange volumes * Says results from the first half have been challenged by softer managed care and exchange volumes - conf call ~BRIEF-HCA Healthcare reports Q2 earnings per share $1.75 * Q2 revenue $10.73 billion versus I/B/E/S view $10.85 billion ~Hospital operator HCA Healthcare's quarterly revenue rises 4 pct July 25 HCA Healthcare Inc, the largest U.S. for-profit hospital operator, reported a 4 percent rise in quarterly revenue on higher patient admissions. ~
HPQ,BRIEF-Aurionpro Solutions says Cyberinc signs partnership with Hewlett Packard Enterprise * Says Cyberinc signs partnership with Hewlett Packard Enterprise Source text for Eikon: Further company coverage: ~
INTC.O,UPDATE 2-Israeli professor settles Mobileye insider trading case in U.S. July 25 An Israeli professor has agreed to pay more than $850,000 to settle U.S. claims he engaged in insider trading in Jerusalem-based Mobileye NV, a maker of sensors and cameras for self-driving vehicles, ahead of its $15.3 billion takeover by Intel Corp. ~CORRECTED-UPDATE 1-Israeli settles Mobileye insider trading case with U.S. regulators July 25 An Israeli professor has agreed to pay more than $850,000 to settle U.S. claims he engaged in insider trading in Jerusalem-based Mobileye NV, a maker of sensors and cameras for self-driving vehicles, ahead of its $15.3 billion takeover by Intel Corp. ~Israeli settles Mobileye insider trading case with U.S. regulators July 25 An Israeli has agreed to pay more than $850,000 settle U.S.  claims he engaged in insider trading in Jerusalem-based Mobileye NV, a maker of sensors and cameras for self-driving vehicles, ahead of its $15.3 billion takeover by Intel Corp. ~
IBM,BRIEF-‍IBM Credit LLC and IBM entered into a $2.5 bln 364-day credit agreement, and a $2.5 bln three-year credit agreement on 20 July​ * ‍IBM Credit LLC - on 20 July, IBM and IBM Credit entered into a $2.5 billion 364-day credit agreement, and a $2.5 billion three-year credit agreement​ Source text: (http://bit.ly/2tXpVLX) Further company coverage: ~BRIEF-IBM sets regular quarterly cash dividend of $1.50 per share * Sets regular quarterly cash dividend of $1.50 per share Source text for Eikon: Further company coverage: ~
IPG,UPDATE 3-Ad company Interpublic's results disappoint, shares slide * U.S. rev slips for first time in over 2 yrs (Updates shares, adds analyst comments) ~BRIEF-REG-Interpublic announces second quarter and first half 2017 results * Interpublic Group of Companies Inc says Q2 diluted earnings per share of $0.24 ~Ad company Interpublic's revenue slips 1.7 pct July 25 U.S. advertising company Interpublic Group on Tuesday reported a 1.7 percent decline in quarterly revenue, hurt by tepid client spending. ~
JPM,EXCLUSIVE -London Metal Exchange to publish gold, silver reference prices within weeks LONDON, July 25 The London Metal Exchange (LME) will start publishing gold and silver reference prices, the exchange told Reuters on Tuesday, potentially challenging the dominance of benchmarks administered by Intercontinental Exchange (ICE). ~
