ABT,UPDATE 2-Diagnostic company Alere to delay filing annual report March 1 Alere Inc said it would delay filing its 2016 annual report, in the latest blow to the diagnostic company engaged in a legal battle with Abbott Laboratories over their deal. ~
GOOGL.O,RPT-Uber's self-driving unit quietly bought firm with tech at heart of Alphabet lawsuit SAN FRANCISCO, Feb 28 A company now owned by Uber last year quietly bought a small firm specializing in sensor technology used in autonomous vehicles, giving the ride services company a patent in the technology and possibly a defense against a trade secrets theft lawsuit filed against it by rival Alphabet Inc. ~Uber's self-driving unit quietly bought firm with tech at heart of Alphabet lawsuit SAN FRANCISCO, Feb 28 A company now owned by Uber last year quietly bought a small firm specializing in sensor technology used in autonomous vehicles, giving the ride services company a patent in the technology and possibly a defense against a trade secrets theft lawsuit filed against it by rival Alphabet Inc. ~
GOOG.O,RPT-Uber's self-driving unit quietly bought firm with tech at heart of Alphabet lawsuit SAN FRANCISCO, Feb 28 A company now owned by Uber last year quietly bought a small firm specializing in sensor technology used in autonomous vehicles, giving the ride services company a patent in the technology and possibly a defense against a trade secrets theft lawsuit filed against it by rival Alphabet Inc. ~Uber's self-driving unit quietly bought firm with tech at heart of Alphabet lawsuit SAN FRANCISCO, Feb 28 A company now owned by Uber last year quietly bought a small firm specializing in sensor technology used in autonomous vehicles, giving the ride services company a patent in the technology and possibly a defense against a trade secrets theft lawsuit filed against it by rival Alphabet Inc. ~
ANTM.N,Connecticut says will not drop opposition to Anthem/Cigna deal WASHINGTON Connecticut said on Wednesday it had no plans to drop its opposition to health insurer Anthem Inc's proposed purchase of rival Cigna Corp, even if the U.S. Justice Department decides to settle with the companies. ~Connecticut says will not drop opposition to Anthem/Cigna deal WASHINGTON, March 1 Connecticut said on Wednesday it had no plans to drop its opposition to health insurer Anthem Inc's proposed purchase of rival Cigna Corp, even if the U.S. Justice Department decides to settle with the companies. ~BRIEF-Cigna decides to postpone Investor Day * Cigna says in light of recently announced schedule in appeal of court's ruling to enjoin proposed merger with Anthem, co decided to postpone investor day  Source text for Eikon: Further company coverage: ~
AAPL.O,U.S. appeals court tosses patent verdict against Apple March 1 A federal appeals court has thrown out a jury verdict that had originally required Apple Inc to pay $533 million to Smartflash LLC, a technology developer and licenser that claimed Apple's iTunes software infringed its data storage patents. ~
T,UPDATE 2-U.S. FCC blocks stricter broadband privacy rules from taking effect NEW YORK, March 1 U.S. regulators on Wednesday blocked some Obama administration rules on the eve of implementation, regulations that would have subjected broadband providers to stricter scrutiny than web sites face to protect customers' private data. ~UPDATE 1-U.S. FCC blocks stricter broadband privacy rules from taking effect NEW YORK The U.S. Federal Communications Commission on Wednesday blocked some Obama administration rules approved last year that would have subjected broadband providers to stricter scrutiny than websites, a victory for internet providers such as AT&T; Inc, Comcast Corp and Verizon Communications Inc . ~U.S. FCC blocks stricter broadband privacy rules from taking effect NEW YORK, March 1 The U.S. Federal Communications Commission on Wednesday blocked some Obama administration rules approved last year that would have subjected broadband providers to stricter scrutiny than websites, a victory for internet providers such as AT&T; Inc , Comcast Corp and Verizon Communications Inc  . ~
BBY,UPDATE 3-Best Buy surprises with weak holiday sales, bleak forecast * Shares off 4.5 pct, mirroring Tuesday's drop   (Adds CEO comments, details; updates shares) ~BRIEF-Best Buy reports Q4 non-GAAP earnings per share $1.95 * Best Buy reports better-than-expected fourth quarter earnings ~REFILE-Best Buy posts unexpected drop in same-store sales March 1 Best Buy Co Inc, the No. 1 U.S. electronics retailer, reported an unexpected decline in holiday-quarter same-store sales on Wednesday, hurt by weak demand for tablets, gaming consoles, wearable devices and mobile phones. ~BRIEF-Best Buy Co announces two-year $3 bln share repurchase plan * Best Buy Co Inc - two-year $3 billion share repurchase plan ~
CVX,UPDATE 4-Exxon touts growth potential with eye toward dividend NEW YORK, March 1 Exxon Mobil Corp, the world's largest publicly traded oil producer, sought to reassure anxious investors on Wednesday about its growth potential, highlighting both short- and long-term projects executives said should continue to help fund the 106-year-old dividend. ~
CI,Connecticut says will not drop opposition to Anthem/Cigna deal WASHINGTON Connecticut said on Wednesday it had no plans to drop its opposition to health insurer Anthem Inc's proposed purchase of rival Cigna Corp, even if the U.S. Justice Department decides to settle with the companies. ~Connecticut says will not drop opposition to Anthem/Cigna deal WASHINGTON, March 1 Connecticut said on Wednesday it had no plans to drop its opposition to health insurer Anthem Inc's proposed purchase of rival Cigna Corp, even if the U.S. Justice Department decides to settle with the companies. ~
C,BRIEF-Citi realigns EMEA custody and fund services leadership * Announced combination of regional management of EMEA global custody and funds services business under Pervaiz Panjwani  Source text for Eikon:  Further company coverage: ~
CMCSA.O,UPDATE 2-U.S. FCC blocks stricter broadband privacy rules from taking effect NEW YORK, March 1 U.S. regulators on Wednesday blocked some Obama administration rules on the eve of implementation, regulations that would have subjected broadband providers to stricter scrutiny than web sites face to protect customers' private data. ~UPDATE 1-U.S. FCC blocks stricter broadband privacy rules from taking effect NEW YORK The U.S. Federal Communications Commission on Wednesday blocked some Obama administration rules approved last year that would have subjected broadband providers to stricter scrutiny than websites, a victory for internet providers such as AT&T; Inc, Comcast Corp and Verizon Communications Inc . ~U.S. FCC blocks stricter broadband privacy rules from taking effect NEW YORK, March 1 The U.S. Federal Communications Commission on Wednesday blocked some Obama administration rules approved last year that would have subjected broadband providers to stricter scrutiny than websites, a victory for internet providers such as AT&T; Inc , Comcast Corp and Verizon Communications Inc  . ~
DLTR.O,Dollar Tree's profit, sales beat estimates Dollar Tree Inc , the biggest U.S. dollar-store chain, reported better-than-expected quarterly profit and sales on Wednesday, helped by lower costs and higher customer spending in its stores. ~UPDATE 1-Dollar Tree's profit, sales beat estimates March 1 Dollar Tree Inc, the biggest U.S. dollar-store chain, reported better-than-expected quarterly profit and sales on Wednesday, helped by lower costs and higher customer spending in its stores. ~Dollar Tree's sales rise 5 pct March 1 Dollar Tree Inc, the biggest U.S. dollar-store chain, reported a 5 percent rise in quarterly net sales on Wednesday, as more customers visited its stores and also spent more on average. ~
DOW,BRIEF-Downer EDI says offer for Spotless Group now closed * Confirms that its offer for Spotless was not extended and has now closed. Source text for Eikon: Further company coverage: ~BRIEF-Downer EDI posts FY net profit of $181.5 million * FY total revenue and other income from ordinary activities $7.29 billion , up 6.4 percent ~BRIEF-Downer EDI says ‍offer for Spotless Group extended to 28 August 2017​ * ‍Offer for Spotless Group extended to 7pm on Monday, 28 august 2017​ Source text for Eikon: Further company coverage: ~BRIEF-Downer EDI says Spotless ‍offer extended to Aug 21, 2017​ * Spotless ‍offer extended to 7pm on monday, 21 august 2017​ Source text for Eikon: Further company coverage: ~BRIEF-Downer EDI's takeover offer for Spotless Group extended till 7pm (Sydney time) on Aug. 14 * Unconditional takeover offer for Spotless Group extended until 7:00pm (Sydney time) on Monday, 14 August Source text for Eikon: Further company coverage: (bangalore.newsroom@thomsonreuters.com) ~BRIEF-Downer extends takeover offer for Spotless Group * decided to extend Spotless offer period for one week; offer will now remain open for acceptance until 14 august Source text for Eikon: Further company coverage: ~BRIEF-Downer extends Spotless offer to August 7 2017 * ‍Downer has decided to extend offer for Spotless Group holdings to 7 pm on Monday, 7 august 2017​ Source text for Eikon: Further company coverage: ~BRIEF-Downer EDI's stake in Spotless increases to 80.3 pct * Downer's stake in Spotless increases to 80.3 pct Source text for Eikon: Further company coverage: ~BRIEF- Downer EDI Ltd'S stake in Spotless Group increases to 72% * As Downer's shareholding in Spotless is now over 70%, Downer expects that Spotless will be removed from certain S&P;/ASX market indices ~
XOM,UPDATE 4-Exxon touts growth potential with eye toward dividend NEW YORK, March 1 Exxon Mobil Corp, the world's largest publicly traded oil producer, sought to reassure anxious investors on Wednesday about its growth potential, highlighting both short- and long-term projects executives said should continue to help fund the 106-year-old dividend. ~Exxon CEO says still sees potential in Canadian oil sands NEW YORK Exxon Mobil Corp  still sees potential in its western Canadian operations despite a recent write-down in the value of nearly all its oil sands reserves there, Chief Executive Officer Darren Woods said on Wednesday. ~Exxon CEO says still sees potential in Canadian oil sands NEW YORK, March 1 Exxon Mobil Corp still sees potential in its western Canadian operations despite a recent write-down in the value of nearly all its oil sands reserves there, Chief Executive Officer Darren Woods said on Wednesday. ~BRIEF-Exxon Mobil CEO says oil markets 'more balanced,' but still sees uncertainty * Chief Executive Darren Woods says continues to expect volatility in oil markets for near term ~Exxon touts growth potential with eye toward dividend NEW YORK, March 1 Exxon Mobil Corp, the world's largest publicly traded oil producer, sought to reassure anxious investors on Wednesday about its growth potential, highlighting both short- and long-term projects that executives said should continue to help fund the 106-year-old dividend. ~BRIEF-Exxon Mobil says 2017 capital and exploration expenses $22 billion * Exxon Mobil - 2017 capital and exploration expenses of $22 billion ~Exxon's Russian unit stops gas supplies from Sakhalin-1 due to accident MOSCOW, March 1 Exxon Neftegaz, the operator of Russian Sakhalin-1 project, has stopped gas supplies to a domestic Russian gas pipeline due to an accident, energy ministry said on Wednesday. ~
FB.O,Snap advertisers worry about measurement even as they 'lean in' NEW YORK As Snap Inc looks to gobble up a larger share of the $82 billion digital U.S. ad market, the owner of the ephemeral messaging app popular with millennials could find itself facing more demands from advertisers for reliable metrics. ~Facebook's Oculus cuts price of virtual reality set by $200 SAN FRANCISCO Facebook Inc's virtual reality unit Oculus has cut $200 from the total price of its flagship hardware set, in a bid to expand the system's base of video game players, the company said on Wednesday. | Video  ~UPDATE 2-Facebook's Oculus cuts price of virtual reality set by $200 SAN FRANCISCO, March 1 Facebook Inc's virtual reality unit Oculus has cut $200 from the total price of its flagship hardware set, in a bid to expand the system's base of video game players, the company said on Wednesday. ~Oculus cuts price for Rift and Touch March 1 Facebook Inc's virtual reality unit Oculus said on Wednesday it has cut the all-in price for its Rift and Touch products by $200. ~Snap advertisers worry about measurement even as they 'lean in' NEW YORK, March 1 As Snap Inc looks to gobble up a larger share of the $82 billion digital U.S. ad market, the owner of the ephemeral messaging app popular with millennials could find itself facing more demands from advertisers for reliable metrics. ~
F,UK unions say Ford to ax 1,100 jobs at Welsh engine plant LONDON Ford  plans to ax 1,100 jobs at its engine plant in Wales, trade unions said on Wednesday, although the U.S. carmaker said there were no immediate plans for cuts nor had it confirmed any future losses. ~UK PM May says government is talking to Ford on automotive sector LONDON Prime Minister Theresa May said on Wednesday her government would hold regular talks with Ford  to find ways to ensure its engine plant in Wales remains part of the car producer's "success" in Britain after leaving the European Union. ~BRIEF-Ford Motor Co says overall Ford Motor Company U.S. sales totaled 208,440 vehicles in February * Ford Motor Co says overall Ford Motor Company U.S. sales totaled 208,440 vehicles in February, a 4 percent decline versus a year ago  Source text for Eikon: Further company coverage: ~UK union fears for jobs at Ford's Welsh engine plant LONDON, March 1 Britain's biggest trade union fears that more than 1,000 jobs could be lost at Ford's engine plant in Wales despite reassurances from the U.S. carmaker that similar levels of employment will be needed in the coming years. ~
GE,UPDATE 2-Cloud software provider Box makes good on promise to investors March 1 Box Inc is finally bringing in more money than it is spending, the cloud software company said on Wednesday, a milestone investors have been waiting for since its initial public offering more than two years ago. ~UPDATE 2-Suez says GE water treatment business would be a good buy * Share price down 3 pct   (Adds comment by CEO on more cost cutting, share price fall) ~BRIEF-Suez targets 150 mln euros in cost cuts this year March 1 Suez Says Interested In General Electric's ~
GM,UPDATE 2-U.S. truck, SUV sales stay strong in February, but at a price DETROIT, March 1 February U.S. auto sales, an indicator of consumer spending, fell slightly even as automakers stepped up discounting to sustain sales, major manufacturers reported on Wednesday. ~BRIEF-General Motors says Feb U.S. total sales up 4 pct to 237,388 units * sees U.S. February auto industry sales at 17.5 million vehicles on an annualized basis ~GM plans to sell stake in East African unit to Isuzu General Motors Co on Tuesday said it plans to sell its majority ownership stake in General Motors East Africa to its Japanese partner Isuzu Motors Ltd, as the U.S. carmaker continues to streamline by exiting non-core operations. ~UPDATE 2-GM plans to sell stake in East African unit to Isuzu Feb 28 General Motors Co on Tuesday said it plans to sell its majority ownership stake in General Motors East Africa to its Japanese partner Isuzu Motors Ltd, as the U.S. carmaker continues to streamline by exiting non-core operations. ~
HD,UPDATE 4-Lowe's forecasts strong sales growth this year, shares soar * Shares rise as much as 11.4 pct to $82.85   (Adds CEO comment, details from conference call) ~
HON,BRIEF-Honeywell incoming CEO says can deploy co's cash to buybacks or M&A; if there is tax regime change - Investor conf * Incoming CEO Darius Adamczyk says can deploy co's cash to buybacks or M&A; if there is a tax regime change ~BRIEF-Honeywell says targeting double-digit earnings growth in 2017 * Honeywell hosts annual investor conference; reaffirms first quarter and full-year 2017 outlook ~
JPM,CORRECTED-UPDATE 4-JPMorgan eyes boosting dividends, buybacks as capital piles up Feb 28 No. 1 U.S. bank JPMorgan Chase & Co  may return more money to shareholders than it earns over the next few years, it forecast on Tuesday, an encouraging sign for investors who have been waiting for richer dividends and share repurchases. ~
KHC.O,UPDATE 2-UK Stocks-Factors to watch on March 1 March 1 Britain's FTSE 100 index is seen opening up 23.1 points on Wednesday, according to financial bookmakers, with futures up 0.1 percent ahead of the cash market open. ~UK Stocks-Factors to watch on March 1     March 1 Britain's FTSE 100 index is seen opening up 23.1 points on Wednesday, according to financial bookmakers.          * The UK blue chip index closed 0.1 percent higher at 7263.44 on Tuesday, as gains by GKN Plc and Pearson Plc outweighed losses from basic resources stocks.     * UNILEVER: Unilever is proposing changes to how it pays executives and directors in order to make them think more like owners of the business, less than two weeks after seeing off a $143 billion takeo ~
MNK,BRIEF-Mallinckrodt Plc says co and units entered into refinancing amendment * Mallinckrodt Plc- on february 28, co and units entered into a refinancing amendment no. 2 and incremental assumption agreement no. 3- sec filing ~
MPC,Marathon Petroleum sells assets to its MLP for $2 bln March 1 Marathon Petroleum Corp said on Wednesday it sold some terminal, pipeline and storage assets to MPLX Inc, the master limited partnership that it spun off in 2012, for $2.02 billion. ~
MCD,UPDATE 4-McDonald's U.S. turnaround shifts to technology, speedier service CHICAGO, March 1 McDonald's Corp on Wednesday announced a push to embrace apps aimed at speeding up service at drive-thrus, which account for about 70 percent of its U.S. business, as the fast-food chain looks to woo back diners. ~McDonald's turns to technology, value to win back lost customers CHICAGO, March 1 McDonald's Corp later this year will give U.S. customers the opportunity to order and pay via their cell phones as it fights to win back customers lost to other fast-food rivals. ~BRIEF-Mcdonald's expects capital expenditures for 2017 to be about $1.7 bln * Mcdonald's - expects capital expenditures for 2017 to be approximately $1.7 billion, about one-third of which will be used to open new restaurants ~
MSFT.O,Major U.S tech accelerator plans Canada expansion -sources TORONTO, March 1 A major U.S.-based accelerator for promising young technology companies is set to announce plans to launch its first Canadian chapter, two sources with knowledge of the plans said on Wednesday. ~
MDLZ.O,BRIEF-Mondelez enter into revolving credit agreement * On March 1, entered into revolving credit agreement for 364-day senior unsecured revolving credit facility in amount of $1.5 billion ~
MYL.A,EpiPen maker Mylan forecasts strong 2017; shares jump EpiPen allergy shot maker Mylan NV  forecast 2017 profit and revenue largely above analysts' estimates on Wednesday, in sharp contrast to downbeat expectations from its rivals, amid pricing pressure in the U.S. generics market. ~UPDATE 2-EpiPen maker Mylan forecasts strong 2017; shares jump March 1 EpiPen allergy shot maker Mylan NV  forecast 2017 profit and revenue largely above analysts' estimates on Wednesday, in sharp contrast to downbeat expectations from its rivals, amid pricing pressure in the U.S. generics market. ~BRIEF-Mylan reports Q4 GAAP earnings per share $0.78 * Mylan reports fourth quarter and full year 2016 results and provides 2017 guidance ~Mylan's quarterly revenue jumps 31 pct March 1 Generic drugmaker Mylan NV reported a 31.2 percent rise in quarterly revenue, helped by demand for products it gained through the acquisition of Swedish drugmaker Meda last year. ~
PEP,PepsiCo to cut jobs in Philly as sales lose fizz after soda tax March 1 PepsiCo Inc said on Wednesday it would cut 80 to 100 jobs in Philadelphia as the city's new sugar-sweetened beverage tax hurts demand for its products. ~BRIEF-PepsiCo to eliminate 80-100 positions in Philadelphia over next few months * Intend to eliminate 80-100 positions, including frontline and supervisory roles, in Philadelphia over the next few months  Further company coverage: ~PepsiCo to close British plant, threatening nearly 400 jobs LONDON Food and drink firm PepsiCo plans to shut a Walkers crisp factory in northern England, the company said on Wednesday, putting almost 400 jobs at risk. ~
PFE,Rare re-argument ordered in insider trading appeal of SAC's Martoma A federal appeals court in Manhattan ordered a rare second round of arguments on Wednesday as former SAC Capital Advisors portfolio manager Mathew Martoma tries to overturn his insider trading conviction. ~Rare re-argument ordered in insider trading appeal of SAC's Martoma A federal appeals court in Manhattan ordered a rare second round of arguments on Wednesday as former SAC Capital Advisors portfolio manager Mathew Martoma tries to overturn his insider trading conviction. ~Rare re-argument ordered in insider trading appeal of SAC's Martoma March 1 A federal appeals court in Manhattan ordered a rare second round of arguments on Wednesday as former SAC Capital Advisors portfolio manager Mathew Martoma tries to overturn his insider trading conviction. ~Fitch Rates Pfizer's Euro Notes Offering 'A+'; Outlook Stable (The following statement was released by the rating agency) CHICAGO, March 01 (Fitch) Fitch Ratings has assigned an 'A+' rating to Pfizer's  senior unsecured Euro notes offering. The net proceeds of the issuance will be  used for general corporate purposes including the repayment of a portion of the  company's commercial paper borrowings. The ratings apply to roughly $42.1 billion of debt outstanding at Dec. 31, 2016.  A full list of ratings follows at the end of this release.  KEY RATING DRIVER ~
PM,REFILE-Egypt's Eastern Co, Philip Morris reach agreement over arrears CAIRO, March 1 Egypt's top cigarette maker Eastern Company said on Wednesday it had reached an agreement with its international partner Philip Morris for the tobacco giant to pay back outstanding debt and make future payments in the local currency. ~
HSY,Hershey to cut global workforce by about 15 percent Hershey Co , maker of Hershey's Kisses and Reese's Peanut Butter Cups, said on Tuesday it would cut its global workforce by about 15 percent as part of a restructuring program. ~
DIS,BRIEF-MTG and Disney reinforce long term strategic collaboration * MTG and Disney reinforce long term strategic collaboration   Source text for Eikon:  Further company coverage:   (Stockholm Newsroom) ~
FOXA.O,Murdoch's Fox set to request EU approval for Sky takeover bid LONDON, March 1 Rupert Murdoch's Twenty-First Century Fox will seek approval from the European Commission for its $14.4 billion bid for European pay-TV firm Sky in the coming days, a person familiar with the matter said. ~Penguin Random House lands book deal with Obamas Penguin Random House has landed a deal to publish two forthcoming books by former U.S. President Barack Obama and the former first lady, Michelle Obama, with one volume to be written by each, the publishing company said on Tuesday. ~UPDATE 1-Penguin Random House lands book deal with Obamas Feb 28 Penguin Random House has landed a deal to publish two forthcoming books by former U.S. President Barack Obama and the former first lady, Michelle Obama, with one volume to be written by each, the publishing company said on Tuesday. ~
FOX.O,Murdoch's Fox set to request EU approval for Sky takeover bid LONDON, March 1 Rupert Murdoch's Twenty-First Century Fox will seek approval from the European Commission for its $14.4 billion bid for European pay-TV firm Sky in the coming days, a person familiar with the matter said. ~Penguin Random House lands book deal with Obamas Penguin Random House has landed a deal to publish two forthcoming books by former U.S. President Barack Obama and the former first lady, Michelle Obama, with one volume to be written by each, the publishing company said on Tuesday. ~UPDATE 1-Penguin Random House lands book deal with Obamas Feb 28 Penguin Random House has landed a deal to publish two forthcoming books by former U.S. President Barack Obama and the former first lady, Michelle Obama, with one volume to be written by each, the publishing company said on Tuesday. ~
VZ,UPDATE 2-U.S. FCC blocks stricter broadband privacy rules from taking effect NEW YORK, March 1 U.S. regulators on Wednesday blocked some Obama administration rules on the eve of implementation, regulations that would have subjected broadband providers to stricter scrutiny than web sites face to protect customers' private data. ~UPDATE 1-U.S. FCC blocks stricter broadband privacy rules from taking effect NEW YORK The U.S. Federal Communications Commission on Wednesday blocked some Obama administration rules approved last year that would have subjected broadband providers to stricter scrutiny than websites, a victory for internet providers such as AT&T; Inc, Comcast Corp and Verizon Communications Inc . ~U.S. FCC blocks stricter broadband privacy rules from taking effect NEW YORK, March 1 The U.S. Federal Communications Commission on Wednesday blocked some Obama administration rules approved last year that would have subjected broadband providers to stricter scrutiny than websites, a victory for internet providers such as AT&T; Inc , Comcast Corp and Verizon Communications Inc  . ~
