AES,BRIEF-AES announces public offering of $500 mln of senior notes * AES announces public offering of $500 million of senior notes ~BRIEF-AES announces tender offer for up to $217 mln of its 8 pct senior notes due 2020 * AES announces tender offer for up to $217 million of its 8.00% senior notes due 2020 ~
GOOGL.O,BRIEF-Tiger Global Management cuts stake in Amazon.com, Alphabet * Cuts share stake in Amazon.com Inc by 8.1 percent to 1.2 million shares - sec filing‍​ ~
GOOG.O,BRIEF-Tiger Global Management cuts stake in Amazon.com, Alphabet * Cuts share stake in Amazon.com Inc by 8.1 percent to 1.2 million shares - sec filing‍​ ~
AMZN.O,BRIEF-Paulson & Co ups share stake in Amazon.com Inc * Paulson & Co ups share stake in Amazon.com Inc by 41.8 percent to 7,800 shares - sec filing‍​ ~BRIEF-Tiger Global Management cuts stake in Amazon.com, Alphabet * Cuts share stake in Amazon.com Inc by 8.1 percent to 1.2 million shares - sec filing‍​ ~BRIEF-‍amazon Web Services Inc announced Amazon Macie​ * Amazon Macie can send all findings to Amazon cloudwatch events and will support api endpoints through AWS SDK later this year​ Source text for Eikon: Further company coverage: ~BRIEF-Omega Advisors Inc ups share stake in Microsoft, cuts share stake in Amazon * Omega Advisors Inc ups share stake in Microsoft Corp to 1.2 million shares from 436,570 shares ‍​ ~US STOCKS-Wall St climbs as North Korea tension eases * Indexes up: Dow 0.59 pct, S&P; 0.80 pct, Nasdaq 0.98 pct (Updates to open) ~US STOCKS-Wall St set to open higher as North Korea tension eases * Futures up: Dow 104 pts, S&P; 14 pts, Nasdaq 35.75 pts (Adds details, comments, updates price) ~
AAL.O,BRIEF-Omega Advisors takes share stake in American Airlines, cuts share stake in Hess Corp * Omega Advisors Inc takes share stake in American Airlines Group Inc of 178,400 shares - SEC filing ~
AMGN.O,BRIEF-Temasek Holdings takes stake in JPMorgan, Biogen, Celgene * Temasek Holdings (Private) Ltd takes share stake in JPMorgan Chase & Co of 264,337 shares ~
AAPL.O,UPDATE 1-U.S. hedge funds bearish on FAANG stocks in Q2 -SEC filings NEW YORK, Aug 14 Closely-watched U.S. hedge fund managers were generally bearish on the FAANG group of high-flying tech stocks in the second quarter, with eight such investors in aggregate cutting or liquidating 18 stakes in the companies, regulatory filings showed. ~BRIEF-Paulson & Co takes share stake in Apple, dissolves share stake in Sarepta, Biogen * Ups share stake in T-Mobile US Inc by 46.1 percent to 6.1 million shares - SEC filing ~Qualcomm outlines impact of dispute with Apple after SEC request Chipmaker Qualcomm Inc on Monday disclosed further details about the impact of an ongoing dispute with Apple Inc, responding to questions from the U.S. Securities and Exchange Commission. ~Qualcomm outlines impact of dispute with Apple after SEC request Aug 14 Chipmaker Qualcomm Inc on Monday disclosed further details about the impact of an ongoing dispute with Apple Inc, responding to questions from the U.S. Securities and Exchange Commission. ~China's Guizhou province to oversee Apple's data project SINGAPORE China's Guizhou province, where Apple Inc  has set up its first data center in the country, plans to create a working committee chaired by communist party members to oversee the U.S. company's iCloud facility. ~
T,Hackers release more HBO episode shows -report Aug 13 Hackers have released more unaired episodes of popular HBO shows but the latest leak did not include anything on the hit series "Game of Thrones," the Associated Press reported on Sunday. ~
ADP.O,Pershing Square says ADP CEO misled board on talks with hedge fund Aug 14 Activist investor Pershing Square Capital Management LP said on Monday the chief executive of Automatic Data Processing Inc had "unfairly characterized" their interactions in an effort to make the hedge fund's requests "appear unreasonable". ~
BRKa.N,UPDATE 1-Buffett's Berkshire adds Synchrony, sheds GE NEW YORK, Aug 14 Warren Buffett's Berkshire Hathaway Inc on Monday said it added a stake in Synchrony Financial, boosting its bet on the credit card industry, and shed its investment in the company's former parent, General Electric Co. ~BRIEF-Berkshire Hathaway cuts share stake in Wabco Holdings by 97.8 pct * Berkshire Hathaway Inc cuts share stake in Wabco Holdings Inc by 97.8 percent to 63,195 shares - sec filing ‍​ ~Buffett's Berkshire sheds GE, adds Synchrony NEW YORK, Aug 14 Warren Buffett's Berkshire Hathaway Inc on Monday said it has taken a 17.5 million share stake in Synchrony Financial and shed its investment in the financial services company's former parent, General Electric Co. ~BRIEF-Berkshire Hathaway takes share stake in Store Capital Corp * Berkshire Hathaway takes share stake of 18.6 million shares in Store Capital Corp - sec filing‍​ ~BRIEF-Berkshire Hathaway dissolves share stake in GE * Takes share stake of 17.5 million shares in Synchrony Financial - SEC filing ~
BIIB.O,BRIEF-Temasek Holdings takes stake in JPMorgan, Biogen, Celgene * Temasek Holdings (Private) Ltd takes share stake in JPMorgan Chase & Co of 264,337 shares ~
CELG.O,BRIEF-Temasek Holdings takes stake in JPMorgan, Biogen, Celgene * Temasek Holdings (Private) Ltd takes share stake in JPMorgan Chase & Co of 264,337 shares ~
CAG,BRIEF-Jana Partners takes sole share stake in Altaba, Pandora, Zimmer Biomet * Takes sole share stake of 3.3 million shares in Altaba Inc ‍​- SEC filing ~
DOW,Saudi's Sadara commissions last plant of its Saudi petchem complex KHOBAR, Saudi Arabia, Aug 14 Saudi-based Sadara Chemical Co, a $20 billion joint venture between Saudi Aramco and U.S. firm Dow Chemical has commissioned the last plant at its petrochemicals complex in Jubail, Saudi Aramco said on Monday. ~
XOM,UPDATE 3-Vanguard seeks corporate disclosure on risks from climate change BOSTON, Aug 14 Vanguard Group on Monday said it has urged companies to disclose how climate change could affect their business and asset valuations, reflecting how the environment has become a priority for the investment industry. ~Vanguard seeks corporate disclosure on risks from climate change BOSTON Vanguard Group on Monday said it has urged companies to disclose how climate change could affect their business and asset valuations, reflecting how the environment has become a priority for the investment industry. ~
FB.O,UPDATE 1-U.S. hedge funds bearish on FAANG stocks in Q2 -SEC filings NEW YORK, Aug 14 Closely-watched U.S. hedge fund managers were generally bearish on the FAANG group of high-flying tech stocks in the second quarter, with eight such investors in aggregate cutting or liquidating 18 stakes in the companies, regulatory filings showed. ~BRIEF-Soros Fund Management cuts share stake in Facebook, Microsoft * Cuts share stake in Facebook Inc by 25.3 percent to 476,713 Class A shares ~BRIEF-Appaloosa LP takes share stake in L Brands, ups share stake in Facebook * Appaloosa Lp takes share stake of 525,000 shares in Activision Blizzard Inc - sec filing ~BRIEF-Tiger Global Management cuts stake in Netflix, Facebook * Tiger Global Management LLC cuts share stake in Facebook by 24.7 percent to 531,000 class A shares ~BRIEF-Omega Advisors cuts share stake in Facebook, Netflix * Omega Advisors Inc ups share stake in Zynga Inc by 30.1 percent to 9.2 million class a shares - SEC filing ~
FDX,BRIEF-Fedex Corp's CEO Frederick W. Smith 's 2017 total annual compensation was $15.6 million * Fedex Corp  - Ceo Frederick W. Smith's 2017 total annual compensation was $15.6 million versus $16.8 million in 2016 Source text: (http://bit.ly/2w7Ir8N) Further company coverage: ~
GE,Buffett's Berkshire sheds GE, adds Synchrony NEW YORK, Aug 14 Warren Buffett's Berkshire Hathaway Inc on Monday said it has taken a 17.5 million share stake in Synchrony Financial and shed its investment in the financial services company's former parent, General Electric Co. ~
GIS,Target appoints Walmart, General Mills execs to shore up grocery business CHICAGO, Aug 14 Target Corp said on Monday it has hired two former executives from Wal-Mart Inc and General Mills Inc to join its food and beverage business, as the retailer seeks to revamp its grocery aisles. ~BRIEF-General Mills says Kendall Powell‍​'s FY 2017 total compensation was $9.2 mln * Says Kendall J. Powell‍​'s FY 2017 total compensation was $9.2 million versus about $11 million in FY 2016 - SEC filing ~
GS,Colombia's Grupo Argos sells port company to Goldman for $136 million BOGOTA Colombian holding company Grupo Argos  has sold its 50 percent stake in a port operator to an investment fund administered by Goldman Sachs  for about $136 million, Grupo Argos said in a statement on Monday. ~Colombia's Grupo Argos sells port company to Goldman for $136 mln BOGOTA, Aug 14 Colombian holding company Grupo Argos has sold its 50 percent stake in a port operator to an investment fund administered by Goldman Sachs for about $136 million, Grupo Argos said in a statement on Monday. ~BRIEF-Temasek Holdings takes stakes in Goldman, Morgan Stanley and Wells Fargo‍​ * Temasek Holdings Private Ltd takes share stake of 20,337 shares in Goldman Sachs Group Inc ‍​ ~
HPE,BRIEF-Greenlight Capital takes share stake of 4.5 mln shares in Hewlett Packard Enterprise * Greenlight Capital Inc takes share stake of 4.5 million shares in Hewlett Packard Enterprise - SEC Filing ~
HUM,BRIEF-Omega Advisors Inc dissolves share stake in Alcoa, Humana * Omega Advisors Inc dissolves share stake in Alcoa Corp- SEC Filing‍​ ~
JPM,JPMorgan launches new algo-driven 'dark pool' for stocks NEW YORK, Aug 14 JPMorgan Chase & Co has begun trading on a new private stock trading venue, or "dark pool," that lets its clients use the bank's algorithms to buy or sell stocks at a benchmark price reached over a period of time. ~BRIEF-Temasek Holdings takes stake in JPMorgan, Biogen, Celgene * Temasek Holdings (Private) Ltd takes share stake in JPMorgan Chase & Co of 264,337 shares ~
KHC.O,UPDATE 1-Activist fund Corvex has $400 mln stake in Danone -Bloomberg Aug 14 Activist hedge fund Corvex Management owns shares in French food group Danone SA worth about $400 million, viewing the world's largest yogurt maker as significantly undervalued, Bloomberg reported late on Monday, citing people familiar with the matter. ~
LMT,BRIEF-Lockheed Martin awarded special operations forces global logistics support services program * Lockheed martin awarded special operations forces global logistics support services program ~GRAPHIC-Take Five: World markets themes for the week ahead LONDON, Aug 11 Following are five big themes likely to dominate thinking of investors and traders in the coming week, and the Reuters stories related to them. ~
MRK,Trump chides Merck CEO after resignation from presidential council WASHINGTON U.S. President Donald Trump chided Merck & Co Inc's Kenneth Frazier after the drugmaker's chief executive resigned from a presidential advisory board earlier on Monday and cited a need for U.S. leaders to denounce bigotry following a violent weekend in Charlottesville, Virginia. ~REFILE-Trump chides Merck CEO after resignation from presidential council WASHINGTON, Aug 14 U.S. President Donald Trump chided Merck & Co Inc's Kenneth Frazier after the drugmaker's chief executive resigned from a presidential advisory board earlier on Monday and cited a need for U.S. leaders to denounce bigotry following a violent weekend in Charlottesville, Virginia. ~REFILE-UPDATE 1-Merck CEO resigns from Trump council after Charlottesville Aug 14 Merck & Co Inc Chief Executive Kenneth Frazier resigned from U.S. President Donald Trump's American Manufacturing Council on Monday, saying he was taking a stand against intolerance and extremism. ~BRIEF-Merck CEO Frazier says "I am resigning from the president's American Manufacturing Council" - tweet * Merck CEO Kenneth Frazier says "I am resigning from the president's American Manufacturing Council" - tweet ~
MSFT.O,BRIEF-Omega Advisors Inc ups share stake in Microsoft, cuts share stake in Amazon * Omega Advisors Inc ups share stake in Microsoft Corp to 1.2 million shares from 436,570 shares ‍​ ~
MS,Second-hand online retailer Poshmark in talks to raise funding -sources Aug 14 Poshmark, an online service that helps people buy and sell second-hand clothing, is in talks to raise more than $50 million in a funding round that could value the startup at roughly $600 million, people familiar with the matter said on Monday. ~
NFLX.O,'Grey's Anatomy' creator Shonda Rhimes leaves ABC for Netflix "Grey's Anatomy" creator Shonda Rhimes is taking her Shondaland production house away from Walt Disney Co's ABC network to Netflix Inc to produce new content, the video streaming company said on Sunday. | Video  ~BRIEF-Tiger Global Management cuts stake in Netflix, Facebook * Tiger Global Management LLC cuts share stake in Facebook by 24.7 percent to 531,000 class A shares ~BRIEF-Omega Advisors cuts share stake in Facebook, Netflix * Omega Advisors Inc ups share stake in Zynga Inc by 30.1 percent to 9.2 million class a shares - SEC filing ~'Grey's Anatomy' creator Shonda Rhimes leaves ABC for Netflix Aug 14 "Grey's Anatomy" creator Shonda Rhimes is taking her Shondaland production house away from Walt Disney Co's ABC network to Netflix Inc to produce new content, the video streaming company said on Sunday. ~
NSC,BRIEF-Norfolk Southern appoints Cynthia Earhart chief financial officer * Norfolk Southern appoints Cynthia C. Earhart executive vice president and chief financial officer ~
PEP,French food group Danone's shares rise after bid speculation report PARIS Shares in French food group Danone  rose on Monday after the New York Post newspaper said in a report over the weekend that Danone could be a takeover target. (http://nyp.st/2vxjSjj) | Video  ~
PFE,BRIEF-Paulson & Co dissolves share stake in Pfizer, ups in Valeant ‍​ * Paulson & Co dissolves share stake in Pfizer- SEC filing ‍​ ~BRIEF-Appaloosa dissolves share stake in Snap Inc, Pfizer Inc * Appaloosa Lp dissolves class a share stake in Snap Inc - SEC Filing ~
PSX,Venezuela ships more oil to U.S. in July vs June, but less than yr ago Aug 14 Venezuela's PDVSA and its joint ventures last month shipped 638,325 barrels per day (bpd) of crude to the United States, a 30 percent increase over June due to larger sales of upgraded oil, according to Thomson Reuters trade flows data. ~
QCOM.O,Qualcomm outlines impact of dispute with Apple after SEC request Aug 14 Chipmaker Qualcomm Inc on Monday disclosed further details about the impact of an ongoing dispute with Apple Inc, responding to questions from the U.S. Securities and Exchange Commission. ~GRAPHIC-Take Five: World markets themes for the week ahead LONDON, Aug 11 Following are five big themes likely to dominate thinking of investors and traders in the coming week, and the Reuters stories related to them. ~
RTN,Raytheon names former U.S. deputy defense secretary to board Tomahawk missile maker Raytheon Co  on Monday named former U.S. Deputy Defense Secretary Robert Work as a director to its board. ~BRIEF-Raytheon elects Robert Work to board * Raytheon Co - ‍Work was appointed deputy secretary of defense by president Barack Obama in 2014, a position work held through July 2017​ Source text for Eikon: Further company coverage: ~
REGN.O,BRIEF-Regeneron's drug for respiratory virus fails late-stage study * Regeneron to discontinue development of suptavumab for respiratory syncytial virus ~BRIEF-Temasek Holdings takes stake in JPMorgan, Biogen, Celgene * Temasek Holdings (Private) Ltd takes share stake in JPMorgan Chase & Co of 264,337 shares ~
R,Ryder to offer Chanje's electric trucks on lease Aug 14 U.S. truck leasing and rental company Ryder Systems Inc said on Monday it would become the exclusive sales partner for California-based electric truck maker Chanje, which would roll out its first commercial vehicle in the last quarter of 2017. ~BRIEF-Ryder System partners Chanje Energy to become exclusive sales channel partner and service provider * Ryder partners with Chanje Energy to become exclusive sales channel partner and service provider ~
SYF,UPDATE 1-Buffett's Berkshire adds Synchrony, sheds GE NEW YORK, Aug 14 Warren Buffett's Berkshire Hathaway Inc on Monday said it added a stake in Synchrony Financial, boosting its bet on the credit card industry, and shed its investment in the company's former parent, General Electric Co. ~Buffett's Berkshire sheds GE, adds Synchrony NEW YORK, Aug 14 Warren Buffett's Berkshire Hathaway Inc on Monday said it has taken a 17.5 million share stake in Synchrony Financial and shed its investment in the financial services company's former parent, General Electric Co. ~
TGT,Target appoints Walmart, General Mills execs to shore up grocery business CHICAGO, Aug 14 Target Corp said on Monday it has hired two former executives from Wal-Mart Inc and General Mills Inc to join its food and beverage business, as the retailer seeks to revamp its grocery aisles. ~
DIS,BRIEF-Soros Fund Management dissolves share stake in Chevron, Citi, Disney * Takes share stake of 2.5 million shares in Altaba - SEC filing ~'Grey's Anatomy' creator Shonda Rhimes leaves ABC for Netflix Aug 14 "Grey's Anatomy" creator Shonda Rhimes is taking her Shondaland production house away from Walt Disney Co's ABC network to Netflix Inc to produce new content, the video streaming company said on Sunday. ~
VFC,UPDATE 2-VF Corp to buy Dickies workwear maker for $820 million Aug 14 Apparel and footwear maker VF Corp said on Monday it would buy  privately held Williamson-Dickie Mfg. Co, the owner of Dickies and Workrite workwear, for about $820 million in cash. ~VF Corp to buy Dickies workwear maker for $820 million Aug 14 Apparel and footwear maker VF Corp said it would buy  Williamson-Dickie Mfg. Co, the owner of Dickies and Workrite workwear, for about $820 million in cash. ~
WMT,Target appoints Walmart, General Mills execs to shore up grocery business CHICAGO, Aug 14 Target Corp said on Monday it has hired two former executives from Wal-Mart Inc and General Mills Inc to join its food and beverage business, as the retailer seeks to revamp its grocery aisles. ~
WFC,BRIEF-Temasek Holdings takes stakes in Goldman, Morgan Stanley and Wells Fargo‍​ * Temasek Holdings Private Ltd takes share stake of 20,337 shares in Goldman Sachs Group Inc ‍​ ~
WHR,BRIEF-Whirlpool comments on Manufacturing Jobs Initiative * Says "the company will continue on the Manufacturing Jobs Initiative" Further company coverage: ~Sears, Whirlpool win fee reduction in washer lawsuit Aug 14 A federal appeals court reduced by $2 million the legal fees that Sears Holdings Corp and Whirlpool Corp must pay to settle a class action lawsuit over defective washing machines. The reason: the case was not that complicated. ~
