ABBV.N,BRIEF-Abbvie's CEO total 2016 compensation was $21 mln - SEC filing * CFO William Chase's 2016 total compensation was $8.8 million versus $7.6 million in 2015 ~
AIG,U.S. insurer AIG makes Luxembourg its EU hub to cope with Brexit LONDON U.S. insurer AIG  plans a European Union hub in Luxembourg following Britain's decision to leave the bloc, the biggest financial services firm so far to detail such a move. ~UPDATE 3-U.S. insurer AIG makes Luxembourg its EU hub to cope with Brexit LONDON, March 8 U.S. insurer AIG plans a European Union hub in Luxembourg following Britain's decision to leave the bloc, the biggest financial services firm so far to detail such a move. ~
ADP.O,REFILE-TREASURIES-Robust ADP jobs data lift U.S. bond yields  (Refiles to correct word order in headline)     * U.S. companies hire most workers since Dec 2015 -ADP     * Futures imply rate hike next week nearly priced in     * U.S. to sell $20 billion 10-year notes at 1 p.m. (1800 GMT)     * U.S. 2-year yield hits highest since August 2009      By Richard Leong     NEW YORK, March 8 U.S. Treasury yields jumped on Wednesday, with benchmark yields hitting their highest levels since December as a strong gain in U.S. private-sector jobs in Februa ~MONEY MARKETS-Traders strengthen U.S. rate hike view after ADP jobs data NEW YORK, March 8 U.S. interest rates futures added to earlier losses on Wednesday as traders raised their expectations on the number of U.S. rate increases in 2017 following a stronger-than-forecast February reading on private jobs growth from payroll processor ADP. ~U.S. private sector adds 298,000 jobs in February: ADP NEW YORK U.S. private employers added 298,000 jobs in February, well above economists' expectations, a report by a payrolls processor showed on Wednesday. ~
BLK,U.S. regulators push new ETF rules despite industry's howl NEW YORK, March 8 U.S. regulators are advancing rules this week to tighten standards on the ballooning exchange-traded fund industry over the objections of asset managers including BlackRock Inc and Invesco Ltd . ~
BA,UPDATE 2-Boeing says 737 MAX 10X jet has support from airlines, suppliers SEATTLE, March 8 Boeing Co defended its proposed 737 MAX 10X aircraft on Wednesday, saying it has drawn plaudits from numerous airlines and interest from parts suppliers to rebut criticisms aired at an industry conference on Tuesday. ~Boeing says 737 MAX 10X jet has support from airlines, suppliers SEATTLE, March 8 Boeing Co said on Wednesday that its proposed 737 MAX 10X aircraft has drawn plaudits from numerous airlines and interest from parts suppliers, a rebuttal to criticisms aired at an industry conference on Tuesday. ~Aircraft lessors lukewarm on Boeing's planned 737-10 jet SAN DIEGO Major aircraft leasing companies have offered a lukewarm response to proposals by Boeing to build a bigger version of its 737 MAX family to counter the Airbus A321neo. ~Aircraft lessors lukewarm on Boeing's planned 737-10 jet SAN DIEGO, March 7 Major aircraft leasing companies have offered a lukewarm response to proposals by Boeing to build a bigger version of its 737 MAX family to counter the Airbus A321neo. ~PRESS DIGEST - Wall Street Journal - March 8 March 8 The following are the top stories in the Wall Street Journal. Reuters has not verified these stories and does not vouch for their accuracy. ~UPDATE 1-China's CDB Aviation has ordered 30 Boeing MAX 8 jets -sources SAN DIEGO, March 7 China's CDB Aviation Lease Finance is poised to announce an order for 30 Boeing 737 MAX 8 passenger jets and is looking at placing further potential aircraft orders as it pursues international growth, industry sources said on Tuesday. ~
CMG,Chipotle lawsuit over food safety, outbreaks is dismissed NEW YORK, March 8 Chipotle Mexican Grill Inc  on Wednesday won the dismissal of a lawsuit claiming it defrauded shareholders about its ability to protect customers from at least seven norovirus, E.coli and salmonella outbreaks that erupted in 2015. ~
CSX.O,Hazardous cargo train derails in New York state but cars unbreached March 7 A CSX Corp freight train containing hazardous materials partially derailed in the area of Newburgh, New York, on Tuesday, but the cars with dangerous substances appear to have been unbreached, an official with the railroad company said. ~
DOW,BRIEF-Downer EDI says offer for Spotless Group now closed * Confirms that its offer for Spotless was not extended and has now closed. Source text for Eikon: Further company coverage: ~BRIEF-Downer EDI posts FY net profit of $181.5 million * FY total revenue and other income from ordinary activities $7.29 billion , up 6.4 percent ~BRIEF-Downer EDI says ‍offer for Spotless Group extended to 28 August 2017​ * ‍Offer for Spotless Group extended to 7pm on Monday, 28 august 2017​ Source text for Eikon: Further company coverage: ~BRIEF-Downer EDI says Spotless ‍offer extended to Aug 21, 2017​ * Spotless ‍offer extended to 7pm on monday, 21 august 2017​ Source text for Eikon: Further company coverage: ~BRIEF-Downer EDI's takeover offer for Spotless Group extended till 7pm (Sydney time) on Aug. 14 * Unconditional takeover offer for Spotless Group extended until 7:00pm (Sydney time) on Monday, 14 August Source text for Eikon: Further company coverage: (bangalore.newsroom@thomsonreuters.com) ~BRIEF-Downer extends takeover offer for Spotless Group * decided to extend Spotless offer period for one week; offer will now remain open for acceptance until 14 august Source text for Eikon: Further company coverage: ~BRIEF-Downer extends Spotless offer to August 7 2017 * ‍Downer has decided to extend offer for Spotless Group holdings to 7 pm on Monday, 7 august 2017​ Source text for Eikon: Further company coverage: ~BRIEF-Downer EDI's stake in Spotless increases to 80.3 pct * Downer's stake in Spotless increases to 80.3 pct Source text for Eikon: Further company coverage: ~BRIEF- Downer EDI Ltd'S stake in Spotless Group increases to 72% * As Downer's shareholding in Spotless is now over 70%, Downer expects that Spotless will be removed from certain S&P;/ASX market indices ~
XOM,CERAWEEK-Oil majors still years from repairing balance sheets after price war HOUSTON, March 8 Financially strapped oil producers are spending billions to boost production before it's clear that recent crude price gains brought on by OPEC output cuts can be sustained. ~Statoil plans to extend Statfjord A output until 2022 OSLO, March 8 Norway's Statoil plans to extend production at its oldest oil platform still in operation, the Statfjord A, until 2022, two years longer than previously planned, the company said in a letter to the country's Ministry of Petroleum and Energy. ~RPT-COLUMN-Oil industry costs will rise as focus shifts to growth: Kemp LONDON, March 7 Oil industry costs are notoriously pro-cyclical, which is one of the main reasons for the pattern of boom and bust that has afflicted in the industry from the beginning. ~
FB.O,WhatsApp tests business chat tools in search for revenue SAN FRANCISCO, March 8 WhatsApp, the Facebook-owned messaging service used by more than 1 billion people worldwide, is testing a system that would let businesses talk directly to WhatsApp users for the first time, according to communications about the project seen by Reuters. ~Snap options set for strong demand on market debut NEW YORK Traders looking for a piece of the action around Snap Inc's  newly launched shares will get another way to bet on the fortunes of the Snapchat owner when its options start trading on Friday. ~Snap options set for strong demand on market debut NEW YORK, March 8 Traders looking for a piece of the action around Snap Inc's newly launched shares will get another way to bet on the fortunes of the Snapchat owner when its options start trading on Friday. ~
GE,Suez targets industrial water with $3.4 billion GE Water deal PARIS French waste and water group Suez has boosted its industrial water treatment business with the 3.2 billion euros ($3.4 billion) acquisition of GE Water from General Electric . ~Withdrawal of GE's Nason leaves Fed job up in the air David Nason, a General Electric  executive and former Treasury Department official, has told the White House he is no longer interested in serving as the Federal Reserve's bank supervision chief. ~BRIEF-Suez Environnement enters into binding agreement to purchase GE Water * Will acquire along with CDPQ, in a 70/30 joint venture, 100% of GE Water ~GE's Nason not interested in joining Fed - Bbg March 8 David Nason, a General Electric executive and former Treasury Department official, has told the White House that he was no longer interested in taking up the role of Federal Reserve's bank supervision chief, Bloomberg reported. ~Suez buys GE Water in 3.2 bln euro deal, considers capital increase PARIS, March 8 French waste and water group Suez  said in a statement it and Canada's Caisse de dépôt et placement du Québec (CDPQ) have agreed to buy GE Water from General Electric for an enterprise value of 3.2 billion euros ($3.37 billion). ~BRIEF-U.S. Army awards GE Aviation contract to develop silicon carbide power electronics * U.S. Army awards GE Aviation contract to develop silicon carbide power electronics  Source text for Eikon: Further company coverage: ~BRIEF-GE, Caithness announce power plant deal that could exceed $1 bln * GE & Caithness announce innovative power deal that could exceed $1b to build multiple HA combined-cycle power plants in US ~
GM,PRESS DIGEST - Wall Street Journal - March 8 March 8 The following are the top stories in the Wall Street Journal. Reuters has not verified these stories and does not vouch for their accuracy. ~
INTC.O,U.S. tech sanctions will rattle China's firewall HONG KONG (Reuters Breakingviews) - China has been giving fair warning. Telecoms equipment maker ZTE has agreed to plead guilty for violating U.S. export controls. The charges could have been more severe and the $892 million fine is manageable for the $9 billion company. More powerful is the message: the new U.S. administration is prepared to take action against corporate giants to rein in troublesome nations. ~UPDATE 5-China's ZTE pleads guilty, settles U.S. sanctions case for nearly $900 mln * ZTE to plead guilty to evading U.S. sanctions on Iran, N.Korea ~
IVZ,U.S. regulators push new ETF rules despite industry's howl NEW YORK, March 8 U.S. regulators are advancing rules this week to tighten standards on the ballooning exchange-traded fund industry over the objections of asset managers including BlackRock Inc and Invesco Ltd . ~
JNPR.N,Juniper's Gary Clark joins Tesla as chief information officer March 7 Gary Clark, a former IT chief technology officer at Juniper Networks Inc, joined Tesla Inc  in February as its chief information officer, according to Clark's LinkedIn profile. ~
MSFT.O,BRIEF-Accenture and Avanade strengthen Microsoft alliance * Accenture and Avanade strengthen Microsoft alliance to expand capabilities in cloud and digital transformation; Debbie Polishook appointed to Avanade board of directors  Source text for Eikon:  Further company coverage: ~China's ZTE pleads guilty, settles U.S. sanctions case for nearly $900 million NEW YORK/HONG KONG Chinese telecom equipment maker ZTE Corp has agreed to plead guilty and pay nearly $900 million in a U.S. sanctions case, drawing a line under a damaging scandal that had threatened its cut off its supply chain. | Video  ~UPDATE 5-China's ZTE pleads guilty, settles U.S. sanctions case for nearly $900 mln * ZTE to plead guilty to evading U.S. sanctions on Iran, N.Korea ~
NKE,Nike to launch high-tech hijab for female Muslim athletes March 8 Nike Inc will launch a hijab for female Muslim athletes early next year, becoming the first major sports apparel maker to offer a traditional Islamic head scarf designed specifically for competition, the company said on Wednesday. ~Adidas U.S. push keeps up pressure on Nike, Under Armour HERZOGENAURACH, Germany The new boss of Adidas  increased sales and profit targets on Wednesday, sending shares in the German sportswear firm to a record high as he pledged to keep investing heavily in the key U.S. market and do more to boost e-commerce sales. | Video  ~UPDATE 3-Adidas U.S. push keeps up pressure on Nike, Under Armour * New CEO says more work to be done in United States   (Adds details from news conference) ~
PEP,UPDATE 1-PepsiCo bidding for Brazilian dairy company Vigor -newspapers SAO PAULO, March 8 PepsiCo Inc has bid to acquire Brazilian dairy company Fábrica de Produtos Alimentícios Vigor SA, according to reports published in two Brazilian newspapers on Wednesday. ~PepsiCo bidding for Brazilian dairy company Vigor -newspapers SAO PAULO, March 8 PepsiCo Inc has bid to acquire Brazilian dairy company Fábrica de Produtos Alimentícios Vigor SA, according to reports published in two Brazilian newspapers on Wednesday. ~
PPG,Deals of the day-Mergers and acquisitions March 8 The following bids, mergers, acquisitions and disposals were reported by 2100 GMT on Wednesday: ~UPDATE 1-Akzo Nobel explores sale, merger with peer -sources March 8 Dutch paint maker Akzo Nobel NV  is exploring a sale or merger with a peer, and is in talks with companies including U.S. coatings manufacturer PPG Industries Inc, people familiar with the matter said on Wednesday. ~Akzo Nobel explores sale, merger with peer -sources March 8 Dutch paint maker Akzo Nobel NV  is exploring a sale or merger with a peer, and is in talks with companies including U.S. coatings manufacturer PPG Industries Inc, people familiar with the matter said on Wednesday. ~
PX,Praxair merger likely to take several months - Linde CEO MUNICH, Germany, March 8 Finalising a merger with Praxair is likely to take "several months", the chief executive of Linde said in a letter to a shareholder association, reiterating he saw no need to ask shareholders to vote on the $65 billion deal. ~
QCOM.O,China's ZTE pleads guilty, settles U.S. sanctions case for nearly $900 million NEW YORK/HONG KONG Chinese telecom equipment maker ZTE Corp has agreed to plead guilty and pay nearly $900 million in a U.S. sanctions case, drawing a line under a damaging scandal that had threatened its cut off its supply chain. | Video  ~U.S. tech sanctions will rattle China's firewall HONG KONG (Reuters Breakingviews) - China has been giving fair warning. Telecoms equipment maker ZTE has agreed to plead guilty for violating U.S. export controls. The charges could have been more severe and the $892 million fine is manageable for the $9 billion company. More powerful is the message: the new U.S. administration is prepared to take action against corporate giants to rein in troublesome nations. ~UPDATE 5-China's ZTE pleads guilty, settles U.S. sanctions case for nearly $900 mln * ZTE to plead guilty to evading U.S. sanctions on Iran, N.Korea ~
STT,FTSE Russell turns to investors on Snap voting rights quandary     By Ross Kerber     BOSTON, March 8 FTSE Russell will consult with big investors on whether to include companies like Snap Inc          in its widely followed  stock indexes even if their shares lack voting rights, an executive said.      The issue will be studied at meetings with asset managers and other clients this month, Joti Rana, Americas head of governance and policy for FTSE Russell, said in an interview on Tuesday. FTSE Russell offers popular indexes like Britain's blue-c ~
DIS,Disney CEO Iger defends role on Trump advisory council LOS ANGELES, March 8 Walt Disney Co Chief Executive Bob Iger on Wednesday said his seat on President Trump's business advisory council provides an opportunity to voice opinions that will benefit the company and its shareholders. ~
FOXA.O,Fox takes issue with UK government analysis of Sky deal LONDON Rupert Murdoch's Twenty-First Century Fox  said it was not surprised the British government wanted to scrutinize its takeover of Sky , but disputed the analysis that led to the view the deal may not be in the public interest. ~Fox takes issue with UK government analysis of Sky deal LONDON, March 8 Rupert Murdoch's Twenty-First Century Fox said it was not surprised the British government wanted to scrutinise its takeover of Sky, but disputed the analysis that led to the view the deal may not be in the public interest. ~
FOX.O,Fox takes issue with UK government analysis of Sky deal LONDON Rupert Murdoch's Twenty-First Century Fox  said it was not surprised the British government wanted to scrutinize its takeover of Sky , but disputed the analysis that led to the view the deal may not be in the public interest. ~Fox takes issue with UK government analysis of Sky deal LONDON, March 8 Rupert Murdoch's Twenty-First Century Fox said it was not surprised the British government wanted to scrutinise its takeover of Sky, but disputed the analysis that led to the view the deal may not be in the public interest. ~
TSN,Tennessee bird flu shares name, not genetics, of feared China strain -USDA CHICAGO, March 7 The strain of bird flu that infected a chicken farm in Tennessee in recent days shares the same name as a form of the virus that has killed humans in China, but is genetically distinct from it, U.S. authorities said on Tuesday. ~
VIAB.O,UPDATE 1-Viacom in talks with ex-Fox Chairman Gianopulos to lead Paramount-WSJ March 8 Viacom Inc is in talks with former Twentieth Century Fox Chairman Jim Gianopulos to lead its Paramount Pictures film studio, the Wall Street Journal reported. ~Viacom in talks with ex-Fox Chairman Gianopulos to lead Paramount-WSJ March 8 Viacom Inc is in talks with former Twentieth Century Fox Chairman Jim Gianopulos to lead its Paramount Pictures film studio, the Wall Street Journal reported. ~
V,BRIEF-Visa calls for redemption all of its 1.200 pct notes due 2017 * Visa Inc - on Sept 11, co called for redemption all of $1.75 billion principal amount outstanding of its 1.200 pct notes due 2017‍​ - SEC filing ~BRIEF-Visa Inc files for three-part senior notes offering of up to $2.5 bln * Visa Inc says files for three-part senior notes offering of up to $2.5 billion - SEC filing‍​ ~Former BoE deputy Hogg to join Visa as Europe unit CEO Visa Inc, the world's largest payments processor, on Thursday named former Bank of England (BoE) deputy governor Charlotte Hogg as chief executive of its Europe division. ~CORRECTED-UPDATE 1-MOVES-Former BoE deputy Hogg to join Visa as Europe unit CEO Sept 7 Visa Inc, the world's largest payments processor, on Thursday named former Bank of England (BoE) deputy governor Charlotte Hogg as chief executive of its Europe division. ~MOVES-Visa names ex-BoE deputy Charlotte Hogg as Europe unit CEO Sept 7 Visa Inc, the world's largest payments processor, on Thursday named Charlotte Hogg as chief executive of its Europe division. ~BRIEF-Visa appoints Charlotte Hogg as CEO of European operations * Visa Inc appoints Charlotte Hogg as chief executive officer of the compan's European operations ~BRIEF-Visa Inc files prospectus supplement for potential three-part senior notes offering * Visa Inc files prospectus supplement for potential three-part senior notes offering; size not disclosed - sec filing‍​ Source text (http://bit.ly/2vLDrIe) Further company coverage: ~BRIEF-Visa enables on the go payments with the new Fitbit Ionic * Visa inc- ‍enabling visa payments on fitbit's smartwatch fitbit ionic​ ~BRIEF-Bridg raises $11 million in Series B funding * Bridg raises $11 million in Series B funding from Morpheus Ventures, March Capital, Visa and NextEquity ~
