AES,BRIEF-AES provides details on financing for sPower deal * Aes corp-portion of deal to be funded with $90 million of subordinated debt to spower,remaining amount to be funded with equity from aes, aimco in equal proportion  Source text for Eikon:  Further company coverage: ~AES and AIMCo to buy solar developer FTP Power for $853 mln Feb 24 U.S. power utility company AES Corp  said on Friday it would buy a privately held company that builds utility-scale solar projects, along with Canada's investment fund manager Alberta Investment Management Corp, for $853 million in cash. ~BRIEF-AES and AIMCO to acquire Spower from Fir Tree Partners * AES and AIMCO agree to acquire Spower, the largest independent solar developer in the United States, from Fir Tree Partners ~
GOOGL.O,Alphabet's self-driving car unit sues Uber with trade theft charge SAN FRANCISCO Alphabet Inc's Waymo self-driving car unit sued Uber Technologies and its autonomous trucking subsidiary Otto on Thursday over allegations of theft of its confidential and proprietary sensor technology. ~UPDATE 2-Alphabet's self-driving car unit sues Uber with trade theft charge SAN FRANCISCO, Feb 23 Alphabet Inc's Waymo self-driving car unit sued Uber Technologies and its autonomous trucking subsidiary Otto on Thursday over allegations of theft of its confidential and proprietary sensor technology. ~
GOOG.O,Alphabet's self-driving car unit sues Uber with trade theft charge SAN FRANCISCO Alphabet Inc's Waymo self-driving car unit sued Uber Technologies and its autonomous trucking subsidiary Otto on Thursday over allegations of theft of its confidential and proprietary sensor technology. ~UPDATE 2-Alphabet's self-driving car unit sues Uber with trade theft charge SAN FRANCISCO, Feb 23 Alphabet Inc's Waymo self-driving car unit sued Uber Technologies and its autonomous trucking subsidiary Otto on Thursday over allegations of theft of its confidential and proprietary sensor technology. ~
AAPL.O,Tech groups Softbank and Foxconn to deepen ties with joint venture TOKYO/TAIPEI Japan's Softbank Group  and Taiwan's Foxconn will soon begin operating a joint venture that deepens ties between two of Asia's biggest technology companies, they said on Friday. ~UPDATE 2-Tech groups Softbank and Foxconn to deepen ties with joint venture TOKYO/TAIPEI, Feb 24 Japan's Softbank Group  and Taiwan's Foxconn will soon begin operating a joint venture that deepens ties between two of Asia's biggest technology companies, they said on Friday. ~
ADM,ADM brokerage arm shifts more trades onto computer screens CHICAGO, Feb 24 ADM Investor Services (ADMIS), a futures commission merchant owned by global grain trader Archer Daniels Midland Co, will begin executing more of its orders electronically beginning on March 1, the company said on Friday. ~
BA,Boeing to open first European factory, to invest 20 mln pounds Feb 24 Boeing Co said it would invest 20 million pounds ($24.98 million) to open its first production facility in Europe to make components for certain aircraft. ~
CI,UPDATE 1-BCBS, Cigna among insurer groups to meet with Trump on Monday NEW YORK, Feb 24 The Blue Cross Blue Shield Association, which represents insurers in every state, Cigna Corp and Humana Inc said on Friday they would attend a meeting between the health insurance industry and President Donald Trump on Monday. ~BCBS, Cigna among insurer groups to meet with Trump on Monday NEW YORK, Feb 24 The Blue Cross Blue Shield Association, which represents insurers in every state, said on Friday that it would attend a meeting between the health insurance industry and President Donald Trump on Monday. ~
COH,Michael Kors, Coach in second round of Kate Spade auction -sources Feb 24 Michael Kors Holding Inc and Coach Inc are among the companies that have made it through to the second round of bidding for handbag and accessories maker Kate Spade & Co, people familiar with the situation said on Friday. ~
DOW,BRIEF-Downer EDI says offer for Spotless Group now closed * Confirms that its offer for Spotless was not extended and has now closed. Source text for Eikon: Further company coverage: ~BRIEF-Downer EDI posts FY net profit of $181.5 million * FY total revenue and other income from ordinary activities $7.29 billion , up 6.4 percent ~BRIEF-Downer EDI says ‍offer for Spotless Group extended to 28 August 2017​ * ‍Offer for Spotless Group extended to 7pm on Monday, 28 august 2017​ Source text for Eikon: Further company coverage: ~BRIEF-Downer EDI says Spotless ‍offer extended to Aug 21, 2017​ * Spotless ‍offer extended to 7pm on monday, 21 august 2017​ Source text for Eikon: Further company coverage: ~BRIEF-Downer EDI's takeover offer for Spotless Group extended till 7pm (Sydney time) on Aug. 14 * Unconditional takeover offer for Spotless Group extended until 7:00pm (Sydney time) on Monday, 14 August Source text for Eikon: Further company coverage: (bangalore.newsroom@thomsonreuters.com) ~BRIEF-Downer extends takeover offer for Spotless Group * decided to extend Spotless offer period for one week; offer will now remain open for acceptance until 14 august Source text for Eikon: Further company coverage: ~BRIEF-Downer extends Spotless offer to August 7 2017 * ‍Downer has decided to extend offer for Spotless Group holdings to 7 pm on Monday, 7 august 2017​ Source text for Eikon: Further company coverage: ~BRIEF-Downer EDI's stake in Spotless increases to 80.3 pct * Downer's stake in Spotless increases to 80.3 pct Source text for Eikon: Further company coverage: ~BRIEF- Downer EDI Ltd'S stake in Spotless Group increases to 72% * As Downer's shareholding in Spotless is now over 70%, Downer expects that Spotless will be removed from certain S&P;/ASX market indices ~
FB.O,Beyond phones and 5G, mobile world seeks to reinvent itself * Mobile operators chase new sources of growth beyond data plans ~
GM,GM demands non-compete clauses in return for Opel patents: Spiegel FRANKFURT General Motors  has told PSA Group  it would only sell licences for the manufacture of Opel cars to the French company if it agreed not to sell them in North America, Russia or China, German magazine Der Spiegel reported. ~GM demands non-compete clauses in return for Opel patents - Spiegel FRANKFURT, Feb 24 General Motors has told PSA Group it would only sell licences for the manufacture of Opel cars to the French company if it agreed not to sell them in North America, Russia or China, German magazine Der Spiegel reported. ~Fitch Assigns Expected First-Time Rating to SAIC-GMAC Finance's Rongteng 2017-1 (The following statement was released by the rating agency) Link to Fitch Ratings' Report: Rongteng 2017-1 Retail Auto Mortgage Loan  Securitization Trust https://www.fitchratings.com/site/re/894427 HONG KONG/BEIJING, February 24 (Fitch) Fitch Ratings has assigned expected  ratings to Rongteng 2017-1 Retail Auto Mortgage Loan Securitization Trust's auto  loan-backed fixed-rate notes. The issuance consists of notes backed by Chinese  automotive loan receivables originated by SAIC-GMAC Automotive  ~
GS,Goldman, shareholders sell South Korea's Daesung Industrial Gases SEOUL Goldman Sachs  and other shareholders said on Friday they had sold 100 percent of South Korea's second-largest producer of industrial gases to Asian private equity firm MBK Partners. ~Goldman, shareholders sell South Korea's Daesung Industrial Gases SEOUL, Feb 24 Goldman Sachs and other shareholders said on Friday they had sold 100 percent of South Korea's second-largest producer of industrial gases to Asian private equity firm MBK Partners. ~
HRS,CORRECTED-UPDATE 3-Canada's MacDonald Dettwiler to buy satellite imagery firm DigitalGlobe Feb 24 Canada's MacDonald Dettwiler and Associates Ltd, a provider of satellite data used for surveillance and communications, said it would buy U.S.-based DigitalGlobe Inc for about C$3.10 billion ($2.40 billion) to strengthen its position in the satellite imagery market. ~
HUM,UPDATE 1-BCBS, Cigna among insurer groups to meet with Trump on Monday NEW YORK, Feb 24 The Blue Cross Blue Shield Association, which represents insurers in every state, Cigna Corp and Humana Inc said on Friday they would attend a meeting between the health insurance industry and President Donald Trump on Monday. ~LPC: Bank lending undeterred by busted U.S. mergers NEW YORK Banks losing fees from a string of mega-mergers scuttled by U.S. antitrust rulings are still eager to extend loans to investment-grade companies seeking big tie-ups, in the hope they will ultimately profit by winning business down the road.     ~LPC: Bank lending undeterred by busted U.S. mergers NEW YORK, Feb 24 Banks losing fees from a string of mega-mergers scuttled by U.S. antitrust rulings are still eager to extend loans to investment-grade companies seeking big tie-ups, in the hope they will ultimately profit by winning business down the road. ~
KHC.O,UPDATE 2-Kraft's shock bid triggers Unilever focus on short-term value * Sees no strategic rationale to combine with Kraft   (Adds share price and valuation details) ~CORRECTED-UPDATE 1-Kraft's shock bid triggers Unilever focus on short-term value Feb 24 Kraft Heinz's bid has jolted Unilever into focusing more on delivering on its strategy in the short-term, the Anglo-Dutch company's finance chief said on Friday. ~Unilever says Kraft's shock bid to spur focus on short-term value LONDON, Feb 24 Unilever said the shock of Kraft Heinz's opportunistic approach had jolted it to re-examine its strategy, and all aspects of the consumer goods giant's business were up for review to increase shareholder value. ~
MA,BRIEF-Mastercard plans to integrate Masterpass into Gulf Pay * Plans to integrate Masterpass into Gulf Oil's new mobile payment application, Gulf Pay  Source text for Eikon:  Further company coverage: ~
KORS.N,Michael Kors, Coach in second round of Kate Spade auction -sources Feb 24 Michael Kors Holding Inc and Coach Inc are among the companies that have made it through to the second round of bidding for handbag and accessories maker Kate Spade & Co, people familiar with the situation said on Friday. ~
MDLZ.O,CORRECTED-UPDATE 1-Kraft's shock bid triggers Unilever focus on short-term value Feb 24 Kraft Heinz's bid has jolted Unilever into focusing more on delivering on its strategy in the short-term, the Anglo-Dutch company's finance chief said on Friday. ~Unilever says Kraft's shock bid to spur focus on short-term value LONDON, Feb 24 Unilever said the shock of Kraft Heinz's opportunistic approach had jolted it to re-examine its strategy, and all aspects of the consumer goods giant's business were up for review to increase shareholder value. ~
MS,MOVES-Morgan Stanley, Credit Suisse, HSBC, Deutsche Bank, JP Morgan Feb 24 The following financial services industry appointments were announced on Friday. To inform us of other job changes, email moves@thomsonreuters.com. ~MOVES-Hillary promoted in further DCM changes at Morgan Stanley LONDON, Feb 24 (IFR) - Morgan Stanley has launched a senior coverage group in its Europe, Middle East and Africa fixed income capital markets business, which will be headed up by former financial institutions group co-head Cecile Hillary. ~
TROW.O,Fidelity, T. Rowe poised for gains on Snap IPO BOSTON, Feb 23 Mutual funds run by Fidelity Investments and T. Rowe Price Group Inc could be poised for a quick win on the upcoming public debut of Snap Inc . ~
KO,UPDATE 1-Mexico's Coca-Cola Femsa profit boosted by Central America sales Feb 24 Coca-Cola Femsa SAB de CV, the largest Coke bottler in the world, reported a jump in quarterly profit on Friday, helped by higher volume sales in Costa Rica, Nicaragua and the Philippines. ~
V,BRIEF-Visa calls for redemption all of its 1.200 pct notes due 2017 * Visa Inc - on Sept 11, co called for redemption all of $1.75 billion principal amount outstanding of its 1.200 pct notes due 2017‍​ - SEC filing ~BRIEF-Visa Inc files for three-part senior notes offering of up to $2.5 bln * Visa Inc says files for three-part senior notes offering of up to $2.5 billion - SEC filing‍​ ~Former BoE deputy Hogg to join Visa as Europe unit CEO Visa Inc, the world's largest payments processor, on Thursday named former Bank of England (BoE) deputy governor Charlotte Hogg as chief executive of its Europe division. ~CORRECTED-UPDATE 1-MOVES-Former BoE deputy Hogg to join Visa as Europe unit CEO Sept 7 Visa Inc, the world's largest payments processor, on Thursday named former Bank of England (BoE) deputy governor Charlotte Hogg as chief executive of its Europe division. ~MOVES-Visa names ex-BoE deputy Charlotte Hogg as Europe unit CEO Sept 7 Visa Inc, the world's largest payments processor, on Thursday named Charlotte Hogg as chief executive of its Europe division. ~BRIEF-Visa appoints Charlotte Hogg as CEO of European operations * Visa Inc appoints Charlotte Hogg as chief executive officer of the compan's European operations ~BRIEF-Visa Inc files prospectus supplement for potential three-part senior notes offering * Visa Inc files prospectus supplement for potential three-part senior notes offering; size not disclosed - sec filing‍​ Source text (http://bit.ly/2vLDrIe) Further company coverage: ~BRIEF-Visa enables on the go payments with the new Fitbit Ionic * Visa inc- ‍enabling visa payments on fitbit's smartwatch fitbit ionic​ ~BRIEF-Bridg raises $11 million in Series B funding * Bridg raises $11 million in Series B funding from Morpheus Ventures, March Capital, Visa and NextEquity ~
