ABT,BRIEF-Abbott secures Health Canada license for Freestyle Libre system for people with diabetes * Abbott secures Health Canada license for Freestyle Libre system for people with diabetes ~
AET,Aetna to move corporate headquarter to New York in 2018 NEW YORK, June 29 Aetna Inc., the third largest U.S. health insurer, will move its corporate headquarters to New York City in 2018, a decision it has been weighing as the state of Connecticut has raised taxes to try to balance its budget. ~
AMZN.O,Europe M&A; surges but U.S. slows sharply amid uncertainty June 29 Acquisitions of European companies surged in recent months, amid optimism about the region's economic prospects, but global deal-making subsided and the total value of U.S. deals fell sharply due to uncertainty about President Donald Trump's tax reform and deregulation agenda. ~Nike to launch pilot program with Amazon; results top estimates Nike Inc , the world's largest footwear maker, said on Thursday it would launch a pilot program with Amazon.com Inc  to sell a limited product assortment on its website. ~Alibaba to launch product similar to Amazon Echo: source Chinese e-commerce company Alibaba Group Holding Ltd would launch a product mimicking Amazon.com Inc's "Echo" next week, according to a source familiar with the matter. ~Alibaba to launch product similar to Amazon Echo - source June 29 Chinese e-commerce company Alibaba Group Holding Ltd would launch a product mimicking Amazon.com Inc's "Echo" next week, according to a source familiar with the matter. ~Mexico court suspends sale of Roku TV streaming gadgets MEXICO CITY A cable operator belonging to Mexico's largest television network has won a legal case to stop the sale of Roku video streaming devices in the country on the grounds that the gadgets are often hacked to let users view pirated channels. ~Mexico court suspends sale of Roku TV streaming gadgets MEXICO CITY, June 29 A cable operator belonging to Mexico's largest television network has won a legal case to stop the sale of Roku video streaming devices in the country on the grounds that the gadgets are often hacked to let users view pirated channels. ~BRIEF-Walgreens Boots CEO- "View this deal as being more attractive than the transaction it replaces" * This quarter we've begun to implement a program in certain stores to simplify our offering and improve retail operational performance ~Meal-kit maker Blue Apron goes public, demand underwhelms as Amazon looms Blue Apron Holdings Inc , the biggest U.S. meal kit provider, raised $300 million as it went public on Wednesday, a third less than it had hoped, as Amazon.com's  industry-changing deal to buy Whole Foods Market Inc  weighed on the sector. | Video  ~
AIG,BRIEF-Icahn said to ease off demand for AIG breakup after CEO switch - Bloomberg * Icahn said to ease off demand for AIG breakup after CEO switch - Bloomberg, citing sources ~
BCR,Europe M&A; surges but U.S. slows sharply amid uncertainty June 29 Acquisitions of European companies surged in recent months, amid optimism about the region's economic prospects, but global deal-making subsided and the total value of U.S. deals fell sharply due to uncertainty about President Donald Trump's tax reform and deregulation agenda. ~
BDX,Europe M&A; surges but U.S. slows sharply amid uncertainty June 29 Acquisitions of European companies surged in recent months, amid optimism about the region's economic prospects, but global deal-making subsided and the total value of U.S. deals fell sharply due to uncertainty about President Donald Trump's tax reform and deregulation agenda. ~
BRKa.N,BRIEF-Home capital announces receipt of tsx conditional listing approval for initial equity investment by Berkshire Hathaway * Home Capital announces receipt of TSX conditional listing approval for initial equity investment by Berkshire Hathaway ~
BBY,Mexico court suspends sale of Roku TV streaming gadgets MEXICO CITY, June 29 A cable operator belonging to Mexico's largest television network has won a legal case to stop the sale of Roku video streaming devices in the country on the grounds that the gadgets are often hacked to let users view pirated channels. ~
BA,RPT-Caisse fires back at Boeing over Bombardier claims NEW YORK, June 28 Quebec's largest pension fund has dismissed as "absolute nonsense" claims by Boeing Co that its $1.5 billion investment in Bombardier Inc's rail business amounted to an unfair subsidy to the Canadian company. ~Caisse fires back at Boeing over Bombardier claims NEW YORK Quebec's largest pension fund has dismissed as "absolute nonsense" claims by Boeing Co  that its $1.5 billion investment in Bombardier Inc's  rail business amounted to an unfair subsidy to the Canadian company. ~Boeing asks for delay in duty ruling on Bombardier jet petition Bombardier Inc  may have to wait to find out if its CSeries commercial jets will be hit by punishing U.S. duties after Boeing  requested the U.S. Department of Commerce to postpone its preliminary ruling on its petition until Sept. 25. ~UPDATE 1-Caisse fires back at Boeing over Bombardier claims NEW YORK, June 28 Quebec's largest pension fund has dismissed as "absolute nonsense" claims by Boeing Co that its $1.5 billion investment in Bombardier Inc's rail business amounted to an unfair subsidy to the Canadian company. ~
C,MOVES-Citi adds to electronic equities team LONDON, June 29 (IFR) - Citigroup has made several appointments to its equities electronic execution team, hiring Joseph Sidibe as a senior salesperson from Bank of America Merrill Lynch as well as Phoebe Nockolds from Liquidnet and Rupert Dransfield from HSBC. ~
CMCSA.O,AMC offers ad-free subscription for Comcast TV customers LOS ANGELES AMC Networks Inc on Thursday will release a $5-a-month subscription option designed for pay TV customers who want commercial-free versions of shows such as hit zombie drama "The Walking Dead," company officials said. ~AMC offers ad-free subscription for Comcast TV customers LOS ANGELES, June 29 AMC Networks Inc on Thursday will release a $5-a-month subscription option designed for pay TV customers who want commercial-free versions of shows such as hit zombie drama "The Walking Dead," company officials said. ~
CAG,UPDATE 2-Conagra profit jumps, but shares fall as margins disappoint June 29 Chef Boyardee pasta maker Conagra Brands Inc reported a 29 percent rise in quarterly profit as it cut back on promotions and jettisoned low-margin products. ~BRIEF-Conagra qtrly adjusted earnings per share ‍$0.37​ * Conagra Brands' transformation continues with solid end to strong fiscal 2017 ~Conagra Brands quarterly profit jumps 29 pct June 29 Chef Boyardee pasta maker Conagra Brands Inc reported a 29 percent rise in quarterly profit as it cut back on promotions and jettisoned unprofitable products. ~
COP,UPDATE 1-ConocoPhillips to sell Barnett assets for $305 mln June 29 ConocoPhillips said it would sell its assets in the Barnett shale field in Texas to Miller Thomson & Partners LLC for about $305 million, as part of the largest U.S. independent oil producer's efforts to reduce exposure to natural gas. ~BRIEF-ConocoPhillips to recognize non-cash impairment of about $0.4 billion after tax in Q2 * Conocophillips-As result of barnet assets sale, to recognize non-cash impairment of about $0.6 billion pre-tax, about $0.4 billion after tax, in q2-sec filing Source text for Eikon: (http://bit.ly/2spK2kM) Further company coverage: ~ConocoPhillips to sell Barnett assets for $305 million June 29 ConocoPhillips said on Thursday it would sell its assets in the Barnett shale field in Texas to Miller Thomson & Partners LLC for about $305 million. ~
DHI,UPDATE 1-Forestar agrees to D.R. Horton's offer; scraps Starwood deal June 29 Forestar Group Inc scrapped its merger agreement with investment firm Starwood Capital Group on Thursday and said U.S. homebuilder D.R. Horton Inc would buy a 75 percent stake in the company. ~BRIEF-D.R. Horton and Forestar announce merger agreement * D.R. Horton and Forestar announce merger agreement to create a leading national land development company ~BRIEF-Forestar terminates its previously announced merger agreement with Starwood Capital * Forestar announces agreement with D.R. Horton and terminates Starwood merger agreement ~Forestar to sell majority stake in company to D.R. Horton June 29 Forestar Group Inc said on Thursday it had agreed to sell a 75 percent stake in the company to U.S. homebuilder D.R. Horton Inc and scrapped its merger agreement with investment firm Starwood Capital Group. ~
FB.O,Facebook says internet drone lands successfully on second test SAN FRANCISCO, June 29 Facebook Inc said on Thursday it had completed a second test of an unmanned aircraft designed to some day beam internet access to remote parts of the planet, and unlike in the first test, the drone did not crash. ~Britain says Fox bid for Sky risks giving Murdoch too much power LONDON Britain intends to subject Rupert Murdoch's takeover of European pay-TV group Sky  to a lengthy in-depth investigation after finding the $15 billion deal risks giving the media mogul too much power over the news agenda. | Video  ~UPDATE 4-Britain says Fox bid for Sky risks giving Murdoch too much power LONDON, June 29 Britain intends to subject Rupert Murdoch's takeover of European pay-TV group Sky to a lengthy in-depth investigation after finding the $15 billion deal risks giving the media mogul too much power over the news agenda. ~
HON,Honeywell, Domtar in $8.2 million settlement over U.S. Superfund site WASHINGTON The governments of the United States, Minnesota and Wisconsin on Thursday announced an $8.2 million settlement with Honeywell International Inc , Domtar Corp  and privately held XIK LLC to resolve a claim over natural resource damages at a Superfund site, the Justice Department said in a statement. ~Honeywell, Domtar in $8.2 mln settlement over U.S. Superfund site WASHINGTON, June 29 The governments of the United States, Minnesota and Wisconsin  on Thursday announced an $8.2 million settlement with Honeywell International Inc , Domtar Corp and privately held XIK LLC to resolve a claim over natural resource damages at a Superfund site, the Justice Department said in a statement. ~
MRK,UPDATE 1-Sales hopes for new Novartis, Merck heart drugs under microscope * But questions over likely scale of clinical benefits (Recasts with sales forecasts and comments from experts) ~
MET,MetLife board OKs Brighthouse spinoff, sets effective date June 29 MetLife Inc on Thursday came a step closer to spinning off its U.S. retail life insurance business after the company's board of directors approved the plan, it said on Thursday. ~
MU.O,UPDATE 3-Micron forecasts strong quarter on cloud and mobile demand * Q4 profit, revenue above estimates (Adds CEO comments, analyst comments, details; Updates shares) ~BRIEF-Micron Technology sees Q4 revenue $5.70 bln-$6.10 bln‍​ * Micron Technology Inc - sees Q4 revenue $5.70 billion - $6.10 billion  ‍​ ~Micron Technology reports profit on strong demand for memory chips June 29 Micron Technology Inc reported a quarterly profit, compared with a loss a year earlier, helped by improved prices of memory chips used in computing systems and smartphones amid tight supply. ~BRIEF-Micron Technology Q3 adjusted earnings per share $1.62 * Micron Technology Inc reports results for the third quarter of fiscal 2017 ~
MS,SEC probes bankers from Barclays, Morgan Stanley on Puerto Rico bond sales The U.S. Securities and Exchange Commission may take action against bankers from Barclays Plc  and Morgan Stanley  for their roles in Puerto Rico bond sales, according to filings with the Financial Industry Regulatory Authority (FINRA). ~UPDATE 1-SEC probes bankers from Barclays, Morgan Stanley on Puerto Rico bond sales June 28 The U.S. Securities and Exchange Commission may take action against bankers from Barclays Plc and Morgan Stanley for their roles in Puerto Rico bond sales, according to filings with the Financial Industry Regulatory Authority (FINRA). ~SEC probes Barclays, Morgan Stanley bankers on Puerto Rico bonds -Bloomberg June 28 The U.S. Securities and Exchange Commission may take action against bankers from Barclays Plc and Morgan Stanley for their roles in Puerto Rico bond sales, Bloomberg reported. ~
MYL.A,UPDATE 2-Investors call on Mylan chairman, director to step down NEW YORK, June 28 An investor group led by New York City's comptroller called for Mylan NV's Chairman Robert Coury and Director Wendy Cameron to step down, as part of a campaign against the firm's executive pay packages and high prices for an allergy treatment. ~BRIEF-Investors urge Mylan to fire director-letter June 28 New York City And State Comptrollers, Calstrs Call On Mylan ~
NFLX.O,UPDATE 4-Britain says Fox bid for Sky risks giving Murdoch too much power LONDON, June 29 Britain intends to subject Rupert Murdoch's takeover of European pay-TV group Sky to a lengthy in-depth investigation after finding the $15 billion deal risks giving the media mogul too much power over the news agenda. ~
NKE,Nike to launch pilot program with Amazon; results top estimates Nike Inc , the world's largest footwear maker, said on Thursday it would launch a pilot program with Amazon.com Inc  to sell a limited product assortment on its website. ~Wall Street hit hard as tech softness continues Wall Street fell sharply on Thursday, with the S&P; 500 and the Dow industrials suffering their worst daily percentage drops in about six weeks, as a recent decline in technology shares deepened and outweighed strength in bank shares. | Video  ~Nike posts higher-than-expected quarterly revenue June 29 Nike Inc, the world's No. 1 footwear maker, reported quarterly revenue that beat analysts' estimates, helped by higher demand in Western Europe, China and emerging markets. ~
QCOM.O,EU antitrust regulators halt Qualcomm, NXP deal review BRUSSELS EU antitrust authorities have halted their scrutiny of Qualcomm's  $38 billion bid for NXP Semiconductors  after the companies failed to provide relevant information.  ~EU antitrust regulators halt Qualcomm, NXP deal review BRUSSELS, June 29 EU antitrust authorities have halted their scrutiny of Qualcomm's $38 billion bid for NXP Semiconductors after the companies failed to provide relevant information. ~
SPLS.O,Breakingviews: Staples' $6.9 bln buyout could end in the shredder DALLAS, June 29 Sycamore Partners had better be ready to roll up its sleeves. The private equity firm is buying Staples for $6.9 billion. Handing over a near-20 percent premium for the struggling office supplies retailer looks foolhardy. ~Staples' $6.9 bln buyout could end in the shredder DALLAS Sycamore Partners had better be ready to roll up its sleeves. The private equity firm is buying Staples for $6.9 billion. Handing over a near-20 percent premium for the struggling office supplies retailer looks foolhardy. ~
FOXA.O,Britain says Fox bid for Sky risks giving Murdoch too much power LONDON Britain intends to subject Rupert Murdoch's takeover of European pay-TV group Sky  to a lengthy in-depth investigation after finding the $15 billion deal risks giving the media mogul too much power over the news agenda. | Video  ~UPDATE 4-Britain says Fox bid for Sky risks giving Murdoch too much power LONDON, June 29 Britain intends to subject Rupert Murdoch's takeover of European pay-TV group Sky to a lengthy in-depth investigation after finding the $15 billion deal risks giving the media mogul too much power over the news agenda. ~Text: Britain says Fox bid for Sky gives Murdoch too much power over news LONDON Britain intends to refer Rupert Murdoch's takeover of Sky  to a full investigation because the deal raises concerns about the amount of influence the media mogul would wield. ~TEXT-Britain says Fox bid for Sky gives Murdoch too much power over news LONDON, June 29 Britain intends to refer Rupert Murdoch's takeover of Sky to a full investigation because the deal raises concerns about the amount of influence the media mogul would wield. ~
FOX.O,Britain says Fox bid for Sky risks giving Murdoch too much power LONDON Britain intends to subject Rupert Murdoch's takeover of European pay-TV group Sky  to a lengthy in-depth investigation after finding the $15 billion deal risks giving the media mogul too much power over the news agenda. | Video  ~UPDATE 4-Britain says Fox bid for Sky risks giving Murdoch too much power LONDON, June 29 Britain intends to subject Rupert Murdoch's takeover of European pay-TV group Sky to a lengthy in-depth investigation after finding the $15 billion deal risks giving the media mogul too much power over the news agenda. ~Text: Britain says Fox bid for Sky gives Murdoch too much power over news LONDON Britain intends to refer Rupert Murdoch's takeover of Sky  to a full investigation because the deal raises concerns about the amount of influence the media mogul would wield. ~TEXT-Britain says Fox bid for Sky gives Murdoch too much power over news LONDON, June 29 Britain intends to refer Rupert Murdoch's takeover of Sky to a full investigation because the deal raises concerns about the amount of influence the media mogul would wield. ~
VRSN.O,BRIEF-Verisign announces proposed $450 million offering of senior unsecured notes * Verisign announces proposed $450 million offering of senior unsecured notes ~
WBA.O,UPDATE 6-Walgreens scraps Rite Aid merger, will instead buy half its stores * Walgreens to buy 2,186 Rite Aid stores, 3 distribution centers ~Walgreens salvages mild boost from intense effort NEW YORK (Reuters Breakingviews) - Walgreens Boots Alliance has at least salvaged something from the wreckage of its deal to buy rival U.S. drugstore chain Rite Aid. After antitrust pushback on the full-strength $9.4 billion deal, Walgreens has abandoned it and is instead buying over 2,000 of Rite Aid's stores for $5.2 billion. For Chief Executive Officer Stefano Pessina, doing about half the deal with half the benefits is something – but it's a modest return on at least 20 months' work. ~Walgreens scraps Rite Aid merger, will instead buy half its stores Drugstore chain Walgreens Boots Alliance Inc scrapped its deal to buy Rite Aid Corp after failing to win antitrust approval, but said it would instead buy nearly half of the smaller rival's U.S. stores for $5.18 billion. ~US STOCKS-Wall St extends losses as tech selloff deepens * U.S. economy grew 1.4 pct in Q1 vs prior reading of 1.2 pct ~Fitch Affirms Walgreens Boots Alliance at 'BBB' Following Revised Rite Aid Corp Transaction (The following statement was released by the rating agency) NEW YORK, June 29 (Fitch) Fitch Ratings has affirmed Walgreens Boots Alliance, Inc.'s (WBA) 'BBB' Long-Term Issuer Default Rating (IDR) following its proposed purchase of 2,186 Rite Aid Corporation locations for $5.175 billion. A full list of ratings follows at the end of this release. Fitch views the new proposal, which replaces WBA's previous proposal to acquire Rite Aid in its entirety, to be a strategic positive based on increased g ~US STOCKS-Wall St lower as tech selloff outweighs bank gains * U.S. economy grew 1.4 pct in Q1 vs prior reading of 1.2 pct ~BRIEF-Walgreens Boots CEO- "View this deal as being more attractive than the transaction it replaces" * This quarter we've begun to implement a program in certain stores to simplify our offering and improve retail operational performance ~US STOCKS-S&P;, Dow flat as tech losses offset gains in banks * U.S. economy grew 1.4 pct in Q1 vs prior reading of 1.2 pct ~RPT-US STOCKS-S&P;, Dow set to open slightly higher as banks get Fed boost * Futures: Dow up 15 pts, S&P; up 1.75 pts, Nasdaq down 31.5 pts ~
